,Comment,Author,Post
0,"First off I'm sorry for the situation you are in. As a woman with BPD, I can tell you straight up she is using your friendship to get what she is lacking romantically and emotionally from her male companions which isn't fair to you because it seems like you want to be with her. Personally, I would take sex 100% off the table but make it a point of discussion at the next therapy session so that her response is neutralized by the therapist. She will more than likely get mad at you for this but I would tell her that losing her friendship is more important to you than having a sexual relationship with her and that if ending the sexual nature of your relationship is an ultimate for her she needs to explain to you why. If you do want a relationship with her please for the love of god don't go the route of sleeping with her while she dates other men. I honestly think that this will make her split on you even more because she is going to perceive you as the reason her relationships don't work. I know it's difficult but you need to put the ball back into your court and define how you are allowed to interact just because she is going through a hard time does not give her the right to treat people like a POS. If you want to make this friendship/relationship work while she is actively in a BPD episode which it sounds like she is you're going to need to be patient, very forthcoming, reassuring, and have clearly defined boundaries.",FerkinSmert,16hql3t
1,"I stopped sleeping with her after the comment was made that I forced her. I also strangely don’t want to be with her, I did at one point but that faded after I noticed the lies along the way to this point. I see her as my friend some would say best friend, I’ve spoken to her ex husband and he said he got a similar treatment at different stages in their marriage. She told the therapist she doesn’t want sex from me but, it was a lie. The therapist confronted her about it in a session we had last week and she said “oh I haven’t wanted to sleep with him in a long time, I never found him attractive I had to force my mind to let me do it”. When the therapist asked what was unattractive she took like 5 mins and said “he’s really tall and doesn’t have green eyes”. The therapist just sort of looked at me with a smirk and said “is that a serious reason or are you winging it” and she went on a tangent about how she’s saying how she really feels and everyone is saying she feels different. I left the session early because it broke my heart, to see her like that. I don’t want her romantically at all but she’s an amazing person and it kills me to see her so different. I spoke to her yesterday and she told me that she wants to go to a friends party on Sunday, I asked if she felt up to that, she said yea. But Tuesday in our session she will say I asked her to come, I made her go, I can already see it coming, so I told her I wanted to go alone and that I thought she should spend the day with her kids to which she said ok",Fire-bird67,16hql3t
2,"The forced thing is tough because she could have easily wanted to have sex with you but also didn't want to for a variety of reasons and she is now allowing herself to say it was forced to excuse her own actions. I would literally ask her, ""So, you feel like I took advantage of you?"" because that's essentially what she is alluding to when she says forced. I would want her to say to my face that she genuinely felt forced and to explain her perception of the incident. Also, if she really felt like you forced her to have sex I can assure you she more than likely wouldn't be trying to maintain a friendship. I would also tell her how the way she described the sex as ""forced"" has affected YOU, not everything should be about her.

Also, can I ask...Do you actually care if she's attracted to you? Especially if you don't want to be with her physically or emotionally. I understand that as a friend it would be hard to hear that they aren't attracted to you but if you're not romantically interested in her why care about her opinion? I'm sure 10 million other people find you attractive who could be better looking and nicer than her so why put so much investment into what SHE thinks of you? Personally, I think you should distance yourself a bit until she can view your and her relationship the way that you want her to. This isn't a one-way street where she only gets what she wants and I can tell you the perception that I get from the way you describe things is that she's not super great for your self-confidence. I wouldn't end the relationship but I would for sure take a big step back to make her realize she needs to treat you better as a friend. Again BPD or not the world doesn't solely revolve around her.",FerkinSmert,16hql3t
3,"The attractive thing was more of a “huh?” Type thing because it’s literally one of the things she’s said most often was how attractive she found me. I just was so opposed to what she literally says all the time that I was more confused in that moment. I’ve made it clear to her that nothing romantic is going to come from this. It difficult to explain how quickly all of this has happened I’m just stunned by the speed everything was good with her and it was like over night bam a complete 180. She doesn’t hurt my self confidence it’s just not the best feeling to hear someone seem so cold and completely different. I have stopped texting her as often, and I’ve set up a rule that we cannot see eachother so often and that I’m going to be doing my own thing for a while that I’m happy to support her if needed but I’m not going to be revolving my life around it. I also feel really bad for the guy she’s talking to because he does genuinely seem like a good dude, and he shouldn’t have to go through it. She admits he knows nothing that she’s lied to him about most things. What really got me what when she said I like being with him because my kids are not around and I like life without them. That’s when I got her ex husband involved. Because she’s pawning the kids off to do things. I do have a question though. Does she actually know what she’s doing, because when she does have moments of clarity she says that she just doesn’t see how she’s doing anything wrong it all just seems normal to her? And she does get quite emotional and you see glimpses of her and she says she’s sorry to us and she knows something is wrong but she just can’t see it no matter who points it out she can’t take herself out to see it , it just feels like she’s doing thing how everyone else would.",Fire-bird67,16hql3t
4,"You're going to hate this reply but more than likely no, she doesn't know what she is doing is wrong until after she's reacted but she still needs to be held accountable for her actions. I have been in a relationship for 10 years and to this day there are instances where I perceive my actions or words as ""normal"" when in fact they are the complete opposite. It's also difficult because he also faced a decent amount of abuse and neglect as a child. One example I can give that's always stuck with me was when I was watching a TikTok of a woman who recorded her abuser verbally harassing her and I was genuinely confused at what everyone was so upset about in the recording thinking, ""Ahh he wasn't that bad"" (He was 100% saying awful, vile things). Yeah...I literally didn't realize a video of a man berating his girlfriend about how worthless, ugly, etc was an abusive situation...YIKES...and it wasn't until I went to the comments and realized ""Oh, people actually aren't supposed to talk to each other like this,"" but I honestly didn't know...I know that sounds stupid but it's a sad reality for many with BPD especially those with negative internal dialogues and past trauma. Truthfully, I can really only see things with clarity once I've already acted on it which means I have to be surrounded by strong, compassionate, forgiving people who know that I am seriously trying my best. So to get back to your original question...more than likely no she doesn't know she's being horrible but you need to hold her accountable for her actions and get her to care about more than just her own feelings. Also, I hate to say it but it's probably better for the kids to be with the dad and not see her if she truly thinks her life is better without her children. Sorry if that's harsh as someone trying to conceive I'm sick of hearing about shit mothers. Again sorry, I know this is your friend but to not want to see your own children to see a man or a friend is the most pathetic shit I've ever heard. Godspeed to you and your patience!",FerkinSmert,16hql3t
5,No I thank you for the honesty. What your saying makes so much sense. She told me just two days ago that she doesn’t see things right away that after a few weeks she always sees the problem. She told the therapist and i that she doesn’t understand and wants to but anytime anything happens in her life she never sees her role in it or that something clicks until we’ll after it’s over.,Fire-bird67,16hql3t
6,"She’s also very much in denial. I care but I have to take a step back. I’m told I’m being “devalued”, I do wish to remain friends with this person so what can I do to not be “devalued”.",Fire-bird67,16hql3t
7,I think stepping back is the right option. It will be tough on her but you deserve to be respected and protected until she can re-evaluate how she treats others.,FerkinSmert,16hql3t
8,Thank you,Fire-bird67,16hql3t
0,[deleted],,xfak3m
1,"Hi, I didn't become aware of my BPD until my 40s after experiencing some substantial losses, I think the pandemic served as the tipping point where I hit rock bottom mental health wise.

I've been getting a lot of help from watching videos on YouTube.  Psychology in Seattle, Daniel J Fox, Lisa LeBlanc,  Tracey Marks, and Todd Grande.  Surviving Narcissism (channel) if appropriate to one's trauma.  I did a lot to address my extensive identtity disturbance it was a little easier knowing I've had a full life and career behind me to renounce the sensation of not existing or having a personality of my own.  I lost every source of externalised identity this summer, I'm rebuilding from the ground up.  Assessing yourself using the five-factor model of personality (OCEAN) is a really straightfoward and helpful exercise imo.

I've found the BPD subs on Reddit to be incredibly helpful, once I got to the point of handling reading my experiences and symptoms in words, and having the opportunity to engage in compassion with experiences we've been at the pointy end of.  Like, we all know how harrowing and painful living with BPD is, especially when it's uncontrolled or undercontrolled.  So it's not light reading by any means, but invaluable.

Favourite People are where we sink our attachment needs and have an odd blind spot that distortsaway any flaws.  Maybe your friend's blind spot resembles a parental figure's toxic traits.  My last FP was a total turd of a human, at the time I thought he was kind and caring; in hindsight, his actions never matched his words, ever.  I'm surprised he didn't fall down every time he pointed up, that's how bad it was.

I'm sorry, I'm typing a lot and saying a lot. :( I just feel for your friend because this is no fun, but it's also at least as easy as life has been up til this point anyways.",,xfak3m
2,Most of the people in my dbt group were over 40,ladepeceur,xfak3m
3,"I strongly recommend the podcast, ""Borderline to Beautiful."" 

Him being older, it might help tremendously. I listen to it every morning, and the things that Rose and Jay have to say have been very helpful to me in my journey, and are generally good imo for anyone. 

I definitely recommend having an open heart and mind, and being willing to confront the things keeping one stuck, though, if he does embark on that podcast.

Informationally, also, I recommend ""We Can Do Hard Things,"" with Glennon Doyle, as well as Early Morning Barking, on YouTube. ""Borderline to Beautiful"" is also a good resource. These are NOT meant to replace therapy, though. 

If therapy cost is an issue, there may be local, state-run help. They are there to help too, if one can manage it.

In the meantime, self-care and journaling, meditation (starting with 5 minute ones is recommended, guided ones are available for free on YouTube), and making a routine are good places to start on any recovery journey. 

Best of luck to your friend, and I hope he gets the help he needs, and thank you for trying to help him.",SomewhereScared3888,xfak3m
4,40 and just diagnosed,udont-knowjax,xfak3m
5,"Me, Dr Fox workbook and Dbt. I used some apps to in the beginning",Far_Bridge_8083,xfak3m
6,"48 and was officially diagnosed two months ago. I was initially diagnosed with Bi Polar Type 2. 

I’m reading all about DBT and how it works wonders. Now Im in the frustrating stage of looking for treatment.",whysofigurative,xfak3m
7,"Thank you so much for sharing! It was a bit of a shock to me (although a lot of things suddenly made sense) and I think also to him. He already has a great interest in mindfulness practices, and is very intelligent and has some self awareness and a will to understand and feel better. I will have a look for the workbooks and share them with him when he seems ready. Thank you for saying I am a good friend. I'm going to try to be.",Acrosstheborder62,xfak3m
8,"Thank you for your reply and no need to apologize! I am trying hard to understand where my friend is coming from. Looking back, I saw all the behaviours (trauma responses) but I couldn't figure out the ""why"". I appreciate so much what people here and on other subreddits have shared and have been moved to tears many times realizing what so many are going through and how my friend has essentially suffered in silence his whole life. No, not light reading at all. Thank you for the list of resources, I will check them out and pass them on! I've been mystified how my friend sticks with our friendship because from the sounds of things I am not the sort of person he's hung out with in the past. I am way too 'safe'. He has pushed me away hard several times and I was very hurt and confused but since learning about BPD I can understand better. I'm trying to keep lines of communication open so I can support in whatever way he is willing to accept. I've known he was struggling and suffering for as long as I've known him but just couldn't figure out why such a talented, intelligent, gentle person felt so down on themselves and had such difficulty finding solid direction in life. It sounds horrible and exhausting. You are all so brave, and I am very grateful for what you have shared.",Acrosstheborder62,xfak3m
9,Thank you for this. The cost of therapy is probably going to be an issue. Not much available free of charge here. I will pass along your recommendations. I'd advise him to check out Reddit but don't want him to stumble across negative things right now.,Acrosstheborder62,xfak3m
10,"I checked out the free worksheets by Dr. Fox. Very interesting. Will see what he's ready for and what other treatment or support he's been able to access. Right now he is out of town. I'll talk to him when he gets back. I have cPTSD (childhood and domestic abuse veteran) and anxiety and a lot of the beliefs/adaptations/exercises to change are similar. I know how difficult they can be to do, and that's just from my perspective, not that of someone with BPD. Thanks for sharing!",Acrosstheborder62,xfak3m
11,"Hi, I'm also frustrated by how inaccessible DBT programs are.  I've been making do with the few skills I've been able to find on YouTube until I get to a point I can start looking for a course myself.  The mammalian dive reflex, DEAR MAN, two types of breathing exercises, and opposite action have seen me through a lot.  It feels like we are either stranded in agony until we find a mythical DBT program where we become psychological ninjas or something, there is a middle ground where we collect a handful of skills that work for us as we move towards DBT training.",,xfak3m
0,"I was diagnosed with BPD back in 2015. I was just diagnosed with ADHD not even two months ago. I’ve been on stimulants a little over a month now. Here’s what I’ve learned this last month:

- the stimulants have made my BPD symptoms go quiet. They’re legit a whisper. 
- the stimulants have made my depression become 85% better. Its so much better Im going to be lowering the dose of my Lamictal the end of this month to see how i do. 
- stimulants don’t work as well the week of my “period” (it’s not a true period because I’m on the pill)
- the week of my “period” my BPD symptoms came back with a vengeance on that Wednesday and lasted till that Sunday. So, a total of 4 days out of the month i had BPD symptoms. Once that Sunday was over, my BPD symptoms have been quiet again
-  the stimulants have improved not only my BPD and depression symptoms but my overall focus/concentration, executive dysfunction and overall energy are a so so so much better. 

I did recently make about post here about ADHD and BPD. If you look at my post history, there were some great comments on it. Hope this helps!

Edit: forgot to add that I’m sleeping so much better too",gooseglug,1bvvzny
1,"BPD and ADHD here, diagnosed a little over a year ago. I found that the Straterra (Atomoxetine) has worked VERY well for me. I don’t know if it made enough of a difference on its own, as I also went extremely heavy into mindfulness, meditation, DBT and CBT therapy up to 5 times per two weeks at max). All of this along with a ton of reading on stoicism, Taoism, and Buddhism (especially the Plum Village/Thich Nhat Hanh writing/podcast etc). 

So, I find myself at a 100% different place and, of course, still working hard to ensure that the me I am each day is me, authentically. The meds helped my focus and getting stuff done ✅ which allowed me to turn chores or work into mindfulness training and the opportunity to center in the middle of a storm. 

Good luck on your journey, I am having fun now, I hope you achieve peace, joy, and happiness also. 😊",sonarriley,1bvvzny
2,"I was diagnosed ADHD as a child, and got on stimulants at a very early age. Proceeded to have a troubled childhood, and developed BPD diagnosed later in life. Still taking stimulants to this day.

I would say DBT helped me the most. Ive had huge emotions my whole life, and was never believed for my genuine meltdowns, by parents or school. Learning to cope with those feelings and express myself appropriately was a skill that came with time, practice, and therapy.

My point is, I don't personally credit stimulants as doing much for me emotionally, other than reducing the stress I feel for having uncompleted work (hah, as I type this having procrastinated myself into a corner). I like my ADHD meds, and take them every weekday. I have never been prescribed any meds for my BPD. I was offered antipsychotics, but turned them down in favor of therapy. 

Best of luck to you! While no pill can cure it all, I won't downplay the positive effects that stimulants have had on my adult career. Probably shouldn't have been taking them as a child, but that's in the past. I hope you find a happy balance :)",Affection-Angel,1bvvzny
3,"Oh my God. This is exactly what I needed to hear. You delivered. Thank you so much!!!

Also, my bpd gets much worse before and during my period, so I know what you mean. 4 days is amazing though. Very happy for you!",WinterTangerine3336,1bvvzny
4,"Weird tangent, but if your BPD symptoms flare up before your period, I would look into premenstrual dysphoric disorder (PMDD.) It's basically a SEVERE lapse in mental illness symptoms before your period due to hormonal changes. I have it and this is just a personal anecdote, but it seems to be extra common in pwBPD, for some reason.

Obv I'm not trying to armchair diagnose you or anything like that but just wanted to give you something to look into if you want to find treatment for it ♥️",witchcrows,1bvvzny
5,"I don’t have PMDD. They don’t usually flare up during my period. What made last month different is my primary had me start taking my BCP continuously so i don’t get that withdrawal bleed. I’m having serve hormonal anxiety during that off week. Im considered premature ovary failure because of the age i started experiencing perimenopausal symptoms. I need actual HRT but since im not 40 yet, its hard for a doctor to take you seriously 🥴 Anyways, it was bad last month because my body is adjusting to the new regime of the BCP.",gooseglug,1bvvzny
0,"Totally get it! I go though the same. So many things I should be doing but can’t be arsed doing any of them, especially if they are good for me! 

I don’t think it’s laziness, but more like executive disfunction. 
I use cannabis products to help me day to day, it’s not for everyone but gives my brain a break from the looping thoughts. 
My body will then go do the chores while my brain has a vacation. Not ideal I know but at least I can get some shit done.

One of the other things that also makes a fairly big difference for me is having vitamins/supplements. I totally don’t want to even though I know it’s good for me. 
I definitely self sabotage so really have to work hard to keep that in check. And I totally fail a lot of the time but that’s okay, I think that’s just living with bpd. 
Keep going therapy, play some video games , watch some uplifting shows and I hope you start to feel more uplifted soon.",Da_Beez--Kneez,y80s3h
1,"One thing I’ve learned about myself (and can be said about other people as well) is that unless you’re ready to change, you won’t change. It’s as simple as that.",gooseglug,y80s3h
2,"Momentum? Have you tried those things yet? Inertia affects us all. Some do get antsy after too much rest but… it all takes an effort. 

I walk outside for a living all day, so going for a hike when I have a couple days off almost seems counterintuitive. But I’ve learned from doing it that if I’m feeling a little restless and crappy just sitting around the house, I feel better after hiking a couple miles through the forest. But it didn’t really become a go-to thing until I’d done it a couple times (and enjoyed it).",proteannomore,y80s3h
3,This sounds a lot like depression. I struggle with these things as well.,lustful_livie,y80s3h
4,[deleted],,y80s3h
5,"If you just accept you are lazy, you could get 8 happy day on your sofa. You don't have to change, only accept the reality. 

Maybe you are tired. Maybe you need 8 days rest to charge yourself emotionally.",bzrinyi,y80s3h
6,"Thank you for this, I really appreciate your response. You're so right about vitamins and general health. Easy to neglect. Unfortunately, anything that counts as looking after myself kind of falls in this can't do/ won't do category. But supplements could be an easy habit to get into. 100% on the looping thoughts. I think this dissociation/ avoidance thing I get into is about trying to turn the thoughts off on some level",Kindly_Bodybuilder43,y80s3h
7,"Yes, I'm definitely resisting change. I think it's fear based. I'm going to do some thinking. Thank you for responding",Kindly_Bodybuilder43,y80s3h
8,"Yes, inertia absolutely doesn't help. It's not what gets me into the mess, but it definitely makes getting out harder. I do know this, I just won't seem to do anything about it...",Kindly_Bodybuilder43,y80s3h
9,"It does sound like depression, but it feels maybe more anxious. I don't know. I'm not very good about what I'm feeling. Thank you for answering",Kindly_Bodybuilder43,y80s3h
10,Thank you for your detailed and helpful response. It made me cry (in a good way). To recognise I'm at a 3 not a zero brought a flood of some feeling I can't name. Maybe relief? There's definitely a lot of feelings here I'm avoiding by shutting down the way I am anyway. I'm going to make a list of symptoms and skills. And maybe even break down the skills into steps to make them easier to face. Thank you,Kindly_Bodybuilder43,y80s3h
11,"Haha yes, that's what's so annoying about this! I just refuse to enjoy the time or do anything useful with it! Some kind of self destructive limbo instead... Rest is important, thank you",Kindly_Bodybuilder43,y80s3h
