,Comment,Author,Post
22,"Having that realisation and taking steps is harder. I know she’s only staying because I’m forcing her to right now. She made a promise never to leave and I’m holding her to that. She can’t end therapy without breaking any trust we have left. I trust her to not block communication, she isn’t terrible and she’s not going to deliberately hurt me if she doesn’t have to. I know she’s a wonderful human being, she’s just maybe not the therapist for me right now. I know she’ll give me the closure I need and as much time as I need to actually say goodbye properly. She won’t just cut off contact and refuse to speak to me one day. 

I’m just getting old and finding love is hard. Someone will love me even if I’m old though haha. 

She’ll give me referrals but they may be useless. She’s really far out of area for me - I travel an hour and a half to see her - so any referrals she gives will be in the same area and if I don’t have to I’ll avoid travelling over there. I also don’t know if I trust anyone she refers. They’re likely to practice like her and that’s not helpful to me. She was going to ask her supervisor for referrals and that may end up being better for me.",Ill_Meat_8195,l3yszj
23,"These dynamics are largely unconscious. But that doesn’t make it any less real. For me, I realized I was compartmentalizing my therapist’s behaviour, thinking he didn’t mean it, so it’s okay, that there’s two sides to every story, etc. I can see now that I was, in a way, seeing him as not having control of himself by compartmentalizing, like almost infantilizing him. It helped me to see that I was actually empowering him and respecting him as an adult and therapist by not making excuses for him. 

That’s a super fair feeling, with her telling you that you guys will be friends after therapy (🚩). Once again though, I have to wonder why she said this. I’m sure part of it is that she genuinely enjoys your company, but lots of therapists feel that way about their clients and still are able to act professional. On feeling discarded, I guess I read hints of that in how you felt abandoned by her wanting to terminate things. Like you didn’t meet up to her expectations and now she’s done with you and wants you to leave. I could be projecting my own experience onto that though. 

I can so relate to that feeling of having wasted time. I saw my new therapist today and had the desire to see my old therapist come up after session. It’s sucks. But I also think that it will always feel like wasted time to me, because nothing will ever be satisfying. I can’t think of any tangible “finish line” with my old therapist that would make it seem worth it, aside from him crossing major boundaries which I know would be incredibly harmful for me in the end.",thewilltobehave,l3yszj
24,[deleted],,l3yszj
25,"You’re right, it’s very real. I feel like if I brought it up with her she’s apologise and never do it again but another part of me realises that would take away me being special and I’m fighting that. I see her as in complete control, she could do anything and I’d allow it. 

Yeah, probably is a massive red flag. She said it when I told her I didn’t mean anything to her and she’d never speak to me again outside therapy. I guess it’s not an abandonment of me entirely, it’s like - if you’ve ever done parts work - she’s abandoning little me who still needs a lot of help in favour of only accepting who she wants me to be now. 

I hope it doesn’t always feel like wasted time. I have written a list of everything we achieved together that will help with that. We did some really good work before everything started getting really bad. I am attached enough that I would happily let her cross those major boundaries despite the damage and I know that needs to stop.",Ill_Meat_8195,l3yszj
26,"She referred to herself as an addiction and said every time I came to see her I was harming myself because I knew it was doing damage and still kept going. That’s why she thinks she can’t see me any more, something about how it’s part of her job to not so any harm. I’ve done exercises on what she can give me, the whole things was piled into a table of what’s logical and what’s not. I know it’s not possible to have a relationship with her - sexual or even just dating - but I can’t seem to get my head around it. I can’t go cold turkey because it would send me spiralling way too hard and I can’t afford to have that happen. 

What I need from her is not possible. She would say I simply want it and it’s not a need but it certainly feels like it in my head. I need to know in some way that she ever actually cared about me. I need to know why she let things drop so far down without thinking how harmful it was. I won’t get answers to either of them.",Ill_Meat_8195,l3yszj
27,"I’ve started doing a lot of parts work and really relate to the ‘little me’ feeling abandoned. One piece of advice I came across was to make your helper part be “the CEO of the company” (you, you’re the company) when deciding on how to proceed with your therapist. Listen to all your parts, validate them, and tend to their needs, but don’t let a sad child make decisions for a company. 

Having that list is a good idea. Maybe I’ll do that if it comes up for me again. Hopefully you can find a good therapists who will help you process things so that it doesn’t feel like a waste, but a part of the process.",thewilltobehave,l3yszj
28,[deleted],,l3yszj
29,"I love parts work and this is a really good way to put it. I’m letting little me take control and say I can’t leave her because I need her just like I actually needed someone then rather than letting any other part of me rationalise and say I need someone who can actually help me. 

I hope so. Otherwise it will continue just being a complete waste of 3 years of my life. The only hope I feel like I have of it not being a waste is if she maintains that we can be friends and I get a good friend out of this. And even then I know I’m just holding on to her when I shouldn’t be.",Ill_Meat_8195,l3yszj
30,"It is definitely torment. I will never get what I need from her. I guess I just need her to make that choice. I know that this isn’t working. We both know that it’s harming me and probably causing more damage to my life than I need but I still can’t find myself ending it. I have done all of these things. I have screamed, begged and cried for even a tiny bit more of her attention and she gives it. She sacrifices her time with her family to cater to me, making me feel special when she shouldn’t, and probably causing her more damage too. That’s valuable time she’s missing with her small children because I’m being needy and demanding she love me too. I know I’m missing out on life. I’ve had things go okay with people I’ve tried to date - though not often - but every time it seems like it’s going somewhere I back out because what if, what if she says yes, what if she chooses to risk her job and her marriage for me. I’ve said I only want one night with her but I know I’m entirely kidding myself, that would never be enough, I’d want more and more and it would ruin both of our lives. 

I think the plan needs to be doing this slowly. Her backing away and lowering contact at a reasonable rate. I’m going to throw tantrums and beg for her to come back but I guess I need her to be the strong one and say this is for my own good. I don’t know why I trust her to do that because she never has in the past. I can’t just have her disappear, I want things to fade out like a friendship where you kind of just lose touch because you’re leading different lives. I don’t want her to be gone forever though and I guess that’s the hard part. I want to be able to update her on my progress because she’s celebrated so many successes with me and I want to be able to thank her one day for all the work she did do and all the things we did achieve. I want that to be possible without becoming addicted to her again though.",Ill_Meat_8195,l3yszj
31,[deleted],,l3yszj
32,"Doing it slowly is probably more than both of us can handle. She has told me that she’s going to need therapy if I keep putting some of this stuff onto her and that should tell me enough that I need to stop and move on but I just can’t actually do that. She’s made it clear that she thinks I should be referred elsewhere and I feel like the only reason that isn’t being enforced is because she’s said it’s always my choice to end therapy. If it was her choice this would probably be our last session. I know I’m way stronger than I feel I am. It just feels like giving up. It feels like I’ve managed to use my attachment to even scare away a therapist and that’s pretty screwed up. 

I’m seeing both the good and bad in her but I’m also seeing this as her fault. I’m angry at her that she let this get to this point without helping me. I’m also understanding that she isn’t perfect and she probably didn’t mean for things to get this bad. She’s admitted that she didn’t realise how bad they were but I guess I needed her to and needed her to help me. I’m feeling more black and white knowing she’s not emailing me tonight after agreed upon because she’s tired and I know I’m being unfair to her but I can’t help but be angry and hurt.",Ill_Meat_8195,l3yszj
33,[deleted],,l3yszj
34,"I don’t know how she feels about me. This is what she told me yeah, that every time I come to see her I’m self harming and enjoying my destruction and she doesn’t want to be a part of that. Her job is not to harm and I’m forcing her to. That’s not fair on either of us. This is why she says she’s going to need therapy to keep dealing with me and I feel horrible about that. At the same time I wonder if she gets therapy would she be able to deal with me just a little bit longer and that’s not the way I should be thinking. 

Having this conversation has kind of made me want to take that power but I also feel like I’m just taking power and “dumping” her just because I want her to hurt as badly as I am but that’s a little bit nasty of me.

I feel like she’s going to manage this way better than I am. As you said my heart is worth protecting and she’s got way more supports and should be far better at protecting herself than I am right now. It’s her job to protect me as my therapist. 

I’m a train wreck now so stopping seeing her isn’t going to alter that I don’t think. I’m hurting so much just having to see her and not get anything from her. It will rip my heart out cutting contact but I’m also aware that I’m already doing that. 

I can ask her to write that letter. She’s written me letters before - again making me feel special. She gave me a Christmas present that wasn’t a present. 

I think she’s already reached her breaking point. She doesn’t know what to do with me so she’s just pushing me away as much as possible while also trying to cater to my demands. She’ll email me today because I’ve demanded she do that and contact me after her holiday. She probably doesn’t have time for this. It will be time away from her children and husband. 

I’m still hoping we can cut and run and I’ll be able to contact her one day and say thanks for everything you did for me and feel nothing for her any more. I know that may not be possible.",Ill_Meat_8195,l3yszj
35,[deleted],,l3yszj
36,"Another thing she has told me, that I will be at some point the reason she quits. I can’t be the cause of that. Her husband has so far dealt with every bit of support she’s given me, at least as far as I know. She probably wouldn’t say if he was against it. I’m not sure what he’s actually like beyond that he likes and sticks to rules and is extremely rigid. So far all of her supervisors have told her she’s doing the right thing in staying with me and that this is something that can be worked out. They just say she needs to limit contact with because the amount we have is apparently unheard of. 

I’m not sure what it will take to have a proper goodbye with her. I’m struggling to think about that. I’m not ready for it even though I know we’re headed into that conversation on Saturday. I don’t know what she’s going to say. I’m not sure she doesn’t want to be my therapist any more. I think she’s just worried about doing more damage and isn’t sure how to fix it without me giving up my attachment and working with her to fix it. I’ve asked her outright if she wants me to see someone else but she hasn’t responded. 

I don’t know what I need from her to move on. I guess I need her to be there until I find a therapist who I like and can work with. I don’t want to quit seeing her and then end up with a therapist like my last one who was more traumatising than helpful. That will send me straight back to her. 

I need her to help me define goodbye and work on that together with her. I think it’s something we both need. I know that this is going to be hard for her as well. Despite what I think of her right now I know she genuinely cares about me, even if she can’t love me, and she’s going to be upset about this ending as well. This needs to work for both of us. I can end sessions after our next one and go non contact but I can’t hurt her like that. It needs to be something we discuss and work towards together.",Ill_Meat_8195,l3yszj
37,[deleted],,l3yszj
38,"Thanks for checking in :)

Saturday was a disaster. I didn’t want to talk to her and requested some silence but she wanted to talk about my thoughts for fixing this are wanting her to be unethical which isn’t possible. I understand that, but I don’t know how to deal with that pain. She’s suggested I engage in life but I know from past FP attachments that’s not useful to making this go away. 

We didn’t really talk much about me finishing therapy. She said when I’m ready to talk she’s willing to be the adult and end therapy and help me find someone else. I know she has a meeting with her supervisor this week though to get referrals for that. She said if she was going to get overwhelmed by me and stop therapy she would have already done it and she’ll end it without my contribution if she really does think it’s harming me. I’m still looking for another therapist though. As soon as I get my schedule for work I’ll be able to work around afternoon meetings and such. 

She checked in after session and sent me a meme telling me to take care and apologising for a hard session. This just adds to the special feeling and makes it harder to end therapy. 

You’re right, I’m not okay. I’m massively overwhelmed. We did some emdr on where the feelings come from and why it’s so overwhelmingly painful that she’s saying she won’t be unethical for me but one session of that isn’t going to help it. I have work in 5 hours and hopefully being back after 6 weeks of holidays will help bring some sense of normalcy back to my life and decrease the need for her. Lunch break is the only time I’ll have to think about her and I’ll spend that with my colleagues.",Ill_Meat_8195,l3yszj
39,[deleted],,l3yszj
40,"Thanks :) Her behaviour always adds confusion and it’s what got us into this mess. She firmly believes that her ignoring email boundaries and supporting me when needed is what went wrong. I can’t throw at her everything she did because I don’t want to be horrible. 

She’s maintained that so far and hopefully she stands by it. She’s really big on the not doing me any harm front. It’s why she wants to end therapy she says. She keeps questioning why I keep coming back even if I’m getting harmed. I don’t think saying you’re my FP and you could get away with anything would help things. 

She said she’d be quite when she finished talking. You mean like if she could feel love in therapy she’d feel it for me. I don’t even know what that’s meant to mean. She told me she’s trained not to feel anything inappropriate for me and because of that and because she has a husband it’s easier for her not to feel anything for me at all. I call bullshit on this, both therapists and married people do the wrong thing despite that, what makes her so holy? 
I don’t know about her not being able to leave. She said she’d care if I left but that doesn’t suggest she feels anything. I care when my favourite work colleague isn’t there for the day, I don’t have feelings for them. 

Jealousy is so hard! Well done for being able to recognise it and know it’s not a healthy feeling. I’m sorry you’re not doing great. It sounds like things are still really hard surrounding your old therapist. Getting over an FP is a difficult thing. It sounds like emotionally he took advantage of you and then realised he was screwing up. Ive asked the same question when I’ve been terminated by therapists, what about me is so difficult that even the person I pay to deal with my problems can’t deal with them? 

I don’t think there’ll ever be closure. They’re going to maintain that everything they did was ethical and find ways to back that up. This is a big part of heartbreak, not just for people with BPD but for everyone. We kind of just keep going on until it hurts a little bit less. For me, if she leaves, this heartbreak will be like grieving someone who has died. It will be massive. 

I don’t know how long it’s been for you but I learnt from my last FP that I needed almost a year before I wasn’t attempting to see him or talk to him any more. It took everything not to reach back out when he’d message me.",Ill_Meat_8195,l3yszj
41,[deleted],,l3yszj
42,"My first day back was tiring haha. Because work is so full on all the time I just don’t get a chance to think about her really. I thought about her as I walked to work so I turned my music up to deafening can’t hear myself think levels which got rid of her pretty quickly. It’s such a shame I can’t do that every time I think of her. 

I don’t understand this either. I would love to tell her I get off on the pain but I know I’d just be trying to make her uncomfortable and it’s not true. I don’t think she understands that I can’t walk away. I’ve been telling her this for years, she could literally do anything and I’d still forgive her and stay. It’s pathetic. She’s got me until wrapped around her finger and I don’t know how to get unwound. 

I’ve been dumped, ghosted by people, and just outright rejected by people I thought I loved. It hurts harder coming from an FP. You can ask him whatever you want but the likelihood is he won’t answer because he knows things are done and refuses to acknowledge his part in that. 

I want her because I can’t have her. It’s a relationship I can’t pursue. Real relationships are terrifying, they require work, they have fights and compromise. The fantasy relationship I have with her in my head is perfect. By loving her and trying to get her I don’t have to open myself up to the possibility of real rejection because I know the rejection is already guaranteed. It still hurts but it hurts a hell of a lot less than being in a genuine relationship for years and then being dumped. An FP takes time to get over but breaking up with my last boyfriend took far longer to get over. I was extremely obsessed with him for years afterwards. I didn’t act on it, I left him alone and went non contact and it still took ages. If I’m being honest if I stopped seeing her and went non contact I’d dissociate hard enough that she wouldn’t exist in a month and I’d feel nothing for her. 

I told her the other day she isn’t perfect. I know she’s not but I still want her. Even if she said yes let’s do this and left her husband the imperfections in both of us would ruin the relationship within a month. She’s told me she gets into screaming matches with her husband where she calls him terrible names. The person she brings into therapy isn’t that and that’s what my idea of a relationship with her is based on. Sure she gets defensive a lot when I argue with her but she never yells back and never insults. In a relationship that would be way different. 

Does he have a reception? Call them and request he send it. Or email him and say you don’t want a response. I had a friend whose therapist dumped her and she sent an email just asking for everything to be sent to her new therapist and she wanted no further contact. 
I have mostly avoided telling her about my erotic transference, she knows it’s there, she knows I’m picturing things in session but we’ve never detailed what that is. I’ve never been out of it enough to actually have this discussion with her. I was meant to read it to her the week she said I should see someone else so it never happened. 

I have spent ages journaling about my toxic relationship with her. I have also created a table of what I want from her, where that comes from, what I want when I can think logically and how do I achieve that. Like minimising my want for a relationship is reminding myself exactly why that’s a bad idea. Reminding myself she’s nice enough to stick around even if I treat her the same way I treat her now and knowing it would slowly exhaust her and stress her out because in a relationship she can’t escape like she can in therapy. Right now, I’m just a client who she doesn’t have to feel anything for so can just leave at any point in time, in a relationship there’s some sort of love there and it makes leaving a lot harder. I don’t want to be the reason she’s too tired to handle life. I can’t love her the way she should be loved. Knowing that puts into perspective the reality of wanting a relationship with her and helps me understand why it’s not possible. And yet, I still can’t make it go away completely and I don’t know how to.",Ill_Meat_8195,l3yszj
0,Medication … kept me from sinking so low I’d be SI. It was getting close … and therapy. One that really knows bpd,Prudent_Antelope_914,1axircw
1,"What meds did you take? I'm wanting to change mine, having changed them several times. Also, do you any leads to a BPD specialist offering 1-to-1s?",No-Associate4514,1axircw
2,"I started with a Christian counselor at a local agency. It just so happened that she specialized with bpd. She’s the one who suggested I need a dopamine based med like Wellbutrin (where ssri just make me numb) because of my adhd… and then I was started on an anxiety med, buspiron, still titrating up but seems like a I’ve got the right combo for once! Def see a provider and don’t try anything on your own with prescriptions. I had tried BrainMD supplements as a last resort but that made things worse at the time and I had to finally break down and get prescription medical intervention

(Don’t take this as medical advice and counselors aren’t supposed to advise on medication, it was just the conversation I had because of years of trying medications and getting off them multiple times. I’m finally making head way, and getting the right diagnoses)",Prudent_Antelope_914,1axircw
3,"Do you have any links to the counselor you used? And the agency? Feel free to send them to me in a DM, I'd be very grateful",No-Associate4514,1axircw
0,"I was diagnosed two years ago and it was a complete shock to me, too. I really relate to what you’re going through. You are not alone in this. It just feels very overwhelming at first. I’ve also struggled with addiction as well. Don’t beat yourself up, the world does enough of that already. Know that there is another person who relates to you, even if they are a stranger.

I wish you only the best.",SquishieThings,rsvcs9
1,"You might find some help on the BPD subs. Some people post tips and informative videos. When I first got my diagnose I felt so helpless. I got myself the BPD workbook everybody talks about (I don't have the name en but it's a blue and white book). I already had trauma therapy ( in the form of cognitive behavioural therapy) and could apply a lot of things I had learn to heal from trauma, on my BPD. Such as radical acceptance, coping skills for high stress, and mindfulness (I found the concept of meditations stupid but apparently it helps to regulate a part of our brain that is overactive and from my experience it REALLY helps to get a different approach on things). As for group therapy, I tried it and they didn't force me to share stuff about myself. I only shared when and what I was comfortable saying. It helped me a lot against shame and guilt, because I realised that I am much harder on myself than others.
I think that getting my diagnose really helped me because once I got it I knew what was wrong with me and that there are many things I can do to get better.
I wish you a good recovery and feel free to share on the BPD subs.",1520FM,rsvcs9
2,"We're here for you. I understand the road ahead seems dark, and without light.

However, there are many who have trodden this path before you, and in their journeys out of this disorder they have left much wisdom behind. I want to communicate that there is hope. I know it sucks. But there is real hope.",argumentativepigeon,rsvcs9
3,"After the doctor mentioned it to me, I was also in shock. I did a lot of reading, especially about DBT, which is a type of therapy. I found the skills to be very useful. Then I looked up podcasts and there are many to choose from. Let me know if I can help with anything",redflannelpajamas,rsvcs9
