,Comment,Author,Post
0,"I had TMS! Just finished about two weeks ago. Here’s what I noticed. 

1. My physical symptoms all went away. My *physical* depression (fatigue, brain fog), anxiety (stomach aches, nausea) etc. all disappeared. It also helped greatly with binge eating. I don’t find myself craving unhealthy habits anymore, for the most part lol. 

2. I still get sad and anxious as any other human, but I’ve found it’s appropriately placed. For example, instead o being anxious all the time, I’m anxious when a cop turns on their light behind me, as most people would. And then I’m able to calm down pretty quickly. I get sad when something sad happens, but I am quick to address it. 

3. I’m able to address and cope with my emotions much easier. I still deal with mood swings, but instead of being held down by my moods, I’m able to use my coping skills and self care to address them. I’m able to say “okay, right now I’m feeling angry. What can I do in this moment to deal with this?” And then I follow through. That’s been the biggest improvement for me - being able to actually follow through on the emotional regulation.

4. I have more energy to do things. I picked up hiking as a hobby and it’s been going great. I usually quit things easily (ADHD) but with hiking I stick to it and I don’t get discouraged when it gets hard. 

The way I view TMS is not a cure for the symptoms, but it’s like taking the huge weight that’s crushing you off in order for you to be able to address what you need to address. The physical symptoms are gone, the trauma is still there, but I’m able to work through it because I’m much more clear headed. 

If you can get it covered I’d highly recommend it. In total, I had to spend about $600 out of pocket, but the total cost would’ve been somewhere near $16k without insurance. 

I’d highly recommend also finding a clinic with a good technician. Some technicians just turn on the machine and leave you alone. My tech actually did some CBT and DBT skills while the machine was on, and I feel like it really helped to solidify those therapies in my head. She would have me journal or would talk with me about something stressful that happened and it was really helpful. 

It’s a time commitment, but I’m so glad I went through it.",,18tw66e
1,"hellooooo so I did tms from end of august until late october (I was bad abt going 5 days a week lol but it’s still okay). I am not completely sure if it’s tms that has made this change in me cause I started going back to my long term therapist I love for the first time since june around the time I ended but. 

since I finished my life as improved so much, I am able to look at things differently and deeper. I am soooooo much less dissociated and even more recently have been noticing things more in general that I never had before. I’m also at a stage where all my friends are positive supportive people in my life. in the beginning of this year I still had a lot of toxic friends. I have a lot of hard stuff going on currently that I think would’ve destroyed me before. I also started on lithium in August so it’s hard to pinpoint if it’s tms exclusively. I think it’s a combination of everything but yeah i’m so happy I did it",,18tw66e
2,"Thank you so much for this, it’s so well written and candid. I really appreciate your feedback 🫶🫶",worthlessinsum,18tw66e
3,How much is the time committment?,No-Associate4514,18tw66e
4,"Hi there, did you do this in the US?",No-Associate4514,18tw66e
5,"Depends on the treatment! Mine was 6 weeks, 5 days a week, then three weeks of tapering where you do 1-2 treatments a week. For 9 weeks in total. Each treatment was about 20 minutes long, so it’s more so just having to go each week day. 

There’s another version where you go for one week, but you’re getting treatment all day everyday. Most people don’t do this one, but I’ve heard it can be just as effective!",,18tw66e
6,yes,,18tw66e
7,Sounds amazing. Whereabouts did you do it? And is this available on the NHS? Or do I require a specific type of insurance?,No-Associate4514,18tw66e
8,"It was really helpful! I’m in the US, I believe it is available on the NHS for depression and anxiety only. Here, most insurances cover - you just have to show symptoms of depression/anxiety AND have (usually) tried at least 2 meds.",,18tw66e
9,"I'm in the UK, and have been through so many different medications and therapy (both public and private), and several medication types. Need the cash/insurance.",No-Associate4514,18tw66e
0,"It's possible that since you canceled many times they might have decided not to schedule you anymore, but if that's the case I would think they'll tell you. Maybe they'll get back with you on Monday. You can always start with a new therapist if the current one terminates you though.",rescuelady111,110bg8l
1,"If you’re chronically canceling you’re costing your therapist money. Imagine you were a shift worker and your boss kept canceling your shifts? Time you’d set aside for work, now canceled without pay at the last moment. That’s not ok. You’re not building a relationship. 

My therapist told me that BPDs are notorious for bailing on sessions and “forgetting” arrangements. I never had this problem with her, I think I’ve missed all of 2 sessions in 3 years of seeing her twice a week because I was sick… but it would definitely screw with my relationship security if I knew I was wasting her time and being unreliable. 

If you want help you must stop canceling and get serious about this. It’s a professional service and this is your life. BPD can ruin it and your therapist is trying to help. Stop being irresponsible. Tell your therapist that going forward you will pay for any and all missed sessions, and see how many you miss.",Ill_Spirit_233,110bg8l
2,"BPD is really hard to treat. Most therapists are scared of it. It has a reputation of being untreatable.  


In the DBT manual there are clinical guidelines about how to handle things like no call no shows, scheduling, ending therapy. Guidelines for staying professional through the stress and difficulty.  


As a therapist, also, they are supposed to expect their DBT clients to flake out ... it's the territory. If you want to give this therapist an out, ask who they'd refer you to.  


I hope this goes well for you.",,110bg8l
3,"Although I believe that you'll be able to get therapy regardless of this, I do agree with some of the commenters here that it is time you take it serious, and make it a point that you'll NEVER miss another appointment. Or at least try to. Make it a part of your identity that going to therapy, or constantly working on yourself, is the person you want to be.

There are plenty of distractions in our day-to-day lives and it is hence easy to get lost in them. But once you do, all the problems you experience whether it is with interpersonal relationships, jobs, intrusive thoughts, etc, will always resurface if you do not make improving yourself a priority as an individual. 

Try to implement a long-term vision for yourself rather than short-term. I know you've got this! Life is a lot more peaceful & enjoyable on the other side.🤎",ditograss,110bg8l
4,thank you it's reassuring me,R1HMkk,110bg8l
5,"Most therapists have cancellation fees, and your therapist making generalizations about “BPDs” is incredibly problematic, if not just flat out ableist.",ncndsvlleTA,110bg8l
6,thank you,R1HMkk,110bg8l
7,"sorry for the late reply but one thing that stops me from compliance is I do it in secret of mom. and I live with her , she always worries where I am going. My therapist thinks it's best not to tell mom as I think she's not ready to admit I need help.",R1HMkk,110bg8l
8,"Lol?! Ableist? Please tell me you’re joking. A therapist who specializes in treating borderline personality disorder isn’t allowed to describe the challenges the disorder presents? May I also please point out that she helps people correct the disorder at a structural level. If you do the right therapy you won’t have BPD eventually. You’ll have completed the psychological milestones to grow out of it. Therefore it’s not a birth defect. You can change it if you can tolerate the honest discussion. 

Ableist. Lol.",Ill_Spirit_233,110bg8l
9,"Yes, ableist. It is ableist to make generalizations about a certain illness, just like it’d be ableist to make generalizations about people with other disabilities, just like it’d be racist to make generalizations about a certain race, or sexist to make generalizations about men or women. Plenty of people aren’t born with certain disabilities, develop them, and then go into remission, that doesn’t mean they can’t experience ableism in that time. Try not to lash out at facts. I also didn’t say that your therapist saying one bad thing made them an overall bad therapist.",ncndsvlleTA,110bg8l
10,"I’m surprised that explaining the challenges of a condition is not allowed. Sex and race aren’t disorders. You cannot compare being female and suffering with BPD. She was describing expressions of the illness itself (fear of intimacy). An expression with the therapist is missing sessions. If we cannot sit down and have that chat then we’re validating the illness and submitting to the disorder. 

You do whatever you like, and that’s your right, but for anyone else reading this — if you want to get better, the best thing you can do for yourself is face the facts. 

It’s not generalising when it is quite LITERALLY the disorder. We all fear abandonment. We’re all afraid of intimacy. Giving us the heads up that we might engage in XYZ behaviour as an expression is assistance, not generalization. We pay these people to work for us and help us out of the lack of insight. Now it’s ableist to share insight. I get it’s hard to hear but then you’re in the wrong therapy.",Ill_Spirit_233,110bg8l
11,I’m not going to be petty and downvote you back.,Ill_Spirit_233,110bg8l
12," I didn’t compare having BPD to being female, they aren’t similar things. Mentally ill people and women however are both examples of people who experience discrimination or poor treatment due to things they can’t control. You can generalize a disorder, because it does not present the same in each person. No matter how badly your therapist wants it to, their experiences with people who have bpd, and your experiences with people who have bpd, are not definitive, they are anecdotal evidence and spouting them as if they are fact is harmful. Downvote me or don’t, my world will keep spinning just like yours.",ncndsvlleTA,110bg8l
13,"Sigh. I didn’t downvote you. Maybe someone else did. My therapist told me, a pwBPD who does not miss appointments, that this is something she often deals with, with her BPD patients. I don’t express my BPD that way. I didn’t feel offended in the slightest. Maybe I would have felt offended if I were someone whose BPD was making me miss appointments… but then it would be a very helpful thing for me to hear? And yes, just like cancer and diabetes, borderline personality disorder does have specific markers common to all sufferers. That may, apparently, in the case of BPD, express as missing appointments. For example - a deep fear of abandonment, incomplete object relations, no object constancy, split self and object representations. 

If my therapist were to say that many of her BPD patients have self harmed, been angry with her, or think about suicide… would it be ableist? What’s the difference? She’s there to help. 

My world isn’t spinning. I’m just wanting you to see that people aren’t out to get you. This is such an important step. Trusting help. You’ll be stuck as long as you’re raging against sincere attempts at help.",Ill_Spirit_233,110bg8l
14,"I’m not raging, generalizations are definitely bad, what your therapist said was definitely a generalizations, and your world is definitely spinning. I didn’t mean it as metaphor I meant like the literal rotation of earth. (I mean it was kind of a metaphor as I was saying “no matter what is said here on the internet life will go on” but eh) 
Eta: you may be under the impression that I’m offended by what your therapist said bc I miss appointments, that is not the case. I’ve never bailed on a therapy appointment and I’m also otherwise disabled and I’ve never bailed on my many doctors appointments, if for some reason I couldn’t attend, I give as much notice as possible. But because of this, I would be upset to hear a new therapist say that to me, I would feel they already have a negative idea of me that is not accurate.",ncndsvlleTA,110bg8l
15,"I see from your post history that you haven’t yet received therapy for your BPD. I know this is scary and it’s probably hard to trust that you will be respected, appreciated and seen as a valid human being despite your disorder. If you find a therapist or group specializing in BPD I can assure you that the first thing they are concerned with is validating your experience and reminding you that you are just a human being with a set of specific challenges that there are known tools to overcome. You’re also young, so your BPD is only going to get better once you access treatment. In 5 years if you work hard, you’ll be living a good life. I promise. Try to trust your therapist when you find one, it will change your life.",Ill_Spirit_233,110bg8l
16,"I’ve definitely been…in therapy. I’m just not currently as my insurance allots for a certain amount of appointments, but I’m actively looking for new therapists, I’m actually awaiting an email from a potential one as we speak. I’m very open and excited towards treatment, I just wouldn’t appreciate being told that “bpds” are chronic bailers, also bc I have friends with bpd that aren’t like that.",ncndsvlleTA,110bg8l
17,what happened here it's like an essay,R1HMkk,110bg8l
0,Look for people who do eft! It's BPD for couples,Klexington47,17d9rge
1,Thank you!,Dependent-Celery-885,17d9rge
0,"If you can afford it, I'd say stick with the therapy. Even when you're not in a relationship it can still help you to manage everyday life and build skills that will improve your relationship with yourself, your friendships, and prepare you for challenges in your next romantic relationship. Personally I learned a ton about myself in therapy after exiting the relationship and my head felt a little less foggy because I didn't feel like I needed to put every thought I had through a ""what would my partner think about this?"" filter.",lovesickanddying,1341eua
1,If you can afford it keep going. It’s really easy to feel like you’ve recovered but when stressful situations and symptoms come up we’re reminded of how bad we can get without therapy and the skills we learned,beepbeep123345432,1341eua
2,I would add free DBT resources and do a lot of the work on your own as well as with a therapist that way when you do stop going to the therapist you are still in the habit of working on your stuff still. There are a lot of free DBT/CBT resources out there.,lustful_livie,1341eua
3,"I didn't settle in a relationship for many years and just happened to meet someone nearly 2 years ago, a couple months after I started therapy. 

I don't know if therapy is the only reason we lasted so long. I finished my course in November and we fought a lot and broke up start of this month. 

I will never regret him, but one thing I regret is that he was my whole world and my main insecurities and issues. It feels like 18 months of intensive therapy was wasted on someone who's now just a stranger. 

It would have been better to be alone. Work on the issues of being alone. 
All the others with partners at least had very serious partners, ones there for life. Having a temporary man was a waste.",,1341eua
4,"Same answer, if you can afford it keep going.

My experience is similar. When I'm single, BPD is easy to manage (wasn't always this way, but for the past couple years). When I'm in relationship, not so easy.",myholelove,1341eua
5,"My ex and I broke up a year a half ago, but with wanting to enter the dating scene again I’ve sought therapy to help with the symptoms that way come up along the way. It’s okay to be in therapy and have less symptoms to prepare for the times that the symptoms many resurface.",OGcaptaindingus,1341eua
0,Maybe DBT isn‘t the right therapy form for you. I didn‘t like it either. I don‘t know how common relying on Youtube videos is for therapists but that seems pretty unprofessional to me but idk,catluvr1312,110qnx8
1,"I know it seems hard rn. Trust me. It is. It's so hard. But don't give up. Slow down a bit perhaps. It's a big thing you're doing. So yeah, it's gonna feel huge. Overwhelming. But dont give up. Take a day off. Relax. Do a comfort thing. Hug your soft toy. And tell yourself the thing you most desperately craved to hear when you were a kid.",SomewhereScared3888,110qnx8
2,"Therapists are not one size fit all. Do some research and find someone new. I hate to be the same person saying “you’ll find the right person someday,” but I also have learning disabilities and have been told the same things as you. My therapist says she pitied me for getting the same treatment you are describing. But I’ve been through a lot.",,110qnx8
3,I use dbt flow charts myself. Makes remembering to use a skill easier. I can direct message a link (it's my blog).,,110qnx8
4,"Fit with your therapist is the #1 predictor of a good therapeutic outcome. If your therapist is leaving you feeling lost or in the dark, they’re probably not the right fit for you. You will know who is the right fit. As BPDs we seem to know instantly. Choosing a therapist who could be a FP is ideal. This way you get to work through your trauma material with the therapist, you like them, cling and play it all out. If that therapist knows their stuff they’ll help you grow out of it. If your therapist doesn’t feel like FP material then yes better to leave and find one who does.",Ill_Spirit_233,110qnx8
5,"I have ADHD. I found a therapist that specialises in both DBT and ADHD and we only do 1:1 sessions. There’s a lot of not being able to do homework’s and forgetting but also gentle prodding and exploring lessons in more digestible ways for me. 

It might be worth bringing up how you think the therapy isn’t working for you and see if some adjustments can be made to accommodate your capacities.",quandary-in-the-oven,110qnx8
6,I didn’t like DBT either. I was greatly helped by psychodynamic psychotherapy.,Ill_Spirit_233,110qnx8
7,What other methods do you think I could use or do instead of dbt to help combat my bpd?,Informal_Appeal5054,110qnx8
8,Could you maybe share this with me?:),julia_psrk,110qnx8
9,Yeah I think I am going to bring up how I need to take small sections one step at the time for me to more easily understand,Informal_Appeal5054,110qnx8
10,"idk about methods but for therapy I can recommend depth psychology, psychoanalysis and systemic therapy",catluvr1312,110qnx8
0,"This is part of WHY group therapy is good for people with BPD.

Why SHOULD you be picked consecutively? It's *group* therapy, it's not just about you. It's not all about you. LIFE isn't all about you.

You don't know what the ""wrong"" questions are, you aren't a therapist. Have some faith in the processes and recognise that these methods work quite well. You recognise you've basically played pretend your whole life and therapy is a safe place to start unravelling all of that.",elegant_pun,z26w5y
1,How do you know that your struggles are more important than others? That's a really poor mindset to have and not very fair to the other people in your group therapy. They are just deserving as you for help.,xAkumu,z26w5y
2,"100/10 for noticing the source of your frustrations - sounds like you're torn between wanting to change the situation, and having to change yourself to meet the needs of the situation (again!)

Should you?

Like, if it's not for you and you know it's not, what's the problem?

The problem is the same as for the rest of us - you're posting this because you know you have vulnerabilities. 

There are ways in which you're different from others and these frustrate you because you have to do all the work to close the empathy gap, and one of the results of that empathy gap is that self-compassion has been harder to learn from others for you.

You're used to dealing with things on your own, but this psychodrama group represents a thing you don't know how to deal with (yet), and you're doing the intuitive thing in seeking reassurance about it. You're probably reasonably good at dealing with most things on your own - I know I am, because I've had to be.

But fml if I wasn't trying to paper over some vulnerabilities with toxic masculinity. Fellow man, I say this in all seriousness - trying to do so is less like shooting yourself in the foot, and more like shooting yourself in the dick.

Bell Hooks:

*""The first act of violence that patriarchy demands of males is not violence toward women. Instead patriarchy demands of all males that they engage in acts of psychic self-mutilation, that they kill off the emotional parts of themselves. If an individual is not successful in emotionally crippling himself, he can count on patriarchal men to enact rituals of power that will assault his self-esteem.""*

**It is not your fault**

Some people might use this kind of sentiment as an excuse, as a 6'2 hairy drummer with no need to, I can tell you with absolute certainty that understanding this kind of thing has been key to recovery.

You're seeking reassurance because you don't know what's going on inside, like a driver taking their car to a mechanic worrying about whether the problem you can't identify is actually going to get solved, or whether you're going to get ripped off.

You're worried about getting ripped off, and, frankly, why wouldn't you be?

I've tried drama groups. I can see how they 'work' for some people. Ask yourself what your recovery goals are, and whether the situation you're giving your time and effort to is helping you achieve those, and then... bro - unless you live in a very small country, ask yourself how you can know that your therapist is one of the best in the country.

Been where you're at, and I still find myself inexorably drawn to people of higher competence and compassion than my own. Some people are just golden, relativistically speaking, but so could you be.

Keep giving yourself opportunities to learn from yourself, and to road-test any new skills and learning along the way, and eventually you can be your own mechanic.

I mean that - these emotion things are just combinations of hormones and neurotransmitters as interpreted by your thoughts and memories. Yours are just different - and if you're afraid because there are things you don't understand, or angry because there are things you'd like to change, that is entirely normal for someone from where we're from.

You don't know what to do with them though, so don't act on them. For now, see this out and keep a diary 👍",,z26w5y
3,"I made a YouTube video on how I dislike group settings.

I think learning the why’s behind your behaviors and implementing new skills is what’s important.

What kind of life do you desire?",Sweetsourgonesassy,z26w5y
4,"You just echoed my past experiences for the last two years. I lived with someone who has Aspd, was spontaneous, energetic daring, manipulative and brash. It did wonders for me growing up and realising some things were okay. I hope you find the same.",D2LDL,z26w5y
5,"This is everything I wanted to reply. BPD has a lot of main character syndrome tendencies, and group therapy is a much needed equalizer.",BabyYodasMacaron,z26w5y
6,Group therapy isn’t for everyone and if op is listening to shit they don’t find is helpful that’s valid. Group therapy isn’t the best fit. If OP wants their treatment to be all about them they can.,Sweetsourgonesassy,z26w5y
