,Comment,Author,Post
6,"Here is my reply to both of your last posts:

I don't want to be in a parental role.

For reasons I'm not gonna get into, I don't have many people and have difficulty getting close with most. I do like her as a person and unless I'm completely off in my assessment of her mirroring capabilities (which I think are mediocre), I think she's a good person. And also good at promoting my growth and I hope I am decent at promoting hers.

I don't base my self worth at all based upon others. It's been very internal to me for a while.

Sacrificing myself: there is an amount of myself I'm happy to give in any friendship/relationship, she does push boundaries but we're not going to live together this time. And I've learned a good bit about my limitations, boundaries, and we're not getting close to those limitations this time. I've also learned alot about her. I pushed so many of her buttons without even realizing. I pushed them alot. Hell I would push a normal persons buttons unknowingly in the past. It's good to have discovered and lock down my boundaries as it pertains with her. I don't think she'll push too aggressively. She'll be upset but I fully expect her to be ok with them. Or move on.

Codependent? A bit.

I'm not letting her become my life this time. And also making an active effort to build a full life.

Her boundaries, yes I will honor them. Considering everything that went on the past few months, I am impressed she managed to push through and do the right thing. Considering how much it ate away at her. I'm gonna make my peace with her and then I'm leaving her be. Ball is in her court. I'm not gonna BS her. But I do expect her to bite.

She's wanted to change since before she met me, she doesn't quite understand what's going on. She used to believe she was a narcissistic and doomed and did pursue therapy for that and made me aware of it in the beginning. I let her know a few months back that I didn't believe she wasn't one and that there is alot of hope for her. The happiness on her face was priceless. I shared info about DBT w/ her and there was an overwhelming fear on her face. She primarily attends therapy when it allows her to continue assuming the victim role. But I have seen her take responsibility and direct feedback, from me and therapist. I think DBT and the right therapist can make a big impact. 

The ball is going to be in her court entirely, she will have to take responsibility but I will be there for her in a few couples sessions just to make sure the therapist isn't being a dick to her. After she's gotten off the ground, and her personal therapist is in sync. I'm planning to step away from it. If she wants me to come for sessions here and there I will.

I'm not nearly as attached to her as most people become w/ their pwBPD. She didn't destroy my self esteem or worth. Mine is pretty concrete. The first time she tried that nonsense on me, I questioned myself but was like no something is very off here. And I found what was very off.",Best_Tart_7252,1biacdn
7,"May I ask how much therapy you were able to go through since the period where you were living with her?

And what's the context of that previous relationship?Since that's highly relevant to how the current one could work... And how precisely did that relationship end?",Choose-2B-Kind,1biacdn
0,"I was diagnosed with both. I was diagnosed with BPD as a teenager, but every mental health professional I saw didn’t point out my ADHD. I moved and I was misdiagnosed with bipolar (that’s a whole other story) and I was also diagnosed with ADHD and anxiety

I found a really good psych and therapist 2 years ago and I’m “properly” diagnosed with BPD, C-PTSD (no longer meet criteria now for both), ADHD-combined type, and OCD.

ADHD symptoms and BPD symptoms overlap a lot. It’s not in the official diagnostic criteria, but people who have ADHD struggle with low frustration tolerance (low ability to manage anger) and effectively regulate emotions. People who have ADHD can also experience more moment-to-moment mood changes, which can also look like BPD. Among the poor impulse control which is also a BPD symptom.

How to differentiate? 
-BPD experiences instability in sense of self, lack of knowing who they are
-severe abandonment issues
-experience transient dissociation/paranoid ideation 

So they can kinda mesh with eachother. I’ve always had a hard time managing my emotions, on stimulant meds I can manage my emotions- ESPECIALLY anger- much better. My mood is also more level during the day. I’m less scattered, more patient. Meds have made my ability to function so much better. I can participate more in therapy, regulate my impulses, I’m more calm during the day. 

The biggest role meds have in treating BPD is treating co-occurring disorders to lower distress, so that the BPD sufferer can further use skills to regulate themselves. I’ve found this to be very true with my adhd meds and my ability to regulate my other BPD  symptoms. 

ADHD is a self-regulation disorder, and in my opinion, I think “ADHD” is a terrible name. It should be executive dysfunction disorder. 

Thanks for coming to my TED talk. I clearly too my amphetamines this morning lol. :)",,1bbdsr0
1,I think I have ADHD traits but I can’t take any stimulants because they increased my anxiety to much and I couldn’t sit still at all (I tried Adderall).,Old_Bluebird_58,1bbdsr0
2,I believe I have overlapping audhd but my therapist dismissed that saying I only have BPD so 🤷🏼‍♀️,Chemical_Machine_970,1bbdsr0
3,Yes. Nearly 30yr struggle with bpd. Diagnosed with adhd last year. Medication has changed my life. My head is calmer. No impulsive behaviour. No self harm. Drinking is down a hell of a lot.,whathappensifipress,1bbdsr0
4,"Omg I feel you, I’m so on this. I got diagnosed with BPD a few years ago, and recently so many people have spoke to me suggesting seeking an ADHD diagnosis. I spoke to my family about it and they mentioned about ADHD being mentioned in primary and secondary school but nothing got done. I think potentially the world is more likely to diagnose mental health than thinking about neurodiversity. How are you feeling about it?",maladaptiveformation,1bbdsr0
5,Totally. And ocd too.,Born-Value-779,1bbdsr0
6,Yeah!,Maleficent-Sleep9900,1bbdsr0
7,Hell yeah stimulants have helped me so much,scummypencil,1bbdsr0
8,"I have both, and they’re frequently comorbid! Unfortunately I haven’t noticed much of a change in my BPD symptoms since starting meds. Someone else in this thread did a great job elaborating on their relationship, but I also wanted to throw in that I find this [Venn diagram](https://neurodivergentinsights.com/misdiagnosis-monday/adhd-vs-bpd) very helpful.",hissingfawn,1bbdsr0
9,"Yep and I wouldn’t have had any idea until I was a couple years into treatment for bpd. 

For me the severity of my bpd had masked the adhd, once my bpd symptoms calmed, my adhd became very obvious, especially when looking back into my childhood, you aren’t alone for sure.",LL197,1bbdsr0
10,[removed],,1bbdsr0
11,"BPD, ADHD, OCD and after Iraq PTSD!! Talking about a nightmare to be around. Still I try.",Sooo-tired,1bbdsr0
12,"Hey! I went to get diagnosed with ADHD, and ended up being diagnosed with BPD first, and then ADHD a few weeks later (two different psychs working under the same company with two different specialties). I also have C-PTSD, anxiety and depression. A LOT of these things can overlap, some symptoms can mask others, or other symptoms can amplify others (eg. when I'm frustrated by my lack of executive dysfunction from my ADHD, my BPD rage can and does kick in and take things to a whole new level). Learning to manage certain triggering symptoms has led to a greater ability to regulate BPD and anxiety symptoms. ADHD medication also changed my life, it made me feel like I could actually breathe, and think without being assaulted by 10 thoughts and 2 songs and a random Spongebob quote being repeated over and over in the background. I hope you feel a lot more validated! It's not easy, but nothing in life is, and the relief of knowing is so much better than the constant nagging fear that you're failing because other people seem to be able to handle things that you find almost impossible",Icy_Stranger9934,1bbdsr0
13,"II have somme serious BPD...My current psych thinks I have ADHD too, I have siblings with it... 

&#x200B;

He just tried me with effexor and it was horrible. I became extremely distressed/ agitated SI SSI etc- really rough. My experience with effexor has been making me afraid to tell my psych and try stims- but you are giving mme somme hope!",saladpal777,1bbdsr0
14,"I (F22) was diagnosed with ADHD at like, the age of 6 or 7 but only because my twin BROTHER was diagnosed first haha

The BPD discovery happened at 20 (I'm 22 now), and personally, **yes** when I'm on stimulant medication my symptoms are SO much less severe. (20mg Vyvanse has been best for me).

I will say however, as a woman, I've realized that if I'm under more stress, or if certain hormone levels are higher for me at certain times of the month, stimulant meds can either make symptoms way worse, or they just don't make a difference at all. 

Generally, they're very helpful, but unfortunately, sometimes they are a big factor when it comes to bouts of mania. So unless you're REALLY in tune with yourself, or you at least have someone around that could recognize any negative signs,  I wouldn't recommend stimulants until you feel more regulated more often. My own doctor was absolutely no help, so I had to figure all of this out on my own.",abby_appy443,1bbdsr0
15,"No this was great to read. I feel the same, congrats on no longer meeting criteria",scummypencil,1bbdsr0
16,This is an excellent explanation between the difference of the two. Thank you for taking the time to write it out (and for taking your stims!). It’s much appreciated!,gooseglug,1bbdsr0
17,"That’s frustrating. While i do have nervous energy from starting the stims, I’ve found anxiety is actually lower.",gooseglug,1bbdsr0
18,The main reason my therapist told me to seek out treatment is due to how i react to cold meds. Daytime makes me drowsy and nighttime keeps awake.,gooseglug,1bbdsr0
19,"I’ve always known that i drink because of my mental health. Ive only drank one since New Year’s Eve. Otherwise I’ve been drying out. Since starting the stims, I’m feel that extra dopamine/serotonin boost that i got when i was drinking.",gooseglug,1bbdsr0
20,"Hey, do you mind telling me what medications helped you? Thanks",Formal-Apricot8237,1bbdsr0
21,Do you mean how do i feel about receiving a diagnoses of ADHD? Or do you mean how do i feel about finding out that all my brain needed to be semi-functional was a stim? Because i don’t know how im feeling about any of it. I have seen such big changes in a little amount of time that i don’t know how to fully process it.,gooseglug,1bbdsr0
22,I’ve seen that Venn diagram before. But not that article. It seems like it’s going to be informative. Thanks for sharing it. Much appreciated!,gooseglug,1bbdsr0
23,"This is similar to my story. The BPD masked the symptoms of ADHD. It wasn’t until i started seeing videos on inattentive ADHD that made me start thinking that maybe i had it. The real kicker and the reason my therapist told me to go tested is how i respond to cold meds. Daytime makes me groggy while nighttime keeps me awake. 

And yes, looking back at my childhood I’m seeing the signs were there. Because i was a “lazy student and lazy person”. 🙄",gooseglug,1bbdsr0
24,"Can i ask when you drink, have you taken your meds that day?",gooseglug,1bbdsr0
25,Do your meds say caution taking them if you suffer from BPD or psychopathy ? I'm curious why the warning.,bpd1518,1bbdsr0
26,"I’ve been on Effexor before. I too had a horrible experience with it. It was not good. The thing i didn’t think of is stimulants are not like antidepressants. I thought there was no way they were acting as fast as they did. But again, it’s a stimulant and it doesn’t have to build up in your body like antidepressants do.",gooseglug,1bbdsr0
27,"I am on the exact stimulant med at the exact same dose. I’m a 39 year old perimenopausal woman (technically it’s considered premature ovary failure because of the age i started experiencing peri symptoms). I’m curious to see how my hormones are going to affect my hormones. I’m due for my withdrawal bleed next week. My primary does want me to take my BCP continuously because of the level of hormonal anxiety I’ve been experiencing. But I’m thinking I’m going to let the withdrawal bleed come this month just to see how i do. 

My psychiatrist did say some people experience mania when they first start stims. That was a big worry for me. I am very much self-aware. I was worried I’d end up experiencing mania like i do when I’ve been on steroids. I haven’t experienced any mania. A lot of nervous energy but no mania.",gooseglug,1bbdsr0
28,I couldn’t tell my therapist how I know lol,Chemical_Machine_970,1bbdsr0
29,methylphenidate.,whathappensifipress,1bbdsr0
30,How you feel about if you had got diagnosed with adhd earlier things may have been different and you may have had a different life/potentially less early difficulty,maladaptiveformation,1bbdsr0
31,"Yeah another common one is caffeine making you feel sleepy instead of waking you up. 

There’s no harm asking to be assessed, because they look back to childhood as part of the diagnosis it really is very hard to get a misdiagnosis, it’s very you’ve either got it or you haven’t, but either way it’s better to know.",LL197,1bbdsr0
32,Nope! Nothing,Icy_Stranger9934,1bbdsr0
33,"ugh Im sorry it sucked for you too, thanks for sharing your experience with it though!",saladpal777,1bbdsr0
34,"That part is making me incredibly sad to think about. Who knows what my life had been if i had been diagnosed in childhood or even as a teen instead of being diagnosed at 39. It hurts my heart to think about it. 😔 I have told my son’s dad we need to keep an eye out in case he starts showing signs. Not saying he currently is showing signs. But his dad was diagnosed at a young age and now with me being diagnosed, there is a good chance he will be diagnosed too.",gooseglug,1bbdsr0
35,Are they stimulants?,bpd1518,1bbdsr0
36,"Yep! Vyvanse, 50mg",Icy_Stranger9934,1bbdsr0
37,Thank you. Has it helped with rage and splitting ?,bpd1518,1bbdsr0
38,"Definitely helped with the rage, I'll admit I still get angry, but it isn't made worse by my ADHD impulsivity or by the sensory issues - not that those things don't still exist by themselves but they're not amplifying the rage! And because my mind is a lot clearer, I'm not twisted by anger and unable to think clearly the way I used to be. Obviously the medication isn't a cure-all, and I've done a lot of therapy, but the meds have definitely helped. 

The splitting isn't affected unfortunately, except for when my sensories are going haywire, which is made a little easier by the meds, but splitting definitely does still happen!",Icy_Stranger9934,1bbdsr0
39,Thanks for the reply and I'm glad it's helping. Is the therapy seeing a DBT therapist?,bpd1518,1bbdsr0
40,"Nope, CBT, which isn't the best option but DBT is too expensive",Icy_Stranger9934,1bbdsr0
0,"Long term: exercise. 
But when you’re about to blow up, ice cubes on pulse points, and removal from the aggravating situation.",lizzie9876,185g43j
1,"I find the DBT skills of stop & tip help. Once I feel that hot rage get into my chest I know there's trouble... If it goes above? Instant fubar, potential violence and instant regret 😱😐I even got an ice bath recently and find it helps in general, not just when you're about to go postal 📯",privateer444,185g43j
2,"What helped me a lot is understanding the physiology going on in the brain. BPD sufferers often have under developed amygdala’s from childhood trauma so it doesn’t fully develop. Amygdala’s regulate when there is a threat, but because ours are smaller they quickly get triggered/over stimulated, releasing cortisol and adrenaline into the bloodstream which makes us much more likely to freeze, fight, or flight. Often fight/yell is the reaction, together the frontal lobe that does the executive thinking eg.Frontal Lobe: ‘If I swear at the doctor the next time I visit ’she’s’ not going to be happy with me’ is turned off, the frontal lobe closes down because we think it’s an emergency like jumping out of danger of a car running us over but it’s not….it’s just the doctor being difficult. Taking notice of when I’m getting anxious eg when I feel a pressure sensation in my brain (flood of adrenaline) or sometimes my eyes get watery I can be aware more and more that I’m getting wound up. Each time I notice, I can just reduce talking/overthinking take some breaths and not let the horse bolt. I used to be extremely volatile (smash windows) and I’ve become soooo much calmer from just noticing this whole process unfolding. Sometimes I have anxiety attacks that go for 5 hours, but I just go for a walk with some music on and it helps reduce it. There are lots of techniques when you become aware its happening that will suit you….but becoming aware it’s happening is the first step. Here’s a little article that explains whats happening in the brain. Good luck🐰 https://medium.com/invisible-illness/its-all-in-your-head-borderline-personality-disorder-and-the-brain-c14b66eb0966",DiStUrBEdMeLoN,185g43j
3,Go to a different doctor—sounds like they sucked. Medications help significantly but finding the right combination takes patience,lomorales1,185g43j
4,With your craft. Take a moment to see how you started and how much energy feedback is going on,,185g43j
5,Grab a bag full of frozen peas or similar and put it on top of your head. Leave it there until you're calmed down,MierdasBeacon,185g43j
6,"I think the issue is you need patience and understanding people in your life including mental health professionals. If I was your doctor and you blew up and said that to me, I'd think, wow this person is really suffering. 

I'd say you sound frustrated lets do some deep breathing together. Then explore options.

It honestly seems like they're not a good fit to treat clients.",Sweetsourgonesassy,185g43j
7,Exercise by far made the biggest difference with that for me. Also fish oil.,ember_frost,185g43j
8,"yesssss , I'm such a ass.",Kathythr,185g43j
9,I second these or a quick hop in a cold shower to reset...,Pretend-Vast1983,185g43j
10,"This. It sucks, how hard we have to work just to maintain a sort of 'normal' but if you can find something physical to do regularly, even just walks, it really helps. No joke I started roller blading over the summer, (I fell. A LOT) because I just wanted something fun and new to try while also getting that exercise.",MrsMeSeeks2013,185g43j
11,There were times when I’d get so angry that I’d go outside and run and run and run until I just couldn’t feel angry anymore. Then I’d take a nice hot shower and cry for a couple of hours. Then I’d be fine (for now),the_fishtanks,185g43j
12,"> Each time I notice, I can just reduce talking/overthinking take some breaths 

don't say a word - breathe - distract 

I came to reddit this morning because I was feeling super triggered, and wanted help.  This is the first post I saw and wow i already feel way more reasonable.  Im grateful for both you and OP for sharing.  I'm sure ice is helpful, but I dont always have it on hand. Learning new things about the brain is a nice distraction too :)",BeeDive,185g43j
0,"TLDR: 3 years +/- after starting DBT and I never found groups helpful so this was all workbooks and readings and modalities from my counselor, done with her or by myself.

Quit alcohol mid 2019. Alcoholism was basically a giant tarp thrown over the BPD and related issues, keeping me or any counselor from getting to the root issues. I certainly *had* BPD before then.

Had a kid mid 2020.

Diagnosed BPD late 2020.

Started barely looking into DBT throughout 2021 while I looked for another counselor (the one that dx me ultimately wasn't a good fit). 

Got another counselor late 2021. Started doing DBT in earnest.

Left my abusive relationship early 2022. Also started reading up about CPTSD and trauma, which was very helpful.

Got a couples counselor to try and work through the abusive relationship in early-mid 2022. Found out quickly that my ex was aggressively against any kind of help and was actively sabotaging my own attempts to get better, practice DBT, etc. Dropped the couples counselor and chose my mental health over a garbage relationship in mid 2022.

Started doing DBT and looking into IFS therapy approaches from mid 2022 onward. Did it like it was my job. Books, workbooks, reminders all over my house, etc. Shit, I still have an emotion wheel on my fridge. This *was* my main hobby for almost a year.

Started a new relationship with an amazingly grounded, patient, understanding person in mid 2023. That turbo-charged everything I'd been working on because I had a supportive partner.

Literally this past Tuesday my counselor said I no longer fit the dx criteria for BPD. My homework for our next session is to decide whether I want to drop to monthly check-ins or quarterly or as-needed, etc.

Dude, when I started, I was seeing my counselor twice a week. The fact that I'm now in a place where it's like ""you got this now; wanna just call me if you have a problem you can't fix yourself?"" is WILD.",Much_Difference,1bv50qp
1,10 goddamn years.,,1bv50qp
2,"That’s awesome!! Congrats on all of you. I’ve been struggling for 12 years now, and although I’m much better than a few years ago, I still fir some of the criteria. I have therapy twice a month and take daily medication. I was diagnosed around 31, now I’m 43. But there is hope. i just need to WANT to get better",Famous-Pick2535,1bv50qp
3,About 7 years of CBT / talk therapy and then 3 years of DBT. So 10 years total. I wasn’t diagnosed with BPD until after the 7 years of therapy (it went under the radar bc I was more so focused on recovering from my bulimia / depression / anxiety and childhood trauma at the time—plus I had more of a quiet subtype).,bpdbeautiful-audrey,1bv50qp
4,"Felt that.
I didn't know it was bpd, I was only diagnosed with anxiety and depression.
But at 17 I was so convinced everything would get better if only I left my parents house.
Now, 6 years later all I have to show for it are a bunch of unfinished projects and a newly diagnosed personality disorder explaining why my brain stops collaborating with me twice a month - when I can't handle to keep trying any more. And then I have deal with my messes and try to keep working on myself while avoiding thinking about my self sabotaging tendencies.",puredepressivo,1bv50qp
5,“Emerging BPD”/BPD traits at 12. Official diagnosis at 16. Re-evaluation and re-diagnosis at 18. Started taking treatment seriously at 19 and officially went into remission at 22. Diagnosis removed from paperwork a year later at age 23.,,1bv50qp
6,"I think I'm going for 20 years then. 
My thing is giving up
I work work work and give up
I can deal with the 20 years, I'm just tired of feeling so stuck in this cycle.",puredepressivo,1bv50qp
0,"You are not alone. I feel similar. I have achieved some things I wanted but never stuck at it long enough for it to develop into a real skill or craft. I am a quick learner but as soon as I learn the basics of something I get bored and move onto to the next ""best"" idea and cycle through that again. 

I'm still stuck on this but I've decided over the next 12 months I'm going to devote my energy to therapy, self care, learning to love myself for just being me rather than filling the void I feel with another attempt at achievements or success, because I know I'll self destruct again if I don't learn to just accept who I am. I think we need to find value in just being, rather than only valuing ourselves for achievement, because that can only last so long. 

Again I'm in a very similar headspace to you, so not real advice just a reflection and reminder to myself as well to not get caught up in the accolades, because I'll still feel empty. So your not alone with this. I hope you continue to do therapy or try and find yourself in some other form. I'm hypercritical of it too, and also of a lot of the self care strategies, but so far ""my way"" hasn't really been working out for me, so I'm trying to give into giving it a proper go. Don't be too hard on yourself, life is hard! Especially if you didn't get the right supports you needed as a young person to foster personal growth.",chucklincharco,za3c7c
1,"Positive self talk and emdr therapy were the only things that ever took down some of the self loathing I had. For the first time in 35 years I don't hate my reflection... dbt, cbt, trauma and talk therapy did nothing to help with the constant self disgust but positive self talk and emdr therapy really did amazing things. Took about 6 months to really ingrain the new thought process.",Ambs1987,za3c7c
2,"> am afraid that letting go of my expectations will just doom me to mediocrity.

Just be aware of the black and white thinking in this - there's options beyond no expectations and really high expectations.",Lifaux,za3c7c
3,"Be in an environment that forces you to be different, you will change eventually. Home maybe reinforces the old you.",D2LDL,za3c7c
0,DBT made more of a difference to my anger than anything else.,gooseglug,1cd7hyt
1,Definitely suggest lamatrogine,Embarrassed_Clue_471,1cd7hyt
2,Lamictal. I don’t think it does literally anything else for me but holy shit I will never stop taking it. I hope it’s something that might work for you <3,crazybabebathsheba,1cd7hyt
