,Comment,Author,Post
1,"You MUST keep going and prove yourself you can do this you hear me. Don't let BDP be your excuse. Once you completed medicine nobody can take that away from you!

You are right nobody gives a fuck about mental health but it sounds like you do. So pave the way!",,14oslpo
2,Man that's fucked,Postaldude2,14oslpo
3,"I’m just saying it’s fking hard man . Even our psychiatrist professors seem like they don’t know shit about mental illness. Man wtf fuck . I may take a year of to go to therapy otherwise I’ll attempt su!cide . I really really need help but fk it fuck people . It’s not fair , to feel empathy towards some wheelchair dude but mental illness gets 0 attention. We got a student who struggled so much , turns out to be schizophrenic . He killed himself 2 years ago . 

Suicide attempt in medical students is high , cuz it’s fucking hard let alone dealing with bpd shit .",MixJealous1733,14oslpo
4,"take a deep breath just because people don’t acknowledge things doesn’t mean that they don’t matter. 

Look at Vincent Van Gogh he killed himself thinking he was as a failure and after his death look at how many people view him as a creative genius and love his work. Random example my bad. 

Truth is you are better than suicide. 
Suicide is a confession. A confession that life is too much for you to handle. I know you’re not a weak person, you are a fighter. I’m sure you fought to get to medical school because so many fail at that. 

Sit down. What’s bothering you. Journal it. Who do you want to be. How can you get there?
what kind of doctor you want to be?
Your training to be a dr then research how to heal yourself. Put in the work. Dedicate a certain amount of time to studying and for 30 minutes a day dedicate to reprogramming your brain. 

It is hard. I stepped onto a live train wire. I should be dead. I should not be here. I’m here for a weird reason.

That day I was a victim and gave up. That’s truly not who I am. That’s not who you are.

We must do what feels like the impossible. Not just survive but thrive..

Do what is right for you. Giving up is not an option.",,14oslpo
0,"Sleep as much as you can my friend I love cannabis for those times and I know you will find some peace regardless, in time",sun_puppy,1598ooy
1,"I just want to say that I'm going through the same, I just shared that too. I can tell you that if you hold on enough time what you feel will go away, I have gone through that several times in the past. But I also know that getting through it, holding on and being able to deal with everything while it lasts is horrible, and, as you are feeling, I also feel that I won't be able, even knowing I was in the past. I hope it helps to know you are not alone.",InSearchOfMeaning99,1598ooy
2,Please if you can drink some water. Take a nice hot bath. Grab a sandwich or something. Just worry about those things for now. Everything you wrote is def a valid concern. But right now it's just the 24 hours ahead I think you should focus on. Feel a little better and things might become more clear as you go along.,osndupu,1598ooy
3,I went through this same thing for the last couple of years.   I had 4 EMDR sessions and it still hurts but I don’t feel like I want to die anymore.  You have to find a therapist that specializes in it.  I was very skeptical at first but it has changed my life.  I hope this helps.,ThatQuickChick,1598ooy
4,"I've been trying to do that tbh, the first night I took Ativan and once I woke up I took hydroxyzine, fell asleep and when I woke up later that day I took hydroxyzine again. Reminds me of whack a mole 😂 I fall asleep but when I get up I do everything I can to fall asleep again.

I regularly consume cannabis, and it definitely does have mind altering effects. If I get too high, I'll become very thirsty, dizzy, confused, disoriented and just very out of it. I took more cannabis than usual last night, intentionally going over my normal dose/tolerance, but I remained just as unhappy. I was having the usual short term memory issues, but I was still fully aware of my situation and able to feel every ounce of pain. So I panicked again because I realized there's no escape. Even when I'm trying to distract myself, I'm still in just as much pain. No rest from the pain. It's torture.

I wish I could just either have brain surgery to remove all the parts that are making me feel this way, be put in a coma for a while or just be in a heavily sedated state for an indefinite time. I previously decided against ECT but I'm close to requesting it now because shocking it out of my system even if it messes me up forever, is better than dealing with this mess. It's so horrible",The_Dateless_Wonder,1598ooy
5,"Thank you. It's just so brutal. The emptiness, the hole in my heart, the intrusive thoughts about her with her new partner, and it makes me sick beyond belief to think about her getting married/having kids. In fact, I simply don't want to be alive for it but I can't kill myself so I'm just here hoping I'll die soon. I'm barely eating because I feel nauseous, and I'm nauseous because I'm barely eating (along with the stress and anxiety of course). It's just so tough and I want to just make it stop already",The_Dateless_Wonder,1598ooy
6,"Yeah I've been trying to eat more solid foods. The day after, I had yogurt and a granola bar or something. I do feel hungry but it's that nausea kind of hunger, which makes it hard to get myself to eat. I'm having a more full meal tonight so hopefully that helps",The_Dateless_Wonder,1598ooy
7,"I'm honestly willing to try anything.. I've heard of it before and it's something I was gonna look into. Does the heartbreak still hurt to the point where you're unable to function, or has it become significantly less intense?",The_Dateless_Wonder,1598ooy
8,"I understand you completely. Those thoughts about the person we love doing with other people the things we wanted to do with them are horrible, and can pop up at any time to ruin everything on a moment's notice. Don't try to run away from what you're feeling, just try to manage it.  


I also don't know how to deal with this, but I think it helps to try to see the person for what she is, remember their flaws and all that, and try not to give in to the thought of her being perfect. It is also important to reming yourself that you will stop loving her eventualy and fall in love with someone else. I know this is about feelings and not reason, but trying to consciously rationalize things can help a little. Remember that your thoughts are not always right and what you feel right now may not be the (whole) truth, and surely not the (whole) truth forever.",InSearchOfMeaning99,1598ooy
9,"Glad to hear from you today! Sorry about that nausea feeling. I hate feeling queasy. But you’re making progress, one foot in front of the other. How’s your sleep been?",osndupu,1598ooy
10,It is not gone by any means but it is much more manageable.   I feel like I can process emotions with the same regulation as someone who does not have BPD.  I could not do that before..not even close,ThatQuickChick,1598ooy
11,"That's a good point. At the moment I definitely feel like she was a perfect angel with zero flaws and it's hard to convince myself otherwise. It's so tough at the moment, and I don't feel like it's gonna get much better anytime soon tbh",The_Dateless_Wonder,1598ooy
12,"Yeah for sure! My sleep has been...odd, that's for sure. Lol. I've been trying to keep myself asleep as much as possible. Once I wake up I'll automatically go for some meds to keep me tired so I can be asleep as much as possible",The_Dateless_Wonder,1598ooy
13,"It's definitely worth a try then tbh, I've been doing cbt, I'm going through another course of DBT and trying so hard. I hope I finally find the right treatment",The_Dateless_Wonder,1598ooy
14,"Yeah. I feel the same. It's getting worse every day, and I feel it's gonna continue to get worse for a while.

My therapist says to get in touch with those feelings. To validade that I have the right to feel like this and that it's natural. Because it is, it's horrible to go through this. Even people who don't have BPD have a hard time with this, for us it's just so much worse... I wish I could help more. But I'm here, going through the same. You are not alone.",InSearchOfMeaning99,1598ooy
15,"Yeah, it seems impossible. Some thoughts make me wanna throw up. I've already canceled a dental appointment because I just can't bring myself to drag myself out of bed and leave the house; it's too hard and I'm physically a little weak from not eating normally for the first few days (even now, but getting better). Waking up is the worst because it all hits me at once. The most disturbing part of this is there's nothing that can be done about it. For physical pain you take pain meds, for emotional pain there's really no equivalent. I've been getting extra high lately but even when I'm super out of it I'm still able to feel every last ounce of emotional agony and there's no rest, not even when I sleep. I'm so exhausted. I'm still hoping for something like broken heart syndrome to come and take me, but unfortunately that's probably not happening",The_Dateless_Wonder,1598ooy
16,"Yeah. Over the past week I've told my heart do many times: ""you keep aching, you keep pounding, just have a fucking heart attack and get it over with"".

I wish I could be more help, but today is being *one of those days*. But you should definitely feel you are not alone. I'm in the same place as you.",InSearchOfMeaning99,1598ooy
17,Thank you so much. It's been brutal and quite honestly I've been keeping myself high because I can't go back to the nightmare of reality,The_Dateless_Wonder,1598ooy
18,"I totally understand. It might not be great long term, but sometimes we just gotta have relief to get through the day",InSearchOfMeaning99,1598ooy
0,London as in uk London? (ABSOLUTELY apply for benefits and personal independence payment as well as the prescription help),Clementinesunshine_,q0pyrs
1,"Yes!! I'll edit, I forgot London is also in Canada lol. 

I've rang disability and they're sending out the form, which is gonna take 1-2 weeks (even when I asked them to email it to me instead) and then there's 2 steps involved in that too, which can take 6-8 weeks each. Like I said above, I find filling out forms and stuff like that really difficult. I had to get my social worker to help me fill it out back home in Ireland, but nobody seems to help with that kind of stuff here.

Can I ask what you mean by prescription help?",showmethemandy,q0pyrs
0,Those are also mood stabilizers so I understand your Drs pov,malloco,157piox
0,"If you're noticing your breathing, it's probably helpful to focus and intentionally breathe slowly.  As in count and stare at an image/clock.

There's a middle point between complete avoidance (also not good), and adding more fuel (and you know how that is). 

Radical acceptance could work.

""Yes I am angry/upset/triggered. I am. It's uncomfortable. I don't like it. Okay. That's where I am.""

But, don't add backstory, as in don't start listing everything that's gone wrong before. If a friend is running late/cancels, don't start listing every time anyone has done that, not even every time that friend has done that. That's fuel. It isn't helpful (when you're calm maybe you want to look at patterns, but not when you're upset). 

I find it helps to do my self-talk out loud, because that means I have to form words and hear them outside. My thoughts run off too fast.

Breathing is a really good thing to focus on.

I also like crosswords when I'm obsessing and can't sleep.

All the best.",Lore-key-reinard,148sgte
1,Shower or exercise. Sleep if necessary. Sometimes driving somewhere (close at low speed—we don’t want any accidents) and screaming my head off helps.,,148sgte
0,"Haha, I'm very careful with the L word, cause a lot of times it really isn't love. It's unhealthy emotional attachment wrapped in a burrito of codependency.

Not tips for managing it, but it's a vibe.",,17quwte
1,"Ok, that sounds really unsexy 🫣 no wonder then",Plus-Platform6597,17quwte
2,"Haha, I dun think BPD is supposed to be sexy, or seem sexy. I kid. Try and work on yourself, hobbies, and expand your social supports so you're not too reliant on one person. I know that's way easier said than done.",,17quwte
3,Yes I try..lately I am still lonely a lot. I still am messed up from toxic relations. The really bad kind.,Plus-Platform6597,17quwte
4,"Me too fam, me too fam. Social supports collapsing  over here and I'm getting isolated.",,17quwte
5,I'm sorry!!!!,Plus-Platform6597,17quwte
0,"Honestly i think thats this sub in general, people who want to take responsibility, want to work on themselves, care about what they are doing ect i haven't noticed it on many posts here myself but i don't check too often

&#x200B;

You should check out the other bpd sub, it's the complete opposite to here where everyone echoes bad behaviour and a poor me attitude. It's a split between people who want to improve and want a good name for the disorder and see others do well and the other sub where everyone thinks they are the center. Not 100% true there is user overlap and people from both sides in both but yeah",Aqacia,1ai4swk
1,"Usually most people who interject something along those lines are willing to have a conversation with the person to iron out the small details. Anyone worth their salt in helping guide people through this won't pass any judgement. There are certainly some who unfortunately do though, and that shouldn't happen.

We should be able to vent to each other, but to be honest a community where that's all we do sounds entirely unappealing and emotionally draining. Asking each other about management is how we hold one another accountable, and can share techniques that work for us.

We can validate how hard this is all day long, but without being willing to be asked hard questions about how you're managing your BPD and holding yourself accountable... This sub would devolve into something not pretty, in my opinion.

Like this conversation for example, you have an opinion, I have a different one. No problem, we're gonna have different opinions on content we want to see here. I will say there are plenty of other BPD forums, even /r/s, where you'll get straight up banned for holding people accountable. I've been straight accused of not having BPD for it in those forums as well. I was extremely happy to find this place. It's a good mix of people who are in the throughs of this, and people who have had the support to navigate through it to a healthy place.",Skullyy,1ai4swk
2,"I used to get that from my sister and my Mum until they learn about my illness. To my Mum’s credit, she went and bought books and educated herself. 

They would be so offended. I have cousins and Aunts & Uncles that will never speak to me again. They have no clue how different I am in 2024 than I was 2017. My family wanted apologies. Ok, but if you demand an apology and Is say, “sorry”, you got me to say a word. You could have asked me to say butter. It’s meaningless. I would tell my Mum and sister that I understood why they would be upset. Be mad at bipolar, not me. I didn’t ask for this. 

I’ve found my perfect combo of meds. I would say I been in remission for at least a year. Meds, DBT therapy. I’m surprised I see no one else posting about this. It is radically life changing therapy. 

So, I can take responsibility for my actions. My Mum & sister now understand if I’m manic. They guide me thru it. They ask questions, did you pay yours before you bought clothes and they would help me sorted money and manic purchases. 

I can tell when mania is coming on. I can catch it and with a lot of self talk, keep myself from Amazon. I still might be up all night deciding what my favourite lipstick is, but that is harmless. You have to ride the wave.",AdGold654,1ai4swk
3,We have to give ourselves grace ♥️,East-Bee-43,1ai4swk
4,"I actually really agree with this. It’s super annoying cause while I know I take things too personally, if I complain about something then someone just commenting saying “Hey! This isn’t an excuse to act out” when I’ve given no indication that I will or that I want to feels a bit shit. Like, when did I ever say I was going to do that? 

But at the end of the day, these people mean well and probably just think they’re doing a good thing to serve these reminders, so I try not to take it personally and appreciate the fact that some people may actually need these reminders. Plus they’ve taken the time to read my post and comment their thoughts so from strangers on Reddit, that’s maybe really all I can ask for",badsbee,1ai4swk
5,"100% 

I like to vent and these are always responses I get. Likke bish...I am aware. Awareness comes with the diagnosis.

I post here cuz these are problems no one else really gets an some comments make me feel less alone.",Sifdidntdeservethat,1ai4swk
6,"Agreed, I notice this on  r/BPDmemes so many ppl there are like ""I am like bad bitch"" ""IDC"" attitude, opposite to this sub",Samyueru17,1ai4swk
7,Can I ask what medicine works for you?,Alternative_Remote_7,1ai4swk
8,"Yea, that sub can be a bit of a mess sometimes. I’ve been showing symptoms since 12 but got unofficially diagnosed at 17 and officially diagnosed at 27. A lot of the things I see on there remind me of stuff I would have said as a teenager with BPD. I get that they’re expressing themselves and making light of their disorder but sometimes it’s a bit upsetting because they just add to the stigma.",yogi_medic_momma,1ai4swk
9,Can't stand that one either!,Aqacia,1ai4swk
10,"I totally get that, the one that stuck to my mind was a time someone wrote essentially that they have bpd and that it's their partners responsibility to be okay with the fact they will cheat on them cause they have bpd... I was shocked how many agreed with it too. Totally get people are at various stages of treatment but I totally get the getting upset cause it adds to the stigma",Aqacia,1ai4swk
11,Yes! I cannot believe how many of us on this sub defend people that cheat. I’ve lived with BPD almost my whole life and I have never had a thought in my head to cheat on someone. I get that we “act impulsively” but we can still have morals and respect for other people too.,yogi_medic_momma,1ai4swk
12,"In defence of them, I think most of them are ironical, they do it BCS it's kinda funny in its tragedy, most of them wouldn't even try to justify cheating, maybe drug abuse or trying to kill their ""ex"" or hating opposite gender. I think we should give them benefit of the doubt… most of them don't really mean it, but that's most of them, they are really ppl who does this",Samyueru17,1ai4swk
0,"Have you ever done a test like GeneSight? It's a test that will help providers figure out what medicines have higher chances based on genetic feedback. Perhaps ask your psychiatrist about it and get their opinion. And if it is possible and you're in a country like the US where insurance is at play, be sure to look at your coverage",princefruit,1cv0lho
0,"Read this

https://www.talkspace.com/mental-health/conditions/articles/bpd-favorite-person/#:~:text=People%20with%20BPD%20feel%20firmly,them%20to%20always%20be%20available.",DayAdmirable1436,17qv138
0,"I’m in the UK and I have similar experiences to yours, the NHS don’t really cater for the mentally ill people. To answer your question, yes, DBT is available on the NHS, however whether or not you can access it depends on your location. I know this service is available in Oxfordshire, but only during work hours, and the wait time was around 6 months to get in. Don’t know if you work or study, for me, skipping work 2 days a week for months wasn’t an option. If you have a good GP, it’s worth discussing whether DBT is offered where you live. Also, Google the available therapies in your area, as often GPs and even psychiatrists are unaware of where patients can be referred. I know it sounds mental but that’s exactly what happened to me.",poszorlegy,14om74s
1,"In my experience getting diagnosed did not lead to me getting any nhs treatment other than meds and now when healthcare professionals read my notes they start treating me like shit. So not beneficial at all, actively damaging. Oh and when I was pregnant they reported me to social services because of the diagnosis. I lost the baby but if I hadn't then I would have been under supervision purely because of bpd. I've been under 4 different community mental health teams now due to moving miles away every time I had a total breakdown and they've all been as useless and dismissive as the last. Attempting suicide also didn't get me any treatment, just a 10 day section in a general hospital before they threw my homeless ass out on the street, with me telling them I was going to finish the job.",,14om74s
2,"I’m in the UK too and honestly, the last five years have been awful in terms of receiving mental health treatment. I hit crisis point about 18 months ago, I was hallucinating, not sleeping, not eating, extremely agitated and angry and stupidly suicidal. I told the well-being text line that I wanted to play in traffic and they sent the police to my house, who for the first time in my life, were actually amazing with me. I received 6 weeks of intensive crisis assistance where someone came to visit me in my home 4 times a week, and then it just stopped. I don’t qualify for the counselling service because apparently my needs are far too complex for what they can offer (I have comorbid bipolar and cpstd, so totally a shit show) my local womens centre won’t work with personality disorders, and my psychiatrist is useless. I would avoid receiving a bpd/eupd diagnosis like the plague.",jaycakes30,14om74s
3,"I'm in the uk and while getting diagnosed for anything took a long time and was difficult, then getting the help i needed cause i moved out the original area and they are pretty hopeless and fucked up my notes. Eventually i did get put into therapy after talking therapies argued with community team to find my info, which they did 5 months later. I'm in invention dbt, got group dbt offered and about to start it, CAT therapy after. So yes you can get treatment and it's offered, but it is hard to get there and i'm not sure how area dependant it might be",Aqacia,14om74s
4,I'm not sure how many of the NHS services offer it but I've recently started treatment for BPD with complex needs and they offer MBT therapy in my borough - 1 group and 1 individual therapy a week. I was referred by my GP though I'd been with complex needs years ago (I discharged myself) so don't know if that helped things?,hyrulenh,14om74s
5,I’m in the UK and was diagnosed years ago. I finally tried to get a referral to what they call the “Personality clinic” but was told I’d need to be in and out of hospital to fit criteria. Just struggling on now xx,lovegeorgiax,14om74s
6,"I remember the Mind charity from the UK.

Maybe they can put you in touch with support groups, suggest reading / online stuff, etc.?",Low-Education9369,14om74s
7,"Can I ask if you were able to access dbt or any nhs help without doing the complex needs service? It’s also not an option for me but when I was given the referral it was implied that it was the only option available (also impossible as I work, etc!). Very frustrating…",everandevermore90,14om74s
8,"I’m so sorry you’ve had an awful experience with social services too. They can be the worst, especially if they aren’t well informed.",jaycakes30,14om74s
9,"No, I would have had to go through the complex needs service. Agree, it’s extremely frustrating how many hoops psychiatry patients have to jump to get healthcare. 😢",poszorlegy,14om74s
10,"Yeah, it was brief because of what happened but I think I'd probably have been dealing with them for a while! Friends have had issues with them too but different reasons.",,14om74s
11,"I’m still too traumatised to go into details about my dealings with social services, but they destroyed me as a person.",jaycakes30,14om74s
12,I'm so sorry :( I hope you are able to heal from it. It's shit there isn't more help as well.,,14om74s
13,"I’m getting there, and things are better than when they were involved. I was young, vulnerable and a mess and I truly believe they preyed upon me, instead of supporting me. The label of bpd has caused me so much shit over the years",jaycakes30,14om74s
14,"I feel the same, I really wish I hadn't been diagnosed. I'm not even sure I agree with the diagnosis either really, I think it's a label they give to traumatised women they find difficult to deal with. It's amazing how much more stable I am now that life has stopped throwing more trauma at me all the time!",,14om74s
15,"I feel exactly the same. As it stands now, I don’t meet the dsm criteria for bpd, but my other diagnoses get ignored. It’s hella frustrating.",jaycakes30,14om74s
16,Same! And the physical ones too. I've 3 different chronic physical conditions which I get no treatment for 🙄 I get so sick of people saying the nhs is great. From where I'm standing it's totally useless.,,14om74s
