,Comment,Author,Post
19,"that is the full story, yes. my mom asked me if there’s any possibility you could be lying about the BPD just to have a reason for the way he was behaving. and i said i doubt it. seems like a hard thing to fake. and why would someone?",sbrant1994,ehaqy9
20,"If someone is already yelling at me - even just raising his/her voice - it is easy for me to get triggered and go off the deep end a little in the argument. It takes me back to childhood when my (strict, bad-tempered) dad would yell at me. But, I have to be triggered to do that. Otherwise, I'm fairly mild-mannered.",,ehaqy9
21,What type are good?,KrazyKatz3,ehaqy9
22,he says mood stabilizers have never helped him. which leads me to believe he hasn’t actually tried them or hasn’t tried hard enough.,sbrant1994,ehaqy9
23,he is waiting for his work health insurance to kick in. he said he use to do DBT therapy and it was the only thing that helped him. i guess he’s going to be doing that again when the new insurance kicks in.,sbrant1994,ehaqy9
24,"Have you been able to rekindle the relationships now that your mental health is better ? My ex is horrifically abusive and extreme bpd (diagnosed) and I do hope that one day, even if years later, we can have a normal polite relationship for the sake of our daughter but I worry it will never happen as he has made up a completely fake reality that paints me as an abuser (as in literally made up things that never happened). Can you talk a bit about whether you managed to heal those relationships (of those that mattered at all- i assume at some point he will want a relationship with his kid but maybe not...up until now, he’s only used her to play victim and has shown absolutely no real desire to see her).",paintingsandfriends,ehaqy9
25,Thank you so much!,SackOfHellNo,ehaqy9
26,Everyone has a past. You don’t have to be ashamed of yourself. But if he cannot control his reactions and they’re scary then keep the topics to ones you both can enjoy and discuss the big stuff with couples counseling. But he should be getting back to the workbook to revisit his skills beforehand so he has a better handle on himself.,misteraskwhy,ehaqy9
27,I would strongly recommend that you leave the relationship if you are feeling scared. Being fearful in a relationship is always an indicator that you need to leave. If you are already worried about your safety I wouldn't wait for the second time.,,ehaqy9
28,[deleted],,ehaqy9
29,To lighten the mood here.. If it wasn't BPD what else could it honestly be 😂,,ehaqy9
30,It’s different for everyone but I’m on lithium and lamictal and they’ve made a world of difference for me.,PopPop-Captain,ehaqy9
31,"He could have a really high tolerance for them, but there's many kinds and medications that can be used in conjunction to get the desired effect. 

I had genetic testing done to figure out why most antidepressants don't work for me. Some drugs I burn through too quickly, others aren't effective in ""lower"" safe doses, so they're out. It's possible that he has that problem - BUT you have to have a great psychiatrist and insurance, or have tried every single drug without success to get the test done... 

His reaction is not ok. You do not have to go back to him and live in fear of it happening again. If you having an ex was enough to set him off, what little thing could cause the next episode? 
I'm all for being supportive and trying to make things work, but I don't think this is the time for that. He needs help but you also need to take care of you and your own struggles, putting his needs above yours will end up hurting you both. It might be best to walk away.",flooffypanda,ehaqy9
32,"Get him the DBT workbook, if the insurance is the waiting list then the book will help in the interim


The Dialectical Behavior Therapy Skills Workbook: Practical DBT Exercises for Learning Mindfulness, Interpersonal Effectiveness, Emotion Regulation, and Distress Tolerance
Book by Jeffrey Brantley, Jeffrey C. Wood, and Matthew McKay",misteraskwhy,ehaqy9
33,"If you going to be a support, get stop walking on eggshells for yourself.


Stop Walking on Eggshells
Book by Paul T. Mason and Randi Kreger",misteraskwhy,ehaqy9
34,"Comparing your experience to someone else is a slippery slope. I’m betting you know that too. 

Let’s try and keep the messages supportive. 

You say you wouldn’t put up with it. but it’s not about you. Is it? To each their own. 
No one here is saying that she has to put up with the words. Or to back down from them. But if she is genuinely fearful she shouldn’t be in the relationship.  If she is trying to understand him, be prepared to be a supportive person if not, leave. You’re vision on her own side should be left to you. She seems like a solid head. She’s asking for informational support from those that have the ailment or experience of it. 

And as a whole you can agree in this post we are saying respect of self is of the utmost importance. He has that problem. She might be willing to give him that respect for himself.

You don’t know. You are not them or him or her. Everyone is different.  But how low was your low? People can learn to deal with it by themselves if they have to (sometimes not.) But it’s easier with a partner. Even if they’re ailing themselves. We all enjoy the support.

But even when if enough is enough, support from afar is still support. no contact is still support. But everyone has their own limitations to each other’s pain. Everyone is different.",misteraskwhy,ehaqy9
35,Thank you! I tried lamictal but it just did the opposite of helping. I'll have to try some others.,KrazyKatz3,ehaqy9
36,i’m on lamictal for bipolar disorder and it changed my life for the better!,sbrant1994,ehaqy9
37,"Same here, I’m so much better than I was.",,ehaqy9
38,Calling someone a whore is emotional abuse. I'm not comparing myself to anyone.,,ehaqy9
0,"Are they in any kind of treatment at all? Even if their toxic behaviour stems from a mental health issue, it's still their responsibility to ensure it has a limited impact on their loved ones. Making you suffer because they're suffering just isn't healthy in the long run, so I don't think you should endure this relationship unless they're willing to put in some work.",N0bother,169qxu2
1,"Yes they are in therapy, taking medicine, apart of multiple groups to discuss their issues. It feels like they’ve put in all the work there is to possibly do but to no avail.",autisticsalazar,169qxu2
2,"I'm really sorry to hear that. Must be hard for you both. I assume they've tried different meds and all? Getting the right treatment can be so hard sometimes. Still, it shouldn't affect you as much as it does. It's a shame they're unable a to direct their frustration in a healthier manner. Idk if couples therapy would be an option for you?",N0bother,169qxu2
3,It is extremely hard. They’ve tried so many things and I feel like I need to give six different pep talks everytime we try something new. It’s like I wish there was anything I could do to help them but they keep lashing out and I hate it because I love them and I hate that it’s come to this,autisticsalazar,169qxu2
4,I feel you. I have a sibling who's struggling a lot and it's tough as heck being the main support. I wish I had the answer/resources to fix it in no time. I just hope you find the best way forward and get all the support you need. <3,N0bother,169qxu2
0,"For me, the desire to self harm comes from both a need to physically bleed the emotions out, the need to feel something other than what I am, and a need to feel in control of something - even if that something is the pain I am causing myself.

Try holding a cube of ice in your hand if that feeling comes back. It hurts like hell, but is much, much less likely to cause harm than cutting/burning/etc.",FiannaBurning,147udjd
0,Same. Especially the tired. I'm always so tired I have a hard time just getting enough energy to clean the house or play with my kids and I hate it. I want to figure out how to not always be so tired all the time. So I can actually enjoy playing with my kids,Fat_Princess21,u52spp
1,"I'm the same way. I am off all meds for 1.5 years now. 

I just feel like I am generally devaluing everything right now. A lot of dreams and hopes I had were not really consistent with reality, and I think coming to that understanding has put me in a low level state of grief with almost everything. I am also very risk adverse right now, which also doesn't help.",AnjelGrace,u52spp
2,"Finding motivation can be difficult and imo boredom effects my depression more than emotional stimuli, but that's me and we're all different. I always try to fill my empty time with books and/ or video games and other forms of stimulating entertainment",CmdrFilthymick,u52spp
3,"I'm similar. I absolutely can't keep my apartment tidy and have a hard time doing anything really that I'm not required to do. Like today I'd like to go outside if sth but it's hard to find the energy/motivation. Idk if it's depression or sth else but it's been pretty debilitating, especially in the past few months.",PoolBubbly9271,u52spp
4,"I'm still trying to figure this out. I was diagonised with ADHD-Innatentive (old school ADD). Adderall helps, but its not what I used to be for motivation.

Let me know if you figure this out",No-Town-7612,u52spp
5,[deleted],,u52spp
6,I’ve always considered boredom to be a trigger of mine.,Separate-Goat1489,u52spp
7,I completely understand how you feel ❤️,Spiritual-Bell-4170,u52spp
8,I will ❤️,Spiritual-Bell-4170,u52spp
9,Agreed if you find a way to change that you should let me know,Fat_Princess21,u52spp
10,🖤🖤🖤,No-Town-7612,u52spp
11,[deleted],,u52spp
12,"Same I so look forward to sleep but then (surprise, surprise) I can’t sleep and when I do I cant stay asleep. I’m deeply tired, of everything",Spiritual-Bell-4170,u52spp
13,I feel the same way with my kids. I wish I could be a better mom for them,Fat_Princess21,u52spp
0,"Works for some people, didn't work for me though.",,mpoi0i
1,"I did Paxil from 1997 to 2001. It was (much) worse than a waste of time. It may work for some people, but after taking a year of psychopharmacology, I cannot honestly understand why any of the first generation SSRIs were Rx'd for the purpose you have described. And still have some difficulty with second-gen SSRIs for *anyone* with OCD or OC*P*D, though Celexa evidently does show some efficacy for that in some pts. 

Seroquel -- which is fairly much a diametric opposite of an SSRI -- works for me with respect to OT during twilight sleep. And the [10 StEPs](http://pairadocks.blogspot.com/2015/04/the-10-steps-of-emotion-processing.html) component of 
[Choiceless Awareness for Emotion Processing](https://pairadocks.blogspot.com/2019/07/choiceless-awareness-for-emotion.html) gets the job done when I am fully awake. (Without any side effects, too. Nice.)",not-moses,mpoi0i
0,Yeah I think so its called mirroring but im not 100% sure hope someone else can clear it up. Idk if mirroring fits but sounds close which is like you mirroring their personality so they like u,Even-Acanthaceae-910,t90dap
1,"Yep I do this with everyone I know, I have no idea what my actual personality is or what I actually like or hate. This is a big part of bpd actually.",YeIFeelLikeFishNarc,t90dap
0,"Abilify made me more angry, I’ve taken around 25 medications across all classes. The only thing that’s really helped my irritability is my stimulant, concerta, but I also have ADHD with BPD- I’ve taken 8 antipsychotics and I felt worse on all of them",,xprg55
1,"I could snap in a split second most of the month, I find my ADHD meds(Vyvanse) make it worst if anything… I am desperate for help with irritability, I am also on Effexor and Topiramax for Migraines 🥴",clithigh,xprg55
2,Abilify genuinely saved my life with bpd,Babycherrix,xprg55
3,"Antipsychotics make my mood flat and emotionless and make me extremely tired. I don’t want to do anything either. I have been on ALOT of medications but antipsychotics by far were the worst for me. Abilify made me gain alot of weight, 50 lbs to be exact. I have ADHD, GAD, and depression in addition to BPD. I have reacted the best to a low dose of Gabapentin, Adderall, and Prozac. I will never take antipsychotics again. Gabapentin is also used as a mood stabilizer.",,xprg55
4,"Yup, that's something I forgot to mention in my post: the weight gain aspect. I've been trying to lose weight and it would **devastate** me to gain weight, especially a large amount. I'd completely give up and never try again, because honestly I see the world in black and white so much that if I fuck something up I'll just be like ""cool fuck this I'm useless.""

I have multiple mental illnesses on top of BPD so it's hard having to be on so many meds for different things. I've tried Prozac but it caused extreme increases in anxiety and panic attacks multiple times a day, it was a miserable time. My mental illnesses have all been labeled ""treatment resistant"" and I don't really even know what that means, if any meds would actually help long term or if it's a nicer way for professionals to tell me ""lol you're fucked, you're gonna be miserable all your life so good luck with that"" in which case I'm not even sure why they're bothering with meds if they know nothing will help.

I've heard that antipsychotics are risky. Tbh I would love a medication to numb me completely or at least blunt my emotions, I'd do anything to get rid of my emotions even if that means sacrificing the positive ones, if that makes any sense. So the side effect of it making people emotionless is rather appealing to me, though the other side effects definitely aren't. I've heard of permanent side effects that I don't want. I've considered ECT, TMS, etc but it's hard thinking that there's no way to know whether it's gonna be the best or worst decision. Same with antipsychotics. Idk what to do honestly. I'm on medical marijuana so I am really hoping it works when I find the correct dosage for me",theirishsquirrel,xprg55
5,"You will only know if you try it. If you don’t like the side effects you can always stop it. I see the world in black and white too so I completely understand what you mean. What you said about your emotions makes complete sense. I wish that I could turn mine off all the time. When I said that antipsychotics make me emotionless, I meant more like a zombie. I don’t like feeling like that at all. I can completely relate to everything you said. All you can do is give it a try.",,xprg55
6,"I take 15 mg of Abilify, though for schizophrenia. It completely shut off my appetite. Take today for example: I worked out in the gym and still have nothing to eat and I’m going to bed soon. So there are also people like me who get decreased appetite from Abilify.",,xprg55
0,"I(F,22) didn't start feeling comfortable with my BPD until I took medication for it (lexapro, lamictal). I've been on both medications for 2 months now and feel great, I've been seeing a counselor since I was 16. For me counseling could help me move past fears and and process emotions, but I always have felt this physical pain or anxiety that did not go away until I took medication. Mental health disorders are due to a chemical imbalance in the brain, there are only so many skills to learn emotional regulation. I needed some more help!!",Intelligent_Car6999,k8rjdq
1,Lamictal. Latuda,She_is-borderline,k8rjdq
2,"I am F,16 right now, and started therapy this year. But how come it took so long for you to get medication despite having a counselor since 16?",Joe_Goldbergnyc,k8rjdq
3,"I think they were hesitant to diagnose me, also I never saw a psychiatrist until recently. I think that makes a real difference because they're education is specifically about medication.",Intelligent_Car6999,k8rjdq
0,"Even if you don't have specifically BPD it's really beneficial to learn all the skills that we use to manage ourselves. 

If you are struggling that hard to have feelings you may be experiencing dissociation. It might be the meds that are putting you off balance or it might be your mind protecting you from your emotions and cutting you off. When I'm dissociated it really helps to put my feet in water and do a mental checklist of past events and present surroundings",_-whisper-_,1661l07
1,"i was thinking maybe it is the medicine and i’m struggling with emotion because the only reason i’m feeling it is because of that. thank you for taking the time to comment on this, im going to continue to try and learn ways to deal with this.",catloverr3,1661l07
0,"I was initially diagnosed in UAE. I remember going to just one session and discontinuing because of how expensive one session was. Getting in touch with people who are also struggling with these (like this community for example) has been really helping me. Because almost everyone can relate some way it another.

You've got this.
 
Build healthy ways for yourself to cope up - Ive been taking up making food in the middle of the night (as an alternative to a self destructive coping mechanism)

Sending you love and comfort",PersimmonBeginning48,194d4b5
1,[deleted],,194d4b5
2,"Well I wish it for you if you dream of it, but I hope you are well prepared before you do move 

🙏🏼 thank you",Overall-Sandwich4697,194d4b5
0,"Did you see there was a busy discussion about it yesterday? 

[https://www.reddit.com/r/BorderlinePDisorder/comments/s1uaas/lamictal/?utm\_source=share&utm\_medium=web2x&context=3](https://www.reddit.com/r/BorderlinePDisorder/comments/s1uaas/lamictal/?utm_source=share&utm_medium=web2x&context=3)

Anti depressants often aren't so effective for people with BPD, but are usually considered safe to try; and I've heard the same, that Lamictal has some results for some people with BPD. Unfortunately no meds have a huge amount of research behind them specific to BPD.",TranZeitgeist,s24f1o
0,Remember you are not alone either!,tryinghard2live,v9ghoo
0,"Same thing happened to me! I was diagnosed bipolar three years ago. But I never had manic phases and didn’t feel like it really fit. Today, my psychiatrist agreed I didn’t have bipolar but does think I have borderline",,bji7g4
1,"See I felt like I did feel bipolar because I have manic behaviors, but looking back at it, they're usually in a shorter timeframe rather than getting stuck in it for weeks.",inkedandnerdy,bji7g4
2,My psychiatrist acted like having it for four days was all it took to qualify. I wish they could all be on the same page!,,bji7g4
0,"Out of curiosity are you on the spectrum as people like to say these days?  Those routines can be a huge part of every day life and falling out of them can be a tough thing to adjust to on the fly.  To be fair theres nothing wrong with relishing a routine every day.  But if you find that when you're unable to stick to a routine it throws off your entire day, there are some skills and things you can do to help make those routine breakers less of an issue for you.",ForgettableFacePlant,13k82iw
1,I find it very very hard to have a routine so if had one and got thrown off it I just know it would make me very upset,throwaway_2mrwishell,13k82iw
2,Or if things don't go according to plan yes. Me all day,applefilla,13k82iw
3,"I haven't been diagnosed as being on the spectrum. But, it's possible. I'm a big list maker. I'll ask my ex-clinician. I've started going to a group she has for anxiety and depression to see if I can work up my tolerance (?) to groups of people. Right now, a group of 10 is about all I can handle without feeling overwhelmed.",desertrosebhc,13k82iw
4,"If you currently have a therapist or some sort of mental health professional you see it wouldn’t hurt to ask.  A lot of what you’re saying rings pretty true with things my autistic pals often talk about.  I mean it sounds kinda like woah, but really, I’d look at it as hey, is there something I can be doing that would make my day to day life easier to manage and enjoy?",ForgettableFacePlant,13k82iw
0,Hang in there. It could get better but not if you end things before you can get there.,bitterhello,gzbe2x
1,"My partner is diagnosed and has had a very difficult past, with relationships, drug abuse, friendships, self harm. She has worked very hard on living her best life and has gone through so much and I am very proud and happy for her to come such a long way from where she was. Everything isn't perfect but that's fine, it'snot supposed to be. It isn't hopeless at all, but it is work. Rewarding work. I hope that you feel better.🙂",dystopic_exister,gzbe2x
2,"What hasn't helped in the past? And after such a long time with social thoughts and depression, why haven't things gotten worse than they are? What do you think *would* help?",TranZeitgeist,gzbe2x
3,"I also really hope this is not patronizing, it isn't meant to be. I just want you to feel hopeful.",dystopic_exister,gzbe2x
4,"Things have and are progressively getting worse. I've been hospitalized and that didn't really help honestly. Therapy isn't seeking to help at all or my medicine. I don't know what will help, I don't really think anything will. I feel like I'm going to be like this until I die. P",Emoly246,gzbe2x
5,">I feel like I'm going to be like this until I die

I'm sorry you're feeling that way :/ tbh sometimes it's hard to hold onto hope with mental illness, especially when you've been working on it for a while. I get that feeling too.",TranZeitgeist,gzbe2x
0,"I think the fact that you exhaust other options and are cautious of the amount you do smoke is important. That right there shows strength and non-abuse (idk if there is a proper term?). 

I’m not a regular user, but I have wondered this too. It helps me sleep more than various medications I’ve tried, and seems to help more than anti-depressants (although I do like my mood stabilizer).

Edit: I’m 30F",,wjgswd
1,"I was dependant on it for 10 years, I stopped cold turkey April 26th and don’t regret it. 
I will smoke it recreationally but I will never smoke every day, ever again. 
Food tastes so much better, I’m sleeping better… my moods do not seem any different. 
Recently my husband lied straight to my face and I didn’t feel the need to smoke. 
I have replaced it with running, healthy eating and just generally taking care of my mind and body in positive ways. 
I love weed, but my anxiety was out of control & my therapist thought that stopping would help… so far I believe he was 100% right. Anxiety does seem to be easier to manage.",mikki-95,wjgswd
2,"I’m on 3 meds and smoke constantly. Ik the withdrawal from quitting cold turkey for even 2-3 days can make me flip shit. But I live as a complete dependent, no job/car, no money making hobbies, etc. weed helps more than anything I wish I didn’t have to do anything for my mental health. Tbh ..",hvstyblogs,wjgswd
3,"weed is the best coping mechanism i have. i cut down A LOT since my boyfriend left me a month ago, just cant afford it but still, even one blunt a day is good enough to regulate me lately. i'm also on medication and have done all of the therapies. weed is still the best treatment for me.",dogtoes101,wjgswd
4,"Actually… that all sounds like a perfectly reasonable use of the stuff. Especially since you are developing coping skills outside of it.

At some point down the line, I would suggest you look into trauma therapies. EMDR is good for specific memories, but CRM is fantastic for when the trauma is more complex than that.",AmazonSk8r,wjgswd
5,"I've been a daily user for 22 years and I probably wouldn't be here today if it weren't for pot. I take thc capsules on mornings that I work because being stoned pushes all the racing and intrusive thoughts to the side so I can actually focus on something. Highly recommended, just look at my screen name!",KronikHaze,wjgswd
6,I was a heavy user for eight years and stopped when entered into rehab. Now I live a sober life and I fully recommend that. It’s just too easy for me to slip into complete dependence with an addictive personality. Its also crazy how defensive some people can get when you point out that smoking 24/7 is a sign of dependence.,Wtfissleet,wjgswd
7,Yeah I would consider it so because it is medicine.,TheMoonGoddess420,wjgswd
8,I was a hardcore stoner for years and I still hit it occasionally.  IMO the main problem with smoking weed all the time is that it can allow you to tolerate situations you should 100% not tolerate (domestic abuse.)  Just try to keep your eyes open.,,wjgswd
9,Two tokes before you shower will make a huge difference in your day.  You don't need to smoke all day.,,wjgswd
10,Cannabis can lead to you getting schizophrenia. No one can say if you will get it or not but it may happen. That’s an almost forgotten possible consequence. I wouldn’t use it too often tho. Just like alcohol,HeftyFig34,wjgswd
11,Thank you!! :) If you don’t mind me asking what mood stabilizer are you on? I’ve been doing some research to see what meds might be a better fit for me,Future-Raspberry-238,wjgswd
12,"Thank you so for sharing this, it gives me hope that over time I can incorporate things like working out and having a healthy diet as a lifestyle. Do you think it helped save you or help harm you to smoke everyday for those 10 years?",Future-Raspberry-238,wjgswd
13,"Hi, I just wanted to thank you for sharing your experience.  My body has given me some big wake-up calls that I'm taking seriously, I don't want to live the rest of my life needing oxygen tubes under my nose so I have cleaned up my eating and slowly increasing my physical strength, endurance, and flexibity.  It is really great to hear this has made a big difference to your mental health.  My black and white thinking likes to kick in and try to discourage me that I will ever get there, it can go jump in a lake! ^_^",,wjgswd
