,Comment,Author,Post
0,Awesome news! I'm excited for you! 😁,Impossible-Spare2180,1c1qdyj
0,"My psychiatrist put me on lamotragine the moment she diagnosed me (I'm now up to 200mg a day). Sometimes, thinking of it all as therapy or work can make it hard to want to do them. Because then it makes it seem exhausting and unachievable, dooming you to fail before you start.

I get it. I wish my meds made everything 100% better, but I also know it's too good to be true. And the most rewarding things tend to take a little effort.

 I've never done or looked into DBT therapy, but I have developed my own methods of coping and thoughts that make it seem less like work and more like self soothing.

Learn to recognize patterns in your behaviors and mood. When you get to the point you're really upset because something someone said to you came off a way that hurt, learn to step back. Don't lash out or let the hurt root. Do things that distract or direct your thoughts. I like to do puzzle apps or matching games. It gives my mind a chance to calm down, while my body is still actively focusing and directing my thoughts. Once I'm calmer, I look what was said and talk to the person involved. Let them know how they said it hurt and why, so there is communication and less hurt or bitterness imposed by a misunderstanding.

I do this too when I'm upset. I tell people I'm talking to I need to practice some emotional management so I don't lash out. That's what I call the calm down technique. Emotional Management. So it sounds not like work, but regaining control. Having something you have power over something. Something no one else can manage or boss about for you. It gives me a Centerpoint. Something that makes me go ""if nothing else, even if things are going to shit, this is something I can control. It's the bull I can grab the horns of and force to be still.""

Thinking of it as a job, a chore, or work can make it harder to want to do things that are good for you're overall health.",Mission-Definition-6,1c6ddm7
1,"Since BPD is a personality disorder, it’s based around a lot of thought and behavior patterns that can’t be fully addressed with medicine. Medicine can help some people with some symptoms, but it does take work to actually recover. You basically have to re-wire parts of your brain and do deep healing. But trust me, the work is WORTH it, even if it doesn’t feel like it all the time especially when you don’t immediately feel results. They say the best things in life don’t come easy… I haven’t experienced anything more rewarding than BPD recovery and self improvement. I’ve been in remission for over 2 years, and I love myself and life more than I ever ever thought possible, even in difficult times. DBT is a great place to start if you have access to it.",SarruhTonin,1c6ddm7
2,">my partner brought it up to me last night that ONLY relying on medicine to be the ""be all end all"" solution is only going to set me up for failure


Everyone plays armchair expert, with BPD being an internet obsession. And everyone also loves to parrot the ""bootstrap"" mentality of ""doing the work"" and personal responsibility. Your boyfriend's quote sounds like (relatively harmless) generic mental health stigma.


In fact ""general psychiatric management"" is a clinically validated way to treat BPD, managing medication with minimal or no talk therapy provided by a psychiatrist. Whether that's appropriate or successful depends on many things, but ideas about medication being not used or not appropriate for bpd are overstated.",TranZeitgeist,1c6ddm7
3,"I use the term “work” for recovery and any area of self improvement/growth/healing, and it doesn’t dissuade me because I LIKE doing the “work” and know that I experience it differently than traditional work, but I always wish I had a better term when talking about it with other people",SarruhTonin,1c6ddm7
4,"I’m not trying to argue your point even though my comment clearly contradicts it, but I’m always looking to expand my understanding, so I would like to better understand your view. As I said in my comment, I do believe it can be helpful as part of treatment for some people, but I’ve never seen anything supporting the idea that BPD can be effectively treated with only medicine. Do you have a source for this? I’d love to read into it further.

I do think that people often misinterpret the idea that there’s no medication specifically approved for BPD to mean that it can’t be helpful in treatment, so I agree with parts of what you’re saying. The idea that it can be the sole treatment is new to me, though.",SarruhTonin,1c6ddm7
5,"I like healing, recovery. I always just call it Emotional Management for myself. Some people find calling it work makes it more daunting. Both sides are valid, and I personally never call it either or, and have to preferences other than the Management.",Mission-Definition-6,1c6ddm7
6,">I’ve never seen anything supporting the idea that BPD can be effectively treated with only medicine. Do you have a source for this? I’d love to read into it further.


Search ""general psychiatric management"" or gpm for bpd, John Gunderson has books and video lectures. If you know the ""what works for treatment of BPD"" research paper I believe it's also included in that.",TranZeitgeist,1c6ddm7
7,"Thank you! I have come across GPM before but didn’t interpret it as supporting medication-only treatment, so I’ll definitely look into it further.",SarruhTonin,1c6ddm7
0,"IMO most meds should be used sparingly to aid emotional growth rather than as a long-term solution (unless a person is at serious risk of harm unmedicated). I've never been medicated so I lack firsthand experience but a lot of my friends expressed feeling as though they were slowly losing their sense of self and capacity for excitement particularly on mood stabilizers. Too many drugs that only cover up the problem rather than striking at the root of the problem. I won't say I've handled BPD sober because I use and abuse to both my benefit and my self-destruction, but most of them only serve to curb my boredom. The only street drugs I ever took with the intention of bettering my mental health were LSD and ketamine. 

&#x200B;

Progress is slow and steady and it comes from working to understand who you really are, how you came to be this person and how to be at peace with it. How to recognize when your thoughts and feelings are irrational and unfounded, what causes them and how to stop them from overwhelming your ability to think critically. It's important to be able to take a step back from what may be a harsh or panicked train of thought and determine if you are really being fair to yourself and to others. Consider the perspectives of others without allowing them to overwhelm your own perspective. 

&#x200B;

Maintaining a healthy balance between your ego and your empathy for others is key. It is good to have self-doubt but self-love and confidence is just as if not more important. Too many people allow their fear to suffocate their hope and it is their belief that they will fail which leads to their failure. Psychedelics can help with that, but there's really no magic pill that can cleanse your personality of insecurity and paranoia and you don't *need* to alter your brain chemistry in order to change the way you think. All that you need is within yourself.",GiveBackTheBoard,1arol2r
1,"I think a lot of this will depend on the individual, any comorbidities, and where their life is at at any given point.  


There are people who do recovery without any medication, or people who may be prescribed meds to take the edge off long enough for them to do more therapy and get the coping skills to cope with their symptoms. In the latter case, people can work with their providers and safely taper off meds. If someone is more comfortable with this option, and they are able to function without meds, they should absolutely feel free to make that choice!  


That isn't the case for everyone though. I have a love/hate relationship with my meds and would love to live in a world where I could get off them, *but* I have other mental illnesses, so every time I go off my meds, my mental health gets worse, and this last time I ended up hospitalized. For someone like me, part of recovery is accepting that, at least for the foreseeable future, medication is necessary. But for me, meds didn't really help with BPD symptoms; they just take down the ""noise"" from my other stuff enough that I'm safe and functioning to do the other necessary work.   


So I guess that conversation is one that's best had with your provider. You could talk through how you're feeling, express an interest in maybe trying your options, and see where the conversation goes. Just find the balance between hearing your provider's perspective and being your own advocate if they don't leave *any* room for you to have a say in your own treatment.",torgoboi,1arol2r
0,What country are you in? I get mexs for bpd and I'm in Scotland,,sr19ye
1,"I’m so sorry baby…. Sending you love, stranger…. My heart feels for yours.",97cherry,sr19ye
2,"Wtf. That's awful.
My only advice to you, is that these people are the fucked up one's not you. Don't let them kill you, you are strong. You can get through this. Keep hounding as many people as you can, someone's gotta give in at some point. 
This makes me so mad for you, my anti phycotics are a huge part of my stability.",6995luv,sr19ye
3,"I’ve been told by my therapist and psychiatrist that BPD is treated with therapy not medicine. It’s a personality disorder it’s not really a chemical imbalance that can be treated with medicine.

I also have bipolar and so I will soon be put on mood stabilizers to treat that, but not the BPD.

Medicine like SSRI’s and mood stabilizers can treat general depression and anxiety which are symptoms of BPD but it doesn’t necessarily treat borderline itself so that’s likely why they won’t prescribe it. 

I’m sorry you’re struggling. Medicine definitely can ease certain symptoms. It may be helpful to get diagnosed with MDD and/or anxiety as that could lead to being prescribed meds.",Successful_Map4660,sr19ye
4,"What about general anxiety disorder? Before I knew I had quiet BPD I was on lexipro and Zoloft for depression and anxiety (not at the same time) and they really helped stabilize me. That’s quiet BPD though, sounds like your symptoms could be very different from mine. Sending you hugs I’m so sorry. Can you move to a country where you can get treatment soon?",Giveushealthcare,sr19ye
5,"It may not fix the problem. It could be a combination of medications that you may need. I used to be on mood stabilizers but Paxil and abilify in the end is what worked for me. Also maybe try looking into therapy, Cognitive behavior therapy or DBT.",brettg926,sr19ye
6,bpd can really go either way with medication tbh... and i'm sorry they won't even consider it as an option,pastelxbones,sr19ye
7,"i know it might feel like a hard thing to live with, but don’t give up, you will get past this point of your life and be stronger for it. i have had BPD symptoms for as long as i can remember and even though life is hard still, it’s a lot more manageable. try and find a different doctor, try every doctor in your area if you have to. i guess the medical system in norway is different to how it is in other countries from what your post implies, but im in england and i was under a specialist care team at one point for people with BPD/CPTSD; i would say 85% of people i knew there took either an antipsychotic + SSRI, or an antipsych and a mood stabiliser. your mood swings will never go away fully, but after trying a few medications i now take Quetiapine (an antipsychotic) and Lamotrigine (a mood stabiliser) and my life is majorly improved. even though Lamotrigine is for depression in bipolar i take it at a slightly less than full dose  and it’s helped me hugely, i don’t cry as much and i’m a lot more stable, i don’t spend everyday staring at the ceiling numb or in rages. i wish you all the best, but please hang on, it might be a bit unorthodox but in my lowest moments i used to tell myself i had to stick around to prove my abusers wrong (bc as you know BPD is trauma based). big love x",imoaq,sr19ye
8,[removed],,sr19ye
9,"
I know it sucks but the truth is, BPD is not treatable with medicine. BPD is caused by trauma. The only way to get rid of it is therapy. 

You can however treat the symptoms of BPD, like depression and anxiety, which it seems like you have from your post. I’m sure they can treat those at the hospital. 

Mood stabilizers are meant for those who shift between mania and depression over a period of time, meaning bipolar disorder - not for your daily irritation/happiness/sleepy/etc mood swings that us with bpd have.

If you are feeling large shifts in moods, from days of mania to deep depression, I would ask the doctors to examine wether or not you might also have bipolar. 

Hang in there. I know it’s hard, mood swings are hard. You will learn to live with them 🧡",Nervous_Beautiful666,sr19ye
10,"Can you not buy online? I’ve never struggled to order mood meds from online chemists?

The real question here is:
What is there alternative to the meds and are you doing that?",sunshinepickaxe,sr19ye
11,My meds have helped me tremendously. They initially put me on them because I was also diagnosed with MDD. Maybe they would give you something if you asked to be accessed for MDD as well?,KlutzyPenalty3304,sr19ye
12,"Seek out a different psychiatrist, as well as a therapist. Somebody will be able to advocate for you if you can find the right person. Even if they won’t medicate your BPD, somebody will eventually see that mood stabilizers, anti depressants, etc. SOMETHING is beneficial to your symptoms. I really hope that not everyone there disagrees with medicating BPD. Good luck",ensorcellzed,sr19ye
13,"That is seriously some bs & unfair. I guess research, resources, etc. involving BPD in your country has made it harder for them to understand it & how to treat it? Idk, like most people with BPD, I also have other diagnoses, & I just know that I personally could not survive without my meds. Without them I would either be dead, a vegetable, or insane.

If it’s a problem in your country, it sounds like no matter how much you ask & beg, it won’t be likely you’ll be prescribed anything. Unless you’re lucky enough to find a doctor who is willing to find a loophole for you. I hope that either your country will soon get its shit together to help you & others struggling or that you find another beneficial resolution to help. This really sucks right now, I really hope for the best for you. 🧡",psychmonkies,sr19ye
14,"You obviously care to some degree or you wouldn't be posting.  Which means you still have some desire to live, even if it's subconscious.  Please don't give up. If there is anybody that you care about,  then they likely also care about you as well. And removing yourself from this plane would be devastating for them as well.  Things will get better for you. It's a rule of existence here. Things get bad, then they get better.  Just push on a little longer.  I dont know you at all, but I love you. Get up!",NinjaMagick186,sr19ye
15,"You deserve to be alive and I’m glad that you’ve reached out here for support.

Is there anyone here from Norway who can better help OP with finding the right resources for mental healthcare?",snail-overlord,sr19ye
16,Try Gabapentin/Pregabalin,newlightpsych,sr19ye
17,"Can you try lithium over the counter? That’s one thing I’ve recently heard can help.

Highly recommend looking into r/unclebens  though. 


Hear me out, the spores are legal. You’re only growing a tiny little bit for yourself to medicate just don’t let anyone know you’re growing them. 
Buy some gel capsules and micro dose. It seems so hard and impossible but I went for it and I’m doing it and it’s helping me so much. It’s a cure for mental illnesses used the right way, so they say. I don’t feel cured but I feel like...”thank god I’ve got my mushrooms capsules” when times get tough. They lighten me up, take away the irritability I feel just existing, take away the constant thoughts running one after another, it really helps to slow my thinking down and in turn helps me to rationalize my inner voice. Also growing them can be quite therapeutic in itself. :) I only take .1 grams and I take them at night time, if I skip a night I really feel the difference in my mood the next day. They really do help, plus the side effects aren’t extra suicidal thoughts...if anything you are irrationally in love with the beauty of the world. Lol 

https://qualityspores.store 

Reminder buying the spores is completely legal in most countries.",AmandaRoseLikesBuds,sr19ye
18,"Im in Norway

The psychiatrist at the psychiatric hospital doesn't want to give me medicine",internetcatalliance,sr19ye
19,Just asking country as my doctor wouldn't give meds either I had to bee seen by a phychatrist to get them so maybe worth asking to be refered to one,,sr19ye
20,"I just got diagnosed with anorexia too...

I dont have the fight In me anymore",internetcatalliance,sr19ye
21,"You are so lucky... I wish I could be like you but I honestly just gave up at this point 

I've been fighting this life ending disorder for years

Never getting better

I just don't want to fight anymore",internetcatalliance,sr19ye
22,"I feel you and OP on this, I was on Quetiapine too for 5 years (it was combined with a SSRI for me personally super effective and I'm not sure if I would be here if I didn't got them prescribed at that time) I quit them both now which I thought I never could, and I feel fine. But I completed DBT therapy too but I still need medication, so why they don't give it the OP?! Keep looking for a doctor that actually listens and helps you, it took me 6 or 7 to find someone that put me back on Xanax with no hesitation which is all I wanted cause my anxiety is to the point it's critical and I was on it for idk 6 years daily but not getting mood stabilizers that's wrong and I would demand them too if I thought I needed them and it would benefit me (like a bandaid, once you get past certain things you can pull it off) now the only medication I still use is benzodiazepines, and taken as prescribed it greatly benefits my life and I was on them for years daily anyway... I live in The Netherlands, and I can't believe they deny someone this medication, stay strong and please find someone that helps you on this ♥️",Bloedstorm666,sr19ye
23,[removed],,sr19ye
24,"I was misdiagnosed as bipolar and put on lithium

It tasted like cum and salt so I didn't take it almost at all

So yeah not a good option",internetcatalliance,sr19ye
25,"So you mean ... there is nothing they can do to make the mood swings go away?

There is nothing then... I dont want to live like this anymore I just don't want, I can't I really really can't

Im crying 5 times a day so loudly people walk in asking if im okay, no I'm not I want to die.",internetcatalliance,sr19ye
26,">I know it sucks but the truth is, BPD is not treatable with medicine. 

Hey, I just want to expand on this since it's an incomplete statement and the nuance can misguide a lot of people. BPD isn't cured by medications, but BPD can also be treated with medications. It just isn't done alone because BPD is a complex mental illness. Medications help with the surface content but not the core content.

Medication treatments differ from psychological treatments in that they are intended  to help people improve the quality of their lives by changing aspects  of their body or brain chemistry. Generally, the most common medications used for BPD include antidepressant medications, mood-stabilizing medications, and antipsychotic medications.

Most of the studies on antidepressants for BPD have focused on  SSRIs (Paris 2005; Silk, Wolf, and Ben-Ami 2005). This is probably  because these medications seem to have fewer or less-serious side effects than TCAs or MAOIs. Four open-label studies have indicated good  effects of fluoxetine (Prozac) on patients with BPD. In one of these  studies, patients who took Prozac had reductions in their sensitivity  to rejection, as well as improvements in anger, depressed mood, mood  instability (or mood swings), anxiety, and impulsivity (Norden 1989).  A few other open-label studies found that Prozac helped to reduce  psychiatric symptoms, depression, anxiety, and interpersonal sensitivity among patients with BPD (Cornelius et al. 1990; Markovitz,  Calabrese, and Meltzer 1991; Markovitz and Wagner 1995).  A few double-blind, placebo-controlled studies have also found  beneficial effects of SSRIs in patients with BPD. For instance, one  study found that anger, anxiety, and depression in patients with BPD  who took Prozac improved more than they did in patients with BPD  who took a placebo (Salzman et al. 1995). Another study looked at  how well Prozac worked for patients who had BPD and a mood or  anxiety disorder. This study found that patients who took Prozac had  greater improvements in depression, anxiety, and other psychiatric  symptoms (Markovitz 1995). A double-blind placebo study of another  SSRI (fluvoxamine, or Luvox) for women with BPD found that the  patients who took Luvox reported more relief from rapid mood shifts,  compared to the patients who took placebos (Rinne et al. 2002).

So, given these studies, what can we conclude? Well, right now,  the best conclusion we can make is that SSRI antidepressants may  be helpful in reducing depression, anxiety, and mood shifts among  patients with BPD.

Mood-stabilizing medications are another type of medication  commonly used to treat BPD. When you think about it, this makes  sense. If having an unstable mood is a key symptom of BPD, then you might expect mood-stabilizing medications to be helpful.There is some evidence that mood stabilizers may be helpful for  people with BPD (Paris 2005; Silk, Wolf, and Ben-Ami 2005). For  instance, there is a small amount of evidence that lithium can be  helpful for patients with BPD (Links et al. 1990). The problem with  this research is that most studies on mood stabilizers have been openlabel trials or have included a very small number of patients. Also, the  medication that has been studied the most is divalproex sodium (DVP). Although DVP has fewer side effects than some of the other mood stabilizers do, it is important to remember that DVP can be harmful to a fetus, so it isn’t a good choice for everyone.

A limited number of studies have shown some good effects of DVP  for people with BPD. One open-label study of eleven patients with BPD  found that after taking DVP for eight weeks, patients had less irritability and psychiatric symptoms (Stein et al. 1995). A larger open-label  study of DVP with thirty hospitalized patients with BPD also found  that DVP seemed to help lessen psychiatric symptoms (Wilcox 1995).  However, double-blind, placebo-controlled studies haven’t always had  the same good findings. For instance, one study found that DVP was  no better than a placebo (Hollander et al. 2001). However, another  study that looked at BPD patients who also had bipolar II disorder  (Frankenburg and Zanarini 2002) found that patients who took DVP  experienced greater improvements in interpersonal sensitivity, anger,  and hostility than did the patients who received the placebo.

The best conclusion we can draw is that mood-stabilizing medications may be helpful for some patients with BPD, especially in  ­alleviating irritability, anger, and general psychiatric symptoms.

Sometimes people use antipsychotic medications in the treatment of BPD. These medications help treat psychotic symptoms and were originally used with people with disorders like schizophrenia.  However, the fact that these medications are sometimes also used to  help people with BPD does not mean that those with BPD are psychotic. Psychosis is a term for problems with being out of touch with  reality. People who have psychotic symptoms might hallucinate (see,  hear, feel, smell, or taste things that are not there), have delusions  (unusual or bizarre thoughts), or experience other such symptoms.  On the other hand, even though BPD is not a psychotic disorder like  schizophrenia, people with BPD sometimes do have unusual thoughts  or beliefs that they just can’t seem to give up (like believing you are  ugly or fat, no matter how often people tell you that is not true, and  try to convince you otherwise). Therefore, some of the medications  used to treat psychosis may be helpful for people with BPD.

Source: The Borderline Personality Disorder Survival Guide, Everything You Need To Know About Living With BPD by Alexander L. Chapman, PhD, Kim L. Gratz, PhD",ladyhaly,sr19ye
27,"You are 10000% correct. Unsure why you’re being downvoted. 

If this person has BPD medicine will not ease their symptoms.",Successful_Map4660,sr19ye
28,"That is absolutely NOT true. And to add, everyone with BPD has a comorbid condition like depression or anxiety, and those symptoms often blend into the symptoms of BPD as well. OP has anorexia btw which is already a separate comorbid condition that is often treated with medication.  

Just because there aren’t any medications “officially” approved to treat BPD doesn’t mean it isn’t medicated off label on a symptom-based approach. Yes, therapy is necessary, but what good does therapy do someone who isn’t even in the right state of mind to be able to benefit from therapy? Medication is often necessary in order for therapy to have an effect.",snail-overlord,sr19ye
29,"I might have to, but I dont know where or how",internetcatalliance,sr19ye
