,Comment,Author,Post
1,"i have bipolar 1 as well as borderline, i am on zyprexa and lamictal. i was diagnosed borderline after the bipolar so i was put on these meds before i knew i had borderline. the meds dont necessarily work for the borderline symptoms but when i miss a day of my meds i get so much more dysregulated",No_Pair178,17etdtd
2,"I was on quetiapine for the longest time and it made so many things worse especially SI. Yes it put me to sleep when I was up late spiraling in intrusive thoughts but it did much more harm than good.

On the other hand, lamictal is straight up saving my life.

Antipsychotics and mood stabilizers are NOT similar, don’t get them confused.

SSRIs & SNRIs and abilify all did nothing for me. I don’t think Wellbutrin really does much either for me, maybe a bit of energy.",WhereIDiscussBS,17etdtd
3,"Zyprexa is very helpful to me.  From what I’ve read, it isn’t uncommon to treat BPD with it.  It seems like it would be a strange choice for Bipolar, but I dunno.  What I do know is that it was designed to treat Schizophrenia, lol.",a11_fa11_d0wn,17etdtd
0,[deleted],,1bwzw4e
1,You feel for them but you don't?,Natural-Possession-2,1bwzw4e
2,I definitely wouldn’t have posted this,peentiss,1bwzw4e
3,Precisely,Own_Collection_8916,1bwzw4e
0,"Happy birthday! Take care of yourself, I'm sending you good vibes. 🫂",princefruit,1criuvc
0,"From personal experience, I see not taking care of yourself as a form of self-harm. I also get the urge to not take my meds when I'm episodic.",Syphlin,184dkv0
1,"It sure is.

Your brain is working against you. Because of the trauma you experienced, your brain has become convinced that you're a piece of shit, you're completely worthless, and that you deserve nothing but pain.

It will manipulate your thoughts, and keep you in a cycle of absolute shit.

This is where DBT really helped me. Once you become aware of what your brain is doing, you can start to fight against it. Recognize when your mind is being an asshole, shove the asshole to the side, and make a conscious choice about what you want to do.

I don't want to say medication is necessary. But it really helps. I was suicidal for 25 years, and after finally taking care of myself and getting help, I was able to get rid of it. The medicine just helped me through the process.",GastonsChin,184dkv0
2,"Do you know about Susanna Kaysen? The famous borderline author? What you're speaking about reminds me of a quote of hers, I sometimes keep a collection of quotes I like, hers goes like this: 

""I was silent when pleasures offered itself to me. I avoided it. My hunger, my thirst, my loneliness and boredom were all weapons aimed at the world. They didn't matter a whit to the world of course, and they tormented me, but I got some gruesome satisfaction from my sufferings. They proved my existence."" 

Needless to say, I can relate. She just said it better than I can.",Most-Shock-2947,184dkv0
3,"Yup, called self sabotage.",Neikitia,184dkv0
4,When I'm sick I just isolate and suffer because that's what I did as a child.,,184dkv0
5,"Yes! Normal, no. Common , apparently so. It is absolutely not what you should be doing.  You are torturing those around you as well. It isn't your logical  brain, it is your trauma. You are worth basic care!!",The_Jessica_C,184dkv0
6,It’s self harm. I’ve done the same a few times.,Magurndy,184dkv0
7,"bells puzzled bored chief label squash toothbrush voracious beneficial wistful

 *This post was mass deleted and anonymized with [Redact](https://redact.dev)*",,184dkv0
8,i was sick for an entire week without taking any medicine and not even drinking that much water. makes me feel a little bit better knowing i’m not the only one who does this stuff,jade318go,184dkv0
9,I am like this I abandon myself completely,666throwawaytrash,184dkv0
10,SAME ABD YEAH I THINK IT IS RELATED,coleisw4ck,184dkv0
11,"Please take your meds, friend! It’s super important. And if you actually don’t like how the meds make you feel, then talk to your doctor about switching. Also be honest and tell them about this",eyeofthebesmircher,184dkv0
12,I do a lot of self sabotaging to man i get it,budderman1028,184dkv0
13,Actually I can really relate to this one. When I was having a episode and I was very intensely angry. I refused to take my meds to calm me down. I didn’t want my meds. I wanted to be understood.,Dookie4noggins,184dkv0
14,"25 years is a hell of a long time to suffer. I know, I've been suffering as long. I'm so glad you're doing better now.",Most-Shock-2947,184dkv0
0,"dbt and therapy will help those symptoms, medicine likely will not target that specifically.",deadtrapped,144rua0
1,Not… that I’m aware of….,Suspicious_Dealer815,144rua0
2,"Nothing makes that go away. Maybe a lot of therapy, but not meds",One-Distribution7909,144rua0
3,"I’ve found jealousy stems from fear of abandonment so treating that as the root cause will be more beneficial than any medicine. btw feelings are sometimes irrational, it usually comes from a hurt place, don’t judge yourself too much over it. it’s best to address the cause and manage feelings",coolofmetotry,144rua0
0,"It's a really hard one to diagnose, and they don't like to diagnose it in teen/young women as much. I got my actual diagnosis from a psychiatrist at 40 but I've known since I was 14 and saw a book called ""I hate you, don't leave me"" and I instantly knew it was about me. 
Talk to your doctor about it and they may make a psych referral. Good luck!",KBelohorec1979,1937lh2
1,Wait cause I'm actually going through that exact scenario. I feel like most ppl just assume you already know because you live with it. So no one says anything to you. It's quite annoying that it took me so long to actually realize it.,,1937lh2
2,"Along with it being difficult to diagnose, it also doesn't change the process very much.

To us, getting a diagnosis makes us feel better, like it confirms we're not just crazy. But to therapists and psychs, pinpointing the exact title isn't vital.

They're still going to focus on the depression and anxiety aspects. Treat you one day or week at a time as things change.

But knowing others also deal with it is good for you, mentally and emotionally. So keep reading into it, it'll help you learn more about yourself.",Positive-Statement-4,1937lh2
3,"Hey, I feel for you. I started seeing mental health professionals when I was 16 and wasn't accurately diagnosed with BPD until I was 28. I even came across some descriptions of it and suggested it to doctors at times, and they told me I didn't have it, because there are still so many misconceptions even among professionals.

BPD is complex. Stigma and misinformation as become widespread around a very limited understanding of it. Everyone forms and expresses it differently. To meet the diagnostic criteria, you need to show at least 5 of 9 symptoms, which means 256 different combinations based on that alone - without including different variations in how the symptoms show up themselves and different severity levels. There are 4 different ""subtypes"" you can look up - but even these are just for the sake of more broadly categorizing things, most people don't fit cleanly into only one subtype all the time.

I'm sorry for the frustration and confusion you must be feeling. But first, because BPD IS so complex and has a lot of overlap with other conditions (and usually has comorbities, which makes things more confusing), please discuss this with a licensed clinician - diagnosis is nuanced, and a professional who's well informed on the condition should be the one to diagnose you. Whether or not you get a diagnosis, you still have the symptoms, and it's important to focus on treating and improving those. BPD has a high rate of remission.

I've been in remission and recovery for over 2 years, and I want to give you and a lot of people here so much more advice and support, but it's difficult to do so like this, so I have a youtube channel if you're interested. [www.youtube.com/@SarruhTonin](https://www.youtube.com/@SarruhTonin) I make BPD specific content as well as other areas of mental health, wellness, and self improvement that have contributed to my overall recovery. Some especially helpful videos for you right now may be Understanding BPD and BPD Advice.

Remember, with misinformation and stigma being so rampant, there's a lot of misinformation on the internet and even within these subs despite the members having BPD themselves. Everyone is different - be wary of any over-generalizations. Dr. Daniel Fox is a great professional resource on YouTube as well - He's a licensed psychologist who specializes personality disorders, and I highly recommend his channel. 

I really hope better understanding your symptoms helps bring you some validation, and even hope since it means you can find a more clear path towards improvement. I wish you the best of luck.",SarruhTonin,1937lh2
4,"Hi. I hope you're doing fine. 

I've been in therapy since I was six years old. When I was 22 I started having depressive episodes, self-harming with high levels of anxiety that wouldn't even let me eat. I've seen psychiatrists and therapists since then and no one, til I turned 27, ever told me that I had BPD. No one ever wanted to tell me even, which was confusing af. So they would prescribe me medications for a disease I didn't know that I had. 

I learned since then that BPD is really hard to identify, because sometimes we don't 'fill' the criteria, but it's something that manifests itself in different ways and in very different periods of time. Sorry for being self-referential, what I mean is: don't be afraid of asking. It's your right to know, and knowing will give you tools to handle what you're feeling. 

And yes, many things will start to make sense.",___letteb,1937lh2
5,"Because your boyfriend isn’t a psychologist or doctor and doesn’t know the complete diagnostic criteria and everything between giving an actual diagnosis. You may or not have bpd, but your boyfriends outpouring of rude and ignorant comments don’t mean you do at all.",DinoGoGrrr7,1937lh2
6,"Because it took them 17 years, several suicide attempts, countless mental health referrals, trials of every SSRI and SNRI and me writing letters and begging for help to eventually trying to kill myself in their care in order for them to take me seriously and refer me to psychiatry for him to diagnose me within very little time of meeting me.



My whole adult life was spent in pain and it could have all been prevented or at least made slightly better if they had just listened to 17 year old me when I went to them asking for help in the first place. It's not uncommon that Borderline/EUPD people feel neglected or let down by healthcare or mental health. Honestly because it's so misunderstood and stigmatized still.",Plus-Introduction347,1937lh2
7,I've heard that the average borderline was misdiagnosed five times before receiving the correct diagnosis,_-whisper-_,1937lh2
8,"I hate to say it but you really have to convince these therapists hard if you want them to diagnose you correctly with BPD. It sucks and it shouldn’t be this hard getting the help you need. I am male and they were so reluctant to diagnose me with it when it was painfully obvious I had it, to me as well as the few I was close to. You are probably gonna have to go into your therapists office and flop around like a fish out of water for a good while before they actually tell you what’s going on. 

So to answer your question, the doctors and specialists probably did notice these traits in you, but just didn’t want to diagnose you. You must be the one to convince them if you want to be seen because in my experience, they WILL NOT help you on their own.",meme_finesser,1937lh2
9,"I hear you. It was the same for me. I’ve seen 5-6 doctors over the last 4 years and not one of them brought up a personality disorder until I did after doing months of research. FINALLY got diagnosed in September & now everything makes sense. 

I’ve learned there’s a grieving process that comes with it, as I’m still working on processing the diagnosis. 

But just know you’re not alone 💕",AdCrafty3620,1937lh2
10,"I’m so sorry. Same here. I was just diagnosed this past year and I am 26F. As soon as that was pointed out to me, everything made sense. Now you can really start to heal. It’s a lot easier with the actual diagnosis, whether you self diagnosed or not! Good luck 🙏🏻",spiritual-mortcian,1937lh2
11,"I didn’t get diagnosed until I asked. I told my therapist I got with the criteria, so she pulled out the DSM and we went through it together. Then I was diagnosed. She seemed careful about the topic like she was worried I would be upset or something, but that’s an assumption",hadeshellhound0,1937lh2
12,"All of the people I know who got diagnosed early (18-22 ish) were very disruptive to society i.e violent and self harming and very public meltdowns, aggressive etc. I didn't get diagnosed till 25, I have those issues but I do my best to contain them and will just wreck my bedroom. Mine presents as depression and irritability a lot of the time, what looks like me being quiet and sulky is me having suicidal ideation, and emotional permeance means that I could have felt like I was dying one morning and by the evening I'm fine, and so I forget it happened. I also struggle to open up to professionals and often downplay my issue so they don't see the patterns",sobadatbeinginlove,1937lh2
13,I'm 25 too and I recently got diagnosed. No one has ever mentioned borderline in my face either.,BPDwreck,1937lh2
14,"Hi! I am a 37 yrs old female I had my diagnosis in 2022. I talked about my symptoms to my old doctor and he doesn't seemed to care. I had to be burnt out, almost suicidal at a psychiatric clinic for emergencies with an online assessment to help diagnose BPD. But I knew since my 20's that something was wrong with me. Fortunately my new doctor knows about that and prescribed me some medication that really helps me. BPD and ADHD have similar symptoms so I think that's why they haven't seen your BPD. In both conditions it's the frontal cortex that has an impairment. Other stuff separates these conditions but they are often mixed up.",Jumpy-Drummer6247,1937lh2
15,"As others have commented; this is one of the trickiest disorders to diagnose. The very use of the word ""Borderline"" gives a clear indication of how challenging the diagnosis must have been for the early psychologists/clinicians who wrote it up.

Hard to judge on the attitudes of your BF or you BFF. Damned if you do; damned if you don't kind of a situation. Personally I only realised what was going on in my relationship 8 weeks or so after it ended, so far I haven't had the opportunity to discuss it with my GF/ex GF but I can imagine it would not be the easiest of conversations.

As I learn more about BPD, it seems the seeds are planted in childhood but typically do not ""fully bloom"" until puberty kicks in. *Does this hormonal change contribute to BPD showing itself?* I also read that age can also have a positive change with the BPD traits/characteristics lessening after the age of 30 with or without therapy. ( for some people)",Bootcamp-Pro,1937lh2
16,"First of all,have you been officially diagnosed and nobody told you? This was what happened to me they kept treating me for mmd.I would tell them it is something else,That I wasnt able to express and years later when I filed for disability I needed copies of recirds,when they lawyer got them,I asked what the recirds saisd and she read it to me and said it was BPD>I had no idea what it was,ands like you I googled and yes,everything made so much sense.Ibrought this to my pcps attention and asked if he knew and asked why I wasnt told.,His answer is most times they dont tell us b/c they are afraid we cant handle it.Which i didnt even know was legal,alot of times they dont know how to treat us,and my pcp wasnt aware he never noticed,but had personal experience with it.Iwas so angry becuase I kept saying something was missing and had I known I could have learned so much sooner before I destroyed every relationship I ever had.I kept asking why I can't change things about myself I didnt like,I was willing to try,I never was able to maintain relationships,and had a poor sense of self.I hated myself and couldnt change things because i wasnt getting the right treatment or meds to the point I could no longer hold a job,or  maintain any stability.So this is when i took it in my own hands,joined forums such as this,got real with myself,and found ways to make it work.You aee young,I was 46 and entering a midlife crisis triggered by an traumatic event,and didnt handle it well which was what lead me down the path of sabotage,and wondering why I pushed people away,why I couldnt quite connect the dots,but I am ok now I mean I still have a lot of these issues but Im 59,i managed to rebuild my life,avoid drama,understand things better,and i could have done that sooner had i understood what my diagnosis was.I think it was so wrong to not be told,I found the reason lame.I dont know if anything I said helps or applies to your situation,but we arent to be feared,We have nothing to fear,we just need to learn how to adjust to a world we see differently.DBT was helpful for me too.",BinkabelleZZZ,1937lh2
17,"The same thing happened to me!  I'd been in treatment for depression and anxiety forever but I didn't know that I had BPD until I started dating a therapist and she told me after a couple of dates that she had BPD.  I asked her what it was and after she explained it to me she kind of said oh by the way, you have it too, lol.  We had a great relationship.  There was regular conflict but we both sort of knew what was happening when the other person was splitting and that reduced the intensity quite a bit.",,1937lh2
18,"There is a good change it’s because it’s a disorder that’s hard to treat. With my daughter, it was explained to me that it’s frequently undiagnosed because it falls into a category that insurance is hesitant to cover, which means providers are less likely to diagnose because they don’t get paid. It’s also very hard to treat.",Own_Scallion6629,1937lh2
19,"I'm glad that book helped you find some answers even if you didn't get diagnosed until later. I read it for more information despite doctors originally telling me I didn't have BPD, and it actually convinced me I definitely didn't. The majority of my symptoms usually exhibited as more ""quiet type,"" and the older edition definitely did not describe different expressions. I'm in remission but still study BPD a lot, so I recently bought the newest edition to see if they've made updates that better explain those nuances, but I haven't gotten the chance to read it yet.",SarruhTonin,1937lh2
20,"Thank you for your post! I’m suffering from quiet BPD, and didn’t have a name for it until I was 43!! It threw me for a loop to begin with, but finding out there are useful treatments available, unlike the previous “take some tablets and go away” made it easier, and it explained so much with regards to my life and relationship history. 

Take heart OP, there are methods like DBT, MBT and Schema therapy that have great success rates! It will be tough to convince yourself it’s worth the effort, but you are, and you can get through this!! 🫡",Commercial_Guitar529,1937lh2
21,"I have a new psychiatrist, gonna see her in a few days and talk about it",Virtual-Ordinary8108,1937lh2
22,"A lot of it is stigma, it's a pretty aggressive Disorder so doctors hesitate to put the label on us. I'm currently on my second misdiagnosis and continuing to push doctors to actually give a f*** and read my tests before they make a decision.

They keep telling me anxiety and I swear to God I do not have anxiety I will throw a chair",_-whisper-_,1937lh2
23,"Also, I went to a neuro psychologist! There’s a 4 hour test you can take that covers about everything. It took about 6 weeks for the results but it’s worth it. Keep your head up.",AdCrafty3620,1937lh2
24,I have appointment with my psychiatrist tomorrow and will talk about it as well.,Virtual-Ordinary8108,1937lh2
25,i disagree and say autism is way harder to diagnose (at least if you're a girl) than BPD. a lot of girls/women even get misdiagnosed with BPD instead of autism.,weiss_doch_o_ni,1937lh2
26,"I am as well and for me, I found the absolute best thing was really educating myself on it and reading others experiences, it made me able to be aware of the behaviours and I was able to not do them; I also have an amazing therapist and we do IFS therapy which works for me. Honestly at that age nothing but the title and a vague idea of what it was really stuck. I am bodied every single bad thing that you read about borderlines at one point or another and now I just kind of want to be alone most of the time which I have to work on in therapy to make sure I don't become a recluse.",KBelohorec1979,1937lh2
27,I watch your YouTube videos!,PropertyAdvanced2668,1937lh2
28,"Be very very careful w that book! It’s extremely sexist, (so is our diagnosis but that’s a different topic) 

While it does have helpful information, read it w consideration",,1937lh2
29,"Good deal, never hurts to ask!",DinoGoGrrr7,1937lh2
30,"Hi OP, I hope the appointment went well! 🤞 When you are ready, could you let us know how you went please? 🫡",Commercial_Guitar529,1937lh2
31,"There's no need to compare like that. They didn't say it was ""harder"" to diagnose than anything, just that it's one of the trickiest disorders. 

Experts are very much starting to discuss whether or not BPD falls under neurodivergency. BPD and autism can have a LOT of overlap, both lie on a spectrum, and both are difficult to diagnose. Bipolar, ADHD, CPSTD, and other disorders in the cluster B category all get misdiagnosed as BPD, and vice versa. The reality is these disorders are just a collection of symptoms seen together enough that it needs its own label. People will often have diagnosable criteria for a lot these disorders at once, which is why can be particularly challenging for a psychologist or psychiatrist —lots won't diagnose purely on the notion that a lot of therapists and clinics refuse to see patients with BPD.   


It doesn't matter which is harder. Bootcamp's point isn't arguing against yours. BPD IS tricky. That's it.",princefruit,1937lh2
32,"I hope you're incredibly proud of your improvement, even though you still struggle. There was a while that my symptoms would only remit while I was isolated, and I was very afraid I'd always have to be alone if I wanted to feel better. I've been in remission/recovery for over 2 years now while having close relationships in my life, and I'm very grateful. I don't know you, but I do believe you can get there too. It's not only possible, but it's important. Humans are built for connection, and you deserve it. Don't give up on it, no matter how tempting. I wish you the best of luck 😊",SarruhTonin,1937lh2
33,"Aw, thank you!! I hope you like them ☺️",SarruhTonin,1937lh2
34,"I have a couple close friends, one more like a sister, so I am happy to be around them and my mom (in small doses lol) and my kids are adults so I'm good in that way, my issue is strangers and major social anxiety; in simplist terms my brain insists to me that I'm awful and going to do something (talk too loud, talk too much etc)to make them judge me. Working on it though.",KBelohorec1979,1937lh2
35,❣️,HoldenCaulfield7,1937lh2
0,A lot of people here are on lamictal. Have you tried that?,Spankpocalypse_Now,18zxzbz
0,"Yep I do that since I was prescribed Hydroxyzine because it’s safer than benzos. However, I still don’t like relying on it because I’ve been using it to numb my anxiety and any other emotions. One strategy I’ve gone back to is a DBT skill where you create a self soothing kit. You can put together more than one and keep one in your car or one in your purse and one in your home. Or whatever works for you. Using that can be an alternative to popping pills. Sometimes it’s not as good as the pills but my goal is to try to make that be enough. There’s also TIP skills like holding an ice cube in your hand. ",Old_Bluebird_58,1cud10g
0,"Bb take your meds. You already know the answer. I do the same thing, I think I’m fine and stop my meds and then I get fuckin crazy. Take your meds and go back to sleep, in a few days, your brain won’t be so hot. ❤️",peentiss,1c1exhb
1,I also struggle with forgetting to take my medicine and what really helped me was getting a med container that’s 30 days (it seems like a lot but it helped me to create a routine and now I barely ever forget my medication). You can do this! I believe in you,Over-Can-4381,1c1exhb
2,"I second peentiss - take your meds, love ♥️ Rest and focus on your health, and you will be good in no time! 🤗",thebombflower,1c1exhb
3,🥹🥹🥹Thank youuuuuuu ❤️❤️❤️❤️,IndependentSleep708,1c1exhb
0,"I'm stoned pretty much all of the time, for like the past 4 years. It used to help a lot but now I'm finding that it brings me to a negative headspace more times than not. It seems as though my vice is no longer doing the trick.",,bo592p
1,"I used to. I think I found my soul mate, so I stopped drinking and smoking. I still really want a beer, I like a nice beer but I'm staying away. I want this to work I want to be level for us. But also of course for myself and my career, for God, for my family. Not just him. Though he is the motivation that got me started.",,bo592p
2,[deleted],,bo592p
