,Title,Post Text,Post Creation Time,Content Type,Post Score,Number of Comments,Post Author,Author Flair,ID,URL
90,Esketamine as treatment help?,"As I've posted before, I'm having trouble finding a DBT therapist near enough to me that I can ""avoid"" avoidance. I know myself, I'll get anxious & not be able to sleep worried I'll be this bad forever. Then I won't go to the appointment because I can't stand to be anywhere during the day, especially driving to an appointment.
I'm pretty desperate for help and use Kratom as basically a mood stabilizer. It can make my breakdown ease to a stop, it helps me sleep, helps me get things done (sometimes.. I've been really depressed & unmotivated), it helps my pain, eases anxiety, makes me feel happy. 

But it's not good for your liver & not advised long term. I've been taking it for over 2 years. It saved my life but I'm worried it will eventually hurt it.

Is anyone using the nasal Esketamine as treatment? I also have the major depressive disorder so I will be allowed to do it. But I have to have my parents drive me, it's a 4 hour appointment 2x a week. Just wondering if it's worth a try. I mean anything seems worth a try right now.

Any experiences?",1604483189.0,False,3,3,SauveMoiPlease,None,jntyqu,https://www.reddit.com/r/BorderlinePDisorder/comments/jntyqu/esketamine_as_treatment_help/
91,Recommended Treatment Plan,"(27 M) So earlier this year at the start of July I was sent to A 75 day treatment facility

In the months leading up to this I had gone through A bad breakup, Lost both of my grandparents to Covid, Was our through A very stressful time at work, was demoted, And lost one of my best friends. Needless to say I was depressed, and I was considering taking my own life.

I’ve always been A weed smoker and A drinker, but my habits turned pretty addictive when Depression seemed to keep lingering around my life 

So I went to A dual diagnosis treatment center that helped cure mental health and substance abuse. 

Before treatment I did not think I had A problem with marijuana or Alcohol. I had never been sober before and had smoked weed every day for the past ten years, and drank on average 4 nights a week for the last 6 years. 

Once I had A few days sober I realized I had A substance abuse problem in addition to the mental health issues I was dealing with

After being in treatment for about 30 days they diagnosed me with BPD. I never knew I had this because I had never seen A therapist/psychiatrist in my life before. Everything was new.

When I was diagnosed I felt kind of upset because I didn’t know what to think. I always felt like O was a little different but I couldn’t pin point why.

I’ve known for about 4 months now and I went through 75 days of PHP treatment and 2 months of IOP treatment. I’m now seeing my therapist every other week for an hour but I feel like my progress is very slow.

Does anybody have recommendations on what I should do for treatment because I don’t feel like this every other week therapy is helping as much as I’d like. DBT groups? Group therapy? Should I see my therapist more often? Are there any books I can read?

My therapist says this is Cureable and I won’t let it define me as A person... but for any of you who have had this for A while and have seen a lot of progress can you please give me some advice?

Anything helps! Thanks in advance!",1607121191.0,False,3,0,Paytonb93,None,k6v7xl,https://www.reddit.com/r/BorderlinePDisorder/comments/k6v7xl/recommended_treatment_plan/
92,Treatment Study for Borderline Personality Disorder [for residents of Kentucky],"Do you experience sudden mood shifts? Are there many ups and downs in your relationships? Do you find yourself engaging in impulsive behaviors (e.g., overeating, substance use, self- injury)?

If so, researchers at the University of Kentucky are inviting you to participate in a study on borderline personality disorder. Eligible participants will be provided over 18 sessions of cognitive behavioral therapy at no cost. In addition to attending therapy sessions, research participation will involve completing a diagnostic interview to confirm eligibility, attending 2-3 follow up interviews, and completing online questionnaires. All study visits may take place in-person or via Telehealth. Participants will be compensated up to $75 for the completion of follow-up interviews.

You may be eligible to participate if you:

* Meet criteria for borderline personality disorder following a study assessment
* Are NOT using certain substances (i.e., opioids, methamphetamine)
* Are 18 years or older

For more information:

TIPS Research Program: [https://tips.as.uky.edu/participate](https://tips.as.uky.edu/participate)  
UK Clinic for Emotional Health

[tipslab@uky.edu](mailto:tipslab@uky.edu)",1653416900.0,False,2,0,TIPSLabUK,None,uwxijz,https://www.reddit.com/r/BorderlinePDisorder/comments/uwxijz/treatment_study_for_borderline_personality/
93,"Did any of you have to take an IQ test, to get into DBT treatment? Please help!","Is this a normal procedure? Or do they think I am too stupid to understand it? What if I fail? Then they can't help me? I finally thought I was getting help, but then I have to take an hour long IQ test to see how my brain works as my therapist put it. I just want to cry now.",1629812238.0,False,8,26,LunaDea69420,None,panhp3,https://www.reddit.com/r/BorderlinePDisorder/comments/panhp3/did_any_of_you_have_to_take_an_iq_test_to_get/
94,Refusing help/treatment when you need it the most,"I don't know if this is a BPD thing but does anyone else refuse help what they're really struggling? I do it as a way of self harm because I want to make myself suffer because I don't feel worthy of good enough for treatment. 

I'm physically telling my therapist that I don't want to see her again, and I've now stopped all sessions, but I'm internally screaming to please see that I'm not okay and I'm scared of myself. It makes me feel like such an attention seeker. I think I do it because I feel guilty if I reach out for help, but if that support is insisted upon me then it's not my fault and removes that guilt. 

I told my dad that I'm stopping my medication even though to stop suddenly and  crash and is dangerous. I said that I'd be fine but in my head I'm begging for him to just get it that I seriously need help but I don't know how to ask for it. 

Does anyone feel like this or do this? Is it a BPD thing?",1633602419.0,False,4,4,Less_Home8530,None,q363vs,https://www.reddit.com/r/BorderlinePDisorder/comments/q363vs/refusing_helptreatment_when_you_need_it_the_most/
95,At the doctor right now receiving ketamine treatment for Borderline. Came in here a hot mess in tears and am right now completely ok with the fact I’m not ok. I want others to be aware of effective this treatment can be for some people. Feeling hope!,"I’m going to keep this brief: while I don’t believe in “miracle drugs” to cure Borderline, ketamine really gives me hope that we may not be far off. Real healing and recovery from Borderline will always require some sort of talk therapy or DBT/CBT and ongoing management, but WOW.

I’m someone who has spent *years* in therapy and receiving psychiatric treatments for BPD (GAD/PTSD/ADD) and actively “working” my recovery and focusing on DBT (a form of CBT) and EMDR (wow so many acronyms). 

I think Ketamine (for me) actually ignites some sort of light at the end of the tunnel. Something resembling hope. 

It, at first in a treatment session, provides (at least for me) profound immediate relief from the constant, heavy feelings of guilt, shame, fear, and genuine terror of everyday existence.

But then the lasting effects I think are that it gives you sort of that distance from your problems in your life, and their perceived weight. It’s like, by giving you a break from carrying everything, it gives you a chance to breathe and reevaluate your issues from a healthier point of view that is less biased— almost like viewing yourself in the third person as a kind friend trying to help. It kind of allows you to be your own lifeguard in a way (Borderline for me often feels like I’m drowning beneath the emotional waves with the trauma response grabbing at my heels to pull me under.)

It’s not like all your problems disappear. It’s more it makes me feel “ok with not being ok” while at the same time reminding my brain how to have an internal monologue where you aren’t attacking yourself constantly with toxic thoughts. Something I probably haven’t experienced since early childhood or maybe ever. 

I see how it is helpful for people with PTSD/ trauma too, thorough similar relief mechanisms. It’s almost like it makes the the coping skills you learn in DBT/CBT more accessible, if that makes sense. Right now I’m getting the visual of a carpenter being able to find a tool in his tool belt. If that makes sense?

So much for keeping this brief, haha! If this helps even one person get closer to feeling ok, it was worth spending my $200 session typing this.

Anyone else have experiences with this medication (positive or negative)?",1655587153.0,False,18,14,vinoprosim,None,vffmgi,https://www.reddit.com/r/BorderlinePDisorder/comments/vffmgi/at_the_doctor_right_now_receiving_ketamine/
96,Looking for Online Treatment Resources for BPD,"Hi everyone. I’m searching for resources for a loved one who suffers from BPD.  Are there any online programs, STEPPS, forums, or something similar to the AA 12 Steps-anything online that one can join online for treatment or support? My loved one is unable to attend in person therapy for the next few months but has expressed an interest to have access to such a resource.
Thank you all!",1599529522.0,False,12,8,enrhoads87,None,iokr12,https://www.reddit.com/r/BorderlinePDisorder/comments/iokr12/looking_for_online_treatment_resources_for_bpd/
97,Treatment for BPD and PTSD that in no way involves therapy?,"Yes, I know I post this question a lot, but I hope that if I keep asking and someone sees it at the right time, they will be able to help!

I'm currently on a lot of medication for MDD, GAD and a variety of other things, but now I'm being put on the waiting list for BPD treatment they want to put me in therapy and I really, really don't want that.

I know that I have felt awful for many, many years, but it was all manageable up until I went to the police and started talking about traumatic events. Now, I have to start thinking about bad things, my life is becoming unmanageable and therapy will only exacerbate that (police case is only about one thing, there are many more).

I have neither the time or the inclination to be completely ruined by bringing up bad memories, so I was wondering if anyone knew of medication that *does* work for BPD, so I can suggest that to my GP instead?",1588977825.0,False,3,22,sonder84,None,gg3fvo,https://www.reddit.com/r/BorderlinePDisorder/comments/gg3fvo/treatment_for_bpd_and_ptsd_that_in_no_way/
98,So I admitted myself into a treatment facility for two months and when I got out my husband is filing for divorce…. Like wowwwwww.,,1647281641.0,False,101,22,Visual-Garden6246,None,te3w81,https://www.reddit.com/r/BorderlinePDisorder/comments/te3w81/so_i_admitted_myself_into_a_treatment_facility/
99,Anybody been to a treatment center?,"My therapist thinks the best thing for me to do to help with BPD is spend 28-35 days straight in a treatment center. I'm scared to be away from my family, fp, and life that long. And what if it doesn't work? Has anyone been that can give me some advice?",1618009351.0,False,1,1,Intelligent_Car6999,None,mnsuym,https://www.reddit.com/r/BorderlinePDisorder/comments/mnsuym/anybody_been_to_a_treatment_center/
100,Treatment Study for Borderline Personality Disorder [for residents of Kentucky],"Do you experience sudden mood shifts? Are there many ups and downs in your relationships? Do you find yourself engaging in impulsive behaviors (e.g., overeating, substance use, self- injury)?

If so, researchers at the University of Kentucky are inviting you to participate in a study on borderline personality disorder. Eligible participants will be provided over 18 sessions of cognitive behavioral therapy at no cost. In addition to attending therapy sessions, research participation will involve completing a diagnostic interview to confirm eligibility, attending 2-3 follow up interviews, and completing online questionnaires. All study visits may take place in-person or via Telehealth. Participants will be compensated up to $75 for the completion of follow-up interviews.

You may be eligible to participate if you:

* Meet criteria for borderline personality disorder following a study assessment
* Are NOT using certain substances (i.e., opioids, methamphetamine)
* Are 18 years or older

For more information:

TIPS Research Program: [https://tips.as.uky.edu/participate](https://tips.as.uky.edu/participate)  
UK Clinic for Emotional Health

[tipslab@uky.edu](mailto:tipslab@uky.edu)",1645555748.0,False,3,0,TIPSLabUK,None,syv2w6,https://www.reddit.com/r/BorderlinePDisorder/comments/syv2w6/treatment_study_for_borderline_personality/
101,"inpatient experiences? anyone with good experience? i fear ER + medicaid will result in poor treatment, but i'm willing to pay to get the best care because I'm truly tired","anyone know of any good make inpatients? 

I've struggled for so long i'm 36, my only family is my mom, all friendships are gone, self image, esteem, and I have comorbid issues that have compounded. i hate writing this... but im basically disabled from BPD at this point. 

i'm afraid going to the ER will result in me being sent to whatever inpatient i guess that has a bed, and then i'd come out a week later around christmas, alone.

i lack the family friend social and colleague support. i am single, and the last few years I should have gone to ER but my fear is heavily around coming out feeling like I wasn't properly treated or helped and then going home alone without the support system one needs.

i live rural, so making friends is hard but now i've got trust issues and anxiety, so i feel like if i don't go somewhere for a longer period & can actually get out on really good feet, that im going to actually finally die. the rumination of it over years has become acceptance and more recently strategic planning and assuming, but i feel like I should give it one big final push. 

my executive function is garbage, i call places but can't tell what's good or not, so many are female only, and ones that also treat say addiction etc. i feel like i might not be getting the best care. 

if i can't find a place (honestly my brain isn't functioning like it used to i can't organize, understand websites, deal with the pressure of calling insurance etc. 

If i have to just go to ER and let them send me wherever, anyone have experience with this and with medicaid? Anyone have tips in terms of what i should request if i have any say in the matter? 

Please anyone please share or let me know and especially if you came out to no family or real support because i can't imagine a one week stay getting me good enough to feel confident on my feet without any support. Thank you",1702830447.0,False,1,2,btypeb,None,18kkyym,https://www.reddit.com/r/BorderlinePDisorder/comments/18kkyym/inpatient_experiences_anyone_with_good_experience/
102,Has anyone done a residential treatment center for BPD?,,1636685393.0,False,3,0,TheRealGongoozler,None,qs1mcb,/r/BPD/comments/qs1l18/has_anyone_done_a_residential_treatment_center/
103,How do you tell somebody that you need to do more intense treatment?,"I’m really struggling right now, and I think that IOP or partial hospitalization would be good for me right now. I’ve had to upgrade to seeing my therapist twice a week because she’s worried I’m going to hurt myself, which she’s not wrong since I have had intense thoughts. My mom has been supportive of me, but doesn’t really understand that BPD isn’t going to go away if I “just think happy thoughts or do something I enjoy”. My dad isn’t really in my life and doesn’t believe in mental health (even tho he definitely has multiple mental illnesses and caused most of mine). I would really benefit from intense treatment, but I’m terrified to ask for it. I had a huge SH relapse yesterday, but my mom doesn’t know that I do that. I’m starting a new job next week, but I’m really suffering. Does anybody have any advice on how to ask for more help?",1654232075.0,False,2,2,Curious_Problem1631,None,v3rq4n,https://www.reddit.com/r/BorderlinePDisorder/comments/v3rq4n/how_do_you_tell_somebody_that_you_need_to_do_more/
104,Any recommendations for residential treatment centers?,"I went to Rogers for OCD last year, but the pandemic has made my
BPD symptoms skyrocket to the point that I’m considering going into res again. 

Any reviews or suggestions would be great!",1607113623.0,False,5,2,Chihuahua_enthusiast,None,k6sth0,https://www.reddit.com/r/BorderlinePDisorder/comments/k6sth0/any_recommendations_for_residential_treatment/
105,What happens to you if someone uses the silent treatment to punish you?,,1649306750.0,False,3,3,fashionkilleer,None,ty57v3,https://www.reddit.com/r/BorderlinePDisorder/comments/ty57v3/what_happens_to_you_if_someone_uses_the_silent/
106,Need help explaining treatment goals to therapist ASAP,"During my assessment with my new therapist she asked me to come up with treatment goals. I have been recently diagnosed with BPD, ADHD, PTSD, anxiety and ""mood disorder depressive symptoms"". I have had a lot of trauma throughout my life and my father recently passed away in February. We hadn't talked for 2 years bc he was basically drinking himself to death and too toxic for me to deal with. His death made my whole life flash before my eyes and I was angry about my existence and upbringing and full of negative memories. I felt like if I wasn't worth staying sober for my parent then I'm pretty dang worthless. Extreme anxiety has been almost constant since the holidays. I have pretty classic BPD symptoms, emotional problems, abandonment issues, self harm etc. It feels impossible for me to sit and relax.

I'm not sure how to put goals into words or how broad or specific should these be? I feel like there's so much wrong with me but how do I turn it into goals? Any help or examples will be much appreciated!",1620679305.0,False,2,2,No-Ideal-8285,None,n9fiul,https://www.reddit.com/r/BorderlinePDisorder/comments/n9fiul/need_help_explaining_treatment_goals_to_therapist/
107,Ketamine Treatment.,"I did my first two round of Ketamine therapy on 04.06.19
Here’s a update of what I can remember, I made it as brief as I could, day of treatment.
I am sick and have been taking some medications for a cold so this could have set me up with a bad experience, the following could have as well- getting two in one day, not having my husband with me and knowing my mom’s doubts about the place. She thought it was a weird place (more alternative vs doctors office) so maybe I felt like I shouldn’t had felt comfortable. Only 3 out of 10 experience dissociative episodes and I did. Also nausea/vomiting isn’t common but I also had that and was given nausea meds which did help a little until the second treatment but me being nervous and sick could have caused that as well. 
I don’t remember much of it except getting dizzy then being gone, then coming to here and there and being very confused while trying to find suitable calming music and trying to figure out if I still had my headphones on and if I was hearing music or was hallucinating, I felt as if I was being pulled between two worlds and in one world I wasnt really me, I was never married and everything was more if a simulation. Everything was very elongated and drawn out in both terms of time and physical objects. It was one dose of 30mg and a 40mg round but he wouldn’t had done a second round of the nurse had told him I got sick, I may request a lower dose in future treatments if possible because I’m not sure how this works. I had pretty bad PTSD from a traumatic health experience but it’s not uncommon for stuff like that to surface. I honestly think it would have been a better experience if I would have just done one dose, had my husband instead of parents with me (fear of being judged or saying stupid things) and if the setting/building had been more professional vs alternative hippy style. Unfortunately I don’t think I can get the remainder of the $800 left but I’m going to ask for maybe a lower dose on my next sessions and will express my fears better of not being monitored properly as my O2 kept dropping. 
I had a lot of factors against me today but I’m still hopeful despite it being quite scary but I’m not against anyone else trying it and definitely think it’s worth it.
-Day after update, I don’t feel a tremendous difference but for once in a very long time I’ve woken up not depressed and not with a feeling of anxiousness and I’m able to accept things that would usually trigger a lot of anxiety like the stack of dishes. Also my mental health usually suffers x2 when I’m sick and I’m feeling quite chatty and happy to hold a conversation! 
My husband should be able to go with me the remainder of the treatments and I’ve requested he video me so I can observe my own process.
-04.10.19-
Despite being sick... actually considering also being sick which usually messes with my brain/mental health to the point I’m a dysfunctional mess whenever I’m sick, I’m actually doing really well mentally. Low does such as mine only last a short period but I really think the Ketamine worked and it’s been such a gift not feeling like I’m in a hole I’ll never get out of ❤️❤️
Next appointment will be next Wednesday, they preferred to do all six within a week but I can’t given my distance from the treatment center and issues with work not allowing requested days (it’s a tourist town thing) for this month, just the standard two days off. Had I known this about the treatments prior my first appointment I probably would have waited.",1554932615.0,False,9,2,saturnine_celeste,None,bbrt3v,https://www.reddit.com/r/BorderlinePDisorder/comments/bbrt3v/ketamine_treatment/
108,How to approach BPD Silent Treatment?,"The amazing, smart, kind man I started seeing 6 weeks ago told me two weeks ago that he has BPD. He's in therapy, he's on meds, he's working hard and I can tell. I also know that no one else in our friend circle knows this. In fact, in the 6 weeks we've been seeing each other he's poured his heart out to me and I've seen a side of him I never saw when he was around our friends. I care very deeply about this guy and I want to support him....but man am I exhausted.

Last week I was getting sick. I felt so crummy and didn't want to tell him, because quite honestly I felt awkward doing so. Unlike him I don't share quite as easily, if at all. I had been working on this with him, but we both are so different in how we communicate. Midway through our text conversation I told him I was sick, on medicine, feeling awful... and he didn't say anything. I felt weirdly awkward and betrayed. I wanted him to ask if I was ok. I waited an hour and he didn't respond so I said it was a little mean for him to not say anything. 6 am the next day (way before I was awake) he texted back that he had been asleep, adding ""...jeeze"" at the end. I could tell he was ticked off. I felt bad and immediately apologized, but I think my clinginess or me calling him mean (probably the second thing) triggered something.

I had been working on consistent communication after reading about BPD and trying hard to do my research, but for two days he didn't respond to any of my texts (two a day, nothing major or clingy, just random things like ""did you like that show?""). I gave up after day 2, too sick and tired to keep reaching out. I've now been silent for 3 days and I'm unsure of what to do. I don't want him to feel smothered, but man I could have used a little bit of support over the past 5 days. He's an inconsistent texter and sometimes won't say anything until he sees me next, then he'll mention it. I haven't seen him in 2 weeks due to getting sick and I'm antsy and sad. Should I reach out? Should I wait for him to come to me? I'm trying so hard to help us both find some balance but I'm worried that it might not be found.

***Side note:*** *He does not know I've done any research on BPD, or that I'm trying to be consistent or, well, any of the work I'm putting in, which might be a part of this as well.* ",1533004107.0,False,6,9,SnipperSnaps14,None,93aje8,https://www.reddit.com/r/BorderlinePDisorder/comments/93aje8/how_to_approach_bpd_silent_treatment/
