,Title,Post Text,Post Creation Time,Content Type,Post Score,Number of Comments,Post Author,Author Flair,ID,URL
46,"I feel like I won't ever get the treatment I need, can anyone relate?","So I've recently moved to the UK and I'm finally on the NHS. I've been trying to get mental health support (particularly DBT or talking therapy) and I've been referred on to different places 3 times now because the services specifically don't treat BPD and dual diagnosis patients. If I had lied and just said I was depressed I'm sure I'd get treatment instantly. Idk I might be too sensitive, I've also tried getting treatment privately with medical aid but the same thing happened with 2 doctors and one therapist. I feel like a monster that nobody wants to help me. I'm sure it'll come right eventually but I've attempted suicide once his year (over stupid shit - I kid you not, I was having wifi connectivity issues and decided that was enough of living 😂 sorry but I do chuckle about it now.) And I'm desperate for help and am prepared to work with a therapist to actually change the way I cope with life. 

Does anyone else feel like treatment is difficult to get? 

BTW back home, it was rarely an issue but I feel so rejected here. Its actually caused me quite a lot of distress",1687695391.0,False,14,12,chronically-iconic,None,14ikugp,https://www.reddit.com/r/BorderlinePDisorder/comments/14ikugp/i_feel_like_i_wont_ever_get_the_treatment_i_need/
47,treatment hub rejected me,"I’ve been in a vulnerable place this week; my doctor (he is nice) and my care coordinator were worried about me on the phone so they gave me an urgent irl appointment. I clung to the idea of seeing the doctor in real life. 

it was meant to be today but when I arrived, reception said my doctor is sick and they ‘tried to contact’ me to tell me not to come. but I have zero missed calls on my cell, zero on my landline, no texts or emails, and I’ve been by my phone all day. they lied. they did NOT contact me. I feel like all they ever do is lie, to me specifically, it feels like they exist just to taunt me. this is the SECOND time that I’ve driven to the treatment centre only to be sent home because of their mistake. I trusted them. I HATE them for leading on someone with bpd who is so sensitive to rejection and change, and not offering any help for me to feel stable again. I feel so vulnerable. (TW) as soon as I got in the car after they told me to go away I self harmed. I don’t know how to recover from how upset I feel about this. I’ve been clinging to this appointment. I survived the last few days by thinking I would see the doctor soon, and I don’t know how to wait any longer",1661954789.0,False,3,2,babysaints,None,x2eixt,https://www.reddit.com/r/BorderlinePDisorder/comments/x2eixt/treatment_hub_rejected_me/
48,Hope? Treatment?,"I've got my diagnoses, been through DBT, got put on SSRIs (previously) and mood stabilizers (currently), and seen countless therapists and psychiatrists... yet I've never actually recovered. I'm really starting to lose hope with this disease. I just want to be stable for once in my life. I feel like I've been living my life in constant chaos since I was 12 years old (20 now).

What other kinds of treatments should I try, or in general what should I do? I'm really losing faith in the systems we have in place for mental health treatment.",1645566813.0,False,3,4,dogsayscow,None,syzh7d,https://www.reddit.com/r/BorderlinePDisorder/comments/syzh7d/hope_treatment/
49,treatment,do antidepressants help you heal/cope? or is just therapy/dbt enough?,1646437326.0,False,2,1,Confident_Towel_4394,None,t6w83p,https://www.reddit.com/r/BorderlinePDisorder/comments/t6w83p/treatment/
50,How did you begin treatment for your BPD?,"A little overwhelmed. Mid thirties physician here just diagnosed with BPD.  Aware of the treatments but not really sure where to begin except a lot of self love. 

Would love your tips/stories as I begin to navigate this. Thank you",1664299634.0,False,13,10,NoMoreCAMJV,None,xpmzg7,https://www.reddit.com/r/BorderlinePDisorder/comments/xpmzg7/how_did_you_begin_treatment_for_your_bpd/
51,ADHD treatment (medication) alleviated my bpd symptoms,"Tw: very short mentions of sh and suicidal ideation

I am in a stationary dbt program atm. 
I was diagnosed with bpd before, here I was also diagnosed with ADHD (I asked to be tested!) 

I decided to try methylphenidate, because a lot of my friends here told me they really benefit from it. I started with only 20mg in the morning (now I take 15 in the morning and 5 in the noon) and from the first day on my bpd symptoms became so much better.

- my mood swings are less often and they are not near as intense as before
- My urge to sh became almost non existent
- Suicidal ideation decreased enormously 
- All in all I seem to suffer less 

You might say, this is also due to dbt. And it is! Dbt is a lot of hard work, it is really painful, but it works and it pays of for me. I am for ever grateful for the chance to make this Dbt program. 

Nevertheless those immense improvements i mentioned above occurred exactly with the beginning of my methylphenidate treatment. 

Bpd and ADHD symptoms often overlap. A high amount of people with bpd have ADHD, and a lot of kids with ADHD develop bpd. 
If you have any chance, I recommend you to get tested for ADHD. It changed a lot for me in the past three or four weeks. 
I am excited how my journey with methylphenidate continues, I might give you guys an update in a year or two if you are interested!",1661849179.0,False,4,7,psy-snoop,None,x1dufp,https://www.reddit.com/r/BorderlinePDisorder/comments/x1dufp/adhd_treatment_medication_alleviated_my_bpd/
52,"No matter the amount of treatment I get, I still can't maintain friends.","Not for any other reason than we just drift apart, I can't relate to them well maybe? 

I don't know. I try to be upbeat, positive, kind. I've done EDMR, and DBT. I've never been hospitalized. I feel pretty ""in remission"" other than not being able to maintain long term friendships. 

Is this a problem everyone has? Is this a social media thing? Are other people just actually busy? How do you know if someone doesn't want to be your friend anymore and they're just being nice? 

I wish this wasn't a problem. It's the most painful one for me and one I can't seem to shake.",1687742673.0,False,9,4,Superb_Ad_6084,None,14j3cc9,https://www.reddit.com/r/BorderlinePDisorder/comments/14j3cc9/no_matter_the_amount_of_treatment_i_get_i_still/
53,Has residential treatment helped with your BPD?,"So honestly I’m at rock bottom rn. And even my typically healthy relationship is also not doing great, due to my mental health depleting, and making me even more codependent. I’ve been on a dark spiral for over a week now, the most suicidal I’ve been in a long time. I relapsed after 3 years free of SH, and I ended up in the psych for a couple days. That was 3 months ago. Anyways, I’ve decided I want to go to residential for a couple months. I did for like 3ish years as a minor. But I think this time if I go as an adult, and chose the help. It will actually work. Idk, what’s y’all’s thoughts. Is residential actually effective for BPD? Will it help if I actually want it to? Tysm in advance.",1669849639.0,False,4,2,Witchyvibes667,None,z96jey,https://www.reddit.com/r/BorderlinePDisorder/comments/z96jey/has_residential_treatment_helped_with_your_bpd/
54,Those who have had successful treatment what worked for you guys?,"I’ve been dealing with this for a very long time. I used to abuse drugs and alcohol in order to cope and feel something but it only made my life worse. I entered a 12 step program, which I’ve been clean for 15 months now. But in the last month or so I feel my symptoms have gotten dramatically worse and I’m seeking any help that could be offered whether it be DBT, CBT or even medication. I’d just like to hear what has worked for you guys and if these things really make life easier",1684595202.0,False,3,2,TheMostAwkwardLion,None,13mxdi0,https://www.reddit.com/r/BorderlinePDisorder/comments/13mxdi0/those_who_have_had_successful_treatment_what/
55,Has anyone gotten Transcranial magnetic stimulation treatment?,,1651185194.0,False,2,10,bumblebee5015,None,ue758y,https://www.reddit.com/r/BorderlinePDisorder/comments/ue758y/has_anyone_gotten_transcranial_magnetic/
56,Treatment fatigue/hopeless despite treatment,"(TW- very minor warning. I just mention negative behaviors)
Gonna keep this short. I have been in some form a treatment at all levels for two years. Despite everything from therapy, IOP/PHP, and even residential, I find myself struggling to apply skills or see any meaning in getting better. My most serious concern is a reliance on self injurious behaviors and chronic suicidal thoughts/attempts. My therapist is considering referring me elsewhere as she is not seeing progress and she can only tolerate my self injury from a  professional standpoint to a certain degree. Does anyone else find themselves burned out or fatigued from treatment? I am just finding it hard to be hopeful and keep going when I don’t even feel treatment is an option.",1569869375.0,False,3,5,Fallowart,None,dbg8aw,https://www.reddit.com/r/BorderlinePDisorder/comments/dbg8aw/treatment_fatiguehopeless_despite_treatment/
57,Treatment [NY],"Has anyone been cured of this? What are some things that helped to completely cure you? Any home remedies? What would help a man in his mid-30s? Counseling is too expensive, cant afford.",1637873941.0,False,1,2,chronicles121,None,r26bd5,https://www.reddit.com/r/BorderlinePDisorder/comments/r26bd5/treatment_ny/
58,has anyone done residential treatment?,"i’m doing a partial hospitalization program after 2 inpatient treatments and the psychiatrist brought up sending me to a residential treatment for about a year.

ive had 5 suicide attempts in a little over a year. lots of inpatient treatments at different hospitals. she thinks i’m getting out of control and am too much of a threat to myself. i have issues with keeping appointments and following through on my medications. short stays at inpatient treatments make me feel okay for awhile but it always wraps back around. 

i’ve struggled with suicidal ideation since i was 13 and had my first attempt at 14. once covid started, my life fell apart and started this cycle. i also have alcohol abuse problems that comes and goes so she thinks it’s a good idea to put me somewhere long term. there’s none in the state i live in so i’d be away from my family 

i’m feeling pretty hopeless. ive started believing i won’t get better. it’s been over a decade but these past few years have been really bad. i have possible bipolar as well (diagnosed w bipolar at 18 then last year told i have bpd instead, now they’re assuming i have both) 

anybody know anything about long programs like residential?",1652371850.0,False,5,3,notrachelmar, ,uo4meo,https://www.reddit.com/r/BorderlinePDisorder/comments/uo4meo/has_anyone_done_residential_treatment/
59,"Symptoms are similar, treatment is not","After struggling to fit my BPD into a little pathological box for years, i’ve started to change my perspective on people who experience these symptoms. 

Most of our fears are highly individualized, and we are highly unlikely to meet our own expectations, if any. This is why some therapists avoid  this disorder and pervasive thought cycles all together. They either think we’re nonnegotiable, or secretly agree with our hopelessness.",1661808726.0,False,2,1,19andoverdue,None,x10jdz,https://www.reddit.com/r/BorderlinePDisorder/comments/x10jdz/symptoms_are_similar_treatment_is_not/
60,Treatment Center Ideas,"Hi everyone. I struggle with severe bpd and bipolar tag teaming against me. I’ve gone to treatment many times for the bipolar, but they don’t think that’s going to get better without treating the bpd. Has anyone ever gone to a treatment center that has any focus on bpd? Double points if they do anything with bipolar. 23 hospital stays, 4 residential stays, a ton of php, and all kinds of other stuff hasn’t worked. I’ve done a ton of dbt. If anyone has any recommendations for my psychiatrist and I, that’d be nifty.",1646362209.0,False,1,0,CapitalSyrup8729,None,t68psx,https://www.reddit.com/r/BorderlinePDisorder/comments/t68psx/treatment_center_ideas/
61,Might actually be a good treatment plan?,"So I'm pretty excited because after pretty awful experience in inpatient a few months ago and just years of ups and downs and lots of downs My new therapist recommended this local treatment center that focuses on BPD, dissociative disorders, and other trauma-recovery concerns. Every conversation has been markedly positive- their staff seem attentive and responsive, and the intake questions seem relevant and actually tailored to my experience instead of past hospitals trying to hyperfocus on one tiny problem of mine because it was their specialty (ugh.) Anyway, I start October 3rd and this IOP lasts 4 weeks while still allowing me to go to work. I'm feeling hopeful and excited. Just thought I would share.",1663952898.0,False,3,1,Ok-Appearance3086,None,xm38kl,https://www.reddit.com/r/BorderlinePDisorder/comments/xm38kl/might_actually_be_a_good_treatment_plan/
62,Finishing Inpatient Treatment This Week,"For the past 8 weeks I've been at an inpatient facility to get a diagnosis, effective medication and a whole lot of therapy. I officially got a BPD diagnosis after my past psychiatrist told me I had ""traits"" but not the actual disorder...the program was DBT based so I have a foundation of skills to build off of and made some really fantastic friends while here.

I get out of the hospital on Thursday and I'm so excited but also so scared. I know I'm going to have my bad days but I don't want to feel like I'm regressing. I'm taking the steps to start an outpatient DBT program to continue my work and I feel like I have a good plan going forward...I'm still just so scared. 

I wanted to post in here just to vent to people who maybe understand. If anyone has any advice, I'd be more than happy to hear it. Overall, I feel like I'm ready, but there's always that voice in the back of my head that tells me otherwise. I try not to listen, but it's easier said than done.

Thanks for reading. xx",1647301054.0,False,5,4,blackivie,None,teb24p,https://www.reddit.com/r/BorderlinePDisorder/comments/teb24p/finishing_inpatient_treatment_this_week/
63,What are your experiences with residential treatment places ?,"Thinking about this for a family member who is currently in a hospital psych unit.  Would like to hear what places you went to, how long you stayed, how much it helped , plus any advice to make them more willing to do this ? Thanks in advance.",1663528373.0,False,1,4,mushlovePHL,None,xhpaiq,https://www.reddit.com/r/BorderlinePDisorder/comments/xhpaiq/what_are_your_experiences_with_residential/
64,pwbpd who are in treatment: what led you to get treatment?,Can you share how that came about? Did you take the initiative to seek help yourself? Or Did a loved one ask you to?,1607369076.0,False,1,3,Singngkiltmygrandma,None,k8ng4u,https://www.reddit.com/r/BorderlinePDisorder/comments/k8ng4u/pwbpd_who_are_in_treatment_what_led_you_to_get/
65,Treatment in the US pro-bono?,"I lost my health insurance and I make too much for government assistance. My policy was cancelled and by the time I was informed, I was no longer allowed to apply through any insurance. I haven’t been in treatment for almost a year. Therapists don’t understand that I struggle with DBT so that makes it worse for maintaining therapeutic relationships. 

What can I do?",1653289064.0,False,2,2,InternalConscious163,None,uvucgd,https://www.reddit.com/r/BorderlinePDisorder/comments/uvucgd/treatment_in_the_us_probono/
66,"Advice on treatment, please I'm desperate","I have borderline, generalized anxiety, social anxiety and dysthymia. I've tried CBT, a group based on CBT and one based on self compassion. I just finished one and a half year of DBT. I'm not getting a referral to some new treatment bcs I've been in treatment for so many years. 

I can't live like this and I don't see a way in which I can get better if I'm not getting treatment. I can't do it on my own. My mind is falling apart and I feel completely hopeless. I have dreams of what I wish my life was like but I feel like they're out of reach. 

All of this is literally killing me. Does anyone have suggestions for what further treatment I could search for or just advice in general. Please, I'm desperate.",1625041702.0,False,3,10,R4ven13,None,oaswoz,https://www.reddit.com/r/BorderlinePDisorder/comments/oaswoz/advice_on_treatment_please_im_desperate/
67,Lamictal (lamotrigine) as treatment?,"I have been on this for 1 year- 100mg. 

I’m beginning to doubt it does anything but I had a 3 hour assessment with a psychiatrist and he recommended I stay on it and increase to 200mg. 

Does anyone have experience with this medication used as a mood stabilizer? Did it help? Thanks",1612450785.0,False,3,10,ClearClam,None,lchfdo,https://www.reddit.com/r/BorderlinePDisorder/comments/lchfdo/lamictal_lamotrigine_as_treatment/
68,How to you guys are able to get a treatment and be able to work,"So in my country we have free health care but BPD is not being under any benefits pretty much and Im unable to get any socials because of that. I have to work to be able to maintain any kind of lifestyle and fortunately I'm working 9-5 corpo job remotely, away from people so even when I have episodes, no one sees it. Because it's till 5 it's extremely hard to be able to find any psychiatrist etc being able to take me as a patient (which I understand, they are people too and don't want to work till whatever late hour). Because of the disorder it's also hard for me to be able to be focused so long during the day - eating disorder as a one way of self harm. After work I pretty much need a nap to live. As I'm not seeing a doctor now I'm scared to take meds regularly as I would run out of them anyways and wouldn't be able to get more of them, I'm super scared of begging unknown doctors for more meds.  
I was on sick leave some time ago because I was in a therapy. About 12 weeks, during day we had meeting and workshops with psychiatrists, good stuff, I was not afraid to take meds then because I had doctors to ask for more if I run out of them. So in the end it was very helpful but every nice thing has to end I guess. 
So I'm not really sure that to do. I'm unable to see any doctors because I work but also I started to have episodes again and it's extremely hard to work. Doctors say bpd are unable to get any kind of socials because it would not benefit them and would make them actually worse as they wouldn't be doing anything regarding their condition but I feel like it's such an ass statement. 
How do you guys manage to get any kind of treatment and work daily? Its so tiring to have episodes and be in agony and also pretend that everything is fine to deliver daily target. It's not like they would care or understand anyways and money is always a first priority. 

Sorry for longer post, I guess just wanted to overshare. 

The question is as above in the title, how to be able to work and be able to see a doctor",1689996128.0,False,1,0,Scared-Way-9828,None,1568r80,https://www.reddit.com/r/BorderlinePDisorder/comments/1568r80/how_to_you_guys_are_able_to_get_a_treatment_and/
69,FP and the silent treatment,How do I cope with this? It feels unhealthy to do this to my FP but I feel like I need to withdraw to avoid further damage. I'm ashamed of my emotions,1637960782.0,False,3,4,Dr_Nabiscuits,None,r2wt8e,https://www.reddit.com/r/BorderlinePDisorder/comments/r2wt8e/fp_and_the_silent_treatment/
70,My wife has bpd but refuses treatment,"How do I deal with it? I'm not neurotypical myself, but I have asperger's, which makes it... extra hard for me to understand her and what she needs. She will go under the mood changes, and I can't tell how to make it better. She's constantly telling me I don't know how to help her and make her come out of the hole, but I've tried nearly everything. Even therapy, but, unfortunately, we got to a bad professional, with lack of ethics, who ranted about her life, and cried when me wife told about her traumas. She has had a complicated relationship with her mother, and lost her father young, but is a very rational and centred person, who doesn't like emotional reactions to her life and story.",1638270130.0,False,5,8,th0bard,None,r5kw5f,https://www.reddit.com/r/BorderlinePDisorder/comments/r5kw5f/my_wife_has_bpd_but_refuses_treatment/
