,Title,Post Text,Post Creation Time,Content Type,Post Score,Number of Comments,Post Author,Author Flair,ID,URL
0,In patient treatment ,Has anyone here had to receive inpatient treatment for their borderline? ,1713709621.0,False,7,7,purpleplatypus29,None,1c9j6iy,https://www.reddit.com/r/BorderlinePDisorder/comments/1c9j6iy/in_patient_treatment/
1,Treatment centers in South,"Hi, I am the bf of a girl with bpd, and it is a situation that may require daily therapy for a time. (Years of trauma, would take decades at once every 2 weeks). I don't want her going to some awful ward. Any suggestions? If not, any ideas for stuff outside of that?",1713902591.0,False,0,0,matthewmdr4,None,1cbedgl,https://www.reddit.com/r/BorderlinePDisorder/comments/1cbedgl/treatment_centers_in_south/
2,I think the current treatment for BPD is actively hurting healing,"People with BPD are have very, very strong emotions and difficulty trusting those around them. Well, in a society where everyone values thinking over feeling and lies constantly in the name of “being polite” *that makes sense*. The current treatment tries to force those with BPD to conform to a system that actively harms the members by teaching conflicting lessons like “don’t seek external validation” but if others don’t like what you make/do then it’s worthless?? Be yourself but be insulted if “yourself” goes against the norm for those around you? Trust people’s words but their actions actively do not match their actions because in public people say things to be seen a certain way while behind closed doors they feel no need to follow their words because we are a society of shaming rather than holding *ourselves* accountable. How can we ever fit in when we are taught to do one thing while we actively see the opposite being done ? The confusion keeps us from healing because society itself is fucked and we’re being judged by the standards that society.

Anyone feel similarly? I feel I’ve healed by rejecting the lessons taught by people who don’t even follow them and listening to my feelings—NOT MY HATRED. Hatred is a warping of feelings, I am not saying to follow your lust or anger or need to divert pain, but the only thing that is objective to us is our own feelings and when we base our reality on the words of people who lie—intentionally or because people refuse to acknowledge their own fault—our reality is gonna constantly be falling apart. We need to find strength in ourselves not those who “should” support us and repeatedly hurt us by failing to. Empathy and support have been lost, people want to do what’s easy and refuse to legitimately feel pain and support others. It’s so much easier to push people onto therapists or suicide hotlines than share your pain, but pain has to go somewhere and in this society that refuses to genuinely connect it’s not.

Have you ever been helped by someone pushing you to a therapist or hotline when you reached out to feel cared for? Humans heal through connection, not transactions. Therapists help us hide our pain and claim we are incurable. We have so much pain that needs to be accepted, and it is so hard to do alone, and when our support pushes us to someone who treats us medically but will not shoulder our pain with us we will not heal.

In pain is growth, it is just so hard to push through alone.

—

I have typed a ton in the comments. I’ll try to keep up if people keep replying, but if you are genuinely interested in hearing more feel free to message me directly",1671711287.0,False,33,121,OnceNotLost,None,zskr16,https://www.reddit.com/r/BorderlinePDisorder/comments/zskr16/i_think_the_current_treatment_for_bpd_is_actively/
3,Can lying be stopped with treatment?,"I’m looking for hope.

Everyone with BPD is different, but I was wondering if anyone here with BPD could tell me about their experience with lying.

I primarily want to know if, you lied regularly in your intimate relationship, were you able to stop with treatment.

My pwBPD lies often and without difficulty, generally to avoid conflict, rejection and taking responsibility. She’ll lie even once she’s caught in the lie and do a sort of trickle truth. She’ll be adamant she isn’t lying even when she is.

When I find out she lied or she comes clean after I press her on some inconsistency she can’t explain away she’ll tell me she hates herself for lying. She tells me she doesn’t want to be a liar and that she knows it’s morally wrong.

She’s recently diagnosed (last few months) and has started DBT and a treatment program for BPD.

Was anyone here who lied regularly able to stop with treatment and prioritize the truth and honesty?

Thank you in advance for sharing your experience. I know it can be incredibly difficult.",1701892521.0,False,15,20,ThrowAwayRS7822,None,18cckf3,https://www.reddit.com/r/BorderlinePDisorder/comments/18cckf3/can_lying_be_stopped_with_treatment/
4,Borderline Testing & Treatment in Arizona,"I have some, who knows how many, cluster B traits and need to find a Psychiatrist to test and help find treatment...in Arizona. 

I'm a little shame based as mental health professionals can be a little avoidant about Borderline- I have attended seminars for professionals ( ""Oh shoot, it was then I realized I had a Borderline in my office!"" )

Anyone have some knowledge to share?",1714170543.0,False,2,1,Interesting_Tale_831,None,1cdykva,https://www.reddit.com/r/BorderlinePDisorder/comments/1cdykva/borderline_testing_treatment_in_arizona/
5,Anyone here had treatment for phobias?,"TW: mention of phobias, spiders

I have arachnophobia which can cause hallucinations, especially when I’m trying to sleep and it’s been an issue for a very long time and I never really thought about seeking help for it. I kind of just saw it as a thing I have to live with.

I game quite a lot and the unfortunate thing is that spiders seem to be in like, every fucking game I want to play. I love horror but spiders play a big part in that genre and I have to avoid titles so I don’t get triggered and damage my mental health.

I decided that I don’t want to live like this anymore as I also like being around nature and forests but have avoided it due the fear of coming across spiders. Also, tbh, I think they’re rad but I’m just shit fucking scared of them. Close ups and their eyes are what freak me the fuck out the most, but I also think I have a bit of trypophobia and their eyes remind me of that.

I had a google and it said exposure therapy is most effective for phobias but it’s not recommended for personality disorders, so I want to discuss treating it with my counsellor this week. I was wondering if anyone has had successful treatment, their experience and what they found most effective for them.",1713174154.0,False,2,2,badsbee,None,1c4i5du,https://www.reddit.com/r/BorderlinePDisorder/comments/1c4i5du/anyone_here_had_treatment_for_phobias/
6,Treatment,"Is there anyone here who is military or military spouse? I’m a military spouse and I’m terrified of seeking help from the base hospital behavioral clinic. It would be strictly psychiatric care because that’s all they offer here (overseas). I have been stigmatized before and I just don’t want it to happen again. 

I’m just looking for anyone who has had experiences with the military and mental health care / being prescribed medicines and like if you have any tips or words of advice please. 

🫶🏻",1698133814.0,False,2,1,Key_Scientist3640,None,17f7fay,https://www.reddit.com/r/BorderlinePDisorder/comments/17f7fay/treatment/
7,where can i go for treatment?,i live in Northest Indiana. right by Chicago. i need seriously help. i don’t want to kill myself. i just want my life to get better. i want to go away. and not to a psych ward. is there a way? somewhere that won’t drain me financially? i need intensive treatment. i’ll be so sad to leave my dog but i seriously need this.,1710221351.0,False,3,2,slutforsynth69,None,1bcpjv8,https://www.reddit.com/r/BorderlinePDisorder/comments/1bcpjv8/where_can_i_go_for_treatment/
8,"BPD - Signs, Symptoms, And Treatment Options",,1712713333.0,False,1,0,theworldthinks1,None,1c09mzt,https://theworldthinks.com/understanding-borderline-personality-disorder/
9,Treatment seams too expensive,"When you’re at your lowest and slightly unhinged, it almost feels like that’s done deliberately to make it harder for anyone not wealthy to be able to get proper help. How do I cope?",1698272134.0,False,6,8,ZealousIDShop,None,17ggsji,https://www.reddit.com/r/BorderlinePDisorder/comments/17ggsji/treatment_seams_too_expensive/
10,Treatment programs,"Hello,

Has anyone been to a treatment program that really made a difference for you? Thank you.",1692458201.0,False,1,4,AdExternal976,None,15viwya,https://www.reddit.com/r/BorderlinePDisorder/comments/15viwya/treatment_programs/
11,need advice: i need treatment,"i’m moving soon and i’m looking to find real therapy for my bpd but i’m not sure what website is legit for finding dbt. all the websites claim that they have dbt but then i delve deeper and they don’t. any recommendations?
or if anyone knows of legit help in the washington dc area?",1703359060.0,False,2,1,bigtiddiemama,None,18pcsm7,https://www.reddit.com/r/BorderlinePDisorder/comments/18pcsm7/need_advice_i_need_treatment/
12,Desperate for Adequate Treatment,"I'm truly at the end of my rope with my bpd and the chronic, treatment-resistant suicidality. It feels like the system in Ontario has repeatedly failed me and I just cannot get enough help here.

Does anyone have recommendations for inpatient or residential facilities (can be in the US or Canada just not Ontario) that are good for treating chronic suicidality?",1700450023.0,False,1,0,chronicallytoomuch,None,17zewof,https://www.reddit.com/r/BorderlinePDisorder/comments/17zewof/desperate_for_adequate_treatment/
13,Ketamine Treatment,"Hi everyone. Long time lurker since my diagnosis, first time contributing. I'm booked in next week for my intake screening for ketamine as I've dealt with depression, anxiety, undescribably dark thoughts, PTSD from a near death experience and of course, BPD. 

I'm wondering if anyone has had the treatment done and what your experience was like, and how did you feel after? I'm currently on a heavy dose of medications that maybe I would like to cut down if I was feeling right again, whenever that was. I'm looking at the Ketamine Treatment as a last resort but I've read too many good things about it online. Any redditors with experience that can share their story?",1690502934.0,False,5,2,ButteryCottonNipples,None,15bhxvn,https://www.reddit.com/r/BorderlinePDisorder/comments/15bhxvn/ketamine_treatment/
14,How to approach suspected BPD and seek treatment?,"So, okay - I have a loved one who I’m 99.99% sure is BPD and the frequency of symptoms and presentations and issues have worn me down.  I want to help, but I can’t deal with the chaos anymore.  It’s become an every day thing now, and I don’t know what to do.  

Splitting occurs multiple times a day.  Idealization/laughing/love > don’t speak to me ever again.  

I’m at my wits end here.  I’ve gotten Dr. Daniel Fox’s YouTube page and want to start there with them, figuring it’s a good starting point.

But how have you folks brought this discussion forward in pursuit of a treatment plan?


TFLMS",1700253565.0,False,6,10,Connect_Glass4036,None,17xohck,https://www.reddit.com/r/BorderlinePDisorder/comments/17xohck/how_to_approach_suspected_bpd_and_seek_treatment/
15,Silent Treatment,Anyone else completely ignore a person when they are P.Oed at them? I’m talking not even small talk or an attempt to be semi friendly. I do this because if I speak to them I’ll get so heated and I’ll go on them saying a bunch of awful things about them. I had a coworker run her mouth to my boss about my health problems and I had to stay at home and lose money because of her. To me silent treatment is better than that.,1690574189.0,False,6,0,Wooden-needle2017,None,15c7gba,https://www.reddit.com/r/BorderlinePDisorder/comments/15c7gba/silent_treatment/
16,I think my therapist thinks I’m treatment resistant ,"I try my hardest, but my BPD is so bad. DBT isn’t working anymore and I’m backsliding so bad. I need to do other therapies for my trauma and autism but I can’t because I work a full time job. I don’t know what to do anymore. I feel like she’s going to give up on me.",1709750033.0,False,0,0,Curious_Problem1631,None,1b87bw3,https://www.reddit.com/r/BorderlinePDisorder/comments/1b87bw3/i_think_my_therapist_thinks_im_treatment_resistant/
17,"Diagnosed with BPD but not ""allowed"" trauma treatment?","I was wondering if anyone else had experienced this. I was diagnosed with BPD and potential CPTSD, I told them that I was most keen on getting treated for the CPTSD 'cause I experience flashbacks and don't want the memories to haunt me anymore. They said I ""Couldn't handle it"", because I have BPD and can't control my emotions. So I went on a specific BPD treatment first called MBT, for one and a half years, it was great progress for my BPD. Now out of that, I still feel my trauma haunting me and once again I asked them can I now get trauma treatment? They seemed reluctant, said it was hard and if I was sure I could handle it. 

??? I worked my ass off for 1.5 years to ""handle it"".",1693577892.0,False,19,14,MildlySatanicMonster,None,1678f92,https://www.reddit.com/r/BorderlinePDisorder/comments/1678f92/diagnosed_with_bpd_but_not_allowed_trauma/
18,Borderline brother refusing Cancer treatment,"My beautiful brother has addiction issues and diagnosed Bipolar and borderline. He’s also just been diagnosed with testicular cancer and suspect it’s spread to his lungs. He’s overwhelmed by this and hasn’t got his head around treatment and so hasn’t had any medical interventions. I’m terrified for him but feeling helplessness. Any advice?
I’m sure borderline is playing a huge role here. What can I do? Thank you. (In NSW Australia for reference)",1696504610.0,False,2,3,Content_Atmosphere82,None,170fb32,https://www.reddit.com/r/BorderlinePDisorder/comments/170fb32/borderline_brother_refusing_cancer_treatment/
19,"Has anyone tried other treatments like ketamine infusions, ECT etc?","I'm beyond frustrated by this point. Tons of therapy, medical marijuana, various medications, but I'm still suffering so much that I wish I could just get my amygdala out so I wouldn't have to suffer anymore.

I've previously decided against ECT and TMS because, well, there's a lot of controversy around those two and I've heard mainly horror stories. I'm not gonna repeat any potential misinformation I've heard, but
it does make me hesitate a lot. I don't wanna develop more problems.

I'm currently looking into ketamine infusions. My doc put me on blood pressure meds (which have helped decrease the intensity of physical symptoms of anger for some reason) to regulate my blood pressure before the infusions. I'm really hoping the ketamine infusions work because I don't know what else could be done aside from the ECT and/or TMS.

So has anyone had ECT, TMS, ketamine infusions, etc? I'd like to hear experiences, whether good or bad. I'm just considering different options that could help",1683530497.0,False,15,37,theirishsquirrel,BPD Men,13bhaao,https://www.reddit.com/r/BorderlinePDisorder/comments/13bhaao/has_anyone_tried_other_treatments_like_ketamine/
20,How to cope until I get treatment?," Sorry  if any of this is incoherent or difficult to read, it’s very difficult  to make sentences that flow right or make sense but I'm just gonna try  my best.

I have had recurring  psychotic episodes for about 2 years now, alongside depression and  anxiety, and I have mananged it not too horribly until roughly half a  year ago.

I have been looking for  treatment for my mental state since then, mainly for the debilitating  psychosis that, as a few doctors told me, is likely caused either by a  combination of BPD and CPTSD, or the beginning stages of paranoid  schizophrenia (my biological mom has it so it's fairly likely that i  might too).

I have seen multiple  medical professionals in the past months and been assessed as high risk  due to the severity of my situation, rapidly worsening psychosis,  suicidal ideaction, etc. and given an urgent recommendation and referral  for inpatient treatment. Because the mental health system is so  ridiculously overstretched where I live though, I basically won't be  able to get any help for at least another 8 weeks. I have spoken to  countless psychiatrists, treatment falilities and so on in the past few   months, and got told over and over again ""sorry there is nothing we can  do for you, we just don't have the capacities"". Sometimes I'd get  referred to someone else, who would inevitably tell me the same thing. I  can't travel to get treatment, because in my country you have to get  treated in the same area you live.

I  fortunately have lovely family members in a different district, whose  house I legally ""moved to"" on paper, which is the only reason I was able  to get assessed at the last inpatient facility a few days ago. Even  with referrals from multiple doctors though, they told me that they can  only take me in 8 weeks at the soonest.

Until  then, I have neither therapy nor medication and honestly I'm very  scared. I have terrifying hallucinations and paranoia that makes  interacting with others incredibly difficult. Even holding a  conversation or stringing a simple sentence together is hard because I  am distracted by my hallucinations, mentally exhausted and/or  distrustful of other people.

Frequent  panic attacks and nightmares, emotional dysregulation and so on... I am  dissociated constantly and don't know whether I am awake or dreaming.

I  have been holding myself together more or less by self medicating with  things like kratom and weed to help me sleep at least a little and stop  me from freaking out 24/7 but it's a very flawed ""solution"" and  exacerbates certain symptoms. Recently this seems to be working less and  less. I spend increasingly more time in that freaked-out state of  impending doom and unable to distract myself from the scary things I  see, hear and feel all the time.

I  can’t do very much, all my energy is spent on trying to keep myself  safe-ish and that doesn’t always work. I frequently self harm to  distract from the overwhelming emotions or because I am so stressed out  by the whole situation. I have some friends but none of them understand  any of what I’m going through and I can’t find the words to explain  what’s going on. I used to be able to talk at least a bit about my  problems, but my paranoia tells me I can't trust anyone and even if im  in a less paranoid state, I just don’t have the mental capacity atm.

I  had to go on sick leave from university, so I spend my days at home  trying to keep myself distracted. I have a hard time going out in public  because of the constant paranoia and anxiety. Also the hallucinations  are incredibly distracting and I look visibly freaked out cause I keep  looking behind me, hearing voices, never knowing if an actual person is  talking to me or if I am just imagining it.

I  struggle immensely with nighttime. The hallucinations get stronger and  scarier and more difficult to ignore and I find myself having tons of  sleepless nights cause I'm just too scared to fall asleep, or I get  woken up by terrifying PTSD nightmares and won't be able to sleep after  that.

I have a general  practitioner who prescribed me antidepressants and benzos in the past,  but isn't comfortable with giving me anything antipsychotic. And  honestly I wouldn't want her to just give me her best guess, cause  multiple things she prescribed me in the past didn’t help and made  certain things worse (the benzos caused intense dissociation that never  went away and then a psychotic episode when I stopped taking them, even  though I was taking them as prescribed)

I  don't even have an official diagnosis for what’s currently going on  yet, apart from BPD, generalized depression and anxiety disorder, that I  got diagnosed with a few years back. The inpatient place that I am on  the waiting list for will do more diagnostic tests and prescribe me the  meds when I get there, but until then I have nothing.

But,  as scary as my situation is, it can hardly be unique. I’m sure I am not  the only one who has had to wait for treatment in a horrible and  declining mental state like this, especially since the pandemic left the  system even more broken then it was before.

Is  there anyone who has been in a similar situation and can give me some  insight into how to cope until I can get help? How can I keep myself  safe? How do I survive 8 or more weeks like this, without meds or  therapy while my mental state seems to keep declining?

Any insight or advice is appreciated.",1698869902.0,False,7,4,montikot,None,17ll7mx,https://www.reddit.com/r/BorderlinePDisorder/comments/17ll7mx/how_to_cope_until_i_get_treatment/
21,Residential treatment in Florida,"Going to get treatment.
Anyone have experience with Banyans Mental Health program in Boca? 
Or with Pasadena Villa in Orlando? 
or even La Amistad?",1692921806.0,False,1,1,Other-Hedgehog-1178,None,160iwb4,https://www.reddit.com/r/BorderlinePDisorder/comments/160iwb4/residential_treatment_in_florida/
22,Online Treatment Programs?,"Hi all,

I'm waiting to hear back from McLean Hospital regarding their outpatient online program.... and I saw a comment saying they have a long wait list. I don't know if that's just their inpatient program, or the online one too, or how long I should expect to wait before hearing from someone.

Anyway, with as expensive as it is, I thought I'd ask if anyone has experience with that program or any others I should consider. I live in a very rural part of Oregon with no BPD options locally, and the self help books aren't helping much.

I've been able to control my behavior and impulses for 20 years (ok, for the most part 😬), but the emotional roller coaster, emptiness, irritation, and internal suffering have only gotten worse. I've tried every major type of medication, EMDR, 'generic' therapy, meditation, yoga/exercise, diet, and a 6 session IV/IM therapy assisted ketamine program that didn't seem to put much of a dent in it.

Does anyone have recommendations for remote programs that work? I'm looking for something intensive.

Thank you ❤️

UPDATE: For anyone interested, the McLean Gunderson program took a little over a week to get back to me, and it's not going to work out after all. You have to be in Massachusetts because of therapist licensing (I thought they had somehow figured this one out because it doesn't mention anywhere on their site) and the $8400 they listed online is actually $9000 (not covered by insurance) for the 6mo program plus another $1100-2300 per week that may or may not be covered by insurance, assuming you have insurance that covers out of state treatment, plus apartment/room rent. So like $20-30k minimum?

DBT Path at emotionallysensitive.com looks to have a decent online program, but without any of the therapy, again for state licensing reasons. That's on my backup plan list, though I might miss the next class start date...

So... I started looking for online DBT therapy in Oregon, instead of searching for BPD programs, and got a few hits of places that offer online group classes in addition to individual therapy and maybe couples therapy. I don't know if my insurance will reimburse for any of it, as they all seem to be self pay, but at this point, I might as well rack up the credit card debt, as my only other option seems to be just continuing to destroy my own life. Hopefully DBT will be enough of a starting point- I was really hoping to incorporate all the other stuff like mentalization and transference focused therapy....

Thanks all for reading - maybe this will help someone?",1683847545.0,False,3,0,colorfulnihilist,None,13f3q5f,https://www.reddit.com/r/BorderlinePDisorder/comments/13f3q5f/online_treatment_programs/
23,Seeking Inpatient Treatment for BPD in Florida,"Anyone have any experience or info on:
Banyan's mental health treatment center 
or
Celadon
?????",1692653831.0,False,1,4,Other-Hedgehog-1178,None,15xkzfg,https://www.reddit.com/r/BorderlinePDisorder/comments/15xkzfg/seeking_inpatient_treatment_for_bpd_in_florida/
24,Running Out of Treatment Options - Seeking Advice,"I'm losing hope that I will ever experience a benefit from mental health treatments, even though I actively seek recovery. I'm diagnosed with borderline personality disorder, PTSD, depression, anxiety, and ""highly likely"" have ADHD. I've been chronically suicidal since childhood.

In terms of psych medications, I've tried: Lexapro, Wellbutrin, hydroxyzine, Prozac, Zoloft, Pristiq, Venlafaxine, and am currently taking Lithium. I've done genetic testing to see how I metabolize different medications.

I've been doing the highest dose of Sparvato (ketamine) treatments twice a week for 2.5 months.

I've been in therapy every single year of my adult life. I've done partial hospitalization programs, intensive outpatient programs, and regular outpatient. I've tried both telehealth and in-person. I've tried individual and group therapy. I've tried CBT and DBT modalities.

I'm transgender and have attended LGBTQ+ support groups.

I'm currently in weekly equine therapy. 

I've done in-patient treatment eight times, each time at a different facility.

I feel discouraged that I've tried so many things and experienced zero improvement. What's still out there that works?",1692395208.0,False,2,4,Pony_Boy420,None,15uxdzd,https://www.reddit.com/r/BorderlinePDisorder/comments/15uxdzd/running_out_of_treatment_options_seeking_advice/
