,Title,Post Text,Post Creation Time,Content Type,Post Score,Number of Comments,Post Author,Author Flair,ID,URL
163,Doctors refuse to give me medicine,"Im yet again at the hospital... 7th time.

Doctors refuse to give me mood stabilisers no matter how much I beg and cry, next thing I might beg on my knees...

Apparently in my stupid ass country ""treatment of bpd with medicine is not advised""

Im done, if i have to go back to having the mood swings im not living anymore.

I will die here.",1644700021.0,False,63,73,internetcatalliance,:pride:LGBT+:pride:,sr19ye,https://www.reddit.com/r/BorderlinePDisorder/comments/sr19ye/doctors_refuse_to_give_me_medicine/
164,my gf doesn't know I have bpd," I've known her for a few months and I'm completely in love, we started dating recently and we talk about everything, including our traumas and psychological state. The only thing she knows is that I have ADHD. I take two medications: an antidepressant and a mood regulator, and I said I just had a severe depressive episode when I was a teenager, which was when I started treatment (this is true, I was diagnosed with bpd at 19). 
She is very empathetic, she asks if I took my medication, how my psychiatric appointment was, she respects my space when I want to be silent and she understands that I get angry easily but calm down just as quickly. I've had bad relationships and I've never been involved with someone so kind. She is not neurodivergent and has never experienced a depressive episode or anything like that.
The point is: she doesn't know I have bpd and I don't want her to know. We know what appears on the first page of google when we search for bpd and people with this disorder. I never know how to explain what it's like to have this without realizing that I feel like a horrible person. I trust her a lot, I want to cry with so much love I feel for this girl and my heart hurts just thinking that she could be afraid of my mind.
Do you guys think I'm wrong to hide something so important? I have been undergoing treatment for years and I am stabilized, I have small problems such as impulsive spending, irritability and self-destructive behaviors such as intense procrastination, but no aggressive thoughts that could hurt me or others. She knows about these problems and helps me with them, she is very calm and understanding and I'm sure she wouldn't break up with me because I have a disorder. Anyway, I don't want her to know, I know you guys understand why, but would you think it's bad for someone to hide it? Would appreciate the help",1706578132.0,False,6,13,hoplesb,None,1aec894,https://www.reddit.com/r/BorderlinePDisorder/comments/1aec894/my_gf_doesnt_know_i_have_bpd/
165,Knowing about it ,Does knowing about it make it harder to do treatments? Like I know lot about my mental health but can that be bad and like cause my splits to know how to hide and stuff like that so it isn't found and continues to get worse or just simply not found?,1712450697.0,False,0,0,AnywhereUnique6271,None,1bxr6da,https://www.reddit.com/r/BorderlinePDisorder/comments/1bxr6da/knowing_about_it/
166,"I'm a DBT psychotherapist, would an AMA be helpful?","Hi all!  


I'm passionate about treating BPD and have specialized in it for years as a therapist and professor. ( [https://www.thestudiolr.space/](https://www.thestudiolr.space/) ) I'm Buddhist and am on the board for Compassion Works for All, a nonprofit prison outreach program that brings mindfulness into the prisons. Obviously, in the US at least, our prisoners are struggling incredibly right now (they're 5 times more likely to get Covid).   


We're trying to expand our services nationally to get more mindfulness to them to bring at least a little peace in their misery. I'm donating proceeds from an 8hr training workshop on DBT and BPD on July 24th that's intended to educate clinicians, clients, and their friends or family members.   


If you're interested in what DBT is or having your family better understand what BPD is, it would likely be helpful for you. The donation for the full day is $100 to go to the nonprofit. There are plenty of volunteer opportunities available as well if you're passionate about bringing humanity into the justice system.  [https://www.compassionworksforall.org/events](https://www.compassionworksforall.org/events) 

&#x200B;

In addition to that however, I'd love to answer any questions that ya'll might have about DBT and BPD from a therapists perspective. (obviously I can't offer any treatment or treatment advice, but I'd be happy to give education.) I'm a total lurker for Reddit, so I have no idea how to get that set up, but if you're interested and someone could figure that out for me, just let me know!  


Much love - Stephanie  


P.s. I believe BPD is 100% recoverable, it's not a life, or death, sentence. It's a lack of healthy coping skills paired with high emotional sensitivity and an invalidating environment. All of that can be addressed and once you don't have the 9 diagnostic criteria you don't have BPD anymore! I love my BPD clients, they're some of the best people I know in the world. There really is hope if anyone is out there suffering.",1594474085.0,False,204,90,thestudio8,None,hp9yzy,https://www.reddit.com/r/BorderlinePDisorder/comments/hp9yzy/im_a_dbt_psychotherapist_would_an_ama_be_helpful/
167,I think I messed up,"So I’m a quiet borderline and I don’t have a history of violence/abusivness. A few months ago I started talking with someone (romantically) things were going fantastic, I was actually starting to feel happy and loved again. I told them I wanted to be completely honest and transparent when we started talking as to not throw our budding relationship away.  So 3 days ago I told them about my diagnosis with bpd and they reacted positively and supportively to it. Then I didn’t get a message until 24 hours later. I was hit with the “I think it’s better if we stay friends, and we focus on ourselves, mental health, and work/school. I wasn’t trying to lead you on or anything I just think it’d be better to stay friends.” Obviously I responded as positively as I could and accepted being friends. I feel so shitty, hating myself and blaming myself because I knew telling them would end this way if not worse, for some reason I thought maybe this time I’d be wrong, I should’ve known better. It’s not something I needed to say, especially since I’m really good at managing it and am in active treatment and take medications to deal with it. And they’re aware that I’m in treatment and I’ve left no toxic footprint in the time Ive had with them. I’m just so fucked up about it and I can’t stop thinking about how this wouldn’t have happened if I’d kept my damn mouth shut. Now I’m having dreams about them and how it would’ve been if I didn’t say anything. I feel like my chance of happiness is gone, I really was starting to love and feel loved by this person, it was the most positive relationship I’d ever begun forming. We got along perfectly and we clicked so well. I just can’t help but hate myself for choosing to act in a way that makes me feel so stupid and hurt. It’s just been the worst days of my life since, everything feels to be going down hill.",1709717620.0,False,9,11,no-life-crisis,None,1b7vnpq,https://www.reddit.com/r/BorderlinePDisorder/comments/1b7vnpq/i_think_i_messed_up/
168,can somebody please validate that what happened was wrong?,"To start, I am diagnosed with BPD, and I don’t know where else to post this. I just need people to confirm that this was wrong of them and never should have happened. I had to go to the ER, and the experience made me never want to see a doctor again. I can’t stop thinking about it, I felt so alone, abandoned, disrespected, and am left feeling traumatized. I don’t see my therapist til the 31st and I don’t know where else to turn to. Here is the full story. 

i was taken into the ER by my fiancee and my mom. We reported that I was experiencing severe abdominal pain, constipation, and i was unable to urinate. We waited in the waiting room but I was called back to the triage room within ten minutes. The nurse assessing me got my identity wrong, thought I was there for anaphylaxis. We corrected him, and he said his treatment plan for me would be to catheterize me and send me home to do an enema. I started to cry, because my pain level was so severe, and my stomach was so distended - I was terrified to go home without my bowel obstruction being removed. I could feel the blockage in my mid-abdomen, and I knew that a home treatment wouldn’t be effective. We were called back to a room, where they took my vitals are tested a vial of my blood. An ultrasound tech came in to do a bladder scan, and she said my bladder was incredibly full and needed to be drained immediately. We informed my treatment team that I have severe anxiety, and I’d need to be sedated in order to insert a catheter. They administered a half dose of ativan, and said we would wait 30 minutes to catheterize. I laid in the hospital bed, curled into fetal position. The medicine never kicked in, my anxiety overpowered it.

After about 45 minutes of waiting, my mom called the nurse over and urged her to start the treatment, because the doctor had warned us it was urgent that we catheterize in order to prevent kidney or bladder infection. The nurse rolled her eyes at my mom, and decided to wheel me out to the hall. Once in the hall, another nurse approached and said I could only have one visitor, so I chose my mom. After about ten minutes in the hallway (I was curled up on the bed and crying), the nurses started steering me away from my mom and said she “wasn’t allowed to come.” I wasn’t alert, I was confused and disoriented from pain - so I didn’t notice that I was being separated. 

Once I got to the private room, two nurses started moving around me very quickly. My family was right down the hall, pleading with nurses to let them join me. They weren’t being kept away from me due to policy, rather - the nurses said “They assumed I’d want privacy.” - even when repeatedly told otherwise. The ativan was not calming me at all. The nurses announced they’d be inserting a catheter, and without warning - started shoved swaps into my vagina while I cried. Nobody asked if I was alright. i was still confused and disoriented. They continued without a word, picking up the catheter and shoving it into my urethra without warning as I sobbed loudly and curled into a hall. I tried to close my legs but they did not stop.

Once the catheter was inserted, I sobbed harder, And the nurse started wiggling the catheter around inside me because “it wasn’t working right”. After about twenty seconds of struggling to get the catheter to work, r they suddenly decided to just rip it out and say “Your crying must’ve caused it to fall out. You need to stay still.” I cried harder in response to this. Then, without any recovery time - they rolled me onto my side and announced they were doing an enema. Just like before, they didn’t warn me or ask if I was okay while I sobbed. They ignored my sobs and inserted the enema anyways, not saying a word as I sobbed loudly and gripped the railing of my bed. They administered it and promptly pulled it out without warning, causing me to have an accident on myself and the bed. They left me in the mess, tossing me a packet of wipes. They told me to “lay there for ten minutes and then use the bathroom.” before they picked up their stuff and left me there. After 5 minutes, the pain was too intense. I sobbed and picked myself up to use the bathroom. When I finished, I wiped myself off and got dressed. I looked outside my room, hoping to find help or my family - but nobody was out there. I was still disoriented and my pain level was severe, so i slipped on my slippers and hobbled out to the lobby to find my family, since I was terrified and felt like my nurses had violated me.

I found a public phone in the hall, but it wasn’t working. I approached the front desk and said my family was gone, and that I needed them. The front desk worker scoffed at me, and said “you think I’m going to help you leave AMA?” I started to cry, but I continued hobbling around asking strangers if they’d seen my family. A nice woman offered to call them, so she did - and as she finished the call to my dad, my family came around the corner. I was overwhelmed with emotion. I started sobbing, saying “YOU ABANDONED ME!” Which made hospital security kick us all out. After the fact, my mom called to complain about my treatment. The nurse who violated me claimed I got “The red carpet treatment” And said I had been “cursing at staff members” (that did not happen) - I urged my mom to just give it up and hang up, and she did. Now that I’m home I’m traumatized. I’m afraid to use the bathroom. I’m afraid of doctors. I’m afraid of hospitals, of nurses. Every time I use the bathroom, I’m reminded of what happened and I start to cry.",1706152538.0,False,3,4,plantbasedpumpkin,None,19ezj23,https://www.reddit.com/r/BorderlinePDisorder/comments/19ezj23/can_somebody_please_validate_that_what_happened/
169,waking up wanting to kill myself,this life is not worth living. i do the treatment i take my medication and even in remission itd still be like this. id give anything not to wake up tomorrow. i just want to be done.,1673619879.0,False,75,24,throwyawa111,None,10avs26,https://www.reddit.com/r/BorderlinePDisorder/comments/10avs26/waking_up_wanting_to_kill_myself/
170,Unwilling adult child ,Are there any parents of young adult borderline kids on here? My daughter (19) is undiagnosed (for BPD). She has had GAD diagnosis since age 9. It’s been clear for a while that there is more going on and the lexapro is barely putting a dent in things. She’s great until there’s any kind of stressor and then it’s game over for days. She has finally acknowledged that’s it’s probably BPD but she refuses to seek treatment. Therapy “doesn’t work for her”. If anyone has any guidance on how they overcame this kind of situation I would be grateful to hear it. ,1710813110.0,False,1,11,AdIntrepid3406,None,1bi8pl9,https://www.reddit.com/r/BorderlinePDisorder/comments/1bi8pl9/unwilling_adult_child/
171,How do you get better? ,"Ugh. I am struggling so much
lately, loosing all hope. I am living in Canada and waiting for free DBT treatment. I have a therapist, however I do not find it very helpful. I missed my last appointment because of that. I experienced a job loss a couple months ago and since then i’ve just been spiralling. My BPD affects my all my relationships so much and I feel so lost in knowing how to get better. Life will be ok for a little and then it just get worse then ever. Any advice would be much appreciated 😭",1714517498.0,False,3,2,breezy_999,None,1ch6dvj,https://www.reddit.com/r/BorderlinePDisorder/comments/1ch6dvj/how_do_you_get_better/
172,Therapy vs. career (when we can't have both),"I'm currently struggling because I honestly don't know how my life is supposed to continue and I need some advice, or maybe just someone who understands me.

Little backstory for clarity. I'm 24f, and I've been severely mentally unwell since the age of 12. I've spent my teen years in and out of treatment and engaged in several really dangerous, self destructive behaviours in the past. Over the years there were good and bad episodes, I've been really stabile during some of these times, but crisis always managed to slip in, some minor and some major. I've been diagnosed with BPD at age 19, and I've been to inpatient DBT treatment twice since then. It has helped me a lot, but I've never completely finished a treatment cycle of 12 weeks because it always got to overwhelming for me during the end. The last time I tried was in late 2020, and unfortunately I haven't had any outpatient specialist treatment for my BPD since, because there's just no access to it in my area. 

A lot has happened since then. I've not SHed since 2020 and I'm not actively engaging in ED behaviours anymore. I'm able to live a seemingly normal adult life now and I've worked 9-5 since 2020. Even during difficult times I haven't relapsed anymore and I've now been clean for longer than ever before. But below the surface there is still a lot of shit I need to work on. My last two relationships have been pretty toxic and I had to deal with all of it by myself even though I would have really needed specialist help during those times. I'm still struggling, but it's all happening internally now.

Now, here's my current tricky situation:
I'm back in my home country after I've lived abroad with my (narcissistic) Ex BF for the last 1,5 years. I'm currently looking for a job, and over the last weeks the idea of going to the police academy developed in my head. I never thought I could do it in the past because I was to sick, but now that I'm in recovery my body is in great health (doctor confirmed) and I have no long term side effects from my ED that hold me back. I actually started working out and became pretty fit during the last two years. I really wanna do this, but there's still a lot of doubt in my head if I'm good enough for such a job and if I can do it. I also signed up for inpatient DBT again, and both the police academy and treatment would start in September. 
I'm not sure what to do now. I really wanna go ahead in my career and chase my dreams, but it would also mean that I couldn't go inpatient (aka have treatment at all because inpatient is the only option where I live) for the next 3 years. I'm also scared that someone with BPD as severe as mine is just not able to be a good police officer, even tho I really wanna try it at least. If I fail, at least I know I did the best I can. 
On the other hand I really wanna work on myself and continue to improve my mental health. I'm doing the best that I can by myself (reading books, using skills, bpd workbooks, meditation ect.) but I know that there's only so much I can do alone without professional help. If I start treatment in September it would be good for me, but it would also be another time where my mental health stopped me for chasing my dreams. I've lost a lot of opportunities to this disorder, and it still hurts to think where I could be in life today if I had taken them.
If you wanna share your perspective on this with my I'm very thankful. And if anyone out there knows, or even is a police officer with BPD please let me know, I wanna know if these people even exist!",1686655805.0,False,2,1,whothefuckamixx,None,148d7i0,https://www.reddit.com/r/BorderlinePDisorder/comments/148d7i0/therapy_vs_career_when_we_cant_have_both/
173,How do you tell if someone is a Favorite Person?,Is constant splitting with silent treatments on you an indicator?,1690214717.0,False,2,12,MacsPowerBike,None,158eugl,https://www.reddit.com/r/BorderlinePDisorder/comments/158eugl/how_do_you_tell_if_someone_is_a_favorite_person/
174,Why doctors are always changing my meds?,"27 (m) 
I’m kinda tired of not being ok with the medical treatment, my doctor is again changing me the medication because Ive been presenting from the last 6 months a hard and impulsive behavior with a lot of anxiety, mixed emotions, hyperactivity and lack concentration. 

I can say I’ve tried almost any antidepressant and drug, I’m worried of writing worse and worse because I remember since I started the medical treatment a lot of things changed on me, I was a funny guy, very anxious but I felt joy in life, now I feel only fear of life, of my future. I’m single and I’ve been single all my life, I’m afraid of having a partner, of sex, of sharing my emotions because I tend to over share with my close friends and sometimes I scare them. I use to screw what I do and I love to do, or I just get bored, my credit cards are overloaded, I never have money even if I have a good job in a good company, I feel angry all the time and I want to quit all the time.

So yeah, I know meds are not magical, I’m taking therapy but is not enough, I feel empty, I need to fulfill that emptiness with something, idk how",1698793611.0,False,3,6,CreepyMazapan,None,17ky2y5,https://www.reddit.com/r/BorderlinePDisorder/comments/17ky2y5/why_doctors_are_always_changing_my_meds/
175,Numbers on BPD,"I was just curious, so I searched the web for some numbers on BPD. I thought these might interest you too, so I decided to share them here. However all of these should be taken with a grain of salt since they come from different studies and articles and one of them is from a self help organization, that does not even name their sources.
Feel free comment your own, if you found some related statistics.

Prevalence:
In the US, 1.6% of the total population were found to have been diagnosed with BPD. It is asumed that the real number is higher. 75% of these were female (found pretty much the same share for other countries). However, this share is probably biased, since females are much more likely to seek out treatment. Among clinical patients in the US 20% were found to have BPD. 

Suicidality and self-harm:
According to data from a Germany 2023, the suicide rate among people with BPD is 5-10% (quite high), with its peak within the age cohort of 20-30 years. They also found that 60% had at least 1 suicide attempt in their life (70% according to US data). 69-80% injured themselves on purpose at least once.

Trauma and abuse:
40-70% according to the same German source have been mistreated and/or abused during childhood. 60-80% claim to have been subjected to sexual abuse. 

Employment:
50% of BPD affected people manage to find employment. Among those, 20% manage to keep their job and stay finacially independent for longer than 12 months, which equals a total of 10%, who stay employed. 

Prognosis: 
Nearly 50% of patients who recieved treatment did no longer fit the diagnostic criteria of BPD after 2 years. After 10 years it was 88%.

Sources:
Juurik et al, 2019:
https://journals.plos.org/plosone/article?id=10.1371%2Fjournal.pone.0220233

Salters-Pedneault, 2020:
https://www.verywellmind.com/borderline-personality-disorder-statistics-425481

Sansone & Sansone, 2012:
https://www.ncbi.nlm.nih.gov/pmc/articles/PMC3472897/

Borderline Selbsthilfe, 2023 (the German one without sources):
https://borderline-selbsthilfe.org/de/zahlen.html",1714015767.0,False,4,2,Ya_average_Doomer,None,1cchybv,https://www.reddit.com/r/BorderlinePDisorder/comments/1cchybv/numbers_on_bpd/
176,"BPD, OCD, ADHD and Depression","Hi, just for context I’ve been formally diagnosed with all except ADHD, which I’m awaiting an assessment on but suspect I have. Mine are overall relatively mild so not the worst, but was wondering what medication/treatment other people with this combo have successful used to deal with it? I’ve found that my issues have culminated with me only being comfortable lying in bed on my phone like a lazy bum, not wanting to work or go to social events due to several barriers. Thanks!",1710376863.0,False,1,5,yusuft99,None,1be81us,https://www.reddit.com/r/BorderlinePDisorder/comments/1be81us/bpd_ocd_adhd_and_depression/
177,Fess up bitches,"Who here is in BPD specific treatment? How many of you can afford treatment? Congratulations, you’ve been chosen to be my sugar daddy/mommy/sugar glider! And also get me some treatment, please. Por favor 🙏🏼",1650503254.0,False,5,6,Dryad_dreams,None,u8bhun,https://www.reddit.com/r/BorderlinePDisorder/comments/u8bhun/fess_up_bitches/
178,New BPD Diagnosis,"Hello gang. Happy to join you all. Over the thanksgiving break I earned myself a lovely little diagnosis of BPD. Honestly, it’s not a surprise. My late best friend was diagnosed just before she overdosed 2 years ago and she and I would always talk about how we experienced similar symptoms. (I know I can’t base myself off of someone else, but the personality traits really aligned) The only difference in us at the time is that her family could afford to send her to extremely expensive treatment centers and I was working to make ends meet. I have already found this page to be extremely helpful. Just knowing I’m not the only one going through this rollercoaster is helpful. I know DBT is the best treatment for BPD, but I’m wondering what everyone else’s experience is. I would really like to get into DBT group therapy, but from what I’m finding none in my area take any insurance? So I’m hoping just to find a therapist that specializes in treating BPD. Has anyone else found just individual therapy to be sufficient? Is there anyone that doesn’t do therapy and just relies on meds?",1701147461.0,False,3,1,devynation0011,None,185o1ti,https://www.reddit.com/r/BorderlinePDisorder/comments/185o1ti/new_bpd_diagnosis/
179,Ketamine?,"Does anyone here have experience with ketamine treatments?  They list PTSD as one of the things it is good for treating, and I know there’s a lot of overlap between PTSD and BPD.  Is ketamine also ok for BPD folks?  Any success stories or warnings?",1694364150.0,False,12,16,Jolly-Morning-6784,None,16f4xn9,https://www.reddit.com/r/BorderlinePDisorder/comments/16f4xn9/ketamine/
