,Comment,Author,Post
0,"Thank you for for sharing. A reminder: if you are seeking resources in your local area, please provide that in the post so that users can share appropriate links and phone numbers. *If you are in distress, please call 9-1-1* or your local emergency number. *You are not alone. Help is available.* If you are having suicidal thoughts, please [click here for a list of crisis support services.](http://www.suicide.org/international-suicide-hotlines.html), If you are seeking therapy online, please [click here for a list of counselling services.](https://thelifelinecanada.ca/pattern-interrupt/ecounselling/) *If you feel well enough to do so, please do your part to enrich this community.* Now that you have posted, please leave a constructive, helpful comment on someone else's post. Filter by new to find posts with zero comments. Together, we make this community great. Thank you for being here. 


*I am a bot, and this action was performed automatically. Please [contact the moderators of this subreddit](/message/compose/?to=/r/mentalhealth) if you have any questions or concerns.*",AutoModerator,102mlrj
1,"When I start with a new therapist,  I usually start with a little about me, and what my most concerning problem is at that time. Usually the first session,  is the therapist getting to know you,  and you to be more comfortable.  I wouldn't worry too much about it.",Drpepperpancake16,102mlrj
0,"IM SO HAPPY FOR YOU!!!! I want to be here so bad lol. 

I have BPD and I have sabotage and ruined so many relationships because of my irrational angry outbursts. I literally just lost an amazing girl because she couldn’t take it anymore after a bad argument and I cursed at her. 

Reading this is so amazing because it gives me hope as I start my journey through therapy. I want to be better and want to feel this genuine happiness that you feel. I was reading your post and literally smiling because you can feel your energy lol",,9nm1b1
1,"AH! I am SO glad for you! I am having a pretty good day myself today. I feel at ease with who I am, and my problems are not bothering me much at all. Good on you for taking those steps! I wish you happiness and love. <3",,9nm1b1
2,"I am happy for you. Its tough, I am bipolar class two and I went psycho on someone who I liked a lot. I am glad reading this though. It gives me hope that one day, I will recover. My circumstances weren't as bad as yours, I wasn't sexually assaulted, I just grew up with the wrong family. ",Alongstoryofanillman,9nm1b1
3,"This is great to see! Your story is very inspiring, and I hope it inspires others to do the same as it has inspired me! The future is bright friend :)",Single_Potential,9nm1b1
4,"I just deleted a longer message I had written, the gist of it was that I'm glad you posted this - gives the rest of us hope. 

What I'm curious about is the family/relatives thing. How did you manage to sort that out? I have BPD, depression, social phobia and history of mental and physical abuse. Great stuff, I know. I'm really torn between cutting all the ties with my family and still caring about them. They're not bad people, but seeing them always brings up painful memories and I end up torturing myself for days before and after seeing or talking to them. 

But yeah. Cheers, and here's to hoping that the positive state of mind stays there for good :)",confussedfluff,9nm1b1
5,I'm really happy for you. This was beautiful to read.,Pufflis,9nm1b1
6,Very well done you. This is wonderful to read and a positive inspiration for others to see. ,Fezzverbal,9nm1b1
7,This is wonderful to see! I’m also having a similar experience recovering from some depression and trauma caused by assault in a bad relationship. I totally relate to the part about your wonderful new partner. That’s how I feel about my new boyfriend. He’s helped me tremendously and I was actually able to reclaim the vast majority of the things that my ex ruined for me. I’m glad you have someone to support you and that things are looking up. Edit: love how you mentioned neuroplasticity.,AnxietyVentsOnline,9nm1b1
8,Happy for you! People need to know that there is light at the end of the tunnel!,,9nm1b1
9,Dude I know that feeling and it's frigging magical. I'm happy for you,VagrantValmar,9nm1b1
10,Couldn't agree more and thanks for posting.,Fargin,9nm1b1
11,"This is so awesome!  Congratulations on everything!  I’m in a sort of similar place where things are suddenly looking up and it’s super weird.  So happy for you, OP.  You deserve it. :)",plottingvengeance,9nm1b1
12,Oh i'm so happy for you. I can't wait to get there. To feel that breath of fresh air again. Thank you for this post. It DOES get better. Im so glad you're finally feeling everything again and I wish you nothing but more and more of it and infinite happiness. :),christineyvette,9nm1b1
13,"Is that the cure?

Love?

Is that what I need for some stability in my mind. 

I am so happy for you. Seeing that someone was able to climb out is fantastic and gives hope to people like me!

Someday I'll find my way out. Someway , somehow.",legion511723,9nm1b1
14,"I'm so happy for you, I have friend(ish) who has BPD and it has been bothering me  that he won't open his mind to therapy. He is an abusive guy but idk maybe he could change. I hope you live the best life you can.",paul_purail,9nm1b1
15,[deleted],,9nm1b1
16,"I FUCKING LOVE CODEPENDENT NO MORE! This was an awesome post; you’re not alone. Keep up the great progress, but have grace and patience with yourself in the valleys. 

Mental illness is tough - I don’t have BPD, but do wrestle with depression/anxiety, and PTSD from childhood abuse. A lot of what you said sounds like my journey too, so far. I’m so happy for you!",riseandroam,9nm1b1
17,I am so glad for you  I've grown up in an anusive household and there's been so many other traumas that really caused my mental health problem which I have had for almost 8 years. I've always felt that there's no hope for me and nothing gets better and everyone says it will but to hear someone on this subreddit say it makes it seem possible. I'm so happy things are going well for you and I hope they continue to get like this. ,edgy_meme_queen,9nm1b1
18,"I’m so sorry you have to go through that. I’m pretty sure I have BPD but I haven’t been fully diagnosed with it, but nonetheless I know how rough it is when your emotions scoop you up and take you on a hell ride. And thank you so much for the kind words <3 I’m so glad this helped in some way. I know I preached about this a lot but I swear to god DBT is so profoundly helpful. It specifically tethered to treat people with BPD as well, but I personally believe it is beneficial to everyone. If you want to read about it or anything you can message me and I can give you info about it. I think it would really help. I hope you have a wonderful day!",tinyturtleted,9nm1b1
19,Thank you my dear! I'm glad you're having a good day. It becomes so much easier to appreciate the good ones when you have so many nasty ones. Sending you my love!,tinyturtleted,9nm1b1
20,Thank you so much love. I’m glad it could help you in some way. I’m sorry you had to grow up in the wrong family. I can relate very much to that statement.  I’ve been trying to create my own family with people I love and trust to compensate for the lack of having a healthy bloodline. Much love to you!,tinyturtleted,9nm1b1
21,Oh I’m so glad this was able to help in some way. Hope you have a wonderful day!!,tinyturtleted,9nm1b1
22,"I’m glad this post could help.  With family it is complicated, they’re very still much in my life as they help me pay for bills and what not. It’s like they have a financial leash around my neck, which immensely sucks but I’m making steps to make sure I won’t live my life like this forever. I’m sorry to hear about what you’re going through. It’s a nightmare. But as far as your family goes, because I totally understand being triggered by the smallest of interactions with them. I know for me if they say something that rubs me the wrong way it’ll bring me back to when I was a helpless child, leaving me to panic.  What’s helped with this is learning how to create boundaries. Not only for them but for myself as well. It seemed nearly impossible at first, like how in the hell am I supposed to choose what to think? Because I was on such an emotional overload auto pilot. But mindfulness of my current thoughts, and reminding myself that thoughts do not hold as much weight as we’re often under the illusion they do, has helped more than I can tell you. And that’s the first step, is being aware of the thoughts and feelings going on in yourself in a non judgmental way whilst understanding their true nature. The second is teaching yourself that you do not need to take on the problems and feelings of others as your own. They are simply not yours. That’s been one of the hardest things for me to grasp because I was always the fixer in my family so I had to rewire 20 years of codependency.  But the group therapy I was going to had men and women in their sixties that were able to learn how to think in a healthier mind set so there is hope!  Sorry I’m rambling there’s just so much helpful shit I’ve learned that I think would really help you. Thanks again for the feedback and I hope you have a wonderful day!",tinyturtleted,9nm1b1
23,Thank you so much. Hope you have a good day!,tinyturtleted,9nm1b1
24,Thank you! Much love to you!,tinyturtleted,9nm1b1
25,"That’s awful, I’m so sorry that happened to you. My assault was with a partner as well. I’m really sorry you had to go through that.  And thank you for all of your kind words! I’m glad to know that you are in good hands now, and that things are getting better for you. It’s so nice isn’t when you finally have someone in your life that treats you the way you deserve (whether or not you realize you deserve it) and yeah I loved learning about neuroplasicity as it actually is able to convince me that I still have the capability to be successful.  Love me some good ole neural pathways, ya dig? Thanks again for taking the time to comment. Sending my love your way! ",tinyturtleted,9nm1b1
26,Thank you so much! I think it’s so important that people know there ARE options. It’s so easy to fall down the rabbit whole and be consumed by debilitating thoughts and feelings. I’m glad I was able to reach some people though.  Hope you have a good day though!,tinyturtleted,9nm1b1
27,I’m happy you know what that’s like. Thanks for the kind words love ,tinyturtleted,9nm1b1
28,Of course! Thank you for taking the time to respond! ,tinyturtleted,9nm1b1
29,"Happy for you!! I get that weird feeling since you’re so used to not being particularly happy to wake up, and it’s so nice to finally wake up and be excited for your day. Thanks so much!",tinyturtleted,9nm1b1
30,Love for self is a huge piece of the puzzle. For me learning that I do not require love from certain people to be whole has changed my life. And I promise that if you continue to try it will get easier. It may get worse before it gets better but eventually it will click. ,tinyturtleted,9nm1b1
31,And thank you so much for your kind response. Sending you my love!!,tinyturtleted,9nm1b1
32,Thank you for the love hun. The thing about change is that you have to truly want to change and be willing to sacrifice your comfortability for it. Which is probably the hardest fucking thing to do for me. I hope you’re doing well and and things get better for your friend.,tinyturtleted,9nm1b1
33,"Oh god I hope you’re okay and not beating yourself up about it. Slip ups happen. Progress isn’t always linear ya know? DBT is like my bible. I swear to god it introduced me into a whole new world of opportunities in thinking and actual tangible hope. I was in several DBT groups and just an iop group for a few months at a time. It’s like you’re able to vomit our all of this poison you’ve been holding in for so long to people who completely understand and care. It’s beautiful and life changing. You get many different perspectives on things you are going through and can learn from the experiences of others. I would really recommend doing this. Having a support system is so crucial. When I get home I’ll send you some links that I hope can help you. I’m so glad this was able to help in some way, wishing you all the love in this world!",tinyturtleted,9nm1b1
34,Codependant no more is an incredible book that everyone should be required to read lol.  And thank you so much for your kindness. I’m sorry you have to go through this kind of stuff too. I’m glad you know you’re not alone though. And thank you love!,tinyturtleted,9nm1b1
35,"You’re strong and I know we don’t know each other but I’m so proud of you. Overcoming this shit seems insurmountable. Just stick around and wait to see what happens, it is worth it. It’s easy to say that I know, but truly just stick around to see if there’s anything cool here worth sticking around for. I was in the mind set of “how will I be able to live if I can’t handle my emotions or my beliefs” but finding this therapy has changed my perception on everything. I’ll send you a link to something that may help when I get home from work. Much love to you!",tinyturtleted,9nm1b1
36,"Yes, PLEASE anything you may have that can give me insight into DBT would be great. I’m starting therapy Wednesday and going in that I can accomplish what you have. Seriously thank you for this post and keep having more awesome days! ",,9nm1b1
37,"Sending it right back atchya. :) I had a good day outside in the woods. Did my thing...and I got to see a long train being hooked up, presumably getting ready to go up North. Ah, I am so happy today. I am glad you're feeling good too! <3",,9nm1b1
38,Your welcome. You too man. I hope one day I find someone like her again. It was so unexpected. ,Alongstoryofanillman,9nm1b1
39,"No worries about rambling - all of it makes sense to me. They are things I have learned in therapy too, it just takes forever to make it work in practice. It seems I'm on the right track, and that's great to hear. Thank you again",confussedfluff,9nm1b1
40,Thank you very much! much love to you as well,edgy_meme_queen,9nm1b1
41,"[https://www.dbtselfhelp.com/html/mindfulness1.html](https://www.dbtselfhelp.com/html/mindfulness1.html) here's a link to some skills. This website seems to include everything DBT. Hey I'm so stoked and proud of you for going to get treatment. It can be scary but it's life saving imo. Oh and here's just what DBT is basically about [https://behavioraltech.org/resources/faqs/dialectical-behavior-therapy-dbt/](https://behavioraltech.org/resources/faqs/dialectical-behavior-therapy-dbt/) this is more CBT related but it also has helped me a lot, [https://positivepsychologyprogram.com/cognitive-distortions/](https://positivepsychologyprogram.com/cognitive-distortions/) it's about cognitive distortions. It's so informative and helps battle unhealthy thinking. Hope this helps! and thanks so much for the support much love to you!",tinyturtleted,9nm1b1
42,Thank you hun. Just keep doing it even if every fiber of your being is telling you you can’t. It’ll click one day. I’m telling ya. ,tinyturtleted,9nm1b1
0,"Thank you for for sharing. A reminder: if you are seeking resources in your local area, please provide that in the post so that users can share appropriate links and phone numbers. *If you are in distress, please call 9-1-1* or your local emergency number. *You are not alone. Help is available.* If you are having suicidal thoughts, please [click here for a list of crisis support services.](http://www.suicide.org/international-suicide-hotlines.html), If you are seeking therapy online, please [click here for a list of counselling services.](https://thelifelinecanada.ca/pattern-interrupt/ecounselling/) *If you feel well enough to do so, please do your part to enrich this community.* Now that you have posted, please leave a constructive, helpful comment on someone else's post. Filter by new to find posts with zero comments. Together, we make this community great. Thank you for being here. 


*I am a bot, and this action was performed automatically. Please [contact the moderators of this subreddit](/message/compose/?to=/r/mentalhealth) if you have any questions or concerns.*",AutoModerator,utwbc7
0,"Thank you for for sharing. A reminder: if you are seeking resources in your local area, please provide that in the post so that users can share appropriate links and phone numbers. *If you are in distress, please call 9-1-1* or your local emergency number. *You are not alone. Help is available.* If you are having suicidal thoughts, please [click here for a list of crisis support services.](http://www.suicide.org/international-suicide-hotlines.html), If you are seeking therapy online, please [click here for a list of counselling services.](https://thelifelinecanada.ca/pattern-interrupt/ecounselling/) *If you feel well enough to do so, please do your part to enrich this community.* Now that you have posted, please leave a constructive, helpful comment on someone else's post. Filter by new to find posts with zero comments. Together, we make this community great. Thank you for being here. 


*I am a bot, and this action was performed automatically. Please [contact the moderators of this subreddit](/message/compose/?to=/r/mentalhealth) if you have any questions or concerns.*",AutoModerator,who15g
1,I’m sorry you feel this way. I don’t really have any advice because I’m going through the same thing. It’s only been a year in my case but yeah nothing seems to work and it’s only getting worse. I’ve even changed doctors and therapists but nothing seems to help. Just wanted to let you know that you’re not alone! I really hope you feel better soon. Thanks for sharing.,Theworldisfuckedfr,who15g
2,"Thank you, I really appreciate it 😊! You should do some research on tms. It didn't work for me, but it's a noninvasive procedure so there wont be any negative lasting effects. I wish the best for you!",Aozorio,who15g
3,Thankyou so much. You’re really kind.,Theworldisfuckedfr,who15g
0,"Thank you for for sharing. A reminder: if you are seeking resources in your local area, please provide that in the post so that users can share appropriate links and phone numbers. *If you are in distress, please call 9-1-1* or your local emergency number. *You are not alone. Help is available.* If you are having suicidal thoughts, please [click here for a list of crisis support services.](http://www.suicide.org/international-suicide-hotlines.html), If you are seeking therapy online, please [click here for a list of counselling services.](https://thelifelinecanada.ca/pattern-interrupt/ecounselling/) *If you feel well enough to do so, please do your part to enrich this community.* Now that you have posted, please leave a constructive, helpful comment on someone else's post. Filter by new to find posts with zero comments. Together, we make this community great. Thank you for being here. 


*I am a bot, and this action was performed automatically. Please [contact the moderators of this subreddit](/message/compose/?to=/r/mentalhealth) if you have any questions or concerns.*",AutoModerator,y6kcut
1,"You just have to take baby steps. Eat little nibbles of a snack, or run some water over yourself in the shower. Something that takes you a tiny stepcin the right direction",TheBeast798,y6kcut
0,"Thank you for for sharing. A reminder: if you are seeking resources in your local area, please provide that in the post so that users can share appropriate links and phone numbers. *If you are in distress, please call 9-1-1* or your local emergency number. *You are not alone. Help is available.* If you are having suicidal thoughts, please [click here for a list of crisis support services.](http://www.suicide.org/international-suicide-hotlines.html), If you are seeking therapy online, please [click here for a list of counselling services.](https://thelifelinecanada.ca/pattern-interrupt/ecounselling/) *If you feel well enough to do so, please do your part to enrich this community.* Now that you have posted, please leave a constructive, helpful comment on someone else's post. Filter by new to find posts with zero comments. Together, we make this community great. Thank you for being here. 


*I am a bot, and this action was performed automatically. Please [contact the moderators of this subreddit](/message/compose/?to=/r/mentalhealth) if you have any questions or concerns.*",AutoModerator,si50sf
1,"The best success story I know - back when the diagnosis of BPD wasn't a thing, teenager Marsha Linehan was hospitalized for self-harm and diagnosed schizophrenic. Today, Dr. Linehan, the founder of DBT, is one of the world's most influential psychologists. 

I'm not saying that Dr. Linehan has an easy life, but then who does?",RWPossum,si50sf
2,"You'll need to be on top of it and you'll need to have good emotional intelligence to deal with it daily, sometimes it might be worse, sometimes better, but you can definitely work with it to have a good life. 

Regarding relationships, it's better if you let people know, and if you find loving friends and partners that take your BPD into consideration and help you get out of some of the spells of it. Avoid toxic people and abusers, always.

We all have traits that we have to work on, BPD just happens to be harder on people because it can feel that it's relentless sometimes.  
I recommend you continue going to therapy and working on the events or circumstances that brought you to have BPD, healing those episodes of your life can make things easier.  
Sobriety is definitely important to keep up too.

Good luck to you, there definitely be an amount of daily work to be done, but you'll be alright, you can have a happy life, and a happy relationship.",,si50sf
3,"Successful, yes.  I recently learned that Pete Davidson has BPD and I would say he is fairly successful compared to most of us normies.  Happy and stable?  I am really not sure.  I think it is possible for people with BPD to be happy and stable for a span of time.  But from what I have researched on it, it doesn't seem like being happy, stable and successful long term is achievable.  I think with a disorder like this you just have to do the best you can day by day.

I am not a medical professional and really dont know a whole heck of a lot about BPD.  So if anything I said was incorrect I apologize.",fluffy_boy_cheddar,si50sf
4,"**Are there any happy, stable, successful people with BPD?**

Mammoth, yes, the vast majority of pwBPD are ""high functioning"" -- i.e., they typically hold jobs and generally get along fine with coworkers, classmates, casual friends, and total strangers. None of those people are able to trigger his fears of abandonment and engulfment.  
  
There is no close relationship that can be abandoned and no intimacy to trigger the suffocating feeling of engulfment. Hence, with most pwBPD, the strong BPD symptoms usually appear only when someone draws very close to the pwBPD.  
  
This is why it is common for a high-functioning pwBPD to do well in socially difficult jobs such as being a social worker, nurse, professor, salesclerk, or doctor. And this is why most pwBPD can be considerate and friendly all day long to complete strangers -- but often will go home at night to yell at the very people who love them. Only the loved ones are able to trigger his fears.

**Are there any happy, stable, successful people with BPD traits?**

Mammoth, BPD is not something -- like chickenpox -- that a person either ""has"" or ""doesn't have."" Instead, it is a spectrum disorder, which means everyone on the planet occasionally exhibits all BPD traits to some degree (usually at a low level if the person is healthy).  
  
At issue, then, is not whether you exhibit BPD traits. Of course you do. We all do. Rather, at issue is whether you exhibit those traits at a strong and persistent level (i.e., are on the upper end of the BPD spectrum).",Up-Town,si50sf
5,"I have BPD and I'm definitely not stable but since I've quit drugs I am a lot more stable if that makes any sense? 

My biggest struggles with BPD is holding down a job and relationships.. Kinda friendships as well but it's easier for me to form friendships than it is relationships. 

Happiness is a fleeting emotion, nobody is happy all the time, if they state that they're talking complete dog shit. 

Or maybe they are? but I think if someone says they're happy all the time they're definitely ignorant to what is happening around them.",,si50sf
6,Marsha Linehan’s book Building a Life Worth Living is an AMAZING book. Highly recommended for learning how to be successful at BPD,Lost_Beautiful,si50sf
