,Comment,Author,Post
7,"Thanks for replying.

You're describing learning. It goes without saying, I reckon, that behaviour alters the brain over time, but it's a bit of a leap to conclude, straight up, ""*it cures mental health problems*"":

To extend the hoop example:

- maybe the hoop is connected to your fire alarm (*you learn to become averse to it, more than getting better at throwing*).

- maybe for some reason you can't see the hoop, and spend a year blinding throwing a ball into the air (*you don't learn the relevant skill, as objectives are poorly set up*).

- maybe you're an ice hockey goalie (*you're spending time learning something irrelevant to your needs*).

...or some combination of complicating factors like these, which can make the ""healthy"" behaviour ineffective in the long run.",almostambidextrous,apmv5f
8,[deleted],,apmv5f
9,I know what these things are. I'm not sure you do. Cut the patronising crap.,almostambidextrous,apmv5f
10,"Let me try again. All I'm objecting to, here, is that ""proven to cure mental health problems"" is misleading. There is certainly strong evidence *it can help*, but that doesn't mean 100% cure for everyone—like I said, there can be many factors.

(edit: *and room for improvement in the therapy that a lot of people experience*)

In other words, you're over-generalising.",almostambidextrous,apmv5f
0,"DBT can be very useful for many conditions. The mindfulness aspect is widely used outside of DBT, the distress tolerance aspect is often used for treating anxiety disorders and phobias, and the accepting, non-judgemental, wise-mind aspect can be powerful for anyone as it encourages practicising self-compassion and, I found, made a very good counterpart to CBT for me.",claireauriga,3egszw
1,"I don't know about Bipolar Disorder, but I've seen that it's been used in the treatment of eating disorders. ",Layil,3egszw
2,"My local health authority in the UK started using DBT about 10 years ago and they soon discovered that much of it could be applied to other mental health issues such as chronic depression, anxiety, bipolar, and I happen to personally know at least one schizophrenic who completed the course. In the last few years, the crisis team and therapeutic day service have used an eight week condensed model as a way of supporting those who would normally end up in hospital for weeks at a time. Now they may spend a few days in hospital, if at all. I did the full DBT course in 2008-9 and been through the short courses twice as a top up when I've been really low in 2010 and 2013.

The workbooks can be useful for establishing behaviour patterns and triggers, and you can adapt them to your situations. A lot of the DBT stuff has its roots in Eastern philosophy and Buddhism. Mindfulness (a key component of DBT) is currently the new poster child for mental health and is intended for everyday use. The internet has a lot of resources relating to DBT as well.  ",Welshgirlie2,3egszw
3,My brother uses it for bipolar nos/schizoaffective. It helps him with intrusive thoughts and other symptoms the come up when he's stressed out. ,argylepancake,3egszw
4,Why not give the workbook a try?  It couldn't hurt.,Blutarg,3egszw
5,"Thank you, I decided to start working through the book last night. I also have the book Feeling Good by David Burns which I think is self-help CBT. Maybe they will work well together.",throwaway798798798,3egszw
6,"Thanks so much, I'm going to try it out and see how it goes!",throwaway798798798,3egszw
7,"Thank you, intrusive thoughts have been one of my very worst symptoms.",throwaway798798798,3egszw
8,"I decided to go ahead. I just didn't know if, since developed for a specific disorder that I don't believe I have, if it would be at all useful for me.",throwaway798798798,3egszw
0,Hey I am very happy for you!,nerosmith,benlsn
1,that means so much! I hope you are doing well too :-),goodandvile,benlsn
0,"Dbt is amazing, hard work. You need to be honest with yourself and kind to yourself throughout. 

It's not simply turning up to therapy. That won't do it. It's really working on implementing the skills and strategies in your life and reflecting on when they go well and dont go well.

It takes a long time but change is definitely possible.

Remember that these skills are skills that everyone needs to learn. They aren't just for people with diagnoses. There are people who want to teach young adults these skills regardless of mental health presentation.  When you know the skills,  you'll see how unskilled a lot of people are in everyday life.

It's a great form of therapy, good luck!",Notarobotsofar,akuho8
1,"Thank you for the good advice. Yesterday was my last day of therapy, and I kept your words in my mind the whole time. It was hard and I didn’t understand at first, but I knew if I kept going to each session, life would get better. Remembering to bring the skills with me into my everyday experience made me learn faster and get in the habit of using them. My thinking has changed and I feel more empowered to shape my life. 

Now I’ll answer my own question. What was the most valuable thing I took from DBT therapy?

Hope. 

Thank you, wholesome redditor. ",magickitty420,akuho8
2,"It's amazing you gave it a go and openly. It's hard to do, there is a lot to learn. The journey is very up and down but you can do it!",Notarobotsofar,akuho8
0,"News for you: you're never going to be like over people. I'm not like other people and i can tell you that doesn't mean you won't function, or be happy. It just means you see and do things differently. And that's okay. It's  hard dealing with a chronic problem.

The hardest part of recovery (2 rounds of DBT here) was learning to trust myself. And stopping the value judgments. 

Dude, chin up. Keep trying. 

Right now it doesn't feel like you can do it. That's okay. That will change. So much less is fixed than we feel. 

Be kind to yourself, take a deep breath, and try again. Knowing all the skills doesn't mean we can do things, it means we can figure out were shit is going wrong.

I wish you all the best. I'm still trying to figure this out myself! 



",Tawnytwo,3xq77s
0,"I'm in the same boat. I have never even posted on this subreddit and was searching ""dbt terrible"" looking for somebody asking this question lmao. BPD as well and finally getting help but the thought of going back into DBT for the third time is crushing. I genuinely can't internalize anything I'm being told and it all comes across as very hokey (I don't need to be convinced it's not. I've heard ""evidence based"" enough times that it has become an intrusive thought). I am medicated and it's helping tremendously, but it's not enough.",TBS_Reruns,b1ufh4
1,"My therapist knows I hate DBT after a bad experience in groups to learn it. Previously she had mentioned possibilities of BPD for me, but now is thinking it is a diagnosable level for me and mentioned DBT again. I know so much DBT, have been learning it for almost 10 years, and still doesn't work (for me). So no, you're not alone in this. ",adovest,b1ufh4
2,A big part of DBT is learning not to judge our feelings but to describe and observe them prior to acting. I’m sorry your therapist isn’t giving you space to feel.  Maybe they aren’t the right person for you. ,luri7555,b1ufh4
3,"More so commenting to affirm what has helped me. Whatever you end up doing OP, I hope you have a path to a similar or better recovery I did.

I have BPD and I'm (mostly) recovered. I'd say about... 90% recovered? And that occurred in about a year, from diagnosis to my current level of disorder management. This isn't to say that I'm emotionally stable all the time, but I can effectively and healthily communicate when it's starting to happen and ask for the support which stops a split from happening. Lack of identity and emotional impermanence are still issues, but I'm actually quite emotionally regulated these days. Save for my first violent split in over a year that went down last night and I'm still not completely out of it. I just feel well controlled to be by myself, but I'm not bright eyed and happy like I usually am 95% of the time.

Reflecting back on when I was really, really out of control and splitting extremely badly on a weekly or twice weekly basis at least, my recovery was only possible because I was ready for therapy. Dismissing it and discrediting it would've made me resentful of my therapist and then there was no way they could help me. Not their fault. Mine. Because I wasn't truly listening to what they were telling me.

I also had to swallow that hard pill that I *was* feeling the wrong way. I was in the wrong. I was being unhealthy to myself and the people around me. It sucked, trust me, I know. But you know, self-acceptance is actually really helpful. I still laugh and openly say that I'm a psycho, I'm a nutcase. It's true. But that doesn't mean I'm a bad person. I often feel like a walking, talking disorder but I understand myself on such a deep level that I know when it's manifesting itself in destructive ways and I can ask for the love and support I need to defuse it. And it works.

And you know what really stuck with me after I left therapy? Developing the maturity to apologize for my behavior and reach out and help heal the people I hurt. I'm inherently incredibly selfish and needy with my BPD but sometimes I have to say you know what, push my needs aside and tend to the needs of my partner. Recognizing that it's not all about me and, if need be, going through our happy times to remember I love this guy even if my emotional impermanence is making it very hard to feel that like I usually do. I also have to accept when I said I hated him, I meant it. But that's something I only feel when my BPD episode turns hurt to anger. Because anger makes me feel better and I'm vindictive when I lose control and I want to hurt him as hurt as I feel but my anger masks.

I think it's good to recognize that while your feelings in episodes are valid, they're still wrong. And you have to actively strive to communicate them in healthy ways. So last night, I lost my shit and messaged my partner ""I really, really hate you."" And I meant it. I didn't regret it. But after a few minutes, I messaged ""I recognize that my lashing out at you is abusive. I understand and accept the potential consequences of my behavior. I sincerely feel like I don't have a partner and I understand that's largely my fault for not having the self-control to avoid this episode.""

See, just because you lose control of your feelings doesn't absolve you of the personality responsibility to take ownership of your actions and make amends as best as you can. You have to have the self-awareness that you were wrong, you couldn't control it, and then have the selflessness to put someone else first and make sure *they're* okay before they can help you.

95% of the time, we're a happy, healthy couple. Like, really. Still in the honeymoon phase after several years. Fights only ever occur when I split which is now a once a year or so thing. Communication and self-awareness and maturity to recognize when I'm being a piece of shit to someone is really healthy. As well as knowing I'm insane and laughing about it positively with my partner that he knows. Acceptance for being a psycho is really healing. Once you accept yourself, you start finding yourself more and more able to manage the disorder until it rarely manifests itself in destructive ways at all.",Feather-Light,b1ufh4
4,"As far as I'm aware DBT is the only therapy designed and approved for BPD. Before DBT individuals with BPD were treated with the other common talk therapies and these were found to have really minimal success rates. 

I do agree that not even ""normal"" people accept everything in life and that your therapist should validate your feelings (depressed and anxious thoughts get validated and then corrected, so why can't they do the same with BPD?). Have you had only one therapist this entire time? Perhaps it's time to try someone new.",Merlocked,b1ufh4
5,"I have
Multiple personality disorder and bi polar and I don’t find DBT works, charring to people who understand your disorder can help",joker197345,b1ufh4
6,"It's good to know that I am not alone in this, but I am sorry you're dealing with both DBT again and BPD. It sucks. It's hard to essentially be told to just accept everything and distract myself. Is that really all they have?",neurocentricx,b1ufh4
7,Do they not suggest any other therapy or type of assistance? I find it asinine to push this therapy on people when it doesn't work for them.,neurocentricx,b1ufh4
8,"What do you mean about describing and observing prior to acting? For instance, when I spiral, my feelings are automatic and immediate.",neurocentricx,b1ufh4
9,"Thank you for writing all of this.

I would like to point out in a non-defensive manner that I do take responsibility, it's that it's negative towards me. For instance, if I lash out, I will almost immediately say, ""I'm sorry, I didn't mean to say that, I'm a shit girlfriend and you would be better off without me."" Because I feel that way. I don't want to have an outburst and when I do I feel so incredibly embarrassed and guilty that I blame myself but then also ridicule myself as well.

I know when my spirals are coming, but they happen too fast for me to stop and ask for help, and they're too strong to get out of. I have a constant fear of abandonment and it makes me say and do things in an attempt to keep those around me to stay around me. And if my boyfriend and I have a disagreement, I'm terrified he will leave me.

He's incredibly supportive and I appreciate him more than words can say, but I just don't want this. I don't want BPD. I accept myself but yet don't, because I feel like this entire disorder ruins my life. I just want it to be over. Not my life, the disorder. It causes so many issues and I can't seem to stop them. I don't want to *accept* them, I want to *stop* them.",neurocentricx,b1ufh4
10,"> Have you had only one therapist this entire time? Perhaps it's time to try someone new.

Since I've been diagnosed with BPD I've only had this therapist. I'm not sure I want to change right now because 1) This treatment right now is pro bono and though I have insurance I'm not sure I could afford the co-pays right now as money is really tight and 2) I'm afraid she would get upset at me for leaving because I'm not happy with how the sessions are going, and I don't know if it's because she's not the right therapist for me or if it's because I have BPD. She said I wouldn't be happy with her some days.",neurocentricx,b1ufh4
11,"This came up in my session less than a week ago, so we haven't discussed it too in depth yet. It seems she mostly wants me to get past my beef with DBT and give it a real chance - but I have and it just doesn't work for me. 
I think because it does have such a high success rate, many professionals may think it just may not have been taught properly or in the right way. Either way, it feels very hopeless. ",adovest,b1ufh4
12,"Feelings are there for a purpose and we can’t help what pops in our head. All we can do is learn not to be controlled by our emotions. These are very basic DBT principles. Are you going to a DBT center or working with an individual therapist who says they are using DBT?  Do you have homework, feelings calendars, and 24 hour coaching?  Are you attending skills groups?  

Whatever is going on, I hope you keep working on yourself and find a treatment which eases your symptoms. ",luri7555,b1ufh4
13,"The feelings can be automatic and immediate  (not bpd but I get rejection sensitive dysphoria from adhd and that's automatic and immediate feelings). The describing and observing is looking at those feelings and trying to name them and so on, and especially do so before deciding to act on them",xsnowpeltx,b1ufh4
14,"By including self degradation in your apology you are being defensive. You are causing the person your apologizing to to feel bad for you. An apology needs to be about the other person, better to say like “I’m sorry, it was wrong for me to say that, I let my feelings get the best of me and reacted without thinking” A real apology also requires a change of behavior, not just feeling bad. Take some time and reflect on why it was wrong and then apologize without feeling bad. Guilt is useful as a catalyst for change, but focusing too much on feeling bad about your actions will prevent real self reflection and change. You have to let go your feelings of shame and just try to do better.",,b1ufh4
15,I agree. And it's frustrating that we're the ones with the illness and yet we're being told we have to work at it harder.,neurocentricx,b1ufh4
16,"I'm working with an individual therapist. I have this DBT workbook but she doesn't always assign me homework as sometimes when I come in, I have a lot to discuss and it takes up the whole time. That's pretty much it.",neurocentricx,b1ufh4
17,"But how do you get rid of them? I want them to go away, or avoid them completely, which I understand is maladaptive behavior. But accepting that they're there is pointless to me, lol.",neurocentricx,b1ufh4
18,"Idk. Getting rid of them is hard (at least for rsd in my experience) and I dont know how to do that. Itd be nice if we could and if you figure it out lemme know. Since I dont know how to get rid of the feelings, observe and describe helps me feel at least a little more in control and helps me avoid taking harmful actions based on them

CBT is in a lot of cases good for helping train away harmful thoughts or feelings but idk how well itd work with bpd spirals",xsnowpeltx,b1ufh4
19,"How do you find the control to observe and describe first? Like if you feel an overwhelming emotion, do you have to remind yourself to stop?",neurocentricx,b1ufh4
20,"It's hard and I dont always manage to do it. Reminding yourself to stop can help. I also find it helpful while not in a spiral to think about when I was in one and figure out what I was feeling

Also it's not really the healthiest of coping mechanisms long term but noticing what triggers spirals and avoiding them while you're figuring out how to deal with spirals can help. And noticing what triggers it can help you be aware and prepared to take that step back if one happens ",xsnowpeltx,b1ufh4
21,"Sadly, almost everything can trigger one. Some are super small, and others are rather big. If I can distract myself, I can usually work through them, but if there's another stressor, like when I'm at work, I can't usually stop it from happening. And because my work is so busy, I don't have time to sit for a few and try to breathe and think about things.",neurocentricx,b1ufh4
22,That sucks because the ability to separate from the situation is so helpful. Dont really have advice for that just sympathy and hope that things work out,xsnowpeltx,b1ufh4
23,I appreciate the kind words. Good luck to you too :),neurocentricx,b1ufh4
0,"DBT talks about paced breathing for a moment of crisis, and this is supported by very good evidence, but think about forming the habit of always responding to a moment of stress by breathing slowly. Mindfulness is very helpful with this. Awareness of fluctuations in your stress level during the day prompts you to slow down and use your coping methods. A nice thing about paced breathing - fast, effective, and you can use it anytime.  
  
Two psychiatrists, Brown and Gerbarg, recommend an exercise that's very simple - inhale and exhale gently, 6 seconds each.",RWPossum,17p5ytk
1,"Mindfullness, grounding excercises, guided imagery, progressive muscle relaxation",swild89,17p5ytk
0,My therapist mentioned it but I didn't ask any follow up questions. What is it?,nothingduploading,7zl1lb
0,"Thank you for for sharing. A reminder: if you are seeking resources in your local area, please provide that in the post so that users can share appropriate links and phone numbers. *If you are in distress, please call 9-1-1* or your local emergency number. *You are not alone. Help is available.* If you are having suicidal thoughts, please [click here for a list of crisis support services.](http://www.suicide.org/international-suicide-hotlines.html), If you are seeking therapy online, please [click here for a list of counselling services.](https://thelifelinecanada.ca/pattern-interrupt/ecounselling/) *If you feel well enough to do so, please do your part to enrich this community.* Now that you have posted, please leave a constructive, helpful comment on someone else's post. Filter by new to find posts with zero comments. Together, we make this community great. Thank you for being here. 


*I am a bot, and this action was performed automatically. Please [contact the moderators of this subreddit](/message/compose/?to=/r/mentalhealth) if you have any questions or concerns.*",AutoModerator,z7739n
1,"I'll give you some information about things that can help children, then something about CPTSD.  
   
There is evidence that relaxation with the traditional Asian methods can help children with ADHD. Psychiatrists Brown and Gerbarg, who have published 6 papers on breathing and mental health, recommend a 3-part program of mind-body methods - breathing, meditation, and slow body movement.   
  
Details here -  
   
https://www.youtube.com/watch?v=wqEM\_jlDRZI  
   
People are often frustrated with meditation. Here’s a simple meditation for beginners -  
  
https://www.youtube.com/watch?v=4d9xFfA6F50&t=88s  
  
I don't have the title of a good book for children, but I'll mention that I always read the Amazon reader reviews carefully, using the filter that shows 5-star, 4-star etc. so I can see what the most intelligent readers say.  
  
ADHD expert and author Dr. Russell Barkley has a number of YouTube videos. You can check Barkley’s impressive credentials at his Wikipedia article.Advocacy and support groups such as CHADD can be helpful.   
  
An excellent author on the subject of CPTSD - Anna Runkle.  
  
It’s important to have a therapist who has experience treating trauma.  
  
I think every victim of childhood trauma should see this -  
  
In this video, author Anna Runkle talks about her study of CPTSD and summarizes treatments shown to help. She says that as a CPTSD survivor, the thing she has found most helpful to her is dealing with the symptom known as dysregulation, which is getting very upset. I would definitely see her videos on dysregulation.  
  
https://www.youtube.com/watch?v=GXSlAfoJiAg&t=8s",RWPossum,z7739n
2,"I really appreciate all this info u laid out and I will definitely look into it for myself personally, my kids (one of which definitely has ADHD bit too young to resort to meds) and I'll see what I can digest to pass on to one of them

My BIL is so very new to mental healing and I don't think he'd switch therapists even if it would benefit him because even though he's seeing someone intermittently, it's a BIG step for him

I also have childhood trauma so I definitely appreciate u posting :)",MsBuzzkillington83,z7739n
0,So what’s your goal with therapy? That could help a lot.,swild89,1ad0ijb
0,"Thanks! I suspect Marsha Linehan probably is slightly biased when it comes to the efficacy of her technique, but it's a starting point. 

Edit: looked at the Linehan studies. They are all focused almost entirely on Borderline or substance abuse. There was one on bipolar disorder but it was teens and had mixed results. 

I suspect there are not really any good studies on DBT outside of personality disorders but there are a ton of anecdotal successes and for that reason, and the idea that it is compact and in a ""module"" format that is easy to present in an inpatient setting, it's being taught to people with a variety of mental illnesses. 

Fascinating.",ivybelle,4whcnb
1,"I was going to list out a couple articles I found. It seems binge-eating is the second most common use, behind borderline personality disorder. Since I don't entirely know what you're looking for, [this link to google scholar](https://scholar.google.com/scholar?hl=en&as_sdt=1,26&qsp=13&q=adapted+dialectical+behavior+therapy) has a decent number of results that aren't just for borderline.",cnz4567890,4whcnb
2,"I've read research (several years ago) that found DBT (both in it's fully, structured format and when mostly just skills-based) to be effective in treating eating disorders, substance use/abuse, impulse disorders, PTSD and other trauma-related disorders, and for targeting specific symptoms like anger, impulsivity, depression, suicidality, and self harm. 

It's hard to link to all or even a good sampling of the research because there's so much out there, but here's one resource that can help for a start (the chart shows the diagnoses and symptoms targeted under ""participants,"" including lots of BPD but also substance use, PTSD, depression, self harm, eating disorder): 

[Linehan Institute](http://www.linehaninstitute.org/research/data-to-date.php)",stayseated23,4whcnb
0,"Full Article:

http://www.nytimes.com/2011/06/23/health/23lives.html",Hikari-SC,31i83x
