,Title,Post Text,Post Creation Time,Content Type,Post Score,Number of Comments,Post Author,Author Flair,ID,URL
73,Treatments for Cluster B?,"I've finally come to terms with my borderline personality disorder, along with other personality disorders that overlap with my borderline (npd, hpd, aspd). And because of that, I'm dealing with severe cognitive dissonance right now from having to accept the fact that I have a personality disorder. I just feel so disconnected from people most of the time. If they don't give me that intensity, or if they don't give me the admiration, attention, and affection l crave, I devalue them. This makes romantic relationships very very painful and unsuccessful. I often dream of material things such as fame, fortune, and success, because I feel as unless I achieve those things in life, nobody will ever love me, because that's how my parents raised me. 

""Mama said: fulfill the prophecy. Be something great: go make a legacy. Manifest destiny, back in the days, we wanted everything, we wanted everything. Mama said don't give up, it's a little complicated. All tied up, no more love, and I'd hate to see you waiting""
-Panic! At the Disco.

Because of the awful childhood emotional neglect that I went through being raised by a cluster be mother, I am even scared to pursue my romantic sexual feelings towards women, even though I'm bisexual, and would because of the awful childhood emotional neglect that I went through being raised by a cluster be mother, I am even scared to pursue my romantic or sexual feelings towards women, even though I'm bisexual, and would prefer to date a girl. I just can't. The attachment feels too intense and I feel too codependent, and it's just too strong of a feeling for me to handle. 

 I am ashamed of the fact that I'm so freaking selfish, and that I have this idea of a perfect partner in my head and it's all almost as if I just want somebody who is willing to just drop everything and be at my aid it's almost as if I just want somebody to serve me. It's very narcissistic and then when they don't give me the attention that I feel as if I deserve, and when I feel abandoned, I act out against them. I just want someone to unconditionally love me. But unconditional love does not exist. It is just a concept. Everybody wants something. Even the spiritual people who claim they unconditionally love people. They're doing it for themselves. They're doing it for that spiritual high for that connection with a higher power. I never experienced true parental love growing up, ny parents were narciissists too. So I don't believe in it. I almost want a partner to chase me and prove to me that this kind of love exists. I want them to be obsessed with me the way that I obsess over the object of my affection--The ""FP"" that I am idealizing at the moment. That is my definition of love, and its flawed.

I have tried DBT, and it actually makes me worse. I hate how DBT is oversold to people with BPD ---almost everybody that I have spoken to who had BPD who tried it said that it did not work for them. It's just a marketing gimic. 

I want to get better, but I feel hopeless and scared.  I know that I probably need to find a provider who specializes in cluster B. But even though it seems as if those people only seem to interpret us through what they read in books, and there's a lot of misinformation out there on cluster B's 

I also need to work with a therapist who could handle BPD and NPD and ASPD. Usually when I tell a therapist, I've been diagnosed with those things, they run. It's like ""oh, your borderline have you tried DBT?""

""Oh, wait, you're also a narcissist and sociopath? Well, then you're incurable. I'm sorry, but I can't help you at least if you were just a borderline you could try DBT""

 I feel as DBT works for some borderline because they're just borderline. I feel as if it's probably my NPD that makes me not react well to DBT.. People with MPD cannot handle that level of introspection. It literally makes my head explode. 

They don't recommend DBT for NPD. For NPD, you really just need serious talk therapy. Think about it narcissist get talking about themselves it's the most therapeutic thing, the world for somebody with NPD lol.

Either way, I just really need someone to talk to you because I feel very distressed tonight and I've been in a serious BPD episode for the past few weeks and I'm just now coming out of it!! despite by resistance to DBT I still am open to treatment and may even be open to going to a DBT group however, I just don't really know if I would be in a skills based group I feel as if I would be better off in some kind of therapy group, where you could just talk about your feelings and develop support.",1706440633.0,False,2,1,Actual_Pepper8815,None,1ad0ijb,https://www.reddit.com/r/mentalhealth/comments/1ad0ijb/treatments_for_cluster_b/
74,DBT research on disorders that are not Borderline Personality Disorder?,"Are there any studies on the effectiveness of DBT for people who don't suffer from Borderline? I've tried doing some research, but it seems like every study is geared in that direction. I realize that was the original focus of the therapy, but now it seems like it's being applied a lot more generally. I'm interested to know what research backs this up.

It seems like distress tolerance and emotion regulation etc. are good skills to teach people, especially in a short term hospital setting where the exposure to material time is short. I see the ""bang for your buck"" value.

I'm just curious whether there have been studies showing that DBT is really effective when used like this. It seems to be EVERYWHERE, especially in inpatient settings.

Any input is appreciated. ",1470511796.0,False,1,3,ivybelle,None,4whcnb,https://www.reddit.com/r/mentalhealth/comments/4whcnb/dbt_research_on_disorders_that_are_not_borderline/
75,Ideas for Abnormal Psych essay about BPD or DBT...,"I need to write an 8 page persuasive essay about an issue relating to Abnormal Psychology (Disordered Psych) 

Do any of toy have any good ideas relating to the topics of Borderline Personality Disorder or Dialectical Behaviour Therapy, something similar, or both?",1446781904.0,False,1,0,weesalouisa25,None,3rpyjg,https://www.reddit.com/r/mentalhealth/comments/3rpyjg/ideas_for_abnormal_psych_essay_about_bpd_or_dbt/
76,I am starting a DBT group therapy program tomorrow that goes for 6 months. What can I expect?,,1581356015.0,False,1,0,Lindseyindia,None,f1to90,/r/depression/comments/f1tb2b/i_am_starting_a_dbt_group_therapy_program/
77,What is DBT Therapy? (dialectical behavior therapy),,1385402522.0,False,0,0,kadaclem,None,1rfj5i,https://www.youtube.com/watch?v=hDJi86n9-Rk
78,Marsha Linehan Acknowledges Her Own Struggle with Borderline Personality Disorder (DBT lady),,1428224938.0,False,12,4,tossmeintrash,None,31i83x,http://psychcentral.com/blog/archives/2011/06/27/marsha-linehan-acknowledges-her-own-struggle-with-borderline-personality-disorder/
79,I am having a hard time with a diagnosis ,"Hi 22F, 

I’m wondering if anyone can relate to my situation. I feel like a tulip in a rose garden. I’ve had two prominent diagnoses: bipolar 2 and borderline personality disorder. 

I have tried antidepressants and TMS.. both were not effective or long-lasting 

I recently tried to do dbt. I only made it 6 months, before I hit my breaking point. It stressed me out and I had a hard time relating to others in group. 

My DBT therapist was heavily leaning towards a more “quiet” BPD diagnosis. 

My CBT therapist is weirdly certain of bipolar 2. 

This is absurd. I’m trying to make it easier for those around me to educate & support me.. but I cannot go back and forth on two different diagnoses. It makes me look like an idiot. It confuses me & others, rightfully so. 

Any advice? I’m looking to do some psychological testing, but in the meantime, I feel so lost on it. Support is appreciated. 

edit: the more I think/speculate, the more I feel like this is just me. I have issues with anxiety, depression, and low self esteem. Nothing more than that. Professionals tend to think otherwise, but I don’t know. ",1711660588.0,False,1,5,No_Blueberry_9039,None,1bq6z1r,https://www.reddit.com/r/mentalhealth/comments/1bq6z1r/i_am_having_a_hard_time_with_a_diagnosis/
80,Looking for friends ,I’m looking for friends with borderline personality disorder who may have gone thru dbt or is currently going thru it. Just wanna find someone who understands what I’m going thru ,1714659726.0,False,1,0,Blitznvixen,None,1cigxk5,https://www.reddit.com/r/mentalhealth/comments/1cigxk5/looking_for_friends/
81,"Helpful Groups, NYC","So I need more social interaction and need to find more people who can relate to me. Recently I joined SMART meetings ( a substance reduction program) and asked my therapist for DBT groups. Unfortunately she only had paid options, but i already have so many professionals in a week (4 visits) that I don't need another thing billable to insurance. Are there any groups on the following issues, that are **free of cost in the NYC area?** 

* Men's Issues
* DBT / Emotional Regulation
* Harm Reduction (I've joined SMART again)
* Abuse Survivors / Emotional Neglect
* OCD (diagnosed with rOCD)
* ADHD  (diagnosed last year) 
* Generally ND meetings (ASD/ADHD/etc) ",1702668996.0,False,2,0,turtleboy1061,None,18j8aut,https://www.reddit.com/r/mentalhealth/comments/18j8aut/helpful_groups_nyc/
82,Has anyone used The Dialectical Behavior Therapy Skills Workbook (WITHOUT undertaking actual DBT) and did it help you?,"I am contemplating buying it.  I am not undergoing DBT currently, but I'm pretty sure I have behaviours that DBT might be of use in changing.",1438786300.0,False,7,10,the_sad_machine,None,3fvqsk,https://www.reddit.com/r/mentalhealth/comments/3fvqsk/has_anyone_used_the_dialectical_behavior_therapy/
83,Finding My Wise Mind|BPD Recovery [DBT Week 2],,1378227750.0,False,3,0,touchingelephants,None,1lnj5q,http://touchingelephants.com/2013/09/03/finding-my-wise-mindbpd-recovery-dbt-week-2/
84,Mental healthcare in Philadelphia,"My brother is having significant mental health issues and needs relief. Now on his third antidepressant with no improvement (if anything he has gotten worse), we need to find him 1) a new psychiatrist who listens more closely, meets him where he is and understands the urgency 2) find him a strong DBT program (preferably via insurance but open to anything at this point) where he can work weekly both in individual therapy and in group therapy. Ideally, we could accomplish this all under one roof - with the psychiatrist collaborating regularly with the DBT therapist. Generally speaking, he struggles with severe ADHD, anxiety, depression, self esteem issues and anger management. We have done a ton of research to no avail, so would really appreciate any guidance on programs or specific individuals to consider in the Philadelphia area. THANK YOU!",1704837299.0,False,1,0,Lazy_Spite316,None,192quga,https://www.reddit.com/r/mentalhealth/comments/192quga/mental_healthcare_in_philadelphia/
85,An Introduction to Skills Training in Dialectical Behaviour Therapy [DBT],,1378462360.0,False,4,0,touchingelephants,None,1lufsd,http://touchingelephants.com/2013/09/06/an-introduction-to-skills-training-in-dialectical-behaviour-therapy-dbt/
86,What’s the life expectancy of a woman with comorbid mental illnesses and addiction without treatments?,"I have BDP, schizo effective bipolar, and a mild substance use disorder. I have done a year of DBT, been on meds and in therapy since my psychosis 6 years ago, and go to 12 step meetings with 2 years clean. I no longer have delusion thinking or hallucinations and I have been successful at self regulating for the most part since I graduated from DBT. (Side note: I’m going to be starting accelerated resolution therapy soon here. Does anyone have good experiences with that?) I have come a long way but I’m curious where I would be without having done all that work. Does anyone have a grasp on what the life expectancy is for women with this profile without treatment? I have a feeling I’d be dead by now, but I also wonder if there’s research out there to confirm this.",1701067562.0,False,1,0,Innovateemulate,None,184wqza,https://www.reddit.com/r/mentalhealth/comments/184wqza/whats_the_life_expectancy_of_a_woman_with/
87,Opinion Needed,"Hi everyone! Since I am currently unemployed my therapist recommended I check out an intensive outpatient dbt program as I have severe trauma due to past physical, emotional, and medical abuse. I wanted to get some opinions on this. Has anyone else done something like this? If yes please share your experiences. Link for the program below. 

https://www.fourwindshospital.com/about_four_winds/saratoga/Adult_Intensive_Outpatient_Treatment.html",1713809515.0,False,1,0,lustreadjuster,None,1cahtk0,https://www.reddit.com/r/mentalhealth/comments/1cahtk0/opinion_needed/
88,BPD Recovery |DBT Skills Group Week One | In The Moment,,1377778516.0,False,3,0,touchingelephants,None,1lbqjg,http://touchingelephants.com/2013/08/29/bpd-recovery-dbt-skills-group-week-one-in-the-moment/
89,Another BPD Crisis &amp; Why the DBT Didn't Work Out |BPD Update,,1382454321.0,False,1,0,touchingelephants,None,1ozae3,http://touchingelephants.com/2013/10/22/another-bpd-crisis-why-the-dbt-didnt-work-out-bpd-update/
90,Which therapy for BPD with conscious self sabotage?,"Hi, I'm really sorry this is so insanely long, I've been unironically re-editing it for 2 hours 💀 even with chatgpt and stuff, I'm finding it hard to express myself, the original text was twice as long :/ I'm self aware of how childish and kind of narcissistic I sound as a person.

So I have BPD and probably ADHD, and I was thrown out of DBT (and another time I left myself, even though I had sacrificed a lot to get that spot) because they said I need more intensive (individual) therapy due to my lack of motivation. Basically only 40% of me wants to get better, and at least 60% actively and consciously wants to get worse, because of many reasons. It's been like this genuinely my entire life. It's a love-hate relationship, but tbh my disorder is all I have, I love it, and I don't really regret any of the things it's caused. Even though I'm miserable. I go in circles: I pretend to myself I want to go forward, but subconsciously I know I always go one step forward, two steps back, because I really just want the freedom of never having to commit to either hell or heaven, but always allowed to oscillate between the extremes, enjoy both of them, never truly change anything. Few days ago I read the term ""approach-avoidance repetition compulsion"", and it struck a cord with me. With everything.

Ofc I don't JUST struggle with conscious self-sabotage and emotional masochism, I have the full range of BPD symptoms, but it's a barrier to even working on them. I'm not sure how DBT can truly help me if I'm not even sure if I like happiness, or health, or responsibility, or in fact lean towards a no.

Recently I've want to know about psychodynamic therapy. I used to dismiss this as ""fake Freud mumbo jumbo,"" but recently I'm not sure. I feel like I need something that's less surface level than DBT... There are aspects of my psyche and childhood that genuinely puzzle me, and maybe understanding and processing them is essential before I can move on. I don't think so, but people often suggest there's repressed childhood trauma; obviously DBT couldn't care less. Subjectively I feel like a not crazy severe, but complex case, with a weirdly convoluted inner life. Maybe it's my annoying personality, but I always feel subtly broken in intricate ways that me and others barely understand, which must be impossible to untangle... :/

So, my question is, can psychodynamic therapy help me with this? Or is motivation a strict prerequisite there too? People say ""I can't help you if you don't want to get better"", but I don't know what they want from me. I can't change what I want and believe and feel on a deep level. And some part of me does want change. Would any sort of TFP, MBT,  or idk, ST or whatever, be able to help me WANT to change in the first place when I'm deeply resistent to change and very comfortable being sick? Or am I just doomed, or need to go down a darker path before I can get better? I'm not really sure who the therapies are for, or which presentations they help most

TL;DR: got kicked out of dbt and need to know which kind of psychodynamic therapy can help me with my lack of motivation + desire to get worse + fascination with misery and darkness. If any can.",1695619885.0,False,3,0,Philosophyofpizza,None,16rjiel,https://www.reddit.com/r/mentalhealth/comments/16rjiel/which_therapy_for_bpd_with_conscious_self_sabotage/
91,Difficult Relatives at Thanksgiving: Surviving the Family Gathering with DBT Skills (Part I),,1415333406.0,False,2,0,biblioteque5,None,2ljr8a,http://www.parkslopetherapy.net/2014/11/difficult-relatives-at-thanksgiving.html
92,"""Its Just the Way I'm Feeling"" | BPD Recovery [DBT Week 3]",,1378980522.0,False,2,0,touchingelephants,None,1m8l2a,http://touchingelephants.com/2013/09/12/its-just-the-way-im-feeling-bpd-recovery-dbt-week-3/
93,I can’t get out of my own way.,"I’ve been in a Radically-Open DBT program for over a year now. Originally I assumed I would complete the program in 9 months and “graduate,” but I have not been making improvements or using the skills, and therefore I’ve started the program over again. 

I can tell that the skills we learn would likely be so helpful, and I can tell they are designed to benefit us and help us feel better in the long run. I believe in DBT and I trust that mental health professionals know more than I do. I trust the current DBT center I’m working with and believe they have everyone’s best interests at heart. But for some reason, I just cannot seem to implement the skills being taught. I am insanely scared of losing control, being in uncomfortable situations that I can’t escape from, and losing myself completely. 

For some context, I did have a bad experience with a former therapist who chose to quit on me spontaneously mid-session and then kicked me out when I had a panic attack about it. I have a lingering fear that my current individual therapist will quit on me, tell me she can’t help me anymore and that DBT isn’t working and send me on my way to figure out something else. I’ve told her about my trauma and my fears of being abandoned, and she’s reassured me that she’s not going anywhere. But my friend from our skills class got kicked out for not giving other people enough chance to talk, sharing too much, asking too many questions, etc. so I know they could kick anyone out of the program if they wanted to (they were nice to her and suggested that a support group would be better for her needs but the fact that she got kicked out scares me). 

I have such a hard time implementing the skills that are being taught. I can’t stand small talk, talking to strangers, etc. and I have an extremely hard time making eye contact, displaying open social signaling, etc. I’m scared of people taking advantage of me so I feel like I have to be a frozen brick wall at all times. 

My individual therapy sessions have gone downhill significantly. Ive always cried a lot in our sessions because she tells me a lot of things I don’t wanna hear, but lately it’s increased tenfold. I feel insanely inferior around her, like I’m a terrible student and she’s a disappointed teacher. I cannot look her in the eye and I’m finding it harder and harder to be myself in front of her because it feels like everything I say or do is being scrutinized and judged. I know she doesn’t purposefully pass judgment on her clients in a negative way, but I’m “aware of imagining” (awareness continuum) that she thinks I’m a heartless, selfish, self-victimizing person. My crying in session has been pointed out as a “don’t hurt me response,” implying that I’m trying to manipulate and control the situation by crying and acting hurt so she stops giving me feedback I don’t wanna hear. I guess subconsciously I could be doing that, but in all honesty I feel like I can’t help it. The crying is very real and I feel broken inside. I desperately want to be understood but don’t feel like I am. 

I’m too scared to make the necessary changes. I’ve dug myself in so deep that if I were to get better, I would feel bad about myself for being “wrong” and my therapist could be thinking, “I told you so.” I feel that I’m incapable of making the changes, but every time I say that, she says “what are you trying to communicate by saying that?” As if I’m telling her indirectly that I’m refusing, but the truth is I’m SCARED that I’m incapable and I’m looking for her to prove to me that I am. But I know she can’t. 

Not to mention the program is insanely expensive, my mom is paying for it, and I feel extreme guilt that I’m not making the most of it. 

I don’t know what I’m asking for in this post, just to be heard I guess. ",1709765513.0,False,2,3,jeannesloaf,None,1b8dwma,https://www.reddit.com/r/mentalhealth/comments/1b8dwma/i_cant_get_out_of_my_own_way/
94,How can I break up with my therapist who isn’t helping me with my mental health?,"I saw a great therapist for 5 years. She has a DBT approach and is great at helping me heal trauma. My insurance changed and I started with a new therapist who has A) been overcharging me (just found out) and B) is really judgmental and C) starts appointments late and never remembers if we rescheduled or gets pissy when I reschedule.

I decided to see my old therapist again but as a private client. I have an appointment with the therapist I’m leaving Friday but need to cancel but I’m afraid to because of her attitude. What should I do?",1713284646.0,False,1,2,legitanonymous__swag,None,1c5kbns,https://www.reddit.com/r/mentalhealth/comments/1c5kbns/how_can_i_break_up_with_my_therapist_who_isnt/
95,"Where can I go, who can I call if I just need to be pointed in the right direction mental and somewhat physically health wise?","I’ve been on 40+ psych meds, 20+ supplements, dTMS, esketamine, cbt and dbt therapy, neurofeedback, and NAD+ IV. I’ve also gotten nerve blockers and Botox to try to help with my head tension. It did nothing to alleviate it.

Please, please help. The worse it gets the less people want to help me. The worse it gets, the less I can advocate for myself. Please.",1707517630.0,False,2,2,throwawayperson911,None,1an0imc,https://www.reddit.com/r/mentalhealth/comments/1an0imc/where_can_i_go_who_can_i_call_if_i_just_need_to/
96,What’s the point of therapy?,"I know the reason for it, it’s just not helping me. I go every week, but my issues aren’t day to day. Could I just be doing the wrong kind? I wanted to do dbt but I was put in cbt. I was told that therapy doesn’t necessarily help bipolar and that it’s meant for tools during symptoms and so I don’t become convinced to stop taking my meds. My therapist also doesn’t specialize in bipolar so I don’t know if that’s also a reason it’s not helping.",1707319959.0,False,4,9,Senior-Breakfast6736,None,1al5lwp,https://www.reddit.com/r/mentalhealth/comments/1al5lwp/whats_the_point_of_therapy/
97,When I get angry all I want is my boyfriends comfort but obviously that never happens because no one wants to be around someone who’s angry,"Like why tf is it so hard to self soothe? Why does it have to feel so lonely? Why do movies have to make relationships seem so beautiful and like you’ll help eachother through anything when the reality is 99% of the time it’s basically like being single and you have to help yourself? Why couldn’t I have just been born with an avoidant attachment style? I’m in DBT but I don’t I’m ever going to not want to be comforted by him. Writing it down sounds selfish but how do I accept never getting what I want? I feel like nothing ever goes right for me. 

I mean now. I’m writing on Reddit. Because internet strangers is better to me than myself? I hate this. I haven’t felt suicidal in so long but I’m sat here thinking what’s the fucking point I feel like I’m just going to be sad forever? Everyday somethings goes wrong with me. I mean today all it was that I lost my earring. Why  is something like that making me feel absolute rage? Like yeah, I could use a DBT skill to calm down. But I’m angry it made me feel this angry in the first place.",1698100049.0,False,2,1,shammmmmmmmm,None,17ex29f,https://www.reddit.com/r/mentalhealth/comments/17ex29f/when_i_get_angry_all_i_want_is_my_boyfriends/
98,I am so desperately looking for help that I cannot get.,I have a psychiatrist who gives me meds for all the mental illnesses I have but it doesn’t seem to be enough. I was suggested DBT to help me with my motivation and abandonment issues. There are no DBT therapists that accept my insurance around me. The only one I found keeps flaking on me. I want help and I’m looking for DBT to help with my BPD but the pills and the therapy I get from my psychiatrist aren’t enough. I am sick of being helpless but it’s the only thing I know.,1633117676.0,False,13,14,J0taa,None,pzfmue,https://www.reddit.com/r/mentalhealth/comments/pzfmue/i_am_so_desperately_looking_for_help_that_i/
