,Comment,Author,Post
0,"adhd and dbt also go well together, it's not only for bpd patients",,1b2thny
0,"I would recommend giving it a try. I was gifted a DBT workbook and had little context as to how to use it so I think it’s great that you’re looking into it more. It is helpful to have some help working through the concepts. You can find videos on line that introduce you to some of the key concepts and skills. However, if available near you and affordable for you, try a group therapy or class on DBT skills. Perhaps an IOP program that is part time or has other offerings is an option. I also recommend seeing a therapist that uses DBT in treatment. I went to a DBT therapist through a university hospital and we solely focused on skill building and I got so much more out of it.",Gerianne19321932,1c0byzw
1,Oh and best of luck to you! You got this! ✨,Gerianne19321932,1c0byzw
2,I feel more determined to do it after reading your reply! Thanks 😊,Positive_Ambition_63,1c0byzw
0,"https://www.reddit.com/u/swild89/s/ff1yDv96UI

There’s some DBT workbooks for free here if you’re interested. DBT is a lot like CBT if you’ve learned about that",swild89,1bjclws
1,Thank you!,Training-Cup5603,1bjclws
0,"Hello, I'm looking for this too. Did you find someone?",Champagne_Supernova3,18tvbjv
1,"There are plenty of expert psychologists in Mibo Health and Happiness, Bangalore. Located in Jayanagar. Highly qualified psychologists with lots of experience.",mibo_care,18tvbjv
2,[deleted],,18tvbjv
3,[removed],,18tvbjv
4,"This site made me worse, soooo don't recommend!",90sRnBMakesMeHappy,18tvbjv
5,"This site made me worse, don't visit!",90sRnBMakesMeHappy,18tvbjv
6,We're sorry to hear that. Can you tell us why you felt that way? We'll try our best to resolve it.,mibo_care,18tvbjv
7,Can you tell us your query in detail? We'll help fix it for you,mibo_care,18tvbjv
8,"Dude just private messaged me asking to see his junk, fucking weirdo",90sRnBMakesMeHappy,18tvbjv
9,"Account has been banned from the community, thanks for flagging!",swild89,18tvbjv
0,Happy to talk later. its sleep time here. Not  talk about dbt but mindfulness and the way we reject and oppose everything .it's our thinking.,nonamenouse2020,12dfbmw
1,"What parts of mindfulness are you struggling with? For me, the idea of meditating made me want to jump out of my skin and scream. Buuuut, grounding exercices really helped in a panic, and stretching was a good way of getting to the present by just being in the moment with my body and mind.",swild89,12dfbmw
2,"First, I want to say that DBT is backed by solid evidence. It was better than the other treatment for BPD in 8 studies (source - book by Roemer and Orsillo).  
  
One way to look at mindfulness is that it's just awareness. Some people make this look like it's more complicated than it really is.  
  
Just being careful in what you do is a kind of mindfulness. The teachers will sometimes tell people to do some common household task like washing and drying the dishes, paying careful attention to the feelings in your hands and the sound of the water. You can look up ""grounding exercises"" and find other things like that.  
  
Maybe if you talk about this with your therapist you can get some good advice about this.  
  
Another thing is that DBT has very useful methods for coping in a moment of crisis, when you think you might hurt yourself. Above all, know those methods. It's very simple things like paced breathing and simple distractions, whatever changes your mood like your favorite music or a funny video.  
  
DBT paced breathing   
  
  
This will make you feel better and let you think clearly. A very easy way to calm down is just to breathe slowly. Dialectical Behavior Therapy recommends this - breathe gently, hand on your belly to feel it go in and out, and breathe 5 seconds in-breath and 7 seconds out-breath till you feel OK.",RWPossum,12dfbmw
3,So it’s not just me? Everyone feels kind of weird about it at first or? Bc I feel super guilty towards the other people in my group cause I’m super negative about it.,psychobreathless,12dfbmw
4,"Specifically wise mind right now and the breathing exercises. Just trying to become one with your body i guess. Meditation isn’t for me either. I’m fine with observing and describing what I’m seeing or feeling, but it doesn’t click with me somehow. Bc how is that going to help me get out of my mind, since my mind is then running with all these thoughts that may upset me, you know? What kind of grounding exercises did you do? Bc I don’t think we’ve covered that yet.",psychobreathless,12dfbmw
5,"Grounding is getting you back to the present here and now moment, works when you’re too in your head or feeling disconnected (like when dissociating or panicking). it can be sometimes as simple as a cold shower/splash of water on the face. There’s the 54321 technique (https://www.choosingtherapy.com/54321-method/). 

Wise mind is a tough concept, don’t be too hard on yourself with wrapping your head around that one, that’s time and practice with your therapist analyzing tough situations and getting a grasp on how to apply it

There’s also the subreddit r/dbtselfhelp that’s got people also struggling if you’re ever interested:)",swild89,12dfbmw
6,"Ohhh okay! The way you’re explaining it sounds more graspable. This technique is not something we’ve discussed but wish we did bc that makes more sense to me than the other stuff. I could definitely try this instead at first. 

Yeah, I also feel like I’m never in that state. I’m either very rational or very emotional. Nothing in between for me. 

Thanks for your advice and comment. I wil def check out that Reddit you suggested and the 54321 method sounds worth a try. Thank you :)",psychobreathless,12dfbmw
0,"Here are some basic links for people who are drawing a blank (google ai results)

[Cognitive behavioral therapy ](https://g.co/kgs/MYgdyu)

[Dialectical Behavioral Therapy ](https://g.co/kgs/s2F2uV)",PlanetExpre5510n,18mxz8z
1,"DBT is an offshoot of CBT. CBT is the most commonly used therapy type for it’s ease of use,  and it’s the most « scientifically sound » and backed up theory. 

However, CBT doesn’t work for everyone, and people diagnosed with BPD are one of those groups that sees less success with CBT. 

DBT was created for those with BPD but is now being used for people with different diagnoses and symptoms. 

DBT is super effective for BPD, There is research showing high success rate and remission of symptoms after even a year of treatment. 

if you’re interested in some free DBT or CBT workbooks I’ve got some [here](https://www.reddit.com/u/swild89/s/HliBbn91Xf)",swild89,18mxz8z
2,"DBT was designed for helping people with borderline personality disorder, a serious mental illness, and is the treatment with the best evidence for treating that disorder. It can help with self-harm and other serious behavior problems, also anxiety and depression. There are people who say that DBT was more helpful than CBT for their anxiety. However, considering the greater time, effort, and cost of DBT, many people will prefer CBT.",RWPossum,18mxz8z
3,"Close. Marsha Linehan said it was designed for helping chronically suicidal young women, but standards at the time forced ""evidence based"" treatments to pick a disorder rather than a symptom, so she chose BPD because of the high overlap.

Also most studies examining DBT skills training against ful DBT have shown virtually no difference in outcome. While full DBT is more time consuming and costly, skills training is fairly accessible and can be done in a group format.",let_id_go,18mxz8z
4,"You Couldn't be more wrong.  About how it is effective and where. and insurance companies are catching on that often therapy using DBT leads to Discharge as much as 5 years earlier. That means it works so well you become your own therapist. They are willing to pay more now and less later more and more with this treatment.  


Reading the history of a treatment doesn't negate its value in other arenas. 1.6 percent of americans have BPD. Something like 60 percent of clinics nation wide offer DBT

&#x200B;

WHY?

DBT works better for anyone resistant to cbt for any reason. And its NOT limited to BPD.  BPD just happens to be the Golden example for ""resistant to traditonal therapy"" and having a high mortality rate needed to be addressed with new methodology

proven to Work for ADHD, Bipolar, Self harm, Eating disorders, Major depression. and CLUSTER B personality Disorders. and yes BPD. These Illnesses together account for SUPRISE around 60 percent of patients.  Most of these illnesses are developmental! So if you had some Messed up stuff that started as kid DBT might really work for you!  


[Source](https://behavioraltech.org/evidence/)",PlanetExpre5510n,18mxz8z
5,"The studies of DBT skills training are very important, given the difficulty many people have in accessing full DBT and the difference in drop-out rates.

In *Psychiatric Times*:

""The available research suggests that DBT skills training is a critical component and mechanism of action in DBT and can be effective as a stand-alone or adjunctive intervention for a variety of conditions. The strongest evidence exists for brief DBT skills training as a stand-alone intervention for binge eating disorder and bulimia nervosa. In addition, moderate evidence exists for the efficacy of brief DBT skills training as an adjunctive intervention to antidepressant medication for individuals with MDD, as well as a stand-alone intervention for ADHD. Two trials have shown promising results for DBT skills training for borderline personality disorder, but the findings require replication because of the notable differences between trials in treatment length, the use of adjunctive treatment components, and the severity of illness.""",RWPossum,18mxz8z
6,Follow up DBT is Covered by most insurances nationwide and a large number of states cover it with medicaid.,PlanetExpre5510n,18mxz8z
0,"DBT is the therapy with the best evidence for treating borderline personality disorder. There are people who say that it was more helpful than CBT for their depression, and anxiety is an important aspect of PTSD.   
  
Article   
  
https://www.anxiety.org/dbt-dialectical-behavior-therapy-compared-to-cbt  
  
The trigger reaction is a fear reaction, a sense that you're in danger. A simple way to deal with a fear reaction when you're not in danger is to say to yourself ""It's OK - I'm safe"" and breathe slowly till you feel OK.  
  
DBT has coping methods, like paced breathing. You breathe slowly and gently while counting seconds - 5 sec. to inhale, 7 sec. to exhale.  
  
A study at Stanford (video, below) in which war veterans - some of whom had not been helped by other treatments - experienced anxiety brought down to normal levels after one week of slow breathing therapy, and good results a year later.  
  
https://www.youtube.com/watch?v=Uvli7NBUfY4&t=3s",RWPossum,17tzctm
0,"Thank you for for sharing. A reminder: if you are seeking resources in your local area, please provide that in the post so that users can share appropriate links and phone numbers. *If you are in distress, please call 9-1-1* or your local emergency number. *You are not alone. Help is available.* If you are having suicidal thoughts, please [click here for a list of crisis support services.](http://www.suicide.org/international-suicide-hotlines.html), If you are seeking therapy online, please [click here for a list of counselling services.](https://thelifelinecanada.ca/pattern-interrupt/ecounselling/) *If you feel well enough to do so, please do your part to enrich this community.* Now that you have posted, please leave a constructive, helpful comment on someone else's post. Filter by new to find posts with zero comments. Together, we make this community great. Thank you for being here. 


*I am a bot, and this action was performed automatically. Please [contact the moderators of this subreddit](/message/compose/?to=/r/mentalhealth) if you have any questions or concerns.*",AutoModerator,tcpwui
1,"SunFlower, I suggest you take a look at [DBT Self Help](https://www.dbtselfhelp.com/), which contains many DBT videos and links to resources. This site was primarily built by pwBPD who have taken the DBT training and are describing -- in many videos -- what they experienced and learned. They also provide a list of recommended DBT workbooks. Some professionals also contribute to that site.",Up-Town,tcpwui
2,"Its not uncommon to feel that way in DBT (its not uncommon to feel that way with BPD in general, but you are asking about being in DBT in particular).... after 3 months I'd expect you to be able to say you have obtained some skills, been able to practice and apply them, be able to see even a small difference.  I'd definitely recommend telling your therapist how you feel.  They \*should\* be able to address your feelings and work with you to increase feeling heard.  No therapy will help if you don't feel heard.",Onlydoc,tcpwui
3,"My partner has CPTSD and recently completed DBT. It’s not a transformative thing, you have to practice a lot and you will fail a lot. Keep reviewing the material and practicing.",,tcpwui
4,"What DBT skills have you learned? Have you been putting them into practice everyday? Are they working? Attending DBT but not practicing would be like going to cooking school and never cooking on your own. 

DBT is a behavioral therapy so there is much less room for talking and processing than most therapies. That’s a great fit for some and not so much for others. 

Say somebody who is self-harming due to overwhelming shame. DBT would combine distress tolerance with emotion regulation skills and help that individual to change their response to shame, rather than primarily talk about the shame itself and root causes.",randomlygeneratedadv,tcpwui
5,"People often say this about DBT - that's it's hard, that it's worth the effort.

If you learn nothing else, learn the distress tolerance methods - paced breathing, etc.",RWPossum,tcpwui
6,"I can relate.  I wasn't seeing much change at this stage either.

I kept at it.  At about the sixth month, I *did* start to see improvement.  I saw significant improvement after a year.

I do stress that I also did work the hell out of the program, and once I did start to see some success, I worked it even harder.

Keep at it.  You can do it.",yskoty,tcpwui
7,"I did dbt in 2015, or around there, and I'm doing it again now. I dont have a diagnosis of bpd, but I believe dbt can be helpful for everyone and the skills should be taught in schools. Personally, I love dbt. I love the practical application of skills. I like how I can be struggling with something and it be like oh, hey. I can use pros and cons, or check the facts! I also find phone coaching to be helpful. 

Honestly, I hate the group format. I struggle with that, and get very on edge for the 2 hours I'm in group, but even my dislike for that has been helpful because its forcing me to get comfortable with things I don't like, or radical acceptance, if you will. 

If you dont like it, that is ok. Everyone is allowed their preferences. I suggest sticking with it & really practicing your skills. The stats are pretty amazing for bpd treatment. Upwards of 77% of people no longer meet the diagnostic criteria for bpd after 1 year of dbt.",,tcpwui
8,Thanks for the tips :),SS_UNFLOWER,tcpwui
9,"Yeah I've been trying to practice the best I can, except it's hard. 

Thanks for the insite",SS_UNFLOWER,tcpwui
10,That you :) I'm doing distress tolerance right now. I'll keep that in mind thank you,SS_UNFLOWER,tcpwui
11,Thanks for the tips and the encouragement :),SS_UNFLOWER,tcpwui
12,"DBT might be one of the hardest things you'll ever do - no joke!

When things aren't going well in your life and your emotions are running on max, distress tolerance and emotion regulation skills are literally the last thing you want to do. But probably also exactly what you need most. 

Stick with it and hopefully you'll reap the rewards later. Good luck!",randomlygeneratedadv,tcpwui
13,"My pleasure.  There is a whole bunch of tools in there.  I did find that some of them didn't really work for me that well; others, extremely well.  I try and have as many as I can, for I also find, and I can obviously only speak for myself, that not all of the tools work in all of the situations.  By having a lot of them, I can quickly switch between them until I find a helpful one.

I'm not perfect at it.  Not by any means.  It takes practice.  And I can still, and sometimes do, fly off the handle and stomp around and act like a two year old.  This happens far less often than it used to, however, and when it DOES happen, I find I can use my DBT skills to re-center faster.  No, I'm not perfect at it, by any means- but I'm getting better, which, to be honest, in some ways, simply makes my heart soar.  Those around me don't get it; they say thing like ""yskoty's finally growing up,"" and ""what do you want, a medal?""  They simply cannot comprehend how much work I had to put in to get to this point, and, yes, this really IS a big deal!

That's really the bottom line here, SS_UNFLOWER.  How bad do you want this, and how hard are you willing to go after it?  

You can do it.",yskoty,tcpwui
0,"Thank you for for sharing. A reminder: if you are seeking resources in your local area, please provide that in the post so that users can share appropriate links and phone numbers. *If you are in distress, please call 9-1-1* or your local emergency number. *You are not alone. Help is available.* If you are having suicidal thoughts, please [click here for a list of crisis support services.](http://www.suicide.org/international-suicide-hotlines.html), If you are seeking therapy online, please [click here for a list of counselling services.](https://thelifelinecanada.ca/pattern-interrupt/ecounselling/) *If you feel well enough to do so, please do your part to enrich this community.* Now that you have posted, please leave a constructive, helpful comment on someone else's post. Filter by new to find posts with zero comments. Together, we make this community great. Thank you for being here. 


*I am a bot, and this action was performed automatically. Please [contact the moderators of this subreddit](/message/compose/?to=/r/mentalhealth) if you have any questions or concerns.*",AutoModerator,107sd9o
1,"What specifically about DBT you think makes you feel that way? Is it the mindfulness part?
Edit: to be more clear",a_lost_soul_creature,107sd9o
2,"Don't give up! Change your attitude as best you can. Reward yourself for going and think of it as ""me time"" for self improvement. Use the time to reflect and focus on yourself. You are resisting the teaching instead of giving it a chance. You don't have to believe everything, but there are some good tools in there that might help you when times get tough.",CookieAndFern,107sd9o
3,"Try and hold through the DBT. I did one about half a year ago, and it really is difficult. There will be countless times where you'll feel like you won't be able to do it. But once you are nearing the end, and afterwards you'll see the value in it, and how it helped. I don't know a single person who doesn't look fondly back to their time in DBT, even though it was really difficult. 

You can do it! The fact alone that you were able to do it till now shows that. I believe in you pal!",Stillgelegt,107sd9o
4,"They keep telling us to remember the last time we had negative thoughts, and the memories are painful so I’m trying to suppress them. I remember the hospital and the nurses telling me I was acting, I remember trying to hang myself, I remember my thoughts at the time and how negative they were, I remember everything, my friends betrayal, being bullied, trying to kill myself. I remember it and it hurts too much, it feels wrong, I feel uncomfortable thinking I was like that. I don’t want to remember.",I_Love_Cyndaquil2,107sd9o
5,"I am using the tactics there. It’s just that they make me try and remember when I was depressed and it hurts too much. It’s so painful to remember, I remember my self harming, my thoughts, the hospital. And it hurts. I’ve been trying to think positive and suppress these memories, and I have a journal from when I was depressed so I can reopen the memories and I have advice if times every get tough again, but right now I don’t want to remember.",I_Love_Cyndaquil2,107sd9o
6,"You are 6 sessions in, and in a commendable way committed to the therapy. So, for that congrats. Yes, while I understand it can be very traumatic, it is meant to feel cathartic. A sense of release. Sometimes unresolved feelings and pent up emotions. It's the mindfulness part of the DBT therapy that should help you in ""coping"" with the uneasiness. This is the part that ""trains"" you to merely observe without judgement. Almost in a way to go outside your body and witness how you feel without guit, shame. When you let your therapist know this what did he/she say?",a_lost_soul_creature,107sd9o
7,I hear what you are saying. It's hard and I have my own struggles and you have yours. They are not the same and you need to do what is good for you. You can always take a step back to take care of yourself and then try again when you are in the right place.,CookieAndFern,107sd9o
8,"I never told my therapist, we are in online meetings and we don’t actually get to talk to our therapist we just listen to what they say.",I_Love_Cyndaquil2,107sd9o
9,"I am not an expert, but seems like you are needing therapy from your therapy session. You should at least speak to your therapist to see what he/she says. Especially in the ""How are you doing?"" part of the therapy session at the beginning.",a_lost_soul_creature,107sd9o
10,We don’t have a how are you doing part… they just jump right into lessons…,I_Love_Cyndaquil2,107sd9o
11,"Find a way to bring it up in conversation either before or after. If the therapist is not aware, they just won't know and you are the only one suffering :-(",a_lost_soul_creature,107sd9o
0,"I'm currently in the DBT program here in Canada! It's perfectly normal to be nervous to try something new, don't let that fear stop you from joining though. 

I have been in and out of different types of therapy for the last 15 years and I will say I haven't noticed much change until I got into DBT the first time. 

Make sure you do the homework! The meditation aspect can be a little hokey but the distress tolerance skills they give you are amazing. Again though, you gotta do the homework and give it your best shot. Think of your brain like a puppy, it's all about training and practice. The more you practice the skills they give you the easier it will become. 

Congratulations for getting in! Proud of you and I know you got this!",bleepbleepnosleep,10rwefm
1,Thank you so much :),sadocean13,10rwefm
0,"Thank you for for sharing. A reminder: if you are seeking resources in your local area, please provide that in the post so that users can share appropriate links and phone numbers. *If you are in distress, please call 9-1-1* or your local emergency number. *You are not alone. Help is available.* If you are having suicidal thoughts, please [click here for a list of crisis support services.](http://www.suicide.org/international-suicide-hotlines.html), If you are seeking therapy online, please [click here for a list of counselling services.](https://thelifelinecanada.ca/pattern-interrupt/ecounselling/) *If you feel well enough to do so, please do your part to enrich this community.* Now that you have posted, please leave a constructive, helpful comment on someone else's post. Filter by new to find posts with zero comments. Together, we make this community great. Thank you for being here. 


*I am a bot, and this action was performed automatically. Please [contact the moderators of this subreddit](/message/compose/?to=/r/mentalhealth) if you have any questions or concerns.*",AutoModerator,yxb95c
1,"I noticed and had the same reaction. Googled ""Phil Stutz Marsha Linehan"" to see if anyone else connected the ""new age dbt vibe"" for lack of a better description & you are the only person I've seen so far to discern those parallels as well. Radical Acceptance is certainly Marsha's & while I was very impressed with the film, I wish some credit would have been given to her. 
That is not to say that she herself didn't borrow heavily from Eastern religion when constructing dbt but she at least cited that.",ithinknothingisreal,yxb95c
2,I liked the documentary and Stutz himself but thought a lot of the ideas were not unique to him.  I wish that had been acknowledged.,,yxb95c
3,"I was also wondering if there were almost citations for many of the concepts because there are a few that I recognize, so there could be more that aren't getting their due credit.

Radical Acceptance - Marsha Linehan and also Tara Brach

Gratitude Flow - is very very similar to Tonglen meditation

and the concept of being ""squeezed"" and dealing with the unbearableness comes from Trungpa Rinpoche, which Pema Chodron credits her master with.

I'm all for people doing their own edit of things in a way that might speak to a more diverse audience, but damn put a visual footnote or something in there. I know they're going for a certain flow of the conversation, but it comes off as just more white men taking credit for things they did not come up with on their own.",Minnniefuego,yxb95c
4,Doesn't radical acceptance come from the top Alcoholics Anonymous tenets?,Prudent_Soft_1228,yxb95c
