,Comment,Author,Post
162,"I don't live in the US, I've been waiting for 5 months for a bed in the only psychiatric hospital my insurance will pay for. I've almost jumped off a building twice in that time, and all that happens is a 24 hour solitary suicide watch hold, then I get sent back home and told it won't take that long anymore. I've been going through manic phases, sometimes waking up at places I don't know or to things in my room I don't remember getting or even mizzing entire days from my memory. And yes, I've been to every single charity and help organization, even the fucking church (I'm jewish and have never been in a church before) just to get told they can't do anything while I'm waiting for treatment because all they can do is set me up with the appropriate treatment, which I have done myself. If I don't get treatment or get medicated soon I might legitimately die because I'm doing something stupid like running in train tracks without consciously wanting to do it. And I live in Germany, a country with supposedly one of the best health systems in the world (which is true for a lot of parts except mental health treatment.) 

Honestly I can't imagine that these kinds of situations don't happen in the US. I'm actually flabbergasted by the arrogance it takes to look at a person dead by suicide or a severly mentally ill person living on the streets and say ""its their own fault. Tough luck."" But you know, you got help so everyone else must be in the exact same position to do so",Transthrowaway69_,eoe3jx
163,"Holy cow. I’ve genuinely never met someone quite as ignorant as you.

People know they need to get help. People also know that they have been turned down again and again. People also know that there are people like you working in the places to help. Honestly if I came in to get help and you just called me lazy, I would never go to seek help. You can’t go around claiming to be helping people whilst also invalidating others experiences.

They need to find that strength in themselves to get help. You can’t invalidate other people’s struggles and expect them to get help just because you were able to get ahead of the game.",,eoe3jx
164,"My comment history says it all? Okay, buddy. I'm not pretending to be a criminologist, I said I minored in it. I am a graduate student that is doing applied research. Do you know what that is? Maybe mind your business and you wouldn't be confused. Since this is also a new account, I am willing to bet that you are also the same person. Why don't you get help.",,eoe3jx
165,Literally look at your own comment history. You sound like a deranged individual.,,eoe3jx
166,"Thank you! I  actually specialize in cluster b personality disorders. I'm trying to research treatment methods right now, especially in sexually violent juvenile offenders. You probably didn't want to know that, but I also can't help talking about it since it's all I study most of the time. 

I truly hope this person leaves you alone. I seem to be having a hard time getting rid of them.",,eoe3jx
167,"It is scary, I feel partially at fault because I became petty and as soon as I doubled down on your comments it dragged you into his crosshairs even more. I think the best approach is to block these accounts and if he keeps bothering you send me a message and we can both report him. If he’s using multiple accounts they’ll be able to match his IP addresses and he’ll be kicked off of Reddit.",,eoe3jx
168,">Same as you.

No. Not same as me. Entirely different from me. You're going through *your* struggle, not *the* struggle, and certainly not *my* struggle. Just because you've been able to keep your head above water doesn't give you the right to put down people who are drowning.",SGTree,eoe3jx
169,[deleted],,eoe3jx
170,[deleted],,eoe3jx
171,"It's definitely not your fault at all. I got suuuper petty. Like you said, I allowed myself to get sucked into the toxicity. This person is clearly very mentally ill, and does deserve an amount of sympathy. At this rate though, I'm just going to make a new account. This is my third one in the past three months anyways lol. I keep having to start over for dumb shit. It was nice talking with you!",,eoe3jx
172,[deleted],,eoe3jx
173,Wow. You're a piece of shit.,Transthrowaway69_,eoe3jx
174,"Also, this is definitely the same person. Please stop, and please get help. On a serious note, if you need to talk this out, you can talk to me for sure, and I won't judge. Everybody goes through rough shit and acts out. 

If you wanna stop the bullshit, and have a decent convo, feel free to pm me. But if you're just going to continue to harass me, I'm going to ask you nicely to stop.",,eoe3jx
175,"Telling someone to ""man up"" is putting them down. 

I'm not saying that I'm the only one who struggles and that nobody gets me. I'm saying that every. single. person. on. this. earth. is. unique. Everybody struggles in slightly different ways, and we can form bonds based on similarities, and yes, encourage each other to seek help. But telling a person that it's their fault for needing help in the first place is not going to make anything better.",SGTree,eoe3jx
176,[deleted],,eoe3jx
177,[deleted],,eoe3jx
178,[deleted],,eoe3jx
179,"Nice to see you're so self-righteous you didn't read my comment and then claim I edited it because you didn't read it. I mark my edited comments. Also, you think I'd edit it and keep the typos in there? Gtfo dude and get someone to suck your dick about how great you are",Transthrowaway69_,eoe3jx
180,"You definitely need help. I am reporting all three of your accounts to Reddit, since you don't know how to stop harassing people. I did admit to my mistake too, and you continue to harass me. Leave me the fuck alone.",,eoe3jx
181,"Also, since you let me know what Sheriff's office you work with, I will be contacting them in the morning complete with all of the threads. Let's let them see if they are comfortable continuing to employ someone with a glaring personality disorder.",,eoe3jx
182,and where did he say he was a mental health professional? Where is his authority on this sub? Are you a moderator? I think the answer is no to all of those questions.,,eoe3jx
183,"But it's my fault for being ""lazy"" or not ""manning up"" enough. Cool. 

There's a difference between self pity and crippling depression yo.",SGTree,eoe3jx
184,"Dude I feel so terrible. This is awful, I blocked his accounts so I can’t see what he’s saying but it’s not hard to infer. I’ve got his original account name so I’ll report that one and make sure they know there’s 2 others.",,eoe3jx
185,His name is Mark.,,eoe3jx
186,[deleted],,eoe3jx
187,[deleted],,eoe3jx
188,Thank you. I'll try reporting his accounts to Reddit too before I delete my account. I was actually liking this one lol,,eoe3jx
189,"You are very clearly the same person. I think you forgot that on ""sam's"" account, you also said the same thing about not even being from america. And police actually take online harassment very seriously, especially if you are doing contract work for them. My uncle is a cop, who I will actually just contact myself and let him contact your sheriff's office instead. More credibility that way. I honestly just feel bad for you. But mostly for myself because I allowed myself to get sucked into your toxicity.",,eoe3jx
190,"If you can please stop harassing me now, that would be awfully nice of you.",,eoe3jx
191,"The fact that you went through a period of crippling depression gives you no insight into how my depression affects me. 

Just because you have ADHD doesn't mean you know how my ADHD affects my life and other aspects of my mental health. 

And since you have had a support system since you were six, you have no idea what it's like to go completely untreated until your teens or adulthood

Just as I don't know what it's like to grow up switching medications all the time. I'm sure that was hard.",SGTree,eoe3jx
192,"Don't delete your account for this clown, he'll go away and harass someone on a different subreddit tomorrow and likely won't remember any of this.",,eoe3jx
193,[deleted],,eoe3jx
194,[deleted],,eoe3jx
195,[deleted],,eoe3jx
196,"Lmao. I was right. That's all I needed to know, thanks. You are literally a sad, miserable nobody. Hope you feel better about yourself. I actually do lol.",,eoe3jx
197,"I haven't believed a word of what you've said, or any of the accounts that I have interacted with tonight. I don't believe literally anything you've posted. I have clearly demonstrated that throughout our interactions. That's how gullible you are. Trust me, you won't hear from me again. Good riddance.",,eoe3jx
198,You are insane.,,eoe3jx
199,">dying on the streets because I couldn't afford treatment

You should be outraged. No one should ever have to even think about ""affording"" treatment. There should be no applications to fill out to determine whether or not a person is worthy of help. It should just always be there. No matter what. 

Which brings us back to the whole point of this post. Good day.",SGTree,eoe3jx
200,"Oh my god...I saw his comments, this is one of the most terrifying people I’ve ever interacted with online. I’m staying as far the fuck away as possible from this guy.",,eoe3jx
201,"Yup. He's blocked now. If he keeps making new accounts, he will continued to be blocked. I just started Adderall for ADHD recently, and I can't sleep,  and I'm hyperfocusing lmao. Otherwise I would have never responded to this guy normally. Stay safe, friend!",,eoe3jx
202,"Check out my post history, definitely been there more times than I could count. You scared him off, he’s purging all of his comments on his original account lol",,eoe3jx
203,[removed],,eoe3jx
204,"Nobody scared us off, we just don’t like drama billy. Unlike you and the missus here. The only comments that got purged from any account were this post. Don’t feel so proud of yourself. We’ll be back.",mizzielephante,eoe3jx
205,And I thought you blocked me billy? Could it be you’re just obsessed?,samjacksonrelaxin,eoe3jx
0,"Thank you for for sharing. A reminder: if you are seeking resources in your local area, please provide that in the post so that users can share appropriate links and phone numbers. *If you are in distress, please call 9-1-1* or your local emergency number. *You are not alone. Help is available.* If you are having suicidal thoughts, please [click here for a list of crisis support services.](http://www.suicide.org/international-suicide-hotlines.html), If you are seeking therapy online, please [click here for a list of counselling services.](https://thelifelinecanada.ca/pattern-interrupt/ecounselling/) *If you feel well enough to do so, please do your part to enrich this community.* Now that you have posted, please leave a constructive, helpful comment on someone else's post. Filter by new to find posts with zero comments. Together, we make this community great. Thank you for being here. 


*I am a bot, and this action was performed automatically. Please [contact the moderators of this subreddit](/message/compose/?to=/r/mentalhealth) if you have any questions or concerns.*",AutoModerator,wro9lw
1,"I'm so sorry for your experiences. My doctor wants to put me on anafranil for OCD, but I've been on so many other medications that don't work that I don't want to try this one, with sexual side effects, and possible constipation.",Craft-Late,wro9lw
2,"I see you. Hold onto hope, love. 

I'm sorry you're going through this. Sometimes it really feels like doctors are just trying to shut one up. 

Valid. Love ❤️",SomewhereScared3888,wro9lw
3,"Hi.  Im starting in 3 days..  The seroquel is a killer on the sexual side for me..

Big hug.. 💞",Wavely1447,wro9lw
4,Big hug back ♥️,Craft-Late,wro9lw
5,Thank you💞,Wavely1447,wro9lw
0,"Thank you for for sharing. A reminder: if you are seeking resources in your local area, please provide that in the post so that users can share appropriate links and phone numbers. *If you are in distress, please call 9-1-1* or your local emergency number. *You are not alone. Help is available.* If you are having suicidal thoughts, please [click here for a list of crisis support services.](http://www.suicide.org/international-suicide-hotlines.html), If you are seeking therapy online, please [click here for a list of counselling services.](https://thelifelinecanada.ca/pattern-interrupt/ecounselling/) *If you feel well enough to do so, please do your part to enrich this community.* Now that you have posted, please leave a constructive, helpful comment on someone else's post. Filter by new to find posts with zero comments. Together, we make this community great. Thank you for being here. 


*I am a bot, and this action was performed automatically. Please [contact the moderators of this subreddit](/message/compose/?to=/r/mentalhealth) if you have any questions or concerns.*",AutoModerator,sfucoj
1,"It’s a pain. Sometimes I romanticize the times I didn’t care or try, I just did what I felt like doing with a feeling of invincibility. Of course I logically know that’s a terrible idea and I ruined plenty of relationships and caused permanent damage to myself and others. But it definitely takes a lot of energy to be better, and I’ll always be jealous of those who don’t have to try. 

It’s worth it though. Stick with it. It gets (slowly) easier the longer you go.",imsadandthatsall,sfucoj
2,"You are not alone, in my experience it is a very common thing to go through that sense of lack of happiness. I've done some stupid, impulsive stuff due to that. However, the fact that you feel like you have to chase happiness says something, and I don't mean to say that in a bad way but just maybe try to analyse your life, your actions. Are you doing things for yourself, or for others? Are you living the life that your are ""supposed"" to live or the life that you actually want? Happiness is not something we should try to get, searching for it is meaningless. What I mean by that is, that we shouldn't search or chase feelings, they usually are random, they come as we act or as we experience something. In my opinion, happiness comes when we do things that inspire us, that are connected to ourselves (amongst other things). Keep in mind that, just like grief, happiness is not permanent, and that is completely okay. Things end, just like everything, but I said it's okay because you did something meaningful for yourself and possibly for others, something that produced a sense of true happiness. Maybe DBT is not your way to go, maybe there is something out there that will give you the thing that you most desire. If you haven't, maybe try seeking professional help such as a psychologist or even talk to someone you trust. I truly hope that you find what your are looking for. Everybody deserves to have that sense of relaxation and happiness. A sense that you are doing things right, not for society, but for yourself.

Ps: I am not sure if what I've said is of any help at all. But I truly hope you find what you are searching for. You are important in this world.",MadSusi,sfucoj
3,"I would say that happiness shouldn't be the aim. It's an extreme, and a fleeting one at that.

Aim to be content. Aim to be satisfied. Aim to be comfortable with yourself.",4721Archer,sfucoj
4,"i’m tired too last year i didn’t want to live i felt like it was so hard to live and be happy. but did you know there’s a God that loves you and cares so much for you? God sent his only son Jesus to die on the cross for everybody’s sins. if you invite him into your heart and ask for forgiveness for your sins and ask him to be your Lord and Savior he will help you. He is the life and the happiness! He wants you have abundance of life through him ♥️

Jesus answered, “I am the way and the truth and the life. No one comes to the Father except through me. John 14:6",disbedizzle,sfucoj
5,"Definitely can relate. I used to be always a ""happy person"" but now I'm just forcing it for my family's sake and it is incredibly tiring...something is holding me back from changing...",Shibachan537,sfucoj
6,Are you the one telling yourself to be happy or is it someone else telling you to be happy?,FarEstablishment9149,sfucoj
7,"Thank you for your reply. It really helps hearing I’m not the only one, but also sucks hearing others have to go through this too. I appreciate you telling me it’ll get better, thank you :)",ghostprncss,sfucoj
8,Thank you so much for your kind words and advice. I appreciate it so so much. Thank you so much for taking the time and care to help.,ghostprncss,sfucoj
0,"Thank you for for sharing. A reminder: if you are seeking resources in your local area, please provide that in the post so that users can share appropriate links and phone numbers. *If you are in distress, please call 9-1-1* or your local emergency number. *You are not alone. Help is available.* If you are having suicidal thoughts, please [click here for a list of crisis support services.](http://www.suicide.org/international-suicide-hotlines.html), If you are seeking therapy online, please [click here for a list of counselling services.](https://thelifelinecanada.ca/pattern-interrupt/ecounselling/) *If you feel well enough to do so, please do your part to enrich this community.* Now that you have posted, please leave a constructive, helpful comment on someone else's post. Filter by new to find posts with zero comments. Together, we make this community great. Thank you for being here. 


*I am a bot, and this action was performed automatically. Please [contact the moderators of this subreddit](/message/compose/?to=/r/mentalhealth) if you have any questions or concerns.*",AutoModerator,sqtbrf
1,"I want to give you a look inside your sons head. Intrusive thoughts are unwanted and typically scary thoughts. Your son does not desire having sex with his siblings at all that’s not what’s happening. With intrusive thoughts the worst possible thing pops into your head and never reflect your real desires they are often things you fear. For me it’s what if you hurt your pets or stab your mom or stab yourself and yes what if you r*ped that person. None of these things I want to do. The thoughts terrify my as they do your son. I want to be clear your son doesn’t desire this and these thoughts are hell to live with. They’ve brought me to tears several times. I’ve had them since I was 11 or 12, I’m 18 now. I have only ever told 4 people about the sexual ones. They scare the shit out of me. Your son doesn’t want this, he doesn’t want these thoughts. You need to sit down and acknowledge how hard it was to tell you and tell him your are proud of him for seeking help, it’s such a hard thing to do. One thing that has really helped me is mood stabilizers and naming my intrusive thoughts. I named my intrusive thoughts phil the pedo and to my surprise it helped to acknowledge that these thoughts are not me. Your son is so scared right now I can guarantee it. Please give him a hug and tell him he will get through it because he will and be so so grateful he trusted you enough to tell you. Big hugs to you both

I want to add this is from my experience mental health has been a huge part of my life since I was very little and I have adhd, bpd, depression, an anxiety disorder, and ocd. My anxiety feeds my intrusive thoughts and then my intrusive thoughts give me anxiety it is a vicious hell cycle.",spicyhotcocoa,sqtbrf
2,"I don't really have advice but the fact that he's at least being honest with you about what's going on in his head is a good thing. Prayers , mama.",DueDevelopment127,sqtbrf
3,"Have you asked him what he thinks you all should do?

And, is it possible that, while you figure that out, one parent go and stay with him somewhere else - even if a hotel?",saladflambe,sqtbrf
4,"I am no professional, but I am familiar with OCD personally. I have intrusive thoughts as one of the symptoms of OCD which is based in part on how much I worry that I’m a bad person. Your child is experiencing thoughts and urges that upset him enough that he’s asked for your help. I don’t have any solutions, but if he has opened a dialogue with you, that’s a tremendously hopeful sign that he 1) understands that acting in those urges/thoughts is wrong and 2) genuinely does not want to act on those thoughts and urges. You can have no better foundation to helping your son that he knows he has a problem and wants to change. I’m sorry you’re going through this. It sounds awful. Don’t forget that you’re a person here and may need guidance/therapy to deal with the complexity of the situation. I wish you and your family the best possible solution.",volerider,sqtbrf
5,Sexual intrusive thoughts are more common than people think. If your son is not a danger to himself or others there’s not a lot the bhs ward can do unfortunately. He’d be better suited in an intensive out patient program. These kind of thoughts are extremely difficult to talk about but again more common than you think. Best of luck,spicyhotcocoa,sqtbrf
6,"Idk this sounds really severe and I'm sorry you're dealing with it. I would just say maybe try to get him off the internet, this place doesn't seem like a good place for that type of thing. And maybe try finding something else they enjoy and different ways to spend their time while you figure things out",Cornographicmaterial,sqtbrf
7,"There are treatment centers who have specific programs for juvenile sex offenders which I know is not exactly what is going on here but those clinicians would probably be better equipped to help your teen. As someone who was a counselor at a residential for two years (in California) and now does business development for that same center, I can confidently say 90% of residential will not admit your teen. The only residential that will be able to accept and treat your teen, are those with dedicated programs for sexual misconduct. Best of luck!",JM_SomethingHelpful,sqtbrf
8,"They do not have some sort of involuntary commitment to a mental facility where you live? You need to protect your other children before he causes them to have trauma/mental health issues as well. Unfortunately it might not be pleasant but again, you need to make sure they harm no one.",,sqtbrf
9,[removed],,sqtbrf
10,"Is he on T? It’s also possible this is super charging his libido. Not blaming that completely or saying that’s a catch all, but there are lots of hormones in action. Anecdotally I remember a trans man who identified as a feminist activist pre and post hormone therapy talking about how it shook him to be dealing with new objectifying thoughts.  

Therapy is helpful, of course, but also just sounds like a lot going on internally. May be helpful for him to have some space as he adjusts. Maybe a relative he can stay with? 

Invasive thoughts are more common than you’d think - violent or sexual ones can be pretty normal if you’re dealing with anxiety and/or a host of other mental illnesses. BUT, if this is seeming like he’s making plans or this is an illegal or non-consensual fixation then that requires a more serious intervention and observation.",buckthestat,sqtbrf
11,"Rent an Airbnb or something like that, separate him from the other children until you can find a permanent treatment and/or solution. 
Take that time to educate him on his condition and why he might feel the way he is feeling/how to prevent it/how to manage it etc. 
Keep honesty a central component to this experience.  
This situation sounds rough and I’m sorry you and your family are going through a rough time.",,sqtbrf
12,"I completely understand your frustrations. Its sad but true this is the state of things. I work with addicts and people suffering from mental health issues. The places you have to press and press to get call backs due to the infection we deal with now and places being understaffed. There is most of the time tons and tons of paper work to even apply. If you make it through ""step one"" it's then usually an initial interview that then needs a ""review"" through the board. Its truly sad there isn't at least one place people can just go when they feel they need help. When you look at it though the doctors and clinicians need as much information as possible to make sure their place is the right place for your son/any patient. It doesn't do patients any good to end up in residential treatment without the proper therapists/ psychiatrists to be there for them. 
You could try 90 day treatment facilities for mental health. I know recovery centers sometimes have beds for people with severe mental health diagnosis. The same will the case though. Lots of paper work and then they also have to have a bed. They can usually get you in quicker than residential though. During the 90 day stay could give you time to look for a good residential to keep him longer?? 
Good luck im sorry you're going through this right now. Im very thankful your son has a parent who cares though. That makes all the difference when you're going through treatment for mental illness. You're a good parent.",,sqtbrf
13,"I just want to say that even though he would be admitted through the ER, your teen wouldn't be staying in the ER for 6 months or however long it takes to find residential treatment, he would be staying in the under 18 psych unit having daily therapy groups and activities. While those groups wouldn't address his specific issues, its better than the ER or him abusing your other children in some way. He would basically be safe from himself and they would be safe from him.",RainbowHippotigris,sqtbrf
14,Maybe look into pocd,anomaly242488,sqtbrf
15,"How old are his brothers and sisters? If they are young please keep them away from him and always monitor him around them, dont leave them with him for a split second.  abuse can cause life long damage.",Throwaway1283838223,sqtbrf
