,Title,Post Text,Post Creation Time,Content Type,Post Score,Number of Comments,Post Author,Author Flair,ID,URL
141,Feeling Invalidated by Family for Getting Help,"(29F) I’ve been diagnosed with depression, anxiety, and PTSD. And I’ve been seeking therapy for years, and finally have a therapist who listens and offers good insights and advice. I’m also working on finding the right medication.

Recently, my therapist and I are starting narrative therapy and DBT therapy. The narrative therapy is supposed to help me change my perception of my past so I can think more positively about the future. And the DBT is supposed to help me regulate my emotions.

But my mom, who lost years parenting me the way she wanted due to illness, is against them 100%. She’s also protective of me because I also have several medical issues. 

She doesn’t see the point in either of them because I shouldn’t focus on the past and I haven’t had that many emotional outbursts. But actually, I’ve had breakdowns almost every night for months. So I feel like I need it.

I explained clearly why I think they’d be helpful, but she’s still upset that I’m going to another person with my feelings and not her. But I know trying to express my feelings to my mom is virtually impossible because she has so much going on medically she can’t take it. 

I am so concerned is that while I’m handicapped, I’m also an adult…who happens to be her at-home caregiver. So I can’t just ignore her. We can’t get help and my dad works all the time to make ends meet. And I’ve been unemployed all year, but am hopefully going to get accepted by an agency that should help me find work as a handicapped person. So I can’t move out for a while.

The only reason why I started telling my mom about my therapy sessions is because my therapist wants to go into the early years with my narrative therapy. And I don’t exactly remember what happened when I was a baby/toddler. So I had to go to her and my dad for details.

Now she’s mad at me because she feels like I’ll forget about her by going to someone else. And she still sees me as a child rather than a grown adult. 

I told her I’m old enough to make my own decisions, and that not all of them should have to please her. But she threw a guilt trip from an incident that happened between her and her mom. 

I’ve always been a people pleaser, but now I’m just angry and don’t know what to do or how to feel better about this.",1700494559.0,False,2,0,Orchidlove456,None,17zr7c7,https://www.reddit.com/r/mentalhealth/comments/17zr7c7/feeling_invalidated_by_family_for_getting_help/
142,Don't know where to turn,Im having a hard time. I'm feeling very low.  I've been feeling low for like two weeks.  None of my DBT skills are helping. My therapist had to cancel on me last week and this week because of childcare issues.  I feel like I have no one to talk to.,1666897061.0,False,7,5,coffeemuffins,None,yf06bs,https://www.reddit.com/r/mentalhealth/comments/yf06bs/dont_know_where_to_turn/
143,vent idk??,"i don’t know what to do anymore. i’ve just finished dbt, and it’s been good. i’ve definitely reduced my target behaviours being self harm and drug use, but i feel like it ends at that. I can sometimes use the skills when i have urges and they mostly work for a bit, but then the urge comes back 10X stronger , and i get so suicidal. I just don’t see the point in anything. i try so hard to make myself feel better and as soon as i feel the slightest bit happy i feel guilty for it and self destruct. i don’t know if ill ever be able to be without an unhealthy coping mechanism. if its not self harm, its drug use, if its not drug use its restrictive eating, and i feel if i did none of them the only option would be suicide. 
i hate the uncertainty of being happy , because im not stupid, i know there are going to be bad times in life and thats inevitable. but if i let myself be happy and those bad times come, ill be devastated and would probably end up relapsing with everything anyway. keeping myself sad seems like the only way i can have some sort of stability in my life even though i hate it and wish it would be different 
",1713308552.0,False,1,0,Willing-Dance-7205,None,1c5u684,https://www.reddit.com/r/mentalhealth/comments/1c5u684/vent_idk/
144,(Borderlines) Need help and support,"I’ve lost almost all my friends, I’ve lost my gf, I’ve pushed my mom away a good bit, I’m so hurt due to my BPD. I’m thinking of starting a legit DBT program and not just getting DBT techniques from my therapist anymore. Have y’all found that your DBT program improved your life, emotions, and relationships after you finished it?",1597640781.0,False,2,1,VolatileJuvenile,None,ib7xjd,https://www.reddit.com/r/mentalhealth/comments/ib7xjd/borderlines_need_help_and_support/
145,Counseling,"Does anyone go to trauma therapy? How is it different from counseling that deals methods such as CBT, DBT, Gestalt, etc.?",1658798488.0,False,1,1,Rush4Life70494,None,w8668p,https://www.reddit.com/r/mentalhealth/comments/w8668p/counseling/
146,What options do I have left? Hopeless and suicidal :(,"I'm 23F from Canada. I've been diagnosed with crippling bipolar but mainly depression, anxiety, ocd, ednos, bpd. Since the onset of my symptoms (about 6 years ago) I haven't been able to work, go to school, have a social life, ect. I range from mildly to severely suicidal all the time. I don't want to live life anymore.

I've tried over 30 different meds, long psych ward admissions, short psych admissions, years of weekly therapy (CBT+dbt among others), and a full round of ect + maintenance. Nothing has worked.

Just not sure what there is even left to try anymore! Any help would be appreciated.",1686115164.0,False,0,1,strugglingbitch,None,14347ge,https://www.reddit.com/r/mentalhealth/comments/14347ge/what_options_do_i_have_left_hopeless_and_suicidal/
147,The cost for inpatient mental health treatment is fucking shameful.,"The average daily cost to be treated at a mental health facility, if you are uninsured,  is $1,000 per day. This is unacceptable and morally evil. I’m ashamed of the way the United States handles our health care. The elite truly DO NOT GIVE A FLYING FUCK about the lower classes.",1578965846.0,False,412,152,Zeteter,None,eoe3jx,https://www.reddit.com/r/mentalhealth/comments/eoe3jx/the_cost_for_inpatient_mental_health_treatment_is/
148,anafranil.. last hope?,"Hi all,

(sorry for bad english, it's not my first language) 

Like the topic name suggests it.  Im starting anafranil in a few days.

A little background on me: i was siagnosed wigh bpd ptsd and ocd some years ago.

Ive been taking anxiety meds (themesta)  for over 10 years..  Ive been into mental health clinics 2 times for 2 months and one time 1 week.  Ive done normal day therapy and DBT.  I had my share of bad docs..some tried to take advantage of me.. Some just filled me up with pills..

At my 'highest' i took
150 venlafaxine
400 seroquel xr (600 when needed)
20 seroxat
200 seroquel ir
1 trazolone
Alprazolam
Dipiperon

Now i just take
200 seroqurl xr (600 if needed)
20 seroxat
Alprazolam

The meds didnt work.. Never have in 4 years..  Ive been though bad childhood trauma.. Lost my child.. Life has been a rolercoaster...

Dbt did help a little bit.. My bpd waves have slowed down and made room for long episodes of depression but now my ocd is having a party..

So they are reducing my seroxat to 10 a day..  200 seroquel xr.. And then sloweling stating with anafranil    and seroquel xr.. With bloodwork check ups. Atm withdrawl is okay.. Just angry.. Im so angry and tired

I am sacred..  They are running out of meds.. Paranoia is high.. Meds make me numb outside but inside i scream.. 😔

I am looking into emdr therapy but next month they are taking out part of my uterus (like life hasnt been hard enough)  so planning therapy is hard now.

- Me",1660840847.0,False,4,6,Wavely1447,None,wro9lw,https://www.reddit.com/r/mentalhealth/comments/wro9lw/anafranil_last_hope/
149,Is anyone else really tired of trying to be happy?,"I’m always chasing happiness and doing the DBT stuff I’ve learnt and taking my meds, which I guess I’ll continue to do, but I’m just so tired. Having to try so hard everyday to be happy is just so tiring. Is it just me feeling this way?",1643497594.0,False,13,9,ghostprncss,None,sfucoj,https://www.reddit.com/r/mentalhealth/comments/sfucoj/is_anyone_else_really_tired_of_trying_to_be_happy/
150,Teen has inappropriate sexual urges,"My teenager (ftm, 16 last year) came to us with invasive sexual thoughts about their siblings and other people last year.  We immediately started seeking help beyond what he was already getting (we are in family therapy, intensive DBT, and he is in individual therapy and sees a psychiatrist for Oppositional Defiance Disorder, Borderline Personality Disorder, OCD and compulsive lying).  

Most of the clinicians kept saying ""it will be okay as long as they're just thoughts"" but understood our fears and helped try to treat the thoughts and other issues.  But we still pressed for more help, but nobody really seemed to know how to help us, which is fair, I am sure this is not a majorly common thing.  We have been pretty stressed and sad and afraid, of course.

Yesterday our son came to us and said it's gone beyond thoughts to wanting to act, and we called CPS, several emergency shelters, his therapist and his psychiatrist.  Psychiatrist did not answer and has not returned our calls, and CPS referred us to the shelters, who said they could not help.  So upon our therapist's recommendation, we took our son to the behavioral emergency room, where the doctors there seemed confused about what we wanted.  They said they could hold him until we found residential treatment, but that can take up to six months.  He said there are often cases where kids stay here six months, even a year, because they can't go home and there's nowhere else to go.  He indicated that the wait list for residential is long and  you often have to go through a lot of other options to show need.

&#x200B;

We have no family.  We don't want our child languishing in an emergency room for months, but nobody seems to have answers or solutions.  How is this possible?  How can this be the state of things?  

&#x200B;

And before anyone says ""this is above Reddit's pay grade"", that is such a thoughtless thing I see posted here a lot.  I would assume that Reddit was for others, like it is for me, a last ditch effort.  We have exhausted every resource we know of.  The reason people come places like this for such serious advice is because they are lost, overwhelmed, or  have tried everything, and you would be surprised how often a nugget found here can lead to change- someone may know of a treatment, a specialist, a program, a home, someone may have gone through this themselves and can offer support- as you can probably guess, searching for any sort of support group was chaotic- I got results that were bothersome, and few people seem to be able or willing to discuss this openly, which will just make it harder for others to seek help.  I will accept any help that I can get.  Thank you.",1644677959.0,False,242,201,momneedshelp88,None,sqtbrf,https://www.reddit.com/r/mentalhealth/comments/sqtbrf/teen_has_inappropriate_sexual_urges/
151,My boyfriend can't love,"So my bf(m17) can't love because of trauma mixed with his autism. To explain his trauma his mom's bf used to abuse her for 9 years and he couldn't do anything about it and also accidentally killing his best friend so of course that messed him up really bad and so he can't love and is in a deep depression because of those (I think he couldn't love before the accident but idk) and I just need a way to help him love again he's already tried many things but I will literally take any suggestions to help him love again please help me help him, he is my everything. Please.",1707884928.0,False,2,2,PiccoloNeither7870,None,1aqe9a2,https://www.reddit.com/r/mentalhealth/comments/1aqe9a2/my_boyfriend_cant_love/
152,Distress Tolerance,"I've been recently diagnosed with Borderline Personality Disorder, OCD, Persistent Depressive Disorder. And told I'm in remission from GAD, Socialphobia and PTSD. My therapist said I should (have to?) make a box of things to help me when I feel any distress due to my mental health (I also have a hard time expressing myself and communicating)
Do you have something like this? I need ideas.

Edit: Thank you for the replies :) I'll work at replying to each. I'm in 1-1 therapy and was supposed to start DBT on Tuesday but I missed too many 1-1's.",1676513932.0,False,3,3,sarahsunflower_,None,113fg81,https://www.reddit.com/r/mentalhealth/comments/113fg81/distress_tolerance/
153,EMDR therapy,"Just wondering if EMDR therapy is available on the nhs? For context I am 24 , diagnosed with bpd , depression and anxiety. This stemmed from being physically abused by my father as a child and emotionally neglected by my mother to this day. I’ve tried a range of cbt and dbt therapies nhs and private and nothing has really worked for me. The past 10 months I had been doing well and made 10 months self harm free but since I had my anti psychotics and antidepressant dosage reduced about an month ago I have deteriorated badly and really close to relapse. I was discharged from the cmht in January and moved house so I haven’t been referred to my new local one as I was stable until a few weeks ago. I can’t get much info on EMDR other than paying £150 upwards per session via priory. I can’t afford that I am a recent uni grad on a 25k a year job. Any help would be appreciated . 
Thanks",1694544029.0,False,1,2,Own-Tear1884,None,16gzaml,https://www.reddit.com/r/mentalhealth/comments/16gzaml/emdr_therapy/
154,Residential Treatment Center Recommendations?,"Hello folks! I'm in a terrible place in my life right now after having been kicked out of my stable nesting housing (11 years with friends) and going through a divorce where I'm the one being dumped in 2023. I had done a partial outpatient program in my city (2 weeks of ACT and DBT) and it helped for a bit, but then during my birthday this year I just totally collapsed and needed to be inpatiented at a ward for 48 hours.  
My therapist of several years, who I trust a lot, said it's time to look at inpatient residential programs across the US so I can be fully supported. We're looking for ones that take a BCBS insurance plan (can't afford self-pay). Also, I'm trans, so I'd want to go somewhere in a safe state or a place known to be very LGBT friendly. I'm an adult, so I need adult programs. What's going on with me seems to be a mix of depression caused by abandonment issues from childhood trauma (so: cptsd). I do not have any substance disorders so places that focus on that aren't right.  
Sheppard-Pratt in MD - I see this has both a self-pay Retreat (expensive) and an insurance paid version  


The Refuge in FL

  
Skyland Trail in GA

HopeWay in NC

 Austen Riggs - her favorite suggestion but all self-pay and I've heard insurance unlikely to cover  
If you've been in any other residential treatment program not listed above, feel free to recommend!",1710261956.0,False,2,0,flameofmiztli,None,1bd1xo3,https://www.reddit.com/r/mentalhealth/comments/1bd1xo3/residential_treatment_center_recommendations/
155,Helping a friend look for a therapist,"Pls dm me if you have any resources 

“I'm currently looking for a therapist well-experienced with treatment for individuals with BPD and complex trauma (my preferred approaches is integrated therapy with a strong focus on DBT&MBT).

I was recently diagnosed with BPD and cPTSD, I am also struggling with attention deficiency, body-tension and seasonal affective disorder. I have years of experiences of meditation and self-treatment with CBT. I've recently started using DBT, RO-DBT and MBT, I like to be well-informed, the research papers of said therapy treatments are more than welcome if shared by therapist. I'm an atheist, my view is mostly rational mysticism as I've experienced altered states of consciousness in my meditation practice. My most recent favorite work is that of Daniel Ingram's.

I'm pansexual, I have a history of being verbally and sexually abused, the trauma of which is what's affecting my functionality mostly. “",1606865021.0,False,1,1,hgao40,None,k4wus5,https://www.reddit.com/r/mentalhealth/comments/k4wus5/helping_a_friend_look_for_a_therapist/
156,Growth mindset seems nearly impossible when I'm so.. different in where I live,"I studied abroad, queer, raised by narccists, bipolar, HSP and stuffs and my home country has littlest knowledge and respect towards somebdy that's so ""different"" from their own ""ideal NoRmAl standards.""

Up until today I get offended from those unwillingly insulting attitudes from coworkers, sometimes friends, or just random ppl every day. I try my best to hide my feelings and it is so challenging. I get exhausted after coming home, question myself if I'm the delusional one, cry, wake up, feeling stucked and go to work.

Wish I could just escape to another environment but before having enough savings and plans, and for my mental health's sake, I wanna learn how to separate myself and set boundaries to save myself from those things that are out of my control. I mean, there always will be those kind of people anywhere anyway.

Did I try anything? I'm on meds, trying to self-study DBT, and also been in therapy for years but it comes down to the conclusion that ultimately I have to change my views and learn to deal with the reality.

Funny how I first wanted to ask for an advice it just turned into ranting. I just hope that I am not being delusional over being treated differently and feeling wrong about myself irl.",1705002364.0,False,2,0,cryptopalice,None,194ajn2,https://www.reddit.com/r/mentalhealth/comments/194ajn2/growth_mindset_seems_nearly_impossible_when_im_so/
157,what to bring up at first appointment with a new therapist (31F),"I have been in therapy for many years...hospital, IOP, groups, partial hospital, DBT programs, and regular therapy. So there's a long history of stuff I could dive into...I'm overwhelmed by so much that's happened and that goes on internally I honestly don't know what is important or not...everything feels messy. Just wondering what basic and not so basic information you tend to share first meeting with a new therapist to help them understand your case? thanks for the help : )",1672787219.0,False,2,2,risinginloveeee,None,102mlrj,https://www.reddit.com/r/mentalhealth/comments/102mlrj/what_to_bring_up_at_first_appointment_with_a_new/
158,What treatment options are there when nothing I try seems to work?,"**TL;DR** I've am autistic and have tried different medications and therapies and nothing has worked. I'm struggling a lot and don't know what to do or where to turn to. What options do I have? 

I've struggled with my mental health for most of my life. I'm turning 20 this year and it feels useless to continue trying to get better when nothing seems to be working. I am diagnosed with ASD and suspect a lot of my mental health struggles are due to the autism but I am also ""high-functioning"" (choosing to use that term because I don't find 'low support needs' to properly describe my situation) which means I don't have access to any care specific to my autism. I have learnt to cope with my struggles as I went undiagnosed up until I was around 15 years old (even though it was heavily suspected all throughout my childhood). I have been on multiple different medications (SSRIs, SNRI, mood stabiliser) with no effect. I am currently not taking any psych meds, most recently came off Venlafaxine since it only caused excessive sweating and did nothing for my mental health. 

I've done different therapies, DBT, CBT, ERGT, and just talking to someone once every week/two weeks. I'm about to end my current therapy contact and will just be on my own after that. We have two more sessions planned until I'm sent away into the dark on my own. I don't think I can handle that though and I don't know how to bring it up with my provider because ERGT didn't give me anything and I'm still doing just as bad (if not worse). I don't want to just do talk therapy again like I have for so many years because it doesn't give me anything but I can't manage all on my own. I need to get better but I don't know what I can try because it feels like I've done it all. 

I'm currently clean from self harm and my restrictive eating disorder is calm **but** I'm not well internally. I'm not showing it physically through these harmful behaviours which means they [the healthcare system] don't see a reason to treat me even if I'm miserable. They only treat the symptoms, not the problem. If I'm not actively hurting myself they won't do anything, so as long as I'm able to handle my impulses I'm ""cured"" to them. I can't live like this though, it's only a matter of time before I relapse or try to take my life again because I can't manage the urges and impulses. All my energy goes towards distracting myself which makes living life *extremely* hard. My school work is suffering and work exhausts me so much I'm unable to work multiple days in a row. Lately I've had a lot of close calls where I almost gave in and it's getting harder and harder to not give in each time. 

I'm at a point where I'm seriously considering self medicating because I feel so hopeless and out of options. I don't want to go that route though, it can jeopardise my career and relationships. 

I also really give everything a fair chance, I don't just give up on stuff because it doesn't show results right away. I have taken each medication I've tried for at least 6 months (most of them multiple years) before giving up on it. For therapy I always put in the work and follow through with the whole program. I only stopped DBT early and it was because it made me so suicidal to do group sessions. Even when I feel like giving up I remind myself to give it an honest try and push through trying to be positive. So it's not like I'm not seeing progress because I'm not fully giving everything a chance. 

I also want to add that I am limited in what support I am able to access as I'm in a country with 'universal healthcare' and I don't have private healthcare insurance. But if there is some form of treatment that is highly likely to actually work I would be willing to put money towards it but I'm unable to try a bunch of maybes out with a private provider. ",1710647607.0,False,1,0,Ok_Analysis9769,None,1bgofu7,https://www.reddit.com/r/mentalhealth/comments/1bgofu7/what_treatment_options_are_there_when_nothing_i/
