,Title,Post Text,Post Creation Time,Content Type,Post Score,Number of Comments,Post Author,Author Flair,ID,URL
174,I pushed everyone I love away,"Less than 48 hours ago I was returning home from a weekend with this amazing guy I was dating, and having a lovely group of friends whom I shared everything to. Today I am not sleeping all night, took a week dose of my antidepressants, my date blocked me and my friends stopped talking to me. 

Have you ever got into a stressful/anxious conversation and it starts a rage within yourself so violent that you cannot control and felt like you could only kill yourself to make it stop? That's what happened to me the day before yesterday. When I was feeling insecure, he seemed off through his text, and I felt so bad but too afraid to ask him whats wrong, texted him in panic, ended up passed out on the pills I took because the feelings would just not went away, and ended up feeling ashamed, humiliated and disgusted with myself the morning after. 

I was so ashamed of facing him, that I broke up with him on a long rage-filled messages, and he just blocked me. I went on attacking my friends as well and they also stopped talking to me. Everyone just deeply hurt, but also I cannot bear to do anything other than some pathetic  apology texts because I'm still so hurt and it still wont go away. 

I am fully aware that from my bf's and my friends POV I'm a textbook narcissistic bitch, but if I AM that way then why does it hurt so much? Why did I have to wreck every relationship in my life because a simple cold message can set me off to the point of wanting to kill myself?

I wish it's just easy as I am a bitch with no sense of boundary and trust issues, but they won't understand that before I put it on them, I went through 8 hours of contemplating if I should text him to ask him whats wrong, decided against it, tried medication, meditate, playing piano while cannot stop sobbing, and ended up almost ODed with the pills just because my normal dose could not put me to sleep and I am so afraid and angry and terrified? 

I hate depression and I hate that I am a bad person because of it. Why did I hurt people and push them away because they're late at replying a text and I felt like I have to have an upperhand in hurting them first???",1649902415.0,False,17,11,Khemkhem1012,None,u36o5n,https://www.reddit.com/r/mentalhealth/comments/u36o5n/i_pushed_everyone_i_love_away/
175,Psychiatrist is dismissive,"Psychiatrist not taking me seriously  I knew BPD would have a stigma around it but not to this extent. I mentioned how I felt I strongly resonate with the BPD criteria due to symptoms I’ve told her about such as my intense rage, complicated interpersonal relationships and the impulsivity and I even mentioned how i spoke with my mother due to her displaying many of the symptoms as well. She told me not to get to hung up on the diagnosis since she treats the symptoms the same whether they fit the criteria or not. She told me people who don’t have BPD can still benefit from DBT. It felt like she was incredibly dismissive to my concerns considering I told her I self harmed due to how much anger I felt I thought she would take me serious by that point but she didn’t. Right now I felt hurt because she completely pushed it to the side.",1680549741.0,False,1,3,vengeanceoftruth,None,12aurju,https://www.reddit.com/r/mentalhealth/comments/12aurju/psychiatrist_is_dismissive/
176,"Coming off my SSRI, I'm really struggling","So I was on sertraline for about 2 or 3 months. I start getting a little bit of paranoia but it's okay. I have auditory and visual hallucinations and I can always tell the visual ones aren't real.

In the past, I have gotten this way when quite stressed. I am a bit stressed out these days, but these things only started happening again after I started the SSRI. I told my doctor and he said to stop it and he will see me in person (instead of over the phone) in a few days.

I came off it on Monday and it is now Wednesday night/Thursday morning (4am). All night I have been very paranoid in my own home and really scared. I'm seeing and hearing things again. Logically I know it's not real but I feel so scared.

Does anyone have any advice of dealing with these things in the moment? I know in DBT there is ""riding the wave,"" but this is too quick and intense for me to stop and try and think of a DBT skill. I just don't want to be scared in my own house anymore.

Thank you, guys.",1621480185.0,False,1,4,BigMonstrosity,None,ngp5di,https://www.reddit.com/r/mentalhealth/comments/ngp5di/coming_off_my_ssri_im_really_struggling/
177,Mental health is waying,"So, back in March I checked myself back into a partial hospital program after loosing my job on January 1st. I was cycling rapidly between being manic and hypo-depressed. While I was there my case worker suggested I try DBT therapy instead of going back to traditional CBT. I was referred to one of their therapists and also assigned a new psychiatrist to manage my meds.

Once I had a slight med change and started seeing the new therapist for individual sessions, things got better for me. What I didn't know initially was that with DBT programs, you usually meet your therapist for individual sessions as well as a group therapy session once a week. I'm bipolar and also a workaholic so I was picking up hours and doing everything my boss asked me to (mostly because I felt lucky to have a new job and be employed during some of the worst bits of COVID) so I missed a group session here and there.

My therapist broke it down for me that if I wanted to stay in the DBT program I would need to start attending group more regularly otherwise she would have to dismiss me from the program. My boss then basically said screw you, I need a doctors note or else I can't excuse you from work. Eventually I got a note that said I wasn't allowed to work more than five days a week and I was only allowed to work 28 hours per week (I had been working between 50 and 65 hours spread over 7 days).

So now I have a new job (again) and my therapist is threatening to kick me out again because I was hired in as a full time employee who works rotating weekends. I asked work if we could adjust my weekend schedule to accommodate for something that I am required to attend and they quickly shut that down. I tried to explain to my therapist that I can't make it to group for a while because I am a new employee and even though I'm working on boundaries, I can't change my schedule. And she thinks thats a load of BS.

So what am I supposed to do? I could tell work that I have to go down to 32 hours a week, but I might loose benefits if I do... but if I don't ill probably be kicked out of this program before the year is out. And like to make matters worse, both sides are trying to invalidate each other - which is driving me mad. Yes, I DO need to be working because nothing in this world is free... and Yes, I DO need DBT therapy because I don't want to check myself into a hospital again for the fourth time in four years and DBT is literally saving my life.  


TL;DR My employer and my therapist don't want to accommodate each other and I can't decide which is more important to me...",1606283979.0,False,0,1,ZebraPharmacyTech,None,k0mfem,https://www.reddit.com/r/mentalhealth/comments/k0mfem/mental_health_is_waying/
178,Electroshock therapy for GAD,"Untreatable GAD that doesn’t respond to SSRIs or SNRIs. Benzos and Gabapentin work but they are for short term. Tried therapy for 2 years. Trauma therapy, CBT, DBT. 
Wondering if electroshock therapy would set my gaba neurons straight? 

It works for untreatable depression. 

Thoughts?",1619026686.0,False,1,9,Katarina136,None,mvkymf,https://www.reddit.com/r/mentalhealth/comments/mvkymf/electroshock_therapy_for_gad/
179,Where can I get checked for Borderline Personality Disorder?,"The title is self explanatory, i have been battling with some of these symptoms my entire life. Now 31M i am ready to give it some further understanding.

I do not know where to begin and i do not know what is a better avenue for diagnosis if there even is one. Any info or general direction is greatly appreciated.

Thank you",1584719208.0,False,1,2,Sturmtrupp13,None,flx6po,https://www.reddit.com/r/mentalhealth/comments/flx6po/where_can_i_get_checked_for_borderline/
180,Having trouble using my coping skills when im mid episode,I got a dbt workbook and created a distraction plan i also have a few grounding techniques i use on my own but it seems like once the intrusive thoughts ramp up and i start spiraling i go into paralysis and cant divert my attention enough to use my techniques. In the moment its like all my energy is going into not reacting violently to these thoughts. The only time i seem to be able to use my techniques is if i feel an episode may come on or im in a blunted state of psychosis where my mind is more quiet but im still really out of it. Any tips for this?,1664228270.0,False,2,3,individual777,None,xowqnq,https://www.reddit.com/r/mentalhealth/comments/xowqnq/having_trouble_using_my_coping_skills_when_im_mid/
181,I'm happy when I'm elsewhere.,"Rocking a 26 score PHQ-9 for the last year.  (Always bummed I can't get that last point, but it's the one where people can tell you're depressed.)  Hospitalization, ECT, rTMS, DBT, all the acronyms.  I even had aVNS (vagus nerve stimulator) implanted.  Nothing helps. 

I go on two solo trips this year and the depression and anxiety almost disappear when I'm away.  I come home and it all just hoses me down with unhappy again.  Home is not the worst environment in the world, though it could be better.

Has anyone else seen anything like this?",1661814423.0,False,2,1,fnirt,None,x12sj2,https://www.reddit.com/r/mentalhealth/comments/x12sj2/im_happy_when_im_elsewhere/
182,"Crying way too easily, possible remedies?","These last 3 years I noticed something really annoying. I can't start a normal conversation irl with anyone about the slightest personal issue without tearing up which leads to crying when called out. I can't comfort anyone without also bursting into tears, hell just recently I embarrassed myself in front of my DENTIST; I got an appointment to fill a hole in my tooth but wanted to mention to my dentist about how terrified I am of needles (they cause me to shake uncontrollably which is really bad when you want to not mess up the anesthetic)
As soon as I start taking about it, my eyes start to water. I end up fighting against full blown crying in the dentist office and became extremely frustrated and embarrassed about it. I am 20+ for christ sake, why do I cry this easily?! I hate it do much. Is there anything I can do to make it stop or at least a good way to stop the crying as soon as the prickle of tears arrive?",1650401084.0,False,1,3,Ill-Lengthiness-5751,None,u7f1sl,https://www.reddit.com/r/mentalhealth/comments/u7f1sl/crying_way_too_easily_possible_remedies/
183,How to support my boyfriend (31M) struggling with long term therapy and hopelessness,"My boyfriend (31M) has been undergoing DBT therapy for nearly a decade for BPD (Borderline Personality Disorder). He's been on a journey to improve his mental health, and is to the point now where he actually no longer fits the symptoms required to be diagnosed with BPD - this is a huge milestone - but he still constantly battles with feelings of hopelessness, feeling ""trapped"", and self-doubt. It's gotten to the point where he feels like he's factually more of a lost cause than most people, despite his efforts. He says he's felt this way for a while.

Lately, he's been expressing how he's struggling to see a way forward. He feels like he can't continue living this way because of how it affects those around him and has urges to push people away because of this. What's more, he's convinced that because he's been in therapy for so long, he's exhausted nearly every approach and avenue. When people suggest that he might be catastrophizing, he feels invalidated, as if they're implying he hasn't been trying hard enough – even though he's tried numerous approaches over the course of many years. I can say that I believe him, and I can see how hard he tries every day.

As someone who cares deeply about him, I find myself grappling with my own sense of helplessness. I want to be there for him and provide meaningful support, but it feels like I've run out of things to say. Offering suggestions that he's already tried over and over seems redundant and unhelpful. Additionally, the well-intentioned phrase ""it gets better"" comes across as belittling to him, further deepening his frustration.

He's currently taking antidepressants, and has been on various other medications throughout the years. He has a new therapist lined up, and has seen many before this over the years. He firmly believes that his situation is not a result of catastrophizing or lack of effort; instead, he's convinced that he's genuinely stuck without options. He feels that people tend to disengage when he talks about it because they can't fathom what it's like to run out of choices. He has expressed that this ongoing battle and years of effort he's spent trying to little avail has led him to loneliness. He's even come to terms with the idea that he might need to simply learn to cope with it and there is no way to actually fix this, after a mental health professional seemingly affirmed this notion a few years back.

What does one do when one feels like you've truly given your all, tried countless options multiple times, and yet is still facing a seemingly insurmountable struggle? How do you keep hope alive when the path forward seems to have no clear direction? I want to be there for my boyfriend, offering support that truly resonates, but I'm at a loss for what I can do or say. It feels like anything I can think of saying gets countered by him pointing out that I'm suggesting something he's tried countless times before, I'm invalidating how he feels, or I'm out of options because that's the reality of the situation for him.

I'd be extremely grateful for any advice, suggestions, or personal experiences you're willing to share. Your insights could make a real difference, not only for me but for him as well. 

**TL;DR:** My boyfriend, after nearly a decade of DBT therapy and various treatments, feels trapped in his struggles and believes he's exhausted all options. He's facing loneliness and hopelessness. I'm also struggling with feeling like I can't provide meaningful help, as I keep suggesting things he's tried or offering clichéd reassurances and I don't want to validate the idea that there's no way to get better.",1692845183.0,False,2,3,JeJappe,None,15zp8cf,https://www.reddit.com/r/mentalhealth/comments/15zp8cf/how_to_support_my_boyfriend_31m_struggling_with/
184,My social life is miserable ,"I have no friends all of them I either cut out myself or I got cut out by. I got social anxiety that makes me scared to talk to strangers. I go out and meet people but none of them I consider friends. All my hobbies are single person activities because I have noone to do anything with. People keep gaslighting me into believing im a “nice guy” even though I don’t pretend to be a nice person at all and I got no alternative motive. Ive been going to therapy for 2 years and taken anti depressants and DBT and group therapy and all that shit and my social life hasnt gotten any better. I stopped going to the gym. I spent all my money on impulsive guitar purchases. People on reddit keep arguing with me which is hilarious because when I respond defensively its always me whos the issue not the person antagonizing me. My dating life is utter dog shit. I had a few “online girlfriends” that used me for money and I caused my BPD to be worse by associating with them. I seriously don’t think my life will get any better. Im not a lazy fuck either I actually tried to go in remission with my BPD but every day I get suicidal thoughts and I feel like people are taking advantage of me and like life is pointless. I don’t think anyone out there can be friends with me even though unlike a lot of assholes out there, I don’t argue or fight with anyone and I keep all my problems to myself. Im really a punching bag for other people. Inside I do have strong opinions on certain people in my life but I don’t let them know because theres no point in starting fights. I got a lot of internal issues but I don’t do anything bad to other people in my life so I dont understand how that makes me a “nice guy.” ",1709130078.0,False,1,0,Equal_Connect,None,1b276hj,https://www.reddit.com/r/mentalhealth/comments/1b276hj/my_social_life_is_miserable/
185,I just want an accurate diagnosis but I can't even get that.,"The way I act and feel isnt normal. Im in my early 20's and im still completely fucking  lost.  I constantly act somewhat hostile, cold, and have impulsive sexual behavior / drug abuse, and question my identity/sexual identity, with one week being absolutely sure im straight, and the next convinced im gay. I lack having many friends and tend to give off a glare to everyone and come across as an emotionless asshole, although i literally dont have anger problems unless its a trigger.

Im so fucking pissed my psychologist wont diagnose me because at first I told him i thought diagnosises were overrated/stupid. Now he just tells me I have depression, and im fucking sick of it. I know theres something else going on - and whether its C-PTSD from growing up in a family woth personality disorders - or quiet BPD (lack anger/self harm though) I want to fucking lnow what it is!! I keep feeling like Im crazy after i leave every appointment, and no matter how much i ask he insists i dont have another diagnosis i know he's full of shit and doesnt think i can handle it. 

Not only do I match most the bpd traits except anger and self harm, but when telling him i didnt think we were a good fit, instead of referring me to another therapist in his office he practically insisted I find a DBT program, for my ""emotional dysregulation"".  Im so fucking pissed i dont know what to do!",1541678378.0,False,6,1,helloooo1264,None,9v9dx4,https://www.reddit.com/r/mentalhealth/comments/9v9dx4/i_just_want_an_accurate_diagnosis_but_i_cant_even/
186,How to get the most out of therapy?,"I always feel scattered trying to make therapy work, because my issues are so deeply ingrained at this point and I've been in therapy for years, so I've tried so many things. I want to be productive but I end up overwhelmed and hopeless, and never feel like going. I still go (usually) but how can I make it actually help? A bit part of me would rather nap. 😰 I have sleep problems/insomnia, I have all of this muscle tension after work, I have CPTSD and a severe eating disorder. I don't want to die, but a lot of times I'll think it'd be nice to not wake up and have to go through another day with my eating disorder and my problems. I'm not suicidal, I still want to get better. I'm just SO stuck. I've tried so many things: neurofeedback, started some small guided psilocybin-assisted therapy and integration sessions this past year, EMDR in the past, inpatient treatment for eating disorder and trauma 12 years ago, CBD, some DBT, group therapy, some psychodrama in treatment, some martial arts in treatment (a self-defense class), some somatic therapy and a lot more. Both inpatient and outpatient I saw nutritionists and got the education portion—I know what I should do, just like an addict knows they shouldn't use. I even don't want to ""use"" my eating disorder often while I'm in it. I just have so much fear and anxiety and dread and trapped feelings that I seem to know no other way/be unable to do enough without it. 

I try some IFS therapy with my therapist, she isn't specialized in IFS but she knows about it and went to a presentation on it and has a workbook. I hear promising things about that and I've read up on it. Should I keep working on that with her?

Just not sure where to focus.",1708368720.0,False,1,0,sandopsio,None,1auv68d,https://www.reddit.com/r/mentalhealth/comments/1auv68d/how_to_get_the_most_out_of_therapy/
187,Do I need a new therapist? Please help!!,"This has only started bothering me very recently. We spend entire sessions talking about the most superficial boring stuff, or she'll get hyper fixated on one topic, get super deep into it, but not actually address any of the issues. I just feel bad after sessions now because she asks questions that bring up all these emotions but never addresses them. She also talks a lot, telling me things I already know, or just stuff about her life and her daughter, which is nice but if I'm being completely honest, I want her to help me with my issues, not tell me she has the same ones as me. It's just beyond frustrating to feel like I have to keep her on topic as well as myself, because I can barely stay on track as is. She is a human being, so maybe I'm being too critical, but I really don't know what to do. I get that it's my responsibility to communicate what I want to work on with her, but I just keep getting distracted by all the little unimportant topics she keeps repeatedly bringing up. Has anyone been in this situation or have any advice?  
I feel bad because I've been with her for so long with no issues whatsoever. I'm realizing recently though, that it feels like we've made absolutely no progress since we've started meeting. She wanted to start DBT at one point, skipped through it briefly then getting distracted, every appointment for a few weeks, then never addressed it again. Same with EMDR. I don't know what to do.",1702014275.0,False,1,0,Dense_Egg_208,None,18dfysw,https://www.reddit.com/r/mentalhealth/comments/18dfysw/do_i_need_a_new_therapist_please_help/
188,Mental health/self harm reduction apps?,"Hello! This is my first time on this sub. I'm currently 6 months clean from self harm (yay!) but I've been having a tough week and I'm having trouble dealing with my urges. Lately I've just been trying to ride them out and crying a lot. I'm also going to try and start opening up to other people about it. In the meantime, I've been looking for something else to help me get through stuff. I've heard of an app called Calm Harm and it looks like it would be helpful for me, but unfortunately I'm still a teenager living with my parents and they need to approve all my apps. They know I've had suicidal thoughts and depressive episodes in the past but not about the self harm. I would rather they not find out for now (that may change in the future, but for now I don't think I'm ready and if I feel unsafe I will reach out). Are there any mental health apps (preferably free) that you have found to be helpful, especially for self harm, but that are not specifically for self harm? I think I would benefit from something that can keep me grounded or calm me down when I want to hurt myself. Thank you!",1544673849.0,False,2,1,partytattoos,None,a5pxqj,https://www.reddit.com/r/mentalhealth/comments/a5pxqj/mental_healthself_harm_reduction_apps/
189,i don't know what to do anymore,"I (F21) have been struggling with my mental health since I was 12 years old. I was hospitalized for suicidal thoughts at 13, and put in residential for an eating disorder last year. I'm severely depressed and I'm pretty sure I have BPD (one of my old psychologists diagnosed me with it, my current psychologist says i have 'borderline traits') or at LEAST something else because I don't think this is just depression, but maybe it is and it's just really debilitating, I don't know.

I have been on 5 different medications, probably getting put on new ones next week. I have gone through DBT, CBT, and traditional talk therapy and nothing has helped. I have periods where I feel okay (sometimes for months on end), but I'm still at a baseline of moderate depression during those times. I don't know what else to do, it feels like I've tried everything even though I know that's not true. I'm genuinely desperate to get better because if I don't, I think I'm going to end up dead. I used to be very empathetic and caring but depression has made me so hateful towards myself and I don't have the energy to have empathy anymore.  I made an alt account to post this because I'm honestly ashamed.

Nobody knows how to help me. I think not even my psychologist knows how to help me anymore. I keep getting more and more destructive and it's affecting my grades and general functioning in college because I can't focus in general.  I call crisis lines, the suicide hotline, etc. and none of it helps. I have used every resource available to me and I'm not getting better. Like I said I really don't know what to do anymore, I was considering bringing up ECT to my psychiatrist but I really don't want future memory problems (I don't really care if I forget my past). I'm just so lost and I feel hopeless, honestly.",1708030309.0,False,1,0,reekingofdesperation,None,1arpv3n,https://www.reddit.com/r/mentalhealth/comments/1arpv3n/i_dont_know_what_to_do_anymore/
