,Title,Post Text,Post Creation Time,Content Type,Post Score,Number of Comments,Post Author,Author Flair,ID,URL
0,DBT referral ,"Why would a therapist refer you to DBT out of nowhere? I have ADHD, CPTSD along with depression and anxiety idk if that’s why ?? I have been seeing a lot about borderline personality disorder (bpd) being treated with DBT; could it be that my former therapist was suspecting bpd? 
",1709187494.0,False,1,1,pinkpink456345,None,1b2thny,https://www.reddit.com/r/mentalhealth/comments/1b2thny/dbt_referral/
1,Dialectic Behavioural Therapy (DBT) - Please Share Your Experience,"I have been diagnosed with several mental disorders, including Borderline Personality Disorder (BPD), which is the most troubling. Mental illness has been a struggle my whole life. But only 3 years ago, I began looking for solutions. Recently, I read this book on DBT, called ""DBT Made Simple"" and overall I understand how the treatment is administred and the fact that DBT is clinically-proven to be effective specifically for BPD because its principles once fully absorbed by the patient transform behavior from unhealthy to highly adaptive. 

Have you or someone you know received DBT? Please share your experience. Thank you. 

",1712720235.0,False,1,3,Positive_Ambition_63,None,1c0byzw,https://www.reddit.com/r/mentalhealth/comments/1c0byzw/dialectic_behavioural_therapy_dbt_please_share/
2,Can someone explain to us how DBT therapy works? ,"Tried to understand but still didn’t understand 

What is that? What you need to do here? ",1710938856.0,False,1,2,Training-Cup5603,None,1bjclws,https://www.reddit.com/r/mentalhealth/comments/1bjclws/can_someone_explain_to_us_how_dbt_therapy_works/
3,Regular DBT Sessions,"Finally getting back into regular sessions with my worker, and currently looking at boundary setting in addition to building on my DBT skills.

I’m still not in a good spot, my physical health is in a scary situation right now and I messed up my knee so getting from place to place or doing my usual tasks is a lot harder now. I’m looking at surgery and I still haven’t had a specialist look at my knee so it’s been up in the air for the most part. 

Getting regular support for probably most of my life is something I’ve accepted now. I’ve increased my meds and I should be on an upswing soon. I feel myself being more productive, I was able to make a meal for myself without the assistance from my partner (made my own dressing and cooked some mushroom bacon for a salad) 

I want October to be my month, at least 1 month this year where things go over smoothly. So far so good?",1696500340.0,False,1,0,ghoulishtrash,None,170e3du,https://www.reddit.com/r/mentalhealth/comments/170e3du/regular_dbt_sessions/
4,therapy issues and cbt/dbt technique,"Please refer me to another thread if this is not the correct sub. I hope my post make sense . F late 20s here. I am sorry in advance for the very long rant.

in my opinion my current therapist is the best I ever had thus far . I am planning on working through my personallity diagnois , but I need to double check that she is 100% knowledagable on DBT. Also, she use to be an addiction couselor , but I do not understand how that is the case because she just tells me to attend meetings ( reachout , 12 steps and find a sponser). I feel like it not for everyone... In addition, I struggle with trichtilomania as well. we have been over the basic coping skills ,but nothing really helps . 

 I obviously relized that I have to put in the work too and continue to take my medications.  My freind (had bpd) recently mentioned the idea of switching therapist.  I have a lot to think about and at this point I am just making my owns notes of coping skills and googling reading material to learn more about how to help myself with these  multiple disorders.  I do not mind putting in the extra work , but it is very exhausting mentally.  I heard that CBT technique is  great for people whom struggle with addiction and Trichtilomania.  I was wondering if has that been the case for anyone else? 

 I am planning to dicuss this all with my therapist in my next apt .So i can figure out if i need to change therapist of not. For context My therapist always tell me that  she is not usually offended and i should not worry about hurting her feelings. If I am rude in anyway she calls me out for it which I do appreciate .  FYI This situation is now the 2nd time that I messed up boundaries. Anyways , My upcoming apt is in the new year and we had our weekly apt before she went on holiday/trip. That night I was organizing my emails / notes for my therapy sessions.  I accidently sent them to my therapist very late in the night. The email referenced referenced self harm , but no intent to harm myself at all. I had no idea i even sent to her until the next morning. I woke up to calls,emails and text ( phone was muted overnight). I called her right away that i was okay and I was sorry . She could not hang up fast enough which i do not blame her for ( she was leaving for her trip that day). my therapist then proceeded to send an email stating "" if it is not true emergency"" please do not reach out and gave me a crisis number etc. I just know when we have our apt that it be the first thing to dicuss. the worst part is that I spiraled and acutally ended self harming because of  how anxcious / guilty i felt. there were other reasons , but that was the main reason. I am not sure how to even explain this in a kind way. I am not blaming her , but it could come off mean. ",1703826610.0,False,2,0,Significant_Access_1,None,18tf1hu,https://www.reddit.com/r/mentalhealth/comments/18tf1hu/therapy_issues_and_cbtdbt_technique/
5,Any psychologists specializing in DBT therapy for BPD in Bangalore?,"Hi,
I am a 29 year old female and I have been diagnosed with Borderline Personality Disorder and haven’t been taking treatment for the same for couple of years.
In the latest consultation with my psychiatrist, he suggested that I should take DBT (Dialectical Behavioral Therapy) to manage the symptoms which are mainly impulsivity and extreme behaviors.
Does anyone know of a good therapist who specializes in DBT in Bangalore? 
Open to both in-person and online therapy sessions. 
#therapy #help #bpd #dbt #mentalhealth #bangalore",1703878461.0,False,3,9,codelikeagirl99,None,18tvbjv,https://www.reddit.com/r/mentalhealth/comments/18tvbjv/any_psychologists_specializing_in_dbt_therapy_for/
6,DBT mindfulness: thoughts?,"Hi, 

so I have bpd and recently I started dialectic behavioral therapy and I’m really struggling with mindfulness. I just don’t believe in it and there’s a lot of resistance on my part. We started with this and I know it’s a huge part of the therapy. 

I just wanna hear your thoughts on it, if anyone felt the same at first and maybe changed their minds later on. Or if you still don’t understand or get it. 

At this point it’s really making it hard to even go to therapy bc I know we’re going to discuss this and I just feel bad for not being open to it.",1680775704.0,False,2,7,psychobreathless,None,12dfbmw,https://www.reddit.com/r/mentalhealth/comments/12dfbmw/dbt_mindfulness_thoughts/
7,"CBT or DBT, which style of therapy works for you?",Its important to know what these are and that there are other options. i just wanted to start that conversation lol.,1703088073.0,False,3,7,PlanetExpre5510n,None,18mxz8z,https://www.reddit.com/r/mentalhealth/comments/18mxz8z/cbt_or_dbt_which_style_of_therapy_works_for_you/
8,DBT or CBT,My psychiatrist is referring me outside of my usual mental health counseling for DBT  (dialectal behavioral therapy) or CBT (cognitive behavioral therapy) which one is better in y’all’s personal opinion? She wants me to do this before giving me a further diagnosis so I feel like I need to pick the best option so I can get the help I need,1688694005.0,False,1,0,Various_Vegetable_93,None,14ssrim,https://www.reddit.com/r/mentalhealth/comments/14ssrim/dbt_or_cbt/
9,Has DBT therapy helped you guys at all?,"Right now I’m diagnosed with depression, anxiety, and PTSD. And my therapist decided to start with both narrative and DBT therapy these past two weeks.

I’m just wondering if DBT has helped anyone at all? I get the concepts of narrative therapy, but not so much of the other one.

If you guys have any insights, I’d appreciate it. Thanks!",1699838624.0,False,1,1,Orchidlove456,None,17tzctm,https://www.reddit.com/r/mentalhealth/comments/17tzctm/has_dbt_therapy_helped_you_guys_at_all/
10,.DBT.,"So I've been doing DBT for about 3 months now. I was wondering if anyone else has experiences of feeling like your not heard or invalid. 

I started DBT after a hospital admition where I was declared to have BPD.

I'm now doing DBT and it just feels like it's not working.

I'm wondering  if any other people who have been threw DBT felt similar to me at some point and does it get better?

Thanks for reading :^)",1647116352.0,False,3,14,SS_UNFLOWER,None,tcpwui,https://www.reddit.com/r/mentalhealth/comments/tcpwui/dbt/
11,Should I drop out of DBT?,"I’ve been in DBT for about 5-6 sessions now, and every time the session ends I feel drained and worse than before. I always feel like I want to cry and I feel so tired after. I have no motivation afterwards and it makes me not do my homework or study. I don’t want to play video games, watch TV, anything after the sessions end. Before the sessions I can be jumping around blaring music and working out until I feel like I’m gonna collapse but after every session, I just feel empty, I just want to cry, cut myself, and listen to sad music. I hate feeling like this after DBT and I want to quit so bad but my mom won’t let me. Should I push for it?",1673303582.0,False,3,12,I_Love_Cyndaquil2,None,107sd9o,https://www.reddit.com/r/mentalhealth/comments/107sd9o/should_i_drop_out_of_dbt/
12,DBT course (NHS),Just wondering if anyone here has done dbt (and if your from the uk if it was on the NHS). I’m starting in a few weeks and am very nervous I don’t know what to expect and I’m worried it won’t help.,1675361280.0,False,1,2,sadocean13,None,10rwefm,https://www.reddit.com/r/mentalhealth/comments/10rwefm/dbt_course_nhs/
13,is ISTDP good for CPTSD? if not - what kind of therapy is? DBT?,"PLEASE HELP.

had been doing CBT with brakes for a few years and depending on a therapist it was either nothing or finding a true mentor i was forced to leave bc of my age (the clinic was for teens and young adults up to 21)...

i delved into EMDR and felt true compassion; learned how to take care of my brain through my body, it was truly amazing, however, with such a strong focus on the topic of trauma and me still living with the oppressors (although without physical violence, still with emotional and financial) after a while i found it too overwhelming + the realization of their behaviour being worse than i thought made me angry which in turn made me act out and suffer more on their account.

recently after an almost a yearly break i tried a couple sessions of SFBT (Solution-focused (brief) therapy). it worked only with very small and short-term stuff. otherwise i didn't get enough emotional support from it and even the therapist themselves said at our last session that i've been through a lot of hurtful life events and that perhaps i should try a different kind of therapy. they suggested ISTDP.

i looked ISTDP up and the depth of it sounds really tempting however, i do not want to get retraumatized; i think one of my two EMDR therapists used it on me at some point and made me supper triggered and angry, that was also a joined session with my parents, and although we were all against each other, we could agree on one thing - that it would be my last session with him. perhaps, given that he had only started training with ISTDP back then - that's not the best example of what this therapy is truly like?

i also heard good things about DBT when it comes to OCD, which i'm not sure if it's an outcome of CPTSD or the way i was born (lol).

**my goal is to get my shit together, move out and heal.**

**thank you for reading this far. what do you think?**",1705576967.0,False,1,0,lilywaternote,None,199nycg,https://www.reddit.com/r/mentalhealth/comments/199nycg/is_istdp_good_for_cptsd_if_not_what_kind_of/
14,“Stutz” takes credit for the DBT term Radical Acceptance,"Just watched the new Netflix documentary “Stutz” which gives viewers an inside look at Jonah Hill’s therapy sessions. The documentary was great UNTIL they began talking about Radical Acceptance. There was NO mention of Marsha Linehan and it’s suggested that Radical Acceptance is a tool that was developed by Phil Stutz (Jonah’s therapist). I found this really upsetting… any body else notice this? 

To be clear, Marsha Linehan is the founder of DBT and she coined the term “Radical Acceptance”. It sucks seeing a man take credit for this brilliant woman’s works.",1668644985.0,False,8,16,verifiedvirgo,None,yxb95c,https://www.reddit.com/r/mentalhealth/comments/yxb95c/stutz_takes_credit_for_the_dbt_term_radical/
15,Should I leave my DBT group?,"Every time I’m in DBT I feel so bad, I’m usually happy and full of energy before hand, and near the end I feel even more drained than being at school. I’ve tried the tactics they have but they seem to be teaching heartlessness and selfishness but I prefer to help others rather than thinking of myself. They make me reopen wounds I have sealed, I have a journal for when I get bad again, and advice helping. I decided that until then the wounds are too painful to reopen and I suppressed them. But this group… it makes me remember the hospital, makes me remember my thoughts, makes me remember everything… it hurts so fucking bad… I feel so numb after each appointment. But my mom won’t let me leave, saying I need it… I don’t feel like I need it. My gut is telling me something isn’t right… I am finding ways to self-heal. But this group, it feels wrong, it’s too painful… I’ve never been in therapy like this, I have felt bad after therapy and that helped, but this is worse, this is a whole new level, this isn’t feeling bad, this is feeling numb and broken…",1673357178.0,False,1,4,I_Love_Cyndaquil2,None,1089sft,https://www.reddit.com/r/mentalhealth/comments/1089sft/should_i_leave_my_dbt_group/
16,DBT questions.,"I have been in a DBT group for over 6 weeks now and have questions... 

Is it normal to feel completely invalidated and  belittled by the way the session is run?


 A woman walked out of a session today as her questions were interupted with no answers. She said she felt gaslit and I totally agree with her.

I'm thinking of sticking with it until the end of the module then switching to another organisation for classes. 

If you happen to run a DBT class can you tell me the therapeutic value of just ignoring questions?

 I see how I'm supposed to refraim statements but the classes are not question friendly places. 

Is it normal to find the program combative?

Exit. The group is all women. Is that normal?",1645570452.0,False,2,4,butterfreebutter,None,sz103m,https://www.reddit.com/r/mentalhealth/comments/sz103m/dbt_questions/
17,DBT and autism,Any autistic ppl on here been through DBT? What were your experiences? How did they adapt the program to you?,1646601530.0,False,2,2,funkydyke,None,t88osc,https://www.reddit.com/r/mentalhealth/comments/t88osc/dbt_and_autism/
18,lack of compassion in DBT,"I am undergoing DBT at the moment and my one on one therapist left so I am working with a new one.

A few weeks in and I'm starting to wonder if there is no place for compassion toward the person undergoing treatment within a DBT program.

The first organisation I worked with was very cold and the therapists were inexperienced. I made good progress with the new group but now the replacement Therapist suggested I switch to a talking therapy even though those have made me worse in the past.

I have a few family members that will respond abusively regardless of how skillfully I approach them. I get the feeling the new therapist does not believe me where as the one that left was quite validateing 

Should I change my expectations and consider the sessions to be more clinical and unfeeling or do I have to undergo the exhausting experience of finding a new therapist?",1659423866.0,False,2,0,butterfreebutter,None,we4uwm,https://www.reddit.com/r/mentalhealth/comments/we4uwm/lack_of_compassion_in_dbt/
19,Started DBT and have concerns,"I am deeply anxious and after a lot of setbacks and horrible GPs I'm taking part in group DBT mindfulness sessions to help me reprogram the way I deal with unhelpful thought patterns. 

However... After two sessions I am concerned that the tools I'm being taught will just leave me walked over. It seems to be a way of suppressing emotions not dealing with them 

I accept this is week 2 of a 6 month program. I will start additional one to one sessions next month and I'm not even close to learning all I need to. 

I'm going to stick with it

Did anyone else starting DBT feel the same way?",1641982218.0,False,3,5,butterfreebutter,None,s22wik,https://www.reddit.com/r/mentalhealth/comments/s22wik/started_dbt_and_have_concerns/
20,Affordable DBT in San Francisco or remote in California?,"My brother struggles with BPD and is currently going through a particularly bad depressive episode after a whirlwind relationship and breakup. 

He doesn’t have insurance as he’s never been able to hold a job for long and is currently unemployed. Are there any low cost DBT options that we could make use of either locally in SF or remote in CA?

Thank you so much for your help. 💕",1669134299.0,False,1,2,natalia-nutella,None,z1xu7m,https://www.reddit.com/r/mentalhealth/comments/z1xu7m/affordable_dbt_in_san_francisco_or_remote_in/
21,A Video explaining DBT,[https://youtu.be/0Vw11tRoxmI](https://youtu.be/0Vw11tRoxmI),1642006918.0,False,2,1,BorderlineHR,None,s2b48e,https://www.reddit.com/r/mentalhealth/comments/s2b48e/a_video_explaining_dbt/
22,Does anyone have any good CBT or DBT worksheets I could use?bor just mental health worksheet in general?,Any other tips are welcome,1698350246.0,False,1,0,XxSiroTheWolfxx,None,17h53vg,https://www.reddit.com/r/mentalhealth/comments/17h53vg/does_anyone_have_any_good_cbt_or_dbt_worksheets_i/
23,DBT therapy,,1625802222.0,False,1,1,meggsovereasy,None,ogne47,/r/bipolar/comments/ogn49u/dbt_therapy/
24,Whats your experience with DBT therapy?,"my therapist is referring me to DBT therapy and I want to know if it’s worth the time, energy, and money. is it? (and before you say it I know everyone’s different)",1647403037.0,False,2,2,yooitsmax,None,tf8q7o,https://www.reddit.com/r/mentalhealth/comments/tf8q7o/whats_your_experience_with_dbt_therapy/
25,13 year old self-harm & DBT outpatient program?,"My 13 year old daughter (7th grade) has been cutting herself and feeling suicidal. We did not realize the severity of her suicidal thoughts nor the degree to which she was cutting herself. A few months ago she had taken a small knife to school with her and someone reported it - months later. She was not carrying the knife on this day in February but admitted carrying it previously. She was suspended out of school for 10 days. She was looking forward to returning to school though stressed out about the ""rumors"" going around that she had a knife and had been cutting herself.

Long story short, she has a psychiatrist (for adhd) and a great therapist, who has only seen her twice but it is a good fit. She began taking Lexapro two weeks ago and her mood is MUCH improved.

My daughter was accepted into an Intensive Outpatient Program (locally considered the ""gold standard"" ) that uses DBT for self-harm. I have heard outstanding things about the program.

The program is 30 days / 6 weeks. She would be out of her middle school for the six weeks. The entire family would do Family Therapy weekly and my DH and I would have to attend weekly Parenting Group that focus on utilizing DBT - I'm assuming. The location is over an hour from our house and would mean ""commuting"" 2 - 2 1/2 hours daily in downtown metro traffic. All of this is quite fine and we are MORE than willing to do it. I'd MUCH rather do this than have my beautiful, brilliant daughter hurting herself or killing herself.

We are concerned about this because she was already stressed by missing two weeks of school. She loves her teachers and enjoys her classes. My husband and I can't decide if we should send her to the program OR if the intensity of the outpatient program will be traumatic and detrimental to her sense of ""fitting in"" at school / school rumors, etc.... The whole, ""my parents put me in a psych hospital"" bit....

This is also on our minds:

If we do the Outpatient Program, we will all be home during Spring Break.  She is REALLY looking forward to the trip we've planned (the destination is her pick), as are our other children.

DH and I are going to ask if there are additional start date options, including summer - which would be ideal because it would preclude the whole school drama. However, again - our family travel plans would be impacted, changed, or dropped entirely.

Again, our daughter's well-being is the highest priority and we just want to make sure we are making the best possible decision for her and NOT causing her additional trauma and harm.

I am really hoping some of you would be willing to give me some insights. Thank you in advance for your sensitivity and willingness to share.",1645903452.0,False,3,9,CricketsMoon,None,t24w0j,https://www.reddit.com/r/mentalhealth/comments/t24w0j/13_year_old_selfharm_dbt_outpatient_program/
26,Has DBT helped you?,"My therapist recommended DBT to me. I have some serious issue that stem from childhood abuse and neglect, along with trauma all throughout my 20's. I also have moderate to severe anxiety, and either depression or bipolar. Maybe more 

I'm beginning to feel a little bit hopeless about therapy, I told her I wanted to go into a program and she agreed a couple weeks down the line when I started having breakdowns during our appointments. I can't find one of course.

Ah, sorry for the rambling, I feel like I've been a mess this long, sure I'm getting worse but I might as well spiral out of control again, maybe if it gets bad enough I will be seen, my family will realize I'm not lazy or stupid, or my former friends will actually care about me again

Is DBT helpful? After everything I read I fear I will need years of therapy and some strong meds",1623174444.0,False,5,4,BrilliantSeahorse,None,nv9xzc,https://www.reddit.com/r/mentalhealth/comments/nv9xzc/has_dbt_helped_you/
27,DBT group. Yay or nay?,"I’m just finishing a 12 week program that combined Act and Dbt but I mainly went for OCD so I focused on that overall. It has helped with my ocd in the places it was worst but I still suffer greatly in other areas. Suicidal thoughts, motivation, existential dread. They recommend I join their DBT group it’s 9 weeks and less intense then the IOP I’m in my last week off. Do you guys reccomend this group? ($50) a week for 9 weeks. One 2 hour session a week.",1642524085.0,False,1,1,LittlePhag,None,s71p1o,https://www.reddit.com/r/mentalhealth/comments/s71p1o/dbt_group_yay_or_nay/
28,How did you find help? (DBT),"I'll get straight to the point...I've been looking for help for about a year now and its been difficult. 

I always get rejected and the following is a list of things that have happened when seeking help:

1. ""You just have child ptsd, and mild depression you're not your sister""

2. ""I can't be your therapist anymore; you need DBT I'll help you find someone who can help"" (and I got a list of places that do not take my insurance 2 months later)

3. ""I see that you marked that you have a possible ED. I'm sorry but we can't take you in even though this isn't why you are seeking help; here is a list for places that can help you with your ED"" 

4. ""You are too high risk""

5. ""We don't take insurance"" 

6. ""We don't do DBT"" (even though they listed it as one of the things they offer) 

If not one of these I try looking for someone that has DBT listed on their profile or on their website but last place I called they told me that they couldn't take me in because they had a waiting list and it was full and they wouldn't even put me on the waiting list... 

I've seen 2 therapist the first one diagnosed me within the first 10 minutes with a mild depression and the 2nd one was nice enough to take me in but didn't know my history of problems and had to stop therapy with me because she said that if she continued with me it would do me more harm than good. I appreciated the honesty but then I was promised help looking for a place that takes my insurance and that would help and I did not receive that... it was disappointing.

I'm mentally getting worse. I've been getting more frequent panic attacks and my emotions seem to be a bit more explosive. I SH and as much as I would like to stop I don't have any other outlet to get rid of the negative feelings that I feel. I think about drinking sleeping pills to get through the harder days but I don't want to waste my days away sleeping because its too painful to be awake. I have constant nightmares and sometimes I'm scared of myself, I feel like I'll snap at some point and hurt someone else. 

I feel like I'm too sick to get any help because I keep getting rejected by the people that are supposed to help me.

I live in CA and just recently got insurance at the beginning of 2022. If anyone knows how to find a place that offers DBT please help ... I don't have anyone I can ask help from...",1644997590.0,False,1,2,For-Panda-14,None,stq9qo,https://www.reddit.com/r/mentalhealth/comments/stq9qo/how_did_you_find_help_dbt/
