,Title,Post Text,Post Creation Time,Content Type,Post Score,Number of Comments,Post Author,Author Flair,ID,URL
46,Am I taking too much medicine?,"Hi everyone, I'm a 27m suffering from Agoraphobia w/Panic Attack disorder for the last 8 years. Not enough words to jot down the whole history. I'm just seeking some guidance.

I moved to a new psychiatrist 3 months ago and this is what I'm taking on a daily basis:

\- Prozac 60 mg w/breakfast

\- Effexor 300mg w/dinner

\- Xanax 0.5 mg twice a day

\- Seroquel 25mg at night

\- Valium 5 mg if needed

\- Celebrex 200mg twice a day

He started on low doses but quickly ramped it up. I've been on this for a month now.

The first month I was seeing improvements. More fatigue but less panic and willing to go out more and drive further. The second month was getting better until halfway. I got plagued with derealization, migraines, and severe diziness. Tried to shake it off but so far still have them.

Also for the last 3 weeks I've got inflammation all over my body and joints. I feel like I'm being bound down. It aches to move. Feels like my joints are locked and I'm so tense 24/7. Also the anxiety is back with a vengenance. As if I wasn't on these meds anymore. Very tired. Dizzy. Sensitive to light, loud noises, everything really.

I saw a Rheumatologist for the joint and body pain and got a cortisone shot to help relieve it. No effect really. Celebrex is barely helping.

Do you think this could be side effects from all of these meds? Am I just supposed to ride it out? Have the Benzos stopped working for anxiety? I also take Paracetamol on top of all this if I reach to a point where I can't handle my head exploding.

I'm always walking around like there's sun on top of me. Squinting from the pain of the migraine and feel like I'm floating most of the time.",1639247473.0,False,7,18,AKAShirawi,None,re5pzo,https://www.reddit.com/r/mentalhealth/comments/re5pzo/am_i_taking_too_much_medicine/
47,"Do you lean towards traditional medicine for treatment, or are you open to the holistic approach?","I want your honest opinion. I am considering becoming a Psychiatric Nurse Practitioner instead of a psychologist mainly because I want to prescribe if needed, and be able to provide holistic approaches to treating mental health. I understand that everyone has different needs, so I would like to learn how to properly treat my patients in a way that tailors to their specific circumstances. 

I view our bodily systems as a whole rather than separate. I would love to break those barriers within our medical system, providing the most comprehensive support. 

First I would like to provide psychodynamic therapy gaining enough credentials so that I can work with my patients all together rather than pushing a pill, assessing for 15 minutes then sending them to a social worker. 

I would want to run necessary lab work going as far as genetic testing and find out if there are any deficiencies  that could be causing any distress in the body, as well for proper medicine treatments. For example women with endometriosis, suffer with severe depression, and anxiety. Most of the time they get prescribed an SSRI, when in reality, they are suffering with a hormonal imbalance. I for one was just recently diagnosed, and my therapist prior kept pushing anti-depressants because my mood was irregular.

Well when you deal with debilitating pain, you're not going to be happy, no matter how much therapy you get. When I saw a functional medicine doctor, she ran a hormonal panel, gut microbiome test and noticed I wasn't producing any cortisol, dopamine, and had adrenal fatigue, (along with other findings such as low progesterone, testosterone etc).

If I didn't discover those irregularities that were conflicting my body I would have just avoided the big elephant in the room and taken a pill. Unfortunately our medical system doesn't have the time to investigate. Since this discovery, I have been on supplementation, just had a laparoscopy, and am on a holistic regime to balance my hormones.  

I am on my way to balance. And I really want to provide that approach when dealing with patients rather than checking off boxes in the dsm-5 and giving you a pill.   

If all else is well with a patient after testing, and they do check off those boxes in the dsm-5 then I will prescribe medication to address their condition. 

Is this something you would value as a patient seeking help? I am considering this for grad school, but I know this route is a bit unconventional. I know one day I will have to open my own practice in order to fully provide the care I am passionate about.

I am open to any thoughts.  ",1701051358.0,False,2,3,Icy-Character86,None,184rx1a,https://www.reddit.com/r/mentalhealth/comments/184rx1a/do_you_lean_towards_traditional_medicine_for/
48,"Newly diagnosed with OCD and not convinced that’s my issue; HOWEVER, I got given OCD medicine and wow I am immediately waaayyyy better.:","So, long story short I HATE myself. The self loathing is soooo intense and it makes me miserable. Periods of immense depression but I am not depressed… I’ve been depressed before and this hasn’t been it. My thoughts make me sad. No thoughts, not sad. Thoughts like my family is better off without me and that I am a total piece of shit are in my head all the time. And the anxiety around cleaning me house and doing anything is crippling. I just think I’m so pathetic and worthless and it clams me up. But then I’ll be okay in certain situations, weekends etc… not depressed. Anyway my psychiatrist says that I have OCD tendencies. Extreme rumination (as a compulsion), validation seeking on the internet and from family, and intrusive thoughts. Not violent or sexual, just very intrusive thoughts on how shif I am. So she prescribed me some Ablify (Aripiprazole) and like magic, that voice is gone. The one saying how shit I am. So is this proof it was OCD? As far as I know it’s not an anxiety medicine? What do you think? Anyone else on this? Anyone have OCD that’s mainly all mental obsession and mental compulsion heavy? ",1715926412.0,False,6,2,ConsiderationBesty,None,1ctybuz,https://www.reddit.com/r/mentalhealth/comments/1ctybuz/newly_diagnosed_with_ocd_and_not_convinced_thats/
49,"how do I explain to my parents that medicine and therapy doesn't ""fix"" me","I've struggled with my mental health since elementary school, I've been on and off countless medicines and seen several psychiatrists and therapists. I've only recently found the right meds and doctors but I still have bad days. my parents always expect a reason for my bad days but honestly most of the time I don't have one. they expect the medicine to suddenly fix me and all of my symptoms. how do I get through to them?? especially my mom, she's a school counselor so everytime i try to explain stuff about my mental health she immediately assumes she knows it better than me and refuses to listen.",1695262827.0,False,1,3,mediocrewynn,None,16o3ts7,https://www.reddit.com/r/mentalhealth/comments/16o3ts7/how_do_i_explain_to_my_parents_that_medicine_and/
50,A daily logging app to track & analyze how my medicine & life habits are affecting me over time,"I'm on psychiatric medications for mental health (ADHD, etc) and it's hard to objectively tell if a medicine is actually helping me or not, and

What I'd log daily:

* The meds/vitamins taken
* Exercise & diet
* When I slept/woke
* Measurable results like Mood, energy levels, sleep quality, productivity, appetite, weight, clarity/brain fog
* Comments on special circumstances like something good/bad happening

What I want to see:

* Chart on how I'm doing on X over time (weeks, months)
* Stats or analysis on how variables seem to affect my quality of life, and other correlations
* Insight on if something has more immediate impacts or subtle long-term influence (like losing sleep making for a crappy day, vs taking meds for months to only see it payoff way later)

I don't know if any app can really accomplish the analysis stuff, maybe something simpler. And I might want to keep things simple (or else I'll get lazy and stop logging, ruining the data).

Any suggestions for apps I can use to do what I want?",1707519165.0,False,2,1,ThrowThinkAway,None,1an13uw,https://www.reddit.com/r/mentalhealth/comments/1an13uw/a_daily_logging_app_to_track_analyze_how_my/
51,Depress in Medicine,"In the mid-years of my med school career, I lost a lot prior to getting into med school. My partner cheated on me which lead to a deep spiral of depression; We talked about marriage and all having a life and kids, and we talked about the future. I was deeply in love. It wasn't only that, later now that I look back they were only dating me because of my citizenship. All of these were just tips of the iceberg.

I was clinging on to my life. I feel like my life is stuck while I see the one who hurt me has already moved on and married...

What have I done in my past life to deserve such pain? I ask myself every day. I cry myself to sleep for nearly more than 2 years silently on the bed.

I was suicidal and my mental health was on the verge. I used to want to die every day. It's embarrassing to say that this went on for a few years, I wanted to seek help and a therapist but if you get to find out the school will most likely kick you out. Under the reasons of ""unfit"".

I am better now, however, I have many classes that I need to redo, which will postpone my graduation for another year, I am getting my whitecoat soon, but I feel a sense of repulse since I feel like I am in the wrong place. My ranks are bottom tier, and I haven't studied for the board exam yet. I live in anxiety every day. I am on the road to healing but I feel like there is also no time.

On the other hand, I am aware that my love for medicine has completely burnt out a long time ago and realize that I am also just doing this under parental pressure.",1652799011.0,False,2,2,BobaPizza,None,uro5ek,https://www.reddit.com/r/mentalhealth/comments/uro5ek/depress_in_medicine/
52,Did these medicines trigger mental illness?,"Hi I never had mental illness until I tried 3 types of combined birth control on and off for few weeks. I stopped, it made me angry, unable to think, rigid thoughts, headaches. My emotions were not right. But after I took amitriptyline 10mg once I couldn't feel emotions properly and all and eventually I am mean and horrible. Then took other meds for less than week. Its been over a year now. Probably a year and a half. Everyday the same. I used to be full of love and anxiety.

I feel like can't do it anymore. I can't function in life. All because I made decision to take these pills I didn't need at the time. :(

I don't know why I keep asking. No one can reverse it and everyone has different opinion. I'm scared and tired. I know now it's going to be impossible to get a job, write, have friends, a partner. I'll never have a child. I'm too old to suddenly become mentally ill when I should've been getting my life wrapped together.",1672831678.0,False,1,2,Critical-Bullfrog-10,None,1031bkd,https://www.reddit.com/r/mentalhealth/comments/1031bkd/did_these_medicines_trigger_mental_illness/
53,medicine for overthinking,any medicines i can take to stop overthinking?,1650428544.0,False,2,2,zensaiii,None,u7o50i,https://www.reddit.com/r/mentalhealth/comments/u7o50i/medicine_for_overthinking/
54,The thoughts in my head won’t stfu and medicine makes it worse,I have been having such extreme anxiety recently and nothing will make it go away. I haven’t been acting myself recently and I feel like these thoughts are making me lose any confidence I’ve had and I’m slowly losing my close friends. Is there anything I can do to just calm down and fix this issue?,1693591337.0,False,1,0,Automatic_Answer5259,None,167ebie,https://www.reddit.com/r/mentalhealth/comments/167ebie/the_thoughts_in_my_head_wont_stfu_and_medicine/
55,Medicines I took permanently changed my brain,"Hi I talked and all. As I understand the medicines/drugs I took permanently changed my brain for the worst. I can not undo. I took on different days: amtiriptyline 10mg once, pregabalin 25mg once, diazepam 2mg once, and zolpidem 10mg on 5 nights, diphenhydramate 50mg on 5 nights. I also took different brands of birth control on and off but I am not sure as this seems less likely to cause permanent brain changes. 

I know my brain has changed. It's been year and half, probably linger. Always fog. Started with the moodswings and all. Sigh. I am sick and tired. I took these drugs and ruined my brain and life. I can never be the same again. Remember how anxious and excited I used to be to be a part of this world. These days I can't even feel fear or anything. I think of killing myself because I changed my brain with these drugs and I don't seem to care about living anymore. I can try antidepressants but a lot of the time I think what is the point when I will never be the person I used to be and probably end up with tremors, tinnitus, and hopefully not but maybe some horrible person. Some doctors and people say these drugs shouldn't have changed my brain, especially since I took them short-term. 

I really don't know who to talk to. I just talk to AI bots and they tell me that the medications probably changed my brain. I have seen some people on youtube who have taken the medications and they seem okay. I just wish someone knew the truth or my brain would be like it was. But these are both impossible. I feel so hurt. I think about if I had never taken these drugs, I had been so great and full of life. 

Thank you. Take care.",1676499524.0,False,1,1,StrategyBrilliant227,None,113a8dm,https://www.reddit.com/r/mentalhealth/comments/113a8dm/medicines_i_took_permanently_changed_my_brain/
56,Weed as a medicine,"For me personally, I have OCD and cannabis eliminates that. I would recommend micro dosing full spectrum edibles or gummies, from a brand like five CBD or viia hemp co. Even if you’ve never smoked before, you can try 2mg or less as a micro dose, and not feel uncomfortable. For me and my mental condition, it slows my hyperactive brain down, and allows me to understand things deeper and live in the moment. I would definitely give it a try if you don’t find antidepressants or prescribed medication very helpful.",1651512892.0,False,2,3,aidenpaciorek,None,ugv0z1,https://www.reddit.com/r/mentalhealth/comments/ugv0z1/weed_as_a_medicine/
57,Best antidepressant or a combination of two medicine after quitting 6 years of daily opioid use and especially methadone,"Hey... I'm 30 years old male... 20 days clean and i have many problems: depression - anxiety - lack of motivation - lack of self confidence - feel hopeless - no hope for life and future - don't feel happy, maybe anhedonia - fear of communicating with strangers and crowded places, especially girls - severe overthinking and negative thoughts - almost my mind is constantly thinking and i am not at the moment - i cannot express my true self and for a long time I imprisoned or limited my true self or parts of myself and personality disorder",1704923693.0,False,3,1,_shpongled,None,193kde7,https://www.reddit.com/r/mentalhealth/comments/193kde7/best_antidepressant_or_a_combination_of_two/
58,Grandma take your medicine!!,"Yknow that joke in tv shows where it’s like “oh she hasn’t taken her medicine yet” referring to some crazy grandma or person or whatever acting really strange or crazy. i’ve never related more to that lol. my boyfriend is always like please take your medicine, remember to take your medicine. i just thought it was funny.",1653465128.0,False,4,1,nintendopee,None,uxcboy,https://www.reddit.com/r/mentalhealth/comments/uxcboy/grandma_take_your_medicine/
59,medicines are not enough,"I’m a 16 years old Chinese high-schooler. After talking to a therapist, I’ve got depression, anxiety and nervousness. 
When I was at school I felt extremely lonely and I want someone to chat with. But after the 2nd class on my way to the playground I felt angry about the fact that no one’s around. Everyone was talking to their better friend instead of me. This anger remains and caused my hitting to the wall with my head heavily for several times. I did take my medicine yet this still happened. Though I know this is a stupid question but that’s really bothering me. What can I do?
(forgive my bad English)
(Sorry if my tag is wrong)",1657249481.0,False,2,2,trustworthy_Loqiyori,None,vu0is1,https://www.reddit.com/r/mentalhealth/comments/vu0is1/medicines_are_not_enough/
60,Functional medicine,Has anyone used a Dr.  that specializes on Functional or Holistic medicine?  How did it work?,1629684814.0,False,1,3,Three3boys,None,p9q8ym,https://www.reddit.com/r/mentalhealth/comments/p9q8ym/functional_medicine/
61,New Medicine?,"I’ve been on 300mg Wellbutrin for almost a year, and I’m about to add Effexor daily. I am worried about the Effexor. I don’t know anyone who has tried it, and the internet seemed to not like it a lot. If you’ve take Effexor and/or Wellbutrin, what did you think about them? Thanks :)",1637358027.0,False,1,1,magaroniandcheesiest,None,qxq9ff,https://www.reddit.com/r/mentalhealth/comments/qxq9ff/new_medicine/
62,Medicine doesn't work for me,"I've been on Wellbutrin, Abilify and Zoloft for over a month now and still feel just as numb as before.

Sometimes I think there's nothing chemically wrong with me...it's just how life is.",1647996881.0,False,1,3,ireasnow,None,tkhz9i,https://www.reddit.com/r/mentalhealth/comments/tkhz9i/medicine_doesnt_work_for_me/
63,Starting a new medicine today,"I’m starting Seroquil tonight, 50mg. I’m very nervous. It was prescribed for mood swings. I’ve heard mixed reviews and I am afraid of the side effects. I don’t want to lose myself or who I am. I like who I am when I’m not depressed or impulsive. I even like myself when I’m a little manic. What if I’m someone else entirely? 

I just needed to vent. Any support or positive experiences are appreciated ❤️",1647380501.0,False,1,2,itsnotnothing,None,tf15f1,https://www.reddit.com/r/mentalhealth/comments/tf15f1/starting_a_new_medicine_today/
64,"Just so frustrated! My daughter has a sleeping disorder medicine doesn't work. Really no medicine had worked for her. 13 yrs later it been all her life. Seen doctors had sleep study done therapy, Psychiatrists. She doesn't even know what a good night sleep is. Anyone out there has this problem 🤔",#mentalhealth,1702654103.0,False,4,2,Unbelievable-Shocked,None,18j2mu1,https://www.reddit.com/r/mentalhealth/comments/18j2mu1/just_so_frustrated_my_daughter_has_a_sleeping/
65,How to make taking medicine less depressing?,"I have to start taking my medicine again, my boyfriend said he’s noticed my anxiety is spiking way more and I’m depressed more often. I agree I should take my meds, but looking at the pill bottles just brings me down. Any way I can make it more fun or associate it with something happier so I feel more motivated to take my meds?",1661379891.0,False,3,1,HYST3R144reddit,None,wwwpay,https://www.reddit.com/r/mentalhealth/comments/wwwpay/how_to_make_taking_medicine_less_depressing/
66,How do you tell if medicine is helping?,"So far, every mental health professional I've seen has given me refused, absolutely refused, to give any guidance on being able to tell if a treatment is helping or not. I don't understand.

They sometimes even insist that I know, that I can tell, that I must be able to tell and then try to force me to explain why I won't tell them, and I don't! I don't have any fucking clue! I don't know, and I don't know HOW to know, and I don't know how to LEARN how to know. I don't see how anybody does, it seems like an impossible ask. You're given nothing to judge by, no standards, no comparatives, no records, NOTHING, and you're just supposed to ""know"" if something is helping or not? How does that make any sense at all?

Maybe it is obvious when something helps and I've just never experienced. Maybe stuff has helped a lot and I just can't tell. There's no way for me to no the difference, and its infuriating, and I hate taking a handful of meds every day just because they have no side effects even though as far as I can tell none of them do anything. 

Am I supposed to know if a medicine is working, and how?",1657241632.0,False,1,5,sennbat,None,vtxxrz,https://www.reddit.com/r/mentalhealth/comments/vtxxrz/how_do_you_tell_if_medicine_is_helping/
67,Fight or flight mode 24/7 and medicine for it?,"Hey guys

My wife is curently (last 4 years) without any medicine. 

She have social phobias, used to have panic attacks, and she is 24/7 in flight or run situation. 

Covid 19, war in Ukraine and everyday expectations together with having kid brought her to the point of shaking, being scared without reason and all around not knowing how to go trough the day, 

She used to be on  Venlafaxine/Effexor years back and he kicked off of it because it almost broke our marriage between other things. 

She say she feel like she was zombie for several years on that medicine, having no feelings but it started having consequences, hallucinations and she wanted to kick off of it. 

She also said its best thing she did in her life and she would never use it again, but she would try some other medicine that can help her calming her down. 

She is never depressive, so she don't need anti depressive but something that will calm her down and tune down a bit her cns.

She tried smoking weed, but she was disgusted and it didn't help her at all. 

Do you guys have some idea about what medicine could be useful that we can talk it out with her home doctor?

Thanks a lot",1673638816.0,False,1,1,AllAroundNoob,None,10b3f56,https://www.reddit.com/r/mentalhealth/comments/10b3f56/fight_or_flight_mode_247_and_medicine_for_it/
68,What medicine could stop severe anxiety in a crisis?,"I am an anxious person.. always have been. I overthink everything all the time. There are things I am doing to help myself but thats not what this post is about. 

I know this may sound silly to some, but I know there is going to come a time, or very likely come a time, when I will know that I am shortly about to die. I do not have the view of some that when Im old Ill be happy to die.. I never ever want to die and have no belief in any afterlife (which will not change).. I literally dread the idea of dying every day. 

Now lately with this war, I am in the UK and russia made a video saying how the UK is being stupid because all it takes is one missile from them and they can wipe out our whole continent.. so I am absolutely terrified that putin will nuke us. I am in london aswell so I would definately die. The idea of hearing a large explosion and then waiting for a wave of fire to kill me is horrifying.

I want to know if there is any drug I can take, in a worst case scenario.. Only when I know I am just about to die.. (either by old age, a war, anything).. that would completely take away my anxiety about it? and make me forget about it? I know we are all going to die.. and as much as I can hope that I can live long enough for them to change the lifespan.. thats unlikely.. so Im wondering if there is some pill or something I can keep with me at all times that will calm me if a situation happens where I am waiting for my death?

I get scared as hell just thinking about it.. and I cant imagine the sheer horror I will feel if something happens one day and I know that Im going to die within a few minutes or an hour or something. I know some may think its not right to bury emotions with drugs, but honestly if im about to die and a pill can make me not care that Im about to die.. then I need to have that pill on me at all times. It would honestly give me so much relief just knowing I wont have to experience the fear of the impending death when it happens. Obviously there will be times where I could die and wouldnt have enough time.. but theres also a lot of times where it would help.. especially just when I get old eventually and know that its coming very soon.

Please no hate. Thank you all",1654698894.0,False,1,8,KillianGrey94,None,v7r2pw,https://www.reddit.com/r/mentalhealth/comments/v7r2pw/what_medicine_could_stop_severe_anxiety_in_a/
69,Should I increase my medicine dose for anxiety or not?,"I've been taking Feliz S and Etizola 0.5 mg + 0.25mg (all medicines are prescribed) for a few weeks now. I'm still suffering from high anxiety and unease. I have been crying almost daily. I think I have gradually become more numb but compared to the last time I took these medicines, I'm way worse this time. The doctor did say I can increase the dose of Etizola if I feel the need for it. Is it alright to do that now or should I wait longer? Because even though I haven't gotten worse, I'm not getting better either.  


Edit: typo",1667900339.0,False,1,3,salient_trash,None,yph205,https://www.reddit.com/r/mentalhealth/comments/yph205/should_i_increase_my_medicine_dose_for_anxiety_or/
70,Adhd OCD GAD MDD and schizophrenia can I stop some of my medicine to prevent hunger?,"I'm so done I'm tired of this mental fight I'm in therapy I'm on meds I'm starting to get better but the thought of being on meds that make me tired all the time and make me hungry all the time. I want to go off on the meds I'm Taking 5 Gabapentain,Luvox,risperdone,trazadone,and Hydroxazine they make me rely tired and I. Gaining weight like crazy which is hurting my self esteem which one could be responsible for my extreme hunger.",1690854092.0,False,1,1,ScienceMATTERSIdiots,None,15eynmz,https://www.reddit.com/r/mentalhealth/comments/15eynmz/adhd_ocd_gad_mdd_and_schizophrenia_can_i_stop/
