,Title,Post Text,Post Creation Time,Content Type,Post Score,Number of Comments,Post Author,Author Flair,ID,URL
98,Can I take medicines or hormones that will make me stop desiring a girlfriend?,"Since I turned 18 and started being interested in girls, my life is ruined.  
I cannot look at girls normally. If I sit in public transport and there are girls around me, all I think is ""wow she is pretty she should be my girlfriend"". Its a curse. I want to be like before 18 again. No unrealistic desires. I hate my life because I cannot get what I desire so strongly.

Please let there be a medicine or a cure for this mental illness. I dont wanna be desperate for a girlfriend anymore. I wanna have the ability to look at girls as if they are just people, the same way as how I look at guys.",1640474055.0,False,1,15,catboy519,None,rojqhr,https://www.reddit.com/r/mentalhealth/comments/rojqhr/can_i_take_medicines_or_hormones_that_will_make/
99,Mental Health in Medicine,"This COVID-19 pandemic is putting a lot of strain in the mental health of our medical professionals, causing burnout and the tragic loss of Dr. Lorna Breen, an NYC ER doctor, by suicide in April.

Did you know that physicians have double the rate of suicide compared to the general population? Today is National Physician Suicide Awareness Day, a reminder that we must do more to support the mental health of physicians.

When 44% of physicians are burned out and 300+ physicians die by suicide every year, mental health should be a huge priority in the field of medicine. Instead we see a culture of silence, in which physicians keep their mental health struggles under the radar to escape scrutiny by licensing boards, residency programs, employers or even their peers, or when mental health issues may be seen as red flags by adcoms for those aspiring to enter the medical profession. Breaking this culture of silence is the first step in dismantling stigma.

That’s why it’s so important to share your story – Medical Minds Matter is a place where physicians and pre-med/medical students can share their mental health struggles with the option of staying anonymous because we want to include even those that are not willing to do so publicly. Follow our Instagram (@medical.minds.matter) or visit [www.medicalmindsmatter.org](http://www.medicalmindsmatter.org/) to learn more about this vital cause!

Question to you all - why does mental health matter to YOU during this difficult time?",1600360287.0,False,2,1,dep15105,None,iumyro,https://www.reddit.com/r/mentalhealth/comments/iumyro/mental_health_in_medicine/
100,Sharing one of my experiences with medicine,"Today I forgot to take my meds, normally I take one half of a pill of Escitalopramum and half of a pill of risperidonum, in the morning and another half of a pill of risperidonum in the evening. Today I forgot to take the morning portion of meds and the effect I noticed was that today I ate JUST one pack of chips and some cookies, for the entire day and I wasnt at all hungry. It was a weird feeling because normally I consume two dinner size meals a day or smth, and it has bern showing on my weight. now I took the medicine I forgot about and in half an hour I became super hungry. I kinda feel calmed knowing that my unhealthy eating habits are just my medicine. Ive been having alot of intrusive thoughts about my weight, mostly because I always have been skinny and my dad is one of these people who will constantly mention my weight and comment on it, Its really painful when I hear this, because its not my fault that I am this hungry. (Technically its fault of my dad because alot of his actions led me to a situation where I am taking these meds). Now that I think about it, I already went through the same thing a year or two ago, when I first started taking Risporidonum, and started becoming obese aswell, then my psychiatrist took me off these meds, and my weight became normal. My conclusion here is that your psychiatrist always wants the best for you, so its very important to always provide him with any problems youre having. Otherwise you might end up unnecesarily dealing with side effects even though the med you are taking can be easily replaced. This friday I am meeting my psychiatrist and will talk with him about replacing risperidonum.",1625087157.0,False,1,1,Antekcz,None,ob6ktr,https://www.reddit.com/r/mentalhealth/comments/ob6ktr/sharing_one_of_my_experiences_with_medicine/
101,As needed anxiety medicine,"Hello everyone, this is my first post on here and I hope it’s relevant.

I was stalked and raped violently 6 years ago causing obvious trauma and a diagnosis of ptsd. After a couple years of partying the pain away I started having bad anxiety attacks. I was prescribed Zoloft and saw a therapist steadily which really helped for a couple more years until very recently some other terrible things involving family happened and I can only assume triggered my anxiety to a whole other level. My GP prescribed me trazodone for my nightmares.

Fast forward a couple months and anxiety attacks here and there, I went to the ER one night thinking I was having a seizure but was simply given a Valium (which worked amazingly) and was told I had an anxiety attack. This one was just bigger and more horrible than before, maybe because it was so bad it outdid my years of Zoloft use? Idk, Anyway... I had since been having vicious panic attacks at least 4 days a week and it is ruining my work and social life.

I went to my GP and told her what happened in the ER and my daily debilitation and straight up asked for something “as needed” while me and my therapist worked out some more knots in my head and heart. She prescribed me Buspirone and upped my Zoloft.

It’s been a couple days and I had a terrible anxiety attack that i took the Buspirone for but had no relief. Which obviously made things worse for the attack and am now here on reddit 4 am in the west coast pretty desperate for advice.

I never wanted to be on any daily medication in the first place. I’m a very attracted to nature and things of authenticity but with ptsd things aren’t the way I wish, which I accept. My therapist (who I adore and owe my life, honestly) thinks I don’t need medication and has always thought so but is only a psychologist so can’t really weigh in too much on that.

All my GP seems to do is put me on more and more medication that makes me feel concerned for my actual healing; how am I supposed to heal my soul and heal naturally through therapy while I’m doped up the whole time? I know she means no harm but I believe we have different ideas of my mental health journey. So I want to ween off everything I’m on and simply have a TRUE as needed medication that can kill the attacks while I work things out authentically with my therapist... like instead of trimming my issues slightly everyday by taking chemical reactors, I want to remove the skin altogether that keeps me so jailed. 

I want to get a second opinion with another doctor and have a few questions:

1) should I see another GP or go straight to a psychiatrist?

2) what as needed medication is best for massive anxiety attacks?

3) am I totally out of touch and should just trust my current GP?

4) is it appropriate to straight up ask for a benzo or should I just tell my story and wishes without specific demands? Will i sound like a druggie???

I know this is a lot and bless your soul for reading it all. I’m so desperate I sometimes feel my life is on the line when really I just want to LIVE. 
Thank you!

",1543581426.0,False,5,10,kishfish,None,a1s25v,https://www.reddit.com/r/mentalhealth/comments/a1s25v/as_needed_anxiety_medicine/
102,Working Medicine and Improvemengs,I have finally been on working meds now for about 3 months now and it took a while to get here. Everything just seems so much more positive and like it's easier to be positive. I have major depression. Unfortunately due to covid I cant work on things that I'd like to improve (mainly social life). I just dont really have anyone to share this with. It feels weird being like this like being able to think faster and control my thoughts better. Medicine is really doing a lot of the heavy lifting here.,1599503947.0,False,2,1,noissimsarm,None,iod8cn,https://www.reddit.com/r/mentalhealth/comments/iod8cn/working_medicine_and_improvemengs/
103,Gut > Brain?? New to natural medicine,"My mom made me see a wellness psychiatrist guy who treats patients with alternative/natural medicine. He told me that my mental health issues could possibly be because of what I eat and what’s in my gut. Does that sound reliable? 
The whole alternative medicine thing will always sound shady to me, but he isn’t trying to get me off of the medications my real psychiatrist gave me. I’m fine with improving my diet as he says, but each one of his appointments are $600 because insurance doesn’t cover it. 

He also looked at me and said that my dark under eyes are a sign of inflammation in my gut. I didn’t like that he made an assumption like that right away especially because discoloration under the eyes is a pretty common ethnic trait for Arabs like me and my family. I expressed as much to him, but he changed the subject easily. I don’t trust him, but I’m unsure if I’m being too critical or if he’s actually unreliable. 

Does anyone have any advice?",1609376896.0,False,3,4,Jemkha,None,knfex9,https://www.reddit.com/r/mentalhealth/comments/knfex9/gut_brain_new_to_natural_medicine/
104,Im so fcking mad right now all i want is my nausea medicine is that so dam hard to ask for,Apparently my doctor was on vacation but was in the office yesterday but never responded to me refill .. ive been violently throwing up from chs for days becaus i cant get a simple refill … thats all i want im just crying and throwing up and i cant stop im go buy my medicine on the dark web or fucking mexico smh i dint know what else to do ive called the on call doctor multiple times they said they sent a fill but the pharmacy isnt getting them i guess idn anymore i would just like to eat one bite of something and hold it down take one sip of water and hold it down fuck sake smell a food and not throw up tmi sorry but this is what chs is kinda morning sickness losing weight cant eat sigh im falling apart and all i want is my nausea meds,1683998776.0,False,2,2,Richardsbitlife,None,13gnfms,https://www.reddit.com/r/mentalhealth/comments/13gnfms/im_so_fcking_mad_right_now_all_i_want_is_my/
105,Developing a strange phobia of medicine,,1614562871.0,False,1,1,ccl722,None,luwlpp,/r/Anxiety/comments/luwlay/developing_a_strange_phobia_of_medicine/
106,No medicine seems to work,I’ve been taking the same medicine for a while now.  Went for one week at half the regular dose and another without any at all while trying a new medicine.  Still hearing voices telling me they hate me.  Not sure what else to do.  Maybe someone here knows how to cope?  I’m a schizophrenic btw.,1601502740.0,False,1,2,CharmingBarnacle11,None,j2vkfa,https://www.reddit.com/r/mentalhealth/comments/j2vkfa/no_medicine_seems_to_work/
107,Medicine Withdrawal Help,"Located in US/South Louisiana

I'm having some issues with medicine withdrawals, and I'm wondering if anyone has any advice or can help.

When I went to see my psychiatrist Thursday, he recommended getting off of Zoloft and then starting Cymbalta. However, he wanted to taper off of 200mg to 100mg for a week and then nothing at all, while starting the Cymbalta simultaneously.

I tried it on Saturday, and I've been experiencing so many side effects, predominantly nausea/vomiting, dizziness, brain fog, and brain zaps. I called the doctor's office yesterday, and he wants to taper off of the medicine slower - start taking 150 instead of 100 for a week, and then taper down by 50 each week while continuing the Cymbalta. He also prescribed some anti-nausea medicine.

Today's the first day on the 150s, and I possibly feel worse now than I did before. I haven't really eaten much due to the nausea and my various stomach issues, and the anti-nausea medicine isn't working today. I'm so dizzy and can't really function very well.

Making it even worse, my depression and anxiety have come back in full force.

Any advice on how long this lasts or what I can do? I've found ice chips to be super helpful to keep down liquids, but I don't know what else to do.

Thanks in advance for your help (and reading this long post).",1591110688.0,False,1,0,mdupre28,None,gv91up,https://www.reddit.com/r/mentalhealth/comments/gv91up/medicine_withdrawal_help/
108,Is there such a thing as an urgent care for mental health that can prescribe medicine?,"So in May I admitted myself to the hospital for weird symptoms I was experiencing (which turned out to be psychosis which they believe was from de). I was prescribed antipsychotics and antidepressants after I was discharged after a five day stay. They helped a lot! However, I have since run out of the antipsychotic and am starting to ration the antidepressant since I am almost out. I have done everything in my power to try to get a refill (contacted the hospital, contacted the office of the doctor that prescribed the medicine, contacted the pharmacy for an emergency refill, and contacted the hospital's advocate). 

I have a psychiatrist appointment but it isn't until the end of the month. I have progressively started to have symptoms again and they are getting worse by the day. I really do not have the ability to stay in the hospital again due to my job. However, it is going to be very difficult to deal with this for the next few weeks and I'm scared. Is there some urgent care way of getting a prescription that will last until the end of the month? I live in the US.",1657469493.0,False,3,6,umberdragon,None,vvusbe,https://www.reddit.com/r/mentalhealth/comments/vvusbe/is_there_such_a_thing_as_an_urgent_care_for/
109,TBI depression medicine,"My TBI is causing so much trouble for me. My short term memory is horrible and on top of that I'm having severe depression, anxiety and OCD. The doctor has put me on multiple medications, none seem to work or have bad side effects. Does anyone know a good medication to try for this? I'm about to give up on everything. I was going to talk to a therapist but my insurance only covers a certain one and it's a 4 month waiting list. I need help now!! 😭",1571148869.0,False,3,3,drealz86,None,di8i3l,https://www.reddit.com/r/mentalhealth/comments/di8i3l/tbi_depression_medicine/
110,What has been your experience taking medicine for ADHD?,How did it feel? What happens if you stop taking medicine?,1632977435.0,False,1,1,Beginning-Ad6447,None,pycp8h,https://www.reddit.com/r/mentalhealth/comments/pycp8h/what_has_been_your_experience_taking_medicine_for/
111,Which combination of medicine helps people (with bipolar) with their depression and anxiety?,"My psychiatrist told me I can’t be on an ssri without a mood stabilizer or antipsychotic because of risk of triggering a manic episode. But I’m on Abilify rn and Wellbutrin, and Wellbutrin is making me feel horrible yet she won’t change my medicine. If I get on actual ssri, will it trigger a bipolar episode?",1647207591.0,False,1,4,rooster_11141,None,tdh9g0,https://www.reddit.com/r/mentalhealth/comments/tdh9g0/which_combination_of_medicine_helps_people_with/
112,Abusing cough medicine,"I've been on somewhat of a functional bender for the last couple weeks and it's been escalating to mixing Dextromorphan with alcohol because I want to reach some unattainable state of ecstasy. I feel like I need to trip on DMT I order to break this dangerous habit of pushing myself to the limit. For some reason I keep finding it harder to escape reality so I push myself to the limit. I feel ashamed of the porn I watch, but it takes so much to feel anything.

I might have to stop taking my antidepressants",1585006987.0,False,1,0,vegetablewizard,None,fnunns,https://www.reddit.com/r/mentalhealth/comments/fnunns/abusing_cough_medicine/
113,Anxiety became really high in 3rd and 4th week of medicine.,Currently taking esacitolapram. Anyone had similar experience?,1638310563.0,False,1,1,acertenay,None,r5yz6m,https://www.reddit.com/r/mentalhealth/comments/r5yz6m/anxiety_became_really_high_in_3rd_and_4th_week_of/
114,Medicine troubles,"Hi I’m f 18. I’ve been taking zoloft for about 6-7 years. I’m one of those people that have a hard time staying on a schedule of taking them so I take them on and off. Sometimes I’ll go months without them. Well I feel like this medicine has made me worse. I’m a completely different person when I’m not taking them. I’m toxic, I’m mean, and just really bad.  My mental health plummets while not taking them. It’s never been this bad before though. I started these for depression but now I have a huge amount of other mental illnesses. There’s other factors to why I have more mental issues now but I feel like these have made it worse. Anyone have anything similar to this? Or any problems with Zoloft at all? Or recommendations?",1554847533.0,False,1,1,myassholehurtsmom,None,bbe2g7,https://www.reddit.com/r/mentalhealth/comments/bbe2g7/medicine_troubles/
115,I don't want to try medicine again. What can I do?,"I'm (20m) about to be a junior in college and am seriously depressed and have a ton of anxiety. I was on medicine most of my freshman year and my grades were horrible and I didn't feel myself. I stopped taking meds and my GPA shot up and I was finally able to better function socially despite my aspergers. I got a girlfriend and my GPA after last semester is approaching the mid 3.0s.

Cue to me now having basically no hope for my future and suffering an existential crisis where I'm struggling to see why life is worth living. I need help, like hospital help. And my mom says I need medicine but I don't want to turn into a fat, slow, idiot again. I would legitimately rather die than take meds and ruin my future, GPA, and social life

What can I do? Please help me",1623981172.0,False,2,5,imsosadplshelp,None,o2dqg9,https://www.reddit.com/r/mentalhealth/comments/o2dqg9/i_dont_want_to_try_medicine_again_what_can_i_do/
116,Grandmother with anxiety was caught throwing medicine away,Our grandmother had been complaining about her arthritis so her doctor upped the dosage and she has been extremely irritable and getting worked up over the smallest stuff which is weird. We found out today she was throwing her medicine in the trash can. after she got super emotional and tried lashing out at our dog. We have an almost 1 year old and while we know the 1 year old means the world to her we fear she might do something irrational and hurt the child unintentionally. If she was financially stable we would probably kick her out but she doesn't make enough to live on her own and I fear kicking her out would kill her. What can I do about this I feel trapped between a rock and a hard place. I would prefer her to get help and continue to live with us.,1616018796.0,False,1,1,Ovted_Gaming,None,m7c05a,https://www.reddit.com/r/mentalhealth/comments/m7c05a/grandmother_with_anxiety_was_caught_throwing/
117,Best way to track my medicine AND mood?,"Was wanting to know if anyone had suggestions on the best way (or even any way because I simply cannot think of a great one), to track the medicine I'm taking (for ADHD), the dosages and times etc, and (almost most importantly) the effect it has. 

The reason is because I have days where the effects are mostly desirable, and then I'll have days where symptomatically things go a bit (a bit is quite an understatement) awry. 

I'm struggling to simplify a way to track this, because of how many factors change on the daily, for example did I eat before? How much time elapsed between doses? What time of day did I take it? How did I feel? 

I guess to further clarify, I understand I could write it down, but would it be easy to start noticing patterns with so many changing factors? Just curious to see if anyone has a method that works for them, or, perhaps (and likely), I'm just overthinking the entire thing. 

P.S. I understand the best idea will be to consult my doctor, but I know it's highly likely that they'll ask the very questions I'm asking myself about the variables.",1606970132.0,False,1,3,luca1809mazzanti,None,k5qfiw,https://www.reddit.com/r/mentalhealth/comments/k5qfiw/best_way_to_track_my_medicine_and_mood/
118,Holistic medicine,Has anyone tried holistic medicine to deal with the effects of anxiety and depression? Thanks! ,1552017351.0,False,1,1,caconci,None,ayltoi,https://www.reddit.com/r/mentalhealth/comments/ayltoi/holistic_medicine/
119,Scared of taking anti anxiety medicine,I've had anxiety my whole life and I just got prescribed some anti anxiety medicine. I don't know I'm just scared of being boring or someone I don't like when I'm medicated. Has anyone else experienced this and what was the outcome?,1582579727.0,False,2,4,paniqueen,None,f8yjce,https://www.reddit.com/r/mentalhealth/comments/f8yjce/scared_of_taking_anti_anxiety_medicine/
120,I think my medicines are interacting negatively.,"I 38. I am on Adderral 30mg XR for my ADHD. I am also on Metformin for pre diabetes . And Fluvoxamine 100mg for OCD/intrusive thoughts. I was also on Lisinopril with the water pill additive bit that made me very dizzy in the evening. So my doc swapped it with normal lisinopril. 

I have complex sleep apnea and have been exhausted every morning. I’ve also barely been able to focus as well during the day. And I nap because I don’t sleep well but then I’m up late. And the cycle repeats. 
I also had been in a real bad funk for a while and can’t ever be “present”. My mind is always racing and I’m never relaxed. 

My sleep doc said my sleep machine results are really good so she doesn’t think my apnea is causing the exhaustion and inability to focus. 

So my primary care also gave me Wellbutrin 150mg. 

Since taking the Wellbutrin and Lisinopril (started at same time 1 week ago), I have been super super exhausted. Like I could sleep all day. I have also felt in a stupor. Like I’m moving in slow motion. Most concerning though is my blurry vision. It’s like my eyes can’t focus, especially on words on a screen. Like when I’m typing this now.",1606516141.0,False,2,3,vinylandgames,None,k2b4xo,https://www.reddit.com/r/mentalhealth/comments/k2b4xo/i_think_my_medicines_are_interacting_negatively/
121,Thousands of Colorado patients put in peril due to risky prescribing of psych medicine,"Known as “benzos,” the anti-anxiety drugs include trade names like Klonopin, Valium, Xanax, Ativan and others, and they are soaring in popularity. 

Use the prescriber lookup tool in the article to search Medicare data and see who heavily prescribes benzodiazepines in Colorado. 

This article is posted from source and is not paywalled

[https://denvergazette.com/colorado-watch/thousands-of-colorado-patients-put-in-peril-due-to-risky-prescribing-of-psych-medicine/article\_9a59cbaf-aff8-54d1-a041-58ef3541a1ee.html](https://denvergazette.com/colorado-watch/thousands-of-colorado-patients-put-in-peril-due-to-risky-prescribing-of-psych-medicine/article_9a59cbaf-aff8-54d1-a041-58ef3541a1ee.html)",1652389686.0,False,1,0,EmBejarano,None,uob8k0,https://www.reddit.com/r/mentalhealth/comments/uob8k0/thousands_of_colorado_patients_put_in_peril_due/
122,Free Webinar on The Future of Personalized Medicine For Mental Health," 📆 The webinar takes place on 01 October at 3.00pm SAST.

➡️ You can register here: [https://event.webinarjam.com/channel/Dr-Riyad-Webinar](https://event.webinarjam.com/channel/Dr-Riyad-Webinar)

 Newly appointed **Chief Innovation Officer of M2Bio Sciences,** [**Dr. Riyad Domingo**](https://pr.report/Ao8uZJbV), will present his inaugural webinar on the future of mental health therapeutics derived from the psychedelic prodrug psilocybin.

**Dr. Domingo holds a PhD in Medical Biochemistry** with a focus on drug discovery and development from the **Institute of Infectious Diseases and Molecular Medicine at the University of Cape Town**.",1632846995.0,False,1,1,pancakesandflowers,None,pxa9io,https://www.reddit.com/r/mentalhealth/comments/pxa9io/free_webinar_on_the_future_of_personalized/
123,I’m almost out of medicine with no refills,"I live in the USA (Mississippi) so medicine is already hella expensive. I realized last night that I’m completely out of refills and the soonest I can get in with a psychiatrist or nurse practitioner is October 2nd. That means I would be without my medicine for a month at the least, depending on my finances. I’m on Lamictal and Zoloft for BPD, depression, bipolar disorder and anxiety. I’ve been on these two medications with the same dosage for 4 years without missing a day. I’m so scared when I run out. I don’t want to be the explosive angry bitch I was 4 years ago. Does anyone know how I can get my prescription refilled before I run out? Or how to cope without medication?",1599059582.0,False,4,5,drunk-oblivion,None,il8mbs,https://www.reddit.com/r/mentalhealth/comments/il8mbs/im_almost_out_of_medicine_with_no_refills/
