,Title,Post Text,Post Creation Time,Content Type,Post Score,Number of Comments,Post Author,Author Flair,ID,URL
164,Question abiut medicine . Didnt know where to post.,"First I wanna say ,I have social anxiety and general anxiety . I'm not usually a depressed human . I'm actually the opposite,very upbeat ,peaceful ,funny etc. I'm not usually outgoing or anything like that but with my family and friends or co-workers I'm a peace maker, a bright smiley guy. Genuinely. Here's the thing. 

I've also scored extremely high on the scale for add.

I'm a creature of habit. I love routine. I'm learning to break that though because of how it can be negative. And this year has been crazy for changes for me and my family. New place . New jobs. A job I'd never see myself doing. I took it because it was outside of my safety bubble of factory work. Marriage issues. Family troubles. 

It's been one hell of a year for me. 

Now for the medicine questions.

I've tried all the anti depressants,they make me have suicidal thoughts ,zombified ,etc. Like every worst side effect I get from them all. They do the opposite for me . Just like opiates do absolutely nothing for me for pain. They make me wired.  I was told it seems medicine has a paradoxical effect on me and that it just happens that way in life sometimes. Just like I can drink coffee before bed to relax me lol.  But anyways . Here goes nothing. 

We finally decided on Clonazepam. For anxiety / sleep. It oddly enough does help me sleep if I mentally want to sleep. Like I tell myself it's time to sleep. So wierd. But I try extremely hard to not take these things. I don't want to become addicted. But for example. Tonight. I was dreading work. Like bad. I had what I call a fight anxiety attack. An angry one. Well I took a Clonazepam knowing it was only going to get worse. I feel alive. In a way we're I'm interacting with customers , hey I really like your shirt. Making jokes with them. My mind isn't racing. No panic. No anger. I'm walking around my job singing to the music. Just doing my thing. No mental issues at all. I'm able to focus. Think. And do. And I'm happy. Not drunk or high. Just like a normal functioning human. 

Is there an alternative to this as needed medicine I could ask a Dr about that I take in the morning or something.  Anyone else have this paradoxical mind ?",1540615727.0,False,2,3,yetty4ever,None,9rrppp,https://www.reddit.com/r/mentalhealth/comments/9rrppp/question_abiut_medicine_didnt_know_where_to_post/
165,How do you know your medicine is working?,"I have rapid cycling bipolar disorder and I'm on Abilify 15mg. I started at 5mg and have been working my way up but don't want to keep increasing my dosage if it is not working. I do seem to be happier and the have my moments where I am feeling depressed and anxious and just don't know if the medicine is working. 

How does anyone know if your medicine is working as it should?",1503000705.0,False,2,5,solipsistrealist,None,6ucoi1,https://www.reddit.com/r/mentalhealth/comments/6ucoi1/how_do_you_know_your_medicine_is_working/
166,Wonderful people! Please in addition to good doctors that have good reviews; wonderful people please enjoy good tasty healthy food and exercise and appropriate sunshine and sleep! A good healthy lifestyle is good medicine too! And good preventive medicine too! All the great physicians know this!,Wonderful people! Please in addition to good doctors that have good reviews; wonderful people please enjoy good tasty healthy food and exercise and appropriate sunshine and sleep! A good healthy lifestyle is good medicine too! And good preventive medicine too! All the great physicians know this! Enjoy and God bless you! “The body is The Temple of the Soul.” Says the Bible.,1626644689.0,False,1,1,Aggravating_Pop2101,None,on04r9,https://www.reddit.com/r/mentalhealth/comments/on04r9/wonderful_people_please_in_addition_to_good/
167,Is there any natural medicine available for psychosis?,"I'm tired of the antipsychotic pills that don't always work and always have bad side effects, wondering if theres anything natural that works. ",1496497375.0,False,1,5,mk24680,None,6f18y0,https://www.reddit.com/r/mentalhealth/comments/6f18y0/is_there_any_natural_medicine_available_for/
168,Should I ask my psychiatrist to switch anxiety medicine?,"Approximately a year ago, my psychiatrist prescribed Lexapro for my anxiety.  The results were great (overall improved confidence, mood etc), but I noticed some other less desirable changes in my personality.  I feel less mentally sharp, I'm more impulsive and make poor decisions more frequently.  Also, a genetic test done on my mom said that she shouldn't take Lexapro, so there's a chance that I shouldn't be taking it either.  I would just like to state that I noticed these effects before I learned I might have a genetic predisposition to react negatively to the medicine.  ",1531270953.0,False,2,3,ImanginaryMaintenanc,None,8xv4ax,https://www.reddit.com/r/mentalhealth/comments/8xv4ax/should_i_ask_my_psychiatrist_to_switch_anxiety/
169,Need help deciding on taking or quitting medicine,"So I’ve been taking Wellbutrin as an add on and it makes me enjoy things more often, but it makes me irritable and mean. Apparently I can only have one or the other, either pleasure or no irritability, so I thought I’d get some opinions from people here.

I’ve been taking Wellbutrin for about 6-8 weeks, but there was a period when I had to go without it for about 5 days because I was supposed to quit it, but I got a high, which is the holy grail for me, so I kept taking it and I ran out, so that set the steady state back some.

I think this is the only add on that was the best for me on my test results. But I was just wondering which I should trade",1539218968.0,False,1,0,marvelite180,None,9n59ns,https://www.reddit.com/r/mentalhealth/comments/9n59ns/need_help_deciding_on_taking_or_quitting_medicine/
170,Getting prescribed medicine before seeing a psychiatrist,"So I have started to make steps to further control my bipolar and ocd by finding a psychiatrist... I have never seen one before, I just always saw my primary and would have him adjust or change my meds.

I can't see my psychiatrist until May though, and with how I'm feeling lately I still have an appt with my primary to see about medication adjustment.

My concern is this negatively affecting what my psychiatrist may be able to do for me.

Am I overthinking the process?",1520283582.0,False,3,0,anewvogue,None,829ari,https://www.reddit.com/r/mentalhealth/comments/829ari/getting_prescribed_medicine_before_seeing_a/
171,Fuck the US Healthcare System! America is a terrible country for mental health!,"Early last year, I thought I had decent insurance because I could see a psychiatrist for $25. Then Oscar Health decided to arbitrarily cancel my plan in the middle of the year and automatically enroll me in a ""similar plan"". Similar my ass! - I now had to pay $90 to see the same psychiatrist.  Fuck you Oscar Health! Now my new insurance for this year is refusing to pay for a medicine I'm prescribed because it's not a ""preferred medicine"". My doctor prescribed the ""preferred medicine"" for me to save money, but I ended up having a huge depressive/anxiety episode while on it! I ended up going back on the old medication because I felt so bad on the ""preferred medicine"". Did it ever occur to anyone that the preferred medicine might not work for everyone and there is a reason that these non-preferred medicines are still being manufactured? On top of that when I do need to see a psychiatrist, I have to book appointments several weeks in advance because he ""has such a busy schedule"".

I lived abroad for 8 years in Japan and South Korea, but now that I'm back in my home country my mental health has taken a turn for the worse - this is mainly due to the horrible mental healthcare (and healthcare in general situation) in the US. While there was probably more stigma against mental healthcare in Japan/Korea than the US, I didn't have to wait very long to see a psychiatrist. I was able to get medication and not worry if I would be able to afford it or not.

Even though I'm an American citizen, I sometimes hate this country so much for the shitty healthcare!",1673408273.0,False,238,29,tgruff77,None,108uehy,https://www.reddit.com/r/mentalhealth/comments/108uehy/fuck_the_us_healthcare_system_america_is_a/
172,Can medicine used to treat Mental illness have long term side effects,"When I was younger I was given Ritalin because they (pyschatrist) thought I had adhd turns out I didn't and I started having vivid and horrible hallucinations. I was put in a psych ward etc. 

Well fast forward to 2019. I was put on Latuda for my bipolar. Latuda was an absolute nightmare for me. The only way I can describe what I felt while taking Latuda was , restless yet tired and energy less. unable to think clearly (mind going a thousand miles per hour, my thoughts getting mixed up together) thankfully I stopped taking it and was put on Seroquel 2 months after I stopped taking Latuda. (SEROQUEL works amazing for me) But I still feel the effects of Latuda (unable to think clearly /getting my thoughts mixed up) Which never ever ever happened to me before I took Latuda.  My therapist kind of talked about it a little bit and told me it was possible. since psych meds can be known to have long term effects. 

It puts me into a panic attack when I start to think about the long term effects. because I don't want my mind to jumble up thoughts together forever. I want to be able to think clearly like I was able to before Latuda.  I know my therapist already told me this can happen. but I don't see her again till Monday. and idk what to do. (I'm not suicidal or anything) I just don't want this to be another burden.",1578640744.0,False,1,0,Awupisc,None,emnkdk,https://www.reddit.com/r/mentalhealth/comments/emnkdk/can_medicine_used_to_treat_mental_illness_have/
173,[Research Study] NYU School of Medicine Research Alcohol and Traumatic Stress,"  

Do you want to cut down or stop your drinking? Are you experiencing any symptoms of stress from a traumatic event?

NYU School of Medicine is researching the effect of an investigational medication on drinking habits and symptoms of stress from a traumatic event. 

You may be eligible to participate in this study if:  
\-You are 18 years or older  
\-You have a desire to cut down or stop your drinking  
\-You currently experience symptoms of stress due to a prior traumatic event

Qualified participants will receive medical evaluation, including MRI scans and blood tests, at no cost. Participation would require in-clinic visits once a week over the span of 3 months, and a final visit after 6 months. 

Compensation will be given for participants’ time.

 For more information, please contact our study team at: NYUAlcoholAndStress@NYULangone.org or (646)-754-4924.

Research Study Website: [https://med.nyu.edu/psych/research/research-programs/center-study-alcohol-use-disorder-traumatic-stress](https://med.nyu.edu/psych/research/research-programs/center-study-alcohol-use-disorder-traumatic-stress)

Privacy/Confidentiality Policy: [https://nyulangone.org/policies-disclaimers/hipaa-patient-privacy](https://nyulangone.org/policies-disclaimers/hipaa-patient-privacy)",1570557152.0,False,1,0,ao2454,None,df3jy0,https://www.reddit.com/r/mentalhealth/comments/df3jy0/research_study_nyu_school_of_medicine_research/
174,Will antidepressant/other mental health medicine change me in ways i don't want?,"i am 19 years old sophomore in college and have suffered from an undiagnosed mental illness for as long as since 5th grade where i remember an incident involving me trying to suffocate myself with my pillow, for the utterly ridiculous reason of my mom not letting me go outside to play with my friends. it was not until about senior year that i realized that maybe something was wrong with me mentally. i have never really talked about this subject with anyone except one counselor at my college a few months ago. i had a meeting in which they got my general story and told me they think i am depressed. 

they wanted me to start one on one therapy when i came back from christmas break, but i never started. one of my biggest fears, more so than just living with my mental issues, is being prescribed medicine that will fix my depression/whatever is wrong with me, but will change who i truly am. i have heard stories in passing of people that get put onto medication and turn to ""zombies"", ""weirdos"", or just described as ""not themselves"". I have no idea how true these stories are, its just word of mouth, but the thought just terrifies me. I for the most part love who i am when i am feeling mentally healthy (not counting my ""bad days"" where i do not like myself) and do not want to change. 

on my good days i am very energetic and playful and happy and very very individualistic. i would hate for any of this to change. however on my bad days i am very quiet, introverted, and do my best to hide away from people, responsibilities, work to do. these are the problems i want fixed.

does anyone have any advice for me? can anyone attest to my fears as nonsense? thank you for any help. sorry if this post is redundant at all.",1522970430.0,False,2,9,throwaway69692527,None,8a4lru,https://www.reddit.com/r/mentalhealth/comments/8a4lru/will_antidepressantother_mental_health_medicine/
175,Looking for some advice regarding medicine and insurance.,"First things first, I've never been on this sub before. I'm not sure if this is the appropriate place to post, or if it violates any rules here. I apologize if I'm wrong on either count. 

A quick explanation of the situation. I've never taken mental health medication, so I'm sorry if I sound uneducated, or if there is a simple answer I'm just unaware of. This is about my SO, who aged out of her parents insurance (Kaiser Permanente). She's taking a variety of medicine, not sure which ones specifically. She had an appointment the last week of her coverage and got most of her prescriptions refilled, and has enough to last a while. She wants to keep Kaiser because they have all her info and the transition to a new plan would be simple.  Unfortunately she missed the cutoff date for signing up with Kaiser to have her coverage begin on June 1st, and now apparently will not be covered until July 1st. 

She said all her medications should last until July, except for one. Her Prozac generic, which is obviously very important. Not sure off the top of my head when she'll run out, but sometime in the next week or two. She's freaking out because we don't know where to get more while she's between coverage, and I'm freaking out because I'm the last person to ask about any of these things. 

I guess I really only have one question at the moment. Is there any way to get more of her medicine while she's not covered? Money isn't a huge issue, as we only need a few weeks max until she is covered again. 

Thanks in advance for any advice you may provide! As I said before, if there's a better place to post this, I certainly will.",1495840003.0,False,0,3,xpyroxmanx,None,6dkbyy,https://www.reddit.com/r/mentalhealth/comments/6dkbyy/looking_for_some_advice_regarding_medicine_and/
176,Ayurvedic Medicine - A Natural Treatment For Anxiety,,1516691811.0,False,0,1,maharishiayurvedaind,None,7scr6b,https://i.redd.it/uvzlv54iprb01.jpg
177,"I feel good. And I know it’s the medicine, though I’m not sure which medicine. Not that it matters. I feel human again, like I can get back on my feet and move forward.","I’ve started on three meds this year, and for the first time in a very very long time, I actually feel good. I feel relaxed. Not high. Just calmer, happier, better. I have more energy. I’m motivated to do things, and I don’t want to just watch tv all day every day (when I’m not at work).  

I know my meds are the reason why. I restarted Zoloft after a few years off, and began feeling better. A few weeks later, I was diagnosed with hypothyroidism and started levothyroxin. A couple months ago, I started buspirone. Levothyroxin can take a few weeks to start showing effects, and Buspar can take a few weeks to get to full effectiveness, so I can’t tell if it’s the thyroid med or anti-anxiety med, or a combination of both, that’s making me feel real again. 

I know it’s not outside factors. My job has been increasingly stressful, and I may not have it much longer (possibility of layoffs), but I’ve been able to stay calm, under control. I’m not getting angry or worked up, at work or at home. I’m actually kind of happy. I feel a little guilty about that, because I know it’s because I’m medicated, but then I tell myself that it’s ok to be medicated. Something is “off” in me and I need medicine to fix it. 

I just wanted to share that with someone.",1561603115.0,False,15,1,ScienceUnicorn,None,c5zwnu,https://www.reddit.com/r/mentalhealth/comments/c5zwnu/i_feel_good_and_i_know_its_the_medicine_though_im/
178,Medicine does not give me future,"I have these two medicine; Ketipinor 50mg and Sertralin Hexal 50mg for Anxiety attacks and Bipolar disorder. I have had few unwanted side effects and i think i'll be rather dead than forced to eat these medicines. Can you people tell me your experiences on using these so called ""medicines"". 16yo dude from Finland 🇫🇮",1481597102.0,False,2,0,Halcien,None,5i13bn,https://www.reddit.com/r/mentalhealth/comments/5i13bn/medicine_does_not_give_me_future/
179,"Which medicine had the most effect in treating your depression, anxiety and lack of motivation and made you feel better or even your sense of happiness returned and made you start new work or activities and feel better about things?","
Other than SSRi's, which I think are the most used drugs to treat depression, I've heard good things about Wellbutrin and Abilify.",1692672609.0,False,2,0,_shpongled,None,15xsovj,https://www.reddit.com/r/mentalhealth/comments/15xsovj/which_medicine_had_the_most_effect_in_treating/
180,Is there medicine to take when a panic attack is coming on?,"Not a take every day sort, but just when you feel you are getting close to a panic attack?",1554525553.0,False,2,2,666_pack_of_beer,None,ba0t77,https://www.reddit.com/r/mentalhealth/comments/ba0t77/is_there_medicine_to_take_when_a_panic_attack_is/
181,Are there medicines that will give me immediate relief from anxiety and depression?,"I’m hoping there are. I heard Xanax works in as little as an hour? Is that an ‘antidepressant’? Unfortunately I’ve had anxiety my entire life, I became depressed a few months ago. I don’t want to wait 4-6 weeks to feel better. I just want some medicine until I can afford therapy, etc.

The doctor (who I haven’t met) will charge me around $150 for an assessment for anxiety and depression. People seem to love or hate this doctor from reviews and word-of-mouth.

 My fear is this doctor will somehow not take me seriously or will prescribe me the wrong meds. Obviously I don’t *know* that will happen, I want to wish for the best. How much will the medicine cost?",1548462669.0,False,5,6,ThrowawayT0,None,ajvqrp,https://www.reddit.com/r/mentalhealth/comments/ajvqrp/are_there_medicines_that_will_give_me_immediate/
182,"I have constant depression for like 8 years ,but i want tò heal i cant anymore stay like this...therapists and medicines have only made me waste time, I want to do it on my own, can you heal? I have the motivation i want tò get better",.,1706454354.0,False,1,1,Confident_Positive31,None,1ad4lv2,https://www.reddit.com/r/mentalhealth/comments/1ad4lv2/i_have_constant_depression_for_like_8_years_but_i/
183,"I have constant depression for like 8 years ,but i want tò heal i cant anymore stay like this...therapists and medicines have only made me waste time, I want to do it on my own, can you heal? I have the motivation i want tò get better",..,1706454321.0,False,1,1,Confident_Positive31,None,1ad4le1,https://www.reddit.com/r/mentalhealth/comments/1ad4le1/i_have_constant_depression_for_like_8_years_but_i/
184,The best medicine,,1381287250.0,False,2,0,lmbianco,None,1o1a3g,http://www.upstart.net.au/2013/10/09/the-best-medicine/
185,Would mass gain affect depression medicine?,"Would protein supplements like mass gain, testosterone, creatine, pre-workout affect the medicine I'm on? I'm currently taking 450mg of Lithium and 25mg of Lamictal twice a day and 400mg of Seroquil at night.",1437257792.0,False,1,2,patrickstarthatsme,None,3ds15b,https://www.reddit.com/r/mentalhealth/comments/3ds15b/would_mass_gain_affect_depression_medicine/
186,First time taking medicine for PTSD,"Hey, so I have been going to therapy on and off since 2010. I finally found a therapist that I clicked with, and have been seeing her once a month for a little over a year now. She mostly did Cognitive Based Therapy for my PTSD and it did wonders, but we have come to a wall in my recovery, and opened up the door for medicine. I just got prescribed Lexapro today and took my first dose, I know the effects won't kick in for about 4 weeks, but I am just curious if anyone else tried Lexapro or what they know about it in general. Also a little pep-talk about getting started on meds to begin with, because I don't know if this is true for anyone else, but I am terrified of how it is going to change me, I know it is supposed to be change for the better, but what if it changes a part of myself that I love?",1450309218.0,False,2,1,exhausthelimits,None,3x5821,https://www.reddit.com/r/mentalhealth/comments/3x5821/first_time_taking_medicine_for_ptsd/
187,Using Breathwork as Medicine for Borderline Personality Disorder (BPD),,1518224805.0,False,3,0,millerpl,None,7wi6sa,http://breakawaymhe.com/using-breathwork-medicine-borderline-personality-disorder-bpd/
188,I hate taking this stupid medicine...,"I forgot to refill my antidepressant (vybriid) and was without it for only 1 day. Within that time, I started having crazy withdrawals as if I'm hooked on crack or something. I would so much rather deal with my depression on my own than ever having to deal with that shit again. And people wonder why so many depressed people refuse to take their medicine. ",1460648358.0,False,0,0,FunkyColdReviewer,None,4erpn9,https://www.reddit.com/r/mentalhealth/comments/4erpn9/i_hate_taking_this_stupid_medicine/
189,What do you wish you knew before getting help/medicine for mental health stuff?,"Hello, I’m new to reddit. I’m 17F and have been dealing with mental health troubles for the past 7 years. I have a doctors appointment on Tuesday and I have no idea what to expect or how to feel. Is there anything you guys wish you knew before getting help (whether in the form of medicine, therapy, etc)? This is my first doctors appointment, but I’ve been going to counseling for awhile. I’m just sort of nervous.",1578217846.0,False,1,0,WaxCrane,None,ekb2hw,https://www.reddit.com/r/mentalhealth/comments/ekb2hw/what_do_you_wish_you_knew_before_getting/
190,How to know if my insomnia is withdrawals or side effects from new medicine?,"My drug which I've taken practically my whole life was discontinued. So my doctor put me on Risperidone for 2 months. Then I switched to abilify which I've been on for a week. On both Risperidone and Abilify I have been experiencing insomnia. How do I know if it's withdrawals from going off the other medicine or side effects from the new medicine?

&#x200B;

Thank you",1556807441.0,False,2,3,ThePoolPlayer2016,None,bjvlv4,https://www.reddit.com/r/mentalhealth/comments/bjvlv4/how_to_know_if_my_insomnia_is_withdrawals_or_side/
191,What Is Energy Medicine & How Can It Help You. Physical & Emotional Issues.,"What is energy medicine? 

It's a way to communicate with your body in its own language. It's everything that you need to empower yourself in relation to your health and wellness. It's a way to support physical and emotional issues......

Watch my video to find out more. Thanks!

[https://www.youtube.com/watch?v=2GtIY86yKbM&t=320s](https://www.youtube.com/watch?v=2GtIY86yKbM&t=320s)

&#x200B;

&#x200B;",1540302077.0,False,0,5,nbnicolab,None,9qp2e5,https://www.reddit.com/r/mentalhealth/comments/9qp2e5/what_is_energy_medicine_how_can_it_help_you/
