,Title,Post Text,Post Creation Time,Content Type,Post Score,Number of Comments,Post Author,Author Flair,ID,URL
0,Fearful of Medicine,"I'm a 30 year old male. I've been working my ass off for a little over a decade now to stay afloat and I've climbed from homeless to a decent, albeit stressful job. I'm exhausted, I'm extremely burnt out, and I can't afford unpaid leave because my bills went up 40% in the last year. 

I'm scared to go to the doctor. I have a general anxiety disorder that's been assigned to me, and for the first time in my life I can recognise that I am very seriously depressed. I was diagnosed with ADHD (at the time it was ADD) at a young age and my parents being the geniuses that they were, considered it a fake diagnosis and never had me medicated. 


But my life is falling apart. I don't have the energy to do my job anymore, let alone chores and everything else. I'm entirely alone and I don't have anyone else I can depend on for anything. I'm scared of taking anti depressants or ADHD medicine. I don't want the side effects, I don't want to gain weight or lose libido or anything like that.  But I don't know what to do anymore. 

I'll take any advice. Be it related to medicine or otherwise. I'm quite lost with how to fix things.",1716331139.0,False,1,5,Saltsmith,None,1cxkz1h,https://www.reddit.com/r/mentalhealth/comments/1cxkz1h/fearful_of_medicine/
1,Fear of medicine,"Im 18y/o male, and i cannot stand medicine, prescription or not, i cant do it, i can barely take over the counter pain relievers myself, and absolutely cannot take my prescription heart medicine. My main problem with this is i am genuinely terrified of the people i love being on medication. I have had multiple experiences where medicine goes wrong, people chose it over me, i wasn’t told about it, ect. And it put a bad taste in my mouth from a young age, i cant be around drugs, i cant be around medicine.  My issue with this is my fiancé is having health issues and needs medicine. I feel like I’m being punched in the stomach every time it’s brought up. I know that its for the better, and its needed, but i cant get myself to be okay about it. Does anyone have advice??? Im not comfortable with exposure therapy or anything and I’ve talked to my therapist about this to no avail, it’s just really hard for me.",1715909233.0,False,0,1,Arachnabyss,None,1cttecx,https://www.reddit.com/r/mentalhealth/comments/1cttecx/fear_of_medicine/
2,Forced medicine,"I was forced to get on heavy antipsychotics in a state mental hospital. One of which, I’m still taking-Invega. 

How can I feel again while on that shitty stuff? I have been smoking cigarettes again and ZYN and the nicotine helps, but it also mixes a lot with my other meds. 

How do I balance it all?",1713314494.0,False,2,0,amberpatricia,None,1c5wdmi,https://www.reddit.com/r/mentalhealth/comments/1c5wdmi/forced_medicine/
3,New medicine,3 days in and I feel on edge.  Keep repeating things in my head over and over . Suicidal thoughts keep coming up and repeating . Trintellix I think if that matters .should I keep taking it until I can't take it in hopes it goes away ? Only ever experienced lithium muscle stuff . These feelings are new after a medicine .,1709429111.0,False,1,2,Willing-Sherbert-525,None,1b54p89,https://www.reddit.com/r/mentalhealth/comments/1b54p89/new_medicine/
4,i hate medicine,"For the past 2 years, I have been taking Oxybutynin hydrochloride (for bladder issues) and Gabapentin (for epilepsy). I will be having surgery sooner or later. I really hate having to take medicine because I'm scared of getting addicted. Recently, I have gotten suicidal thoughts to OD on Gabapentin, and I did as so. Luckily nothing really happened.

I *hate* medicine. I wish I didn't have this disability at all. I wish I was all well and no one would have to worry about me.",1709406461.0,False,1,0,mr-qars,None,1b4vyg8,https://www.reddit.com/r/mentalhealth/comments/1b4vyg8/i_hate_medicine/
5,Is psychiatric medicines good or bad for our body,Is it advisable to take psychiatric medicines and does  continuation of these medicines cause any further damage to your body ?,1701007467.0,False,19,42,Electronic_Gene_183,None,184bes1,https://www.reddit.com/r/mentalhealth/comments/184bes1/is_psychiatric_medicines_good_or_bad_for_our_body/
6,Free Mental Health Webinar -Holistic Medicine,"If anyone is interested SpectraCell Laboratories offers free monthly webinars going over different health topics from a holistic approach, this month one of the topics is Mental Health.   
  
Here is a link to the series :) They also give out occasional coupon codes for attendees.  
  
Webinar series registration link:  
  
https://spectracelllaboratories.webex.com/webappng/sites/spectracelllaboratories/webinar/webinarSeries/register/918e86ee82474c0380bc79894b6794f5",1714509330.0,False,1,0,mdb_33,None,1ch326f,https://www.reddit.com/r/mentalhealth/comments/1ch326f/free_mental_health_webinar_holistic_medicine/
7,Struggling with taking medicine,"Kinda ticked off with a friend of mine. We used to be super close but have grown apart.


I went to the psych hospital a while back, and ever since then, every time I mention something mental health related, he turns into a total ass. I said to him that I was looking at mushroom and ketamine therapy. He told me I didn’t need it, that my only problem was that I don’t have a purpose. He told me that only 1% of people diagnosed have what he claims as “real” depression. He said that it’s over diagnosed and that I only use it as an excuse to take pills as an escape, to get a fix.. If I was looking for a fix, I’d still be drinking, I’d still be doping. He talks to me like I’m not putting any effort into getting better. Was going to the hospital not trying to get better? Is taking my meds as prescribed not trying to get better? Is going to therapy once a week not trying to get better? Im sorry bro, but if my anxiety and depression isn’t real, your adhd isn’t real. (Both are very real)


It just sucks. It’s hard enough feeling like it’s ok to be medicated without someone saying you don’t need it. For somebody who has mental health struggles in his family, he sure is ignorant about all of it. Is it so wrong that I’m trying to find what works for me? I just want to feel ok. I know every day won’t be like walking on sunshine, but I shouldn’t have to feel awful all the time.


Anyway, my therapist told me there’s no shame in being medicated. We don’t shame people for using medicine when they get a cough, or some illness. Mental illness is no different. So if any of you struggle with feeling like it’s not ok to take your medicine, it is ok. It’s ok to not be ok, what matters is we keep trying to get better, because we deserve to be happy and to feel peace. 


Sending out all of my Love & Positve Vibes <3",1705968752.0,False,2,2,GenerationalTalent_,None,19daubl,https://www.reddit.com/r/mentalhealth/comments/19daubl/struggling_with_taking_medicine/
8,First time medicine,"I've recently started taking antidepressants and have been for about 3 months now. And I used to have bad spirals at night that was a combination of anxiety and depression. And at the end of my spirals my thoughts would just lead to one thoughts. That I would rather die. 
My medicine has stopped these spirals but I still get this suicidal ideation. But now it's occurring through the whole day sporadically. I don't have the deep falls anymore. Or I haven't experienced one yet, but I'm not sure if It's going to get better or stop these thoughts. Now my head seems all jumbled and my thoughts of sh haven't gone away either. In fact it feels as if they've increased. My anxiety has lessened and I don't find myself crying at night. But I get feelings of almost apathy with the underline of depressed and suicidal thoughts. They never go anywhere but are still active in my mind. It's like i trade my high anxiety for a lesser one but got a bigger portion of depression and other crap I can't name off the top of my head. It feels as if it's work and doesn't at the same time.",1704095944.0,False,1,0,EV-B,None,18vs2if,https://www.reddit.com/r/mentalhealth/comments/18vs2if/first_time_medicine/
9,Scared to try new medicine,"I’ve been on anti depressants my whole life and my psychiatrist wants me to go on anafranil. I remember I tried it when I was 15 or so(I’m 32 now) and had a bad side effect but don’t remember what. It was serious enough that I had to stop though. I’m supposed to take it tonight but i feel paralyzed by my fear of the possible side effects or one of them being long term. I forgot the name but I took a new medicine 5 years ago that affected my motor skills. Once I stopped that went away but part of me feels like it’s still there. I was learning the drums and suddenly felt like I got worse. It’s probably all in my head but I just can’t get myself to take the anafranil. Idk what to do. Am I overreacting? Thanks
",1708658643.0,False,1,0,No_Mirror_7098,None,1axqdvs,https://www.reddit.com/r/mentalhealth/comments/1axqdvs/scared_to_try_new_medicine/
10,Taking new medicine,"Hi I have bipolar 1 and am taking a newer medication and have been very manic in the month long trial of taking it. I see my nurse practitioner on Thursday, I’m nervous to tell her. Any advice on what I should say about it? I like my other medicine I take with it. Could that be the problem, them fighting each other? Anybody take their medicine & have mania or mini manic episodes?",1702971430.0,False,1,0,hmclayton23,None,18lwcn3,https://www.reddit.com/r/mentalhealth/comments/18lwcn3/taking_new_medicine/
11,Friend wont take medicine or schedule therapy,"Hey all, just wondering what you think about this and if you have advice. 

Back in december my friend admitted himself to a mental hospital. After he got out they put him on lexapro and told him to get therapy. He took his medicine for about two weeks at most before quitting, and never scheduled therapy. He told me he quit his meds because they didnt work and made him feel worse. I have found out now that he has been drinking but i dont know for how long. He said hes started his medicine again a couple weeks ago, and he has told me hes drank a couple times while on it. 

Ive been hounding him about scheduling therapy and he just brushes me off and says goofy stuff back like he doesnt care. He complains about depressive symptoms and his medicine not working but wont take his meds and wont seek therapy. ",1710373649.0,False,2,2,MonkeyKing501,None,1be6t93,https://www.reddit.com/r/mentalhealth/comments/1be6t93/friend_wont_take_medicine_or_schedule_therapy/
12,Holistic Medicine for Agoraphobia/Panic Disorder?,Does anyone know any studies or experience in taking holistic supplements for panic disorder/agoraphobia? I've been struggling with both for a while now and I'm exploring all my options available and a friend I know said it (ashwagandha) helped with their anxiety and i asked my psychiatrist's opinion and he said if I were to try anything he suggested inositol. I just would like to know from people who have severe agoraphobia/panic disorder's opinions.,1704273079.0,False,1,1,ItIsTomE_,None,18xf5qc,https://www.reddit.com/r/mentalhealth/comments/18xf5qc/holistic_medicine_for_agoraphobiapanic_disorder/
13,The Promise and Perils of AI in medicine,"The idea of artificial intelligence has existed since 1955, when a few researchers first suggested looking into ""the simulation of human intelligence processes by machines.""  
  
While the promises are immense, there are also perils that demand our attention. Let's delve into the world of AI in medicine to understand both aspects.  
  
Promises of AI in Medicine:  
  
1. Enhanced Diagnostics:  
  
AI algorithms excel at analyzing vast amounts of medical data, aiding in quicker and more accurate diagnostics. This can lead to the early detection of diseases and improved treatment outcomes.  
  
2. Personalized Treatment Plans:  
  
By considering individual patient data, AI enables the creation of personalized treatment plans. This tailored approach can optimize the effectiveness of treatments while minimizing side effects.  
  
3. Streamlined Administrative Tasks:  
  
AI streamlines administrative processes, reducing the burden on healthcare professionals. This allows them to focus more on patient care, ultimately improving overall healthcare delivery.  
Perils of AI in Medicine:  
  
1. Data Privacy Concerns:  
  
The use of AI involves handling sensitive patient data. Striking a balance between utilizing this data for medical advancements and protecting patient privacy is a critical challenge.  
  
2. Bias in Algorithms:  
  
AI systems may inadvertently perpetuate biases present in the data they are trained on. This could result in unequal healthcare outcomes for different demographic groups, emphasizing the need for ongoing scrutiny and improvement.  
  
3. Dependence on Technology:  
  
Overreliance on AI can potentially lead to reduced clinical skills among healthcare professionals. Striking the right balance between human expertise and technological assistance is crucial.  
  
Conclusion:  
  
As we navigate the integration of AI into medicine, it's essential to remain vigilant about both the promises and the perils. Harnessing the potential of AI while addressing its challenges will pave the way for a healthcare landscape that is not only technologically advanced but also ethically sound and patient-centered.  
",1706797932.0,False,1,1,drdanielmckennitt,None,1agcced,https://www.reddit.com/r/mentalhealth/comments/1agcced/the_promise_and_perils_of_ai_in_medicine/
14,Was this medicine or something more?,"I’ve been dealing with low libido for months. Zero pleasure during sex. Maybe it’s due to my antidepressant? I was talking to my new therapist and she said it might be because of my past trauma. This hit me like a truck. Has trauma caused trouble in your sex life?

Edit: I am married and I’m happy with them. Please don’t suggest I am not in love.",1701890721.0,False,2,0,Asian_Bae,None,18cbvs1,https://www.reddit.com/r/mentalhealth/comments/18cbvs1/was_this_medicine_or_something_more/
15,Concierge medicine,"Anyone else think this concept is fucked up? I’ve been trying to find a PCP but it seems like it’s taken over where I live. How messed up is it to charge people literally thousands of dollars just so they can continue seeing their doctor? And it’s not covered by insurance? Even for the trade-off of having your doctor available “24/7” (which is literally impossible, doctors are people who need time off too), it doesn’t seem worth it. What better way to exclude poor people from getting proper healthcare, right?

I have such bad anxiety now that my doctors will switch over to concierge medicine like my family’s doctor, whom we’d been going to for years, has. Now I can’t see her without paying over 2k a year for a membership.

Whenever I look up concierge medicine, it’s all articles and comments praising it. Am I alone in thinking it’s messed up? The only benefit I see is that wealthy people get access to resources that poorer people don’t (what else is new), and doctors make more money. What the hell?",1687194087.0,False,1,1,koalathebean,None,14dk5p2,https://www.reddit.com/r/mentalhealth/comments/14dk5p2/concierge_medicine/
16,Burning and itching brain from medicine harm is making me crazy,Has anyone with mental health issues had burning and itching brain? What is the cause of this hell? ,1712602616.0,False,0,0,Special_Cranberry_42,None,1bz61tc,https://www.reddit.com/r/mentalhealth/comments/1bz61tc/burning_and_itching_brain_from_medicine_harm_is/
17,"Friend has major chronic pain and is feeling suicidal, no medicine is working.","As the title says my friend has major chronic pain as a complication of surgery. I think i just wanna get this off my chest. dont wanna give details as he could be on here, but essentially the dr’s arent believing him at all and medicine is providing no relief. He has already struggled with mental health over the years but now with this, im fearing the worst. The worst part is i couldnt blame him if he did as what hes going through appears to be unimaginable agony and ik hes the kinda guy to talk down his suffering. he recently lost consciousness due to the pain and was admitted to the er and nothing they gave him helped nor did they believe him. The system is failing him and hes been dealing with this for months and its only gotten worse over time, so likely to get worse than what it already is. Idk i dont think theres really any advice anyone could give me but im just terrified of the worst and i cant imagine him being gone cause of some stupid bad luck bullshit like a surgical complication that only 1 in thousands get and normally recover from…",1715533833.0,False,1,0,OnyxCobra17,None,1cqcobz,https://www.reddit.com/r/mentalhealth/comments/1cqcobz/friend_has_major_chronic_pain_and_is_feeling/
18,"How to cope with exhaustion, depression and loneliness without medicine?","I'm not stupid, just have really difficult situation. Let me explain. 

I have depression from 2018 and diagnosed in this spring. This is really ruined my life, because I hadn't even chance on support from somebody. I had bad childhood, my needs were not being met. All my hell life I do that other need from me (go to school, help with household tasks, go to work) and in free time I just consume games, films, youtube, networks and often obsessive daydream about sweet future. Last year I had hard phase caused difficult situation in my country (hello from Ukraine) and family (war made me live with them). Now I found work and this is good, but I feel so exhaustion. And earlier I felt exhaustion, when I do nothing or live in better situation on some period. Now I even don't play games or watch something, I have 8 hours work day: before work I lay and try to distract in internet, 4 hours work, lunch and listen music, 4 hours work, listen music. I can't even cook for myself anything. Yes, take medicine in all will be good. I took and my life pattern doesn't change and now I have health problem cause allergic reaction caused by AD and this is even don't start on beginning, after 3 weeks. I really need strong support for changing my life. I feel that my lifestyle ruin me more than my brain hormonal disbalance, but I can't change it myself.   


I must to notice, right now I HAVEN'T friends, supporter, HAVEN'T way to find somebody in IRL or internet, CAN'T do it with my family (because they dumb and ruined my dumb life), plus I HAVEN'T money on therapy or way to take free.   


Only what I want it do something that I like and want. How you cope with exhaustion? Rest doesn't help because I burn out by inactivity. I had coping mechanism, when talk with my friend everyday, but it was bad. I was productive, but when I  lost communication I lost all my productivity. I just can't fore myself to do my own preferences.   
Now I have daily schedule, but this is minimum task that I must to do to keep alive, I can't add something more to this, because I feel pain of powerlessness, can't handle and can't do it.   


Honestly maybe I really stupid dumb, because this is like ""how to get home without money, friend and even haven't hands, guys?""  


I feel so much pain, exhaustion and lonely, but all that I do just make everything worse. ",1693599931.0,False,2,16,userhidnickname,None,167i1qk,https://www.reddit.com/r/mentalhealth/comments/167i1qk/how_to_cope_with_exhaustion_depression_and/
19,Starting New Medicine Need Advice😭,"So this is my first ever post here so i don’t really know what i’m doing but i’m making this post because i need some advice about this new medication i’m taking. i’ve struggled with anxiety and depression for years now and just recently was prescribed a medication to help with it (fluoxetine) i took it at night on a friday and fell asleep feeling normal but the next day i felt very anxious and like my breathing was almost shallow. keep in mind i have that phobia or wtv it’s called where any little thing that’s wrong with me like if i get heartburn or something i think i’m gonna have a heart attack. so the breathing thing freaked me out and i ended up having a pretty bad panic attack which i’ve been able to control usually but this time i couldn’t. overall i was just very anxious that entire day so i decided not to take the medication again that night and to wait a bit to try it again. fast forward a day and i’ve felt very depressed and shallow this entire day, a feeling i haven’t felt this severe in a while, i feel almost as if something is missing and i’ve also had bad anxiety through the day. i want to know or get some opinions is this because of the medicine and maybe a drop in seratonin since i took the medication two days ago or could it be something else?? please help me out and lmk if anyone who’s taken/is taking the medication has had a similar experience.",1693788005.0,False,1,0,AlxaChv,None,169ddag,https://www.reddit.com/r/mentalhealth/comments/169ddag/starting_new_medicine_need_advice/
20,Sleep medicine doctor,"Hi, I am a guy had several mental health issues. Most of them don't exists now but i am just stuggling with sleep. My sleep quality is poor. I manage to sleep only for 2-3 hours per day not even continuously. 
I have been to psychiatrist and they suggested me some medicines but it didn't help me the way that it should.. 
Is it wise to take consultation with doctors specialises in sleep medicines? 
Any help will be appreaciated, if anyone has taken consultation on the same. 
Thanks.",1686697363.0,False,1,0,MentalRule7807,None,148s6uv,https://www.reddit.com/r/mentalhealth/comments/148s6uv/sleep_medicine_doctor/
21,"ADHD medicine has profoundly benefitted my life, but it has been taken illicitly.","I'll try to make this short. I got into a rather prestigious university after HS (largely from my SAT scores), but struggled with studying and adapting to university life. I couldn't focus, and forcing my brain to read dozens of textbook pages was pure torture and my retention of the info was poor. I made it a year and a half before having to drop out. I felt like I had lost hope of ever accomplishing anything. I couldn't keep my room clean, couldn't force myself to do the tasks I needed to do and allowed my self pity and wallowing to lead me to some drug use here and there that ended up on my medical records.  
After years of introspection, reading PubMed articles, taking tests online, and eventually reading the DSM IV (I can focus on things that interest me) to try and pinpoint my issues I came to the understanding that I likely have high functioning Autism (Aspergers) and ADHD. Both of these disorders are present in my family, untreated however. I have been clean from any ""recreational"" drug use for several years, but not having insurance, and having a tainted record I felt like any substantive treatment for ADHD would never be possible (knowing the research shows how ineffective the alternatives to stimulants are). So I bought some Adderall (confirmed to be real and not street product) to see if it could improve my life.  
And oh my goodness did it. I got promoted at my lowly job, I got organized, fixed my credit score, started saving money, and eventually started taking online classes and got a 4.0 GPA. Got accepted back into university, and now I'm consistently getting the top test grades for several of my very difficult and challenging statistics and high-level accounting classes. I've never abused the medication. Never. Take a consistent 30mg 4-5 times weekly. I now feel like I can make something of my life, and maybe get into law school. It makes me want to cry realizing how easier things would've been for me had my parents not been the type to say ""medicating kids for ADHD is for lazy parents..."" I have something to lose now too though, and don't want to buy this from a sketchy dealer anymore. In fact, I refuse to. But at the same time I don't want to revert back into the mess of my old life. I'm thinking of visiting a psychiatrist, but feel like they will judge me. I'm also afraid that my troubled past will lead them to not trust me and think I'm just a junkie trying to get high. I don't think I'll ever realize my dreams untreated, but treatment feels so unattainable. It's soul crushing. If I do go to a psychiatrist and get tested I will be 100% truthful, I don't want to delude myself or taint my results. But I feel rather strongly that I have this condition. I'm open to suggestions and honest feedback? Would appreciate any and all insight (even if you just think I'm a lazy loser seeking drugs).",1712679013.0,False,1,0,MotorAcrobatic1070,None,1bzw04t,https://www.reddit.com/r/mentalhealth/comments/1bzw04t/adhd_medicine_has_profoundly_benefitted_my_life/
