,Comment,Author,Post
0,ERP or CBT,south19u,1c38uyb
0,There's nothing demonic or dark about it. It's just tapping into trauma and unleashing your feelings.,stunninghotwife,14j4nfd
0,"This is the first time I have seen someone so accurately describe my situation. 

(May be trigger warnings in the 1st 2 paragraphs)

For me, it got to the point that my somatic OCD tries to sabotage every positive experience there is. For example, when I’m watching a show that I love and a really good part is about to come on, my mind shatters all attention off the screen and focuses on wanting me to re arrange something in the desk that might not be perfectly in place, so I lose a lot of the authentic enjoyment from the scene/show sometimes. Even when I completely ignore it and let the thought pass, it still puts my mind in a state of unease where I can’t focus/enjoy the show for those moments

It even started affecting my speech now which I never thought would happen. Now when I’m trying to articulate something properly in a conversion,  my mind gets scared by the thought of messing up my words and I lose my train of thought mid convo which makes me sound inarticulate. The scariest realisation to me was that ocd can actually mess up my performance especially when it matters (because that’s when you care the most so it’s a feeding ground for OCD) which makes it much harder to accept. But I learned I’ll have to accept and be ok with performance dips to truly overcome it.

In terms of the focus, I had the same situation, and I was just accepting of the fact that I may not be able to read or absorb text as fast as I’d like because of ocd interference and was fully ok with that. Now it rarely shows up

I believe the only way to deal with this is to accept anything and everything it throws, no matter how difficult, and be ok with living like that for the rest of your life

Feel free to ask anything about this",kingmystic17,15dtdds
1,"Hey I’m just seeing this, thanks so much for the reply! Im glad we can relate, it’s very grounding, and I’m very happy to announce that I’m doing MUCH better since I made this post, but my ocd has moved onto something else😅 recently hit a new low where ocd has made me unable to enjoy any of my hobbies whihc has threw me into a very deep depressive mood, but I’m getting better there too. I can’t believe how creative ocd can be. So I’m still in a pretty crappy place just not nearly as bad. I’ve been sticking with erp! Like you said, you just have to let it happen, accept this “new life”. 
Also, everything you described here I experience just in a different way. Ocd fears about being unable to enjoy things, and having difficulty articulating speech and thought process while trying to talk with people. It feels so tragic. But you know what…apart of me is almost thankful for this excruciating experience, because the reality is that we have a disorder. Obsessive compulsive disorder. This disorder is going to be with us for the rest of our lives, and saying or thinking things like “I wish things could be the way they were before” loses its meaning once you realize that ocd can show you the most dreadful horrid fears at any given point in your life. So I’m glad it’s showing me now, because I feel so much better equipped to deal with whatever it may show me in the future. I mean it really struck me down this past month, debilitated me, got me to a place that I could never imagine getting better in on my own. But dammit I’m doing it! It’s not perfect and regression is to be expected, but I’ve come a long way. I hope this is encouraging 😅.",ahuman996,15dtdds
0,Have you found any resources? I recently got diagnosed with somatic symptom disorder and info on the internet is all over the map I talked to my therapist and they don't really agree with the diagnosis I just have not found any good resources on the net,Albuquerque505NM,1b2q9k1
0,"Thank you for for sharing. A reminder: if you are seeking resources in your local area, please provide that in the post so that users can share appropriate links and phone numbers. *If you are in distress, please call 9-1-1* or your local emergency number. *You are not alone. Help is available.* If you are having suicidal thoughts, please [click here for a list of crisis support services.](http://www.suicide.org/international-suicide-hotlines.html), If you are seeking therapy online, please [click here for a list of counselling services.](https://thelifelinecanada.ca/pattern-interrupt/ecounselling/) *If you feel well enough to do so, please do your part to enrich this community.* Now that you have posted, please leave a constructive, helpful comment on someone else's post. Filter by new to find posts with zero comments. Together, we make this community great. Thank you for being here. 


*I am a bot, and this action was performed automatically. Please [contact the moderators of this subreddit](/message/compose/?to=/r/mentalhealth) if you have any questions or concerns.*",AutoModerator,zkn0wb
0,🙋‍♀️ Me. Feel free to pm me. I’ve been struggling with this on and off for 3 years,limabeans2345,yh1oq6
0,"Thank you for for sharing. A reminder: if you are seeking resources in your local area, please provide that in the post so that users can share appropriate links and phone numbers. *If you are in distress, please call 9-1-1* or your local emergency number. *You are not alone. Help is available.* If you are having suicidal thoughts, please [click here for a list of crisis support services.](http://www.suicide.org/international-suicide-hotlines.html), If you are seeking therapy online, please [click here for a list of counselling services.](https://thelifelinecanada.ca/pattern-interrupt/ecounselling/) *If you feel well enough to do so, please do your part to enrich this community.* Now that you have posted, please leave a constructive, helpful comment on someone else's post. Filter by new to find posts with zero comments. Together, we make this community great. Thank you for being here. 


*I am a bot, and this action was performed automatically. Please [contact the moderators of this subreddit](/message/compose/?to=/r/mentalhealth) if you have any questions or concerns.*",AutoModerator,uadnec
1,"The technical name would be 'somatic hallucinations', which is likely related to psychosis: [https://www.mind.org.uk/information-support/types-of-mental-health-problems/psychosis/types-of-psychosis/](https://www.mind.org.uk/information-support/types-of-mental-health-problems/psychosis/types-of-psychosis/)

You could also repost to /r/psychosis for more advice and support.",Sbeast,uadnec
0,"Thank you for for sharing. A reminder: if you are seeking resources in your local area, please provide that in the post so that users can share appropriate links and phone numbers. *If you are in distress, please call 9-1-1* or your local emergency number. *You are not alone. Help is available.* If you are having suicidal thoughts, please [click here for a list of crisis support services.](http://www.suicide.org/international-suicide-hotlines.html), If you are seeking therapy online, please [click here for a list of counselling services.](https://thelifelinecanada.ca/pattern-interrupt/ecounselling/) *If you feel well enough to do so, please do your part to enrich this community.* Now that you have posted, please leave a constructive, helpful comment on someone else's post. Filter by new to find posts with zero comments. Together, we make this community great. Thank you for being here. 


*I am a bot, and this action was performed automatically. Please [contact the moderators of this subreddit](/message/compose/?to=/r/mentalhealth) if you have any questions or concerns.*",AutoModerator,wh95oo
0,"Thank you for for sharing. A reminder: if you are seeking resources in your local area, please provide that in the post so that users can share appropriate links and phone numbers. *If you are in distress, please call 9-1-1* or your local emergency number. *You are not alone. Help is available.* If you are having suicidal thoughts, please [click here for a list of crisis support services.](http://www.suicide.org/international-suicide-hotlines.html), If you are seeking therapy online, please [click here for a list of counselling services.](https://thelifelinecanada.ca/pattern-interrupt/ecounselling/) *If you feel well enough to do so, please do your part to enrich this community.* Now that you have posted, please leave a constructive, helpful comment on someone else's post. Filter by new to find posts with zero comments. Together, we make this community great. Thank you for being here. 


*I am a bot, and this action was performed automatically. Please [contact the moderators of this subreddit](/message/compose/?to=/r/mentalhealth) if you have any questions or concerns.*",AutoModerator,yz5asg
1,[deleted],,yz5asg
2,"Somatic symptom disorder can happen even with real problem. It basically mean your symptoms stress you out, etc.",BachelorPOP,yz5asg
3,I only went to the urgent care around three weeks ago and the pcp on Wednesday. And I had never seen either of them before.,Oopsitsgale927,yz5asg
4,"I thought somatic symptom disorder was a mental health issue like stress or anxiety causing physical health problems, not the other way around. Otherwise, everyone with cancer would have somatic symptom disorder and it wouldn’t be cause for dismissal of my issues. 

I don’t understand how being upset from being in physical pain is a disorder. I CAN understand how being in physical pain from being upset is a disorder.",Oopsitsgale927,yz5asg
5,But I am trying to be self-aware and not flat out deny that it’s psychosomatic. I don’t think that’s what’s wrong but I am not in a position to argue.,Oopsitsgale927,yz5asg
6,"“What are the symptoms of somatic symptom disorder?
Somatic symptom disorder is characterized by an extreme focus on physical symptoms — such as pain or fatigue — that causes major emotional distress and problems functioning. You may or may not have another diagnosed medical condition associated with these symptoms, but your reaction to the symptoms is not normal.”

https://www.mayoclinic.org/diseases-conditions/somatic-symptom-disorder/symptoms-causes/syc-20377776",BachelorPOP,yz5asg
7,"“What is a somatic syndrome?
Somatic symptom disorder (SSD) occurs when a person feels extreme, exaggerated anxiety about physical symptoms. The person has such intense thoughts, feelings, and behaviors related to the symptoms, that they feel they cannot do some of the activities of daily life.”

https://medlineplus.gov/ency/article/000955.htm#start",BachelorPOP,yz5asg
8,I’m have Somatic Symptom Disorder because my symptoms stress me the fuck out,BachelorPOP,yz5asg
9,I still don’t understand how being distressed and unable to function from a real health problem is a mental health disorder and is cause for dismissal of my symptoms.,Oopsitsgale927,yz5asg
10,Same.,thepoppaparazzi,yz5asg
11,"I think because Somatic Symptom Disorder (SSD) is a new name and supposed to be a new way of seeing a condition with problematic history “hypochondria”. Most up-to-date information on these conditions is “hypochondria” was misnamed and mistreated. We have a new name but some professionals are still mistreating the condition and people who have it. Let me see if I can find a link to the DSM5 about SSD, that might help.",BachelorPOP,yz5asg
12,I’m not sure if this helps you understand better: https://www.psychiatry.org/patients-families/somatic-symptom-disorder/what-is-somatic-symptom-disorder,BachelorPOP,yz5asg
13,Symptoms start around 30… I’m 27 and it’s all been happening in the last 4 months. I’m a little early 😭😭,Licilynn12,yz5asg
0,"Thank you for for sharing. A reminder: if you are seeking resources in your local area, please provide that in the post so that users can share appropriate links and phone numbers. *If you are in distress, please call 9-1-1* or your local emergency number. *You are not alone. Help is available.* If you are having suicidal thoughts, please [click here for a list of crisis support services.](http://www.suicide.org/international-suicide-hotlines.html), If you are seeking therapy online, please [click here for a list of counselling services.](https://thelifelinecanada.ca/pattern-interrupt/ecounselling/) *If you feel well enough to do so, please do your part to enrich this community.* Now that you have posted, please leave a constructive, helpful comment on someone else's post. Filter by new to find posts with zero comments. Together, we make this community great. Thank you for being here. 


*I am a bot, and this action was performed automatically. Please [contact the moderators of this subreddit](/message/compose/?to=/r/mentalhealth) if you have any questions or concerns.*",AutoModerator,ohw7rx
1,"I don’t think this is what happens in somatic therapy. But I do go to boxing classes, and it’s great for my anxiety. Gets a lot of frustration out when punching the bag. Can you go to a local boxing gym?",,ohw7rx
2,"From wikipedia:

> Somatic experiencing is a form of alternative therapy ...

and

> Two randomized controlled studies of Somatic Experiencing as a treatment for PTSD were published in 2017 . They showed positive results indicating Somatic Experiencing may be an effective therapy method for PTSD and concluded that further research is needed to understand who shall benefit most from this treatment modality.

So, I'd say *maybe*, there are other mainstream therapy methods.",,ohw7rx
0,"Yes, what are you specifically curious about?",billy_the_kid16,bihdvd
1,I would go to your pcp and explain your symptoms and I’m sure he would decide it to be true. I’ve had it for a while and it affects my day to day life. I had a seizure and live everyday petrified I’m going to have another one.,billy_the_kid16,bihdvd
2,"How where you diagnosed? I’ve been fighting with it for the past few years and now I feel I can no longer deal with it myself.  

If I were to go to my PCP would he send me to someone else?",Roastin_N_AZ,bihdvd
3,"I’ve never had any serious medical issues, but I always feel as if I’m going to get cancer or whenever my body feels different I just think of the worst shit possible.",Roastin_N_AZ,bihdvd
4,"Yea I hear you. I think you could definitely benefit from an anti anxiety, or anti depressant. It helps me a TON",billy_the_kid16,bihdvd
5,What were you proscribed?,Roastin_N_AZ,bihdvd
6,"Lexapro for daily use, and colonzepams as needed. So an antidepressant that worked for me (also treats anxiety and other orders not just depression) and a sedative that dulls the panic attacks.",billy_the_kid16,bihdvd
0,"Thank you for for sharing. A reminder: if you are seeking resources in your local area, please provide that in the post so that users can share appropriate links and phone numbers. *If you are in distress, please call 9-1-1* or your local emergency number. *You are not alone. Help is available.* If you are having suicidal thoughts, please [click here for a list of crisis support services.](http://www.suicide.org/international-suicide-hotlines.html), If you are seeking therapy online, please [click here for a list of counselling services.](https://thelifelinecanada.ca/pattern-interrupt/ecounselling/) *If you feel well enough to do so, please do your part to enrich this community.* Now that you have posted, please leave a constructive, helpful comment on someone else's post. Filter by new to find posts with zero comments. Together, we make this community great. Thank you for being here. 


*I am a bot, and this action was performed automatically. Please [contact the moderators of this subreddit](/message/compose/?to=/r/mentalhealth) if you have any questions or concerns.*",AutoModerator,vsogez
1,"I’m currently facing this issue… constant googling of symptoms and thinking that I have this illness that illness.. giving me a toll in mind and physically.. I’m so hypersensitive now towards lights and sounds and always feeling very tensed up.. and constantly feel unwell eg dizzy, headache,back pain, chest pain neck/shoulder pain, and feeling like out of balance like I would fall when standing still..  and appointment with a psychiatrist is hard to get. See GP to get a referral in July and they schedule me appt on Oct… only manage to bring forward the appt to sept thru calling.. feel like I’m in a disaster.. I just want to be happy and be my normal self again … I need to stop myself from googling and Reddit but I can’t seems to stop myself..",Pretend-Doughnut-910,vsogez
2,"Yes, anxiety and stress can cause pseudo symptoms. Sucks you went through that though",SP4CEP00DLE,vsogez
3,"Yes 

I had this happen to me when I was younger because of someone close to me died of cancer. 

The anxiety has never went but it took a long time for the Somatic Symptoms to disappear and the constant checking things and rabbit holes. 

Thing is though nobody listens when they are in that state so trying to convince them is almost pointless. 

Even the bloods the scans ect didn't completely convince me they just gave temp relief.",,vsogez
4,"As someone who goes through this for 2 years, I am still asking myself this question: Is it better to reddit and google symptoms and getting to know the basics of the illnesses or is it healthier to just drop it and never-ever research the condition?",,vsogez
0,The Somatic Nervous System is built up of various nerve systems that correlate mostly to skeletal muscles and skin. It allows for reflexes and contractions. If someone has a disorder that affects this system then that’s indeed what it would be called. There is a psychiatrist disorder that also uses the word Somatic which goes by Somatization disorder. This involves an unnaturally severe effect from a physical ailment or a perceived physical ailment. Doctors are unable to substantiate all of the symptoms and the patient will usually go years with the same set of complaints. Given many people have chronic pain it is hard to differentiate between what the individual is perceiving and the realty. It’s verified once everything checks out as clear or there is an underlining issue but it can’t be causing all of the issues the patient states. There will also be a history of them experiencing said issue or set of issues for years with no further substantiative evidence of their claims. The Disorder is treated by a psychiatrist while an issue with the somatic system is treated by the respected specialist. This is highly oversimplified but I don’t have a lot of time to elaborate right now. ,,8n1i2m
0,"It sounds like he needs to be admitted, honestly. I'm sorry to say, but I worked with psych clients. Attempting and threatening suicide is no joke, whether he is doing it for attention or results. I don't think you would be betraying him by having him admitted. Just support him while he is there.",mikaa_jo,cmqfli
1,You should admit him. You can’t argue with psychosis remember that.,madara_rider,cmqfli
2,"I’ve also been hesitant to get him admitted because sometimes he will have a week or even more where everything seems ok. During that time I then forget how bad it was and think I was over reacting. 

Also I have no idea of how to get him admitted involuntarily. 

But I think deep down I know I have to do it. 
I just feel so helpless and lost and scared.",SmallBear91,cmqfli
3,"I really feel your pain. But exactly, he may have a good week, but that does not mean everything is okay and will go back to normal. And usually when my clients were suicidal we called the police and they were admitted involuntarily. Either that or call a crisis hotline when he isn't around and see what they say. I, by no means am an expert. But that is what I would do.",mikaa_jo,cmqfli
0,"Thank you for for sharing. A reminder: if you are seeking resources in your local area, please provide that in the post so that users can share appropriate links and phone numbers. *If you are in distress, please call 9-1-1* or your local emergency number. *You are not alone. Help is available.* If you are having suicidal thoughts, please [click here for a list of crisis support services.](http://www.suicide.org/international-suicide-hotlines.html), If you are seeking therapy online, please [click here for a list of counselling services.](https://thelifelinecanada.ca/pattern-interrupt/ecounselling/) *If you feel well enough to do so, please do your part to enrich this community.* Now that you have posted, please leave a constructive, helpful comment on someone else's post. Filter by new to find posts with zero comments. Together, we make this community great. Thank you for being here. 


*I am a bot, and this action was performed automatically. Please [contact the moderators of this subreddit](/message/compose/?to=/r/mentalhealth) if you have any questions or concerns.*",AutoModerator,ycdod3
0,"Hi Sean! I just wanted to let you know you are not alone! My husband also has illness anxiety disorder with somatic symptoms and CBT therapy has been helping him get though it. Like you, he also feels like he constantly has cancer and that something is slowly killing him regardless of his great health. He has pains, sores that support his worry but it is his anxiety alone that creates the somatic symptoms. It is possible anti anxiety therapy and medication could help you cope and perhaps stop feeling pain! Best of luck to you",Sugarspellitoutt,9b4z40
0,Are you seeing a therapist? They should be able to give you a treatment plan of how you're going to improve and manage it. ,laurenshapiro,23cxgy
1,I scheduled to see one but it's its a few months away since I'm a new patient. ,youtbuddcody,23cxgy
2,Where did you schedule that they can't see you right away? I've never heard of such a long wait list.,laurenshapiro,23cxgy
3,"Its my insurance. I called other places, but they're out a little further. It's only because i'm a new patient according to them. ",youtbuddcody,23cxgy
4,That's so strange. I've never heard that before. Are their local mental health agencies that would be willing to take you on as a client despite having insurance?,laurenshapiro,23cxgy
5,"Well, I didn't ask. I don't have much money so I'd rather go through insurance. My MD told me (when talking about this) that mental illness isn't viewed as urgent as physical illness. ",youtbuddcody,23cxgy
6,"Going through a community mental health center would be work on your part, not something you'd ask your MD. Also, that's an assholish thing to say.",laurenshapiro,23cxgy
0,My experience was very good compared to others. I think it depends on the other people like patients in there majority but the nurses can be a little extra sometimes. If you need it you really need to focus on yourself fr it’s usually worth it even if it feels bad during or after,Dragonfly_TAP,1c602al
1,"Most of my experiences were negative in the moment, but positive overall. The main purpose of inpatient is actually just stabilisation—at least, that's what it's like here. They focus on getting you to a point where you are no longer a danger to yourself and/or others. They may also emphasise long-term care, but making you feel better *enough* is what they aim for, not making you feel *good.*

I can't guarantee that you will feel better after discharge. It is true that many people have felt worse after discharge, and I was also abused during my stays. 

But I think what you can bank on is the patients being more caring than you'd expect. Yes, there can be a lot of violence, particularly if you are in a male ward. Female wards tend to be calmer, but it's still not uncommon for there to be fights. Mixed sex wards seem to be the most stable, in my opinion. Also, sometimes they separate people who are more likely to be aggressive into a separate unit. I have experience with all types because I am transgender and psychotic (most hospitals I went to grouped psychotic patients with aggressive patients), and regardless of where I was, I've always got support from the other patients. The staff may not care if you're in a crisis (although there are definitely some that do), but the patients almost certainly will. 

There was someone who had a service dog who coincidentally was trained for a condition I had, and she let her comfort and try to pull me out of the attack. Another time, I was having a psychotic episode, and a patient stayed up all night to talk to me, even though later she said she had no idea what I was saying. 

As for good staff stories, I had a nurse comfort me while I was catatonic before she administered my medicine. Another time, a tech stayed with me for literal hours just comforting me while I was having a flashback. 

There is one hospital I went to that was a 100% good experience. This was the hospital that I had the flashback in and the tech comforted me. Not only did they allow you to go out of your room at any time, they had a 24/7 snack bar and didn't even have fences when we went outside. When my family visited, I had an anxiety attack and they escorted me back to the unit, comforting me and reassuring me that I wasn't obligated to see them and I was not inconveniencing them. The group therapy was also very good, and the unit was kept clean. 

So, yes, it's very common that inpatient is a terrible experience, but it's not unheard of that it could be a good one as well, or at the very least, useful. 

I'm sorry to hear you have to go and I understand it is scary. I hate going inpatient every time, and I have been inpatient more times than I can remember. I can't make any promises to you, but I hope you get the help and support you need.

Edit: Spelling.",TheJackdaws,1c602al
