,Comment,Author,Post
0,"Thank you for for sharing. A reminder: if you are seeking resources in your local area, please provide that in the post so that users can share appropriate links and phone numbers. *If you are in distress, please call 9-1-1* or your local emergency number. *You are not alone. Help is available.* If you are having suicidal thoughts, please [click here for a list of crisis support services.](http://www.suicide.org/international-suicide-hotlines.html), If you are seeking therapy online, please [click here for a list of counselling services.](https://thelifelinecanada.ca/pattern-interrupt/ecounselling/) *If you feel well enough to do so, please do your part to enrich this community.* Now that you have posted, please leave a constructive, helpful comment on someone else's post. Filter by new to find posts with zero comments. Together, we make this community great. Thank you for being here. 


*I am a bot, and this action was performed automatically. Please [contact the moderators of this subreddit](/message/compose/?to=/r/mentalhealth) if you have any questions or concerns.*",AutoModerator,t6st4y
0,"Having had cancer in mid 20s, anytime my body feels off or a lump appears my automatic first thought is cancer and I’m dying. Talking with a therapist helps just having a space to validate said feelings and then challenging them. I wish deeply my automatic thought process didn’t work that way it’s exhausting.

Covid was a different story for me, never got vaccinated, finally got it and I’ve had a flu that was worse. However when it first happened I was terrified and the media didn’t help. It also sounds like you’ve had Covid and you survived. Stop listening to the anxiety inducing news and trust in your immune system, the body is an amazing machine and humans have been surviving for 10,000+ years.",prime777time,1cwx8rk
1,"I think I lived inside a void of anxiety all of 2020 because of COVID, so I sympathize. I too had a triggering time period before COVID where everyone in my family took turns getting really sick. When COVID happened I was \*not ready\* to deal with it.

Anyways, I thought I'd share this technique I have for dealing with triggers. It's a journal entry where I go through questions that help me process the event.

Here are the prompts:

- Date

- What happened? (stick to objective facts here)

- How did you feel? (emotionally, physically)

- What did you think? (you can write about assumptions you had about other people or judgements)

- What did you do? (describe any confrontation or lack of)

- What was your fantasy? (write about your ideal confrontation, including how the other people would respond)

- What was the trigger? (try to distill it down to a sentence)

- What are your thoughts on the trigger?

- What is the earliest memory (in childhood) of this trigger upsetting you?

You could add another one, like ""If you could travel back in time to your younger self, what would you say or do to protect yourself or help you manage the traumatic event?""

I think a visualization exercise could help here too. The key is to really sit with your feelings in order to move through them. An exercise I try sometimes when I deal with anxiety or fear in particular is telling myself ""it's okay if \_\_\_\_\_\_\_\_ happens."" Of course it's clearly NOT ok, but through the act of repeating it, I force myself through the connected emotions.

If you try any of this, let me know how it goes. Best of luck.",-63-,1cwx8rk
2,"Have you thought about trauma therapy for your first illness? Also do all the things you can to protect your immune system, the vitamins and minerals.  Time in nature to calm and centre. Exercise is good for the body and mind.",hannah_lilly,1cwx8rk
3,"I'm so sorry that happened to you. I can imagine after something so traumatic how evert lump would cause immense anxiety. I'm so glad you're okay. 
And you're completely right. I got covid back in 2021 (on Christmas no less!). It sucked but I got over it. I don't even know why I'm so anxious honestly. It really sucks...I'm vaccinated and survived covid so i really should have some faith in my immune system. Anxiety is the REAL problem here",Anxious-Captain6848,1cwx8rk
4,"Thank you so much for your thoughtful comment. And thank you for taking the time to write such a wonderful detailed description! This is a great resource 
I screenshot this and will be trying it. I really like these pointed questions. Thank you so much! ",Anxious-Captain6848,1cwx8rk
5,"You know, trauma therapy specifically might be beneficial. I'm currently in therapy but it's more general, she's been helping me with my trauma but I do wonder if it would be worth it to find a specialized therapist. I guess I just assumed it's not ""real"" trauma. Idk if that makes sense. Like, other people go through so much worse amd deserve trauma therapy more. 
And thank you for the tips, I've been trying to exercise more and take care if my body. Hopefully it helps. ",Anxious-Captain6848,1cwx8rk
6,"I think of it as my bodies automatic survival response that sometimes gets confused in the modern world. Many years ago that anxiety was how people survived, however now we have healthcare, education, sanitation, etc. yet the body still responds as if the world is extremely dangerous. When I get to this point, I can even laugh to myself and thank my body for trying to protect myself by wrapping my arms around myself saying outloud “I am safe, thank you.”",prime777time,1cwx8rk
7,"There’s a therapy called somatic therapy for trauma held in the body. Sounds like you are holding fear and anxiety in your body from the illness you had. From what I know about somatic is it takes you into your body to feel these fears and release them. Might be worth looking into. The other way is to look into all the ways that can help calm your system, and reassure it. Feel good feelings.",hannah_lilly,1cwx8rk
8,"Aw, I like that. I'll try that. I am probably being too harsh on my body. Especially since I did get a mystery illness at one point. My body is just trying to protect me the only way it knows how. But geez... ",Anxious-Captain6848,1cwx8rk
0,"Hi there, I hope all is well. :))


I tend to focus on muscle relaxation by tensing up my muscles. I usually start from the toe to the head; but it can work vice versa. I start by tensing, but each time I'm doing it: I'm holding it in for 3-4 seconds. Once I'm done, I slowly start to release different muscle groups in my body. It can help ease physical tension associated with the freeze response. ",Eastern-Policy7643,1aoi80h
0,"Family issues can do that. Those who are closest to us have the greatest power to mash our emotional buttons, and can do so in ways that hurt deeply. It may be little comfort, but you have plenty of company with others who have been there, and have grown stronger and wiser in the process.

There is nothing wrong with you, or with needing time to process it all and continue healing. Hurts take time to heal, whether physical or mental. The fact that you are seeing a therapist and getting support from a friend is a great start. A day at a time. It will get better. And if it helps at all, here's a virtual hug from an internet anon. ![gif](emote|free_emotes_pack|hug)",,17chko0
0,"If you can't get therapy for PTSD, I can tell you about self-help for PTSD recommended by therapists, which would be better than nothing -

[https://www.reddit.com/r/mentalhealth/comments/p9374f/im\_terrified\_of\_therapy/h9zp144/?context=3](https://www.reddit.com/r/mentalhealth/comments/p9374f/im_terrified_of_therapy/h9zp144/?context=3)

A Yale medical journal says that the best things for avoiding relapse from addiction are relaxation with traditional Asian methods and cognitive therapy.

The Asian method with the best evidence is slow breathing. Two psychiatrists, Brown and Gerbarg, say a 10 or 20 min slow breathing exercise is good and 20 min in the early morning and at bedtime is a therapy for anxiety. The exercise is inhale and exhale gently, 6 seconds each.

You can learn relaxing tai chi exercise with one or two beginner's videos on YouTube. 

[https://www.youtube.com/watch?v=cEOS2zoyQw4](https://www.youtube.com/watch?v=cEOS2zoyQw4)

This video shows you how easy it is to get started with meditation -

[https://www.youtube.com/watch?v=4d9xFfA6F50&t=88s](https://www.youtube.com/watch?v=4d9xFfA6F50&t=88s)

Cognitive therapy - [SMARTRecovery.org](https://SMARTRecovery.org) is like a brainy version of NA, ex-users who believe in psychology. They have a program based on the most popular counseling methods.

Other experts recommend activities that get your mind involved, like an interesting hobby. I know of a recovering addict who learned to play the guitar.

A friend of mine who belongs to AA says that the key is persistence - never give up, no matter what.",RWPossum,1avy02l
0,"It's possible that it is. Heart pain is the somatization of anxiety. 

Try this [https://www.reddit.com/r/mentalhealth/comments/1c9ukjs/comment/l0nvxva/?utm\\\_source=share&utm\\\_medium=web3x&utm\\\_name=web3xcss&utm\\\_term=1&utm\\\_content=share\\\_button](https://www.reddit.com/r/mentalhealth/comments/1c9ukjs/comment/l0nvxva/?utm\_source=share&utm\_medium=web3x&utm\_name=web3xcss&utm\_term=1&utm\_content=share\_button)",-ZaneTruesdale-,1cb4nys
0,"Thank you for for sharing. A reminder: if you are seeking resources in your local area, please provide that in the post so that users can share appropriate links and phone numbers. *If you are in distress, please call 9-1-1* or your local emergency number. *You are not alone. Help is available.* If you are having suicidal thoughts, please [click here for a list of crisis support services.](http://www.suicide.org/international-suicide-hotlines.html), If you are seeking therapy online, please [click here for a list of counselling services.](https://thelifelinecanada.ca/pattern-interrupt/ecounselling/) *If you feel well enough to do so, please do your part to enrich this community.* Now that you have posted, please leave a constructive, helpful comment on someone else's post. Filter by new to find posts with zero comments. Together, we make this community great. Thank you for being here. 


*I am a bot, and this action was performed automatically. Please [contact the moderators of this subreddit](/message/compose/?to=/r/mentalhealth) if you have any questions or concerns.*",AutoModerator,10pa1p9
0,The description of shutting down and then shaking reminds me of the trauma model in Somatic Experiencing. https://www.youtube.com/watch?v=nmJDkzDMllc,damocles_paw,172boer
0,"Thank you for for sharing. A reminder: if you are seeking resources in your local area, please provide that in the post so that users can share appropriate links and phone numbers. *If you are in distress, please call 9-1-1* or your local emergency number. *You are not alone. Help is available.* If you are having suicidal thoughts, please [click here for a list of crisis support services.](http://www.suicide.org/international-suicide-hotlines.html), If you are seeking therapy online, please [click here for a list of counselling services.](https://thelifelinecanada.ca/pattern-interrupt/ecounselling/) *If you feel well enough to do so, please do your part to enrich this community.* Now that you have posted, please leave a constructive, helpful comment on someone else's post. Filter by new to find posts with zero comments. Together, we make this community great. Thank you for being here. 


*I am a bot, and this action was performed automatically. Please [contact the moderators of this subreddit](/message/compose/?to=/r/mentalhealth) if you have any questions or concerns.*",AutoModerator,ydjute
1,"They absolutely can. My brother is going through hell because of them. It's so bad he can't get up. 

I also took them foe 15 years. Much higher doses than you. I'm still on it. Trying to get off.

Here's my advice. Wean off as slow as possible and give it some time. In meantime get whatever help you can. Benzos are a serious threat for mental and physical health iff taken long and a lot like I have. Your dose is also very high if you are still at 5 mg a day of klonopin converted to diazepam",0Skeptik0,ydjute
0,"Thank you for for sharing. A reminder: if you are seeking resources in your local area, please provide that in the post so that users can share appropriate links and phone numbers. *If you are in distress, please call 9-1-1* or your local emergency number. *You are not alone. Help is available.* If you are having suicidal thoughts, please [click here for a list of crisis support services.](http://www.suicide.org/international-suicide-hotlines.html), If you are seeking therapy online, please [click here for a list of counselling services.](https://thelifelinecanada.ca/pattern-interrupt/ecounselling/) *If you feel well enough to do so, please do your part to enrich this community.* Now that you have posted, please leave a constructive, helpful comment on someone else's post. Filter by new to find posts with zero comments. Together, we make this community great. Thank you for being here. 


*I am a bot, and this action was performed automatically. Please [contact the moderators of this subreddit](/message/compose/?to=/r/mentalhealth) if you have any questions or concerns.*",AutoModerator,yxkeqj
0,Personally I've seen great results from ECT in others and I'd be leaning towards that.,PianistSupersoldier,17xr9aw
1,"I have the same disorder. 
Have you tried Latuda? It has helped me out a ton with a antidepressant. SSRIs have never done any good for me, so I always do atypical antidepressants, Tetra, or SNRIs. If Latuda doesn’t work I have heard of Abilify doing good. I haven’t personally tried this one yet.
Adding Gabapentin can help with anxiety. Propanerolol can help with the physical symptoms of anxiety. 
You could try Esketamine treatment’s? They are new, but I have seen a lot of people say that they really help.",Positive-Coyote9140,17xr9aw
2,"There's a lot of talk about therapy with ketamine. ECT can have impressive results, but, as with medication, the treatment doesn't address whatever caused the depression, so relapse is liable to follow unless the cause is addressed.  

 If you go to Metapsychology, you can read a psychologist's review of Dr Steve Ilardi's book (""a splendid book"").He's the therapist and researcher who headed the Univ of Kansas lifestyle-depression project.",RWPossum,17xr9aw
0,"Honestly therapy wasn't for me either , like people always say it's all gonna solve the issues but for me it really doesn't , I don't see the magic but it's not the same for everyone , for some it does help..


I've been trough a lot of things and truly know how hard it really is for us out there , people don't understand it at all and it makes me upset , it's always seek therapy or do this or that bla bla it quite upsets me that people all say the same things but don't even think about what they're saying.


If you need someone to talk to , I'm here for you if you want! Hope it gets better soon..",,1b0bz45
1,"yes exactly, sometimes it’s a lifelong issue and they don’t get that there isn’t an easy fix.",Odd_Aerie8300,1b0bz45
2,"That's very true , for some it's a hard and long fix but people don't realize that at all.

It's always the same thing ""Go to therapy"" ""Seek help""

If things were that easy I'd have no issues anymore :/",,1b0bz45
0,"Yup. They are called “somatic symptoms”. If you look up somatic symptoms in mental health, there will be a heap of references.",HuckyBuddy,18y4002
1,"You can always go to the doctor if it's possible. It's always good to do a check up just in case. 

But all of these also sound like regular somatic symptoms. 

When I have anxiety attack I will depersonalize and derealize which make me feel dizzy, foggy and tired. I can also get nauseous as well. 

When I get huge panic attack, I will actually feel chest pain for the next few days and even sometimes be sore and feel like I have the flu days after the actual attack (I call them panic flus). Anxiety is rough on your body, especially when you experience acute episode, and it's absolutely normal to feel it physically. 

Do you think about hydrating enough? I know I lose my appetite a lot and eating/drinking/taking care of my basic needs fall off the wagon sharply when I'm in a bad headspace. Dehydration can definitely contribute to headaches, head pressure, tiredness and nausea. 

Drinking really cold or flavored water can also help with your anxiety, because it's super grounding. I like to chew on an ice cube because I have sensitive gums and the slight pain helps me focus.",Selfconscioustheater,18y4002
2,Is it normal to experience these symptoms even on days when I am not feeling overly anxious or depressed about anything?,nathanbgerman,18y4002
3,"It's not because you don't feel emotionally anxious or depressed that you aren't. Somatic symptoms may be a way for your body to express these troubles even though you don't feel anxiety emotionally. 

Picture a bottle of water. For most people who do not have anxiety disorders, or troubles, this bottle is relatively empty. They can bottle it up, give it a good shake, and there's space for it to go. 

More stressors happens, and it fills, but there's still space.

Yours, on the daily, is 100% full. This is when you don't feel anxious or depressed. It's not overflowing, but there's no space either. If you close it up and try to shake it, there's no space for it to go. If this is your baseline, it is entirely normal to feel somatic symptoms. And when something happens that triggers more anxiety or a depressive episodes, you have no space to absorb it. So your bottle overflows and you emotionally feel the hit on top of your somatic symptoms.",Selfconscioustheater,18y4002
0,"I can't say with any certainty what's going on but I can say that when people have a huge amount of anxiety or stress it can absolutely cause 'ticks', depersonalizing, self isolation, and a disconnect from reality. Honestly, it sounds like you may have some PTSD going on that's ramping up your anxiety in certain situations and your body is reacting to that extremely high stress level. Sometimes, the best way to regulate the tics is to stretch and let them out. 
Do some research on stimming. It's typically associated with autism and ADHD but it might be a relevant coping mechanism for you and your anxiety?",throwmeinthepit,1bm63p2
1,could you please explain this part: *the best way to regulate the tics is to stretch and let them out.*,Historical-Meet-6617,1bm63p2
2,"Like, if you notice yourself doing them try to take a step aside for a moment and actually like shake yourself, stretch out your muscles, make some funny noises, ect. Whatever your body is urging you to do, let it out for a moment. And then also take some deep breaths. Anxiety can build up in a way that feels like physical pressure in your body and it helps to give it an outlet for a brief moment.",throwmeinthepit,1bm63p2
3,thanks for clarification.,Historical-Meet-6617,1bm63p2
4,"No problem! For real tho, I recommend research on stimming.",throwmeinthepit,1bm63p2
0,"Thank you for for sharing. A reminder: if you are seeking resources in your local area, please provide that in the post so that users can share appropriate links and phone numbers. *If you are in distress, please call 9-1-1* or your local emergency number. *You are not alone. Help is available.* If you are having suicidal thoughts, please [click here for a list of crisis support services.](http://www.suicide.org/international-suicide-hotlines.html), If you are seeking therapy online, please [click here for a list of counselling services.](https://thelifelinecanada.ca/pattern-interrupt/ecounselling/) *If you feel well enough to do so, please do your part to enrich this community.* Now that you have posted, please leave a constructive, helpful comment on someone else's post. Filter by new to find posts with zero comments. Together, we make this community great. Thank you for being here. 


*I am a bot, and this action was performed automatically. Please [contact the moderators of this subreddit](/message/compose/?to=/r/mentalhealth) if you have any questions or concerns.*",AutoModerator,q9kp7x
1,"I have a question, why do people have panic attacks and why is it so goddamn scary. we know we are not in danger, but we feel that we are. Thank you in advance",GhostBuster1919,q9kp7x
2,How does trauma affect the brain ?,sweetalmondjoy,q9kp7x
3,Do I have to remember my past? How do I face it? Do I need to do this to heal.,Functioningerror,q9kp7x
0,"Thank you for for sharing. A reminder: if you are seeking resources in your local area, please provide that in the post so that users can share appropriate links and phone numbers. *If you are in distress, please call 9-1-1* or your local emergency number. *You are not alone. Help is available.* If you are having suicidal thoughts, please [click here for a list of crisis support services.](http://www.suicide.org/international-suicide-hotlines.html), If you are seeking therapy online, please [click here for a list of counselling services.](https://thelifelinecanada.ca/pattern-interrupt/ecounselling/) *If you feel well enough to do so, please do your part to enrich this community.* Now that you have posted, please leave a constructive, helpful comment on someone else's post. Filter by new to find posts with zero comments. Together, we make this community great. Thank you for being here. 


*I am a bot, and this action was performed automatically. Please [contact the moderators of this subreddit](/message/compose/?to=/r/mentalhealth) if you have any questions or concerns.*",AutoModerator,xtj33a
1,"There's some tips in this post which might help: [How to Handle Panic Attacks](https://www.reddit.com/r/MindOverMatterScott/comments/jzjvj3/how_to_handle_panic_attacks/)

You could also check out this article on dissociation: https://www.mind.org.uk/information-support/types-of-mental-health-problems/dissociation-and-dissociative-disorders/about-dissociation/",Sbeast,xtj33a
0,"Thank you for for sharing. A reminder: if you are seeking resources in your local area, please provide that in the post so that users can share appropriate links and phone numbers. *If you are in distress, please call 9-1-1* or your local emergency number. *You are not alone. Help is available.* If you are having suicidal thoughts, please [click here for a list of crisis support services.](http://www.suicide.org/international-suicide-hotlines.html), If you are seeking therapy online, please [click here for a list of counselling services.](https://thelifelinecanada.ca/pattern-interrupt/ecounselling/) *If you feel well enough to do so, please do your part to enrich this community.* Now that you have posted, please leave a constructive, helpful comment on someone else's post. Filter by new to find posts with zero comments. Together, we make this community great. Thank you for being here. 


*I am a bot, and this action was performed automatically. Please [contact the moderators of this subreddit](/message/compose/?to=/r/mentalhealth) if you have any questions or concerns.*",AutoModerator,ogl0nq
1,"I promise it's all in your head, theres no bugs over you, you are gonna be better🧡",,ogl0nq
2,No bugs there at all! Would a shower maybe help? I’m sorry you’re going through this. I don’t have the hallucinations but I do get paranoid really bad sometimes and I know how awful that can be,andanotherone89,ogl0nq
3,"hey there :) 

trust me, there are no spiders on you at all. don't trust the part of you that is forcing you to think that they are real, ok? 

you're gonna be completely okay, just breathe, do a guided breathing. [https://youtu.be/odADwWzHR24](https://youtu.be/odADwWzHR24) hopefully this helps a little. 

try to get to get some sleep as well, alright? sleep is important for this. 

stay safe, my friend",,ogl0nq
0,"Trauma is difficult to deal with and there's not exactly any one way to deal with it that works for everybody, but the two primary categories for dealing with it are to run from it or to fight it. On the run from it side there's hoping your mind blocks everything and never opens up the can of worms again, trying to remain as relaxed as possible, avoiding any potential triggers, ""faking it til you make it"", helping other people with their problems instead of facing your own, and a bunch of other methods that I can't think of right off the top of my head, but I know they exist. This tends to be the camp that I stay in, but it's also often seen as the ""unhealthy"" way of dealing. On the other side (the fight side) you process your emotions, talk through everything with your therapist, do a bit of research into why you have the stress reactions you do, and replace any negative reactions you have with positive coping mechanisms and attitudes. There's also a bit of room to engage in both styles of dealing with trauma to resolve it, but honestly dealing with problems seems like a lot of effort and I'm significantly less interested in that personally than I am in integrating my issues into myself and using the least healthy methods I can find to deal with my issues, so I don't have much information on how to achieve the second style of dealing with trauma.",SwordoftheRevelation,gk19sw
