,Comment,Author,Post
1,"Hey there. Well if you feel like you want to try out another therapy, then don’t be shy and tell her. But also tell her why and what you expect by doing so. I think she’ll understand and won’t hold any grudge. I’m also very happy that you are looking for ways to get better. I wish you best of luck for your future journey",gogelio,ronhtv
0,"Beautiful description of a terrifying experience. I was about 10 years old when I suddenly found myself sitting awake on my bed, Mom and Dad next to me trying to calm me down. I had had a nightmare, and couldn't quite shake it off yet. And I was still yelling ""wood and water"" over and over. Even though I was already awake, I would focus on the closet doors of my room and could still see them swelling infinitely. Everything was swelling around me, as had happened in my dream. Everything was overboarding itself due to its mere material existence. Over the years I can still remember the sensation, and sometimes think of it as an experience of unconventional dimensions of reality. Thank you for sharing.",paleRedSkin,9di2x3
1,"I have definitely experienced a number of things you are describing since childhood. I would cycle between feeling absolutely huge, actually in my case it was more swollen, and then very thin and twig like. I would also have this sense of weird time where things felt fast and slow and it's disturbing to experience. The sound is the worst, it sounds like all the molecules are screaming at me in some alien like fashion. 

I have these attacks a lot less frequently but the time dilation and the sound still happen more often.  I've never been able to find an explanation for it and people have a hard time grasping what I am talking about when I try to describe it.",pharaohess,9di2x3
2,"Woah. I get that this is a terrifying experience, but at the same time, this seems absolutely amazing. Not ""good"" amazing, but ""amazed"", ""awestruck"" amazing. It almost seems like you start to transcend into a fourth dimension and are suddenly conscious of the limitations of 3D that none of us can even comprehend (same sort of cramped terror one might get if they were shoved into a two dimensional plane).

While i have never taken it, i have been fascinated by DMT trips and what they might mean. These trips can also be terrifying for those unprepared for what is to come. It almost sounds like you are forcibly shoved into a similar experience, albeit much less psychedelic. I am still unconvinced that DMT is entirely in the mind, since there have been experiments that say otherwise: with two isolated subjects simultaneously tripping and having corroborating and consistent experiences despite having never even met before.",jcinto23,9di2x3
3,"Thank you for sharing this. 

I don't think my experiences are the same thing, mostly because there was no terror associated... Though there was a feeling of panic. 

I would start to notice that my hands felt abnormally large, like Mickey mouse hands. And when I touched my teeth together it was like they were huge and somehow more sensitive. Not painful just, idk more aware of my jaw closing and my top teeth coming into contact with the bottom ones. Like my mouth was as big as a football stadium and could feel that big sensation.  

Then my thoughts would go from normal to frantic. Like I'd think ""I wonder what time it is"" and the voice thinking it wouldn't be calm and normal, it would be like someone freaking out. Every single thought. Freaking out lady in my head. But the thoughts weren't different in content than usual, just screaming and panicked in tone. 

I would eventually start to feel that feeling of time moving painfully slowly while at the same time feeling like my body was working on fast forward. But I'd look down at my hands and they wouldn't be moving any differently, so that was really disorienting.

This got to happen less and less as I got older. I'm 36 now and I can't remember the last time it happened. This is the first time I've talked about it as these words don't adequately explain the experience and I feel like no one will understand what I'm trying to say. Nice to have the chance to maybe be understood, thank you. 

Edit: just looked it up and holy crap, maybe that is what I was experiencing even though I wasn't afraid during it. From wiki  
>The person affected by Alice in Wonderland Syndrome may also lose the sense of time, a problem similar to the lack of spatial perspective. In other words, time seems to pass very slowly, akin to an LSD experience. The lack of time, and space, perspective leads to a distorted sense of velocity. For example, one could be inching along ever so slowly in reality, yet it would seem as if one were sprinting uncontrollably along a moving walkway, leading to severe, overwhelming disorientation. 

That so perfectly explains what I was feeling re time. Crazy! ",,9di2x3
4,"i love these descriptions and i’m sorry you have had to deal with this terrifying syndrome your whole life. you’ve described what you have so perfectly that i bet a lot of people are going to relate to what you have, despite the fact if they actually possess it or not. hope all goes well (better)!",warmdes,9di2x3
5,"Your description of this is amazing and is exactly how I felt. I didn’t even know the term for it until a week ago and until last week I just assumed it was a normal thing. I’m only 15 years old right now, but I remember experiencing exactly this when I was around 7-12 years old. 

Most of the time it would be after I wake up from naps and suddenly the walls seemed stretched and my bed seemed to grow several feet wider. I remember one time I was crying because I thought my parents had been fighting due to how loud they were talking but it turns out they were talking normally. Sometimes I’d wake up in the middle of the night and my blinds would stretch like towers and the clock sounded like a giant stomping on the ground.

I don’t remember how long those sessions had usually last but it seemed like forever.",1024MegByte,9di2x3
6,"This is the best description of this experience that I've found on the internet. While I don't get it as powerfully as you have, I receive the full ""time goes awol"" treatment.  ""There's a manic chaos to everything, yet an infinite terrifying vastness and stillness"" best describes it for me.  Thank you for sharing.

I just experienced it for the first time as a passenger in a moving car. I wouldn't recommend it.",wizkidweb,9di2x3
7,Do you get to appreciate the experience in any positive way?,paleRedSkin,9di2x3
8,"I wonder if i had this disease..? I used to imagine people all around me.. 

Video game characters,classmates,friends.

I couldnt sit down for example because i saw someone else there,i was imaginating it,but in reality no one was there. No one.

My imagination was so strong..
It REALLY bothered me in other things,but in the last few years,it has started to bother me less. Way less.

And thats not all..",JuhpPug,9di2x3
9,"That sounds a lot like what I experience on a fever. Thankfully, that's the only time I experience it. I can only imagine how tough it'd be for someone that with the actual syndrome.",ArmouredGoldfish,9di2x3
10,"Absolutely fascinated by your story, I can only imagine how trippy and unsettling those experiences could've been especially as a child.

Although I have never experienced it myself it sounds very similar to panic attacks I've experienced before bar the obvious Macropsia. Just curious, but have you ever experienced sleep paralysis? I feel like that can be similar again but with different kinds of effects on visual perception. I only ask as that is the closest I could possibly relate to this experience and sleep paralysis is absolutely terrifying so I can only imagine AIWS must be really hard to deal with.

Also when you spoke of the time and sound changes it really really reminded me of the effects Nitrous Oxide can have on the brain when used recreationally.",Siannington,9di2x3
11,"I wonder if it’s possible to have a very mild attack of this condition. I have lifelong and regular insomnia. With that comes many secondary quirks and health problems. Every few months, after an extended period of sleep deprivation, I get this feeling like I’m huge and tiny at once. My limbs feel very wide and I feel tiny all over. Yet, as I lie there in the dark, I feel as though my feet at 10m from my eyes. I don’t think I get all of the time distortion parts, though. Or the thing about materials feeling differently. ",valueyoghurt,9di2x3
12,"I've heard of it before, but have never read such a detailed description like this.  
On wikipedia it's classified as a neuropsychological disorder, so I wonder to what degree psychological factors play a role in this. Dissociation and psychosis are known to greatly affect our ability to perceive the world and ourself, so I wonder if it's similar to them.",Sbeast,9di2x3
13,"Your writing is damn perfect to describe the experience, goddamn. I haven't had nearly as rough of a bunch of experiences as you have, thankfully. It's downright incredible to read accounts from someone else who's experiences something like I have, thought with what seems like a lot more intensity.

I had attacks from (as far as I remember) 9ish-12, and have some mild residuals now, but haven't had the full-blown version since 12. It didn't shake me quite so badly after a few years, and they never went back-to-back, thankfully. It's been burned into my memory since, here we go:

The hard/edge feeling is accurate for me, it's sorta like everything between the edges of contact between myself and the bed/blanket felt flat and just a uniform pressure rather than a texture, and the edges themselves are highlighted/oversensitive. If I'm still looking around at all, edges stand out from objects, highlighted and artifacting slightly, things don't look 2D but they look oddly thin in depth without losing perspective. The height of the ceiling or the distance to the far wall become...variable, normal at once glance and 50' away on another. Ceiling lights would glitch this once in a while, my brain knew what size it was supposed to look like, and tried to adapt a '50 feet = 5 feet' logic, this just made me dizzy so I avoided it.

Time as my body perceived it slows, physical feedback from the bed/air fades off, but mentally it's a whirlwind. I remember the ambient noise getting sucked away, replaced by a soft static-ish hiss. There was a fast feeling of deep, primal dread (where I could usually tell I wasn't just falling asleep funny) and of being forcefully sucked/backflipping through the bed itself by some incredible force. I still don't like rollercoasters that do certain motions because of that.

Maybe 1/5 times, at this point, I could mentally trash and struggle enough to get out of it (if I could get one toe to twitch and give a new touch response, I was free), and fall asleep afterwards fine, but usually not.

The feeling of force/flipping turned into acceleration, like being shoved along an infinite, wide track and gradually approaching lightspeed. Felt real enough that my chest/abs refused to breathe normally, shorter gaspy breaths. The audio parts started kicking in a bit after I got 'launched' from the bed. Random, short yelps or yells, sometimes clips from my memory, sometimes a word or two, and always stuff in either a harsh or a pleading tone. They'd get louder as the speed picked up, more urgent and aggressive, turned into some hellish symphony of head-filling screaming fights without discernible words, all feeling like they were aimed square at me. Still feeling like falling backwards at 0.8c through this bit, both volume and speed rising.

This usually lasted from 3-5 min or so to this point, and varied a bit afterwards. Most often, thanks to being in an apartment, a bang/thud from a door closing would register through this at some point, sounding like it was very far away but louder and boomier than the clusterfuck. Sometimes, my parents would notice and wake me. Either of these resulted in a 2000mph-to-0 snap back into my own head (the feeling of being back inside your own, solid skull is a weird one), body feeling fading back in, and the yelling fading quickly back into a hiss then gone. I remember several times where it just melded the feeling of the bed and ambient noise back in over top of the cacophony, which makes a quiet room seem like it's ear-splittingly loud.

In either case, that spacial deformity stuck around for a few minutes after snapping back, the floor seemed a long fall away, the door a hundred feet away but 50 feet tall. My hand in front of my face would be normal, but at arm's length kept reporting that it was possibly gigantic. The primal dread fades off, but the anxiety didn't.

Once, I remember riding through the effect, mentally bracing against whatever the hell this experience was (I was 12 and tired of it kicking my ass). The falling/acceleration feeling kept climbing after 5 min (I'm fairly sure no person has felt this level of speed in reality before), the yelling ascending to a stream of hundreds of angry, hostile sounds overlapping to where only the peaks stuck out. The screaming stopped (but not at all once), the speed didn't change, but its scale no longer mattered, because the space I felt I was floating in was infinite. I suppose outer space is the only comparable thing, just infinite black nothingness in every direction with zero perceived 'end' anywhere. I got pretty panicked about whether or not I had somehow left my body doing this, since this was a bit different. The return to the bed was a hard jolt that time,  I twitched in a way that felt like I fell into the mattress from a short distance up, but without leaving it. It wasn't the last attack, but the only one I ever had go that far.

As for the residual stuff... thankfully really mild. The spacial effect happens randomly in certain conditions (looking darker to better lit space, not much motion, and I'm tired but staying up). Edges seem a bit 'harder' along with the effect, but there's no warning to it otherwise. If I'm looking into the hallway from my desk, it'll seem 10' away then 100'  then 10' again as I look at it, keeping perspective/relative distances of things at distance unaffected. Someone standing in the doorway would be 5', then 50' tall according to what my brain is trying to tell me. This lasts for between 30 seconds or so to a few minutes, and can happen repeatedly in one night. I've gotten a bit used to it in that I can carry on a conversation while it happens, losing focus for a second as I force my brain to accept normal scale a few times.",Orange_C,9di2x3
14,"I saw this the other day and saved it but only just got round to replying.
I used to get this as a child, also mostly when I had a temperature and it was almost exclusively when I was In bed (although I would get the weird shouting in my head sometimes in the shower too later in life - I kind of feel it now weirdly just reading this)

I fully get how it would be traumatising and I’m kind of surprised it didn’t traumatise me, unless I’ve just forgotten that. I have a vague recollection of feeling alone and trapped but I wouldn’t say I felt scared or anxious and if anything I would talk it up to people about how cool it was to feel my hands getting bigger and smaller.

I also used to get nightmares when I was ill, I’d be in a weird environment of cumuli coloured hills and mounds and I’d feel myself getting trapped in the valleys with the walls looming over me and the weird loud and incoherent voice shouting at me. 

It really is a strange condition and I was glad I was able to find out what it was years ago, I am surprised it hasn’t affected me more than it has, unless I haven’t realised yet.

Just last night I woke up and my head felt like it was in overdrive, no real thoughts in particular but there was some feeling whirring around and making me restless and uncomfortable. I’m wondering if this is part of it too and that is probably the symptom that has stuck with me most as I’ve got older, although it is still rare that it happens 

Would love to see any links to articles or studies about this if you have found anything interesting yourself ",,9di2x3
15,"Hi all!  And hello Tiger Widow :)  Thanks to everybody who shared their stories!  Count me among those that experience this strange phenomenon.    
I thought I would offer my story because I had some really fascinating things happen to me as my comfort with the sensations evolved over time.  I'll try to keep it short and to the point.  


I can't recall exactly when the symptoms began, it must have been 8 years old or so.  Typical manifestation to what many here have already said; terrifying sensations of being impossibly large and impossibly small at the same time.  The impossible part was an important descriptor because part of the panic I felt as a child was in the sense that what simply could NOT be, actually was, though it felt so wrong.  In addition to the bodily sensations, environmental feedback, intense bad dreams, sleep walking and talking... I had the strong internal visual of what I called a ""black ball"" (my mother said I'd be speaking of it while sleeping quite often). All this occurred for me at the same time in my young life, an otherwise normal and healthy life in a happy home.  Eventually, after some months of trouble while adults shrugged their shoulders at what descriptions I could add to my parents observations, the sensations eased and I had regular sleeps again.  


Frequently over the years the sensations would return, mostly when I was tired, to varying degrees of intensity, sometimes overwhelming, as it was at first, but sometime slightly less so.  What I noticed was that I was becoming more comfortable with it.  As a teenager I even began to invoke it intentionally to see how 'deep' I could get with it.  There was a definite increase in it's intensity if I could focus on it and relax into it.     
I understand that part might sound a little crazy for some of you, being that overall it was a very unpleasant sensation.  I totally get that... I can only say that for me, once I stopped resisting the sensations, it meshed well enough with my psyche and wasn't SO foreign perhaps because of the vivid and occasionally quite odd dreams I had been having as a kid.   Perhaps worth mentioning is that I have been a very active dreamer through my life and able to have lucid dreams from an early age and such.  I suspect that there are correlations between this and AIWS.  


Here's the part I thought important to add to the conversation: Time goes on and as a young man in my twenties  (I'm 42 now) I was still able to invoke the sense of stillness that comes with the size perception distortion and other hard to describe sensory feedback - sometimes it would still come on it's own, mostly as I lay in bed ready for sleep.   One winter night, I lay in bed suffering terribly with a bad infection in both ears.  I was very feverish and as often happens for me when I am exhausted and feverish my mind got stuck in a sort of a loop.  Does this happen to anyone else?  It can be such a nightmare... a repeating thought or feeling, over and over, throughout the night only changing a little here and there... quite the test of sanity for a person already feeling quite sick.     
So!  This night, as I lay drifting into my feverish sleep the Alice symptoms settled strongly into place and this sensation became what my mind looped into.  Over and over through the night, like some kind of sense mantra, my mind stayed fixed on this feeling.  It was very intense, to a new level and I even began to perceive the 'black ball' that my mom said I used to fearfully talk about.  As the night wore on, this black ball became more of a focus and I could see it more and more clearly or I approached it closer and closer.  Eventually, still looped into the AIWS sensation, I could actually see that the black ball was an immensely large knot, tied into itself like a monkeyfist with no ends showing.  


I realize this gets a bit far out there but bear with me.  I am an otherwise normal person... haha  


I had a very strong impulse to get closer to the knot, to untie it perhaps but as I got 'nearer' to it I could feel that it was impossible to do so.  Here I felt a forced coming together with the black ball, with this knot, and as I felt myself enter into a sort of overlapping with it, however cheesy or fantastic it sounds, I gained a new perspective that automatically led to a simultaneous bonding with it and an untying of myself.    
The sensation that followed is harder to describe.  I sensed something feminine, and the certainty that all the answers to whatever question that exists were here, in this place where the knot once was.  As reassuring as this feeling was, as beautiful and transcendent, it didn't last very long... I could feel that my self was unable to occupy this space, got scared and retracted post haste.  I pulled back from it, sensing the knot again as I withdrew, got outta bed and wandered the house for a few minutes, still totally feverish, feeling the AIWS symptoms subsiding and not perfectly clear on my sense of self.  It all came back to me in short order.  


I realize that must sound hokey to some.  I'm out of free time to share for the moment.  I can say a bit more about it so perhaps I'll pop back in a while and see if anyone has bothered to read through and wants me to continue.     


Thanks again Tiger Widow!

  
",TheCuriousApathy,9di2x3
16,"Well said. I've had these experiences in some form or another. The feeling of everything being so far away, the room, my hands, every object elongated and zoomed out. The rushy feeling of reality moving faster then comprehension. The bombardment of many voices speaking all at once. And Yes, it was much more intense during fevers. I remember feeling like I was going mad during times when I was sick. My mind overwhelmed with some unknown rush of stimuli  that couldn't be vocalized or described to any sensible accuracy. It was usually in the dark for me but there were times I had to turn the light on to try to get the episodes to subside or feel some kind if physical normalcy. ",cosmicdreams34,9di2x3
17,"That sounds like a fairly similar state of perception. If I can provide some insight into what you experienced regarding what I've learned about my condition:

What you're describing sounds like Macropsia ([https://en.wikipedia.org/wiki/Macropsia](https://en.wikipedia.org/wiki/Macropsia)) which is one of the components of an attack of Alice in Wonderland Syndrome. It can effect different senses, touch, sight, hearing, and seems to be something to do with a breakdown in a proper gauging of proportionality.

There's an area of your brain that's called the TPO-C, which is the crossroad of temporooccipital, parietooccipital, and temporoparietal junctions (TOJ, POJ, and TPJ). TPO-C is where visual and somatosensory information are integrated to generate the inner and external representation of self. An episode of micropsia in children being tested with AIWS has revealed contemporary hypoactivation in occipital lobe and hyperactivation in the right superior parietal cortex.

Think of it as an extremely strange form of epilepsy - type - occurance that interferes with the brains ability to integrate visual, audible and somatosensory input. This area of the brain seems, at least anecdotally, to under certain conditions have some form of small misfiring in otherwise normal people. There seems to be widespread accounts of people experiencing one or two moments of this as children. It's possible then that quite a significant portion of people have experienced, fleetingly at least, some aspect of the symptoms AIWS sufferers experience episodically. It sounds like this could be what happened to you.

Again, this is more likely to occur in childhood (and also seems to be largely triggered around the sleep onset stage) as it's much less prevalent in adults, even for those that had previously experienced many episodes in childhood. I've had maybe 3 (lets say 2 and a half) episodes in the past 11 years. though more than I could care to remember between childhood and mid-late adolescence.

But if that gives you some insight into how it functions, I hope that's maybe given you some clarity on that. Of course I could be wrong but that's what sense I can make of what your experience sounds like.",Tiger_Widow,9di2x3
18,"It's amazing how many others in the AIWS communities I've found that have exactly the same experience as this. As was my story too. Spending, well, 25 years now (beginning at 6, I'm now 31) having great difficulty explaining the nature of this thing to others, and trying to get some answers. Never getting any. And finally being bought into contact with this not very well understood neurological condition. And suddenly having a whole set of people knowing exactly what I'm talking about. And a load of literature explaining what's actually happening.

You should maybe look into Alice in Wonderland Syndrome yourself. It's commonly cited that this is massively under-diagnosed due to the nature of how it works, how little known the condition is, and how difficult it is to bridge that gap for people that experience these kinds of weird symptoms.

There are various kinds of things that can trigger this stuff. Migrains are a predominant factor, as are forms of temporal lobe epilepsy, or viral infections. Often though it appears on it's own and fades away as sufferers get older. It's not that well understood really, other than there's a definite set of criteria that are symptomatic of the syndrome and diagnosis is generally predicated on the account of the sufferer's description of their episodes.",Tiger_Widow,9di2x3
