,Comment,Author,Post
4,"What do you envision happening when your parents are gone? That’s part of our crisis. He relies on them completely.  I will not take that on. Not even a little. I feel like as they get older and he realizes they will be gone more of a borderline personality disorder is being revealed. At least his behavior is exactly like that. Do you think you would resent him more if he started to characterize you as “ you are all I’ve got!” I just want to scream— “I was never there. I left 35 years ago. As soon as I could to get away from the dynamic.   “. Am I responsible for him even though I did everything to get away?  I’ve never in my life asked him for anything. How can he demand that I become responsible for him? “ can you call me more often so I can complain about how awful everything is and tell you life is unfair because you are the polar opposite.” No, I can’t. But I feel like such a jerk.",Errr789,q3orv1
5,"Great questions and insight by the way.  I guess I’m just not ready to deal.  

Funny thing— today I told my dad his behavior really sounds like borderline personality disorder, but since no one has ever said I guess it can’t be…. And he said oh they diagnosed him with that a few years ago.p",Errr789,q3orv1
6,"I think a major problem is his intrusiveness, and that my parents expect me to have as few boundaries with him as they do.  He calls them in the middle of the night to complain. They will tell him he shouldn’t do that to me  because I have a job and kids ( he has done this.) I say - wait—- even if I weren’t working with no kids it’s NOT ok to call me in the middle of the night to complain.  I’m not mad at myself for leaving, but i am that I don’t want him to re-enter my life.  It’s even crap like there has been a history of accusations ( twice) from women— not sexual assault but more like showing up repeatedly when he’s been told to go away.  My mom’s take was that they were “ manipulative bad women.”  Mine is WTF?  We make excuses for creepy behavior? 

He has financial stability from our parents, has vacations with them paid for, college degree paid for,  cash psychiatric payments, car paid for, is on disability, and they established a trust fund for him and bought him a house.  My parents never earned more than 90k between the two of them but made smart investments after 1995.  They had no money when I went to college so I got financial aid and loans and then paid for my doctorate completely with loans. And now they want to move down here with him, and Part of it is to force him into my life.  They want to see me and the kids, but I know part of it is for me to take over for them with him.  They are pissed when I say he can’t just show up at my house. I just want him to stay away from me.   I know of nothing traumatic that has ever happened to him. I think my parents are at a loss to deal with his manipulation.  And I can’t listen to his complaints that his life is awful and our parent’s don’t want to pay for experimental medical treatments for 10,000 etc.  oh, and he complains that I’m “ going to be just like mom.”  Yeah, no. I would never tolerate you…  

I spend most of my day with scared people who have often received or are afraid of receiving terrible news.  It’s hard to listen to his complaints, and watch my parents break themselves over him. 

I’m sure that you are right that there is a lot of potential growth but I just don’t want any growth if it means spending time with him. He got my parents. I gave enough.",Errr789,q3orv1
7,"Ok, well I'm not sure is there much more to say, because your last paragraph seems to conclude how you feel and seems to imply you have already made a decision.  


It's really not fair to bait people into a conversation just so you can validate your reasons, without really considering why you have these feelings/where they are really coming from. I'm not saying I don't appreciate you explaining, but you are doing it from a pretty bias place. And I don't think you can go deeper until you let go of some of your animosity, which don't get me wrong, I KNOW is not easy to do---but you are the one that is hurting or you wouldn't be here writing about it.  


It's your right if you don't want someone in your life---but it sounds like you will be hurting your parents too, since they are the ones that want to move themselves/your brother closer to you and that  might be what this is really about: hurting your parents.",TheOtherMe4,q3orv1
8,"Sadly  I think you are 100 percent correct in everything that you wrote, and I’ll think long and hard about everything you said.  Everything. ( it might not seem like I’m listening or value your opinion, but I definitely do! And I think you are correct. I guess I’ll have to work to a place where I’m willing to accept it. ) thank you again for your response.",Errr789,q3orv1
0,"Suggested studies in ""boundary construction.""

1) The Patterns & Characteristics of Codependence on the Codependents Anonymous website;

2) ""The Five Stages of Recovery"" at pairadocks.blogspot.com to see where one is in them; 

3) The ""Karpman Drama Triangle"" schematic of control strategies in interpersonal relationships; 

4) Codependents Anonymous and Emotions Anonymous meetings (you can find meeting locators on their websites);

5) ""Jiddu Krishnamurti on Loneliness vs. Being Alone"" at pairadocks.blogspot.com, further quoting a young Krishnamurti on being *alone* vs. being *lonely*; 

6) Practicing some thought questioner & mindfulness inducer like the ""10 StEPs of Emotion Processing"" at pairadocks.blogspot.com, so that one is able to continue to *sense* what is going on and know what to do about it;

7) Carefully reading the lyrics while listening to Alanis Morrissette's CD / MP3, ""Jagged Little Pill"";

8) Pia Mellody's book, *Facing Codependence*;

9) Anne Wilson Schaef's book, *Co-Dependence: Misunderstood, Mistreated*; 

10) Barry & Jane Weinhold's book, *Breaking Free of the Codependency Trap*;

11) Susan Forward's book, *Emotional Blackmail* on manipulative relationships;

12) Patricia Evans's book, *Controlling People* on the same topic;

13) DBT's ""FAST"" boundary-setting skills set (on DBTSelfHelp.com).

Hmm. Is she alcoholic or drug-abusing, by any chance? 
",not-moses,5y5rdm
0,"How did you rule out CFS and POTS?

Fatigue can be a symptom of a lot of things, including stress, anxiety, depression, and a myriad of physical disorders (I have fatigue so bad that for a while I deeply and sincerely thought I had severe CFS, and have a book on how to survive with severe CFS, but I'm like maybe 75% sure it's ""just"" a symptom of my hEDS/HSD). Nailing down what's causing fatigue can be really difficult but usually there's other symptoms that help to point to a cause, or a pattern to it.",magpiegoo,bol6nj
1,"A diagnosis of CFS requires post-exertional malaise, which is something I do not experience when walking.",Misrta,bol6nj
2,"Different people have different trigger levels for their PEM, but that's fair.",magpiegoo,bol6nj
0,Have you talked to a dr or therapist about this? I would also do some research on anxiety and OCD.,snowangellms,8o2kzy
1,I was taking effexor for it (lowest dose) and it worked (anxiety was half as intense) but I've decided to stop taking this poison - this med can make you dependent for life,klosimierz,8o2kzy
0,"Thank you for for sharing. A reminder: if you are seeking resources in your local area, please provide that in the post so that users can share appropriate links and phone numbers. *If you are in distress, please call 9-1-1* or your local emergency number. *You are not alone. Help is available.* If you are having suicidal thoughts, please [click here for a list of crisis support services.](http://www.suicide.org/international-suicide-hotlines.html), If you are seeking therapy online, please [click here for a list of counselling services.](https://thelifelinecanada.ca/pattern-interrupt/ecounselling/) *If you feel well enough to do so, please do your part to enrich this community.* Now that you have posted, please leave a constructive, helpful comment on someone else's post. Filter by new to find posts with zero comments. Together, we make this community great. Thank you for being here. 


*I am a bot, and this action was performed automatically. Please [contact the moderators of this subreddit](/message/compose/?to=/r/mentalhealth) if you have any questions or concerns.*",AutoModerator,q7wn7v
0,For some reason it won’t let me start a chat but if you want I’ve got experience with some or these if you have questions,xSYPHx,fixgce
1,I’d love to chat about schizophrenia and dissociation. I can’t start a chat from my phone (I don’t even know why) so send me a message!,Schizoqueen,fixgce
2,">I feel a lot of characters written to have PTSD aren’t as accurate as they should be.

Good, it means you know enough.",shadow-Walk,fixgce
3,"Ok! I'll try to start a chat, and if it won't let me, I'll just send a regular DM",Dragonwysper,fixgce
4,Kk! I'll start up the chat!,Dragonwysper,fixgce
5,"Fair xd  
I still want to be able to accurately and effectively show what happens in flashbacks and dissociation, and how everything affects a person. I can't do that if I don't fully understand it all xdd",Dragonwysper,fixgce
6,"If you want accuracy there is wikipedia pages about these disorders and conditions.

If you want specificity there are subs dedicated for CPTSD, Schizophrenia, schizotypal, DID, borderline et al just add the r/* or do a Reddit search.

There is a wealth of information from those with a range of disorders whom already have shared their experience with issues related to your interest on these subs.",shadow-Walk,fixgce
7,"I've researched a lot about all sorts of disorders relating to PTSD on several different websites. I've also been kinda lurking in r/PTSD and r/CPTSD for quite a few months now. Online articles are good and have helped me quite a bit, but they speak in a formal, general, analytical way, and don't go into as much detail as I'd prefer with some more emotional/personal/hard-to-explain stuff, like PTSD flashbacks and dissociation. The subreddits are good, but often times, people don't talk about specifically what I want to know, in a detailed way that makes sense, at least.

That's why I decided to come here and ask for information and advice on specifically what I want to know from people willing to talk to me about it for a while. From talking to a couple people who responded to my post here, I much better understand some of these complicated issues, and feel much more confident in my ability to describe them in a fictional character",Dragonwysper,fixgce
0,"Thank you for for sharing. A reminder: if you are seeking resources in your local area, please provide that in the post so that users can share appropriate links and phone numbers. *If you are in distress, please call 9-1-1* or your local emergency number. *You are not alone. Help is available.* If you are having suicidal thoughts, please [click here for a list of crisis support services.](http://www.suicide.org/international-suicide-hotlines.html), If you are seeking therapy online, please [click here for a list of counselling services.](https://thelifelinecanada.ca/pattern-interrupt/ecounselling/) *If you feel well enough to do so, please do your part to enrich this community.* Now that you have posted, please leave a constructive, helpful comment on someone else's post. Filter by new to find posts with zero comments. Together, we make this community great. Thank you for being here. 


*I am a bot, and this action was performed automatically. Please [contact the moderators of this subreddit](/message/compose/?to=/r/mentalhealth) if you have any questions or concerns.*",AutoModerator,n93n0q
1,"There's some tips in these posts which might help:

[How to Develop Self-esteem (Preview)](https://www.reddit.com/r/MindOverMatterScott/comments/foqpd6/how_to_develop_selfesteem_preview/)

[5 Ways to Build Lasting Self-esteem](https://www.reddit.com/r/MindOverMatterScott/comments/ijg2yp/5_ways_to_build_lasting_selfesteem/)",Sbeast,n93n0q
2,Thank you,MajoraFeels,n93n0q
0,"Thank you for for sharing. A reminder: if you are seeking resources in your local area, please provide that in the post so that users can share appropriate links and phone numbers. *If you are in distress, please call 9-1-1* or your local emergency number. *You are not alone. Help is available.* If you are having suicidal thoughts, please [click here for a list of crisis support services.](http://www.suicide.org/international-suicide-hotlines.html), If you are seeking therapy online, please [click here for a list of counselling services.](https://thelifelinecanada.ca/pattern-interrupt/ecounselling/) *If you feel well enough to do so, please do your part to enrich this community.* Now that you have posted, please leave a constructive, helpful comment on someone else's post. Filter by new to find posts with zero comments. Together, we make this community great. Thank you for being here. 


*I am a bot, and this action was performed automatically. Please [contact the moderators of this subreddit](/message/compose/?to=/r/mentalhealth) if you have any questions or concerns.*",AutoModerator,wuqxle
1,"Wow this is a lot of different resources! It was a bit overwhelming and a slap in the face to read, so I advice others to see it like you should only take in what suits you. For example meditation is a no go for me. It only opened flashbacks and retraumatized me. (It's not recommended to do without supervision for a reason) Same with weed /, cannabis etc, opens my flashbacks and retraumatize me.

However reading books like Peter Levin's books,
And help apps / work sheets, regular exercise, cool showers, acupuncture / self massage works very well for me, as well as trauma focused yoga (There's specific yoga  for that if you search on YouTube)

I'm curious how the EMDR app works? And how much it costs? I don't afford expensive apps but it depends how much they help. I found EMDR therapy to work extremely well on me but for economical reasons I only had a few sessions. 


Art therapy was also great for me. And I have noticed that it's my type of meditation now at home, to colour, draw, paint. It makes me grounded and safe. 
There's colour apps, there's colour books. I have both. I also have painting material online and irl so when I need to do art, it's all easy accessed. 

There's a physical boundary practice I learned once that also helps me. Where you lay on the floor /couch /bed and do a movement with an arm or a leg and then you say stop and stop the movement. You can do this on pairs too where someone moves your arm or leg and then you say stop and they stop. 

If someone likes animals I seriously reccommend finding a way to interact with animals as often as possible. I follow all animal subs. They crowd my feed and make me warm safe and smiling. I take care of dogs I visit people with animals as often I can. Heck I even go outside my apartment building just to see if a neighbor cat is outside.  They tend to hang around the neighborhood and I give them my pets and love! 


In terms of help online. The best mental app I have ever come across is ""Youper"" I used it while it was for free for 3 years and wow it helped me more than ever. It costs now since they've updated it, if you afford it I couldn't reccommend any mental health app more. I consider paying to stay on there. That's how good it is. You should check out the trailer on youtube to get an idea of why I love it so much.",Queen-of-meme,wuqxle
2,"That's a quite a few things you've tried! Which one(s) did you find to be the most helpful?

You could also check out this article on CPTSD for more information: https://www.mind.org.uk/information-support/types-of-mental-health-problems/post-traumatic-stress-disorder-ptsd-and-complex-ptsd/complex-ptsd/",Sbeast,wuqxle
3,"Thank you for taking the time to read this and it is true that not everything on this list is going to work well for everyone, this post is just a toolbox and people can pick what works for them. 

The EMDR apps that I listed are for free, or they were last I checked. I use the phone app for cold baths combined with breathwork sometimes and this combo has helped. The desktop app I listed has a number of settings to adjust the EMDR experience. There isn't guided therapy/meditations that come with these apps but combining them with EMDR self therapy resources could be an option. 

I have done a few physical boundary exercises as well, I've not heard of Youper though, I will look into this. 

You are right about meditation, it does pose those risks for some people, as does mindfulness ironically. Mindfulness can be a double edge sword, Trauma-Sensitive Mindfulness is a book that discusses this: 

[https://www.amazon.com/Trauma-Sensitive-Mindfulness-Practices-Transformative-Healing/dp/0393709787](https://www.amazon.com/Trauma-Sensitive-Mindfulness-Practices-Transformative-Healing/dp/0393709787)

I'm not promoting the book, but I've listened to the ebook and it is very enlightening. 

I follow r/catsareassholes for my pet therapy needs, and you are right it is therapeutic.",Reisno,wuqxle
4,"If I could only pick one for me personally it would be microdosing but all of them chipped away at CPTSD at different angles, there is no magic bullet for this. Thank you for this link!",Reisno,wuqxle
5,"Thank you for taking the time to make this! It's valued a lot.

I'll check that EMDR app up. What's it called?",Queen-of-meme,wuqxle
6,"The one on the phone is BLST and the one on the desktop is ""Go With That 4.0 Free""",Reisno,wuqxle
7,I couldn't find the BLST (I'm in Europe maybe that's why?) is it for android?,Queen-of-meme,wuqxle
8,I am also in Europe and that is strange. If I can find a link I will paste it here.,Reisno,wuqxle
9,"Yes that would be great, thank you.",Queen-of-meme,wuqxle
10,"[https://play.google.com/store/apps/details?id=com.app.openemdr](https://play.google.com/store/apps/details?id=com.app.openemdr)

try this one",Reisno,wuqxle
11,I see. I seem to have it installed on my old phone through my Google account that's why it didn't show up. Thanks!,Queen-of-meme,wuqxle
0,"Thank you for for sharing. A reminder: if you are seeking resources in your local area, please provide that in the post so that users can share appropriate links and phone numbers. *If you are in distress, please call 9-1-1* or your local emergency number. *You are not alone. Help is available.* If you are having suicidal thoughts, please [click here for a list of crisis support services.](http://www.suicide.org/international-suicide-hotlines.html), If you are seeking therapy online, please [click here for a list of counselling services.](https://thelifelinecanada.ca/pattern-interrupt/ecounselling/) *If you feel well enough to do so, please do your part to enrich this community.* Now that you have posted, please leave a constructive, helpful comment on someone else's post. Filter by new to find posts with zero comments. Together, we make this community great. Thank you for being here. 


*I am a bot, and this action was performed automatically. Please [contact the moderators of this subreddit](/message/compose/?to=/r/mentalhealth) if you have any questions or concerns.*",AutoModerator,otvboq
0,"&#x200B;

I know nothing, but Occum's Razor and all. Have you checked you blood oxygen saturation percent throughout the day. Simple finger tip ones are available for around $20. Here is hoping it's that simple.",ultramega,bl62m2
0,"Thank you for for sharing. A reminder: if you are seeking resources in your local area, please provide that in the post so that users can share appropriate links and phone numbers. *If you are in distress, please call 9-1-1* or your local emergency number. *You are not alone. Help is available.* If you are having suicidal thoughts, please [click here for a list of crisis support services.](http://www.suicide.org/international-suicide-hotlines.html), If you are seeking therapy online, please [click here for a list of counselling services.](https://thelifelinecanada.ca/pattern-interrupt/ecounselling/) *If you feel well enough to do so, please do your part to enrich this community.* Now that you have posted, please leave a constructive, helpful comment on someone else's post. Filter by new to find posts with zero comments. Together, we make this community great. Thank you for being here. 


*I am a bot, and this action was performed automatically. Please [contact the moderators of this subreddit](/message/compose/?to=/r/mentalhealth) if you have any questions or concerns.*",AutoModerator,jzo80d
1,"Hi. You can doubt your therapist diagnosis if that doesn’t feel right. Ask them more information, and share your doubts, ask them why they thought about ocd instead of gad. I’m not a professional but maybe it’s a bit of both, maybe it’s none of them. 
From what you wrote i too thought about ocd (but again I am NOT a therapist, i just read stuff). Idk just try to comunicate your doubts, and hopefully they will get solved.

For panic attacks, what I found helpful in my personal experience, is to drink (I’m forced to stop breathing in order to drink) and cold things (grounding) like holding ice. Sometimes I start describing stuff out loud, like what it’s my room, or how does the plushie at the end of my bed look like, in details; it helps to distract me.

Hope this helped even if just a little, and didn’t confuse you even more. <3",,jzo80d
2,"Thank you for your comment! <3 It’s true that I am no psychologist to diagnose myself, and it could be something completely different. My sister has a mental disorder too but psychologists have all told her something different, it’s definitely a process that can take time and effort. I wonder, however, if someone has gone through something similar and could relate to it.",BillyRoca,jzo80d
3,"It does take time to get something diagnosed. I do have some thoughts and behaviours that sometimes makes me think about ocd and some that makes me think that I have gad, kinda different from what you said, but not that much actually. tho I haven’t told my therapist, i’m not that good at communicating and this stuff it’s confusing. But I trust her and they always ask the right question so eventually I’ll get there.",,jzo80d
0,"Thank you for for sharing. A reminder: if you are seeking resources in your local area, please provide that in the post so that users can share appropriate links and phone numbers. *If you are in distress, please call 9-1-1* or your local emergency number. *You are not alone. Help is available.* If you are having suicidal thoughts, please [click here for a list of crisis support services.](http://www.suicide.org/international-suicide-hotlines.html), If you are seeking therapy online, please [click here for a list of counselling services.](https://thelifelinecanada.ca/pattern-interrupt/ecounselling/) *If you feel well enough to do so, please do your part to enrich this community.* Now that you have posted, please leave a constructive, helpful comment on someone else's post. Filter by new to find posts with zero comments. Together, we make this community great. Thank you for being here. 


*I am a bot, and this action was performed automatically. Please [contact the moderators of this subreddit](/message/compose/?to=/r/mentalhealth) if you have any questions or concerns.*",AutoModerator,yokmxy
0,"Thank you for for sharing. A reminder: if you are seeking resources in your local area, please provide that in the post so that users can share appropriate links and phone numbers. *If you are in distress, please call 9-11* or your local emergency number. *You are not alone. Help is available.* If you are having suicidal thoughts, please [click here for a list of crisis support services.](http://www.suicide.org/international-suicide-hotlines.html), If you are seeking therapy online, please [click here for a list of counselling services.](https://thelifelinecanada.ca/pattern-interrupt/ecounselling/) *If you feel well enough to do so, please do your part to enrich this community.* Now that you have posted, please leave a constructive, helpful comment on someone else's post. Filter by new to find posts with zero comments. Together, we make this community great. Thank you for being here. 


*I am a bot, and this action was performed automatically. Please [contact the moderators of this subreddit](/message/compose/?to=/r/mentalhealth) if you have any questions or concerns.*",AutoModerator,j1k4a0
1,"I have similar circumstances. I too am experiencing something similar to your situation. I just wanted to drop a note to say “you are not alone in this.” My circumstances are a result of a chronic physical condition as well. 

I recently started to set goals for myself the night before each day.  It’s challenging when you have lack of motivation, however it gives me a map of something good/beneficial for the next day without having to spend mental energy on it then.

I have also started taking a cold shower for 10 min right when I wake up. No pc, no phone, and no electronics for the first 2 hours of my day. I use at least 30min of that to meditate.

I’ve only been doing these things for about 2 months and have started to have a better outlook.

Another thing you might try is reach out in your community and look for cool activities to do outside in your area. I used to be big into stargazing and found some really good spots for this by just asking. Again it’s tough to get going but once I’m there under the open sky I find I enjoy it.

You may want to talk to your MD about options that he/she may have for you.

Hope that helps a little. Hang in there.",atlas128,j1k4a0
