,Comment,Author,Post
5,By the time Christmas vaca comes I’ll be home and I’ll have my bong and stuff it won’t be long that I’m sober for and I don’t intend to stay sober,No_Cupcake_241,18etr40
6,"I'll be honest with you, rehab is actually really fun. Not trying to push you to go or anything because everyone's needs are different, but I think it's best to keep an open mind about it just in case you do need to go.",bullymeahhh,18etr40
7,Rehab is a place to meet other drug addicts where I’m from,No_Cupcake_241,18etr40
0,"This post has been marked as a [Venting Post](https://www.reddit.com/r/bpd/wiki/index/flairs#wiki_post_flair_breakdown). 

Please be aware that the OP may not be seeking advice. 

u/Fun_Park2505, if you do not want advice, please specify in the body of your post. 


*I am a bot, and this action was performed automatically. Please [contact the moderators of this subreddit](/message/compose/?to=/r/BPD) if you have any questions or concerns.*",AutoModerator,1cmovf1
1,"I was addicted for just over a year to black market THC (definitely more than just THC in that shit). I was using it to cope with a month long situationship that went sour, and I regret it so much. My psychiatrist told me the whole time that what I was doing was only going to create more problems. Here I am now, exactly 120 days sober, on antipsychotics that make me feel like shit, having gone through a pretty bad religious psychosis, contracting HPPD, and my BPD symptoms are 12x worse than when they started. Drugs never made anything better, I was just trading one set of problems for another, and now I’ve got both sets. I’m so glad I got sober, even though the withdrawal sucked for the first two months and me and my mind are still learning to live without substances once again.

Having BPD, we carry the heaviest sense of emptiness with us wherever we go, and a lot of the times we make it our life goal to fill that emptiness rather than getting to the source of it. Addiction, favorite persons, and rapid shifts in identity are all attempts of filling that hole. Rather than slapping bandaids on the issue, it’s our ultimate goal to delve into the depths of that dark hole within us. In my experience at least, that hole is left by a damaged, stunted inner child doing everything it can to feel alright, because that child was never taught to love and take care of itself, to be its own support. Getting sober is hard, but the journey of sobriety is grounds for a lot of very important work that can be done. Don’t run away from those feelings. Take a step back, listen to yourself, take note of what you’re feeling and why you’re feeling this way, and if you have to, just sit with it. Don’t embody your feelings, but observe them.

The best of luck to you, friend 💚💚",shitassmoneyman,1cmovf1
2,"Hey good job on getting sober and thankyou for this comment, so much truth in this.",Fun_Park2505,1cmovf1
3,What are your HPPD symptoms and from what drug?,ssYxji,1cmovf1
0,"I think a lot of us will relate with this, drugs make things feel ""better"" and then our usage becomes more and more frequent until it becomes the addiction. I've definitely dealt with the cravings when there were drugs I've only done once, but something that helped me lower my weed consumption was cutting it with natural herbs like mugwort. I'm not super knowledgeable on that but after about a week of it I noticed I've been feeling less like a zombie. I don't know what you specifically struggle with, but something that helped me a lot is weaning off instead of cold turkey, and also trying to purposefully be sober (like in the way people try to be drunk). I basically give myself time limits until I'm ""allowed"" to smoke or drink, and it forces me to distract myself with other things. You're not alone, and no matter how helpless it may feel, just know that as long as you're doing the best you can for you, that's good enough 🩷",femmesbian,1b8eb3v
1,"Ya exactly that's how all my addictions started off first weekends then daily then hourly it's very deceiving how it creeps up then once I realize I'm addicted part of me doesnt care. Ya il look into mugwart thankyou 

My biggest issue is I guess I dont feel like I'm not always me so then everything about my plans and goals changes so frequently.

Thanks I do appreciate that I just need to be careful cause if I'm not I could end up homeless but at the same time having shame does make it all worse",Fun_Park2505,1b8eb3v
0,"I'd rather be honest. I'm not going to terrify you of drugs. I will honestly tell you they don't work. They end up delaying putting off what does work for years and usually decades to get you back to the point you are now where what would work then would have worked for you now. But now you've added a whole more laundary list of problems, regreats and everything else that is stopping you from getting healthy in the correct ways to your list, making it harder and harder to do it. And that's if you make it through the whole ordeal. 

Find me an obituary where they say oh he died such a happy drug user, he showed everyone that using drugs, alochol whatever was the way to overacheieve, to overcome everything that held him down, to beat his mental demons. I don't think you will find that.

You'll find obituarties of people who died too early and never overcame what they used drugs for.

And you'll find people who died happy, successful, maybe they did use drugs along the way, but they had to once again go and kick that habit and go backwards to eventually go forwards.

So, being honest, I'm not going to make you terrified. I'm just going to say honestly they are a waste of time.",MainAction9667,1bgmt3j
1,Some ppl choose drugs over the ppl in their life. Yes ppl can be shitty and fucked up but drugs are way worse. Drugs won’t come around and apologize or tell you everything is going to be okay. Only the ppl you abandoned can do that.,Old_Bluebird_58,1bgmt3j
2,"I just smoked my last bit of weed and now I’m losing my mind because I have to go without. Don’t do it, it’s not worth the meaningless anxiety. The chronic boredom kills me everytime tho",breyness,1bgmt3j
3,"In UK you can get boxes of overstock food at night from Aldi

AP is too good to go

Buy a couple and give to the addicts conveniently behind store 

Keep doing this often

Don't interview or be fake mates

After a while you may witness a neck or groin shot, or a toddler in the pram you assumed empty/stolen

Repeat as needed",,1bgmt3j
4,"More drugs = less money

Less money = less drugs

(This is messed up advice, but if you can keep yourself in a loop and get the habit of hoarding cash, it might work)",No_Hope_4237,1bgmt3j
5,"one thing i do that actually helps a lot, procrastinating it. “i’ll do it later” or “not this time, i’ll do it next time” just keep procrastinating it as much as possible until you no longer find yourself interested in it",Rich-Mix2273,1bgmt3j
6,"don’t write drug addiction into your future. don’t manifest that bullshit. you are stronger than drugs. 

also, that shit is expensive. and the cheap ones will fuck up your life too just slowly. imagine that you keep doing drugs, til you’ve spent your last penny, then you start asking your loved ones for money, then it gets too much, you can’t pay them back, you lose your job, your family and friends, you lose your house, you sell your clothes, you’re on the streets. now you are smoking butts of cigarettes from the garbage because that’s the only relief you can find. you stink. you don’t have a warm home, a hot shower, and you’d kill for a hot meal or just a roof over your head for a night. 

on top of that, you look like shit. your skin looks like you take meth, your body has 7 layers of dirt shit and piss, you’re getting infections and you can’t afford a doctor. eventually you die. you die either as a drug addict or as a homeless person who didn’t have the means to take care of themselves. 

this is one of many routes it could go. but a very realistic one too. stop before it’s too late. you cannot afford rehab. and there are becoming less and less ways to seek help for this kind of shit.",ihateitherealotlmao,1bgmt3j
0,"He has typical addict behaviour (coming from myself, a recovering addict) and unless he gets help, he will most likely continue on this path he is taking. 

If I were in your situation, I'd break up. This is a situation that you are far better off without having in your life. Drugs and mental illnesses don't mix - it's a recipe for disaster. You deserve better OP.",,17t7eie
1,"i think your boyfriend likes drugs better then you, i know it sounds rough, but from what you told us its looks like it.",Timely-Rub-4513,17t7eie
0,"This post has been marked as a [Venting Post](https://www.reddit.com/r/bpd/wiki/index/flairs#wiki_post_flair_breakdown). 

Please be aware that the OP may not be seeking advice. 

u/mitzychang, if you do not want advice, please specify in the body of your post. 


*I am a bot, and this action was performed automatically. Please [contact the moderators of this subreddit](/message/compose/?to=/r/BPD) if you have any questions or concerns.*",AutoModerator,180ctxx
1,"You know, you have beautifully identified this as a maladaptive coping mechanism, which would indicate that you understand that you're doing the best you can with the tools you have.
You're not a bad egg. You're just trying to survive by any means possible, and while this is hard to understand for those around us sometimes, it's important to realise that they react because they care.

Don't be so hard on yourself. You've got this.",Noswe,180ctxx
2,"Have you done DBT therapy? It can help you deal with your strong emotions and impulses without engaging in the risky behavior. Also, I’m glad you have such a caring bf 😊",Historical-moth,180ctxx
3,Thankyou for this idk why im crying just reading this over and over but thankyou.,mitzychang,180ctxx
0,"Auvelity is the only medication I’ve had that gave me any success in my depression and with my BPD. It’s a new medication and is generally used for MDD, but because of how much it’s helped my BPD I feel like it could really help others too.",Illustrious_Gur_3629,1c6hzwg
1,Effexor. ,Repulsive-Try9065,1c6hzwg
2,I take lomictol which is a mood stabilizer a lot of people with bpd are prescribed. Also lexapro. Both of these things so far seem to help with my emotions and overall mood without having side effects.,Overall-Cable9818,1c6hzwg
3,Thanks for the info!,zedthehead,1c6hzwg
0,"Me too, cant use drugs as a way to calm myself down anymore. I feel like it just getting worse when i do drug. I cant breath, full of anxiety and losing control",Mymychannnn,17aaqv4
0,"
Oh and dont even get me started on how different mushrooms are for me compared to my friends, it's very intense.
Marijuana I smoke heavily, but when I smoke with friends who have smoked the same amount as me for many years, I never feel high when they do.",lillie-the-lillith,zxubgl
1,"It takes me very little weed to catch a buzz. But I can eat xanax like a champ. I don't even feel anything until it gets to the had too many and will be blacking out. (I didn't abuse them on purpose,  i was blacked out before I took 13 of them) My daily meds I don't feel either. I've been on them over 10yrs and so I'm starting to lower the doses to see if I'm ok with less.  Tylenol has little effect on me also.  So, just throwing in my 2 bits, don't know if it helps or matters . Peace",DennyJunkshin86,zxubgl
2,"I did the same thing at 16 with ativan. Took too much because I felt nothing, but was too young to think of it being an actual danger to me. I appreciate you telling me you relate :)",lillie-the-lillith,zxubgl
0,"I struggle with the same fear and I’m so sorry, my mom actually also had and still has a drug problem that caused a lot of my fears and triggers. The problem itself is called lack of emotional permanency, and can usually be seen in small children. In terms of dealing with it, the only thing that has helped me is self assurance. I tell myself that Im not going to be abandoned bc I didn’t do anything wrong and that even if people do leave, I’ll be okay by myself like I was before I met the person I’m referring to. The feeling in my case has never gone away and it’s still a very real fear of mine, but talking yourself down is all that can be done. Just try not to rely on others for reassurance bc even someone promising they won’t leave only temporarily pacifies the problem and after that instance, you won’t stop feeling that way. You are worth not forgetting about and you’re totally justified in feeling the way that you do, always remember that!!",Johnny-Bravooooooo,15puxyf
1,I went through the same thing with my dad. He would call and say he’s on his way to come see me and never would so I would just sit by the window and cry waiting,Goinggoinggone_me,15puxyf
2,"I relate. No drug problems in my immediate family—I think my issue came from being left alone a lot at home as a young child. My dad also always forgot to pick me up at school, so I’d be the last one there and the staff had to stay late and would get mad at me because they’d think I had gotten my mom/dad days mixed up. He’d show up like an hour later but I already felt so forgotten and alone. Then when I got older, I could have basically run away and nobody would have noticed for a while. My parents had zero contact (they’re divorced), so if I was supposed to be at one house, the other would never confirm I actually made it there. My parents were very hands-off, and I actually think that made it worse for me, because I felt like I only had myself to look after my well-being, and nobody else cared. I was the youngest of 3, unplanned, and felt like my parents had given up on parenting by the time they got to me.



Now when I feel like I’m being forgotten, even in the most minor way, I get triggered and flip out. I feel like a neglected child again. I’m sorry for your pain, OP.",Peachntangy,15puxyf
0,What strains are you smoking? Stay away from Indica‘s. They will couch lock you. Stick to sativa. I use it every day but only to alleviate immediate symptoms. I am still able to function… Although I do like my caffeine also. These are my only two “drugs”.,,vdiebd
1,Weed can be helpful for certain things like anxiety and such but u have to be very careful of moderation for ur health I used marijuana multiple times a day for five years and eventually developed the cannaboidal syndrome or whatever it’s called I had never even heard of it before I was actually hospitalized and I didn’t believe it was true for the longest time until it almost killed me drugs r a hard thing to evaluate and can make things worse depending on how they’re used finding healthier coping mechanisms and ways to spend ur time can help ease the boredom and make it a little easier to use less but I’m sorry ur going through this cuz I understand it can b very difficult,shortstuff43,vdiebd
2,What drugs are you on? And is it daily use? Im on STIMS but I designate certain days to use them...Any hobbies or things you loved to do as a kid that could fill your time? Nothing to do is a big trigger for me to engage in drug use...,,vdiebd
3,Wait never mind lol you said weed and STIMS. But any other substance that could be causing  non-productiveness?....,,vdiebd
4,Yeah I fucked fentanyl that shit ruined my life,lookingtobefound,vdiebd
5,[deleted],,vdiebd
6,Hybrid. It's the only one I've been able to find here. It's called Amnesia Weed.,pinkmor,vdiebd
7,For this week I’m smoking CBD to calm down before sleep as right now I’m feeling like pure shit,pinkmor,vdiebd
0,"This post has been marked as a [Venting Post](https://www.reddit.com/r/bpd/wiki/index/flairs#wiki_post_flair_breakdown). 

Please be aware that the OP may not be seeking advice. 

u/YamOrnery6686, if you do not want advice, please specify in the body of your post. 


*I am a bot, and this action was performed automatically. Please [contact the moderators of this subreddit](/message/compose/?to=/r/BPD) if you have any questions or concerns.*",AutoModerator,1472x7w
0,"I was like this. I romanticised my heavy smoking to the point that i realised how i felt like absolute shit after every cigarette was over. It made me feel like i was useless and worn out and overall, like crap. Cigarettes aren't good for us either way. I quit weed. I quit cigarettes. I've reduced alcohol usage so much i feel like a whole new person (much better now infact)",melanoic,146lncg
1,"I’m a recovering addict…did my time…heard someone once say…”if you don’t go within, you’ll go without”…was never any of my business what others thought of me..which is another way of saying…it’s none of your business what others think of you… :/",bonecontender,146lncg
2,"ugh! i can relate to this. i got sober in mid-december but still struggle with things here and there (weed, cigarettes). i was addicted to opioids so it's a far cry, but every once in a while i'll get a little too stoned or have a little ""too much"" fun and get that dirty, ""junkie"" feeling again lol. i still consider myself mostly sober since i was addicted to pills and alcohol, but there's so much stigma that makes it hard for me to even enjoy casual drug use. i wanna be fun and healthy but it feels like my self-conceptualization is either ""boring"" or ""hot mess"". bpd things!",,146lncg
0,"I also just made it to the 100 day mark for abstaining from my drug of choice: cocaine. I got majorly addicted to it over the past summer and it took two overdoses (and nearly dying from the second one) to really get it through my head that I have a problem. Like you, my addiction was my coping mechanism. Dealing with the withdrawal has been hell on earth, but I am better for it and I’m able to pick up on my own borderline personality cues in order to try and catch myself and prevent emotional damage to my loved ones.

I’m proud of you, from one Internet stranger to another.",Terra_117,lm76mq
1,"Your English is fine

Congrats! That’s awesome",permthrowaway20,lm76mq
2,"Thats amazing! I am so happy for you! I am also in recovery (13 months sober) and it has improved every area of my life, but I couldn't have done it without help for my mental health :) we are a bunch of self medicators aren't we! Really well done!",toscata,lm76mq
3,Good for you! I am 98 days sober from alcohol today. Very proud of your hardwork!,1OO_,lm76mq
4,"I spent about 10 years abusing alcohol, heroin, cocaine, benzos, meth, you name it just to exist. It took me a long time to even care enough to want to stop. It’s frustrating seeing people who haven’t experienced themselves preach about it. By the height my addiction, when I was using needles for everything, i wanted to be dead and felt there was nothing to get better for. That is how most addicts feel. Fuck opiates though......they are the most evil. I’m so glad to read that you made it to 100 days. Soon it will be another and another.",salazarsmistress,lm76mq
5,"I’m trying to quit my weed and methadone addiction, but I’m not successful so far.. I just can’t be sober, cause then my self hatred and frustration just ruins my life.",Lammetje98,lm76mq
6,"I’m still in my drug use, but this is so inspiring I hope I will be where you are some day!",mamasalttt,lm76mq
7,"Thanks for posting. I've been thinking a lot about my drug use. While microdosing has been helpful, I'd really like a break from all drugs. I appreciate the insight.",shallowandpedantik,lm76mq
8,Good work! And knowing you have BPD should be useful information too!,ConflamaLlama,lm76mq
9,Super proud of you! BPD sucks ass and so does getting sober. You should be genuinely proud of yourself and your english. ☺️,drugstorediet,lm76mq
10,Fuckk yeahhh,imsodonewithmyself,lm76mq
11,"Dude, your English is good. In fact it’s better than that of most Americans, sadly!",Open-Chain-7137,lm76mq
12,"That's an amazing achievement, well done!!

I'm loving success stories like this. Knowing that things can get better, and we can learn new ways of coping and managing.

Thank you so much for sharing!
❤❤",,lm76mq
13,"Thank you, I needed this today (alcohol is my vice). And congratulations, that is so huge. Getting off opioids and benzos is notoriously hard. You’ve moved mountains!",Live_Pen,lm76mq
14,"I am so proud of you for standing strong in your sobriety!! Also, you don't need to apologize for your English– this language barely has stable rules, haha.",,lm76mq
15,Keep up the great work,Kiki-its-Kiki,lm76mq
16,Wow! I am so proud of this! What an accomplishment! Congrats ❤️,Starshine-04,lm76mq
17,"That's such good news, keep it up and keep motivating by these post",OD07ME,lm76mq
18,This is amazing. I wish I could do that,tanis6lee,lm76mq
19,Right on!,milkndoobies,lm76mq
20,Well done!,AgentKnitter,lm76mq
21,That’s awesome!! *takes a dab*,,lm76mq
22,Congrats! Keep on going one day at a time! ❤️,gentlywithachainsaww,lm76mq
23,I’m so happy for you!!,ForgetfulWhale_2304,lm76mq
24,"Thank you for posting and congrats! I’m proud of you. I’ll be rooting for you. You deserve happiness! 

Also your English is way better than you prob think. :)",,lm76mq
25,That’s incredible! So proud of your accomplishments the last 100 days. Keep it up! ❤️,austinjames2015,lm76mq
26,Bravo!,RMW91-,lm76mq
27,"Yay!! Congratulations!! I'm so proud of you! That is no easy feat my friend, you are a bad ass!",angnichoo-meow,lm76mq
28,"Great English btw, Well done though genuinely. Keep it up, and be proud :)",Tinbot2,lm76mq
29,"Yay, congrats! You're nailing it! I'm on the same ride. I genuinely felt that I couldn't go on without any kind of substance and here I am. Alcohol and drug free. Looking forward to make it a one year score. The only thing I regret is not making the decision sooner.",Astromina,lm76mq
30,Amazing 10/10 proud of you,,lm76mq
31,That's so amazing. I've watch very close family struggle with substance abuse and I've seen them recover. I can't imagine the strength it takes to stay clean and healthy while working through the things that got you there to begin with. I admire your courage and determination.,,lm76mq
32,"I'm so happy for and proud OF you!    


Congratulations!  Keep going and enjoy it!",tadams2tone,lm76mq
33,HELL YEAH BROTHER,itzYaBoi90,lm76mq
34,Das ist gut english.,Lildrummerman,lm76mq
35,I’m really proud of you. Makes me want to step back and examine my own drug use.,compassdial,lm76mq
36,Your English is great and well done buddy! We so often self medicate with drugs but it’s a dangerous spiral to the bottom. It never leads any where good.  I wish you nothing but the best!,Mvg888,lm76mq
37,"I'M SO PROUD OF YOU!! that's amazing!!! 

sobriety is extremely difficult, you're a very strong person <3 wishing you only the best and remember: it only goes up from here \^\_\_\^",panzerrrwolf,lm76mq
38,"Cocaine was my self medicating drug of choice, not really a good choice in the long run. You get away with it for a while but it will get a hold of you. The mistake people make with cocaine is that it feels so good and people think they can be the one person who can maintain a casual use. You can’t and as I said and I’m sure you know, coke will get you eventually. Not to mention how you feel like absolute dog shit for days after. I cringe thinking about it. Stay strong! I’m happy for you!",Mvg888,lm76mq
39,Well done,AgentKnitter,lm76mq
40,Thank you!,bleybleybley,lm76mq
41,Likewise.,hch1111,lm76mq
42,"Interesting. I am tapering from methadone. From a very high dose I was on for 2 years to get me through 2 years of surgery with no anesthesia (during procedures nor to take at home- all because I was addicted to pain pills- apparently it only matters to ME that I’ve been sober over 6 years of my drug of choice: oxy.

But I wanted to share this, and if I get any feedback I’ll make a post about this later... but I am, in fact USING marijuana (my medical marijuana edibles that are potent indica) to cope with the physical and sometimes harrowing mental symptoms that come with tapering off methadone.",Trash-Secret,lm76mq
43,"Hey, thank you dude! That really means a lot to me and gave me a lot of confidence!",bleybleybley,lm76mq
44,"Thank yourself on this one mate, it’s all you!!!! :)",permthrowaway20,lm76mq
0,I’ve done/do my share of drugs but the ones I will NEVER do are psychedelics! I know a lot of people do them to help depression and what not but I knowwwww that with my anxiety I would put myself into a bad trip. But honestly it’s really best to either be sober or stick with weed/alcohol if you can control it. Addictions straight up ruined my life lol. Idk if I would say my bpd dx really effects how I react to certain drugs but I know my other dx have an impact !  Whatever you do stay safe !:),disappearing-c,unffm6
