,Comment,Author,Post
0,ive been a drug addict for as long as ive had bpd. i stopped doing pills but i still smoke weed even though i shouldn't. drugs make me behave poorly and make my mental illness worse,i_hate_sex_666,1bru59s
1,"I'm a bit addicted to cocaine, which started in casual hook ups with people. I'm moving back home with my mum soon as I'm just getting more addicted and don't know how to stop it, I'm awaiting an ADHD assessment as well.
About 50% of the time i use it I end up with horrible anxiety, which feels absolutely awful. I've also ended up calling the samaritans (charity helpline who listen to calls in uk) after using as the anxiety has been so bad. It's a rabbit hole I really wish I hadn't gone down :(... but moving so I'm not living alone should really help",Upbeat-Comfortable43,1bru59s
2,"I don’t recommend hallucinogens based on your mental health symptoms.  They can be great for some people, but if you’re already prone to mania and paranoia, there’s a really high chance of having the worst 8 hours of your life.  I did it and it permanently fucked me up, leaving me with a lingering existential horror that I’ve mostly overcome but not completely.  Psychic trauma isn’t fun.",bloodyvisions,1bru59s
3,"I had an addiction to coke and ketamine for a while, but I'm back to being a weed smoking alcoholic 🫶 I tried everything I could possibly score, but coke and ket were always the main ones- and it really fucked up my life and mental health for a while. Do not recommend.",1ashleyr6,1bru59s
4,"I regularly do a variety of drugs, i test them, im careful with dosage, c, k ,m, L. No pot

I take supplements to help regulate my nutrition and happy chemicals, 


I have no other options at the moment. When im sober for too long i start ping ponging between killing myself or others. Easy access to healthcare would go a long way. Whatev. Street drugs it is 💃",_-whisper-_,1bru59s
5,"I only smoke weed but I’ve been trying to stop. If I’m really strict I can quit but it’s hard not to use it as a coping mechanism. My psychiatrist wants me to stop because they haven’t done long term studies of it combined with my meds (which I assume is accurate to most of those medications) 

I also find that smoking is a wild card for me. Sometimes it relaxes me and other times it makes me paranoid and more anxious. So I personally have been trying to quit. I didn’t smoke last night which I’m really proud of. Especially cause I usually causally smoke every night",MeanGreenMother1986,1bru59s
6,"i’ve always been curious about pushing the limits of my addictive personality traits. ive tried cigarettes and it never stuck. then towards the end of 2022 i started abusing valium (50mg a day) and alcohol and lost chunks of my memory. i ran out and never really felt the need to do more. 

the following summer, i started smoking a lot more weed and taking edibles. then i was offered cocaine. and the rest was history lol.",Swimming-Finance-927,1bru59s
7,"I smoke weed every so often. For me it makes my thoughts rather dull for a bit and it's just really soothing for me when life finally gets quiet for a bit. It doesn't always help to self-medicate IMO, when my really bad time hits I have a rule that I can't smoke 'cause damn it really can make it hard for me to regulate. Some days when it's at the cusp of changing though, it's okay, I can get ahead of it just before it hits and I feel everything slipping.


I'm allowed to use it when I feel good, it's not allowed when I'm not. I'm not always perfect at it, but it's become a nice way to have more control in my life.",NegativeBeing8287,1bru59s
8,Comin from some1 who is goin thru withdraw from meth n heroin id say stick with the mild stuff cause otherwise it gonna make ur bpd worse,MoxieMashed,1bru59s
9,"Im far too paranoid to take drugs, although I’ve wanted to at times. And, I’m also fully aware at how susceptible I must be to addiction. I’m desperate to feel good, so I’d be fucking my self over",septerpride,1bru59s
10,"weed do nothing on me and I never wanted to try anything else, but I only sleep well when I drink alcohol and smoke some regular cigarettes... I already told my psychiatrist and therapist but they doesn't seem to care",sushicomcerveja,1bru59s
11,"I smoke weed, but I want to try psilocybin. I have also done spravato which is basically medical ketamine for depression.

My thought processes is fuck it, weed let's me smile. Spravato helped me change my mental processes",FeliksthePirat,1bru59s
12,Drugs makes everything so much worse for me. I can't have a healthy relationship while doing drugs.,icyteardrop,1bru59s
13,[removed],,1bru59s
14,"I used to do hallucinogens a bit more than I should’ve, and while it could be fun, a lot of the time it led to severe breakdowns and crazy lows. I now just smoke weed on occasion and drink even less, it seems to help keep me from numbing myself and/or having worse breakdowns",That3mo0verTh3re,1bru59s
15,"I’ve used marijuana since I was 17 (now 27). Virtually every day. Never had an issues besides the classic smoke too much for the social function you are going to lol I have had bouts with abusing adderall tho and I’m an alcoholic in recovery. Alcohol was my go to to ease any anger, anxious thoughts, nerves, etc, however it eventually became not as fun and just made me get mad/annoyed all the time at my wife. At the end of the day booze triggered a lot of my bpd symptoms that I was unaware of until getting diagnosed and medicated for bpd around 4 months ago. No issues with any other drugs than adderall and alcohol, though I have tried Molly, coke, acid, and I still do shroomies every once in a while",tyzaginger,1bru59s
16,I've been abusing pills for a while now.,BulkyAlternative9509,1bru59s
17,"I think of it like this: ecstasy = mania on purpose. LSD = psychosis on purpose. I’ve done both several times and had lovely experiences, but I’m also acutely aware I’m playing with fire. Although I personally have had mostly pleasant trips, I once did LSD with someone who had a psychotic break and became violent. So be very, very, very fucking careful. Even with weed tbh.

If you decide to try anyway: 
- only do it with someone you really trust (ideally someone who is more experienced or more sober). 
- Look up drug interactions if you’re taking any medications. 
- TEST ALL POWDERS AND PILLS FOR FENTANYL AND XYLAZINE
- Be aware that ecstasy will make you feel incredibly shitty and depressed the next day. 
- And have an emergency plan!!!! I cannot stress that enough. Decide in advance what to do if shit goes left (i.e., overdose, psychotic break, panic attack, suicidality, paranoia, etc). Make sure whoever you’re with knows the plan too.",rufeelingitmrkrabz,1bru59s
18,"honestly i’ve done it all. hallucinogens have done a lot of great things but have also had some not so great things. mdma, aka ecstasy, is my favorite by far in the right dosages! i generally have a higher tolerance for things though and i think that’s always helped me ease into these things. if you do plan to. take anything i highly suggest a plan in case things go worst case scenario. i’ve been out in city’s when i had real bad trips and i shouldn’t have been honestly. 

long story short. plan out for the best and the worst. they can be great in some cases and not so great in others. everyone is different so don’t base your doses or expectations off anyone else! be safe and have fun 🖤",Critical_Shirt4221,1bru59s
19,"As a certified ADHDer, cocaine doesn't really do anything for me/us. It certainly doesn't make me anxious, but it doesn't really make me euphoric either. Just calm and kinda awake like a big cup of coffee. I find it hard to see myself ever getting addicted to this drug because it's just an underwhelming experience overall.

Not a doctor, don't take this as medical advice, but a lot of ADHDers have similar experiences with it.",HoldingMoonlight,1bru59s
20,"I have the same issue. I'm trying to get off it, but not faring too well. It's feels like I've replaced one addiction for another. If you fancy support or a chat anytime, hit me up. I'm also in the UK.",Solid-Society-5940,1bru59s
21,[deleted],,1bru59s
22,"Agreed. I have very bad depression. I mean when I’m going through it, I‘m going through it. Last time I did shrooms, I did them alone. Bad choice. I was already fighting my depression the first time I did it with someone there. The first time I did it was really good. I had a friend there with me. We both have BPD actually lol. I didn’t know at the time though that either of Us had it but yeah it was fun. We both were chill artistic people and she was more of a hippy type than me but we shared that sentiment. So it was a deep and freeing experience. We danced all night and made art. 

Unfortunately during the second time I took shrooms, I was alone. I was forced to face my own subconscious all by myself. One of the main themes was fear of loneliness. Dying alone. Getting old and dying alone. Being a miserable old woman with nobody in her life. Though was more focused on not having friends. 

If I took shrooms again now alone, I’d be very depressed still. They say small amounts of shrooms taken during the day can help with depression. So I’d suggest a small amount rather than the larger amount just to get really high. Start small and see how that feels and then go from there maybe. I don’t even like smoking weed anymore. It just makes me face reality in this very dark and pessimistic way. I’m good lol y’all have fun tho.",Candi-Bo-Bandi,1bru59s
23,"Not just 8 hours, if you take hallucinogens when you're even passively suicidal, something like ego death could be lethal. They're magical things, but you absolutely have to be in a stable place for a while before you go there (and do so with someone experienced).",busigirl21,1bru59s
24,What do you mean by existential horror?,Sensesflow,1bru59s
25,"fun fact, dbt helped me cope with being on lsd and not get distressed",fubzoh,1bru59s
26,"If you get anxiety from smoking, I recommend only smoking indica vs sativa. I smoke occasionally (like once every couple months). Sativa gets my anxiety and paranoia going, where indica relaxes me...but makes me couch bound with munchies lol.",lsant1986,1bru59s
27,"and make sure you have a friend who's larger than you who can help hold ya down if need be . 

seriously tho , remember that you're gambling with your brain and you can cause permanent damage .",TheNewestCat,1bru59s
28,"Hey thanks, same goes for you!",Upbeat-Comfortable43,1bru59s
29,How long have you been addicted?,Solid-Society-5940,1bru59s
30,"I don't think the anxiety comes from the cocaine directly. It comes from the fact I have bad anxiety issues, and so I start to think i might be having a heart attack lol. I'm very intolerant to nuts but I'll try the others thanks",Upbeat-Comfortable43,1bru59s
31,It’s hard to describe.  There’s an incredibly violent entity out there with a voice like broken glass being poured into a cement mixer who tells you horrific truths about the nature of existence and once you hear them they always kind of live in the corners of your mind.,bloodyvisions,1bru59s
32,Yeah I’ve tried both and they both make me anxious lol I think I end up smoking way more than I’m supposed to. I also smoke carts so I’m sure that makes things way more intense,MeanGreenMother1986,1bru59s
0,I agree with you. I always listen to music. When I leave the house bose soundsports. All day. Bpd makes it better. One of the only benefits. Helps my anxiety as well.,StatementEast8247,16i111k
1,bro sometimes when I’m listening to music during an episode I straight up transcend space and time,mathlete_4_lif,16i111k
2,"Music does release dopamine, and before recordable/replay-able music technology was invented in the last hundred or so years, the only way to listen was to have someone play a song for you or play one yourself. Now we have on demand thousands of songs to choose from which didn’t exist for the majority of human history",No-Turnover8128,16i111k
3,It’s the same for me. I write music too and I don’t even know where it comes from. It just comes out of my head. It’s like a language I can understand and speak intuitively. Some people just don’t feel the same. Some people don’t get chills from certain melodies. I find that sad. I don’t know what I’d do without music.,Peachntangy,16i111k
4,"music has been my lifeline my whole life. Ask my mother who knows all about Amy Lee because Evanescence single-handedly got me through the trauma that actually gave me BPD. 
I am either listening to music, singing music, humming, or dancing to music in my head. (I'm also autistic so that might contribute to that as well as having special interest bands.)
But I know exactly what that feeling is. It's almost like you're having a mystical experience. It's as addicting as drugs for me. I couldn't live without it.
It also helps me process my emotions. I feel like I'm really bad at intellectualizing my feelings instead of feeling them, so when I listen to music it allows me to internalize them and process them which is why I usually cry a lot when I listen to music.

My current special interest band I have been listening to non-stop is Lacuna Coil. I've loved them since I was in middle school and I'm going to their concert for the first time in October! (Yes I have been to an Evanescence concert) [also both of the lead singers are reasons that helped me realize I was gay] {sorry this is getting way out of topic but I just can't help the chaos}",danskmarais,16i111k
5,"My only guess is that we’re more sensitive and imprintable than the average person. That maybe combined with rapidly shifting, unstable emotions and a tendency to idealize things makes it so music has a enhanced effect",NoahDC8,16i111k
6,"Idk but music can make me feel utterly invincible or put me into a depression. I’ve had car rides where when I start out I’m pretty neutral (basically the empty feeling) as it were or maybe even in a good mood but if one “sad” song or even if a small part of a song is “sad” eg a chord change, a lyric etc comes on then when I get to my destination I can barely function. Don’t wanna’ talk to anyone, all my energy has gone, could possibly become suicidal and I just wanna’ go to bed in a dark room and this can go on for hours. 

Conversely I’ve been into store with my AirPods on for like 10 minutes and an upbeat song will come on my playlist and my thoughts get so grandiose because honestly I have to listen to music when I go in the store ‘cause I get too anxious otherwise but yeah the “happy” song comes on and it’s like I start making all these wild plans in my head of what I’m gonna’ do, how massive tasks seem so easy. 

Sometimes because I’m out and I’m at the stores that one “happy” song can make me go on a spending spree that I don’t want to do and know I can’t afford but the feelings are too much but then of course I take the music away and I’m back to being well, depressed then pretty much because it’s like being on a come down and it’s ducking awful especially if I’ve spent excessive amounts and then I have to go about trying to sell the stuff I’ve bought. 

If other people are playing music, especially loud music I get anxious because I KNOW it’s going to change my mood drastically but I’M not in control of it and it scares me. 

I use it to regulate my emotions, to desensitise, to give me an identity (I play some instruments). Anyway that’s my story about music.",1HeyMattJ,16i111k
7,I feel you on that. Whenever I listen to my music I feel like I'm going into like a fantasy battle.,RustyRose42069,16i111k
8,"No idea the science and I didn’t even know it was a BPD thing until I read your post. How does one come to know that we experience music differently or more intensely? I can totally see that being true tho don’t get me wrong. Music can be very intense for me, and it does sometimes hit like a drug. It can go both ways for me. A song can make me feel untouchable and over confident. Another song will make me break down and bawl my eyes out for an hour. I think that can happen to most people with a powerful enough song, but I do think it happens to me more often, more easily, and more intensely for sure. Makes sense since we are neurodivergent, are we think and feel things differently than neurotypical people.",Arbornaut,16i111k
9,"Music is the only thing that stimulates the whole brain at one time rather than just sections. Different frequencies effect different regions, but still, the whole brain at once. This is why sound therapy is so amazing. So, it could replicate drug like sensations because it’s activating similar areas releasing similar neurotransmitters like dopamine (the pleasure hormone).",FriendTop6736,16i111k
10,"I don’t have answer and I don’t have bpd (traits of it) but I’m happy to see I’m not alone 
Music saved me so many times",chris_hrystyna,16i111k
11,"Music feels like drugs. Drugs feel like music, wonderful and emotive and feelings filled positive and negative. Depression and euphoria, I agree.

But for some of them (stims) the comedown to them just feels like really fucking hard crappy reality.",trans-fusion,16i111k
12,"I also have always been drawn to music since I was young. I love singing, I used to tell my parents I would rather sing to people than talk. If I don’t listen to music I can start drifting into a really depressed phase. A good song will give me chills every time.",shrekswife,16i111k
13,"I listen to music almost 24/7. It’s so good and I love singing and dancing along. It’s really been the only non-therapeutical or pharmaceutical thing that’s helped me immensely. Especially when I just shut my eyes and hear all the instruments, the vocals. Mmm so good!",Songoftheday42,16i111k
14,"Did my science fair project in highschool on the effects of different genres of music on the brains of folks in varying age groups. All ages love music, tempo is a uniting factor in how things make us feel, but genre is often a defining generational difference (all pretty common sense). I listen to music for at least half of my day, if not more, and only because I don’t wear headphones at home so I can “talk” back at my cats when they meow at me. 

I think part of it is how huge our emotional capacity is and how empathetic we can be, so we feel the words being sung more deeply. I think part of it for me is that music makes me feel specific emotions I have a hard time explaining, so I can use music to communicate. It always sucks when I show someone a song and they don’t care for it. :(",rosiesunfunhouse,16i111k
15,I don’t know the scientific reason behind it but I am absolutely the same way. It makes me feel so euphoric. That’s the best word I can use to describe it but it truly feels there’s no words good enough to describe the feeling. It’s bittersweet,EastMedium9408,16i111k
16,I experience Musical frissons like crazy !! Goosebumps all over and ecstasy feeling,Gothpos,16i111k
17,I legit haven’t listened to music since being on medication. It doesn’t have that power for me anymore,Individual-Cheetah85,16i111k
18,"Music isn't shit to me ninety percent of the time, so I don't know about the ""we"" thing but hey, ""we"" are all different.",boris_the_executionr,16i111k
19,"BPD is basically emotional dysregulation due to past trauma, that is cumulative or acute abuse and neglect. There surely is a neurologic component as neurons that fire together, wire together.

Any disregulated feeling is experienced at a stronger intensity and this includes feelings music creates in people too so this is perfectly normal for a pwBPD.",Brightmist,16i111k
20,"Damn I thought it was just me, but music plays a powerful role in my life

It helps me stabilize my mood, lift me up, help me relax

I also tend to associate certain times in my life with specific songs I listened to",secks_see_guy,16i111k
21,Until you get up to 400 mg of Lamictal,Equal-Bat-861,16i111k
22,"'Strehlow and Lindner [17] found that some individuals with BPD utilised music as an emotionally protective tool, whereas others avoided music altogether due to the emotional vulnerability felt when listening to music. Kenner and colleagues [18] found that participants with BPD were emotionally overwhelmed by music and could identify this state as being connected to their BPD.'

There's a whole article about correlation between music and personality disorders on National Library of Medicine but I found this paragraph might be considered a valid scientific research.
:)",spierdalaczka,16i111k
23,now that you said it... the only people who I know that feel the way I do about music are also BPD lol,dianamaximoff,16i111k
24,I can’t listen to “sad” music if I’m in any sort of episode because of how much it affects my mood,kitty__81,16i111k
25,Listen to lateralus the album by Tool during an episode and come back to me.,No-Protection3185,16i111k
26,Yes! Listening to piano music does something wild to me. I listen to it daily.,Jiujiu_,16i111k
27,"Emancipator is an amazing band for this. 

But this song always does it for me: [Just listen](https://www.youtube.com/watch?v=dzNvk80XY9s)",SleepySpaceBby,16i111k
28,Music singlehandedly changed my life with BPD. I DJ now and theres no going back. Really switched up the narrative for me in terms of getting well,,16i111k
29,for me its because im autistic as well as BPD and my autism makes me experience sensory a lot differently and intensely,shatteredsuffer,16i111k
30,Music seriously lifts my brain into outer fucking space it’s amazing,starfox1o1,16i111k
31,I'm constantly listening to exile by Taylor Swift because i need to detach from my fp who dumped me 3 months ago. If i can just let my mind and body detach i know i can make a full recovery.,tealeavesladybird,16i111k
32,Words.,PlantManiac,16i111k
33,Music is my life lol,,16i111k
34,Nah music makes me feel sad. Thus i dislike it,Aedemon137,16i111k
35,Wait i didnt know this was a bpd thing i thought I just loved music that much omg,pinknymph,16i111k
36,"I’ve been listening to music basically constantly for weeks on end, it helps me a lot. Usually a song a day on repeat right now, but sometimes mix it up. Today is Placebo - Beautiful James and Placebo - Sad white Reggae.",g2caf,16i111k
37,Idk but for me music is pure bliss its what gives me the most beautiful emotions even the bad ones when im listening to music it feels like theres an apocalypse and nothing matters and i notice it can even have bad effects on me like i get more reckless take bigger lines take shots faster when im listening to music,Any-Possible-7836,16i111k
38,"It’s so nice to have some benefits to such a chaotic disorder don’t you think. Some silver linings, and it makes me sad sometimes that other people must live such boring, stable lives 🤣",doccharlie2000,16i111k
39,Try [this](https://youtu.be/Tyr6BelrpgA?si=z_wa3lNFPwVJ-DXt) out sometime and LMK what you think.,,16i111k
40,"There are a lot of people, that aren't able to understand what it means that a chain of chords is capable of making me change my entire mind into a place that I don't even understand, can't explain it, but it's just frikin amazing.",NovaFive_Sound,16i111k
41,how do other people live not being shaken to the core by a fragment of a song?,coolofmetotry,16i111k
42,You might really love The Birthday Massacre.,blessednenus3r,16i111k
43,I love Lacuna Coil!! 😀,Famous-Pick2535,16i111k
44,"You sound exactly like me. I use music to control how I'm feeling. When I'm feeling depressed, music can temporarily fix that for me. If I'm really happy, and I choose to listen to a sad song, then I'm not happy anymore, and I'll be looking at this subreddit because I'm depressed.

""The End of The World"" by Skeeter Davis, makes me get in a sad mood, just after she sings the first words.

People never understand how big the effect is for me, and they get to see when they show me a song, and I'm not in the same mood that I was before listening to it. They never understand it anyway.",NovaFive_Sound,16i111k
45,That’s interesting. What does it mean that you don’t have bpd but you have traits of it,doccharlie2000,16i111k
46,"I think you’re probably right, our empathy levels are higher and that makes complete sense, even if there aren’t any words for the reasons you’ve listed. And yh different genres affect different ppl with BPD differently too, but the effect seems to be amplified from what I’ve heard so I do believe that. And I will probably ask r/neuroscience to confirm this about our brains and the increase in certain emotions due to heightened empathy",doccharlie2000,16i111k
47,"I also like using music to communicate this, I share music a lot to people I think might appreciate it and feel similar (or I don’t mind if they don’t) but I’d definitely say it’s a love language of mine and I just love sharing it",doccharlie2000,16i111k
48,Is frissons a technical term or just some vocab I haven’t heard of?,doccharlie2000,16i111k
49,Has that effected you negatively overall? Or do you find the positives of your medication outweigh the negatives? What meds are u on?,doccharlie2000,16i111k
50,Interesting… would you say listening to music creates dysregulated emotions? I’m not sure I know what you mean,doccharlie2000,16i111k
51,Damn that sounds like a lot 😯,doccharlie2000,16i111k
52,Oh this is great stuff thanks!,doccharlie2000,16i111k
