,Comment,Author,Post
15,"This is exactly my situation also. I never ever saw a problem though, I thought my parents were the best and I was the worst for never being the ""good child"". Only after therapy did I realise that somewhere along the way I lost myself.

I feel resentment towards them, especially because my younger sister has also been diagnosed with BPD and they just don't even want to hear about it. I'm working on trying to forgive them and understand that that is just who they are, I will love them for the good things they do and it's ok if I don't like them sometimes.

Seriously though, it's kind of lame that my upbringing led to BPD, because I highly doubt my parents set out to make me miserable. I think they were trying the best they could",lazerbrownies,5sodep
16,"I began attending ACA meetings in 1991 and was likewise edified... after seven previous years in AA, NA and MA, btw. (For any lurkers here: This is a *great* place to get some clarity, as well as some excellent tools.) ",not-moses,5sodep
17,Thanks for reminding me. Will do. Are the folks over there aware of the books I listed above? You're welcome to bag the list and post it there if you wish. ,not-moses,5sodep
18,"> stopped developing emotionally at the time of the wound. But they tried to keep behaving the way they were back then

Bullseye. Nice way to put it. ",not-moses,5sodep
19,"ACA and those books I ran down above may be useful. Not sure. I've seen a lot of people get a lot of lift-off from them, however. ",not-moses,5sodep
20,"So long as one understands that one is not responsible for one's disease, but is responsible of one's recovery, such data can be highly useful to help lift off the hair shirt of shame many of us wear because we think *we* were ""bad."" ",not-moses,5sodep
21,ACA (in the west) / ACoA (in the east) was a real door-opener for me. Thanks for sharing. ,not-moses,5sodep
22,"Oh, Jeez; I forgot about the ""death stares."" (Just great stuff for little kids, don'tchathink?) Thanks for reminding me. That said, I don't really blame my parents anymore after digging into how *they* were raised. Both were significantly abused in a # of ways by their own. It's truly a legacy of shame handed down from one abusively authoritarian generation to the next. Sigh.  ",not-moses,5sodep
23,"Who could blame you (if they understood what happened)? Adult Children of Alcoholics (they have a website) opened the door to understanding it all for me... and connected the dots between my reactive behaviors and consequences thereof. I'd already quit drinking and drugging by the time I found ACA, but gave up some other dysfunctional behaviors after that, including a fierce sex & romance addiction.  ",not-moses,5sodep
24,Love your post-religious existentialism. My parents were pentecostals. I got into... and the OUT of the cults (see [this](http://pairadocks.blogspot.com/2016/08/understanding-co-dependence-as-soft.html)) to which I had been socialized and normalized as a child. Codependent creepiness... and *full* of BPD. ,not-moses,5sodep
25,Further confirmation. Thanks. ,not-moses,5sodep
26,"YW, OC. Stay in the hunt. Knowledge is power. ",not-moses,5sodep
27,"This is great, thanks so much! ",lampworkz,5sodep
28,"Thanks! Appreciated. I'm currently reading/working through a book called Thoughts and Feelings, I forget the authors. It's a cbt self help / workbook with exercise sheets and stuff to fill out. I find it very useful because it really drives home understanding by getting you to give x examples and examining them in detail. Limited thinking and feed back loops, you know. Thanks again :-)",,5sodep
29,"For what it's worth, upon looking back I did have a very turbulent and troubling childhood. Stepdad seemed to get off on humiliating me. Mom worked three jobs. Stepdad started putting hands on every once in a while, until I was old enough to hold my own. My whole family as far as we know, were abusive hillbilly alcoholics who did physical, emotional and sexual abuse. My sister was a dancer. My uncle was a coke dealer. My cousin was a drug addict. Very unstable surroundings which built up a strong fight or flight response and thick skin to the point of being emotionally slow, and uh I do stupid shit for excitement and to pass time. Which could literally end up in me serving time. Shrug. 

",,5sodep
30,My cousin regularly got his junkyard dog Samson to attack me when I was in elementary 1-4. Stepdad smacked me up like the red headed step child I was. I couldn't say about how attentive my parents were factually but she tells me I was God's gift to her and him. Don't know if I'm even sharing proper info.,,5sodep
31,"I'm Aussie and we just call it ACOA, I didn't know there were different abbreviations!",starla_,5sodep
32,"Sorry, I didn't keep in mind that my comment was triggering. I blame mine, they had as much free will to act nice as I do to act like a monster. They choose for themselves.",,5sodep
33,No worries. ,Have_A_Nice_Day2016,5sodep
34,"YW, OC. There are well over 100 workbooks out there now that I know of. Most published by New Harbinger and Guildford Press. ",not-moses,5sodep
35,"You're doing fine. If you're interested in digging out of the effects all that abuse left you with, [ACA](https://www.google.com/webhp?sourceid=chrome-instant&ion=1&espv=2&ie=UTF-8#safe=off&q=adult+children+of+alcoholics)'s not a bad place to start. Great book, pretty good treatment program, costs next to nothing. ",not-moses,5sodep
36,"Re: triggering. No problem. Stay conscious and mindful of that (totally understandable) rage. Once we get a steering wheel on our anger, we've got the fuel to get out of the rat hole. ",not-moses,5sodep
37,"Ive saved your comments. Again, they're appreciated. One of my biggest complaints is there isn't enough material out there but you've fixed that problem. Thanks again for pointing me in the right direction! Hope you have a great night :-).",,5sodep
0,"Deeply sorry for your loss and suffering. It’s beautiful that you remained good friends with your ex for so many years. The only thing I can offer about the grieving process is that drugs won’t numb it either. You’ll just be throwing away years of sobriety. 

I agree with Rude_Bobcat4501, one of the best things you can do to lift yourself is to be of service to others. Volunteer at a soup kitchen, help people learn to read, etc. This will distract you from your pain for many hours of the day, plus boost your positive endorphins. Plus, you avoid feeling bad about yourself for relapsing. 

Wishing you peace and comfort during this difficult time.",Chloe_Bowie4,v7gp7t
1,"Man, reading this brings me to tears. I’m terribly sorry for your loss. You’re amazing for reaching out, seriously I wonder if I’d have the same courage. I don’t think there is any advice I could state that will bring you peace. But I think you should look into Greg Braden on YouTube and a host of others. I just think some of his material could help shed some new perspective and maybe provide some peace for you. I don’t know you, but I care about you. I can’t reach you or I’d give you a hug man. I can’t relate to your situation but maybe honoring yourself may be a form of honoring her. May the light she brought to you show you the parts of you she loved so maybe you can love them as she did. I’m spitballing here. But my heart is with you, my condolences, and my hope that when all around you seems dark and you feel lost that instead of anchoring in being lost you remember to take a step. Being of service to others can be extremely healing as well, if you can find the motivation in time that may be of benefit. Much love man!",,v7gp7t
2,Thank you for your kind words dude. I will check out the guy on youtube..,CosmicCharlie86,v7gp7t
0,"I used to think like this. I really mean it, I thought I'd fucking die without drugs.

Turns out it's not true, in fact, life is boring with drink and drugs. You limit yourself by doing them.

Edit: I realise you don't ""do"" drink but you know what I meant. ",,8t178p
1,"Yeah, it is at times. I am not entirely sober, I cannot say I am entirely there yet. But I am getting there. I have lived with BPD stuff a long time. I have lived a wild and crazy life, truly. Don't you ever get tired of interesting times?. It is like being trapped in the carnival for years. I get sick from the rides now, cotton candy is not real food, and I would like to see my reflection in a real mirror and not a funhouse, just once in my life. It stopped being fun, actual fun and not forced frantic fun, years ago. I am not out yet. Whoever built it does not want people to leave, like a fucking maze finding the exit. Sometimes I wonder if there is an exit. But I found a spot near the edge of the park, away from the amusements. It is almost peaceful, and all I want these days is some goddamn peace.",gurneyhallack,8t178p
2,"Wow, I wish I didn't relate to this as much...",,8t178p
3,How else are you gonna live with your heart is dying at all time?,wcube12,8t178p
4,I miss mdma,,8t178p
5,"I don’t miss drugs anymore, you’ll get to this point too, trust me. ",,8t178p
6,"It is a little bit, I guess. But after I was so hungover at work that I literally slept under my desk, I came to the conclusion that I would rather have a peaceful, boring existence than live in my usual, constant state of ""what the fuck did I say/do last night"" anxiety. It's been about 6 weeks since that night I got shitwrecked, and I feel so much better for it. I still have one or two every now and then, but my tolerance has gone down so much and it's almost like a switch flipped after that hungover morning - my body doesn't even enjoy the feeling of a slight buzz anymore. Or maybe I'm getting old, who knows..",,8t178p
7,"If you can get into meditation, it can be better than drugs. Like LSD and MDMA but you are more in control and can end the trip or increase it at any moment. I really am not kidding. ",,8t178p
8,"It is as first but after a while, it doesn’t feel as boring. Hang in there, it gets easier ",,8t178p
9,"I'm missing prescription drugs, i feel you.(i went cold turkey with abilify back in 2016) Idk about drinks, they're not really my thing.",NewWrist,8t178p
10,"I'm not bored sober. I'm just really sad all the time. Why stay sober so I don't die, for this?",howdyhammerhead,8t178p
11,"Honestly my BPD has made sobriety so difficult. I view it as a coping mechanism that I want to think is helping me. It starts by my impulse kicking in when I don’t have my fix, I spend money that I barely have to stop feeling so miserable, which essentially makes everything worse as I begin to stress about the money afterwards. It’s an endless cycle that I’m just throwing myself into and it makes me want to choke. ",gravmi-a,8t178p
12,Then I would retort that you've not experienced much of life yet.,cluelessclod,8t178p
13,"I have moments thinking about that too, and yet the further I've left substances behind the more I'm enjoying my own personality.  There is magic on both sides, and those of us who have the tendency to abuse substances often seem to speak a deeper desire that we want to not be dependent.  There is something comforting about going without, and believing I know things many other people do not about what I saw when on drugs.  I like the confidence and simplicity of relating to my sober self.  I have to remind myself often that this is a hero's journey.  Good luck.",maximumrelief,8t178p
14,This is an accurate description.,RealGoldVHS,8t178p
15,Yea but that fucked me,orangealiensmiling,8t178p
16,"I have eaten so much of the stuff, it hardly affects me at all. ",,8t178p
17,"Like...how??  I'm meditating but don't feel I feel anything different doing it. It's really a struggle and don't feel I get anything back from doing it. I don't know how to get positive effect from meditation. It's just boring for me.  


I miss smoking weed. ",plusoneday,8t178p
18,"Do you mean your prescribed meds in general, or addiction to prescription drugs?",,8t178p
19,You have no idea what I've been through ,meansertralinequeen,8t178p
20,"I feel put off thinking of how I felt during the last times, drove me psychotic. But now ive lost the fucks to give, but it'd make me a vegetable so I can't",,8t178p
21,"I was the same way. a guy was pushing me to keep doing it. It just never worked for me. Just felt like i was wasting time, which would give me anxiety cause i would think i should be doing something. 

Then someone told me about an app called myNoise, its a program that allows you to customize different noises and sounds from sci-fi to nature walks to just white noise. 

I found that if i would just lay there, headphones in, eyes closed, and listen to the sounds, they are very detailed and vibrant. I would try to not judge anything about the experience, i would allow thoughts and judgements to come up but always, bring my awareness back to the noise. After maybe 10 minuets, honest to god, i felt i has ascended, above my thinking, above my emotions, it almost looked like if you have seen the movie Dr Strange, kinda like the dark dimension. I actually credit that first moment of true meditation, with me still being alive today. ",,8t178p
22,"general, just the med itself.But i'm fine with chain smoking nowadays.",NewWrist,8t178p
23,True. But I am willing to bet there are things you haven't been through yet. ,cluelessclod,8t178p
0,"Even without BPD, ecstasy/molly usually leaves you feeling pretty pretty depressed for at least a day afterwards. I think you’ll start feeling better pretty soon. It seems like your boyfriend has been pretty understanding. Just be aware of that effect uppers can have, especially when you have a mental illness.",kaycaps,8lp1wc
1,"I’ve had this happen before - felt that same fog, albeit not from mdma. It does sound like you are dissociating or detaching in some way. 

What I had to do was really ground myself, self care and self soothe. Take warm baths, write, get outside alone and walk and just listen to nature, practice some everyday mindfulness. I play the drums, and paint for example. 

Keep doing it. If one doesn’t work, move on to the next until something does. You got this. You can get through this. ",i-am-who-i-am-1776,8lp1wc
2,"I want to help, but I'm sort of a different case than you because I'm a sexually/romantically inexperienced guy. The problem that BPD has caused me is to make me feel so anxious or angry with girls I'm interested in that I push them away. I guess what I'm saying is that I put too much pressure on my romantic interest. If he's that forgiving, then he seems like a good relationship for you, but if you feel like you might be hurting him, then I would say to try to give him more space and to focus on something else instead, like work or school for yourself.

As for the drugs, I've never taken anything harder than weed. Weed imo has been the best for me, as it doesn't cause me to feel down during or after the high, unlike alcohol. Weed helps me to control anxiety and lifts my mood if I feel down. I've also been given one oxycodone pill at a hospital visit for severe pain, but I had a depressive episode when it wore off so they didn't prescribe it to me. Since you don't have health insurance, I hope you can have good people to vent to.",redaelk,8lp1wc
3,"Do you have an addiction to drugs? I only ask because reoccurring substance abuse can be complicated and insidiously intertwined with BPD/BPD tendencies and shame, in which case I can offer insights based on my personal experience. 

If not then I think the feedback already provided by others here is good advice so no need in repeating it.

Best wishes!",feelingsnotIBS,8lp1wc
4,[deleted],,8lp1wc
5,"What really made me feel like I had a sense of control over my BPD was knowing what made it better and what made it worse. After my divorce, I met a narcissistic guy that I was madly in love with. We did shrooms, dropped acid and rolled pretty frequently. Drama with him was effecting my work, the drugs was effecting how I felt about myself and it was also effecting my judgement. I was in an abusive relationship, the drugs made me feel like shit about myself, and eventually I spiraled. Now that I am in a better place, I know that doing drugs and hanging around bad influences are not good for me and now that I've stayed away from things and people like that I can better manage my BPD and MY LIFE. What's worked for me is the DBT workbook \(I suggested ordering one off of Amazon if you can, it's amazing\) In it are ways of managing anxiety and learning ways to ground when you feel yourself dissociating. Everybody is different, therapy might work for you but for me it didn't. This workbook is the only thing that worked for me. I felt that it was very hands on and the examples given were very relatable.",,8lp1wc
6,"I had one rule with drugs and that was nothing unidentifiable as a plant.  Cocaine, pills, and mysterious powders expose you to a long supply chain each one more sketchy than the next.  Then there is the idea that maybe some people just shouldn't do hallucinogens or party drug ever.  I knew that I was already close enough to crazy not to delve into those waters.",,8lp1wc
7,"I love the high of MDMA but the next day is so tormenting I haven't rolled in maybe a year. I know some people who can go on with their lives normally the next day, but I'm not one of those. ",prettymuchtits,8lp1wc
8,"I'm the complete opposite. I love MDMA so much I don't even get comedowns, the afterglow from having a weekend with friends, listening to music I love and just being detached from this worthless piece of crap I am on a daily basis keeps me going for days after a party. But yeah, the after can be fucking awful so hold on for a few days until your serotonin levels are back to normal, putting everything back in its place.",grossko19,8lp1wc
9,Don't do drugs if you have bpd. It never ends well. I'm so much more stable when I don't smoke weed and take pills.,CatfishKitty,8lp1wc
10,"No addiction issues, but in the scene it just happens. I don't need it though and can completely not indulge in those things. I do like smoking weed, but I do keep drinking to a minimum...but that's easy for me to do. 

I'm just wondering if it's normal for the comedown to be harder on those with bpd. I have friends that just go back to normal life and work. And I literally need a week off to function. It takes me minutes just to convince myself to get up. ",r3_rider,8lp1wc
11,"Thank you! I've been there as well and I know it passes. Just glad I'm not the only one, it makes you feel super alone like it's the end of the world. ",r3_rider,8lp1wc
12,"I guess I've kinda learned the experimental way. I'm not planning on doing any mdma again. I still love raves, but I love the music too and don't need drugs to enjoy it. Just love that euphoria and loving everyone around me cuz normally I hate everyone lol. Mdma opens my mind to care for others, which with bpd is a hard thing to do considering most of the time I don't feel empathy for others. ",r3_rider,8lp1wc
13,I'm not either. The last day I rolled was Saturday night and I'm just now getting back to reality and emotionally calming down after being super depressed and having anxiety since Sunday,r3_rider,8lp1wc
14,"For drugs it is definitely case by case.  Mushrooms, cannabis, peyote, among other non refined plants can help some people. 
Others who have an above average anxiety aspect of BPD may want to cut back or quit drugs altogether.

I use THC pills daily for severe night muscle spasms and insomnia. It doesn't make my BPD worse as far as I can tell. The only side effects I feel are euphoria and relaxation.  ",,8lp1wc
15,"That's a bummer! I hope you're feeling better today. 
",prettymuchtits,8lp1wc
0,"For me it's an endless cycle of 1) looking for something to quiet my mind, 2) doing said substance to excess, 3) substance makes all symptoms worse for days so I spend a week or so emotionally recovering. Its exhausting and I know it's bad, but I can't control myself. I don't have any good advice here. Just know you're not alone. ",,b29v90
1,"I hsve this with weed. I smoke everyday, a lot. And I know I can quit cold turkey, but then I will start drinking. And while I dont drink extremely excessively, I do get tempted to do other drugs whe im drunk.

So I prefer smoking weed because It actually calms me down more. But I wish to just be able to use neither...",Godislate,b29v90
2,"I have the same problem. I recently quit drinking using kratom to help with withdrawals and this is the longest I’ve been sober for years. (Almost 2 months) 

I am so, so familiar with the depressive crash after a night of drug abuse. Keep in mind that after a night like you mentioned, especially while mixing substances, your brain chemistry is gonna be thrown way outta whack. For me, the thing that always kept me from quitting drinking was the horrible depression and emptiness I felt when I was sobering up. The easiest way to get rid of the feeling is just to get fucked up again, and so the cycle continues. 

If you really want to get out of it, it isn’t going to be easy. The physical stuff sucks of course, (make sure you taper if you’ve been consuming alcohol regularly. Stopping cold turkey when you’ve been drinking consistently can cause serious health issues and kill you) but for me the worst pat was crossing that mental bridge, working through all the emotions and trauma I’d been repressing with the help of substances, and waiting for my brain chemistry to right itself again. It sucked ass. I’m not gonna lie. But I’m nearly 2 months sober (3 more days!) and once I got through all that shitty stuff, things have actually changed. I’m not magically cured, my mental health stuff is all still there, but for once I’m not totally repressing things and living in denial. I’ve been a better friend, I’ve been cooking and eating healthy, and I’m starting to get back control over my life. I didn’t think it would be worth it, but it really is. 

r/stopdrinking is a great sub if you’re thinking about it. I wasn’t ready to be sober when I subscribed, but I figured what the hell, and it actually did help, to see other people doing it and how it was helping them. Best of luck, and feel free to DM me if you need someone to talk to. ",MaestroMeowMix,b29v90
3,When I’m depressed I can’t control my intake too. Had a horrible period of mephedrone abuse. The fact all my friends take mephedrone almost daily didn’t help. I don’t take anything but my antidepressants now but I wish I could afford therapy,gosutomoon,b29v90
0,"Honestly, yes but don't start or u won't stop and can be a slippery slope.",,e22ep6
1,"They not only help me, they are the only real coping skill I have. Very difficult to quit because all the symptoms suddenly flooding my brain is painful. If this is how you wanna go on with life, weed and alcohol, nothing more. Your life and your symptoms will just get worse when you don't have drugs just so you can cope for the time you do have them, vicious and self destructive life style, what we do best after all.",,e22ep6
2,"Yes, they do. I've been clean for about 3 months now and HOLY SHIT it's been getting worse. BUT taking drugs is NOT the solution!",Batgrill,e22ep6
0,Hello - I’m here. Addiction is so hard especially with bpd. I smoked weed incessantly all day everyday and just sooo much of it for 10 years and have just somehow made it the last few months without. Please don’t give up. What drugs are you divulging in? Where do you live (country?). I’m 29 female Australia,,p1k63h
1,"Third world, I dislike disclosing my country. Opiates and liquor, don't have much money. I'm feeling somewhat better now, no longer crying like yesterday. I'm just itchy but I no longer have anything in my body.

Thank you for your kind words.",iamyourdance,p1k63h
0,"Yes yes and yes! I cant regulate any benzos. Got to the point that I was locking them in my bfs safe, only to call him begging for the code hours later. That obviously didnt work haha I had to make a personal decision to stop taking them and telling the doctor about it was super hard but necessary! In the long term, xanax makes me worse and I know that now. It's like alcoholism where you can't have just one drink. I cant take just one xanax.",mercurialmrn,cdmmcu
1,yeah oh my god it got to the point where i expected to black out and got pissed when i didnt every day,woggin,cdmmcu
2,"I am prescribed the drug and I am only allowed 15 in a month, because it’s a controlled substance. I’d take it everyday because it is the perfect drug for me, but it’s not allowed as something you can just take daily, it’s only allowed to be taken as needed for panic attacks, so I have to save it and only take it when I’m literally dying.",,cdmmcu
3,Trust me! It was soooo bad. So glad I got myself out of that,bxllets,cdmmcu
0,"Update: now at my auties apartment im getting mixed signals from her too at this point im just cofused and looking for answers i just wanna ask if anybody has advice on how to deal with this because i am a socially cofused person as it is without getting mixed signals and seemingly stressing everybody around me out i dont wanna be a problem for people but it seem to keep emding up that way. I dont know maybe in the grand scheme of things its just a day with a lot o change and its weirdimg me out?

Update 2: well off to my job to try and sew thw gm and give her document's my auntie got absuve and hit me mutiple times and stole mt vape because she ""owns me"" im hopimg she can chill out like we used to cause im honestly scared as fuck (sorry for all the cuss words idk if its offensive or not)",mr_-guy,puuzze
