,Comment,Author,Post
4,"Symptoms were increased energy. I was cycling 11+km a day and still having lots of energy. I felt incredibly good. I commented to friends that I hadn't felt this alive in years. I was more talkative and friendly than ever before. Got myself into a lot of debt without noticing (shared bpd symptom). I was always on the go from waking to sleeping. I didn't need or get much sleep. Less than 3 hours mostly. I had to knock myself out with my anti depressants to get that much.

My doubt comes from the fact that this has happened before, and that wasn't drug induced because I wasn't taking anything then.",slain101,1j6783
5,I'm absolutely positive if it is drug induced it does not qualify as bipolar. And that I'm totally screwed if it is. The psychiatrists words were 'I think this is the only drug I can give you'. ,slain101,1j6783
6,"How did you know when the low was going to happen. My change from high to low was very sudden,  like a slap in the face. ",slain101,1j6783
7,"Huh, thats interesting. I can't take any SSRIs, they don't work for me. I take a tricyclic and that's of limited use.",slain101,1j6783
8,I didn't - that's why in the back of my mind I was so worried! I guess I just tried to prepare for it and kept it in mind so *hopefully* it wouldn't be such a shock. It always is though :(,,1j6783
9,"Oh I see, from experience you knew it would happen. Im sorry I misunderstood. ",slain101,1j6783
0,"If you have someone who you trust deeply and is calm and experienced with lsd.. take him/her as tripwatch. But if you are feeling bold.. do it by yourself and remove all that could disturb your trip. Dim the lights and make them soft. Music of your choice... Something that is calm and doesnt change suddenly. Meditate. For me those were the things that kept things good.

If you feel your life is in shambles I wouldnt recommend for you to take it. Just because you will go trough everything in your mind. But.. the thing is.. it can help you with that or not.

It helped me foward but it was a tough trip to do all by myself.",Malgorr,jlqamn
1,"Tripping always depended on my mindset at the time. If l was feeling negative, I had shitty trips. If I was happy, like just chillin’ with a loving dog and music, then I was good. So I would say make sure you’re not feeling like shit first.",,jlqamn
2,do it with a close circle of people you know and have a trip sitter,eves4263,jlqamn
0,"I think the big plot twist is there isn't a single human being on the planet that isn't tripping on some monkeybrain chemicals. Some hide it better than others. We see this false image when we look outside, or examine the highly filtered and selected social medias. But if people expressed all the negative, suspicious, malicious, self-absorbed, and delusional things in their head, no one would want to be around anyone or do any cooperative things. So we all just hide in our own heads, and keep up appearances.

A few people are probably genuinely happy, but not terribly many, and not for terribly long.",Compassionate_Cat,ctko1j
1,"I have a close friend that I met when he was in his late 20s, he's quite a bit older than me. He's my FP / non-committed lover. 

While in his early 20s he was addicted to crack. He described how he felt fighting the addiction when he wasn't high. 

I can't remember exactly what he said but I was like ""that's how I feel all the time sweet baby Jesus send help RIP I don't even know what crack looks like what tha-""",sadlilbumblebee,ctko1j
2,Me especially,behel1t,ctko1j
3,Me.,,ctko1j
4,coffee i.e tons of people do it,welltherehello,ctko1j
0,ubereats,Unleaked,a76348
1,"Books I never read, stickers and stationery stuff, notebooks I never write, art supplies I never use because I can't draw or paint. I also love buying stuffed toys and collectibles.",,a76348
2,"I love working on cars and getting tattoos. Either my money goes towards drugs, new tattoos or car parts",BPDphyscopath,a76348
3,"Video games, junk food, cigarettes, weed, more junk food.",DSToRrm,a76348
4,"Clothes, home stuff, impulse things like stuff at CVS and stuff for my FP ",yandereb4be,a76348
5,[deleted],,a76348
6,Yugioh cards.,PolluxValdez,a76348
7,Ridiculously priced makeup ,Angelfourtwentyish,a76348
8,tattoos and makeup,cosmiccmermaid,a76348
9,recently it's been nail polish. at least it gives me a lil temporary boost from the darkness lol,cordelia17,a76348
10,"Video games that I never will play fully... But yet I want to, but can't seem to start. Or finish.",PhoenixtheII,a76348
11,"My cigar habit got to the point where the cigar shop hired me to work there...

It's my money pit. I collect the boxes and cigar gear as well now.",HistoricalMeat,a76348
12,Paint and canvases (both of which i never use) ,,a76348
13,"Yarn! Crocheting keeps my mind and hands busy, and I bought sixteen skeins of yarn recently. I’m gonna be giving a lot of handmade good this Christmas, like “you get a scarf, and you get a hat, and you get some gloves, blankets for everyone!”",,a76348
14,My cat. Seriously. I worship him so much I don’t spend much on alcohol anymore.,,a76348
15,"Never used drugs or alcohol. But, I used to blow my money on fish tanks and animals and such as well as tools I would use for self harm. 

I still have fish tanks and spend some money on them, but not like I used to.   I have a strict three tank limit, which works for me. I also buy art supplies, which sometimes get used. I am now my own payee, and am much better at controlling my impulsive spending. It also helps that I don't get manic anymore. ",esoper1976,a76348
16,Candy. Clothes. Makeup that's outside my budget.  ,Sericatis,a76348
17,"I got a gym membership recently so I feel like I'm blowing money on exercise stuff whether it be gym clothes, bag, lock, swim gear.. my boyfriend bought us new gameboy 2dsxl and we buy a lot of games now.. also just new clothes for me.. kinda addicted to buying clothes ",cowboycanoli,a76348
18,"Books, makeup, random house decorations, clothes/shoes/accessories is a big one. 

But I’m pregnant now (due in 2 weeks) and I’m fairly certain most of my money will be blown on cute baby things. I’m already addicted to looking at clothes online for her. ",prettybutlame,a76348
19,"drugs, alcohol, tattoos, culinary supplies and chef's knives",SlightlyToastedBagel,a76348
20,"Clothes. So many clothes that I never ever wear, expensive food, inviting all my friends out for dinner and insisting I pay even though I can barely make rent ah.. and cigarettes mostly,  I guess that'd fall into the drug category though. Pawn shops are my weakness though, I think the stupidest thing I impulsively bought was a $150 bowie knife (I dont hunt/fish/hike and have barely touched it ever since)",merenneitoja,a76348
21,"Actually, presents for other people. If I see something this one person could like, I will buy it as an impulse. This happens multiple times a day when I'm shopping stuff. Kind of bad when 'friendships' breaks before actually giving them the present. 


Oh. And notebooks. MANY notebooks.",KK_Leme,a76348
22,"lost entire life saving of $150k trading options during lowest point because of all or nothing thinking.  had multiple health issues at the time and saw no way out and couldn't figure out how to go to a 9 to 5 with hip pain sitting all day.

&#x200B;

Years later I invested $40k into a cryptocurrency and was up 250k, but bc of all or nothing thinking, I didn't sell anything.  Market went bearish and lost 90% and was back to 30k.",selfdestruct1234,a76348
23,"I can relate to this a little. I kind of swing between being terrified of spending $5 on something ""not worth it"" and feeling reckless because I blew through $50 in a night out. ",cordelia17,a76348
24,"That's how I am. For the bigger part of the time, I just hoard all of my money for as long as possible, and then some random day I'll go somewhere or buy things online like a crazy person and blow through the majority of what I saved. Then I start all over. The good thing is, if I'm ever in a position where I don't have money to spend, it doesn't bother me. I make do with what I can or just do without, even if it's things I really need or want. ",kaylabebe151,a76348
0,Nope.,,9n5mbo
1,I think it really depends on WHY ur using them u know? If its purely recreational id like to think nah but if ur using them to escape something? Probably,jammyjog,9n5mbo
2,"I agree with what Jammyjog said. Recreational use is fine I guess, but can't really confirm, since it never worked for me like that. I was smoking weed / doing speed alot, just not to feel the way I did, even if only for few hours. But after, I just felt even worse. After, I just hated myself even more. Not to mention consequences of drug use, which we are all familiar with. And because of that, I am just selfharming at the moment instead. While I can not really stop, I know it is fucked up, but from my perspective, it is better than two alternatives that cross my mind constantly. I wish my horrible fucked up self would at least not have addicted personality, so I could at least have drug use under control. Edit; typo",,9n5mbo
0,drugs lower inhibitions so when you use them often enough sobriety feels boring and kind of itchy and life is just worse than when you're high. You'll never get one fun day of sobriety the more days sober the easier it gets.,,aanovh
1,"this used to be me. i used to smoke weed alllll the time. then some trauma happened and living situations/circumstances changed, and now I only smoke on occasion. At first it was really fucking hard readjusting. Like really really hard. I self harmed more than ever. But honestly I can say life is better without being dependent on it. Tbh I think it’s better for me at least, bc now I can actually deal with my problems vs just letting them drift into obscurity which made me even more awkward and dissociative in general. But everyone’s different and I would be lying if I said I didn’t want access to more weed. ",terrancelovesme,aanovh
2,Go to therapy,Muffcakelord,aanovh
3,"I feel this. Ever since I got my card I’ve been high every single day. All day. I want to use it less because I can’t afford my tolerance & my grades are suffering, but I don’t think it’s the worst coping mechanism either of us could be using. If you want to stop being so dependent on it, it’s all mental. It’s hard, but you’re capable. What helps me most is just not restocking - if it’s not readily available, I’m less likely to use it unless I REALLY want it. ",halfpricedcrunchwrap,aanovh
4,I feel the same way. It pisses me off that I have to depend on medication to feel a bit normal. I have been off of medication for 2 weeks because I’m an between insurance and I didn’t plan for it. I’m a fucking mess and the only things that helps is weed. I beat myself up for smoking weed to feel better. ,syl_acious,aanovh
5,It takes practice.,,aanovh
6,"Don't be so hard on yourself. Make small goals, like only smoke 2 joints tomorrow, and gradually reduce how much you're smoking. It's easier to deal when you're high - at least in my experience I can justify my actions easier and not feel as bad about consequences. But you're right, it's not a sustainable existence. But instead of looking at it as a big problem (even if it is for you) tackle it in smaller, achievable steps and it will be easier to stick to it and it feels good to actually follow through on these promises to ourself. Good luck :)",Kitty_has_no_name,aanovh
7,"I personally don't see cannabis as a drug, I've grown up with it, my parents have smoked it every single day I've been alive. I've been smoking since I was 14, I've even had a year off and I was in the worst place ever for that year. To me alcohol is totally normalised in society even though it's far more evil than weed, I mean it is literally poison. I know weed isn't right for everyone but for me I don't see it as a problem that it calms me down. What's worse, feeling suicidal, smoking a J and being instantly happy or just ending up self harming? 

I'll look for links later but I read a study that said that cannabis is the only medication that works for BPD, which I completely agree with. If you see cannabis consumption as a problem then it becomes that way, but I don't see a problem with it. I embrace that I have BPD and I embrace that cannabis helps me, remember it was the American government that demonised weed, our ancestors have consumed it forever, weed is a human being's right, it's the ultimate pain killer, it's better for you than most other substances (especially if you eat it), it helps my dad's arthritis/hypermobility, it helps us all wind down and to me a smoke is way better than a drink. Weed makes me wonder about the universe, alcohol makes me wonder if I should take my own life.

I know it's hard not being okay without drugs, but would you tell someone with cancer to stop taking their meds? Society had told us it's fine to take drugs to help our bodies, but for some reason it's not okay to take them for our minds. I mean would you tell someone with MS to stop smoking weed even though it's the only thing that takes the pain away? What about those children who have to take cannabis every single day to stop their fits? There is nothing wrong with getting stoned to help you, most people are on something, at least weed is natural. ",,aanovh
8,It will get easier you eventually just learn to live in your sober mind. Boredom! Don't allow yourself to get bored. It will get easier. ,,aanovh
9,"I know those feels. Good luck, but you've got this!",Kitty_has_no_name,aanovh
10,"I'm not completely dependent at least, like, if I don't smoke again I'll be fine, irritable and bored but fine. I think my problem is that I rapidly regain my old emotional instability.",ATrashcanInHumanForm,aanovh
11,"Eh, I'm basically out of money and weed anyway, so, looks like I'm going cold turkey",ATrashcanInHumanForm,aanovh
12,"Honestly, the biggest problem with me and weed is that I don't have the money to use it as a regular medication",ATrashcanInHumanForm,aanovh
13,"Daily smoker 

Bipolar 2 bpd ptsd 

It is literally nature’s medicine 
Kinda doesn’t help me when suicidal but I guess takes edge off since I no longer self harm ",,aanovh
14,Also to further the point even my mental health workers are cool with me smoking it. ,,aanovh
15,"Okay, I can see that as a problem, same thing happened to me so I moved on to hash instead, costs nowhere near as much and lasts so much longer, and has higher CBD content so it's more calming. But hash isn't the easiest to get hold of I must admit. ",,aanovh
0,I’ve PMed you. ,Large_Rhino,8v8b95
1,Always willing to talk. Pm me anytime ,EloraJane14,8v8b95
2,Pm men,Eyedeafan88,8v8b95
3,"I am always available to talk if you need, Ive been clean for a few years on methadone but was an IV heroin addict and crackhead.for 11 years. i still smoke occasionally but have been off dope completely for almost 3 years
edit..spelling",atrofeed,8v8b95
4,[deleted],,8v8b95
5,Messaging you. ,chasingd0pamine,8v8b95
6,Check out r/stopdrinking.,midazolam4breakfast,8v8b95
7,I'll definately be hitting you up!!!,GooQueen,8v8b95
8,But do they have bpd? Thats like my main objective. And what's IWNDWYT?,GooQueen,8v8b95
9,I dunno if you're trolling or I'm being paranoid so I'll just leave it at that in case you're serious. I'm not a drinker and I'm asking in this sub for a reason.,GooQueen,8v8b95
10,anytime! ,atrofeed,8v8b95
11,"You said ""AA"" so I suggested r/stopdrinking because it seemed helpful. That is all.",midazolam4breakfast,8v8b95
12,My comment probably came off rude but thank you I appreciate it.,GooQueen,8v8b95
13,"Here's a sneak peek of /r/stopdrinking using the [top posts](https://np.reddit.com/r/stopdrinking/top/?sort=top&t=year) of the year!

\#1: [Out of jail, Reddit helped lower my sentence.](https://np.reddit.com/r/stopdrinking/comments/7t2y7i/out_of_jail_reddit_helped_lower_my_sentence/)  
\#2: [Woke up to packed bags](https://np.reddit.com/r/stopdrinking/comments/6teym3/woke_up_to_packed_bags/)  
\#3: [It’s not even 9am but I know it’s going to be a GREAT day because I’m 100 days alcohol free. 💯💯💯💯💯💯💯💯💯💯💯💯💯](https://np.reddit.com/r/stopdrinking/comments/7s5v8y/its_not_even_9am_but_i_know_its_going_to_be_a/)

----
^^I'm ^^a ^^bot, ^^beep ^^boop ^^| ^^Downvote ^^to ^^remove ^^| [^^Contact ^^me](https://www.reddit.com/message/compose/?to=sneakpeekbot) ^^| [^^Info](https://np.reddit.com/r/sneakpeekbot/) ^^| [^^Opt-out](https://np.reddit.com/r/sneakpeekbot/comments/7o7jnj/blacklist/)",sneakpeekbot,8v8b95
14,"Don't worry fam, everything's fine. Hope you get better!",midazolam4breakfast,8v8b95
0,"i think it depends on the person, but for me no. i have a hole inside of me that marijuana helps fill a bit and so i see no reason to stop. it helps me more than anything else i've tried. ",boulder82SScamino,680jox
1,"I've experienced wellness on my own in the past. Ironically, I took it for granted when I was well...but I probably wouldn't have stayed well if I had been actively focusing on it at the time. Having good relationships and a sense of purpose, even if its just a job or a project you're excited about, can make such a difference.",,680jox
2,"I've been stoned since I moved out on my own man. Been trying to ease up but I guess the dependence has gotten a hold of me at this point. I definitely never feel feel at ease without some weed. Being in an illegal state makes this frustrating, dangerous, and expensive; but the alternative seems to be daily self harm.",trapBandocoot,680jox
3,Unfortunately I have to stop smoking weed for my DBT program but this is my exact concern. That I'll have nothing to help anymore. ,princess_angst,680jox
4,I have two jobs that I like but I still feel empty and I wish I could fill the hole with anything other than drugs but I'm not sure I can. Relationships and living with purpose are tough but maybe that will become easier with DBT. ,princess_angst,680jox
5,"Yeah. It's been hard for me to not smoke weed every chance I get for the same reasons. Now I need to stop so I can ""re-learn"" to soothe myself without the use of drugs. I can already tell it's going to be really difficult. ",princess_angst,680jox
0,"Microdosing is when you take very small quantities of a psychedelic like mushrooms or LSD every day for a few days or weeks. So small of a dose that you don't get any visuals or feel anything. If you're tripping you're not microdosing. Apparantly it can help with things like depression and migraines.

I don't know if it could help with BPD. I know with my BPD I have experienced psychosis before, so psychedelics are probably a bad idea even in small amounts. Microdosing can intensify things like anxiety and mania which could potentially throw me into psychosis if I get too stressed out. If you ever hear sounds/voices that aren't there or hallucinate things out of the corner of your eyes when you're stressed out, it could intensify that and make you uncomfortable.

If you do try it, microdosing or not, try to use it when you're in a good mood and in a comfortable environment. With someone who can make sure you're doing okay. Like don't microdose before a job interview or something lol. Mushrooms can be fun if you take them normally, I tried them once when I was younger and had a good time. But that was before I had such severe BPD symptoms so I'm not really sure if it would mix well now. It tends to intensify everything you're already feeling.",Q1e3t5r4w2,bv9i90
0,"Many, quit all of them 4 years ago and have been clean since then. 

Weed - loved it, made me really mellow and stoned but super paranoid. By the end I was convinced the cops were after me, checking windows and doors etc...
Cocaine - loved it again, horrible come down though 
Ketamine - I touched heaven with this drug. Believed I was speaking with the divine creator, super trippy. Like mild lsd with a bit of weed mixed in. Very weird. 
Mephadrone (MKAT) - my favourite. The one drug I miss. Such an intense high, amazing nights out on it. 

That’s about it for me. Never really got much out of MDMA...",,9agofm
1,Illicit you mean?,susannahsays,9agofm
2,"With the disorder, I knew I would never try anything that required me to be in a good state of mind because I am NEVER in a good state of mind. Ever. Even when I'm not super affected at the moment. So no psychedelics or hallucinogenics. Shrooms, LSD, fuck all that. You're just asking for a bad trip. You can't just snap out of that. 

I have tried Coke, Ecstasy, Vyvanse, Adderall, I was a pothead for a good four years, but bars enhanced with a little alcohol and MJ were my go-to along when I would get bad back in the day. 

I steered cleared of most opiods and hard, dirty shit like straight meth and heroin because why be more useless and numb than I already am? Seemed counterproductive.",brojules,9agofm
3,"Xanax (prescribed) : became very addicted for about 6 years, they almost killed me a few times. A good chunk of my memory is gone because of them. Nothing else relieved my anxiety like they did, but I simply can not have them anymore or I will kill myself. 

Psychedelics: I’ve only had a very light handful of experiences, nothing crazy. 

Ketamine (prescribed): I did Ketamine shots for a few months, while the experience was pretty cool, I didn’t notice any changes in my mental state. 

Weed: the only thing I haven’t given up. I feel like it helps me keep my sanity, and keeps my anxiety down. Not sure what I would do without it honestly. ",,9agofm
4,Yes,Henrix99,9agofm
5,"I've only ever done weed. I think I usually do too much because it takes a longer time for it to hit me than it does for other people. So I just keep hitting the bong over and over and over. Then all of a sudden, I'm super high. Like, can hardly stand, high. If I'm with somebody, I tend to talk a lot. I've been told I'm fun to be around and not annoying, though. Sometimes, I'll just make shit up. Nothing outrageous, but it won't be true. And then I'll tell the person hey, what I just said was completely made up. It's weird because I'll fabricate something completely plausible but utterly false. When I'm not high, I never do that and couldn't if I tried. I'd try acid, ecstasy, or shrooms if given the chance. ",susannahsays,9agofm
6,Exactly ^ I did MDMA and started thinking my gay friend wanted to screw my GF at the time. Shit got wierd really quick.,,9agofm
7,"I've done every drug in existence, probably, AMA?

Immune to cannabis though and stimulants barely affect me.

Acid wasn't a great time but it was really stimmy to me. Xtc literally feels like you're in love. About 18 months after the break up with my gf I tried xtc. Immediately recognized it as ""that feeling I used to feel when with my ex.""

Shrooms make me nauseous at first and they're hard to dose properly but fun. Not hard to control at all. 2cb is a little bit easier to dose and handle though and nearly identical. ",DreamteamPancake,9agofm
0,[deleted],,chlily
1,"I use them to escape my feelings and thoughts, or to help me regulate them, I guess. Used to be just alcohol for a long time, and that especially was more about ""killing"" negative feelings. Like feeling depressed/anxious/heartbroken? Just drink until it goes away! (Spoiler alert, it would always come back even harder the next day). Also an easy way to avoid loveliness - just go drinking, and you don't have to be alone with your thoughts! But at some point it started getting old and I internalized it was just making it worse, so I toned it down a lot.
Then I discovered weed, mdma and psychedelics. I would not say I abuse psychedelics tho, I use them quite infrequently and you can't really escape negative thoughts with them - they will find you. So I only use them in a good mindset. Been quite therapeutical actually. Same with mdma, I mean that one I have used just to escape negativity sometimes, but again, quite infrequently, and that too has helped me learn a bit more about myself.

Now weed, on the other hand...Yes, I smoke pretty much daily. Basically because it makes me so much less anxious, helps me think more positively, calms me down. Should I learn to deal with emotions without it? Yes. Do I sometimes use it to avoid difficult issues? Probably yeah. But I'm not really worried, because I kind of believe it's just a phase, like alcohol. Like, I'm not coping that well so I need a crutch for a while, and since I don't really consider it that bad, I'm like eh, give it time.",wirelessprotocol,chlily
2,"This is very much me. I've tried a few things recreationally, though not many, and I see the appeal of abuse, but the abuse just doesn't actually happen for me.

Idk maybe I'm just too Gods damn lazy haha. Drug abuse feels like a lot of hard work.",magpiegoo,chlily
0,"I honestly support you and can only really try to imagine how you feel. And I can see you are hoping to find a better way to handle mood changes.

But I do want to say, that based on what you described, you are \*unequivocally\* addicted to cocaine.",,alx5sf
1,I abused meth in very high amounts for years. Made me more suicidal than ever. Getting clean was the best thing I ever did. ,ActuallyDidMethOnce,alx5sf
2,"“I enjoy it”. Addiction. If you can’t get through life without it as a crutch, you’re an addict. ",iLok_hart,alx5sf
3,"> If you can’t get through life without it as a crutch, you’re an addict.

That's closer to drug dependence. What you are describing in your opening post is drug addiction. You are addicted to cocaine.",,alx5sf
4,"Good point. What I meant as a crutch, as in you need it to feel happy for a small moment, but it’s not taking care of the underlying issue. Unlike sleep medications where you get used to it and can’t sleep without it. 

",iLok_hart,alx5sf
