Title,Post Date,Post Text,Author,Author Flair,Original Content,ID,Score,Total Comments,Post URL
Talking to my friends,1714249488.0,I draw sometimes :3 ,jeminix2,,False,1ceo1f6,118,6,https://i.redd.it/8v4d88puz2xc1.jpeg
posting memes until I feel something,1714240333.0,,pyrocidal,:woman-yelling::smudge: i'm insufferable,False,1cekgxy,162,5,https://i.redd.it/w2g1ullh82xc1.jpeg
found on an instagram meme page ,1714239181.0,the page was completely unrelated to mental health but I just feel like this belongs here ,sad_bong_bitch,:sigh1::sigh2::sigh3::sigh4:,False,1cek0q5,189,8,https://i.redd.it/jrmmrdd752xc1.jpeg
me_irl,1714233946.0,,a_new_user_name333,,False,1cei06e,91,1,https://i.redd.it/x3qo704edzwc1.png
Very stupid I was... regulations and shit exist lol,1714232360.0,,g0ose_withrants,,False,1cehe61,17,1,https://i.redd.it/tx1x0snjk1xc1.png
The real core issues. It’s hard out here.,1714231731.0,,Psych-obsessed,,False,1ceh5ja,683,73,https://i.redd.it/v9tvi5z1j1xc1.jpeg
"""i dOn't aNSWer EvEry TEXt rigHt AwAY""",1714229597.0,,GiftToTheUniverse,,False,1cegcjg,34,33,https://i.redd.it/4h7rt9i7c1xc1.jpeg
People be hating me for using names,1714229179.0,,chronicallykafka,:britney::dont:,False,1ceg6y1,111,5,https://i.redd.it/ztqhj5jgb1xc1.jpeg
I'm currently in a clinic and would love some memes to make me LOL ,1714228567.0,"I got a little too silly and ended up admitting myself, and I'm having some difficulty settling in. I could really use some humour to help me cope, so please send memes!

Side note:  ❤️ Look after yourselves, also it's okay to ask for help - even if you end up being admitted. We do recover ,🤗",chronically-iconic,,False,1cefyq0,121,8,https://i.redd.it/9urs765n91xc1.jpeg
Um,1714228514.0,,chronicallykafka,:britney::dont:,False,1cefy0y,39,0,https://i.redd.it/f2gn3i9h91xc1.png
Everyday ,1714228100.0,,chronicallykafka,:britney::dont:,False,1cefslu,24,0,https://i.redd.it/j2bx692981xc1.jpeg
Love Emo music hits so hard,1714227515.0,,AbbyRose05683,,False,1cefl6o,16,1,https://www.reddit.com/gallery/1cefl6o
‎ ‎ ‎ ‎ ‎ ‎ ‎ ‎ ‎ ‎ ‎ ‎ ‎ ‎ ‎ ‎ ‎ ‎ ‎ ‎ ‎ ‎ ‎ ‎ ‎ ‎ ‎ ‎ ‎ ‎ ‎ ‎ ‎ ‎ ‎ ‎ ‎ ‎ ‎ ‎ ‎ ‎ ‎ ‎ ‎ ‎ ‎ ‎ ‎ ‎ ‎ ‎ ‎ ‎ ‎ ‎ ‎ ‎ ‎ ‎ ‎ ‎ ‎ ‎ ‎ ‎ ‎ ‎ ‎ ‎ ‎ ‎ ‎ ‎ ‎ ‎ ‎ ‎ ‎ ‎ ‎ ‎ ‎ ‎ ‎ ‎ ‎ ‎ ‎ ‎ ‎ ‎ ‎ ‎ ‎ ‎ ‎ ‎ ‎ ‎ ‎ ‎ ‎ ‎ ‎ ‎ ‎ ‎ ‎ ‎ ‎ ‎ ‎ ‎ ‎ ‎ ‎ ‎ ‎ ‎ ‎ ‎ ‎ ‎ ‎ ‎ ‎ ‎ ‎ ‎ ‎ ‎ ‎ ‎ ‎ ‎ ‎ ‎ ‎ ‎ ‎ ‎ ‎ ‎ ‎ ‎ ‎ ‎ ‎ ‎,1714226283.0,,XiND3R,,False,1cef586,272,23,https://i.redd.it/c3s1y6es21xc1.jpeg
This is OUR book,1714225622.0,,Bigwh,,False,1ceex8f,54,0,https://i.redd.it/a9qx47ku01xc1.jpeg
Calling out my bpd-fellas,1714222309.0,,Professional_Low_978,,False,1cedtdq,186,4,https://i.redd.it/0yfx89b1r0xc1.jpeg
Most people I like have avoidant attachment style and I need to stop,1714217296.0,,vonWistalia,,False,1cecbh9,18,0,https://www.reddit.com/gallery/1cecbh9
I just found this video on TikTok and I actually love it. Explains bpd so well compared to reality.,1714216138.0,,kittycakekats,,False,1cec0ay,1077,74,https://v.redd.it/2qano37l80xc1
me today when he left the call abruptly without saying goodbye twice so i think hes upset with me (i was genuinely happy for a few weeks and knew it wouldnt last long),1714206015.0,god smite me please i cant stand living,TruckScared3859,,False,1ce9h9m,49,1,https://www.reddit.com/gallery/1ce9h9m
Fr😂,1714203265.0,,SadBitch640,,False,1ce8sfr,45,1,https://v.redd.it/p66kprvc6zwc1
🔁🔁,1714202549.0,,FuckRedditsMom,,False,1ce8m16,74,2,https://v.redd.it/ynuppwr84zwc1
"went to apply to go back to school, found out i’m in debt",1714200314.0,,kayaslaya,,False,1ce812w,29,0,https://i.redd.it/m91tyqsmxywc1.jpeg
Okay but what if I’m in love??,1714198066.0,,Slime-Kiddo,,False,1ce7fug,130,2,https://i.redd.it/9tedzf6yqywc1.jpeg
BPDmemes,1714193100.0,,Warm_Jeweler_6565,,False,1ce626r,388,21,https://i.redd.it/dvhc8pk6cywc1.png
This hit me harder than it should’ve.,1714190276.0,,gd2go250,,False,1ce58ds,107,1,https://i.redd.it/s7n5oc9uyuwc1.jpeg
Straight up,1714189495.0,,Designer_Strike_3099,,False,1ce507z,22,0,https://www.reddit.com/gallery/1ce507z
those euphoric episodes be hitting‼️,1714183602.0,,ArtisticRaspberry891,,False,1ce360j,216,4,https://i.redd.it/2vod7psxjxwc1.jpeg
I do not know how to perceive people sometimes,1714181124.0,,Leading_Failure,,False,1ce2ctn,72,1,https://i.redd.it/1fs9qrlkcxwc1.jpeg
there's nothing you could do or say that would make me fall out of love with you,1714180189.0,,sandiserumoto,BPD pride uwu,False,1ce21kr,41,0,https://i.redd.it/fqzksylm6xwc1.jpeg
💖,1714176571.0,,pyrocidal,:woman-yelling::smudge: i'm insufferable,False,1ce0soo,145,11,https://i.redd.it/lfpg9rexywwc1.jpeg
dis bitch tho,1714175250.0,,pyrocidal,:woman-yelling::smudge: i'm insufferable,False,1ce0bff,102,0,https://i.redd.it/4ksolw7xuwwc1.jpeg
it’s better than it looks ok,1714174017.0,,Successful-Box2570,,False,1cdzvf3,220,7,https://i.redd.it/8mosycvfrwwc1.jpeg
Surges of emotions but today takes the absolute piss ✅,1714171669.0,,cyb3rbhabie,,False,1cdz00a,55,2,https://i.redd.it/6ak4vgggkwwc1.jpeg
😃🎉 I fucking hate myself and this world fuck this shit why can't just be HAPPY ,1714156757.0,,ThrowawayThestral,:steve1::steve2:,False,1cdt06g,99,9,https://i.redd.it/fduwo614cvwc1.jpeg
Every Fuckin Time 🙃,1714151961.0,,Reasonable-Impress38,,False,1cdr1kw,73,0,https://i.redd.it/ou3n763uxuwc1.jpeg
why me </3,1714150853.0,,Bad_Bleep_1234,,False,1cdqlfz,416,21,https://i.redd.it/ikpd0i3kuuwc1.jpeg
I hate I love I hate I love I hate I love I hate I love I hate I love I hate I love I hate I love I hate I love I hate I love I hate I love I hate I love I hate I love I hate I love I hate I love I hate I love I hate I love I hate I love I JUST WANT TO BE YOUR FRIEND I STG I'M FUCKING NORMAL,1714149911.0,OH MY GOD WHY CAN'T I JUST BE NORMAL GOD DAMMIT,Glittering-War5185,,False,1cdq7ld,27,2,https://i.redd.it/89eu4zarruwc1.png
I'm slipping again,1714149242.0,,youmeandthetardis,:buttercup::buttercup2:,False,1cdpxjx,252,11,https://i.redd.it/mjrgxt3y6twc1.jpeg
literally can keep saying this for hours,1714149005.0,,VissPodswiadek,:box2:bpd traits:box2:,False,1cdptyr,30,0,https://i.redd.it/0oqq5c9zouwc1.png
How it feels on the worst days,1714148376.0,,Sourice229,,False,1cdpkqo,89,4,https://i.redd.it/67zzaf27nuwc1.jpeg
happens about once a week after starting DBT but he's gen immensely supportive and I love him to bits ,1714147403.0,,AerisSpire,,False,1cdp60s,42,0,https://i.redd.it/4idlq0uakuwc1.jpeg
can't trust those euphoric moments no more 😭,1714141619.0,,Maeldemier,,False,1cdmt7v,206,11,https://i.redd.it/tjwegms33uwc1.jpeg
Jes' so you're aware. 🤷,1714137417.0,,MochaFied91,,False,1cdl62s,118,10,https://i.redd.it/tjmvd4zlqtwc1.jpeg
I thought this was hilarious from a bpd pov,1714137229.0,,AbbyRose05683,,False,1cdl3lq,174,4,https://v.redd.it/9nz23ih1qtwc1
Fucking worthless ,1714136311.0,,AbbyRose05683,,False,1cdkr2l,57,1,https://i.redd.it/2geze7ibntwc1.jpeg
We need therapists working the corner.,1714130590.0,,Psych-obsessed,,False,1cdiv69,276,19,https://i.redd.it/4opgek7b6twc1.jpeg
It's like I become his appendage like anglerfish,1714129202.0,Anyone else? XD ,LaaaaMaaaa,,False,1cdifr1,50,0,https://i.redd.it/pr3zijj62twc1.jpeg
Me rn:),1714108730.0,,gnartgnart69,:sadcat1::sadcat2::smudge:,False,1cdd9tu,82,1,https://i.redd.it/9tte9h2bdrwc1.jpeg
I need her i need her i need her i need her now. She needs to text me now. Now now now now,1714100046.0,,Historical_Piglet_41,:this2::is2::fine:,False,1cdalmx,133,9,https://i.redd.it/ho0bddghnqwc1.jpeg
☠️,1714097669.0,,MochaFied91,,False,1cd9ss7,143,18,https://i.redd.it/synz8q1fgqwc1.jpeg
Lost my support person over economic issues and now I have no one to call or text me back :(,1714096478.0,,AbbyRose05683,,False,1cd9dj1,576,35,https://i.redd.it/toqcgxevcqwc1.jpeg
I’m not lazy just mentally tired of everything ,1714092553.0,,AbbyRose05683,,False,1cd7zzq,404,15,https://i.redd.it/dsaamj871qwc1.jpeg
Loneliness ,1714089576.0,,AbbyRose05683,,False,1cd6w3e,123,8,https://i.redd.it/e3313yecspwc1.jpeg
When they don't follow the scripted scenario that I have carefully crafted in my mind.,1714086029.0,,halikadito,,False,1cd5icl,124,10,https://i.redd.it/ake00d7mhpwc1.jpeg
🤠,1714083395.0,,fluffywuffy_,,False,1cd4end,76,3,https://i.redd.it/d6mwbsxy9pwc1.jpeg
All the time.,1714082125.0,"I want someone to see the rotten parts of me and love them anyways, but I don't think its possible to know someone like you know yourself, so no one will ever be able to love you in that way. If that makes sense",ok-elias,:catra:,False,1cd40br,157,7,https://i.redd.it/ew6t3n376pwc1.png
Yee Haw!,1714077227.0,,Impossible-Spare2180,,False,1cd1xkc,51,2,https://i.redd.it/9vm1u4smrowc1.jpeg
how to stop feeling lonely,1714076014.0,when i dont get messages for a few days i start feeling very lonely and think no one wants me (*´-`) i want to be free from this,whirl-wnd,,False,1cd1e54,93,7,https://www.reddit.com/gallery/1cd1e54
waking up in the morning post-break up vs the second someone says a word that starts with the same first letter as her name hahahahaha (fucking kill me),1714074563.0,,obituweary,,False,1cd0qtf,30,1,https://v.redd.it/kl41vqnpjowc1
interact with my posts to get a free little stalking :3,1714063365.0,,lostinthevoid_d,,False,1ccwqgk,841,106,https://i.redd.it/q6qwset27nwc1.jpeg
found a new fp that already ghosted me,1714063309.0,,bipolarbisexual69,,False,1ccwpla,128,3,https://i.redd.it/uao80yu8mnwc1.jpeg
"OUR memes, comrade!",1714058275.0,,pyrocidal,:woman-yelling::smudge: i'm insufferable,False,1ccul02,56,0,https://www.reddit.com/gallery/1ccul02
I hate having feelings,1714057968.0,,m00minek_,:buttercup::buttercup2:,False,1ccugjl,79,3,https://i.redd.it/lzu2mo5d6nwc1.jpeg
insert other embarrassingly needy google search questions here,1714057096.0,anyone else start doing this shit when they get obsessed with someone or is it just a me thing,LilGidGid,,False,1ccu39h,61,2,https://i.redd.it/imja1vrr3nwc1.jpeg
The way bpd is portrayed in media will always ruin my day.,1714053637.0,,xbluewolfiex,:sadcat1::sadcat2::smudge:,False,1ccsooz,205,27,https://i.redd.it/5x98i8mhtmwc1.jpeg
real,1714052486.0,,ihavenoideano,,False,1ccs8ny,403,12,https://www.reddit.com/gallery/1ccs8ny
Friend sent me this a few years ago. Still makes me laugh.,1714051289.0,,FrecklesofYore,,False,1ccrsuh,291,9,https://www.reddit.com/gallery/1ccrsuh
🥰,1714044035.0,,m00minek_,:buttercup::buttercup2:,False,1ccpehb,88,1,https://i.redd.it/6xrkvepx0mwc1.jpeg
[OG] I'm trying my best then fail fuck me fuck me fuck me,1714030194.0,,FuckRedditsMom,,False,1ccly5p,66,3,https://i.redd.it/q1poejsrvkwc1.png
"i lost many of my friends, or alienated myself from the rest, when i left my ex in fear of increasingly abusive behavior, and i am so alone. ",1714018323.0,,motheraostara,:this2::is2::fine:,False,1ccir6p,99,4,https://i.redd.it/1tadu7chwjwc1.jpeg
this (self medicating) really is starting to look like an option (i will do it),1714015016.0,,vale000001,,False,1cchq42,203,19,https://i.redd.it/tp5xxe6nmjwc1.jpeg
nothing is going right,1714011592.0,,dyatlov_pass,,False,1ccgleb,52,1,https://www.reddit.com/gallery/1ccgleb
I have a new fp,1714000295.0,"This is the most exciting yet terrifying thing, on the plus side it turns out they also have bpd soo that helps them understand",Sootyowls,:trans::trans::trans:,False,1ccclfx,345,15,https://i.redd.it/aczgs8dveiwc1.jpeg
BPDmemes,1713996634.0,,Warm_Jeweler_6565,,False,1ccb75z,422,23,https://i.redd.it/ii4fsomz3iwc1.png
BPDmemes,1713996614.0,,Warm_Jeweler_6565,,False,1ccb6va,154,11,https://i.redd.it/wj51p0ex3iwc1.png
broke up with my bf genuinely feel like i am dying ,1713991199.0,"I broke up with him when he wanted a break because I thought it would be easier. And I said so so so many things to him that were mean and that I did not mean on the notion that I’ll never speak to him again. 

I messaged him today and asked to go on a break and he said he doesn’t know if he wants to lol because i just keep proving im emotionally unstable, even if he misses me

what do i do girlies, i legit did this to myself but our relationship wasnt good as it was and something had to change",mpckly,,False,1cc8zim,102,4,https://i.redd.it/jha3sqptnhwc1.jpeg
Made this so I could ask- Does this have a name?,1713987705.0,,ToyboxOfThoughts,,False,1cc7irs,53,11,https://i.redd.it/vy1dsua7dhwc1.png
It's my birthday 🥳,1713987643.0,"I made this and I love it so much, I wanted you to love it too. ",PotentialECash,,False,1cc7hut,64,6,https://i.redd.it/8lt872z8dhwc1.jpeg
"""Just go to the gym, bro trust it'll cure all your mental problems 🙏🏻""           Me at the gym like:",1713987354.0,,Orchid_Dull,,False,1cc7dmv,249,3,https://i.redd.it/tt5a4r4echwc1.png
I really thought my fp would change ,1713985482.0,,m00minek_,:buttercup::buttercup2:,False,1cc6lyo,111,0,https://i.redd.it/to8m5urt6hwc1.jpeg
God I love being attached to someone I can only talk to once a week,1713980792.0,,ahhchaoticneutral,,False,1cc4miv,341,26,https://i.redd.it/5366zlnvsgwc1.jpeg
This may affect the economy,1713979870.0,,rosiesunfunhouse,:noteasybeingold:,False,1cc48as,28,1,https://i.redd.it/tfjv6y35qgwc1.jpeg
It is coming,1713977301.0,,WeakGate26,,False,1cc34dt,44,2,https://i.redd.it/5viv4cefigwc1.png
is this a meme or am i just venting to the void?,1713972698.0,"i am both okay and safe right now, don't sic the crisis counselors on me pretty please 🥺",bella1138,,False,1cc1629,203,5,https://i.redd.it/1otvfm9t4gwc1.jpeg
I just want to be enough for once,1713944958.0,,m00minek_,:buttercup::buttercup2:,False,1cbsjat,119,5,https://i.redd.it/1p1floubudwc1.jpeg
just have to survive another week………,1713941874.0,we got this..,bunnyprincesx,what :bratz:,False,1cbrti4,160,8,https://www.reddit.com/gallery/1cbrti4
should i feel good about the fact that im the reason therapists keep their houses?,1713938167.0,,yakuzagutz,,False,1cbqvox,172,11,https://i.redd.it/tjswu3x4adwc1.jpeg
"“A mistake he'll regret... FOR THE REST OF HIS LIFE. A one-night fling, with no strings attached.” 🥲",1713937123.0,"Find the #1 movie on your birthday then Google the tagline:  
  
https://playback.fm/birthday-movie",reanabanana,:steve1::steve2:,False,1cbqlnn,181,124,https://www.reddit.com/gallery/1cbqlnn
Bring it. ,1713934217.0,,MochaFied91,,False,1cbpsiq,49,3,https://i.redd.it/vfh0bu3eycwc1.jpeg
Goodbye ordinaryish people maybe??,1713931130.0,,kittenciub,,False,1cbovhd,37,4,https://i.redd.it/g8vdb4o7pcwc1.jpeg
Choosing which type of vacation I need,1713926679.0,One way or another I need a week off work ,plutoforprez,,False,1cbnhqx,167,15,https://i.redd.it/ap95q50zbcwc1.jpeg
me pretending that I'm not suspicious at all that my boyfriend isn't abusive anymore and just keeps getting nicer and nicer. I will end up in a hospital when this ends,1713923375.0,,howsinavi,,False,1cbmda4,22,8,https://i.redd.it/ejogi7h52cwc1.png
"A bit from here…a little from there….take that, leave the rest. Ahhh….perfect! Will you accept and love me now? (spoiler alert: they don’t) ",1713923155.0,"My cringiest (and hardest to admit) I was 17-21 years old, became friends with dude at gym who was fucking brolick as hell (roided to all fuck), got “attention” from the women there, and I took him as a big bro kinda deal

Started to adopt his fucked up views towards women. Things like: it’s ok to lie to get sex, attachment is weak and “unmanly”, real men have several partners and have no romantic feelings, etc etc you get the idea

This went against every fiber of my being - I was raised by a mom with all sisters, aunts, female cousins, not many men around, and was always clowned on by the “popular” kids for being a p****. 

But with gym dude, my BPD mind was like “He’s cool, so thinking that must be cool too right?”

Yeah he was never cool to begin with. Also it goes without saying, haven’t spoke in years LOL",_RadicalAcceptance,,False,1cbmalw,25,3,https://i.redd.it/lm8yqjzh1cwc1.jpeg
This guy 😂,1713922258.0,,ElectronicGrade2654,,False,1cblzo4,207,9,https://v.redd.it/avvrpqntybwc1
Might just prescribe my own 😂,1713921261.0,,OwnAccountant4884,,False,1cbln5b,550,21,https://i.redd.it/orkg2j2vvbwc1.jpeg
Sadness goin crazy the last few months,1713918296.0,Literally ruining my own fucking mood. Hearing about my bf’s past ruins my mood??? He got to do so much fun and cool shit and I feel like such a lame motherfucker who hasn’t done anything and I don’t have any friends to go do fun stuff with so go figure 🙃 Need to start finding some people to hang out with who won’t leave me ,dahliachuu,,False,1cbkm8s,87,1,https://i.redd.it/edodsrr1nbwc1.jpeg
"me dating as a bipolar, borderline, anorexic, OCD bitch",1713916953.0,,bipolarbisexual69,,False,1cbk5bn,148,3,https://i.redd.it/dixli2kxibwc1.jpeg
is that they are good,1713915044.0,,Live_Bookkeeper05,,False,1cbjg8k,100,3,https://i.redd.it/e150co66dbwc1.png
🙃,1713911783.0,,MochaFied91,,False,1cbi703,90,1,https://i.redd.it/hknlfxlo3bwc1.jpeg
"brb, getting hot again",1713908808.0,,pyrocidal,:woman-yelling::smudge: i'm insufferable,False,1cbgzgp,118,0,https://i.redd.it/ibp1unoluawc1.png
💔,1713899394.0,,The_sheepherder,,False,1cbd0ua,212,4,https://i.redd.it/zn58wxcu2awc1.jpeg
Very reliable🤡,1713899291.0,,The_sheepherder,,False,1cbczdl,50,1,https://i.redd.it/5befr1dj2awc1.jpeg
Ahaha,1713894477.0,,ftm666incubus,:steve1::steve2:,False,1cbayl4,116,0,https://i.redd.it/76xa9228o9wc1.jpeg
.,1713891189.0,,,,False,1cb9lhc,220,9,https://i.redd.it/bojxf2xfe9wc1.jpeg
"gd morning, gd evening, gd night 😀🙃",1713889553.0,,cyb3rbhabie,,False,1cb8x7o,103,9,https://i.redd.it/g2tbt2yk99wc1.jpeg
One of those (every) days,1713888119.0,,sharp-bunny,,False,1cb8bi2,32,2,https://www.reddit.com/gallery/1cb8bi2
I feel so desired yet undesirable at the same time,1713886004.0,,notalgore420,,False,1cb7fog,122,2,https://i.redd.it/on786zz0z8wc1.jpeg
real,1713878801.0,,lostinthevoid_d,,False,1cb4m0q,181,5,https://i.redd.it/rauyhekld8wc1.jpeg
first pic is kinda gross to some people so yea,1713877518.0,,MentallyDeclining,,False,1cb44qh,60,3,https://www.reddit.com/gallery/1cb44qh
It’s excruciatingly frustrating ,1713870383.0,,tigerlotus33,,False,1cb1skp,184,8,https://i.redd.it/ebxthbvko7wc1.jpeg
how much to buy 1 (one) self esteem,1713849476.0,,cherryybrat,:bubbles1::bubblesmagic::bubblessad::bubbleswut:,False,1cawkzr,43,2,https://www.reddit.com/gallery/1cawkzr
i love quiet bpd : ),1713842914.0,,depressedkat4920,:sigh1::sigh2::sigh3::sigh4:,False,1caumh1,88,1,https://i.redd.it/xnsl0x8we5wc1.jpeg
when you’re reminded that you will never be enough for anyone,1713837735.0,i’m tired ,AltruisticFeed8290,,False,1casuqf,120,11,https://i.redd.it/3shdnnyhz4wc1.jpeg
I saw this on Pinterest and thought it fit ,1713836590.0,,vampstela,:bratz: bpd devil,False,1casgdg,114,5,https://i.redd.it/66hezde3w4wc1.jpeg
crying / laughing ,1713836478.0,,headonaplather,,False,1casezi,87,2,https://i.redd.it/iz5dcmfrv4wc1.jpeg
When you just can't split on your FP (she hates you),1713835929.0,,Obv-Throwaway49442,,False,1cas84y,17,3,https://i.redd.it/s7h0qjyjt4wc1.png
Gonna try and talk to a girl wish me luck chat🫡,1713832022.0,,gnartgnart69,:sadcat1::sadcat2::smudge:,False,1caqu6z,314,19,https://i.redd.it/r03rvkiii4wc1.jpeg
Me after realizing I turn 25 in a few days and have spent almost all of those years miserable. 🙃,1713829574.0,,OwnAccountant4884,,False,1capyiz,607,54,https://i.redd.it/fd1pu3f8b4wc1.jpeg
🥴,1713829292.0,,MochaFied91,,False,1caput0,94,0,https://i.redd.it/9ma4o3aea4wc1.jpeg
"Wait, I feel like I've been here before...",1713824871.0,,JimmieRustler531,,False,1cao4ku,190,18,https://i.redd.it/m0lnl5u6x3wc1.png
Just some bpd things. It's been a rough month with the homies.,1713824350.0,"These all don't sound related but they are.

I feel like I can't be myself around the homies.

And what if I decide to date? Am I gonna have to hide who I am around a more intimate relationship?

I think I'm a bit paranoid. My BPD got hands bro.",StorageValuable8884,,False,1canwn0,133,10,https://www.reddit.com/gallery/1canwn0
Leftover BPD monster and wine bc sad :((,1713823563.0,"Mom said I was 'asking for it'' for wearing a low top- after she adopted me as a kid from a violent incest CSA case that changed a state law. My twin also said my income problems and potential homelessness and incarceration for a crime I never committed was 'nothing' compared to her losing her tiktok job and for me to get over it :-(

Barely holding on fam, cheers",glitter_g0blynn,:bratz:,False,1cankfs,32,2,https://www.reddit.com/gallery/1cankfs
"Am I a possessive bf, idk",1713822891.0,,HelpIDownLoadedJapan,:is2::fine::nope: questioning BPD,False,1can9or,37,1,https://i.redd.it/ycwm8n0dr3wc1.jpeg
What song just screams BPD to you? ,1713822576.0,"I'd have to say one of mine has to be ""Follow You"" by Imagine Dragons because it shows the lengths I would go to just to keep my FP/lover happy and for them to stay with me even if it's killing me in the process. 

Another one would be; mime by Issac Dunbar",crazyboutnails,:spinel1::spinel2::spinel3::spinel4::spinel5:,False,1can4tt,1277,166,https://i.redd.it/35ax4abfq3wc1.jpeg
GONNA HAND IN MY RESIGNATION AT WORK ON Friday 🤞,1713816730.0,"I have no back up plan atm but I'm TIRED of being burnt out from a job that gives no shits!
(the rest of my team are also looking for new jobs because of how horrible and stressful it is currently and will continue to be for the foreseeable future) 

😎

",Fancy-Significance-5,:birb1::birb2:,False,1cakwvp,30,0,https://i.redd.it/yq50pyh193wc1.jpeg
Also works for puppers like mine 😆,1713815269.0,,Impossible-Spare2180,,False,1caka8l,390,8,https://i.redd.it/hfsvf16p43wc1.jpeg
I’m changing 🥲,1713811435.0,,Apprehensive_Cap3056,:bubbles1::bubblesmagic::bubblessad::bubbleswut:,False,1cain1t,59,1,https://www.reddit.com/gallery/1cain1t
Introducing your FP to all your personalities like,1713802499.0,,AMaidenofIron,:sadcat1::sadcat2::smudge:,False,1caev36,105,3,https://i.redd.it/vydhejup22wc1.jpeg
When the post depressive/euphoric  episode clarity hits,1713799013.0,,peanutbuttergirlie,,False,1cadfn3,136,2,https://i.redd.it/mecvsszcs1wc1.jpeg
How we girlies are when we perceive tiniest of abandonment from our fp,1713795806.0,,tinsilprincess,,False,1cac3xe,63,7,https://i.redd.it/7gdiqekti1wc1.jpeg
UPDATE - I GOT IN !!! I PASSED THE INTERVIEW AND I GOT INTO THE COURSE !!!!! MASTERS IN ENGLISH FOR THE NEXT 2 YEARS LET'S GOOOOO,1713790973.0,,ThrowawayThestral,:steve1::steve2:,False,1caa7dp,331,33,https://i.redd.it/jbsjxjag41wc1.jpeg
monthly rant,1713790180.0,"I want to text my ex bf who actually ruined me. He was my first male fp and this new taylor swift album has me craving his voice and presence even though it would probably just make me sick. I have a new male FP who’s 28 and he’s cool but he just doesn’t get me, he’s so uninterested in anything I have to say but yk he’s there and wants to talk to me… kinda. I just miss joking w my ex and laughing for hours about dumb shit. He’s 32 a whole 10 yrs older than me but somehow he’s like my twin fr 🙈 idk guys I’m sad and gaining weight even though I been binging and purging lol I just want peace and I need to leave my exes alone it’s just have so much love 4 them 😔💔",Dickatarian,,False,1ca9whj,75,3,https://www.reddit.com/gallery/1ca9whj
I’m not really important to anyone ,1713786358.0,,AbbyRose05683,,False,1ca8lph,265,12,https://i.redd.it/2j4ldybqq0wc1.jpeg
Anyone else feel like psychiatrists are quite often rude and cruelly blunt while actual therapists are warm and welcoming? Or am I just a sensitive lil bitch who splits on the doctors anyways here’s a meme,1713785071.0,Also my therapist canceled my session today because she’s ill like bitch me too take some ibuprofen an electrolyte drink and fix me ,whitewalker_x,,False,1ca87mk,68,3,https://i.redd.it/efnddsgwm0wc1.jpeg
You can tell the kind of night I'm having by looking at these carefully curated memes,1713765280.0,"Also in there: screenshot of the last messages I sent that got left on read after picking my second fight in as many days. 

Shout out to my fellow Canadians (they don't want us alive).",ad_astra96,,False,1ca38gd,30,0,https://www.reddit.com/gallery/1ca38gd
"I still haven’t processed it, I’m glad I’m safe but I still ended up going to bed alone.",1713764672.0,,ahhchaoticneutral,,False,1ca32oc,29,0,https://www.reddit.com/gallery/1ca32oc
The silly urge to kill people I don’t like,1713758528.0,,Jabari-,,False,1ca1cbc,98,1,https://i.redd.it/fse28w7zfyvc1.jpeg
Posted by @mask_kink_420 on IG,1713757904.0,,hotdogsonly666,,False,1ca15a4,121,0,https://i.redd.it/7aemmvg4eyvc1.jpeg
Why’s my brain gotta be this way? ,1713755101.0,,OwnAccountant4884,,False,1ca0avo,146,5,https://i.redd.it/9mmpj9bs5yvc1.jpeg
*screams*,1713754803.0,,Character-Escape-175,,False,1ca07cd,46,1,https://i.redd.it/jx5enhiw4yvc1.jpeg
My therapist said I no longer fit the diagnosis,1713743970.0,I worked with a previous DBT therapist for over a year but this new one only 2 months. He said I have no problems with interpersonal relationships even tho I'm terrified to date again and will try to kms if I think someone is leaving but yeah diassociating and being chatty during our appointments means I'm healed lmao,Brave_Matter,,False,1c9wnsx,319,9,https://www.reddit.com/gallery/1c9wnsx
Atleast im trying ,1713742983.0,,OwnAccountant4884,,False,1c9wc6o,100,2,https://i.redd.it/ydn5qt7r5xvc1.jpeg
How does one say no and set up boundaries? ,1713740275.0,,crazyboutnails,:spinel1::spinel2::spinel3::spinel4::spinel5:,False,1c9vcum,372,10,https://i.redd.it/zy85jkcpxwvc1.jpeg
