Title,Post Date,Post Text,Author,Author Flair,Original Content,ID,Score,Total Comments,Post URL
lol,1716076726.0,,BASHANDI-2005,,False,1cvax3u,7,0,https://i.redd.it/9lgxy416x91d1.jpeg
damn they are still acting kind to me,1716061710.0,,BASHANDI-2005,,False,1cv5l0r,28,1,https://i.redd.it/ansgp7lio81d1.jpeg
I am an unlovable pile of trash who ruins everything ,1716057435.0,,idkfadoomcheat,,False,1cv3zng,117,14,https://i.redd.it/xb8dyjosb81d1.jpeg
I found it. Hands down THE official anthem of BPD,1716051234.0,"Like, how ",Baedhisattva,,False,1cv1nrm,4,0,https://youtu.be/kUApl0QEulI?si=yFK9hj73MfYrRf5CIfoundtheofficialBPDanthem
I was so glad i didn't off myself all the times i wanted to.. i would've missed out on meeting him. too bad it was brief.. feels like that was really all i came to this life for. ,1716027289.0,"https://preview.redd.it/wgz5xo9ut51d1.jpg?width=960&format=pjpg&auto=webp&s=97e1fc6eb55ac333ff48397b3ac35bf822960458

",PolarBear0309,:blossom3::fine:,False,1cuu48a,5,0,https://www.reddit.com/r/BPDmemes/comments/1cuu48a/i_was_so_glad_i_didnt_off_myself_all_the_times_i/
oh man,1716041600.0,,BASHANDI-2005,,False,1cuy86n,15,1,https://i.redd.it/wieegqyp071d1.jpeg
idk why this happens to me my head shakes and my body feels weak in this situation,1716040302.0,,BASHANDI-2005,,False,1cuxs9p,20,0,https://i.redd.it/dp83glyuw61d1.jpeg
well that escalated quickly. guess I got engaged last week lmfao,1716010295.0,,needygameroverdose,,False,1cuq4hc,129,26,https://www.reddit.com/gallery/1cuq4hc
Tweaking bc I don't have access to my escapist behaviors,1715830177.0,"Omg I didn't realize how cooked I am up until tonight, like I can't go for more than 1 day without it",sorebbw,,False,1ct3oep,16,1,https://i.redd.it/xy86q102kp0d1.jpeg
they never do :(,1714273463.0,i think if i got a text back i'd probably be in a good mood for the next month it's so pathetic lmao,cherryybrat,:bubbles1::bubblesmagic::bubblessad::bubbleswut:,False,1cewcow,70,0,https://www.reddit.com/gallery/1cewcow
ALL EYES ON ME!!!!!!!,1713643153.0,,Any_Dark3939,,False,1c8yz93,0,2,https://v.redd.it/9r2mrgrwwovc1
UwU,1713625096.0,,Any_Dark3939,,False,1c8rz2x,101,47,https://i.redd.it/zv4y9st7fnvc1.jpeg
FUCK i wanna text him so bad,1713244524.0,,cherryybrat,:bubbles1::bubblesmagic::bubblessad::bubbleswut:,False,1c582e0,375,27,https://www.reddit.com/gallery/1c582e0
He’s hanging in there folks 😅 bless him 🤣,1713186400.0,,XxbritthemisfitxX,:sadcat1::sadcat2::smudge:,False,1c4lr9p,73,3,https://i.redd.it/iiiw8rxq6nuc1.jpeg
We're just trying to live too.,1713185875.0,,femalecreature,,False,1c4lkcv,41,0,https://i.redd.it/a0s1pfq65nuc1.jpeg
When you're in a bad mood but still want to work on yourself:,1713179126.0,I love this workbook. I really do. but with every ending of a chapter I'm confronted with THIS and I NEVER know what to write,D-Beyond,:sigh1::sigh2::sigh3::sigh4:,False,1c4jfqn,31,2,https://www.reddit.com/gallery/1c4jfqn
Stuff,1713161306.0,,Designer_Strike_3099,,False,1c4f1jf,139,4,https://www.reddit.com/gallery/1c4f1jf
fuck me for letting my guard down and getting too close.,1713153231.0,,rottenb3rry,,False,1c4csqg,78,4,https://www.reddit.com/gallery/1c4csqg
My FP will never replace me now (I hope he doesn’t),1713153071.0,,FlowerBeanBabey,,False,1c4cr35,51,0,https://i.redd.it/9pg2gk5nfkuc1.jpeg
i think no contact will be the literal death of me,1713147861.0,,cherryybrat,:bubbles1::bubblesmagic::bubblessad::bubbleswut:,False,1c4b3u9,128,8,https://www.reddit.com/gallery/1c4b3u9
Reflecting on my past relationship 🤮,1713140676.0,,coleisw4ck,,False,1c48peg,117,3,https://i.redd.it/p5ngchbsejuc1.jpeg
How do u guys stop obsessing over new crush i feel sick to my stomachhh,1713140433.0,,rsosilly,:listentoyourheart::listentoyourheart::listentoyourheart:,False,1c48mdj,75,18,https://www.reddit.com/gallery/1c48mdj
😞,1713139289.0,,Warm_Jeweler_6565,,False,1c487ln,298,3,https://i.redd.it/ca1rczrnajuc1.jpeg
Worship my delulu,1713138639.0,,coleisw4ck,,False,1c47zac,40,1,https://i.redd.it/g7g59wcq8juc1.jpeg
dating is soooooo fun guys,1713136634.0,"i’ve been on THREE dates with a guy and he slept over and my pillow smells like him and i’m literally about to start tweaking over him,,, i’ve been doing good but the moment i start developing romantic feelings for someone baby it’s time for bpd city all over again 😐😐😐",criesofalonelyfairy,:this2::is2::fine:,False,1c479fw,53,0,https://i.redd.it/k7btyejr2juc1.jpeg
I can’t do it,1713135049.0,,coleisw4ck,,False,1c46opb,44,0,https://i.redd.it/0idc9vz1yiuc1.jpeg
me,1713134842.0,,coleisw4ck,,False,1c46ltf,57,1,https://i.redd.it/mgelupufxiuc1.jpeg
Annoying,1713134747.0,,coleisw4ck,,False,1c46kjv,397,19,https://i.redd.it/dldwr3p5xiuc1.jpeg
Sad but true,1713127699.0,,The_sheepherder,,False,1c43u0x,1017,29,https://i.redd.it/miwde547ciuc1.jpeg
I could have him put in jail but not stooping to his level is so much better 🙌 ✨ 🧚,1713126251.0,,coleisw4ck,,False,1c438qn,87,1,https://i.redd.it/g4ud188w7iuc1.jpeg
I expect to be worshipped 🙌 ,1713126202.0,,coleisw4ck,,False,1c4381q,166,8,https://i.redd.it/dae0i7yq7iuc1.jpeg
Title,1713125235.0,,gnartgnart69,:sadcat1::sadcat2::smudge:,False,1c42tk3,263,16,https://i.redd.it/ol4iujhv4iuc1.jpeg
me,1713121268.0,,bipolarbisexual69,,False,1c416ng,135,1,https://i.redd.it/hi6tpes2thuc1.jpeg
Omg 😳 you’re right ,1713118157.0,,glitterygh0st,:birb1::birb2:,False,1c3zwz0,162,1,https://i.redd.it/ywx6za9sz95c1.png
just memein,1713117980.0,,,,False,1c3zuge,77,0,https://www.reddit.com/gallery/1c3zuge
The lowest point of my life being ten minutes ago 😃✌🏼,1713115460.0,,metalheadhippy108,,False,1c3yuau,163,7,https://i.redd.it/wae71zvsbhuc1.jpeg
😎,1713107224.0,,coleisw4ck,,False,1c3vpgb,107,0,https://i.redd.it/22vgvrfbnguc1.jpeg
#relatable 😂😂,1713103987.0,,kittycakekats,,False,1c3uijy,14,2,https://i.redd.it/oh6v0lsndguc1.jpeg
This show fucking emotionally destroyed me. ,1713092537.0,,,,False,1c3qyiz,116,41,https://i.redd.it/kpqacy5nffuc1.jpeg
Someone please end this pain I can't do it anymore...,1713083191.0,,JimmieRustler531,,False,1c3oo27,141,4,https://i.redd.it/j8ghrtnuneuc1.jpeg
"I don't even know what the fuck to do anymore, I'm sick of self loving, just want someone else to love me for once.",1713080674.0,,JimmieRustler531,,False,1c3o1v9,46,2,https://i.redd.it/kp3wydh2geuc1.png
soulmates,1713073274.0,,sandiserumoto,BPD pride uwu,False,1c3m50b,57,0,https://i.redd.it/abxe5epitduc1.jpeg
It’s betray your best friend day apparently,1713067076.0,Like girl. Fr. Over this shit. After everything. God damn I hate mfs so much,Hungry-Quail-80004,:woman-yelling::smudge:,False,1c3kfmb,122,3,https://www.reddit.com/gallery/1c3kfmb
Best to spare her from yourself and crawl back into the dark cave where you belong,1713053428.0,,pokecod,,False,1c3g8n3,73,4,https://v.redd.it/g68l0ens6cuc1
When he doesn't answer your texts after 3 days,1713053426.0,,coleisw4ck,,False,1c3g8mb,49,2,https://i.redd.it/aptxw6n2frsa1.jpg
Why can't you just be happy...,1713053412.0,,coleisw4ck,,False,1c3g8fh,12,0,https://i.redd.it/oa6ahfnqm9ua1.jpg
I have a problem,1713053362.0,,coleisw4ck,,False,1c3g7sv,43,0,https://i.redd.it/d3hrlwqccp5b1.jpg
lol what a joke,1713053240.0,,coleisw4ck,,False,1c3g6bo,79,1,https://i.redd.it/xz56f4nyebuc1.jpeg
I just want to be in love and be loved. ,1713050464.0,,ftm666incubus,:steve1::steve2:,False,1c3f6mm,114,2,https://i.redd.it/cohch3eiybuc1.png
I don’t think I would have lol,1713044167.0,,coleisw4ck,,False,1c3cuyu,97,2,https://i.redd.it/sqhl2e9tfbuc1.jpeg
Pick up line.,1713042322.0,,coleisw4ck,,False,1c3c5tp,196,2,https://i.redd.it/wc3waabu56pc1.jpeg
Real but he reverse discarded me instead lol,1713042174.0,,coleisw4ck,,False,1c3c3ui,72,0,https://i.redd.it/nizs6krv9buc1.jpeg
tfw your fp is too busy hanging out with their other friends (you literally do not have anyone else except for them in your life),1713039750.0,,some947guy,,False,1c3b6z9,221,14,https://i.redd.it/1yw9607m2buc1.jpeg
Splitting? Just replace your wiper blades!,1713039084.0,"Thank you Discount Tire! Why did I not think of that? 🤣

Be well y’all. 



",sonarriley,,False,1c3axta,34,2,https://i.redd.it/gktwv30p0buc1.jpeg
Real.,1713035506.0,,coleisw4ck,,False,1c39ksw,366,8,https://i.redd.it/nkvolig0q9uc1.jpeg
Bpd vibes,1713034805.0,,lonely-sad,,False,1c39amp,22,1,https://i.redd.it/yhr7eq7znauc1.png
"In 4 hours, I typed the time and what I feel each time my mood changes. (If only I can control myself. 🥴)",1713034331.0,The rest of the day was me being depressed and numb.,FuckRedditsMom,,False,1c3943v,710,93,https://i.redd.it/r4gms78kmauc1.png
(OP) Yearning for their undivided attention and reassurance while knowing full well I'll never receive that,1713031507.0,,Strange-Ad-9941,:this2::is2::fine:,False,1c3819q,27,0,https://i.redd.it/nyflne26eauc1.png
I should be more open:,1713030098.0,,Maeldemier,,False,1c37hz6,57,0,https://i.redd.it/uw8vccfz9auc1.jpeg
🌸🌼🔪,1713029797.0,,coleisw4ck,,False,1c37e0h,26,0,https://i.redd.it/2cc5f7briakc1.jpeg
I need to stop,1713029636.0,,coleisw4ck,,False,1c37bu8,68,1,https://i.redd.it/syd90qvl8auc1.jpeg
Meow,1713029103.0,,coleisw4ck,,False,1c374t9,42,0,https://i.redd.it/vafumyodc4uc1.jpeg
I KNEW IT,1713028088.0,,coleisw4ck,,False,1c36rav,29,0,https://i.redd.it/f28br2fkeppc1.jpeg
🥵,1713028071.0,,coleisw4ck,,False,1c36r2h,135,15,https://i.redd.it/0vix7iijf7mc1.jpeg
finish your damn sentence ,1713027988.0,,coleisw4ck,,False,1c36pyt,47,0,https://i.redd.it/tvrfy4ivkisc1.jpeg
"How I'm doing is directly correlative to how many BPD-coded memes I'm downloading. That being said, I have an image dump but can't figure out how to post multiple pictures on the mobile browser",1713027607.0,,pyrocidal,:woman-yelling::smudge: i'm insufferable,False,1c36kmh,58,0,https://i.redd.it/24b52jt42auc1.jpeg
No it is not,1713021068.0,,coleisw4ck,,False,1c346vg,52,1,https://i.redd.it/xfjfdaq4j9uc1.jpeg
Some of you need to hear this ,1713020921.0,,coleisw4ck,,False,1c344ua,378,19,https://i.redd.it/0zghw23huvtc1.jpeg
except it actually worked and i felt better immediately for some fucking reason. thanks lazlo,1713018854.0,"is this anything lol? my first post here. what a very specific meme to make.. i had no idea what template to use so i searched imgflip and i think this one is the most fitting one, even though it doesnt entirely work because i think the joke of the template is that the flex tape is kind of a shitty solution to stop the horrendous flow of water.. idk. its too early for this man 😭 its only 7:30 in the morning (pst timezone bayby)",rainbowraverdeluxe,,False,1c33d1q,41,1,https://i.redd.it/awluwzmjc9uc1.jpeg
hang in there gorgeous ✨️,1713015576.0,,lesh1845,:box1::box2::box1:,False,1c32777,342,26,https://i.redd.it/9061n1np29uc1.jpeg
a rare W for me my dudes ,1713015472.0,,ThrowawayThestral,:steve1::steve2:,False,1c325xm,160,4,https://i.redd.it/4o3oogfh29uc1.jpeg
This really upset me seeing it on a ptsd support group on fb.,1713013485.0,"I fucking hate this. We will never follow this advice on this. No excuses. Yeah you can fuck up by accident but not in serious ways. You know better. Research. Learn. 

No. I’m sorry but you need to learn to break the cycle. You can’t excuse yourself for fucking up your children with being emotionally unavailable just because their parents were . They caused the cptsd and Bpd I have. They were the ones who allowed my father to sexually abuse me and my mother said I deserved it since I was a woman and also that I deserved being raped by other men when I went to her about them. That’s not culture. That’s abuse and they have no excuse or reason to be forgiven.

“Doing the best they could with what they knew and had”

No sorry. That’s an excuse. There’s no excuse to be drunk all the time and ruin your kids life when they beg you to stop. It just means they don’t care. They literally don’t want to improve.  Oh it’s culture to be drunk all the time. No it’s not. You literally can’t control yourself when you’re drunk around your kid? Then don’t fucking drink. 

“Oh sorry I couldn’t afford your much loved hobby and skill that you were learning because I spent it all on booze! “ fuck that. You could have tried harder and not spent it on the fucking booze. He could have learnt and been a master at that craft. You chose your needs above your child’s. 

You beat your kid? “Oh that’s all I knew!! Oh yeah I love being beaten so I’m beating my kids oh wow! “
No. You know what’s bad and good. If you didn’t like it. Your kids don’t either. I don’t care if you grew up with it. You don’t punish your kid by giving them what you grew up with. You give them better than that. 

This post is so invalidating for those who have been abused by their parents and is a huge trigger.

Don’t have children if you don’t have the capacity to understand your children or be emotionally available for them. Don’t have children if you don’t want to resolve your trauma. Don’t have children if you don’t want to be a better person for them.",kittycakekats,,False,1c31i4b,224,49,https://i.redd.it/112gbxwkw8uc1.jpeg
🐸 🔥,1713011784.0,,coleisw4ck,,False,1c30ybd,55,0,https://i.redd.it/kcx0jxvir8uc1.jpeg
lol,1713011616.0,,coleisw4ck,,False,1c30whd,165,9,https://i.redd.it/r0uth3x0r8uc1.jpeg
Fragile as a bomb,1713004719.0,,everythingisducked,,False,1c2yy8l,88,3,https://i.redd.it/ng6g4mei68uc1.png
Any semblance of a good mood gone in an instant everytime smh,1712999449.0,,DuckyisKing,,False,1c2xpud,60,0,https://i.redd.it/91uyp5ciq7uc1.png
me trying not to feel betrayed when they literally just go to sleep,1712982389.0,,AltruisticFeed8290,,False,1c2tdqu,58,1,https://i.redd.it/vxcn6f84c6uc1.jpeg
"As a girl with bpd, this is my dream lol ",1712981453.0,,sorebbw,,False,1c2t48l,123,12,https://i.redd.it/705yyg3c96uc1.jpeg
Up all night wondering if they’ll ghost you after this 🫠,1712981062.0,,Electronic-Fold-7430,,False,1c2t08i,66,0,https://i.redd.it/k0hkhb5686uc1.jpeg
THIS,1712964956.0,,coleisw4ck,,False,1c2nr7l,78,0,https://i.redd.it/gu6zq7f8w4uc1.jpeg
Every. Time. 😣,1712961728.0,,coleisw4ck,,False,1c2mk1b,29,0,https://i.redd.it/pkdy4hwsqwtc1.jpeg
No I’m not,1712961681.0,,coleisw4ck,,False,1c2mjc6,85,1,https://i.redd.it/rvedtkxmtwtc1.jpeg
Me after falling for the love bombing and future faking 🤡 ,1712961612.0,,coleisw4ck,,False,1c2midb,23,1,https://i.redd.it/g0h2lyqrt7rc1.png
Real 🔥 😣,1712961534.0,,coleisw4ck,,False,1c2mhbo,29,0,https://i.redd.it/qjggjvieuwtc1.jpeg
😃,1712961437.0,,coleisw4ck,,False,1c2mg2d,53,0,https://i.redd.it/10eqoyw3k3uc1.jpeg
😔,1712961393.0,,coleisw4ck,,False,1c2mfj0,49,0,https://i.redd.it/bj4ac38li4uc1.jpeg
Puck up,1712952444.0,,Designer_Strike_3099,,False,1c2ivtf,223,14,https://www.reddit.com/gallery/1c2ivtf
As they stated... and explained... numerous times,1712949805.0,,Strange-Ad-9941,:this2::is2::fine:,False,1c2htoo,165,10,https://i.redd.it/g8olrx68n3uc1.png
It's a sign,1712949476.0,,Strange-Ad-9941,:this2::is2::fine:,False,1c2hoon,98,2,https://i.redd.it/5ed9x7z8m3uc1.png
"(OG) Well, you did ask for a sign",1712949246.0,,Strange-Ad-9941,:this2::is2::fine:,False,1c2hlbw,24,0,https://i.redd.it/ywp026ckl3uc1.png
I need help.,1712948316.0,,FuckRedditsMom,,False,1c2h7h5,39,1,https://www.reddit.com/gallery/1c2h7h5
"Haha (if I don't laugh, I'll probably cry)",1716400298.0,"Welcome to the latest episode of ""Oh God, what did I just do..?! Followed by panicking and screaming internally""",Beehive404,,False,1cy6k8k,1,0,https://www.reddit.com/gallery/1cy6k8k
"FOR ONCE IN MY LIFE CAN I JUST HAVE SOMEONE LIKE THIS WHO WON’T IMMEDIATELY WANT TO BE SEXUAL AND WON’T HURT ME, I JUST WANT TO BE LOVED INNOCENTLY IS THAT TOO MUCH TO ASK",1716396179.0,,coleisw4ck,,False,1cy4v8m,11,1,https://i.redd.it/1zgdcgppv8kc1.jpeg
i mean??? i might be right... right?,1716392423.0,,faerinana,,False,1cy3b5d,41,2,https://i.redd.it/w9nps99wzz1d1.jpeg
Gag me with a spoon! 🤢,1716388526.0,,MochaFied91,,False,1cy1rba,23,3,https://i.redd.it/otrrge5boz1d1.jpeg
i’m just a girl,1716388506.0,,coleisw4ck,,False,1cy1r1i,30,1,https://i.redd.it/ptorxl39oz1d1.jpeg
real,1716388214.0,,coleisw4ck,,False,1cy1n26,4,0,https://i.redd.it/aomqhfpslz1d1.jpeg
normal,1716388195.0,,coleisw4ck,,False,1cy1mre,8,0,https://i.redd.it/jzehmwt0mz1d1.jpeg
At least it is good for something,1716388051.0,,coleisw4ck,,False,1cy1krs,15,0,https://i.redd.it/4laygw3fu0xc1.png
"What would win: My need for validation, or the disgust I felt? The answer might shock you (or not)",1716388024.0,,coleisw4ck,,False,1cy1kfc,22,1,https://i.redd.it/iq7ir3iy87pc1.jpeg
!!!,1716384979.0,,Ashley-Amai,,False,1cy0eye,98,5,https://i.redd.it/fpgsk1hrdz1d1.jpeg
Longest streak so far!,1716369642.0,,Celebess,,False,1cxw03e,51,25,https://www.reddit.com/gallery/1cxw03e
this cannot continue,1716369049.0,"he started using dots in his messages 
",yumhorseonmyplate,I HATE HORSES I HATE HORSES I HATE HORSES I HATE HORSES I HATE H,False,1cxvv6k,21,0,https://i.redd.it/cw8dw66e2y1d1.jpeg
Everytime 😅🥲,1716367433.0,,Crack-pipe-fairy,,False,1cxvi03,55,2,https://i.redd.it/a229cx2iwr1d1.jpeg
"Because f me, that's why",1716361592.0,,kert111,,False,1cxu787,11,0,https://i.redd.it/w27isn08gx1d1.jpeg
"At this point, anything is reasonable. 🤷",1716359976.0,,MochaFied91,,False,1cxtsrw,29,0,https://i.redd.it/xqxate1fbx1d1.jpeg
😬,1716349793.0,,MochaFied91,,False,1cxr3lg,173,2,https://i.redd.it/bp8puwz4hw1d1.jpeg
when their slight change in tone ruins my entire night and i feel like a burden all over again,1716349485.0,"this girl shows me so much love and i still find myself questioning everything over a miniscule change in tone. i just wish i could feel secure in my relationships for once, but i can’t even help but feel this way",AltruisticFeed8290,,False,1cxr0cj,19,0,https://i.redd.it/q0git0z7gw1d1.jpeg
I usually add them back or message them after a couple days 🙃 I'm just a silly guy,1716348403.0,,Majestic-orange12,:this2::is2::fine:,False,1cxqot1,94,6,https://i.redd.it/u3rlmy70dw1d1.jpeg
"Another day of arguing with myself, losing, and then not giving a fuck. ",1716348391.0,,DitzyPotato,,False,1cxqonz,12,1,https://i.redd.it/5m9z6luycw1d1.png
"People say I should be a comedian, yet I’ve never once actually tried to be funny. ",1716346388.0,,Psych-obsessed,,False,1cxq2s2,74,3,https://i.redd.it/hd9v2hh07w1d1.jpeg
this influencer’s day is our entire lives ,1716339960.0,just saw this on stories like damn i forgot this isn’t an every day thing for most ppl,100percentrealalien,,False,1cxo12n,32,7,https://v.redd.it/6gimhtfvnv1d1
crying alone > crying on zoom,1716339609.0,its almost stereotypical but i surprised myself at how quickly i was unable to speak ,tastefullyirreverent,,False,1cxnwzg,27,1,https://i.redd.it/j84s50vumv1d1.jpeg
🫤,1716335149.0,,MochaFied91,,False,1cxmetb,475,21,https://i.redd.it/jr1oj0el9v1d1.jpeg
It's therapy day so that means it's time for another ✨ breakdown ✨ because it's too hard,1716335132.0,,kawaiifie,,False,1cxmem1,24,2,https://i.redd.it/6mrt65e59v1d1.png
Ugh,1716334097.0,"It’s funny because my doctor encouraged me to start standing up for myself and to try to voice my feelings more and the moment I do, it gets ignored, viewed as wrong, invalidated and inappropriate. I guess I just deserve to be walked all over then like damn. 
",Nervous-Management-1,,False,1cxm1aq,11,3,https://i.redd.it/14glbype6v1d1.gif
haha ouch ,1716331808.0,,InevitableScale136,,False,1cxl7vj,90,5,https://i.redd.it/7xanz4qnzu1d1.jpeg
My friend:if i can't sleep i am thinking about being Princess My thoughts before sleep:,1716327687.0,,Old_Rock8537,,False,1cxjn1a,26,1,https://i.redd.it/go0bt1henu1d1.jpeg
Yep everyone does. Why is maintaining relationships so fucking hard?,1716326974.0,,Crafty_Cell_4395,,False,1cxjd1z,222,9,https://i.redd.it/o0l0mi9alu1d1.jpeg
Nothing ever changes,1716326031.0,,Old_Rock8537,,False,1cxizsr,28,2,https://i.redd.it/j5lrhw9hiu1d1.jpeg
I recall every time when i was thinkinh like that. Why every one could get pleasure from this world except me? What makes me so diffrent?,1716325594.0,,Old_Rock8537,,False,1cxitqt,43,2,https://i.redd.it/mio61qi6hu1d1.jpeg
i’m so done with everyone i mean everything :3,1716325230.0,,Mrs-Literally-A-God,,False,1cxiogl,32,0,https://i.redd.it/d9frzsl3gu1d1.jpeg
Well funny you should ask 😅,1716322807.0,,Equivalent_Treat_823,:britney::dont:,False,1cxhpq1,10,0,https://www.reddit.com/gallery/1cxawxr
Yep,1716320120.0,,JayJay7620,,False,1cxgm38,245,7,https://i.redd.it/w3w8rtkw0u1d1.jpeg
Call me Private Dipshit,1716313383.0,,ToshDC,,False,1cxdua0,53,4,https://i.redd.it/l7rybegvgt1d1.jpeg
Me be like,1716311723.0,,RemarkableRemote5355,,False,1cxd6j6,97,4,https://i.redd.it/wvvfghvws4wc1.jpeg
"This showed up on my Facebook stories. My brain sees what it sees, not my fault. ",1716310694.0,"Ps sorry for the quality, had to take a pic of my pc screen with my phone because I knew I wouldn’t be able to find it again lol ",Soulful_Critter,,False,1cxcren,587,34,https://i.redd.it/2rhc8shv8t1d1.jpeg
my main struggle recently,1716299434.0,"The lows are so intense that I'm terrified of another bad thing happening that'll cause me to spiral. I'm doing well right now, things are going good- and I'm so so scared that it won't last. I can't handle how intense the lows are. (Credit to Waifcigs on Instagram)",1ashleyr6,,False,1cx8e2t,30,1,https://i.redd.it/6hj34z8ebs1d1.jpeg
Black and white thinking just doesn’t apply to him ❤️ ,1716297821.0,,InternationalCat5779,,False,1cx7tem,32,0,https://i.redd.it/zghszdhl6s1d1.jpeg
Starter pack 🔥🎒 (kill me pls),1716290507.0,,Crafty_Cell_4395,,False,1cx5gn2,153,12,https://i.redd.it/0eu7l6otkr1d1.jpeg
It’s been 5 mins 🤠 ,1716290151.0,,cyb3rbhabie,,False,1cx5d2f,64,5,https://v.redd.it/9zc9qh3mjr1d1
😂,1716290062.0,,lets-go-scream,,False,1cx5c67,362,9,https://i.redd.it/dv6dwqyijr1d1.png
"Found this bingo meme on Pinterest of all places, so filled it in with stuff that applies to me",1716270561.0,"Not officially diagnosed since idk how I would even go about getting tested for a personality disorder, but I suspect I might have BPD based on months (ok, fine…it is actually years) of research",After-Potential8976,,False,1cx0p90,15,6,https://www.reddit.com/gallery/1cx0p90
International BPD study for PhD Thesis,1716206785.0,"https://preview.redd.it/es2b6spvnk1d1.png?width=1105&format=png&auto=webp&s=68b05004646a65bf251b63f7339d1d084d807bff

Full survey link: [https://qfreeaccountssjc1.az1.qualtrics.com/jfe/form/SV\_0eUrZXLKClKErHg](https://qfreeaccountssjc1.az1.qualtrics.com/jfe/form/SV_0eUrZXLKClKErHg)",Subject_Rooster_9332,,False,1cwdy4r,1,0,https://www.reddit.com/r/BPDmemes/comments/1cwdy4r/international_bpd_study_for_phd_thesis/
cat mood board ,1716274001.0,,motheraostara,:this2::is2::fine:,False,1cx1j2p,15,0,https://www.reddit.com/gallery/1cx1j2p
this but unironically,1716269556.0,,kommsussertod1,,False,1cx0g6c,187,7,https://i.redd.it/jim927vjup1d1.jpeg
Yeppers,1716265231.0,,JayJay7620,,False,1cwzbjv,42,1,https://i.redd.it/dc29eoxohp1d1.jpeg
Get me out of here,1716264565.0,,rnountdiablo,,False,1cwz52d,260,15,https://i.redd.it/16a0jyopfp1d1.jpeg
I can't live without my iced java juice. 🧋🩶,1716263471.0,,MochaFied91,,False,1cwyte8,55,1,https://i.redd.it/37pb9blgcp1d1.jpeg
Average Monday activities,1716261284.0,,GetYouMad573,,False,1cwy65c,20,1,https://i.redd.it/3evtg1fy5p1d1.png
I get to attached so easily that's my biggest problem 🙃,1716258195.0,,Majestic-orange12,:this2::is2::fine:,False,1cwx7j6,90,4,https://i.redd.it/gixzr2srwo1d1.jpeg
Going through this currently 😪 ,1716258132.0,,kimbermall,,False,1cwx6sm,303,16,https://i.redd.it/ao2axx0lwo1d1.jpeg
Favorite Person 🥰,1716258093.0,,kimbermall,,False,1cwx6cu,87,3,https://i.redd.it/tnd7xzrgwo1d1.jpeg
Low low low low,1716258008.0,,JayJay7620,,False,1cwx5et,52,0,https://i.redd.it/bgb420s7wo1d1.jpeg
Always,1716257475.0,,JayJay7620,,False,1cwwzah,69,0,https://i.redd.it/23u35hpmuo1d1.jpeg
😴,1716257111.0,,JayJay7620,,False,1cwwv3f,146,4,https://i.redd.it/qz78wnmjto1d1.jpeg
Felt,1716257071.0,,JayJay7620,,False,1cwwulm,157,5,https://i.redd.it/dh2os3efto1d1.jpeg
Today,1716257048.0,,JayJay7620,,False,1cwwuc5,91,1,https://i.redd.it/lstlt01dto1d1.jpeg
Meh 🫤,1716257034.0,,JayJay7620,,False,1cwwu6b,28,1,https://i.redd.it/xslpbghbto1d1.jpeg
It's my coping mechanism 👺,1716252691.0,,ftm666incubus,:steve1::steve2:,False,1cwve7p,323,22,https://i.redd.it/fng4eciego1d1.jpeg
"I feel yew, network connection. I feel yew. 🫡",1716252194.0,,MochaFied91,,False,1cwv824,43,0,https://i.redd.it/zcieu8cxeo1d1.jpeg
What do you think?,1716246459.0,,NocoNicole,,False,1cwt89r,726,63,https://i.redd.it/sfxn1ofvxn1d1.jpeg
trying to find concrete enough pieces of your own identity to latch onto when trying to create an OC for yourself,1716246451.0,,umbral_ultimatum,,False,1cwt86b,23,0,https://i.redd.it/j65nhh9uxn1d1.jpeg
This loneliness is now getting really hard to romanticize. ,1716238191.0,I'm not doing good. I need friends to keep me falling from reality. ,Rude_Door1504,,False,1cwq24j,58,0,https://i.redd.it/f89kchaa9n1d1.jpeg
never fails,1716238155.0,,InevitableScale136,,False,1cwq1kr,72,2,https://i.redd.it/oj3n72i69n1d1.jpeg
bruh,1716237887.0,,BASHANDI-2005,,False,1cwpxtn,9,0,https://i.redd.it/pdcusdtd8n1d1.jpeg
Still waiting to gain this skill,1716236386.0,,BridesGown,,False,1cwpbx1,264,17,https://i.redd.it/w503no5x3n1d1.jpeg
I'm off 😎 ,1716235343.0,,eckregal,,False,1cwowqw,390,17,https://i.redd.it/nzd6rpgt0n1d1.jpeg
Just a meme I stole ,1716235279.0,,eckregal,,False,1cwovpm,64,1,https://i.redd.it/tcuea3pm0n1d1.jpeg
.,1716231205.0,,Impossible-Spare2180,,False,1cwn7o7,377,12,https://i.redd.it/1a8fhcjiom1d1.png
I need a little treat or ill die,1716230475.0,,ftm666incubus,:steve1::steve2:,False,1cwmx5h,140,12,https://i.redd.it/1etbcoacmm1d1.jpeg
