Title,Post Date,Post Text,Author,Author Flair,Original Content,ID,Score,Total Comments,Post URL
One of my spirit animals,1714649374.0,"Even though I'm not a white middle aged man, he's the most relatable character in my life ngl. I always feel him.",Zestyclose-Rough-176,,False,1cidajf,144,11,https://www.reddit.com/gallery/1cidajf
I am gonna ignore my problems,1714647330.0,,m00minek_,:buttercup::buttercup2:,False,1cicog2,31,0,https://i.redd.it/04skoy8uuzxc1.jpeg
BPD in a nutshell,1714641594.0,,Prazf,,False,1cib7ob,90,1,https://i.redd.it/p8ap396sdzxc1.jpeg
Always fighting social security for the little income I get and this economy is hell ,1714635963.0,,AbbyRose05683,,False,1ci9wiw,13,1,https://www.reddit.com/gallery/1ci9wiw
it do be like that sometimes,1714630543.0,,tealfairydust,,False,1ci8jgi,106,3,https://i.redd.it/m6kqkgaxgyxc1.jpeg
Never shoulda smoked that shit my FP coerced me into sex,1714627303.0,I can’t take this anymore y’all 🤪,Burnout_DieYoung,:test::test::test:,False,1ci7o7r,72,8,https://i.redd.it/glgka2ka7yxc1.jpeg
me listening to the entire discography of an artist my fp said he likes so I can feel close to him bc I am too scared to ever text him again ,1714622251.0,saw him at school today and actually acted Normal after having a mental break down in front of him on Saturday and then running away from him on Monday so I didn't do the same thing again god I hate myself I want him so bad but like I can't bc I gotta protect him from myself and my stupid ass attachment,howsinavi,,False,1ci67as,58,5,https://i.redd.it/iq0jv0h9sxxc1.jpeg
Regaining myself,1714620680.0,,elda2024,,False,1ci5pzz,22,0,https://i.redd.it/otb81mklnxxc1.jpeg
Change,1714620666.0,,elda2024,,False,1ci5pu1,25,1,https://i.redd.it/p6ith05knxxc1.jpeg
Happy Mental Health Awareness Month 🫶,1714617067.0,,BrootlePoodle,,False,1ci4kjj,74,2,https://i.redd.it/hhoiyftucxxc1.png
me writing a detailed will and planning my suicide to be as inconvenient as possible to my family members ,1714616107.0,"‼️‼️IM NOT GONNA KILL MYSELF BTWW‼️‼️ like yes I dont remember a time in my life where I didn't have immense suicidal ideation but like I still wanna live like I gotta get my degress and shit and life is cool sometimes but I keep having this reoccurring instrusive thought of making a will and giving everything to my little sister (the only family member who hasn't wronged me) and boxing up all my belongings and taking my life in a way that wouldn't leave a mess so my family wouldn't have to worry about the cleanup of a corpse. 

Again, I'm not gonna do it  but for some reason I can't stop thinking about this. I like to be organized in life and I try to avoid being a burden yk💀💀💀💀",howsinavi,,False,1ci490m,42,0,https://i.redd.it/md9pexyz9xxc1.jpeg
Happy Mental Health Awareness Month 🫶,1714615968.0,,BrootlePoodle,,False,1ci47ct,22,1,https://i.redd.it/457k115l9xxc1.png
"Me: (chillin, doing nothing) Inner voice: “You f-cking POS! You ruin everything good! You don’t deserve to feel peace or happiness!!” ",1714614401.0,,AdHocShellShock,,False,1ci3o1d,31,0,https://i.redd.it/gwoaqjex4xxc1.jpeg
Auto sabotage in relationships ,1714609019.0,"After six months of being an upgraded secure person thanks to the support of my gf,I start hating my self again for no reason and I fear so much it will destroy everything ",archibaldLeBG,,False,1ci1sgg,30,0,https://i.redd.it/iy0xjw8xowxc1.jpeg
i hate loneliness,1714608356.0,:( ,whirl-wnd,,False,1ci1jyn,22,2,https://i.redd.it/dxdcpvcymwxc1.jpeg
"Me, stressed af, sending 30 emails to my lecturers while panicking about my upcoming deadline",1714600721.0,,RetordGoblin,,False,1chykcq,16,0,https://i.redd.it/31oqenz80wxc1.gif
when my friends ask me to pick out some music,1714600106.0,"hey, where are you going? what, y'all don't want to sit around and think about death with me???",bella1138,,False,1chyax3,88,14,https://i.redd.it/qljrx46fyvxc1.png
"Been there, done that",1714598645.0,,PepiDaJudoka,,False,1chxp0t,24,0,https://i.redd.it/uxtctkq2uvxc1.jpeg
"Aha, I have arrived as the 3rd member of this sub! Here's a meme to pay rent.",1714598468.0,,coleisw4ck,,False,1chxmfw,111,5,https://i.redd.it/z9aa9608imtb1.jpg
I’m not okay right now,1714597822.0,,coleisw4ck,,False,1chxd1i,25,1,https://www.reddit.com/gallery/1chxd1i
Real,1714597726.0,,coleisw4ck,,False,1chxbn6,43,0,https://i.redd.it/2fmssigcrvxc1.jpeg
My superpower 😎,1714597323.0,,coleisw4ck,,False,1chx5re,48,1,https://v.redd.it/jac9yhhz3bsc1
😒,1714597214.0,,m00minek_,:buttercup::buttercup2:,False,1chx3wk,73,1,https://i.redd.it/wcow45ltpvxc1.jpeg
BPDmemes,1714593857.0,,Warm_Jeweler_6565,,False,1chvrbq,399,13,https://i.redd.it/40r57c7ufvxc1.png
Give me a sec,1714593805.0,,The_sheepherder,,False,1chvqlw,289,10,https://i.redd.it/2nbtaslofvxc1.jpeg
Current situation. How do you guys deal with having fps?,1714591670.0,,PoloPatch47,,False,1chuvnj,274,50,https://i.redd.it/079heiwb9vxc1.jpeg
We’re so back (real),1714589990.0,,Skyis4Landfill,,False,1chu6jg,187,7,https://i.redd.it/2kduyl9c4vxc1.jpeg
soul ties kind of scare me,1714581162.0,,sad_bong_bitch,:sigh1::sigh2::sigh3::sigh4:,False,1chqj8x,53,5,https://i.redd.it/9lqrkx93euxc1.jpeg
If only it was that simple. 🙃,1714580631.0,,MochaFied91,,False,1chqbng,341,7,https://i.redd.it/2uw4aygicuxc1.jpeg
why are they like this💔then they’ll get disappointed when u actually behave crazy like that,1714577922.0,,Bad_Bleep_1234,,False,1chp7rg,380,28,https://i.redd.it/dyv30cdg4uxc1.jpeg
Teehee :3,1714573113.0,,coleisw4ck,,False,1chnc0w,80,0,https://i.redd.it/8jwyk8xy96wc1.jpeg
How to fight please 🙏,1714572708.0,,coleisw4ck,,False,1chn6c8,48,2,https://i.redd.it/fhqksipe6txc1.jpeg
Can't be abandoned if nobody will even give you the time of day.,1714569479.0,"Of course, that leads to its own myriad of issues.",kb3uoe,,False,1chlyph,153,5,https://i.redd.it/lytyi7ocftxc1.jpeg
🫠,1714543761.0,,MochaFied91,,False,1chexe9,193,7,https://i.redd.it/2esxv6mvarxc1.jpeg
im totally normal ✨,1714543671.0,,InevitableScale136,,False,1chewi7,115,5,https://i.redd.it/5nvfs11marxc1.jpeg
Ever been physically hurt or caused someone to shut down emotionally because you dared to express pain and need for comfort,1714540092.0,,ToyboxOfThoughts,,False,1chdybp,54,0,https://i.redd.it/m2n3vcfuzqxc1.png
removed my ex off all my socials,1714530476.0,,dyatlov_pass,,False,1chb130,64,2,https://www.reddit.com/gallery/1chb130
All in a day's work (not oc),1714524157.0,,MentallyDeclining,,False,1ch8tyq,168,25,https://i.redd.it/hou9l6fkopxc1.png
Yeah I might be a Vulcan,1714524150.0,,Impossible-Spare2180,,False,1ch8tvw,50,3,https://i.redd.it/c0j8wjdkopxc1.jpeg
try not to relapse challenge (impossible),1714523158.0,,TruckScared3859,,False,1ch8hdt,106,10,https://www.reddit.com/gallery/1ch8hdt
No one will ever know,1714521029.0,,coleisw4ck,,False,1ch7oql,80,5,https://i.redd.it/o32xuxdaidib1.jpg
I'll do a positive one,1714520848.0,"Super important reminder for everyone. 
",sirennn444,:nope1::nope2:,False,1ch7mbu,45,2,https://i.redd.it/enuss4uqepxc1.jpeg
2meirl4meirl,1714519188.0,,coleisw4ck,,False,1ch70vq,51,0,https://i.redd.it/7qfgy3ueoswc1.png
I don’t know what to do with myself anymore. ,1714518265.0,,pussyknife,,False,1ch6oko,70,2,https://i.redd.it/n5qgoid27pxc1.jpeg
🥲,1714509685.0,,rcontece,,False,1ch37ix,71,2,https://i.redd.it/2noy0gwjhoxc1.jpeg
when your friend starts dating and leaves you behind,1714508252.0,hurts when this happens even though i want them to be happy,whirl-wnd,,False,1ch2m9o,65,12,https://i.redd.it/m5yywkiadoxc1.jpeg
Anyone else frequently switching PFPs or avatars based on their moment to moment mental state?,1714504024.0,,HotdogRacecar,:sigh1::sigh2::sigh3::sigh4:,False,1ch0wql,379,38,https://i.redd.it/otsu5iwp0oxc1.jpeg
How we feeling lately,1714503479.0,,Miserable_Layer_2082,,False,1ch0oo7,180,26,https://i.redd.it/temoc9h3znxc1.png
"i’m not gonna, but it would probably feel a whole lot better than this",1714501129.0,"i fear i may never see her again, i feel worthless :)) ",VenuslnFauxFurs,:sadcat1::sadcat2::smudge:,False,1cgzq0x,49,6,https://i.redd.it/m8vh2z14snxc1.jpeg
"I've been alone my entire life, I should be used to it by now. ",1714501021.0,,ftm666incubus,:steve1::steve2:,False,1cgzoei,209,15,https://i.redd.it/mvdfx99srnxc1.jpeg
"It really do be like that, huh",1714498874.0,,DenniAkira,,False,1cgytdy,188,13,https://i.redd.it/t7geryhelnxc1.jpeg
They never cared,1714498332.0,,Maeldemier,,False,1cgylno,796,32,https://i.redd.it/qoqhhjosjnxc1.jpeg
Actually,1714497915.0,,chronicallykafka,:britney::dont:,False,1cgyfh4,49,0,https://i.redd.it/w06rsrbjinxc1.jpeg
2meirl4meirl,1714489696.0,,coleisw4ck,,False,1cgv6b8,826,29,https://i.redd.it/i6tdnlxkw0ec1.jpeg
my daily schedule,1714489677.0,,coleisw4ck,,False,1cgv5zf,90,4,https://i.redd.it/paur99ab2nmc1.jpeg
Gravity falls nostalgia,1714488984.0,,gardenintheocean,,False,1cguvr1,41,0,https://i.redd.it/b7k7onizrmxc1.png
Sounds familiar ,1714479638.0,,AbbyRose05683,,False,1cgrgri,81,3,https://i.redd.it/yqzl3ve70mxc1.jpeg
One of them days,1714477974.0,,AbbyRose05683,,False,1cgqxjq,115,5,https://i.redd.it/7u0l51d9vlxc1.jpeg
BPDinner,1714463059.0,,plutoforprez,,False,1cgn5v4,527,32,https://i.redd.it/yxktcllwmkxc1.jpeg
🤷,1714454357.0,,MochaFied91,,False,1cgkyg5,65,2,https://i.redd.it/wviynv91xjxc1.jpeg
What are your go to songs?,1714448071.0,,OwnAccountant4884,,False,1cgj2qq,642,36,https://i.redd.it/ccegmrdcejxc1.jpeg
My boyfriend is mad at me it’s so over,1714446994.0,,my_gun_snapped,,False,1cgiqap,82,4,https://i.redd.it/eulzra35bjxc1.jpeg
"There is no in between, there is no intersection ",1714446918.0,,plutoforprez,,False,1cgipg1,127,3,https://i.redd.it/5z5bdovwajxc1.jpeg
Fr 💀 🎀,1714446645.0,,coleisw4ck,,False,1cgim8w,44,0,https://i.redd.it/ts2b0xo9oixc1.jpeg
Emo music feels!,1714446463.0,,AbbyRose05683,,False,1cgik64,6,1,https://www.reddit.com/gallery/1cgik64
Every night.,1714444099.0,,kb3uoe,,False,1cghrof,80,7,https://i.redd.it/gvzaddgg2jxc1.jpeg
Ifuckingswear,1714433285.0,,Maeldemier,,False,1cgdwvs,67,0,https://i.redd.it/ujb8txkd6ixc1.jpeg
Me the last two days 🙃,1714432436.0,,OwnAccountant4884,,False,1cgdlao,57,1,https://i.redd.it/kze1djnu3ixc1.jpeg
"if you hurt a neurodivergent, you're still hurting someone",1714432025.0,,sandiserumoto,BPD pride uwu,False,1cgdfmh,255,16,https://i.redd.it/f5j9uamt8bxc1.jpeg
me the moment i devalue anyone,1714427961.0,,almond3238,,False,1cgbsgf,23,0,https://i.redd.it/fymi1zljqhxc1.jpeg
yeah :'),1714427020.0,i love my boyfriend so much <333 hes my world and i love him but i wish i didnt feel so horrifically numb whenever he's not in the same room as me,slowly-rotting-dying,,False,1cgbeji,266,7,https://i.redd.it/wtl7bdwqnhxc1.jpeg
finally freed up some storage by deleting pictures of my ex,1714422528.0,,almond3238,,False,1cg9i2d,278,15,https://i.redd.it/wsrxor1eahxc1.jpeg
I'm not saying I didn't not do this,1714422421.0,,glitter_g0blynn,:bratz:,False,1cg9gdn,64,9,https://i.redd.it/kocdl7b1ahxc1.png
Tantalizing 🫦,1714421389.0,,cyb3rbhabie,,False,1cg90o0,26,0,https://i.redd.it/e6uae8407hxc1.jpeg
My ads lately,1714420980.0,Im not looking up anything similar lol,notfunnystfu,,False,1cg8ug0,56,3,https://www.reddit.com/gallery/1cg8ug0
"my prefrontal cortex after a long day of meditation, eating well, journaling, not drinking and working on myself mentally and my ability to find happiness without a partner in my life",1714420241.0,,obituweary,,False,1cg8j1g,208,11,https://i.redd.it/12apdhal3hxc1.jpeg
I feel so stupid for waiting like a dog,1714409429.0,,m00minek_,:buttercup::buttercup2:,False,1cg3zsx,88,2,https://i.redd.it/z6lh2tsf7gxc1.jpeg
"I like to opt out from another day of this life, any takers? (No returns)",1714408504.0,The identity upheaval has been leaving me really empty lately,Zealousideal-Week515,,False,1cg3m4r,59,3,https://www.reddit.com/gallery/1cg3m4r
the bathroom…,1714406827.0,,psychologycat666,,False,1cg2xg9,151,8,https://i.redd.it/xis5btapzfxc1.jpeg
Rant: Any Support / Advice is Welcome,1714397121.0,"I would first like to say thank you in advance for anyone taking the time to read this. I have always felt a true sense of camaraderie on this sub that I have greatly appreciated, and i’m really in need of that support now. 
   I truly feel as though I am drowning. I cannot escape myself or my BPD diagnosis. For the past 6 months, I have been in an on again off again situationship with someone I should’ve never been with in the first place. We have nothing in common and he’s not nice to me, but my brain has CONSTANTLY convinced me that without a man by my side, I am nothing. I turn into a hollow shell, void of my own interests or self respect, and in turn become a vessel for the other person, my current FP. All my time and energy is dedicated to him and him alone, and the whole world disappears, including myself. The cycle is brutal, of course, because no one will ever be able to match the level of affection I give (or so my brain convinces me) so therefore they do not care about me or for me whatsoever. 
   Granted, he did not make my life easy. I’ve never cried so hard in my life. Coming over to hook up, but constantly wanting to keep us a secret, asking me what I was planning on wearing to meet his parents then less than a week later abruptly telling me it’s not going to work out, then coming back into my life because he thought another man might be interested. After being given no affection by him at all (no compliments, no affection unless we were hooking up) being discarded, and picked back up again like it was nothing 3 times now, I am at the lowest point in my life than I have ever been. I have begged him and begged him to give me a reason why he couldn’t at the very least communicate with me, the person he had said he wanted to be his girlfriend. He finally told me it was because I am convinced there is someone else, and when I cry around him about it, it makes him “feel bad and lose interest.” It’s pathetic, but if my partner is nonchalant and wants to keep things behind closed doors, it’s difficult for my brain to not fill in the blanks with terrible anxiety ridden thoughts, like “he’s definitely talking to someone else.” I will admit that if I didn’t have that issue we’d likely still be together, which is why I’m in so much pain. 3 times he wouldn’t communicate with me, he would just become distant, and then after ditching me for plans we had that day, he simply wouldn’t show. Or he’d take hours and hours to reply to my messages. Once I would call frantically begging for answers on why I was being abandoned, he would coldly respond “I don’t know.” And each time destroyed me. If I had just a shred of self confidence, I wouldn’t have taken him back the first time, and I wouldn’t feel like offing myself now. But I am tethered to him, and my body and mind have suffered greatly because of it. My anxiety is through the roof, constantly wondering why I wasn’t good enough when we’re apart and if there’s someone else when we’re together. I’ve cried so hard that I get a massive migraine and throw up. 
   Yesterday, however, was the biggest blow. I walked in for my shift and noticed a handmade bracelet on his wrist, made for him by “a friend.” a girl. after he reassured me we weren’t parting ways because he found someone else, but because he needed to focus on his accelerated school program, but i think he lied. Just like I felt like he was lying to me when we were together. Two weeks ago I asked him if he would consider waiting for me, because I would be willing to wait for him. He said yes, and that he missed me. Then a week went by and he texted me saying that I can do what I want, he doesn’t care if I wait. Now that he’s in school, I only see him once a week, and after feeling physically ill this entire day due to the bracelet his new friend made for him, I have decided i’m going to ask for that day of the week off my schedule. 
   My brain is more fragmented than ever before, and the worst part is, this isn’t even the first time I’ve had to learn this lesson, that not everyone who gives me the slightest bit of attention has the best intentions for me or us together. After all, I was willing to take him back after he went to hang out with a girl without telling me and I found out from my friend. My insanely low self worth made me this way. I am so tired of being a doormat with the words “WALK ALL OVER ME” stamped on my forehead. He said I made him feel loved and cared about, which he said his ex did not. I tried, I tried so hard to give him so many compliments after he said he didn’t get any. I took him to a sit down restaurant for his birthday because I wanted him to show that he mattered to me, still matters to me. I never thought this would be a situationship, but here I am, half a year later. He never committed and now he’s gone. I know if he came back right now with nothing but a half assed “sorry” i would hold him in my arms forever. Today he looked me in the eyes and i sobbed and I asked if i could give him one last hug. he said okay, and kissed my cheek. I feel so defeated. I love him. Why was I never good enough for him, or anyone else? why can’t my brain just shut the fuck up and stop telling me i’m being cheated on, or more importantly to stand up for myself? Deep down I know I don’t want to be with someone like him, so uncaring and cold, yet I can’t stop thinking about him and I want him back so desperately. I wish i could turn my brain off and never turn it back on again. I can’t keep repeating this cycle. I come back weaker and weaker every time, in agonizing pain until i find another FP to fill the void until it inevitably sours and it starts all over again. I just want to be alone to avoid this pain and suffering. I want to be free of this disorder.",turtlegab021201,:spinel1::spinel2::spinel3::spinel4::spinel5:,False,1cfz28k,83,3,https://i.redd.it/hwgarp9u6fxc1.jpeg
"Stupid online argument I had. They pulled the ”You have bpd. So I’m gonna disregard you”. Even though… I was right🤦‍♀️ (posting my comments too for full story, because from their comment only you could take me for a maniac, which I’m not) (r/bpd wont allow pics)",1714364606.0,"Last pic, Where I sent them 2 links with actual info about memory (which they seem clueless about) was the one that triggered the first comment: the bpd card. 

They went looking through my post history? Like what??? And decided yes: let’s use bpd as an argument",NationalNecessary120,,False,1cfq6ek,14,14,https://www.reddit.com/gallery/1cfq6ek
I am unwell 😁,1714371771.0,,LasVegasBoy13,:box1::box2::box1:,False,1cfs4qh,55,2,https://i.redd.it/cqez2xqg3dxc1.jpeg
🩶,1714371090.0,,MochaFied91,,False,1cfryes,74,3,https://i.redd.it/pmz7l1uf1dxc1.jpeg
"Oh, im sorry, let me just 🤬 🤯",1714367983.0,,bridget14509,,False,1cfr4lj,296,26,https://i.redd.it/zrrvsm77scxc1.jpeg
Meirl,1714359912.0,,Lost-Economics-3597,,False,1cfos56,73,3,https://i.redd.it/70tjnkkdz1xc1.jpeg
Who approved these😭😂,1714359352.0,"Like I'm assuming two of these is a spelling error, but the first two 🤷😂😭",wisherstar,I have a personality disease ,False,1cfolqz,512,79,https://www.reddit.com/gallery/1cfolqz
i let them convince me to take melatonin knowing it wouldn’t work,1714355764.0,they only get the chance to chart during my potty breaks and then they have to go right back to listening to my rambling.,vanillancoke,:dangerbrain::listentoyourheart::drugsandsex:,False,1cfnfdk,152,15,https://i.redd.it/kcq63y5vrbxc1.jpeg
I had a great day,1714355203.0,,ThrowRA229966,,False,1cfn8t7,57,1,https://i.redd.it/m8zhgu47qbxc1.jpeg
Never ending circle of disappointment,1714349430.0,,OwnAccountant4884,,False,1cflb2r,207,12,https://www.reddit.com/gallery/1cflb2r
Don’t wanna be a burden,1714346980.0,,AbbyRose05683,,False,1cfkfu3,31,3,https://www.reddit.com/gallery/1cfkfu3
Very sad,1714345990.0,"I lost my FP. A little over a month ago he just stopped responding. He gave me his number and said to call if he doesn't snap me back bc he gets busy. I've tried and he's just a ghost. Texts and calls go through, just never any response. Now I'm really depressed I just want a FP who will actually care about me :(",SadBitch640,,False,1cfk32i,100,4,https://i.redd.it/k88pkpxsyaxc1.jpeg
😘,1714344732.0,,ftm666incubus,:steve1::steve2:,False,1cfjmaa,184,7,https://i.redd.it/z1g1bk62vaxc1.jpeg
Twice in the last six months. How does this keep happening,1714337787.0,"it’s ok it’s not like i have serious sexual trauma or anything i actually love being treated like a toy!!! and then to have a fp ripped away from me, to realize he didn’t like me at all and was actually degrading and manipulating me the whole time, that’s so nice of y’all!! 

not to mention all the married/taken men who try to sleep with me despite their partners… people who ask me to sleep with them and their partners… “open relationships”… and so on… i am very tired. ",deranged-possibility,,False,1cfgwt5,83,7,https://i.redd.it/o868wmueaaxc1.jpeg
Accurate,1714337241.0,,Skyis4Landfill,,False,1cfgovm,349,9,https://i.redd.it/fwv241da76xc1.jpeg
BPDchamber,1714337092.0,,TangerineNo8243,,False,1cfgmms,116,0,https://i.redd.it/3zbvn2ec8axc1.jpeg
"also some of my friends are graduating and every time i remember that i start spiraling :,D",1714333722.0,,manic-pixie-dr3amer,:smudge:,False,1cff8ca,121,14,https://i.redd.it/brgset32y9xc1.png
"Literally begging, i will draw u (pretty selfies soothe me for some reason)",1714332570.0,,ToyboxOfThoughts,,False,1cferjd,23,12,https://i.redd.it/ybwstrpbu9xc1.png
Me when I think of the life I could have had if I wasn't forced into a life of isolation when I was a teen due to my environment.,1714332379.0,,Dannboye,,False,1cfeosz,56,2,https://i.redd.it/1ifz0kubu9xc1.jpeg
"""What's your favorite self-harm method?"" ""Competitive games"" ""Oh...""",1714328252.0,,SatokoHoujou,:trans::trans::trans:,False,1cfd0bt,447,60,https://i.redd.it/hr867oikh9xc1.png
I think my fp is getting tired of me and it hurts (:,1714328104.0,,m00minek_,:buttercup::buttercup2:,False,1cfcy5o,103,3,https://i.redd.it/58w9h08mh9xc1.jpeg
💞🫠,1714321016.0,,wez26,,False,1cfa5nv,288,7,https://i.redd.it/4mzs1qjjw8xc1.jpeg
Tit 4 Tat,1714316918.0,,cyb3rbhabie,,False,1cf8kyj,52,1,https://i.redd.it/6gqugwpck8xc1.jpeg
I’m not 100% sure but I feel like this is a BPD thing,1714300111.0,,KabdiSystem,,False,1cf3a1p,499,30,https://i.redd.it/ali817r167xc1.jpeg
It's one of my coping skills. Leave me alone. 🫠,1714288571.0,,MochaFied91,,False,1cf0fwl,161,9,https://i.redd.it/kpwks2g286xc1.jpeg
i just want to be good,1714288119.0,,sweetbabycoconut,,False,1cf0bqj,207,4,https://i.redd.it/2wqsp21q66xc1.jpeg
🫡,1714279324.0,,MochaFied91,,False,1cey13x,165,8,https://i.redd.it/deehlflkg5xc1.jpeg
licherally me,1714279047.0,,bipolarbisexual69,,False,1cexyet,97,3,https://i.redd.it/y5c4kztqf5xc1.jpeg
So fun.,1714276692.0,,Maeldemier,,False,1cexafv,153,4,https://i.redd.it/piph0suq85xc1.jpeg
comforting yellow friends for a grey day 🛌,1714275466.0,woke up at 4am brain decided to remember and be angry at everything someone said to me 3 months ago „oh yeah BORDERLINERS“ when we talked about dating red flags / worst people to date .. yeah as if we chose to be sick like do you say that someone having cancer is a red flag? No so shut up bye,bunnyprincesx,what :bratz:,False,1cewy21,74,4,https://www.reddit.com/gallery/1cewy21
pr...ee.. ttyyy,1714275159.0,,chronicallykafka,:britney::dont:,False,1cewusu,40,1,https://i.redd.it/3hs5ykk645xc1.png
"it's so over, I had a mental break down bc my fp is graduating soon and he and a bunch of my other classmates saw it I can never show my face at my college again  ",1714273306.0,"so I'm tuba player n I'm in my uni's band. Tonight was our final concert of the semester and I was already feeling shit but before the last song started the conductor listed out all the graduating seniors and I cried the whole time throughout the last song I couldn't even play my instrument correctly. When the concert ended I was trying to run to go to my car ASAP but I ran into my fp and started bawling even harder and he's like ""dont worry I'll still keep in touch and I'll still see you in tuba/euph ensemble!!"" I love him so so so so much it's crazy I wanna kill myself I really do it's so embarrassing why am I so in love with this random ass fucking chemistry nerd who plays tuba. Like when I came into uni he was the first one to talk to me and he's always been very kind and wtf I think he's amazing like I want him but I feel even worse bc 1. I would never be able to act normal with him and I already have a boyfriend (bro used to be super abusive but now he stopped??)  And idk sometimes I fantazise this cool tuba guy wouldnt abuse me

BUT holy fuck I wanna die when I think that I'll have to see my fp on Monday again at school, the tuba ensemble is having their own concert am I gonna have that same experience of crying like a pussy at the last song bc I will never be able to be close with my fp. Being a music student with bpd fucking sucks I should quit my instrument and drop out and lie on some train tracks. I could literally never show up at school again I was shouting bc it was so bad when my mom was trying to comfort me but just ended up pouring salt into the wound. She was like ""it's ok it's normal to be sad!!"" And like NO mom I wanna kill myself it is not normal to get suicidal over some random classmate graduating ",howsinavi,,False,1cewax8,177,8,https://i.redd.it/ofvgurxny4xc1.jpeg
Ha,1714269436.0,,AbbyRose05683,,False,1cev4eu,40,0,https://www.reddit.com/gallery/1cev4eu
"This is not a funny meme, this is a cry for help",1714263904.0,,FuckRedditsMom,,False,1cetcko,412,16,https://i.redd.it/8fhl334p64xc1.jpeg
