,Title,Post Text,Post Creation Time,Content Type,Post Score,Number of Comments,Post Author,Author Flair,ID,URL
0,What meds are you on? ,"I’ve been trying my best to get better without any medication since the start of the year. Things get better and then go downhill again. A lot of people are telling me to just go on meds as it has helped them drastically and anything that can help take it as improving without is extremely difficult. 

What has your experience been like? What meds/dosage are you on? How long have you been taking them? 

I’m just worried that if I start taking them then I’ll have to keep taking them. 

Did they really help you a lot to the point where you’re at least feeling 50% better and can manage/control your emotions more effectively? 

",1716299848.0,False,2,2,Vivid-Cranberry81,None,1cx8jb2,https://www.reddit.com/r/BPDsupport/comments/1cx8jb2/what_meds_are_you_on/
1,Meds?,"I’m interested in what kind of medicine other BPDS are getting. I have on the highest dose of lamacital but was recently taken off because it stopped working for me and I kept SH. I got switched to olanzapine and propanol? I am also on seroquel. 

I never tried to olanzapine? Anyone tried it? 

Any other recommendations?",1701721715.0,False,2,1,Decent-Taro-8212,None,18atggj,https://www.reddit.com/r/BPDsupport/comments/18atggj/meds/
2,should i go on meds?,"i was diagnosed with bpd a few years ago, i have mostly internal and quieter bpd. my therapist at the time said that there weren't many options of meds for people with bpd, so i mostly focused on dbt and cbt therapy. now, i'm feeling like my bd might be either creating or aiding some sort of depression. i feel very drained, angry, sad, a lot of the time. instead of experiencing euphoria and then episodes, i just feel like my brain is numb, sad and episodes. i smoke weed daily but it tends to make me feel brain dead, so i'd like to get back to smoking only a few times a week, but my feelings just become so unbearable sometimes. should i be looking into meds? considering the time, energy, and cost...",1699143254.0,False,4,11,fairyari,None,17nzkl3,https://www.reddit.com/r/BPDsupport/comments/17nzkl3/should_i_go_on_meds/
3,Any med you recommend?,"Hi All, 

I'm currently on a very low dose of lithium carbonate. It worked very well for me until it got me terrible intrusions all day long. I want to replace it for another med. Anyone knows a med that is similar to lithium? I'm thinking of a SSRI which is more sedating than activating.... Anyone knows one? Or maybe a med from another category that worked for you? Thanks! ",1715703214.0,False,1,3,Low-Statistician5176,None,1crw0s1,https://www.reddit.com/r/BPDsupport/comments/1crw0s1/any_med_you_recommend/
4,BPD and meds (Quetiapine),"Hi, recently I got diagnosed with bpd.
I’ve been struggling for a long time, and there were suspicions for BPD but now it is confirmed. To be honest it’s not that much of a surprise, I somehow knew I had it but was still hoping it’s not true.
My symptoms became more severe ever since I got into a relationship, including agressive outbursts, jealousy and a constant feeling of uneasiness. Blaming my partner constantly and feeling left out started to kill my relationship, and I didn’t want it to happen at all. Luckily my partner is patient and we somehow stayed together. I went to a psychiatrist, got diagnosed and now I am on Brintellixn(vortioxetine) and Quetiapine.
Already after a few days I can feel my moods are more stable, but quetiapine does make me sleepy and very hard to wake up in the morning. At this moment I am only taking 25 mg of quetiapine at night but I am supposed to up the dose to 50mg a day (25 in the morning, 25 at night).
As I have never experienced this drug I have my reservations and I am a bit scared of it’s sideffects (losing all emotion, drowsiness, weight gain, unable to concetrate)
Does anyone have experience with this drug? Do you like it? Or did you find something else that works better?",1701227895.0,False,1,0,unai96,None,186fg6l,https://www.reddit.com/r/BPDsupport/comments/186fg6l/bpd_and_meds_quetiapine/
5,Depression or missing meds???,"Hello everyone. I've been highly depressed lately esp here within the past two weeks. I mean it feels like just like it did a couple of months ago. I was upset/agitated/irritated/frustrated w/ everyone and everything that pissed me off. Even the slightest thing will piss me off. And I know this is a symptom of BPD but still it gets even worse when depression is involved. So I was feeling like that, I've also been sleeping a ton, which is something i always do when my depression hits, and now that I actually know that's one of my symptoms I'm more aware of it so I notice that's been happening this entire month. I thought it was because I just have a terrible sleep sched. But I'm just really confused. I know I skipped my meds for the past couple of days,  and I've skipped them a couple-a few times this month mostly because I've been at my bf's house and when I get tired at his house at night, I just do not want to get up and take them unless my mom reminds him to remind me to take them, which has been happening recently but at the beginning of the month and before that it wasn't happening so I would always miss taking them. My mom said that I could be feeling this extreme exhaustion because I missed a dose. I looked up the symptoms of accidentally missing a dose of an antidepressant and I had basically the maj of the symptoms on there. But knowing that, it still doesn't really justify even when I remember to take them. So I can't tell if I've just been depressed since december, or if there really had been a couple of months break from my depression and it's just now starting to hit again. Has anyone had this happen to you before? If so what did you think it was?

Edit: I've also been getting the feeling that I should just drop all my hobbies. My hobbies right now include art (both traditional and digital art), and music production. I feel like for one w/ the music production there's just so much to learn. And I feel frustrated because I just spend my entire day watching Youtube vids on how to do stuff. Which I agree is fine but I just want to actually get started on doing something and I spend the entire day watching vids too and I am always very indecisive on what to do w/ my music stuff. So there's the frustration w/ that, and w/ the art stuff I'm the same way. I tried laying out like a plan for my art stuff where I would like to be in 6 months. And this took all day to write out. I lay out a sched for the week of when I did this and I only followed through w/ it for one day and that was extremely frustrating to me because that told me I had taken the time to do that for nothing. So because of this frustration, I've just been getting the feeling that I should just drop everything. I also have a maj in psych right now and I'm even thinking that college isn't for me. I tried dong full time student w/ 4 classes last fall semester. It didn't work out at all, because I have extremly bad time management skills, and I knew that there was going to be a lot of work involved but my expectations were nothing like to what I experienced and because I didn't have the skills I needed I had to drop the classes because I was falling too far behind, and I also had depression/anxiety pretty bad at the time as well so that was coming into plat as well along w/ my BPD symptoms. So now I'm taking a summer class, but I realized when I looked more at the syllabus for the class earlier this week I realized it wasn't the class I thought I was signing up for. My thoughts were getting mixed up because I was reading the description for one class and then I read one for another and then I thought it was like an ""upgrade"" from the first class I read and it turns out it wasn't. I figured because of this, I can't take a class that I'm interested in because I won't be able to focus because I'll end up zoning out, because I won't want to pay attention and I can't do that in a college class or I'll miss a lot of things and fail. So I""m having to drop this class too. And it's just getting frustrating dropping classes so it makes me feel like I can't even do college either. ",1590257845.0,False,1,6,sophiebeanzee,BPD. and Memory Question,gp9q79,https://www.reddit.com/r/BPDsupport/comments/gp9q79/depression_or_missing_meds/
6,I want to stop taking my meds,"Ever since I started I cant feel emotions to their full extent and its killing me. I feel as if im faking all of them and its horrible. I dont even want to wake up tomorrow because of it. I feel so empty and fake.
Will this dissapear if I stop?",1592921111.0,False,4,6,lasdehnennnheart,None,hef72m,https://www.reddit.com/r/BPDsupport/comments/hef72m/i_want_to_stop_taking_my_meds/
7,BPD - MEDS - WEIGHT GAIN,"Even before I was diagnosed with BPD and started treatment, I'd started gaining weight. 4 years later I'm 35kgs heavier. Yes, that's insane. Yes, i have tried every possible way to reduce my weight. I have been able to reduce few kgs sometimes but then I gain more. I stopped meds in between cause they were making me put on weight. Which, to no surprise, made things worse. At this point I am so ashamed of myself.. I do have bursts of energy here and there when I want to lose weight but that doesn't last even for a day. I would like to know if anybody is facing the same, how do you deal with it? Has anyone been able to reduce their weight? How was the journey? 
Thank you x",1591814747.0,False,3,3,Samruddhii001,None,h0h9cx,https://www.reddit.com/r/BPDsupport/comments/h0h9cx/bpd_meds_weight_gain/
8,Med side affect question,"hello everyone. I have a question about meds. Is anyone on meds? I’m experiencing something but idk whether it’s appropriate or not to say it out loud, but if anyone, specifically looking for females since this is a female related issue, at least I’m pretty sure it is, that is on meds please dm me! I’m also looking for females who currently take cymbalta and gabapentin so that way I can narrow this down easier. Thanks for everyone’s input!",1590956808.0,False,0,3,sophiebeanzee,BPD. and Memory Question,gu6ajx,https://www.reddit.com/r/BPDsupport/comments/gu6ajx/med_side_affect_question/
9,I'm so stupid ,I fucked up my meds and now I'm gonna be unable to work.  So what I did was email my team the truth saying I messed up my meds and sorry my bad.  I cringed so hard I couldn't even look as I typed.  What have I become lol,1712818432.0,False,3,2,sharp-bunny,None,1c18jqq,https://www.reddit.com/r/BPDsupport/comments/1c18jqq/im_so_stupid/
10,Uphill of fucked up,"I’ve recently been diagnosed with BPD, I’ve been taking my meds consistently(lie) due to the fear of having an episode and loosing myself(has happened before). But I didn’t think this journey would put me in a bad place with food. I’ve lost soo much weight my clothes barely fit, I can feel my bones. Did BPD meds give me an ED?
",1713618016.0,False,1,1,Sadimhere101,None,1c8pemu,https://www.reddit.com/r/BPDsupport/comments/1c8pemu/uphill_of_fucked_up/
11,Recently diagnosed ,"I’ve been battling with anger and abandonment issues over the last year, thought maybe is just my major anxiety and severe depression but I always felt it was more than that. About 2 weeks ago, my fiancée lined up a lot of the things I’ve done between destructive behavior, anger outbursts, when I feel attacked-I attack back but try to cut deeper, can go from I love you so much to I hate you forever…… now that I’m starting DBT; had my meds adjusted and added a mood stabilizer. What can I do to reassure myself and my fiancée that I’m serious about getting my recent diagnosis under control??? I have a workbook that I need to keep diving into, I joined this support group, new meds and started DBT therapy but I fear it just won’t ever be enough…..",1716079862.0,False,5,1,RaveLeo91,None,1cvbz1s,https://www.reddit.com/r/BPDsupport/comments/1cvbz1s/recently_diagnosed/
12,What medicine helps the most with splits?,"I know not all people with BPD get any help from meds at all, but for those who do, what meds have helped you with your splits and mood swings the most? I’m currently taking Lamotrigine, and while it’s making me a bit less ‘generally’ depressed, I still have extreme splits. Most anti depressants unfortunately make me nauseous
:(",1698334373.0,False,2,7,frycekk,None,17gz61z,https://www.reddit.com/r/BPDsupport/comments/17gz61z/what_medicine_helps_the_most_with_splits/
13,End it all: points of views are appreciated,"Im in my early 30st. 
I had a handicap since i was a kid that led to a childhood full of bullying and resentment.
Was SAed by a trusted family member (not close family)
Bullied throughout kindergarten, elementary, and secondary school, it triggered me do much that I 
Feveloped a skin rash linked to stress and uncured.
Got type 2 diabetes at age 14.
Had body image issues as a teen/young adult. 

Started self harming on and off by age 14.

My older siblings  were overlooked since i got all the focus and attention being the youngest child and the sick one. I had to be accompanied by my parents for physical therapy and for talk therapy (for kids) for years and years. 
So i lived with the feeling of guilt since i took away all our parents focus, and time.

By 19h i was officially diagnosed with chronical  depression and general anxiety. 
Started using meds to just survive day to day life, but was never happy or anxiety free, just alive. 

By age 25 i tried to commit suicide and failed. (Insulin overdose: no one knew it was intentional).

I turned 30 and my doctor officially diagnosed me with borderline personality disorder. I read about it and it makes sense. 

I have a job that im giving the bare minimum to, and feels guilty for letting them down.
No friends because i cant keep a human relationships since i go through a lit of isolating phases.
I still see myself as the biggest burden to my old and tired parents. And a disappointment to my own self. 
I dont want to get better i want to disappear.

Im thinking about ending it all.

I dont want to traumatize my parents so no jumping from the rooftop or hanging in my room, im doing it by meds. 

I heard that if u mess up you can fuck urself up and not die so im looking for tips to not fuck it up. 

Meds that i have access to: fast acting insulin 
Risperdal (raspidone)
bromazepam (lesomil)
Lamictal (Lamotrigine)

I dont want to suffer and end up in a coma. I want to fall asleep peacefully and never wake up. What is the perfect mix to get this result? ",1714945679.0,False,1,2,That_Tunisian_chick,None,1cl2fqm,https://www.reddit.com/r/BPDsupport/comments/1cl2fqm/end_it_all_points_of_views_are_appreciated/
14,"anger issues (idk if this is okay to post here, but no one has interacted w my post in the other subs) ","do any of you take medication for your anger? im jw bc im thinking abt talking to my dr abt trying one as my anger is a big issue. 
im wondering what meds youve tried/are currently on, & whats helped. 

thank you

EDIT:: im on a waitlist for therapy. i just want to clarify as well that im not looking for a cure, only smtg to help manage my symptoms! ",1714091091.0,False,3,12,dabskinpencare,None,1cd7h95,https://www.reddit.com/r/BPDsupport/comments/1cd7h95/anger_issues_idk_if_this_is_okay_to_post_here_but/
15,Been itching for a risky behavior to feel something.,"I've been living with a friend for the past three years, and my partner for 2, they make sure I take my meds, have my mini addictions and make sure I'm good for the day. But I wanna do something random and reckless, but they are all so on edge with my BPD (and my previous unalive attempt) that they always keep a close leash on me. I can understand why they are uneasy, I have a tendency of hurting myself, randomly disappearing for a day or two. Can anyone suggest any activities or advice on how to scratch that itch?",1714267292.0,False,5,11,Maleficent_Cry_116,None,1ceug25,https://www.reddit.com/r/BPDsupport/comments/1ceug25/been_itching_for_a_risky_behavior_to_feel/
16,Rose tinted glasses,"Hiya! So I've [M 26] been seeing a guy[M34] for about three months, give or take. Things were great in the beginning, and I'd been upfront about seeing a therapist. Well lately I've noticed, there's a lot more arguments happening over little things such as me trying to explain my feelings or thoughts. The most recent boundary/ feeling I expressed was feeling objectifed bc it seemed/ seems like all he cares about is being intimate but that's really it. Well right before the holidays [Christmas] I had an appointment ye ol shrink and got bumped up from emd [ episodic mood disorder] to straight up BPD [ sib cat. Quiet or discouraged] which after talking to the doctor and some people ik who also have this, that there's not much meds can really do to ""get rid of it"" and I've told this to my bf and said I'm going to up my appointments. He essentially flipped out on me bc according to him, I need meds bc he went to school for nurse stuff [failed whatever is before RN due poor life choices]. During his explanation he aggressively flipped over his coffee table and broke several candles while say "" honestly I could get drunk and go to any bar and get whoever I want"" which I'll admit still hurts... 

Is there any salvaging this relationship or do I bite the bullet and end it?
Thanks,
A collection of atoms.",1704599490.0,False,2,1,wanderingmotopanda,None,190iwrf,https://www.reddit.com/r/BPDsupport/comments/190iwrf/rose_tinted_glasses/
17,ouch,"im losing my mind and i cant even cry and everything hurts too much. i cant sleep even with my meds, im shaking all day every day and nothing is making it better. i dont know how to make this stop",1703373113.0,False,2,1,ThatWeirdGirlButcher,None,18phlzi,https://www.reddit.com/r/BPDsupport/comments/18phlzi/ouch/
18,BPD vs RAD,"I have BPD (current diagnosis) and was treated for reactive attachment disorder at a “troubled teen home”. 

I’m 21/F and was misdiagnosed with RAD (reactive attachment disorder) as a teen after I came out as gay to my parents. They blamed my “unhealthy attachment to women” as “mommy issues for being adopted” and claimed that I acted out and had behavioral issues. While I did have severe attachment issues, RAD is usually given to kids who are violent, constantly rebelling, and have no attachments at all. I never once was violent towards my parents or even threatened them, and my “acting out” was me texting my girlfriend at the time behind their back because I knew the consequences if they found out. My parents were also heavily involved in the church. I had good grades in school, never had issues with other kids besides typical teenage drama, never used any substances until I graduated (good ol’ MJ but nothing more). I did struggle with SH and my entire mood would be dictated around my girlfriend at the time, and I did feel as if I would pass away without her. However, those feelings never manifested through anger outwardly. 

 I was sent to the institute for attachment and  child development in Colorado, who’s notoriously known for mistreating and even taking the life of children. Just look up Candance Newmarker for reference, she was a victim to the same administration under a different name. The results of the treatment left me with years of trauma and it wasn’t until I was an adult when I got the BPD diagnosis and started doing therapy for it when I finally started healing. Therapy/meds for bpd has truly changed my life for the better, while therapy and meds from the RAD places made me even worse than I already was. 

I can’t seem to find any solid research on the differences between BPD and RAD and how detrimental it is to treat someone with BPD (who doesn’t have RAD) as if they had RAD. Does anyone have a similar experience or has studied this?",1713649446.0,False,1,1,GlassShake8689,None,1c91dsl,https://www.reddit.com/r/BPDsupport/comments/1c91dsl/bpd_vs_rad/
19,How to process guilt (sfw) (trigger warning)(seeking advice),"Trigger warning: DV 
**************



I (24f) have been struggling with bpd since I was in high school. I restarted seeing a therapist in august of last year after I got out of the hospital and was put on meds. I still struggle a lot with lashing out in anger which is what this post is about. Last night I got really angry with my boyfriend. It was over something really stupid. It’s no excuse but he was pushing my buttons so bad and I laid my hands on him. At first I didn’t mean to hurt him and then I realized I was getting way too rough. Today I feel like shit. He’s obviously really mad at me because I hurt him but I want him to forgive me. I understand he needs to process but the guilt is overwhelming me. I’ve begged for forgiveness over and over and he won’t say he accepts it. We can’t even look at each other. Does anyone have any advice for processing guilt when you’ve done something wrong? How do you come to terms that they’re not ready to forgive you yet? Is there anything I can do to right the situation? 

My meds were changed a few days ago so I don’t know if the increased anger could be a side affect. Also I do have therapy tomorrow and will be discussing with my therapist",1699221046.0,False,3,2,LickeyCat,None,17omq11,https://www.reddit.com/r/BPDsupport/comments/17omq11/how_to_process_guilt_sfw_trigger_warningseeking/
20,I wanna die but i got finals💀,"I've been heavily suicidal, on and off but I think all I really need right now is a break and to figure out my meds. I can't handle anymore stress but finals are in a week, and summer school lasts a month. I just want to be sedated lol. Everything is so exhausting

I'm sure I'll try to commit but it won't work because im afraid of pain. the hospital isn't a good option since we can't afford anything like that. I also think im on the brink of psychosis, but I can't really tell. The lines are so blurred, this just feels like everyday life atp. 

what the fuck am I supposed to do. I wanna die but I can't. I have the urge to bash my head into the wall 24/7. I feel like im going crazy

",1715567908.0,False,3,1,chalexica1226,None,1cqosk5,https://www.reddit.com/r/BPDsupport/comments/1cqosk5/i_wanna_die_but_i_got_finals/
21,Anyone know what this is,"I don’t know if this is a bpd thing or a med thing but sometimes I will just randomly get so so angry. Not at anything or anyone, and it won’t come with any thoughts about anything, I’m literally just angry for no reason. And I’ll sit here and want to scream or run away or hit something and there’s no reason for it. I want it to stop it’s so awful to go through over and over.",1713292452.0,False,3,3,Puzzleheaded-Dog1407,None,1c5nlnk,https://www.reddit.com/r/BPDsupport/comments/1c5nlnk/anyone_know_what_this_is/
22,Last night I almost :/ ended things TW: SI and SU,"Backstory: I’ve been dealing with the thoughts my whole life, had a couple attempts and ended up in the mental hospital more than I want to count. Was diagnosed bipolar but new that wasn’t me so I continued life not knowing what really is up. A couple months ago I met with a online doctor she diagnosed me with BPD and said that she couldn’t treat me or give me meds bc of the state my SI thoughts are in. Every single day and I cannot help it. So I’ve been struggling alone and no one seems to care. I’ve been drinking way to much this past year, about a 750 ml every 3 days. I go to bed sick and pass out. 

Currently, last night: what triggered the thoughts was a phone call with a close family member. The call went fine and the person didn’t do anything wrong but I couldn’t stop thinking about how terrible I am, how I talk to much, how embarrassing I am, how no one can stand me, my own husband ect and I’m so tired of making a fool out of myself. I’m tired of existing and failing. After dinner I asked my husband to take my son with him and get us some ice cream, I wanted to be alone.. you get the point. I know it sounds pathetic but I thought that was my only chance and if I didn’t do it then I would keep suffering and things have not ever got better, I don’t want to live in pain anymore.

TW: idk if I’m allowed to talk about the details this is my first post on here. But here it goes- I grabbed my husbands hand *** and loaded it. Finished up my note that’s been sitting in my phone for a while and put it up to my head. I then got scared and couldn’t do it. Thinking of SI is one thing (sounds easy enough, sounds like a release) but in the actual moment I was actually scared of the pain. Finally I heard my husband pull back up the house so I quickly put everything back up. I went out like everything was normal and he went to where the stuff was and said “WHY WERE YOU MESSING WITH MY STUFF” I said I wasn’t and he called me a child and said “wow now I can’t even keep these in the house” he unloaded them all. I he kept verbally harassing me. I put my son to bed and slept in our guest room and he hasn’t talked to me since. 

Now I feel so embarrassed and alone. He makes me feel pathetic. I know I am. I’m barely hanging on and no one seems to care. I have told my mother and close people how bad it is and they said “sorry maybe you should get on meds “ I’ve been on soo many different types of meds my whole life and it was a nightmare, felt like I was living in a shell. 

Anyways, I guess I needed to let it out. Maybe talk to someone who is going through the same.",1700236522.0,False,3,3,ZealousidealLet4898,None,17xi547,https://www.reddit.com/r/BPDsupport/comments/17xi547/last_night_i_almost_ended_things_tw_si_and_su/
