,Comment,Author,Post
0,"hi, im no doctor, but when im at my lowest they helped me get back on my feet enough to try and … idk.. ground myself a little. I usually fall back down, unfortunately, albeit it takes time. I feel like there’s never really an end to the ups and downs. I’d say 50% is accurate enough with the right mindset. I’m sorry if my answer isn’t what you were hoping for. Just my personal experience.",xSnowVale,1cx8jb2
1,"I'm on fluoxatine (probably spelt wrong) 
For me it doesn't make it better however it stops the up and down and keeps me on a straight path for the most part.

I think it helps making me less angry for sure",misswatkinz,1cx8jb2
0,"I’ve at times been an anti-psychiatry type, but in my and many others experience, medication is beneficial. Stopping weed/nicotine sucks, my experience has been that quitting after using for a while has caused emotional turbulence. I believe my medication has lessened the lows and destructive behaviors for me.  But most importantly: talk to a doctor about your options. Like others said, exercise, good habits, etc., a lot of the stuff traditionally advised for depression and general improved health will help you over time. A doctor will also be able to get a better picture of your health than this forum can. Wishing you the best.",beingandbecoming,17nzkl3
1,"Honestly starting meds was the best decision I ever made! I’m on Seroquel and Lithium, but find what works for you. I started out on these and these just happen to work best. Now, I still struggle with my BPD symptoms like mood swings, but they at a level I can control. That’s the goal - Management. I used to struggle a lot of suicidal tendencies, impulsive behavior and such but again, these are now thoughts that I sometimes have, but am able to control due to my medication. The medication gives me time to react and think about my decisions before I act on them. Before? I used to act then figure what the hell I needed to do to clean up the mess I made lol. I mention my struggles because I want you to know medication isn’t an end all be all, but it is 100% something I recommend to everyone considering getting on them especially pairing meds with DPT and CBT. It’s very helpful in the recovery process.

If you need help paying for meds, I do too, look at using apps like blinkhealth, goodRX, Cost Plus drugs, and even CVS has a discount card for medication. These services provide discounted prices for prescription medications. I’ve used all of them. 

Also, this is a bit of advice you didn’t ask for but from a person with BPD to another. Staying off of social media has given my life a whole new meaning. Like I find myself enjoying my life and not comparing myself to others or becoming obsessed with people etc. Also try reading the book atomic habits, I know cheesy, but I just started it and it’s helping me. Idk, but it’s something to consider! 🤍",,17nzkl3
2,"Holy shit I’m literally going through the same thing 
I’m not sure what you want to decide on for your journey but my psychiatrist told me that I should probably be on medication and antidepressants especially will help . I personally have major depression disorder as a diagnosis. But I do believe with the right medication can help the pain.  
If you’re gonna go on meds, I think considering your environment and your current lifestyle is important . For example I am currently working on quitting alcohol and nicotine.",TotalConstant9478,17nzkl3
3,"I’m on antidepressants and it really helps me, talk to your doctor about it if you feel like you need something. If you don’t like it you can always stop taking them",Demonderus,17nzkl3
4,Have you tried rigorous exercise? Serious question.,,17nzkl3
5,"I was recently diagnosed with BPD and yes the meds can help. It may be a long journey to find the right ones but as long as you know your medical background and have been logging everything and be open and honest about all your struggles and childhood and adult trauma they will adjust you to the correct ones. Please don't lose hope. A 24yF bullying/sexual assault and lack of emotional parental person. I've had it all. Get rid of the bad addictions, start with good things and find what makes you happy. Music, yoga, journaling, video diary, try it ALL.",Loud-Age-226,17nzkl3
6,i have not… my therapist recommended it. i dance twice a week (theatre major lol) but that’s it. takes a lot to get me motivated to do it,fairyari,17nzkl3
7,[deleted],,17nzkl3
8,I have a ptsd dog :) if he is not exercised 3-4 times a week he is an 🤬so that’s my motivation,wotstators,17nzkl3
9,well i won’t be doing that ! i’m a little more self aware … your comment is unhelpful (:,fairyari,17nzkl3
10,"Yeah really 
Why add a story to it",Sir_Lee_Rawkah,17nzkl3
0,"SSRIs aren’t similar to lithium. Lithium is used as an antipsychotic.. we cannot recommend medications, as I’ve said before on other posts, what works for one person, might not work for everyone. I would suggest speaking to your psych team for better advice.",jaycakes30,1crw0s1
1,"Not a recommendation but as the other person said SSRIs aren’t similar. Lithium is a mood stabiliser, other mood stabilisers MAY be effective but everyone is different. talk to a psychiatrist 💕",BedSad3,1crw0s1
2,"I'm on a mix of lamotrigine and quetiapene and it's been working really well for me with minimal side effects. The worst I've experienced is dry mouth (which honestly it's encouraged me to drink way more water so that a plus) and clumsiness/lack of coordination (which is honestly just funny sometimes) lol. I'll just randomly be holding a pen and my hand will just drop it and I'm like ""oh nice""",atlasdur,1crw0s1
0,"Music takes a long time! don't stress. seriously there are technologies I spent 7-10 years learning and I still forget stuff.  It can be really helpful to hang out with other musicians and get off the internet- youtube is not my favourite way to learn for the reasons you stated.  

The way I deal with the creative stress is to be kind of scheduled, so that it fits in with your life (it's pretty hard to do music and school in my opinion, but sometimes it works.  I feel like you can always keep a little practice going somewhere- and I find mobile apps can be nice for this, I like this one called sunvox which is free on android.) 

This is how I do it: I jam on my instruments after work or school on monday/tues.  W/Th I make sure my work stations stay clean, but I don't usually get a hand on it.  Friday night I do my correspondence or computer work as that is the only time I find enough quiet usually to do production.  Sunday I back up files.  

This is nice because there isn't any catching up.  If you miss a monday, well there's tuesday. If you miss both, well I guess you don't get to jam this week, which is sad but you'll want to even more next week. If you don't backup one week, you can do it next week, and if you feel like going out on friday night, well fine.   Hey, every once and a while your desk might already be clean on wednesday and you might feel extra inspired!    


Focus is hard for me, so the separation of tasks really helps and is less overwhelming.   


Seriously, for everyone, it takes a really long time to learn. 

  
Hope this helps!  And yeah, it's ""normal"" to go up and down.  Sometimes my depressions are very extreme even when i'm medicated but usually I feel better after some rest.",,gp9q79
1,Hey this is actually sounding like a method that could work for me. Do you care if I DM you more about this sched? I was wondering if you could help me come up w/ one that would work for me and fit my needs. :),sophiebeanzee,gp9q79
2,"If I could give you a reward on this comment I def would've but I don't have enough coins. It's stupid really that you have to pay for the coins. What they should do is give you a certain amount each month for free, then refill it the next month! 😣😀",sophiebeanzee,gp9q79
3,sure im taking a screen break this w/e though so may not be v responsive,,gp9q79
4,"i don't care really, I only use reddit for this group",,gp9q79
5,thx tho,,gp9q79
0,"Well it could be possible that the particular med(s) you are on aren’t suited to you. They can make you feel worse. It’s generally not recommended to just stop taking your meds because some meds can have disastrous consequences and withdrawals and even worse suicidal thoughts and anxiety and stuff. Not claiming to know it all but have been on meds for years and can say they really aren’t fucking around when they say dont stop taking them suddenly and to talk to your doctor/psychiatrist about it. It’s possible you can just stop, just talk to them first before making the decision so you don’t feel worse! I’m sorry you’re feeling like this. Meds can be really hard to get right and unfortunately have a lot of side effects that make it seem like it’s not worth it. I believe you got this OP, it’s gonna be ok even though it doesn’t feel very good right now ❤️",,hef72m
1,"Definitely talk to your doctor or psychiatrist and they should help you but as someone who was told by a psychiatrist (that i no longer go to) she told me to go off meds cold turkey for some odd reason and it was the worst month of my entire life. I was very suicidal, id constantly cry out of no where. If you think bpd mood swings are bad, coming off meds can make them farr worse. 🙈 it also depends on how long youve been on those meds and also it does take a long time to get meds right so if you dont like how you feel with these talk about how you feel with your doctor and hopefully theyll sort them.",Kuraaku1,hef72m
2,This happened to me when I was on 20mg of Lexapro daily! Turns out I only needed 5mg (:,ayyemmsee,hef72m
3,It usually takes about 3 weeks for a lot of meds to show their effects. All mood drugs has warnings. I suggest talking to the pharmacist before any decision.,,hef72m
4,Thank you so much for your support!,lasdehnennnheart,hef72m
5,Of course!! That’s why we’re here right ☺️,,hef72m
0,"Weight gain is an unfortunately common side effect of some psych meds :(

If you don't get replies here, try r/mentalillness since it really is a common med related experience.

Sometimes shame goes away when you're able to share that feeling, like talking with friends or even journaling or making art about it. So it makes me wonder, when you notice wanting to lose weight, who would support you? Who would you want to be about to share that with?",TranZeitgeist,h0h9cx
1,Yes. I gained close to 20 pounds on Serequel. I understand and those feelings sound tough. I feel it's a matter of perspective: that if the meds working outweigh to their side effects,,h0h9cx
2,Yeah I’d rather be fat than mentally unstable but also it’s annoying. I also really gained a lot quickly but have just gotten strict about exercise which has its own benefits. I just cut down to one med and increased dosage so that I’m moving and not fat AND sad,,h0h9cx
0,"I used to take both of those together. I’m off the gaba now. What’s happening? It’s reddit, so nothing is really “inappropriate”. 😂",fashlatebloomer,gu6ajx
1,"True 😅 someone made a chat w/ me on here, idk if it’s available for group chat, or if it’s just a dm between me and them, but if it isn’t, I’ll add you. I just don’t wanna disclose anything that would be offensive towards anyone, or cause anyone to have triggers which is why I didn’t want to post specifics about my issue.",sophiebeanzee,gu6ajx
2,And sorry for the late response M just now getting this!,sophiebeanzee,gu6ajx
0,You're only human. This will help you have compassion for someone else someday. Hope you feel better soon.,funtrial,1c18jqq
1,"Omg I have an upset stomach today

Crap my internet is down, isp is coming tomorrow 

Windows stopped booting

For your bank for next time 😅",Best_Tart_7252,1c18jqq
0,"Some medications can suppress appetite, but dramatic weight loss should be discussed with your primary care physician asap.",jaycakes30,1c8pemu
0,"I have no advice for you, but I’m in the same position. I keep teetering between “I can do this” and “what if I can’t do this?” I’m so scared I’m going to lose everything, and that I’m never going to be able to repair the damage I’ve caused. It’s so overwhelming and also the guilt and shame are drowning me. I hope you (and I) find a way through. 🤞",Mamapakled,1cvbz1s
0,"Like my psychiatrist told me, the meds will help my anxiety and depression, but therapy is where I should be tackling bpd symptoms. Ik for a lot of people meds don't make a difference with bpd, it can help a little but dbt or cbt can help a lot as long as you keep up using it",punkmexicana,17gz61z
1,"I'm on Abilify and it's helped with all of my symptoms dramatically. Only problem is it's helped so much, I can't tell when I'm splitting. I used to be able to identify it when it was happening.",,17gz61z
2,[deleted],,17gz61z
3,I’m on many meds and unfortunately none have really worked on my splits. The only thing that helps is being alone and processing why i’m splitting thru writing,youtubehistorian,17gz61z
4,Lexapro has in general made my symptoms alot more tolerable but I don't think anything can directly help with splitting,belmoria,17gz61z
5,I got prescribed an ssri for my anxiety and a few other symptoms and it made my splits go crazy. I was thinking about trying to find a good mood stabilizer.,More_again1959,17gz61z
0,"God loves you! Please ask The Holy Spirit to come into you and guide you to real help. Pharma isn't enough. Real counseling can help! I didn't think I would ever feel ""normal"" again... I was suicidal and paranoid. I finally asked for help from our local DHS community center. Being around other people going through the same suffering and pain finally made me realize I wasn't alone. The classes gave me real tools to help me. I pray you seek out the help that is available. You just have to ask for it. 💙💚🩵",Chainsaw7777777,1cl2fqm
1,"If you die, you will be free of pain but will have no love. 

Hold onto a tree. Keep crying. I’m thinking of you.",wotstators,1cl2fqm
0,"Mood stabilizers help… like topamax, neurontin, depakote, seroquil",5crackmonkeys,1cd7h95
1,"There's not any medication that is going to fix what you are experiencing, it will help. But you need to do the work to get better. Go to therapy, online therapy or buy some workbooks on BPD if you can't do therapy.
Edit - I'm on Seroquel .",NoView5165,1cd7h95
2,Just xanax ,devilsissue,1cd7h95
3,"And Lamictal, I can't think of any others.",Silent-Tadpole3779,1cd7h95
4,"i know. im not looking for a cure, just smtg to help manage it. im on a waitlist for therapy rn",dabskinpencare,1cd7h95
5,my dr doesnt want to prescribe me any benzos (honestly probably for the better anyways),dabskinpencare,1cd7h95
6,Ketamine stopped my rage attacks from bpd. Message for info ,devilsissue,1cd7h95
7,That sucks. I rely on them to function lol ,devilsissue,1cd7h95
8,i feel like theyd help so much tbh. i get a pretty constant chest pain/discomfort from anxiety that gets worse bc i get anxious bc of it XD,dabskinpencare,1cd7h95
9,"They help with motivation, anxiety, sleep, happiness. But it increases brain fog,  memory issues, addiction, black outs if taken more than prescribed. So it's hard to get but you can ask to try a benzo like klonopin or Ativan and see if it helps you ",devilsissue,1cd7h95
10,"yeah addictions the big thing for my dr w me. 

when you say it helps w motivation? how so? if youre able to explain",dabskinpencare,1cd7h95
11,"I guess because it gives me dopamine it helps my executive dysfunction. Like a boost of motivation but in a calm good feeling way. It helps me be more creatively inspired and get my self care done, sometimes lol ",devilsissue,1cd7h95
0,I scratch this itch by playing certain video games. It's a safe way to do it.  Is that something you'd be interested in trying?,coollalumshe,1ceug25
1,"Have you tried extreme sports?  Or martial arts?  There's full contact swordfighting, night paintball with no armor, you got tons of adrenaline options that don't put you in literal life threatening positions, if that's what you're asking for",sharp-bunny,1ceug25
2,"In the past, how did you scratch this itch...

What are you used to?",HiddenAssumptions,1ceug25
3,Gambling? I'd say low dose some psilocybin it's the least destructive and most fun,devilsissue,1ceug25
4,What video games have you played to help with this urge?,I-have-the-tism,1ceug25
5,"Definitely have attempted trying to use video games, I've tried a wide variety of game types, first person shooters, RPGs, open world survival, and a bunch of others. They don't really pull me in I can play for like an hour and I get bored. Even if I nuke a town in fallout it doesn't seem to help much.",Maleficent_Cry_116,1ceug25
6,"I'm definitely not the athletic person that can do extreme sports😅. I used to wrestle in highschool and play football, I do hunting and enjoy practicing with throwing knives but it's not like the adrenaline from extensive activity it's more the rush from when you get slightly injured I suppose.",Maleficent_Cry_116,1ceug25
7,"In a number of really unhealthy ways, but I'm trying to find better ways. I took the first steps into going back to therapy, so worse case they will be able to give some ideas.",Maleficent_Cry_116,1ceug25
8,Oops sorry for the late response. Dead by daylight is a constant adrenaline rush as you're being chased. Other games like this work too like Friday the 13th.,coollalumshe,1ceug25
9,How ya doin now?  Hope you are relatively unscarred all things considered.,sharp-bunny,1ceug25
10,Had my first day of therapy yesterday,Maleficent_Cry_116,1ceug25
0,"Hey.
I’ll start by saying that it’s good you’re setting boundaries and receiving continuous professional support. I would stick to what your therapist suggests rather than what your partner has said concerning medication etc. I can confirm that there aren’t really many medications than can help with a BPD mind. People often equate it to something like anxiety or depression (as these are common symptoms for us and can be treated with meds) But if anything, I think BPD is more akin to something like being on the spectrum. It’s more just that our brains are wired differently at a core level. I usually find explaining it this way to those who don’t understand BPD helps a bit more. 
It does sound like your partner has some problematic behaviours, and it’s worth taking the time to think about whether they’re open to working through them, and whether you’re up for standing by them whilst they do. Outburst of anger are a big no for me, but you may be someone who handles that stuff well.  We can’t really tell you whether you should end it or not, that’s down to you. I guess it’s all about balance and protecting your peace. If they’re making you feel worse, then it may not be worth continuing the relationship x",Accomplished_Funny51,190iwrf
0,See a doctor! I have been trying to see a psychiatrist for my worsening mental health but the waits are insane… see a doctor and they can push for you to see a psychiatrist if you’re desperate or they can help you for the short term,Budget_Community_605,18phlzi
0,"I don’t have a similar experience or know any studies. BUT I’m proud of you for getting through that, accepting therapy and meds and finding healing ❤️",Street_Chance9191,1c91dsl
0,[deleted],,17omq11
1,Thank you so much for this. It was really nice to hear your advice. I wouldn’t have thought of doing some sort of class. I will definitely check it out. I know it in my head but the sentence you’re not a monster is nice to hear. It feels that way a lot. Wishing you all the best,LickeyCat,17omq11
0,"Are you under a psychiatrist? Have a therapist?? These are worrying symptoms and I think it’s really important you talk to someone. 

I’m not sure where in the world you are but I’m not than happy to find resources for you to that could be helpful?",jaycakes30,1cqosk5
0,"That's BPD. One of the diagnostic criteria is ""Inappropriate, intense anger or difficulty controlling anger.""",rockem-sockem-ho-bot,1c5nlnk
1,I have similar thing. I'm not sure what it is but i find it very helpfull to just vent to someone who wont juge you for that. Music and having a walk helps. Might sound stupid but i actually find it helpfull.,yeah_ofc_its_taken,1c5nlnk
2,"If you are a person who menstruates, I’ve noticed a lot of correlation between my cycle and the intensity of my mood swings. Anger can just be a symptom of BPD, but being mindful of what is your brain vs body is trying to communicate. 🫶🏻",urgnomefriend,1c5nlnk
0,"Sorry to hear you’re not well🙁, have you considered seeing a psychologist in person? That way you could discuss getting your partner to come along to a session and the psychologist could help explain how he can help or develop an action plan for you when you’re not well and also for him to understand the condition. I give this little article to explain my condition from time to time to people close to me: [https://medium.com/invisible-illness/its-all-in-your-head-borderline-personality-disorder-and-the-brain-c14b66eb0966](https://medium.com/invisible-illness/its-all-in-your-head-borderline-personality-disorder-and-the-brain-c14b66eb0966)",DiStUrBEdMeLoN,17xi547
1,"Hooray for your first post (sorry it came out of desperation)!!! I'm so sorry you're going through it! Gosh, I can really relate to the loneliness of all that secretive si and attempt. It's such a hopeless place to be!!! And even more so when those in our lives can't/ won't help, or make it worse somehow. It sounds like you might need a different type of support in your life than what you currently have. (Easier said than done, I know...trust me I know.) I don't have any magic solutions, but here are some things that helped me at different times that could be helpful to look into, or hopefully even just distract you for a little while:
* Patrick Teahan is personally my favorite and has the most content. https://youtube.com/@patrickteahanlicswtherapy?si=xyLPH_H-FwQh8ZJS
* Dr. Kim Sage is very calming. https://youtube.com/@DrKimSage?si=I4UsdHF9AtueHxUe
* Dr. Fox is very practical, but sometimes his face bothers me, so I just listen to his stuff 😉
https://youtube.com/@DrDanielFox?si=ZnsBzlcWyJcbg1Uk
(All of them have content on other platforms as well.)
* If you struggle with self-harm, this is an alternative list of things to try to avoid self harming, and it is a loooooong list. https://projectlets.org/alternatives-to-selfharm
* This bpd sub has been particularly supportive and validating, and I encourage you to ""let it out"" here.
* Therapy/new therapist if you have access. Same with psychiatrist if you have comorbid issues that require meds. 

Also, I understand people have reactions, but out of concern for your health, I just want to say that your partner's reaction to noticing that you ""messed with their 'stuff'"" is concerning to hear. I don't hear concern for you in ""now I can't even keep these here"" - however, I do hear them shaming you in what was relayed. (I do think it's better the weapons aren't in the house for some time but that's it's own thing)...AND It's no wonder you're having a ""reaction"" and probably having trouble regulating. Sometimes people don't realize they speak a certain way toward others, and sometimes ""we"" don't pick up on it b/c often we've been conditioned to accept ""less than."" I just thought, based on your post, it might be a useful conversation for you and your partner to have or revisit when you felt comfortable so that maybe the next bad situation doesn't go from bad to worse. 😬 Shame and BPD don't generally mix well. 

I've struggled with mental health issues my whole life, been in therapy for 25 years - dozens of medication trials and various treatment modalities later I'm still sitting in a near constant state of wanting to die, too. I'm trying to figure it all out, too. I hope something in the list helps, and if not, at least we can suffer together. 🖤",LongMedia7072,17xi547
2,"Honestly me after. Do whatever makes you happy. If drinking is it be careful but be mindful of your emotions and don't go overboard . If you need someone to talk to , I'm here . In the same boat. LIFE SUCKS ASS love . Be good to yourself ❤️",Mindless-Rip-4007,17xi547
0,"Known guys on exogenous testosterone and yes, mood elevation, heightened emotions and mania/confidence are all increased. Keep your providers in the loop, congrats on the changes",beingandbecoming,1c9d9um
0,"Bpd, depression, anxiety, ptsd 

My medication is for depression and it helps me a little but I mostly try to cope",punkmexicana,1bf64ze
1,"Yes. Apart from bpd I also have social anxiety, adhd, possible ptsd, anorexia/other ed and a bit of ocd",Consistent_Cold1908,1bf64ze
0,"There are times when I split that I am calm and not filled with pure rage. But I of course don't mean anything that I am saying, because I'm in an episode and I am splitting. I've split on my partner while crying too.",Topic-Economy,1ciu9kt
1,"I’m more cold and callous, but can also be accusatory and spiteful.",heyitsEnricoPallazzo,1ciu9kt
2,"Yes absolutely. Everything about this sounds like splitting except this:
>She even cried and said that I remain her soulmate.",rockem-sockem-ho-bot,1ciu9kt
