,Title,Post Text,Post Creation Time,Content Type,Post Score,Number of Comments,Post Author,Author Flair,ID,URL
69,"Wedding got cancelled.
","I know this post is very long but please take the time to read, I really need ur opinions and help on this one🥺🙏🙏

I (20f) and my partner (26m) have been waiting to get married for 6months now, we have been together for 4 years now, engaged for 1. I struggle with bpd but we found this out during the relationship. During our whole relationship it has been rough, when I met him I was very young and had just came out of a very abusive relationship (when I say just it was probably nearly a year later) and was still recovering, he knew this and we made it work anyway. It was great for a while, I started really feeling better with my mental health. Then I got assaulted by one of his friends. ( It's a long story but I won't get into it now) Obviously my mental health degraded after that and I was in and out of hospital and that is when they figured out I had bpd. It was a horrible time in my life and to me felt like forever. Right when all of this was happening COVID hit, my bf lost his house bc his roommates left unexpectedly bc of COVID and he couldn't afford it anymore. So I was still living with my parents at the time and I was SOOO ill that my parents agreed to my bf moving in with us as he was helping so much with my mental health. The plan was always to leave and move in with eachother but life sucks as you all may know. We saved enough money to leave together and work on the other side of world with his dad, we were there for 3 months but to put it short his dad fucked us over and then Brexit happened ( I'm British) so I was not allowed to work basically anywhere and had to leave. So we came back to my parents and decided to get married as we had previously been engaged for a year anyway so we could build the life together that we wanted. So that would have been 6 months since we came back and decided to do all of this, I spent a lot of money on paperwork and got very stressed about it. In this period of time our relationship was under a lot of stress and pressure and let's just say that my bf ""cracked"", I am very patient with him given how patient he was with me and how much he helped me with everything, but I can only put up with so much. He has been shouting at me and calling me names every day for maybe 8 months. So eventually we got to a point where we could finally get married and go away together but because of his behaviour I am not well enough to go now, I had to quit my job due to panic attacks coming back. Had a trip to the hospital and now back on meds and I am physically ill from my anxiety (vomiting, nauseous, not sleeping) We had a very long chat and for obvious reasons have cancelled the marriage because I am not well enough to leave yet and because of how toxic everything has become, he says that he behaved this way because of stress and is very sorry about the whole situation. He wants to stay here for a few months (I don't know how comfortable I am with that) and save up money so that he can leave on his own ( he hadn't been working since we came back which really bugs me) and I have to stay with my parents where they can look after me and I can get the help I need with the psychologist bc where we want to go I will have no insurance or right to it and I NEED it right now. His plan is to work and study at the same time while he is there and then go to uni and after uni come and get me. Which to me seems like a silly plan, I can make a year work but not 4 years. Also I feel like after everything happened it's not really the same anymore between us (I really do love him but it's all a bit too much) I just feel a bit in shock with all of this bc it all happened very fast and suddenly I am now trying to figure out my life. I am 20 with very little work experience and little to no education (I am very intelligent but could not do these things due to panic disorder) I have 0 friends, I only have my mum and dad and we have very little money. I want to move away but it seems nearly impossible on my own and I just feel a bit defeated by this whole situation. Obviously I think being on my own and focusing on my mental health and getting a job that works for me would be the best thing for me rn, but obviously bc of my bpd I am terrified of being alone and it's already hard as it is bc I have no social life apart from him and it been like that for so long that I don't really know where to start. I just don't really know what to do in this situation, he seems to think that if he leaves and does all of this he can make it work between us, but I am not so sure. I feel bad for saying that but I just don't think we're on the same page at all.",1709576774.0,False,4,9,Naive-Foot4459,None,1b6i730,https://www.reddit.com/r/BPDsupport/comments/1b6i730/wedding_got_cancelled/
70,Getting tired of being tired. Feels harder to keep going on,"If I'm posting this in the wrong place let me know and I'll delete it.

I can barely stand to go to work because of all the triggers causing panic attacks.  When I'm home all I can think about is the best way to end everything.  My wife is so busy with her personal stuff that I really can't talk to her.  When I do she turns into a total bitch.  I go to every thereopy sessions, do my journal, follow my breathing techniques, and follow my meds to a tee.  

I feel like I'm getting nowhere and more and wore out.  I think more about how I can get legally high with OTC so I can a few minutes of joy.  Or where  I can comfortably open my wrists and feel the life leave me and float to sleep.  

I don't want to go back to the hospital because the nurses refused to give me the medications I needed to survive. I have physical conditions outside BPD but they treated me like shit until I filed a complaint.  Oddly enough they sent me home the next day.

I'm holding on for now.  I don'' know what I will do a week or two if I cant find the eye in the storm.",1472417875.0,False,6,2,tekrat,None,501dn8,https://www.reddit.com/r/BPDsupport/comments/501dn8/getting_tired_of_being_tired_feels_harder_to_keep/
71,Rant/seeking support,"So it feels like no matter what I do I'm doomed to drive everyone away and make them hate me. I'm getting pretty good at controlling my emotions and knowing when I'm over reacting. I can sit back and say ""hey, this is just your bpd making you take X the wrong way. Just calm down and think it through.""

But what if that's not enough? I'm doing the best I've ever done, and I'm still driving people away from me. I've been communicating well, taking my meds, doing therapy, exercising,  and yet even my closest friends can't really stand to be around me.

I'm still always jealous and posessive, but (I think) I'm handling it okay and not letting them know. The jealousy is the worst part. No matter what I do I can't stop hating when someone picks someone else over me. I can't even handle stories about people doing things without me feeling this awful ugly rage boiling up inside me. And I know it's irrational and I try to stop it. But I've been doing SO GOOD at not showing it!

Ive been doing so good at everything, but I still can't shake the feeling that I'm too crazy to love/be around. I feel like I'm just going to end up being alone forever because stability to me is still too unstable for normal people...",1444406250.0,False,5,5,cheesybagel,None,3o43zk,https://www.reddit.com/r/BPDsupport/comments/3o43zk/rantseeking_support/
72,I cancelled new years eve plans and my gf is still going - I'm sad and mad,"I always hated new years eve, I always spent it alone because I had no friends or on the few occasions I did I cancelled last minute, idk why. I have been with my gf for 2 years and I have spent the last 2 new years eve with her and her friends, and we were supposed to be spending this one as well toghether. 
As soon as New Year's eve was mentioned, I told her that I was really hoping to not go away and celebrate it in our city, but her friends (which I spent also a lot of one on one time with) said that they were thinking about going to the lake house, which is quite far away to get to by train. I mumbled and truly didn't want to go and I asked my gf if we could even hint at staying in genoa, She said it was already all decided and so I didn't even get to express the fact that it was going to be difficult for me be there. So I just followed along the plans, which ultimately became too much for the same exact reason that I told her in the beginning: I have wayyy too many exams and I am stressed because it implies going away for many days rather than spending just one night. So I told her I couldn't go anymore and we initially left it all there, she truly apologised and asked if she could try to talk her friends into doing it here, but ultimalty I said it was already too late, she should have thought of that way earlier, as we had been talking about new years eve for more than a month. I wasn't too angry at first, I was much rather disappointed that she still wanted to go even though I do understand that it is probably her last New years eve with her friends since they are all graduating med school and going different pathways, still I felt like the main priority for her was to spend it with her friends rather than me when presented with the need to spend it with one or the other. This really upset me as I feel like I have been hurt twice - first of all by her not saying anything to her friends when I mentioned it would have been a problem for me still I passively agreed because as soon as I feel someone shutting me down, I am not going to ask again ( I truly don't think she did it maliciously she never asks her friends for anything even if she needs something and I do believe she didn't want to cause any problems), and by her going even though I have decided I can't anymore and I blame it on her since she didn't say anything, that might not have changed the original plan, but could have least let me be honest about my struggle rather than swiping it down the rug. We have been fighting a lot, I am so mad, I am trying not to insult her anymore since the last year it was a fucking mess as she was studying abroad, and this discussion reminded her so much of all the discussions we had while she was away( she wanted do to something i made her feel guilty for not making me enough of a priority and it ended up being a nightmare for her, since she cut off contact with all her friends to try and salvage our relationship, and even though i regret it so much, this doesnt seem to help me change or act better, the only thing that's changed is that i dont verbally abuse her anymore calling all sort of disgusting names.
I don't know what to do or how to cope these days. I feel as I always do this thing where when we have a sort of big plan which involves going on holiday/moving from our city, I tend to not want to go, as a sort of provocation? To test her to see if she would chouse me? Obviously she always fails because people cannot be tested on these things, still my rational brain and emotional brain seem to be 2 separate entities and there is no mediation that lasts long enough for us to stay peaceful. She is now saying she isn't gonna go if we don't find a way to even discuss this in person because she won't go if going away means starting the new year angry and resentful. I think I try to emotionally manipulate her, and I don't know how to change this or how to even come to terms with the fact that I do this that makes my love feel not authentic, wondering even if, and borderlines in general have the capacity to love another person without wanting to bring that person down to your sadness whenever something happens that doesn't go my way. It makes me feel rotten to core, and yet again, I seem to all relate it to myself. 

Summary: gf and I were supposed to spend new years eve together, I said I wasn't going anymore bc I couldn't and I'm mad she still is going.",1703850596.0,False,4,8,United_Cry3357,None,18tlf2g,https://www.reddit.com/r/BPDsupport/comments/18tlf2g/i_cancelled_new_years_eve_plans_and_my_gf_is/
73,What to do at this point - suggestions welcomed,"I have been diagnosed with BPD for almost 8 years now. One of the hardest parts of my illness is right now. I have never had healthy relationships until now - well at least it used to be. I have been with the love of my life for about a year and a half now. A lot of the times I was awful... now I mean awful. I was mean, irrational and not a good person to be around. Why did I do that if I love him so much? I pushed him away to the point where he is not ""in it"" anymore. Doesn't feel engaged to be with me considering how horrible I was to him. We are currently on a ""break"" to see if he misses me and wants to be with me but we live together and it is extremely hard. I am trying to stay positive and hoping that this will reconnect us. It has been a couple of weeks now and I am not as hopeful anymore. When I get super anxious or depressed I get physically ill. To the point where I cannot go anywhere bc I am vomiting so much and I don't eat.  I am sooo fearful and worried that he will end it with me. He is the only person to actually understand me. I love him so much. He used to tell me I looked nice, want to touch me and we used to write little notes on the fridge for each other. He doesn't seem happy with me even when I am trying to engage in conversation with him or what have you. I have been trying very hard to be a ""normal"" person. I am on a good balance of meds I believe, and I am going to a personality disorder clinic/programs hopefully this upcoming September. I just don't know what to do. He doesn't like talking about it bc he has talked about it so much with me that he thinks I don't ""get it"". I do get it now and I want to be the person i was when we first got together. I was fun, outgoing, easy to talk to and affectionate. I really want my relationship back.. he means everything to me. Has anyone ever felt like this or know any suggestions?",1562163849.0,False,3,2,kristanball,None,c8op5u,https://www.reddit.com/r/BPDsupport/comments/c8op5u/what_to_do_at_this_point_suggestions_welcomed/
74,Feeling stuck in my relationship,"I (32F) and my bf (31M) have been together for almost 2 years, but we don't live together. I'm turning 33 next week, and he'll be 32 next month. We both went into this relationship saying that our goals were to get married and have kids within a few years. He specifically said he'd like to start working on starting a family within 3 years. It's now been almost 2, and again, we don't even live together. This is because we fight all the time, and because of my BPD, those fights often spiral out of control. I have hurt myself numerous times in front of him (mostly hitting myself, but sometimes more), and I have been physical with him, which I know is never ok. Last night I slapped his arm and he got really mad, understandably. I feel like a stupid kid when I do stuff like this, but also, I am getting older and I want to be settling down and starting a family. It's all I've ever wanted. But my boyfriend says that my negative coping mechanisms make him fearful of what would happen if we lived together. We've already had the police called on us twice, and the second time (which was last month), I was sent to the psych ward against my will for 3 days because I admitted to sometimes thinking about dying. It was horrible and scary and not very helpful at all other than that it got me a prescription for Lexapro. Anyway, I am trying hard. I am taking meds, I have been actively looking for a DBT therapist (or any therapist!) but am having such a hard time finding one that is accepting new patients and accepts my insurance. I am reading all I can about BPD. I have tried meditating, I try to do yoga, I try to attend 12 step meetings for codependence and love addiction. But he keeps saying he wants my coping mechanisms to change before we can live together. He says it's not an ultimatum, but that's what it sounds like to me. I just don't understand why I'm good enough to keep being his girlfriend, but not good enough to move forward in our relationship. If I am not giving him what he needs, why doesn't he leave? He says it's because he loves me and has hope that things can change. It feels horrible feeling like somebody is sitting around waiting for me to change in order for me to have access to the things I want in life. Don't get me wrong, I desperately want to change, but I don't know when I will or if I will or if I can.",1596588241.0,False,2,2,deleauquipique,None,i3vim3,https://www.reddit.com/r/BPDsupport/comments/i3vim3/feeling_stuck_in_my_relationship/
75,I can’t believe I’m doing this,"TRIGGER WARNING: suicide, self harm and all that bad mental health stuff. (Sorry if I did that wrong). 

Hi redditors. I’ve never posted before. Thanks for reading and responding if you choose to do so. I’m sorry if the following triggers you or if you are struggling with the same brand of futile terrible I am. 

I’m at a point in my life where I’ve struggled so much and for so long that I’m just exhausted. I’m not angry or bitter or sad anymore; I just want it to be over. I’m tired of being confused all the time, completely disconnected from this thing called ‘life’ everyone seems to be switched into. I’m tired of being panicky and depressed and anxious all at the same time, almost all the time. Im tired of being at the mercy of my insane mood swings where I'm experiencing overlapping interchanges of all these conflicting emotions all day long. I'm tired of crying so often that it feels like my brain is going to explode in my own head and my eyes will just cease to function properly. I’m tired of being dismissed when I say I’m unwell (psychiatrist included) because ‘I’m doing so well’ - I don’t even know what this means or how you could conclude that from someone whose chronically unemployed, can’t finish uni or even leave the house or make eye contact with people without panicking. I feel like an absolute rotting turd most of the time despite what I’m putting out there (which feels to me like a shit show but to other people for some reasons seems completely normal).

People seem to consistently make this crazy assumption that I’m ‘intelligent and capable’ for some reason and therefore I don’t need help. They couldn’t be more wrong. I can’t accomplish basic tasks because I’m emotionally all over the place all the time and trying to do basic human things like pick what to wear in the morning sends me into shame spirals, suicidal thoughts and urges to self harm. I have no control over my emotions or impulses, I’m constantly floating away from my body and nothing feels real. I’m incapable of accepting any kind of affection or goodwill from others without completely self destructing and I don’t want to burden others so my relationships are nonexistent. 

I’ve dealt with thoughts, feelings, urges and attempts of suicide my entire life. Its pretty much always been a terrifying backup in the back of my mind ever since I can remember as a safety plan to escape the torture of life where I can always feel exactly how close I am to death. Some days feel a magnetism to it but a strong resolve to resist. Other days, I’m basically hanging on by a thread and not telling anyone so they don’t come and take me from my home against my will again. 

I just want the freedom to be able to make this decision on my own. I did not give consent to be born, and I don’t think it’s ethical to keep someone alive against their will when they are suffering chronically and there isn’t a solution. 

I just feel like there’s no way out. I don’t respond to medications and suffer from such severe side effects that my psychiatrist refuses to prescribe any more drugs. My old psychiatrist had me on 5 different meds and I was equally bad, maybe worse, but in a completely different way. Those who have had adverse reactions to medications will understand this. Being mentally ill or being on psychiatric medication is like choosing if you want death by drowning or self-immolation.

I do DBT group therapy, see a psychologist and psychiatrist but I still feel like absolute shit. Everyone seems to be going through the motions, ticking all the boxes, but I just feel like nothing has really shifted. No amount of bandaids is going to help me when I’m walking around absolutely raw with no fucking skin on my body. It’s excruciating to just be alive but because it’s not visible, and it’s a slow death, nobody cares and the state ‘has a responsibility’ to keep you alive. In my experience, everyone is all sad when someone kills them selves, but also calls them selfish because they’ve left so much pain in their wake. Being passed around a mental health care system that can’t really help you, is insanely expensive and practically useless makes me miss the days when I didn’t seek help, suffered in silence but could at least hold on to the hope that there was a possibility of getting better if I had the right help. Now I know that’s not even an option. 

I’m just doomed to relive this cycle of extreme pain, possible suicide, absurdity, exhaustion, sheer terror, panic attacks, extreme mood swings, paranoia, catatonia, confusion, dissociation, spontaneous stuttering, paralysis and fatigue, where I can’t seem to express myself clearly no matter how hard I try or connect with other people. 

I am incapable of feeling positive emotions. No matter how hard I try, I just can’t stop the anxiety, panic, negativity, paranoia and depression from seeping in. I fear my emotions, I fear my thoughts and the things in life I can’t control that are going to hurt me so I just live in a constant state of sheer paralysis, frozen in fear and bracing myself for impact.

The only thing that’s keeping me alive is the thought that my sister will have to deal with the trauma of my suicide. But it also seems like it should be unethical to keep a person in this much chronic pain alive. I can feel my body deteriorating, my mind is basically scrambled eggs at this point, and I feel like I’m at the mercy of an emotionally handicapped body that I have zero control over. I keep harming myself and those around me. I just want to die with a little bit of dignity but there doesn’t seem to be a way out.

Life seems to be one trauma after the next, and continued reluctant attempts to help myself that only end up in things getting worse. I was not made for this world. I wasn’t supposed to be here. Please let me go. I don’t want to hurt anyone but I’m so tired now. Please tell me this will all be over soon.",1596368916.0,False,12,7,sarahthehumanperson,None,i2asxt,https://www.reddit.com/r/BPDsupport/comments/i2asxt/i_cant_believe_im_doing_this/
