,Comment,Author,Post
0,"Competent psychiatrists will never diagnose someone under the age of 18 with a personality disorder. Additionally, from personal experience, I can tell you with absolute assurance that BPD is just one is those labels that mental health professionals don't want to reveal to patients. And that's simply owing to the misinformation out there about this illness, in terms of stigma and inconclusive online literature. The diagnosis is hidden from the patient in an attempt to protect them from overthinking and spiralling. However, now that you are an adult, you have every legal right to demand an accurate diagnostic finding. Have a candid conversation with your doctor, I assure you it's more to do with the rules within the psychiatric community, and less to do with you. You got this.",,17szsas
0,"Read the book “ I hate you, don’t leave me”",hunterhiddengreen,16lf2v6
1,Mine isn't.,Born-Value-779,16lf2v6
2,Yes,skdhjsjd,16lf2v6
3,Ama,Born-Value-779,16lf2v6
0,"Please go easy on yourself! Dreams mean nothing no matter how real they feel. Say that over and over because it's true! Take a bath or do something to comfort yourself. Watch your favorite show, distract yourself.",ayyemmsee,hcxif1
1,"I know what it feels like to have a cheating dream or dream where I did something horrible. Usually by the next day I feel okay, although sometimes I have back to back nightmares. Over the years I started having less by removing stressors, so if that's a possibility then it might help. Other than that I also listen to podcasts like ""Get Sleepy"" and ""The Nothing Much"" podcast. I have to listen to them the whole night or my sleep is weird, but it helps to listen to a happy, sweet story before bed. I also sometimes keep my nightlight on or look at a collection of cozy images on my phone that I get from Pinterest. I try to really imagine being in those happy places. Things like log cabins or rooms with pastel decor. Whatever floats your boat. Finally, after I have a nightmare, I try to write a letter to my brain or rewrite the nightmare but with a happy ending. Some nightmares can't be written with a happy ending so I write a letter to my brain saying ""why did you make me have this weird dream? I know you are a bit scrambled from ptsd but I would never do that because (x reason)."" It doesn't always help. Sometimes I feel so hopeless about nightmares, but please know you are not alone and the fact that the things in the nightmare are bad to you is a good thing. It means you would never really so it. Hope this helps. Good luck from one nightmare-haver to another!",Cobalt-Royal,hcxif1
0,"you’re definitely not the only person in this kind of position. i think that we all experience similar scenarios in our own personal ways as individuals, and because of that we each tackle these things a little differently. things don’t always happen the same as they do to others either, so never try to compare yourself as it can be hard on self-esteem! my advice is to just focus on that which you Do like about yourself; that which makes you You, what you have done with your life that brings you happiness or pride, or what is in your life now that has that effect. i believe that focussing/dwelling on these things can have really positive effect, as well as eating, sleeping and exercising healthily. it’s easier said than done of course and not every day is going to be a great one, but any amount of effort is better than none at all and we’re all stronger than we give ourselves credit for at the end of the day, when we’re feeling our weakest. sometimes all we need is just a little encouragement or support and there’s Nothing wrong with that. you’re not alone in your struggle, no matter how lonesome it feels! best of luck to you 🤘🏻",theshape1428_13,1cl574f
1,"If you don't mind me asking, what makes you choose to be by yourself? Is it introversion, or a cycle of bad thoughts? What do you think of when you think about socializing and making friendships?",EagleMaleficent4602,1cl574f
2,Yes! Focusing on the things that make us happy in the present. Living in the and enjoying the present and what we love about our selves right now. I do tend to be an over thinker at times and it helps to think of the present.,honeyjaye,1cl574f
3,"A combination of both actually. Depending on the group that I have felt safe with before I am excited. But if it’s with people I know don’t care for me deep down or I know have talked bad about me before I instantly get nervous. Even if I’ve chosen to forgive them and move pass it. 
I also am going back to old hobbies that brought me peace and joy.
And thanks for asking.",honeyjaye,1cl574f
4,That makes sense! Do you think you should develop a strong relationship with a person before moving as deep as a group of people? It sounds really hard to tackle the group aspect as there's a lot of chaotic variables. Maybe I'm overthinking it. I've always wanted a group when I was younger because of my loneliness and over use of social media and then I realized I'm more of a one on one person. You should see how excited I get at parties with strangers. It's because none of those bad thoughts exist because I don't know them. It's a conundrum.,EagleMaleficent4602,1cl574f
5,Yes that makes total sense! I am very much a one on one painting sessions and just talking sessions. When I’m actually out if I don’t know anyone the better. Then I get an opportunity to actually make new friends if the vibes are right.,honeyjaye,1cl574f
6,😋 agreeeed,EagleMaleficent4602,1cl574f
0,"Yes, don’t know why. I know the stereotype is hypersexuality and with all the memes I see theres a running joke about that being the redeeming factor of dating someone with bpd. Makes me feel kinda bad I dont have the “redeeming factor” but I’m lucky to have a partner I trust who loves me for who I am and never pressures me into what I dont wanna do. 

Its more about pleasing them, its like I dont experience sexual fulfillment or attraction at all but not totally asexual because I do like pleasing my partner. It is all about them and their reactions though, if the focus is on me I feel nothing.",,1bmous7
0,Cus it doesn't help. My problems aren't the same as yours and neither are our copping mechanisms. Im usually the friend that just listens and gives advice that helps me more than talking about bow fucked up I am.,,frdefc
1,"I can imagine the feeling sucks, but it’s really good to be aware of this, because these kind of relationships become a crutch. I am only speaking from experience.",sartrecafe,frdefc
2,Okay. I don't understand your your response as it relates to my post.,blixafritz,frdefc
3,Thank you. I hope that staying positive will improve my chances of developing beneficial relationships.,blixafritz,frdefc
4,Seems like you don't understand a lot.,,frdefc
5,"Are you trying to pick a text fight by insulting me?
I honestly don't understand what your response means as it relates my post. Perhaps instead of be combative, you could clarify what you were trying to say.",blixafritz,frdefc
6,"No, its an observation. You asked why you guys cant bond through your trauma.. some ppl don't work like that. I mean I cant explain it anymore than I already have.",,frdefc
7,"This person is right. It’s one thing to know someone has struggled and maybe that person can be a little more empathetic or altruistic toward you, but not a lot of people want to wallow in their past. They experience, accept that it is what it is, and learn to move forward. It’s much better than sharing the “war stories” of life.",,frdefc
0,"Even with this disorder over the past 1.5 years, I managed to get off of methadone, Xanax and end a 15-year almost daily drinking problem as well as quit smoking. I have over a year sober now and 6 months without cigarettes. I think that's something worth mentioning.
I spent the latter half of today literally in a ball crying after almost 2 days of rage, but I did the above, so I got this :)",immakinggoodfriends,1csymju
1,I was able to help my younger coworkers get along and understand each other 🥹,honeyjaye,1csymju
2,"I have found the most beautiful person for a boyfriend, if perfect was real, he would be it. 
I never thought I would be able to accept this level of love and care. I never thought that you can feel secure in a relationship or know he feels the same way. 
After all the shitty things I’ve done in my life, some I still feel a lot of shame for and all the terrible relationships that end is lying, cheating and manipulation. I thought I wouldn’t let love properly but here I am.

Love exists, healthy relationships exist. There is hope",DaynaWatson,1csymju
3,"I wanted to start by saying, I’m proud of you 💕 going into work whilst feeling that way, that’s a massive achievement. 

Today I am grateful for my therapist. She really does help me put things into perspective. Things that were overwhelming me earlier in the week, I’ve managed to frame them a little differently and I feel calmer.",jaycakes30,1csymju
4,You’re a good person OP.,birdbandb,1csymju
5,"You are amazing! Sober doesn’t equal a perfect life, but you can imagine if you hadn’t stopped. This frigging disorder makes everything 1000 times worse, and self-medicating is almost universal with us. I’ve been sober 14 years, and it gave me a chance which I wouldn’t have had if I was still using. (I had to do rehab for Xanax and painkillers.) Give yourself a huge pat on the back, and I’m immensely impressed and proud of you!",Acceptable_Current10,1csymju
6,Thank you :),immakinggoodfriends,1csymju
0,I relate to this a lot. I didn’t realize for a long time that it was a pattern. It’s frustrating. Even when it is a male friend that I truly have no sexual attraction to it becomes an issue due to past behavior. I struggle with female relationships and just don’t feel the same connection to the majority of people. When I do find a close connection it’s typically with a guy and threatens my husband.  I can accept that I created the reasons he reacts the way he does but it still sucks. I feel so isolated and honestly he just doesn’t seem to understand exactly how much attention/interaction I need to feel satisfied.,Original-Disaster297,1cobjsq
0,"I recently was diagnosed with BPD. What I did to get my diagnosis was talk to a proper professional (in my case a psychologist) and I told him I had been experiencing symptoms and done some research, it led me to BPD and I would like a proper test/sessions to see if he agrees that is what I have or if it aligned more with something else. Take notes when you’re in a situation where you feel like the symptoms are affecting you so you have specific examples when they ask for them! Be prepared for a longer process and don’t get discouraged if you don’t get the answer you are looking for right away.",usernamenotfound1441,1cs5c3b
1,"I also would say don’t worry about being judged. BPD is a highly stigmatized subject but it is able to be managed, you can get help and you can feel stable enough to be happy. I am finally starting to feel that way with the help and resources I need. You got this!",usernamenotfound1441,1cs5c3b
2,"Thank you, I will try this. And I’m only worried about being judged bc there so many horror stories about people with bpd being refused help because it’s to difficult to treat and stuff like that. I just don’t wanna finally reach out and have hope only for that to happen, but I know I have to push through!",Confident_Pain8263,1cs5c3b
3,"I totally understand that! It took me 10 years to finally get my diagnosis and get someone to listen to me. Just know that if the first one doesn’t make you feel validated and heard there are thousands of other professionals out there to try and one of them will make you feel seen and heard without judgement. There are also ways to begin treatment on your own to see if it helps, there is a specific type of therapy for people with BPD (even without a formal diagnosis) and maybe that could even benefit you in the meantime. There are always options and if you ever need any help or advice my DM’s are open :)",usernamenotfound1441,1cs5c3b
0,This could very much be the honeymoon phase is over,windontheporch,1cpoj5e
1,[deleted],,1cpoj5e
2,"But yes, I’m going through it again, and this time I have zero sexual attraction to the point where I disassociate during sex. I’ve never experienced this w my bf and we’ve been together for almost 4 years",windontheporch,1cpoj5e
3,"Yeah I get that but our past situation was intolerable. I had to drive 35+ mins to see her and I am autistic and I was constantly burnt out. I have animals at home to take care of and it was extremely stressful trying to see her and take care of them, plus I worked over by her. It seemed to make the most sense so I wasn’t living at two places basically. There is no perfect solution. Life is difficult no matter what and my autism makes everything way harder",birdtattoos,1cpoj5e
4,Damn me too though 😭😭😭 why does this happen to us,birdtattoos,1cpoj5e
5,I completely get what you're saying. I'm also autistic so we think about things logically and rationally and most people with bpd do not. There isn't ever a perfect solution but this situation would be difficult with someone without bpd but for someone with bpd it is most likely going ronget very toxic very quickly.  I wish you the best.,No-Writer-9188,1cpoj5e
6,"I don’t think it’ll be toxic, I’ve been in therapy for 7 years and done extensive DBT and trauma therapy. I’m very self aware. It’s okay to struggle and get back on track after. Thanks for the concern though",birdtattoos,1cpoj5e
0,"Hi! I'm new here too and also new to reddit in general. So I hope I'm not doing something wrong with this reply but I'd like to give advice as someone who was diagnosed around 2 years ago. (F20) 
 For starters, theres lots of stigma around this disorder. I've been through residential, iop, and php, (if you dont know these are inpatient/outpatient treatment centers, or what's considered ""rehab,"" where you live there and go to group everyday, possibly with Sundays off, for 3-6 hours a day. You stay in these facilities on average for 1 month) and even the professionals there can get nasty even upon hearing the diagnosis. (Ex. I was already diagnosed before entering, and each facility immediately refused my diagnosis, and then were disgusted after doing assessments/noticing symptoms and behaviors) With that being said, it's going to hurt while you're doing research and you come across people who make us out to be monsters. I still encourage you to do a lot of research. I would encourage most people to do some form of treatment. (I understand that money can be an issue I owe 7k to treatment centers even with my good insurance.) One thing I did when I was first diagnosed was I bought the DBT skills workbook. Professionals will say meds are only half the battle. For me, they are none of the battle because I was on 20+ different ones during treatment and I just don't currently feel like that's my way of going about it. Also important: Bpd CAN go in remission. I notice people acting like their bpd will be crisis level forever. It really doesn't have to be that way. I'm not completely better by any means, but I've for sure improved since I found out I had it. This is starting to get long so lmk if I can help anymore! (Don't know if there's a limit for this post or if I've broken any rules never use reddit)",bpdrelationshiphelp,1cxrx0s
0,"Try to find another job, when I quit my stressful job my bpd rage really calmed down. Self care, practice dbt, spend some time out alone",punkmexicana,17pyyhs
0,"Sounds fine. If you don’t hear from them within a few days, call them to make sure they have opened the email. It seems you’re ready for the next stage in the journey of healing and managing your condition in a healthier way. Good Luck with a diagnosis and treatment. Ps if you don’t get an immediate diagnosis don’t be discouraged, I went back 3 times.",DiStUrBEdMeLoN,1934pf7
0,Changes do bring back our deepest trauma.. I can totally feel you,,169ajst
0,But you can order the bpd workbook though by Daniel J Fox a get a better idea if you have it or not!,Usual-South-6520,1clauk6
1,BPD isn’t diagnosed until adulthood for a reason. I would suggest reaching out to a school counsellor or similar if your parents are unwilling to help,jaycakes30,1clauk6
2,I'll try to get that thanks ,weakin_ma_knees,1clauk6
3,"My school counsellor thinks I'm faking everything and in the country i live in, any sort of mental illness other than anxiety and high functioning depression isn't really acknowledged. 


So im trying to do whatever it takes to get better on my own :/",weakin_ma_knees,1clauk6
0,your title just made me have a mini breakthrough it’s something i struggle with really bad in my relationships and it’s confusing for my partner cause id be mad at him then forget what we were even mad about and carry on with my day like we are okay then id rethink the situation and get mad and split on him all over again and he doesn’t get it cause quite literally 20 minutes ago we were fine.,ParticularAd1224,1ctd511
0,[deleted],,1brnago
1,"Hi and thanks for the intro. I'm the parent of a bpd kid and the spouse of a bpd person.  I'm usually lurking here just so I don't feel so alone when looking at my life and how bpd affects our family dynamics.  Sometimes I feel pretty lucky,  other times I feel alone but coming here helps my life feel 'normal' if that makes sense.",santana0987,1brnago
2,"If you click my name, you can see the subs I’m acting in. They are “hermitcrabs” and “landhermitcrabs.” The subs are very helpful for giving accurate information on proper hermit crab care following LHCOS guidelines 🫶🏻",Rowdylilred,1brnago
0,"I feel like he purposely triggers it. Tells me to leave all the time that he is done - to get the fuck out. 
. It has made it so much worse.",birdbandb,1cwhmkv
1,"I’m literally going through this right now. It’s tough to feel this way. My partner loves me so much and has always been so patient but lately I feel like he’s been getting sick of my disorder and it just makes me feel even guiltier abt my existence. It’s hard to not also cause a fight over feeling like he’s losing his patience for me.

Another thing with BPD though- we have to give these people who are with us grace. YES we have to feel the shitty emotions that are enough to take us out on a daily basis. BUT, they also have to sit there and deal with us and these emotions they cannot comprehend. That can be really confusing and stressful sometimes! If I were a “normal” person and saw the shit I get mad over I’d be like wtf girl 😭😭😭😭. They’re allowed to feel their emotions just like we are! They can’t always be smiles and rainbows just because they don’t have BPD. That’s a CRAZYYY unrealistic standard to hold our partners to. 

Two things can be true at once, okay? They can be human beings with their own valid emotions and they can still love us at the same time. Obviously a relationship with one person being a borderline requires effort, understanding, and patience from both sides. But we need to keep in mind that it’s ON US TO HEAL OURSELVES AND LEARN TO EMOTIONALLY REGULATE ONE DAY! ❤️

At the end of the day if your partner respects you and your relationship and makes you feel loved that’s what we deserve, to be loved! We can’t always expect the people we love to completely understand us or respond the way we want them to. In my personal experience I mostly feel the way you do because I idolize my partner WAYYY too aggressively sometimes. It’s hard to work on but it can be done! ❤️

If you truly still feel like it’s your partner who is neglecting your feelings or purposely does try to trigger you and it’s NOT your BPD clouding the reality, then that’s fucked up and you deserve better. 

wish you the best and I hope you have a great night friend !! 😇",Klutzy-Highlight-884,1cwhmkv
2,All the time. My ex would say “snap out of it “ or to just not do x y z and it’s like oh my bad for having a defective brain due to childhood trauma lmao,CrybabyCannoli,1cwhmkv
3,"It always seems like serious relationship issues or things I’m doing wrong get brought up when I’m already in a spiral and in the worst place to be “rational”, which makes me more reactive and fucked up. I don’t think my spouse does it on purpose. I do wish it didn’t happen. Why can’t we talk about serious shit when I’m doing well?",BrttyPwrBtty,1cwhmkv
4,Mine purposely would trigger too. So dismissive and avoidant and would always make himself the victim.,CrybabyCannoli,1cwhmkv
0,if anyone can relate please let me know and share whatever you feel comfortable sharing.,ImpossibleBicycle249,ul6h66
1,"Your mother sounds a lot like my mom. I have been no contact with her for 7 months, and it’s been much better. I’m not sure what your living situation looks like with her, but maybe in time, you can consider this option. Because I fucking GUARANTEE you are not even remotely the cause of your father to leave. And I also guarantee, your mom has been emotionally neglectful your entire life, and you’ve been made out to feel like it’s your fault when, in reality, she just can’t live with the idea that she’s unfit. You deserve better. You will find inner peace, and you will find people who fill the role you so desperately need and deserve. 

I understand how it feels like everything has been “confirmed”, but I promise it’s not. She has no agency to decide that.",wazzledazzle,ul6h66
2,"I can really relate as I have been in a relationship with someone like your mom and even been like your mom or parroted those beliefs of you should be able to do things because I can. It is a highly narcissistic way of thinking. It isn't correct and the person saying that lacks empathy or can't deal with THEIR emotions. Please understand that. You are not incorrect.

In my case the person who was telling me these things I kept trying to explain to her that the more she pushed the further locked in my mental crisis prison I would get. It was horrible. I empathize so much with your pain and anger and self hatred. I tried and tried to change myself that way and its exhausting and soul crushing. 

From your post it sounds like your mom is very mentally damaging for you to be around. Is there a reason you are stuck being around her? Is there any way you can get out or away from her influence? You clearly have a lot of pain to process and this is only  making it worse. She probably will not listen to you. 


In my case the only thing that soothed that intense self loathing was that, miracle of miracles, the person who was pushing and gaslighting me ended up validating the harm they did to me apologizing and reaffirming that I did not deserve it (up to that point they insisted I deserved it). I have been locked in cycles with her for a long time. And the way out was that I swallowed my pride and apologized and took responsibility for the damage I had done her, and listened to her even though I didn't agree with her perspective, and she actually opened up about how much my behavior hurt her or just the pain she was feeling, and then I was able to follow that up by sharing the same, how much her behavior had impacted me. We still have to separate to heal and protect ourselves but I have never felt ANYTHING like that moment of validation. It showed me how powerfully mind destroying gaslighting is to someone with a vulnerable mind. I began to imagine what it would be like to be around people who did not gaslight me at all, even if I was simply alone. I imagined how different life might feel. 

It inspired me to decide with a heavy heart I have to cut off contact further with my parents if they keep gaslighting me and leave a job that is confusing where I have bad boundaries.
 I have thought I can tolerate it and explain or just put my feelings aside. But there will come a breakthrough point when you realize how much your peace matters and that nothing in the world is worth mental chaos because it will destroy your soul and everyone around you will be affected. 

All that is to say I hope you can find a way to unentangle from your mom even if you still care or love her. Don't be surprised if things begin to feel a lot different. The stuff you are saying here is very heavy and dangerous. That amount of shame and self blame will eat you alive. It isn't that you have BPD and are bad as much as your BPD may be allowing you to emotionally stay in a destructive situation. 

All the best to you.",oisin_berry,ul6h66
3,"thank you so much. Im really happy that you’re doing much better now that you have zero contact. i wish i could leave too but she relies on me for so much. i help pay her bills and she’s threatened to kill herself before. and i never realized how messed up it is until now. and you’re right she did emotionally neglect me my whole life. 
i’m just gonna try to cut back on speaking about any of my issues to her until we’re in the presence of a mediator like a therapist because i don’t see the value in communicating with her anymore. everything i say to her is “manipulation.” i’m going to focus on staying productive and healthy as much as i can. thanks again!",ImpossibleBicycle249,ul6h66
