,Comment,Author,Post
2,"I like your reasons and I admire your courage to be one of the few confident enough to be open about mental health struggles in the work place. I love when people pave the way for others so they feel comfortable doing the same if they so choose. 

You are lucky to have the support system you do, it seems as though they will try to understand and relate to you as best as they can which is all we can ask for.  

I am glad you felt comfortable sharing such personal effects with those you love. I wish you the very best. 

To answer your question, growing up in a home where issues were better ignored than dealt with, there were a lot of unresolved feelings for most of my life; 
I never believed I was cared for and I lived under the impression I deserved to suffer in silence in order to maintain my mothers perfect image in the society. It’s still difficult to this day but it is what it is.",bansheespirit,chgaqw
0,"I'm looking from the outside and I'm male and bloody old so sorry I don't fit what you want and I completely understand wanting to speak to someone similar to you. I have been in a relationship with someone who suffered a lot, various attempts to end it, plus they suffered from DID as well as PTSD.

Deep breath.

You need to vent a bit somewhere safe. Even the odd primal scream in the woods might make you feel a bit better, not a cure but it might take the steam out a bit.

Other than that you really need someone to talk to where any fear of hospitalisation isn't present. No friends that might be that non-judgemental ear? Depending on where you are there are also some good help lines or PTSD charities that might be a good ear too.

The ideation to end it? Of course, I might be taking a risk here but I see that as a normal part of the process of being you. It doesn't always last and is really driven by a deep desire to NOT be you and you can only say that because of the memories you have that are negative. Again completely understandable. Just be aware that it can spiral downwards as a repetitive thought. That's very exhausting to have those thoughts every time you feel triggered or down.

Here's one key that applies to people having too many thoughts creating a desire to control or suppress them. Suppressing them can be the problem more than those thoughts actually exist being the problem. The tremendous desire to suppress them is probably more exhausting than having the thoughts in the first place! In other words, those thoughts are stressful when you're inside of them. They seem real and valid. If you manage to find a moment of peace and suddenly those thoughts come, look at them as if they are just a machine working in your head to try and make yourself feel in control. Let it go. It's going to happen anyway. The thoughts will come, and they will go. Allow them to go even if they seem stubborn and are sticking around. Put them in a place where you realise they are not who you really are. They are like a machine kicking off when the on button has been pushed. Kind of like a knee jerk reaction of the brain. You can practice this every day just by being aware of it rather than trying to control it. Be aware of it but it's really just babble in the background.

There is another part of you that isn't this. A deep and relevant part that can access something else other than thinking about bad thoughts.

With the PTSD you can try some of the trusted and true methods that bring your attention to the things around you. When you feel yourself going into a PTSD mode do things like look at the walls and their colour. Describe the light in the room. Use sensing as a way to connect with the reality of where you are rather than the thoughts in your head. Run cold water over your hands is another good one. It focuses your brain on the relevant and immediate world.

Much love.",NeerImagi,17yxzr7
0,"You sound pretty isolated. It might be difficult but are there friends, support groups, or clubs around your interests you could start attending? Before your partner is unavailable?
Diversifying resources is a great way to help wean off that energy we depend on our FP for. Even if you feel restless, dissatisfied or unhappy around everyone else but them, just trying to get out the door or into a discord server and chat and check in with other people could help. You don't have to be totally alone.",oisin_berry,vhwiek
1,"Keep looking for a therapist if you can, it really is super helpful to have a good therapist. I always suggest finding a new therapist if the one you have isn't helping, as well. I went through several but have found one that has helped me make leaps and bounds of improvement. It's worth it. 

I have been in a similar place to you before where I *needed* to be talking to my FP at all times or I'd lose it. Time with your FP can be very addictive and right now you're taking that drug like a junkie. Try to wean yourself off time talking to your FP slowly to prepare for the coming change. Communicate openly with your FP about your plan, why you're doing it, and ask their help with slowly reducing communication time. Find out what kind of communication time you'll have after their job moves back to the office, and make that amount the goal for you to reduce down to. Look for ways to stay occupied when you're not talking to your FP. Maybe think of ways to surprise them when you do get to talk to them next. Perhaps if you're artistically inclined you could work on art as a gift for your FP. 

It's hard, but I believe in you. You'll feel a lot more functional and whole and when you are more independent you will have a more healthy relationship that you can feel extra proud of. 

I'm also in an LDR and it's been hard especially since you can't see your partner in real life but it's really valuable to me to still have a healthy relationship and when I do get to talk to him I have a whole day's worth of events to tell him all about!",sparrowlion,vhwiek
2,"I am, actually, which sucks because I didn't quite realize how isolated I am until this possibility. It's no ones fault it just happened. Especially since I've gone no contact with my family and my irl best friend lives 40 mins away and we both don't really drive. But a discord server might be a good idea! I could try slowly going outside again, its just my meds make me super weak to heat and summer makes the depression way worse. (Its like the opposite of seasonal sads lol). But I just hope I can endure this cause I've really come to rely on her just to get through the hard days these days. 

Thank you for this 🥺",cheytans,vhwiek
0,"i have memory problems but I have also had concussions. Bpd-related amnesia is dissociation. You may be reading the page but your mind is elsewhere even if you aren’t aware of it. Mine is pretty severe- beyond forgetting names of streets, faces, names of people, there are many life events that people have told me about that I don’t remember at all. people I have met many times. Places I have been to over and over that I don’t remember or remember wrong. I also recall events differently than
other people and have been accused of selective memory or being manipulative when really I just don’t know what’s going on. Dissociative insomnia is why I got really serious about treatment- and I still haven’t talked to anyone who knows anything about it.",,ghd18e
1,"My memory is absolutely awful. Ive forgotten a massive chunk of my childhood (thank you, brain for suppressing that bs) but it really makes me question if the abuse actually ever took place.",jaycakes30,ghd18e
2,"i mainly struggle with my memory after stressful situations occur, for example, you may have been subconsciously or consciously stressed whilst revising for your tests or exams and you’ve forgotten in the morning. my brain blanks out stuff that could be stressful or harmful to me, like i know something would have happened but it’s a shallow thing and no detail would be contained in the memory until a while later. hopefully this helped but dissociation is very common within BPD too!",kurthoebain,ghd18e
3,"I also have awful memory issues, that I think have slowly gotten worse over the years (I was diagnosed 6 years ago). It's gotten to the point where I have been considering mentioning it to a doctor but I have also adapted a lot of things around it. Such as putting EVERYTHING in my calender on my phone, setting reminders for just about everything, writing stuff down where possible (and making sure they're in plain sight) etc. 

Stuff I mostly struggle with is who I told what (meaning I repeat myself a lot, I usually start stories with ""Did I tell you about x?"" To avoid that), keeping up with friends (sometimes weeks will go by without hearing from them but it'll feel like yesterday - I try to check my chats regularly for people I haven't caught up with in a while,  I never get movie/ show referances even when I've seen it multiple times (and if I haven't seen something in a while it's like watching it for the first time, only upside I see here lol), forgetting to feed my cats (don't worry, they remind me), forgetting to eat myself, or forgetting to take my meds, or doing those last 2 twice because I forget I already did them. 

There's probably a lot more, but I'm also crap at remembering stuff to give examples xD

Setting routines for stuff you forget has also been helpful for me

If you are worried, see a health professional, as I probably should too. Writing it out definetly makes me realise how bad mine is

Best of luck with everything :)",Alcoholic-Pizza,ghd18e
4,Yeah I can relate most of my life is a blank I can't remember a lot of it and what I can remember is fuzzy and it doesn't help that I was gaslit most of my life I've had to ask my family about things that have happened I can only seem to remember the traumatic things which is like super fun(sarcasm) anyway idk if I can help beyond commiserating but I'm here if you need someone to talk to,,ghd18e
5,"I've had memory problems for a long time. My ex used to joke and say that its like being in ""50 First Dates"" being with me cause i'm so forgetful/forget things he shared with me or showed me. It was embarassing (and he also would use that against me so it was dismantling).

It scares me and I'm anxious I'm forgetting something a lot of times. It isn't TOO awful, but yeah its a problem and gets in the way of functioning sometimes.",,ghd18e
6,I have had trouble remembering my own address,,ghd18e
7,"So w/ the amnesia thing. Are you saying amnesia dissociation is a thing? Or are you saying that as two seperate things? If so it sounds like I could possibly have that. I relate to literally every memory issue you just listed on there. Esp when you said ""you don't remember places you've been to."" I went to SC beaches many years when I was young. I""m only 19 now but I stopped going when I was ;probably about 7 years old. As much as I loved that place, there are certain details of the area I just can't remember. Like for ex, my mom mentioned that there is this one shop that we pass by all the time on this street, she even remembers the street name, but I don't. And maybe part of it was because I was young and wasn't paying attention to things like that, but you would think if we've been to the same beach area quite a few times I would've at least remembered what the shop building looked like but I don't. But she was talking to me about it because we were thinking about going back this year and she asked if I remember the shop and what it looked like and I just for the life of me couldn't remember. And the same thing will happen for college/school related things. I'll study for tests all day, and then can't remember a thing I studied the day of the test. And while keeping in mind even tho I only studied a couple of days, at least that's what usually happens, I would still think I would be able to remember at least a little bit. And I think part of the issue is I stay up all the night before, or the night before that sometimes it would be two or three nights in a row pulling an all nighter because I have really bad time management skills, but anyways, I would stay up all night then I would be so tired the next morning and my brain was probably so tired that I just couldn't remember anything which is really frustrating esp if the quiz/test/exam is a big part of your grade which that happened to me several times through my last fall semester. Which is why I had to drop out. But what is dissociative insomnia? I haven't heard of that. Since you haven't heard of it, if you want I can't ask my therapist or psychiatrist about that. They seem to know their disorders pretty well.",sophiebeanzee,ghd18e
8,I have a feeling that I was sexually abused when I was young but don’t remember it.,,ghd18e
9,"Well that might be a trauma response. My therapist talked to me about trauma responses last Friday and that's what that sounds like. If you did have abuse during your childhood, your probably trying to co er it up. I think it's your brain's way of a coping w/ the trauma is what I'm trying to get at. I could be wrong but I'm pretty sure that's what that is because that's how my therapist described what was going on w/ me. And you may have PTSD too because my therapist really does think I have that as we discussed last Friday as well. I say you might have PTSD because I know that is very much related to trauma response. I""m not trying to diagnose you wrongly, or just diagnosing you but it ius a suggestion tho. If you have a therapist/psychologist/psychatrist I would highly suggest bringing that up to them because when I brough it up it prety much clicked right away w/ my therpaist on why I was doing the things I was doing.",sophiebeanzee,ghd18e
10,"EXACTLY WHAT I GO THROUGH!!! So my therapist always ask if my dad and I or if my sister and I have had any arguments/fights/blow ups this week on Friday and I can never remember because I block it out. She told me that was most likely a coping mechanism thing. So that's probably what your doing too and you're probablt doing it unconscioulsy because I know I do it unconciously. And I'll forget so often that it'll be like ten mins after the argument even tho I'm still mad/frustrated whatever the negative feeling is, I'll ususally text my bf about it and I can't even remember all of the details of why I was mad in the first place.",sophiebeanzee,ghd18e
11,"Thank you! This was helpful knowing someone can relate to the issues I'm having. I also agree my memory is getting pretty terrible and the worst part about it is I'm only 19 and I have plenty of more years to go and I don't want it almost half gone by the time I'm in my 20's or 30's. I've mentioned it to my psychologist (or therapist? I've always been confused about what to call her) but anyways, she thinks its something related w/ BPD and I wouldn't be surprised either. I'll have to do some looking around to see if people w/ BPD have similar issues. But from the examples you gave literally EVERYTHING on this list I relate too. I hardly remember to feed my cat and the bad thing is she doesn't remind me when she needs to be fed. Thankfully my mom is there to help out w/ that part. But w/ other things, I try putting things down in my planner for college stuff that didn't work so I switched to setting reminders on my iPad/phone and that still didn't work because I have an issue where I ignore the reminder. It's like I see it so I acknowledge to myself that I see it but then I slide the notification up and then I end up either completely forgetting about it or not remembering until the night of when the assignment/paper and/or test/quiz/exam was due. Which can be extremely frustrating esp if it heavily impacts your grade. My therapist is usually good w/ coming up w/ solutions to my issues but this one we've been struggling w/ for quite a while. It would also happen during hs which is partially the main reason why I almost didn't graduate and I honestly probably wouldn't have if it weren't for my amazing counselor that I had there. But for the communicating w/ friends/family or just people that I'm close to I also have the same issue of ""Did I tell you about the time... or did I tell you this already?"" It's very frustrating and I feel bad for the person esp if I've said it a million times which will happen very often too. Although most of the people who I'm close w/ or talk to often have gotten used to it by now and know that I have this disorder so they're pretty understanding about it THANK GOD for that lol.  But for that situation I'm almost starting to wonder if I should write down the important stuff that I either want to tell, or have already told them so I don't have to constantly repeat myself. I also tend to forget things about important people esp when it comes to someone I'm dating. I'm trying my best atm not to forget the important things about the current bf that I have so I'm thinking I should write these things down. But I still have no solution for the college issue which sucks.",sophiebeanzee,ghd18e
12,"Thank you that means a lot!! And yes I know how you feel, it's weird like I said above this response, I'll block out fights and what not but I'll remember most of the negative things that happen in my childhood. Whenever I meet someone new, and most of the time I do this w/ a guy, and they ask me to tell me about myself, or what my life's story is, I always hate that question because there were so many stressful things that happened, most of them pretty traumatic unfortunately, and I always feel like that's all I can say my life was as a child and is now which really sucks I wish I could come up w/ something different but it's always so hard to.",sophiebeanzee,ghd18e
13,"Yea my exes would use that against me as well. Although of course I can't think of any examples where he used to do that to me but I know basically all of them but one did that to me. It was really frustrating. And when I was in school, all throughout grade school I would have a small friend group, all of them were girls, and they would talk during lunchtime or recess, and I would always zone out of the conversation because they would talk amongst themselves and they would never talk to me. I can't even think of one time where they actually sat down and had a real conversation w/ me which is pretty sad. And the only time it happened was when me and my best friend were alone at the lunch table and everyone else was absent or taking a test or doing whatever. But anyways something funny would happen and I would always ask what's so funny? and then because I would zone out I wouldn't remember what they said and they would always say the same shit to me, ""oh it's nothing, or nevermind"" and that pissed the lving daylights out of me. I was so angry and furious when they did that to me. And now my sister does that same sort of bs to me and because that's happened to me when I was younger I act like it's a big deal because it technically is since people did that to me, but she never understands no matter how many times my mom explains it to her. My mom used to do that as well but she doesn't anymore now because I told her what happened a couple of years ago and she understands why I act like that now. But my family does it to me too (family outside of intermediate family) and I don't talk to them about any mental health issues I have except for my cousin, well my one cousin. Sometimes I talk to my cousins sister, which would be my other cousin but I don't talk to her about the deep stuff.  I just really hate it honestly.",sophiebeanzee,ghd18e
14,"Ok so I don't have trouble memorizing my address, but if someone says take me to your house I wouldn't be able to do it. And while I agree w/ my parents part of the reason is because I""m on my phone all the time while I'm in the car, but even when I""m paying attention, I try to remember how to get home from where we are and I won't be able to do it. I only know how to get to 2 places out of many places in my town and it's really annoying which is why I""m worried about getting my license because even when I use GPS I stil struggle really really bad w/ directions esp since the GPS is always facing the opposite way your going most of the time so I always have to turn it around and when I don't remember to turn the map around that's when I get extremely  confused.",sophiebeanzee,ghd18e
15,"I mean it’s different for everyone so, but yes amnesia is a bpd symptom and it maybe suggests that you were dissociated at a time when you should have been making a memory.",,ghd18e
16,I'm so sorry to hear that! The uncertainty must be so difficult 😩 I've forgotten a massive chunk of my abuse but it lasted until I was 14,jaycakes30,ghd18e
17,"Yea it def sounds like a coping thing your trying to do maybe w/out even realizing it. I love psychology I'm very much into it, in fact it's my maj in college rn. But look at the comment I posted on your last reply. That should help I hope!",sophiebeanzee,ghd18e
18,Well not like but upvoted,sophiebeanzee,ghd18e
19,"This is very common even in those who don't have BPD. Your brain protects you by  'forgetting' the sexual abuse, but the trauma eventually resurfaces through nightmares, and/or flashbacks. Then you start piecing those together and get the memories back once you're emotionally ready to accept and deal with it.",kalamity23,ghd18e
20,"yeah I def know what you mean. I dissociate especially when there is more than one person speaking at a time. If I'm trying to interact with someone and there's too much going on I can't focus. I get easily overwhelmed and people don't really get it.  
I also used to dissociate when I was working retail jobs with artificial lighting and always caught myself zoning out staring to the only natural light source that would be in the establishment.  
I think its just a safe way for us to rescue ourselves when we're not content/overwhelmed. I've been more conscious of it and I've also figured out a way to work for myself and hold myself accountable.",,ghd18e
21,oh really it is? I had no idea it was a symptom of it. I'll have to ask my therapist about that to see if she knew that it was a symptom cause she said she also has bpd too. Where did you find out it was a symptom? Or did you find out from a doctor and they told you?,sophiebeanzee,ghd18e
22,at least I don't remember it- sorry that happened to you,,ghd18e
23,It is extremely difficult esp knowing what your not going to remember the next day. And idk if you've seen my recent responses from other's comments above but it def plays a big part of my education stuff.  Which is extremly frustrating to deal with!!!,sophiebeanzee,ghd18e
24,"I would've liked your post but I didn't want that to come off in a bad way I'm sure I""m overthinking that but you know I just don't want to trigger anyone!! Esp when it comes to that stuff.",sophiebeanzee,ghd18e
25,"Lol how am I laughing at my childhood trauma right now 

😁",,ghd18e
26,"What strategy worked best for you? I'd love to know cause I notice the problem still continues to happen, more consistently now esp when I was in my first semester of college. Which is a big reason why I had to drop out cause of the lack of focus I was having and I think it was due to so much stress. And if you don't want to say on here, please feel free to dm me!! :)",sophiebeanzee,ghd18e
27,"Since I've been in therapy and addressed this coming up, I've been told/recommended to try and catch myself in those moments. When you notice yourself drifting/spacing/leaving your body and brain, to notice and then use a grounding technique. Taking a few deep breaths, redirecting your consciousness to your feet, noting the sounds around you perhaps. Grounding can work differently for everyone, but I hope you can find whats best for you.  
I also started using a meditation app just sitting down 12-15 minutes either in the morning or the evening helps stabilize me.  
PS. sorry I'm slow to respond.",,ghd18e
28,"Hey np I respond late too! Lol. But my therapist who lead a group called DBT mentioned the grounding skill. She mentioned the bringing yourself back to center she said it was called being in the present moment, I forget the exact name but I remember that phrase being mentioned. I never really tried it. I always claimed that those types of skills never really worked for me. But I thought that because I was actually afraid it wouldn’t work. I didn’t really know if it would work or not cause I never really tried it. But hearing it from someone else who was outside of my DBT group and saying it worked for them, I might actually consider trying it this time! What’s the meditation app you use? Is it Headspace? Cause I still have a subscription that app. I’ve never used it. I paid for a subscription to it and then I checked it out cause I thought it was like a brain workout type of app but it was just the meditation stuff and at the time I wasn’t into meditation. But honestly even tho I’m not into meditation I might as well just try it. It couldn’t hurt plus I have a bf who’s very supportive in me with my mental health stuff so maybe I can get him to do it with me. But I think I might mention to my therapist p, current therapist that I have now that I need to work on those skills again. Maybe 5-10 mins each day or something like that.",sophiebeanzee,ghd18e
0,"Well, we love you and understand. It helps me knowing your out there fighting & surviving. Give your cat extra pets.",InsanelySaved1010,i5dzmr
1,"Are you on bc at all? Some lucky people like myself get on bc and don’t have a period at all. However that also comes with the hormones and potential weight gain, but personally the pain alone was enough for me to get on it.",valixiyuh,i5dzmr
