,Comment,Author,Post
3,"Before I recognized my bpd and learned coping mechanisms I use to do this. Literally say the worse things imaginable to the people I loved without thinking of the consequences. At the point in time you assume this person knows you so well, they should know your moods and triggers. So to be a human and make a mistake….it’s daunting especially after being over stimulated. Not saying any of it is right, just looking from her lenses. With my coping mechanisms I have now i filter my thoughts before reacting or feeling them turn into a split. Sometimes it doesn’t work though I still split, but it’s on a lower scale and isn’t so detrimental. She realizes you’re a good partner so one part of her thinks she doesn’t deserve you and the other part knows her part. And it makes her feel worse.",honeyjaye,1ciu9kt
4,"It really depends on how severe I perceive something was. If it’s something small that I sorta DBT’d my way into thinking I just get a little petty and be dry. If I ignore DBT and simply just resort to rage, it’s horrifying. I don’t know who that is anymore. I lose a piece of myself and get replaced with a whole new person for the time being. It’s like there really is 2 of me in this body, and it only comes out when I need to protect myself. Which for us BPD fold, that’s just an ordinary Wednesday afternoon. Sigh.",,1ciu9kt
5,"Thank you for sharing this :) It must not be easy to openly talk about, and sharing your experience gives me the closure of understanding.

When you say you don't mean anything you're saying in that moment, do you still actually believe it while you're saying it? And then realize afterwards that what you were saying was not fully true?",Afraid_Knowledge4983,1ciu9kt
6,Would you be able to describe what cold and callous looks like?,Afraid_Knowledge4983,1ciu9kt
7,i’m not the og commenter but i have quite bpd and i can say personally that when i split i don’t mean anything of what i’m saying they’re just words i know personally would hurt someone doesn’t mean i believe it but it’s still totally horrible for the other person to hear and i regret it so much after i isolate i’m sorry she said those things to you and i hope you’re doing ok if she does come back and you want her back you need to have some serious conversations and she may need some type of help because it’s can’t be great for you mentally as well and you deserve peace just as much as anyone i wish you good luck!!,Evening_Station_429,1ciu9kt
8,"Yes, I fully believe it when I'm saying it because I'm splitting and my thinking is very black and white and in that moment all I feel is hate for that person. Which is horrible, I know. Once the episode is over I feel so much regret and shame.",Topic-Economy,1ciu9kt
9,"I always think of it as a supervillain who’s far too smart for his own good, like Dr. Doom or Ozymandias.. Or if Shakespeare is more hour thing, Coriolanus after he switches sides and they’re pleading with him not to destroy Rome",heyitsEnricoPallazzo,1ciu9kt
10,"That must be incredibly hard to feel. How long does it usually take for your split to end? Can it be as long as months?

Does what i described sound like a split?",Afraid_Knowledge4983,1ciu9kt
11,"It is and my partner is absolutely incredible because he doesn't hold it against me because he knows it's not me talking. It's my illness. A split is quite short and we cannot control when it happens and it usually happens during an episode (for me anyway) and while the episode can last for a few hours, the split does not. It's usually only 20 minutes before I realise what I've said and I apologise and I feel the regret and shame, despite still being in the episode and emotions are running high. It's like waking up out of a dream. It's like something else had control of you. And yes it does sound like she split on you, despite her being calm but still quite upset, splits don't always happen during what I call ""rage episodes"" or ""depressive episodes"" I would just give her some space to clear her head and see how things are in a few days.",Topic-Economy,1ciu9kt
12,"Thank you so much for this. It has unfortunately been a month, but I know her history and I believe her splits are usually more permanent. But it is still helpful to know this was not because I'm a bad person or partner.",Afraid_Knowledge4983,1ciu9kt
13,"You're welcome and no of course you're not. There are a lot of learning curves in relationships and we don't always get it right & we can sometimes really upset our partner without even knowing it, especially when you're dating someone with BPD. I think reaching out to her soon would be good, even just to check in and see how she's doing. She will appreciate that you thought of her.",Topic-Economy,1ciu9kt
14,"Sadly I did reach out and asked to meet up to talk and she said she ""said everything I have to say"". Which is disappointing but also how it goes i guess",Afraid_Knowledge4983,1ciu9kt
15,Wait a bit longer and reach out again in a few months or maybe even 6 months. She may feel different then. Do you want her back? Or are you okay with being single?,Topic-Economy,1ciu9kt
16,"It's tough, because I badly want the version of her that loved me and was willing to hear me out (or even see me). I love her, but I can't healthily wait for 6 months for her to possibly come around.",Afraid_Knowledge4983,1ciu9kt
17,"I understand. But remember, if you guys are meant to be, you will find your way back to each other.",Topic-Economy,1ciu9kt
0,"Hey OP! I know this struggle so well, and you are definitely not alone.

Something that helped in my circumstances was a couple of things:

1. Knowing I had BPD and learning about it; knowing a lot about why I’ve done what I’ve done (basically that “aha!” moment)
2. Coming to understand that obsessively friending, then unfriending, or sending a message and then deleting the message or following up with my thoughts one after the other in multiple messages after initial message and the like, is–how I see it– something of a subform of *splitting*
3. Choosing and learning to believe people when they say this or that about you (positives only; but taking less than positive things is a diff convo)
4. Identifying the feelings you get in the moment when you do those things, naming it and reflecting on the why. What’s triggering that response? When it happens, write it down (eg, “today I friended Elly again, then unfriended her. At this moment I was feeling anxiety because… and then delve into that further). This sometimes helped with my spirals
5. When you see the pattern and the triggers, it was then about processing after that and then learning to catch myself before I deleted a message or sent additional texts or unfriended
6. Always, always, always remember that practice and learning better habits is NOT linear! Give yourself grace if it’s not something you’re able to catch every time
7. Realizing that part of my personal trigger for this was obsessing about the “am I being annoying, do they like me, etc” and that by hyper focusing on that made me super twitchy and to get rid of that anxiety I decided to “un-do it”. I began practicing the “I friended them/ sent that message, now I’m going to focus on something else, and if it’s important enough, or they specifically ask me to, I will leave it alone.” The urge began to stick after a while. To this day, I still wonder if I’m being annoying or if someone doesn’t like me but it’s manageable most of the time now. But then that leads to:
8. Wherein you can’t control what other people think of you, but you can control how you put yourself out there with your actions and decisions.

OP, you’ve noticed this is something you do that you don’t find helpful or healthy, and you mentioned your loved ones are or seem to be getting annoyed by the consistent back and forth, right? Don’t let that destroy you! You’ve taken a great step by even having the reflection that this is not how you want to keep behaving and then reaching out.

There’s no quick fix to BPD, there’s either remaining stagnant and drowning in it, or taking the process of overcoming certain aspects one step at a time and making progress down the path you want to walk.

I know you mentioned that you aren’t comfortable sharing your diagnosis with your loved ones, but perhaps in the future that will change. And I really think it could potentially help, and them; them, so that they can understand it’s not just you being annoying or too much on purpose, but that there’s an actual reason for it and you’re actively working on making it better because you care for them and (I hope more importantly) about yourself. And it’d potentially help you because when a person takes ownership of things like this, you’re giving yourself the power over how you feel, and taking it away from others (or at least how we perceive that).

Off topic example of owning it to keep the power in your hands: I had the crown/tooth next to my front tooth fall out and it’s unrepairable. I could get an implant but that will be hella expensive and around a year plus long wait. I am super self conscious about my teeth as is since I didn’t take care of them in childhood and it’s haunting my ass now. But I figured, “Ok, I’ll just wear a mask everywhere”. I hated that. So this last Tuesday when I went to campus for class I was wearing a mask and made a decision for myself. (Helps if there’s one person you feel a semblance of safety with at first when practicing this; it doesn’t have to be your FP or BFF 5eva). I spoke up right before class began (like a minute or seconds before), and started off with a little joke announcement “So I know we’re all judgment free in this class, except when it comes to Professor A’s dad jokes (insert snorts of laughter) but I wanted to sort of tell you all this”, and proceeded to basically say “My tooth fell out, I’m not sick (as I took off my mask) and I don’t want to wear this mask so here’s my adorable smile minus one teephers”. And I actually showed the class while sitting all chill-like in my seat. I further added, “I know it’s weird I’m announcing this but I’m doing it because it gives me the power to own it on my terms since I can be self conscious about it, so there you have it!” Lots of nods and “that’s awesome’s” and “I love that!” were the responses.

And wow that’s long. Anyway:

**Tl;dr** OP has made a significant step by 1) taking note of this behavior and wanting to change it as well as 2) seeking support in my opinion. Here’s some things that helped me (sorry you’ll have to read above) and it’s ok if it doesn’t feel like it would help you, but it’s a place to begin thinking and then devising your own strategy!",the-panda-general,1asfix4
1,I can relate fully. I am going through the same. I hate hearing you say you hate yourself because you’re not choosing bpd I hate hating myself for a mental health pattern that I have. It’s not fair to do that to ourselves. You are not alone and even the tiniest success should be celebrated. The fact that you’re sharing your experience is HUGE and you should be proud of yourself. We got this! ❤️,InspectionOk7022,1asfix4
2,"I can not tell my fam much because of the stigma.   I told my mom that addiction recovery includes relapse. and she tell me that i doing well because i am 8mths sober and my grandmother said to just get over it and just stop when i mentioned my hair pulling.  They think i need to stop talking about the past in therapy and how i can not have therapy forever.  My siblings are a whole new level when it comes to my mental health. 

Thanks so much for insight! I want to be the best version of myself for my future relationships and to be able to be a mom one day.",Significant_Access_1,1asfix4
3,I dont understand the example and no need to apologize.  I really appreciate it and needed to hear that.,Significant_Access_1,1asfix4
0,"Hi! I'm new here too and also new to reddit in general. So I hope I'm not doing something wrong with this reply but I'd like to give advice as someone who was diagnosed around 2 years ago. (F20) 
 For starters, theres lots of stigma around this disorder. I've been through residential, iop, and php, (if you dont know these are inpatient/outpatient treatment centers, or what's considered ""rehab,"" where you live there and go to group everyday, possibly with Sundays off, for 3-6 hours a day. You stay in these facilities on average for 1 month) and even the professionals there can get nasty even upon hearing the diagnosis. (Ex. I was already diagnosed before entering, and each facility immediately refused my diagnosis, and then were disgusted after doing assessments/noticing symptoms and behaviors) With that being said, it's going to hurt while you're doing research and you come across people who make us out to be monsters. I still encourage you to do a lot of research. I would encourage most people to do some form of treatment. (I understand that money can be an issue I owe 7k to treatment centers even with my good insurance.) One thing I did when I was first diagnosed was I bought the DBT skills workbook. Professionals will say meds are only half the battle. For me, they are none of the battle because I was on 20+ different ones during treatment and I just don't currently feel like that's my way of going about it. Also important: Bpd CAN go in remission. I notice people acting like their bpd will be crisis level forever. It really doesn't have to be that way. I'm not completely better by any means, but I've for sure improved since I found out I had it. This is starting to get long so lmk if I can help anymore! (Don't know if there's a limit for this post or if I've broken any rules never use reddit)",bpdrelationshiphelp,1cxrx0s
0,"Youre not alone. I also feel this way. Things will get better for us. I don’t have advice, but please hang in there.",bedbug_____girl,16nzxrc
0,"Sounds a lot like dissociation to me, if that's the case I don't think there's much you can do except trying to focus on the here and now",AnnyFoxy,16k1gc6
1,"That’s what I thought I was doing, I thought I was doing okay. And then yesterday it hit me that something didn’t happen 3 days ago, it happened two weeks ago 🥴",PrincessKittyy00,16k1gc6
0,"Losing someone is hard, but losing someone who was not good to you is complicated. It’s easy to have regrets when someone is gone and to justify/look over the bad things about them when they’re not here anymore because you’re not actively dealing with them anymore. You have no reason to feel guilty though. You needed space from her for your own mental health. Never feel bad about putting your metal health first and staying away from people who make it worse. 

Try thinking of it in a physical way if that helps. If you had an open wound, and every time you were around your mother she took a knife and stuck it in that wound, would you honestly feel guilty about staying away from her? Would you honestly let her trick you into believing that it’s your fault that you didn’t get to spend a lot of time with her? Or would you put the blame on her for sticking the knife in every time? 

It’s the same thing. Just because you’re mental pain isn’t visible doesn’t make it any less real or valid.",love_me_madly,1847k6a
1,"My dad died of cancer when I was 21. I'm 24 now and it still hurts just as much as it did the day he left. Grief doesn't get smaller, you just get bigger. If you'd like to chat, my DMs are open. Please take care.",,1847k6a
2,i’m so sorry for ur loss. wishing u all the best my dm is open in case u wanna talk,little7bean,1847k6a
3,"Complex grief is difficult to manage. There is no doubt that she is responsible for your disorder, and a neglectful parent.

You don't owe her your guilt. She doesn't deserve it.

Don't give her the satisfaction of proving you're good enough after her death. Move on without guilt and work on yourself.",BettySwollocks45,1847k6a
0,"There is something to be said for being g self aware. 
My goodness what I would give to be one of these oblivious assholes. But that’s not the cards we were dealt. 
I am 40. Just diagnosed I. Last year (but it’s been there forever). Push yourself to talk with mom. Push yourself to be with friends. Isolation is the worst thing u can do I promise u.
As far as therapist. If child work isn’t working. Say it.
See if they do t offer up something else. I’m sure u e heard it but the go to is DBT therapy. But for me the best was EMDR. 
See what happens if therapist won’t budge then u move on. It suuux. But we have to be our own advocates.
This shit is the hardest shit on earth. We both know that. Fight. Fight it. 
God bless",birdbandb,1cvrfvw
0,"Don’t look back, move forward. Once you have dated someone, even the subtlest advice from them is tainted with their emotions from the relationship you shared with them.",DiStUrBEdMeLoN,18ywuxb
1,Get addicted to multiple hobbies,,18ywuxb
2,"Lol ,i literally had to put perfume under my nose bc i smelled it in publication",Significant_Access_1,18ywuxb
0,"You should definitely speak to a therapist or psychiatrist if you feel you need meds 🖤 have you tried writing down your thoughts and emotions? It might make you feel better to put it down on paper. Or watch something that you can enjoy, or make you feel the opposite (sad watch something funny)",punkmexicana,114vffw
1,I would also suggest limiting writing it down to 30 minutes only. So you can give yourself a definite time to get it all out on paper.,EurekaVonFritz,114vffw
0,"Sometimes when I feel like such crap inside, i focus on taking care of my outside (clean clothes, comfy environment, distractions, snacks) and wait it out, like I'm waiting out a tornado. It will pass, I promise",100pct_Linda,11flx2j
0,i’m a server. and idk if i mask or whatever bc i can stay super calm cool collected when i’m clocked in. under really any circumstances with my customers. 🤷‍♀️ i clock out or even go to back of the house and no fucks given. lol.,dumbbitchsaidthis,17qjwsb
1,"I'm a janitor. I love it, especially working in empty buildings where I can just zone out and go on autopilot. I can listen to music or audio books, and the work itself is satisfying yet not super challenging. Sometimes there's gross stuff to deal with, but once it's clean and the chaos is made into order, it's all worth it.",LunchboxFP,17qjwsb
2,I'm a ugernt care coordinator for the National Health Service in the UK. I organise appointments and arrange and coordinate doctor visits to people's homes in an out of hours setting. It's a service called NHS111 and it's designed to stop the need for people to visit hospital for non-emergency issues.,Muay_Thai_Cat,17qjwsb
3,i work in delivery and love it. i’ve found that i work best in environments where i don’t have to interact with others much and there’s not a whole lot of interruption to the work i’m supposed to be doing. i have my set route on my van and can put on music and be left alone.,carmesancheeese,17qjwsb
4,"In med school, so guess doctor in the future.",AffectionateMistake7,17qjwsb
5,"Costco bakery, sanitization. It’s great, especially on bad days, lots of time alone and heavy lifting. Good for getting anger out, and also super satisfying to see the area go from disgusting to perfectly clean.",g0regutz,17qjwsb
6,I’m a chiropractic assistant and I love it. I help patients get their pain managed. I’ve found that work has never been a large challenge for me probably because it gives me something to focus my energy on and I can mask really well,DyingImagination,17qjwsb
7,Hairstylist! I love making impact on people's lives by creating art with their hair! I forget everything else exists and focus on each and every clients needs. It's fulfilling and makes me feel purposeful.,,17qjwsb
8,"ive never had a problem getting a job, but ive had a problem keeping it. its very overwhelming for me to put this mask so ppl cant see what im actualy like. (rollercoaster XD)

So I just started a new job 3 weeks ago, working from home accountant. and its better than going in to the office, i have facecalls all day which is overwhelming for me, but everything cant be perfect.

now its my partner stressing me out, hes not used to me working lately, so its a big change and hes not being supportive, its hard for me to work but i have to just ignore him because i need this!!!!",namaste_all_day_,17qjwsb
9,"I work with IT. I was able to work on site but it would drain me emotionally. Home office was a game changer, it’s easier to self regulate in your own space and the limited social interaction helps",SilverGirl-,17qjwsb
10,"I just started as sailsperson and i already hate it. Too stressful, too many people, no training, you have to have an working brain - which i dont, all the time",marora25,17qjwsb
11,PTA,heljantus,17qjwsb
12,"I work in a store. My position used to be just a stock clerk, I used to work during closed hours so I don’t have to talk to any customers. Then I got a position as cashier, bc they needed it and it was alright and now i’ve been the team manager for almost a year and in the beginning it did me good and right now I can only enjoy the behind the scenes task I need to do rather than the interaction with the customers. I can be really pissy and in a bad mood so quickly bc of people, It’s very hard to be customer friendly for me…",beepboopwaa,17qjwsb
13,"I am a student, studying and researching in astrophysics.",veeee2002,17qjwsb
14,Cosmetologist! :),Whoactuallyknows19,17qjwsb
15,I work in acute care rehab!,feverdreamadventure,17qjwsb
0,I’m sorry.,MasterOfOne,14aguvd
1,Thank you...I feel sorry too...but...there is nothing I can do anymore...,Angiogio,14aguvd
0,"Hi I’m 37 and have been living with BPD most of my life. Properly diagnosed when I was 24. First off, people with BPD can absolutely be good even amazing partners. We just have to work extra hard on our end to stay constantly aware of ourselves and how we perceive whatever current situation we are facing that is triggering us. The best possible skill you can learn is respect boundaries both your own and the boundaries of others. For us, a lot of it comes down to communication. How we convey and receive to and from our loved ones. We have to work extra hard to remind ourselves that we need to trust and know our partners love us. And on their end they have to also be willing to stay healthy and regulated as well as taking part in either personal or group therapy. The truth is… we are a tall order. But we also, have the innate skill to love… if we remind ourselves why we are doing this, it’s all out of love.
I myself am entrenched in a battle that is slowly degrading my partners will to keep going. 
I’ve decided to take space after a big blow up. 
(This included splitting, devaluing, and the eventual “break up” talk) and I’ve been doing my best to calm myself physically and mentally while I let the emotions run it’s course. Im trying to be more observant rather than reactive. But I know deep down somewhere… im losing someone I truly love and care about… I honestly would not have revisited this BPD if it wasn’t for her. 
In that, makes her a great partner. But we are doing our best to keep ourselves healthy. And that comes first. Everything else, let them lay as they fall. And be ok in knowing you will be ok. Let it hurt. But do no harm.",Maximum_Primary6940,171nkeh
0,"could you please edit out the other subreddit name? It always triggers people, it's a very anti-BPD group.",TranZeitgeist,14a6p2o
1,"You were born a sweet, innocent child. Something happened to you on the way up. I've had the same struggle for many years. I didn't realize that I was messed up, even after 2 divorces and too many stupid and/or embarrassing mistakes to count, until I was an old man.

At least you are aware. Have you had the same therapist for the 3 years?",zoolook67,14a6p2o
2,Literally me,Upset-Quality-4104,14a6p2o
3,"You are not a bad person. We all have BPD from being traumatized. No one who doesn’t have BPD will ever understand how we work. My boyfriend tries his best but we still end up fighting a lot. You are a person with ambition, thought and feeling. You came to the BPD subreddit for help. They came to their anti group to hate and tear down others with mental disabilities. Something that’s known as one of the hardest to deal with. You deserve people who love you. I haven’t found my people yet but one day we all will",spidergwen16,14a6p2o
0,DBT,bruhnothot,156asds
1,"Straight up I relate, i overstimulate myself (do things like music and tv and hold ice all at once to feel something dramatic so it gives me the same relief as self harm without self harming!",Vverroonniikkaa,156asds
2,I do dbt,bordercup-brat,156asds
3,I been eating sour candy but it ain’t always work,bordercup-brat,156asds
0,">I've been faking it for his sake, as he works really hard to support us and doesn't need the added stress, but it's taking a huge toll on my mental health and physical body.

In my opinion, faking it for his sake is the wrong approach, and will do you no favors in the long run. You can’t run and hide from your setback, which is all that this is. You’re already working on it, and you’ll find another job. 

You’re in a relationship with this person. You’re partners. You’re supposed to be able to lean on each other for support. He can’t give you support if you aren’t open and communicate about what’s going on with how you feel. Allow him to tell you how he feels and how he manages his stress level.",thomas-grant,15gs22s
