,Comment,Author,Post
0,"I haven't cried this hard in a few months. I had to let go of my partner. When I say that, I mean I have BPD, C-PTSD, MDD, and DID. The second my partner joined that subreddit, it was just a slow decline. There were other factors. But ever since then, it's like, in his mind, everything I do is to try and manipulate him. Or play victim. It's like I went from his partner to his enemy in a matter of days. Do your best to get him into an actual support group for loved ones of BPD. Because 97% of the post on that subreddit is just negative. There is nothing about supporting each other. Or their spouse or how to deal with the stress and feelings of overwhelming helplessness and resentment that build trying to support or love someone with this condition in a healthy way. 

But I saw him pulling away. And I didn't just split. I tried to talk things out. I talked to my therapist and psychologist. In my case, they came to the conclusion that his expectations of the quality of progress I was making wasn't enough for him. And he was likely to break up with me. I didn't let that break me. Like I always did in the past. I focused on my therapy and God. Continued to work on myself. And is it at times the most miserable, painful experience of my life. Not being with him.. 

Not texting. Or calling him on his lunch break to hear how his day is going. Going to his house and playing minecraft. Listening to songs in the car and holding hands. Watching him play video games with his friends or learning about code. Seeing the smile on his face when he figures out how to solve a problem. The way he scrinches up his face when people say things he thinks is ignorant. Or the cute way he talks to his cats. I miss him every  second of every minute of every hour of every day, weeks, and months we have been apart.

 And he did ask for a break. And we are on this very long break it's been 5 months. We hardly ever talk. Or text or meet up. When we do talk, we argue. But, we almost always say I love you when we hang up. And I know he's trying to work on himself.  And so am I. I'm doing everything I can to move forward. To continue fighting  those waves that try to take me under, I say all this not to scare you. But, because as much as I miss him. I know this is what he needed. And what I needed. I know we wouldn't have BPD if doing this was easy. And if the pain we experience wasn't almost impossible to bear at the thought or realization that we are going to lose someone you love. But, this is about being able to face you fears over and over again. There are gonna be days that you lose, but you can't keep letting that fear control your life. Or it will keep trying to kill you. Until it succeed.

Every time I stand up to face my fears, it gets just a little bit easier. Because you'll slowly start to realize you can do it. You start to trust in your ability to adapt and rise to the occasion. 

One scariest things for me is the unknown. 

Things I don't know: 
AM I  Unloveable?
Am I damaged beyond repair?
What will I do if he leaves for good?
Can I do this on my own?..
Will I ever heal from my abuse?
Can I ever truly forgive my family 
Forgive My rapists?..

I don't know. 
But as I work on myself. And very slowly heal from my past. And unlearn my bad habits, negative thinking, and self sabotage. Learning how to listen to myself and my desires.Learning who I am. Building real love and compassion for myself. The unknown is now know. No not everything but a few things on that list I finally know the real answer.

Something I realized when I started loving myself. Is I can't be unlovable like my mother said if I love myself.  I can't be unlovable if God loves me. And being alone isn't the worst thing you could be. Trust me when I say this it's gonna be hard. But not impossible. If you have the will there is a way through it. God will come through for you like he's always done for me. Not always in the way we want. But if you put your trust in him that he will help you. All you need is the will and the faith to trust him to lead you through the dark into the light. You'll come out of this better than before. And you'll get all the comfort you'll ever need. And if you where to lose your way again you'll know he's right there with you. Waiting for you to take his hand. Never ever leaving your side. 

I love you, but God loves you more. 🫂

Feel free you contact me if you need anyone to talk to or encouragement. I'm here for you and anyone who needs a friend to lean on.",Corpse2Bunny,1cxwlef
1,"You are right. You are NOT a monster. YOU… ARE… NOT… A… MONSTER. You are the result of what happens when a person is mistreated or abused by their parents or another adult. My heart bleeds for you. 

My husband works hard to understand me. I know that if he fell into a group like that he would quickly see that it was not productive and simply BPD bashing and he would seek a better group. 

But here’s the thing… we are the victims of our abusive parents, but our loved ones can become victims of BPD through its manifestation in us. They need help to get through this, too. It is unfortunate that groups can get like that but I guarantee there are other options for him. Whether they are here on Reddit or in an actual face to face support group or even individual counseling. They need help. Don’t catastrophize… fix it. 

Tell him your concerns and have ready a list of options you feel would actually be helpful to him because you care about HIM and not just your relationship or losing him. And if you are not in couples counseling please, by all means, consider getting into it. It has helped me and my husband tremendously for each of us to see through each other’s eyes and understand what is needed. And when it isn’t clear, our trained therapist who knows a lot about BPD helps us figure it out. 

Whatever you do, do not let yourself go down the path of self loathing and wanting to give up. Anyone who has BPD knows exactly what that means as we have all been there. DO NOT GO THERE. You are strong enough to have gotten this far through abusive parents and now through BPD affected relationships. You can get through this as well. 

You are worthy of love and the most effective place to get that is in yourself. I know how cliche that can sound and how hard it can be for us to even know what that looks like, but loving yourself means taking care of yourself. It means sometimes simply closing your eyes in a quiet space and imagining that hurt child whose caretakers failed to protect her and were even the ones who hurt her. Wrap your arms around her and tell her you know she wasn’t protected. You know she was hurt by those who were supposed to love her, but YOU are here now and YOU will protect her. You will provide for her and you will love her. Because she deserves love and you deserve love. Period. 

The sooner your little girl inside begins to feel safe and loved by you, the sooner she (and you) can heal. 

Do it right now. If you’re at work, go to your car. If you’re at home, take a break in a quiet room. I personally like to take a warm bath and turn off the lights and put on some white noise or some healing kind of music with no words so I can focus. And do this for you. Do this for her. TALK TO HER. Console her. 

Because she is not a monster and neither are you.",Overall_Interview441,1cxwlef
0,"This was a really amazing and detailed post with so much insight. Thank you for taking the time the share your detailed thoughts! I’m sorry for the abuse you suffered. You sound very self aware, like you’ve done a lot of work on your BPD symptom.",coconutstyle808,1cm6oiu
1,"This post hurt my heart. I’m so sorry you’ve had to deal with such shit circumstances. You are super young though and honestly when I was 21, I was certain my bpd would kill me. Ten years later and I’m only just starting EMDR and really working on fixing the damage others caused. Your self awareness regarding your situation and issues really gives me hope that you’ll beat this. Get yourself into therapy, and give yourself some time. It’s still so very fresh.",jaycakes30,1cm6oiu
2,"Crying at work reading this :( I am so sorry for all you’ve been through. Please send me a PM if you ever want to talk, I genuinely mean that ❤️",Glum-Marionberry9591,1cm6oiu
0,"I’m sorry that happened and I understand that you feel abandoned by your therapist and trust me I know it’s very difficult dealing with those emotions. But maybe it’s possible something happened with your therapist and that’s why they aren’t responding? 
I suggest you try to sit tight for a while and see if maybe your therapist will contact you soon. It doesn’t necessarily have to be that they abandoned you, there are possible other answers to why this is happening. 
And if your therapist contacts you, explain what you went through and everything will be okay!",Melindish,15ekcpi
1,"First, I want to start by saying that I am so incredibly sorry that this happened to you. I can't imagine how painful this must be and I commend you on your ability to seek support despite this negative experience. As a therapist, I seriously recommend you report this therapist to their licensing board. From what you're describing here, their behavior is wildly unethical and absolutely unprofessional and should not be practicing. I cannot believe that they would think it's okay to go on a MONTH LONG vacation and either 1. Inform you of their planned vacation WAY in advance (I literally tell all of my clients if I'll be off for even 1 day as soon as I know and will remind them as the date gets closer) or 2. terminate and refer out as there are both ethical and legal obligations to do so after 3 consecutive weeks without treatment. Please be kind to yourself and know that this is 100000% on them and they should absolutely be held accountable for their actions.",bornforthis23,15ekcpi
2,Thank you so much <3,spiralingspiderr,15ekcpi
3,"Thank you so much <3 I was just so confused because usually they send emails when their late, or they have to cancel our session etc. I never received an email or anything.
I really appreciate all your kind words! Thank you for your support :)",spiralingspiderr,15ekcpi
0,"Work on your self esteem. The lack of self respect is what makes one take rejection sensitive. Work on focusing on building up on yourself. Your esteem, your confidence and etc. This will make these unpleasant incidents have lesser holding onto you. Work and focus on yourself. And you will release the impact of others have lessened on you.",No_Bandicoot_864,1bdrs7f
0,"The best thing you can do is work on yourself. You can recover from this and become the best verison of yourself so that you never have to go through this again. I would say, as much as you love someone, give yourself that much more love while you heal and develop. Loving, accepting and forgiving yourself is an integral part of moving on so you can be a worthy partner again someday. Good luck and I believe in you.",raincanyon,14a86ms
1,i'm going through the same but she just left me. i feel so lost and just keeping a little hope she'll come back is keeping me sane,ackhein,14a86ms
2,"100%

Therapy.  

Work through the ""ism""s.

Check if meds are a good choice.",Abrakem,14a86ms
0,"Sounds like this medication was a god-send. What is it? Asking because I believe I also struggle with all 3. 

and If you’re not comfortable sharing that’s fine as well :)",OpeningDisk9699,1brjlhq
1,"I can’t say it would work for everyone in every situation since every body and every diagnosis is unique, but my doctor thought Adderall was a good fit for my situation. That was for treating the ADHD, though. Not BPD. 🫶🏻 having multiple diagnosis with a lot of symptom over lap made my brain a weird chemical cocktail and this just leveled me out I believe.",Rowdylilred,1brjlhq
0,"I was like this with my first bf who eventually left me because I was too up and down. That was before I was diagnosed so I didn’t know what it was and how it should be treated. I’m now on meds and have been seeing a psychologist which might be a good idea to look into for yourself. I’ve got a lot better and am now a lot more stable though still have the occasional episodes but they’re a lot more manageable. So, maybe try seeing a doctor or psychologist about it to get treated. It does cost quite a bit but it might save you a lot in the long term",RosieSnowflakes,1cq0dvi
0,"I haven't read the entire post cause i want to keto myself from triggering, but based off the first little bit here:
The best thing i ever did in my life was just leave my family. My mom would call me and the second she'd start some buckshot I'd tell her i refused to be talked too this way and i would hang up. I moved halfway across the country and because i was not around them all the time i got a lot better. Im back home after 15 years living back in the same state and honestly im thinking about leaving again. Things are better than they used too be but all the same BS still happens and sucks me back into it.",SilverSix311,183gywn
1,"Hey, I’m really sorry that you have been going through that, my friends have honestly been declared as my chosen family at this point and they are the reason I have survived so far. Something that gives me hope when I do feel like doing something is imagining my future family and giving a kid a much better life and being able to like live the way I would like to which would be different from the life I had to go through until then. You have been brave and have done great so far and that’s beautiful and deserves a lot of love",,183gywn
2,omg how horrible and cruel. i cannot imagine ur pain love 🥺 she doesn’t desreve u at all esp after u made sm effort to be close w her. i think cutting off all contact is the best solution here,little7bean,183gywn
3,"You need to break contact with her. I really mean, break contact altogether. This is one of the prime ways you can care for yourself. Doesn't matter how you are coping with her saying these things. They will cut deep and in the end those cuts will make you bleed out, make you weak. Cut contact, concentrate on your friends.

Oh, and move house when you financially can so you can get a dog. You won't regret it. Promise.

Much love to you. Onwards!",NeerImagi,183gywn
4,"Sometimes the best thing you can do is get away from them. Even if they're family, it will take a big stress off you to cut off toxic people. 

My mom told me she wished she could kill me when I was 17. It affected me a lot, on top of everything I was already dealing with. When I was 19 I moved out and became totally independent. Even when my mom would try to talk with me and still invalidate me, I just cut off communication",punkmexicana,183gywn
5,"Please don't listen to whatever they have to say, you are 22 and you are doing good for yourself. In a situation like this, not having parents is way better than having one who triggers you, when you are trying your best to make positive changes in your life. If they can't do any good, then they don't have any right to do you any bad, so they better keep shut in their own world while you go ahead bbg, live your life, be the best you can and never ever let them bring you down. Just because they brought us into this world, doesn't mean we tolerate every piece of shit they throw at us.You are amazing and have a wonderful life ahead🫂❤️",Winter_Sandwich_9166,183gywn
6,"I’m usually not one to jump to saying go no-contact, but this is a genuine concern for your safety without even mentioning the psychological aspect. You do not have to accept that kind of abusive behavior just because it’s your mother and you do not deserve to be treated that way. 

I am so glad you have a support system of friends/chosen-family, and I hope you can rely on them through this. Cutting contact with someone can be very rough but remember you have a group of people who love you and have your back",quad-shot,183gywn
7,"Hi I’m a 24 year old female, I am so sorry you are going through this. Bpd is extremely hard to deal with being diagnosed myself but no one’s parents should tell them such horrible things. Have you thought about or are you able to going low contact or no contact with your parents? I think this might be a safe option for you especially your mother with the horrific things she’s describing to do to you or want to happen to you. Maybe reach out and lean on your friends or other family if you’re able. It can get easier but it’s definitely hard but you got this ❤️. Please don’t leave this world and your friends/support system behind, you are loved and needed",Bratywithafaty,183gywn
8,"We live in the same town, so we are very close and because of my university I can’t currently move but i am thinking about it once I graduate and i have one year left so i can even leave the country",Informal-Loan3063,183gywn
9,"Thank you so much for your comment , it really felt like a virtual hug 🫂💜. And I totally agree with you my friends are literally my family and the only reason keeping me alive but when it comes to future family and kids its hard for me to think about that. I never knew how to love or be loved and i would never decide to have kids until i feel mentally stable. I don’t want to inflict my past pain and trauma on my kids i want them to feel loved and safe and be mentally healthy and stable so until i can give them that i wouldn’t feel ready and it all just seems a far fetched version of my future.",Informal-Loan3063,183gywn
10,Thank you for your concern and kind comment. I have minimal contact with her just because we live in the same area and after these incidents we haven’t been in contact at all. Hopefully once i graduate university i will look for a job as far away as possible. It’s just the way it all affects me emotionally that’s hard to deal with,Informal-Loan3063,183gywn
11,"Many more hugs for you, the future family thing it feels tough but yeah it feels good to live in those thoughts for a while rather than reality. For what it’s worth I’m proud of you for everything and you’ve done great and I’m sure your friends are proud of you too 🫂",,183gywn
12,"also if you can now or later, adopting animals can help. I got my dog 2 months after my attempt and he’s kept me alive for 9 months now and I owe it all to him 🌙",,183gywn
13,Ohh how i wish i can adopt a pet 🥺🥺🥹🥹🥹 i love animals but my apartment doesn’t allow pets 🥲,Informal-Loan3063,183gywn
14,"Ah damn 🥺
Hopefully you get to do it in some time 🫂",,183gywn
0,"Tbh if you don't have emotional disregulation it sounds like you might need to talk to your doctor about your diagnosis because that's the main issue with BPD. Perhaps they saw something in you that you haven't recognized, or perhaps they're wrong.

Also saying people with BPD quit their job because their bosses ""are mean to them"" sounds kind of disingenuous. Lots of people struggle with keeping jobs because they have a lot of bad mental health days and can't make it to work during crises, or for other reasons. Lots of people with BPD don't have trouble keeping a job, either. It's different for everyone and using language that implies immaturity is a bit insulting. 

Anyways, maybe see a different doctor if you feel this one just kind of pinned the label because they couldn't think of anything better.

I will say that not all people with BPD have emotional trauma, it's just really common in people who have emotional trauma. You don't need to fit every symptom to have a mental illness.",Cobalt-Royal,ujabxw
1,"I have very strong interpersonal issues and am very clingy. People cut me off a lot and I seek revenge often, if not always. I have intense impulsivity issues.  I physically cannot be alone and have that problem of having no interests and being always bored when I am alone. That was allegedly enough to clear the bar for BPD. 

The shrink diagnosed me after a few questionnaires, a chat with an ADHD specialist and 2 hours. I asked her at the last session (I believe the 9th or 10th) if she still stuck with her diagnosis, she said yes. She also tagged along ""possibly-clinical depression"" for good measure.

If I said something tactless, I apologize. I'm just trying to transpire my thoughts and feelings and apprehensions as concisely as possible.",JeanPaulItsArt,ujabxw
2,"That's fair. I'm also being a bit hard on you. Having a new diagnosis is always really hard, too.

Let's look at some questions regarding emotional disregualtion, because everything else does sound like BPD, but at the same time, it can always be due to other causes.

Maybe think these over and see if things start falling into place for you or if the BPD diagnosis still seems wrong ro you:

Have you asked anyone in your friends or family if they've noticed you have strong emotions?

How often do you lose your temper?

How often do you yell?

How often do you cry?

Do you get really excited about stuff to the point where you're yelling or jumping around?

How many times do you switch moods throughout the day? My neurotypical partner once told me he's usually in the same mood throughout the entire day and I was shocked. I have BPD and yeah. Different mood like... every hour? Every few hours? But each person is different. Like lots of neurological people can be moody.

Why do you think people cut you off?

In what ways do you seek revenge? I'm going to go ahead and say that's not a very healthy way of doing things. Doesn't necessarily say you have BPD but it does sound like it's related to a possible mental health issue.

These aren't necessarily ways to diagnose yourself or undiagnose yourself. They're just exploratory questions for you to see if you can understand yourself a bit more. But maybe they'll help you understand your doctor or dispute them if needed.

Hope this helps!",Cobalt-Royal,ujabxw
3,"Ha, the diagnosis is from 2019. I just kinda left it on hold since then.

I dont have many moods. Just ""normal"" and ""I cant di anything or function"". They switch unpredictably 

I lose my temper unpredictably, but not often, and it often seems like a conscious decision

I can get excited and jumpy sometimes, yeah, but not often. 

I dont cry but I am a wreck in the second mood. They dont switch regularly, again, it takes a trigger to switch.

People cut me off because I just am not really attractive to people or interesting. I wrote a very long description of how this happens if it would provide more context",JeanPaulItsArt,ujabxw
0,Holla,Unusualbellows,g94fd5
0,"I have BPD and can relate. If we were to dig deeper, instead of it sounding black and white, problem solving entails not over generalizing I've learned (which people with BPD famously do). So the more accurate question I'd say is, ""What does it mean to deserve something?""

I feel having a life partner is one piece of the pie of being whole. Intimacy is a basic human need because we are social creatures.",,h8geym
1,"Hey, my take on this is that you completely can be in a relationship. But hold out for a really special person, they must be compassionate and kind, understanding and have a gentle and loving nature. I’ve spent the last 15 years consecutively in and out of relationships with very little time being single. A bad/toxic/unhealthy relationship really exasperates my symptoms and behaviours and can really set you back in learning how best to cope and manage your bpd. 

My advice is to learn your triggers, identify the parts of you that are hurt, and allow yourself to feel worthy of love as an imperfect person. It is only now that I am in a loving and healthy relationship that I have learnt and realised that a being in a relationship is not the be all and end all but that I’m worthy of love ❤️",,h8geym
0,"I’ve never even thought about letting my work know about my BPD. I always thought it would make others view me as less capable and I never wanted that. My parents won’t even speak about it so it’s always been hush hush. 

Why have you decided to discuss it with your work? 
How do you plan to go about it? 
How do you hope people react? 

I’m very curious how it will go, but I wish you best of luck.",bansheespirit,chgaqw
1,"I know what you mean when you say ""I always thought it would make others view meas less capable.."".          
 That thought did run through my mind. If I tell them what I experience will it make them walk on egg shells around me or make me seem unstable as an employee? Reason 1.) Personally I want mental illnesses to be openly discussed and to have more awareness surrounding them so there is no stigma. Reason 2.) I leave work sometimes. I have all sorts of panic/ anxiety attacks that unfortunately can dictate my behavior and that effects my job. 

 The reason I want to openly share with my work is probably because my job is a very ""family vibe"" and open about our personal struggles. We try and ask each other at the beginning of the week, ""What you need to know to be able to work with me."" Which gives us the chance to say things like ""My cat got sick this past weekend and I am very anxious about the whole process. So if I seem off with you all at work, that's why."" 

This idea to open up is still in the beginning stages of how I want to go about it because I don't want to make things worse. But at the same time, why not tell them? I am not ashamed of my BPD. It has caused me a lot of pain, confusion, and perseverance. 

How has that made you feel to keep your BPD ""hush hush"" with your parents?",mommasaidnoEm,chgaqw
