,Comment,Author,Post
0,"I have similar feelings sometimes. I often feel like there's no point in carrying on if I'm going to be bpd forever. Your feelings will eventually pass, the best thing about bpd is that even though it's hard having such huge lows we feel positive emotions more strongly too. Focus on the good things, listen to music or try to exercise. ",LittlePup86,501dn8
1,"I dont want sound like douche , but please try smoking a joint before slitting your wrists and letting the life flow out of them.Im not sure if you take drug test , but it seems like one can only fight dysfunctional mind with words so much. And these people wont give you your meds..that seems criminal",Dunston47,501dn8
0,"I feel this. I mean honestly this probably won't be helpful but ~recovery is a journey~ and learning to manage the symptoms and learn new ways of coping with stuff takes time. If you're doing the best you've ever done, that's awesome, just try not to stagnate. Not everyone is going to be your ride or die anyway, but I believe you'll find some people who see the good in you and think it's totally worth sticking around. The negative parts of who you are aren't the whole picture. 
Good luck tho",salr0ka,3o43zk
1,"Hey, sorry for your trouble.  Have you thought about learning to meditate? Also, one weird thing that helps me tremendously is a raw vegan diet. I don't know how to explain it; it seems to change the chemistry in my brain for the better. It's a hard diet to actually stick with but when I'm doing it, I'm like a new and improved person. ",SistinaLuv,3o43zk
2,"Hey I want you to know you're not alone in this feeling. I feel the same way with my friendships, relationships, and family. At first when I was young and I wasn't included or people didn't act the way I wanted I lashed out at the closest people nearby. Now, my rage and depression has progressed to when my significant other doesn't act or the say the things I need I lash out and I have a hard time controlling the urge to hurt them so they can understand my pain and refrain from hurting me. I feel like I'll be alone too a lot of the time. I can't trust anyone not even myself because I'm afraid people will not accept me and tell me that I am a burden. Frequently, I feel like all people see me for is my mood swings and depressed behavior. I try to manage those feelings with medicine and therapy. Recently I have tried Lamictal but I had to stop within two weeks to prevent a rash from forming. In therapy I have tried to address my issues but that hasn't been enough. Currently, I am looking for a group therapy workshop to handle these emotions and to not feel so alone. Since I have been unsuccessful thus far I have turned to reddit to reach out to those feeling the way I do so I can mitigate this pain. ",alicialee2093,3o43zk
3,Thank you for this. It's a good perspective on the situation <3,cheesybagel,3o43zk
4,"I meditate, but I often forget to do it since I'm so busy/run down. Also I've done keto which I believe is somewhat similar, and it helped me a lot. It's just hard to stick to as well",cheesybagel,3o43zk
0,[deleted],,18tlf2g
1,"It hurts when your subconscious emotional manipulation doesn't work. You're insightful enough to recognise this behaviour, and you're smart enough to manage your emotional well-being while she's away.

BPD is an attachment disorder that is uniquely difficult to manage. Your pain is real but you have to manage it.",BettySwollocks45,18tlf2g
2,Let her go... We can't let our misery try to keep company it's not fair to you or your girlfriend.,ExpensiveSwing7481,18tlf2g
3,This. Very well said and great advice.,West_Voice1616,18tlf2g
4,"Thank you so much for your thoughtful reply. Everything you said really resonates with me. In the past few years I was able to recall way more stuff that wasn't okay that happened in my childhood, so much neglect and abuse from both my parents. I think that I really struggle with the fact that I know what is wrong, I know what would be a healthier alternative, but there is no way in which I can even try to bring myself to get there. When I do try, it doesn't last nearly long enough to allow me to feel calm and regulated, impacting the people in my life as well, canceling out all my good intentions. I think I really struggle with control, frustration and despite the many years of therapy, where I am able to talk about what is wrong and what could be better, I truly cannot for the life of me to tolerate this difficult situations (especially feelings of abandonment, I think this might be my worst absolute trigger) and I  resort to unhealthy coping mechanisms",United_Cry3357,18tlf2g
5,"I agree that I do recognise my tendencies, however I truly don't how to to manage my emotional wellbeing, I have no tools, and even when I try to meditate or make a list of pro and cons, I can stay calm for 1 minute, then I'm mad/sad again, with a thousand thoughts and I feel rage building up inside. Though I think the thing that scares me the most is the fact that I feel like it truly was a priority for me spending it together and it makes me feel incredibly unsafe and vulnerable to realise that I am this in love and attached to someone. Do you have any advice on how to manage it?",United_Cry3357,18tlf2g
6,"here are some tools that I use when I’m looking for answers to problems. It seems BPD sufferers get stuck in an anxiety thought loop and finding ideas to counter the ones causing the mind to be caught in a trap helps release us from the anxiety trap. Some times my mind is like a solid piece of cement with intense tension right in the middle and I have to listen for 6 hours of videos before the cement cracks n crumbles and I find some releif.🥵

[https://www.youtube.com/watch?v=p2KHo95Qknk&list=PLhEkKo\_KJJI9T5SrGi9CzBRTtebfo8heU&index=24](https://www.youtube.com/watch?v=p2KHo95Qknk&list=PLhEkKo_KJJI9T5SrGi9CzBRTtebfo8heU&index=24)

[https://www.youtube.com/watch?v=h-dyoZx2Jhk&list=PLhEkKo\_KJJI9T5SrGi9CzBRTtebfo8heU&index=159](https://www.youtube.com/watch?v=h-dyoZx2Jhk&list=PLhEkKo_KJJI9T5SrGi9CzBRTtebfo8heU&index=159)

[https://www.youtube.com/watch?v=EAeMjbTYUcQ](https://www.youtube.com/watch?v=EAeMjbTYUcQ)

[https://www.youtube.com/watch?v=W23Qob0d6rA&list=PLhEkKo\_KJJI9T5SrGi9CzBRTtebfo8heU&index=144&t=46s](https://www.youtube.com/watch?v=W23Qob0d6rA&list=PLhEkKo_KJJI9T5SrGi9CzBRTtebfo8heU&index=144&t=46s)",DiStUrBEdMeLoN,18tlf2g
7,Thank you for these. Particularly the second to last one on suffering. It is so difficult to sit in my feelings/suffering without acting on them and then ruining a relationship or a moment or making things worse.,West_Voice1616,18tlf2g
8,yeah suffering is a major one for us BP’s! Wrecked plenty of moments/nights and relationships myself from not realising the whole time that it was the underlying suffering that I was experiencing/ignoring that was making me snap over and over again. I see it building up now and I put a vid on or I see myself doing the loathing talk in my head and realise how dark it’s getting and put a vid on. You don’t realise how serious the illness is until you try to stop the intense feelings🤯 i Think I’ll end up a Buddha and evaporate into pure energy with all the work I’m doing to stop this out of control freight train.🥵,DiStUrBEdMeLoN,18tlf2g
0,"I’ve ruined a few relationships this way. I was truly awful and abusive but was totally aware of it and unable to control my feelings/reactions. When my last relationship ended, I stayed in bed for 3 days and didn’t eat anything. Things can seem impossible to cope with, and sometimes they are, but being with friends and exercising helped me start to feel like a person again. I’ve been single for a few years now but moving forward I would just try to take a step back and focus on yourself and the way you’re feeling when you’re upset. I think really mindful behavior could potentially help. I’m not great with advice but it sounds like he might be interested in working with you. You are actively seeking out treatment and doing everything you can right now. Hopefully he will realize that and be willing to go through this with you. I wish you the best and hope things work out! You’re not alone",shoski13,c8op5u
1,"Thank you so much for your reply. This gives me some hope and some positivety. If this fails then I would be alone for quite some time. I unfortunately do not have any friends that I am close with, I have a hard time. My best friend just moved away less than a week ago. All my support is him and his family as I do not have a relationship with mine except for my brother and sister who do not know a lot about me. I just want him to smile at me again, touch me and genuinely want to be with me. I am just so scared which makes me so anxious. Thank you for your reply :)",kristanball,c8op5u
0,Relationships can be super difficult for those with BPD. Sometimes even I feel like just quoting and I think about death. Do not be ashamed of feel guilty. Just keep trying your hardest to improve as a person.  The best advice is to Do what makes you happy because that is what you can control and be happy. I hope this helps,Blackwidow705,i3vim3
1,"You can't put a timeline on happiness. This sounds like my relationship. I've just recently moved out because of how bad it got. I wanted so bad to get married/have kids. He once told he was going to propose when I graduate my baking program. Well... that... didn't happen. And he hasn't said a thing about it since....   


Honestly, I currently love living on my own, trying not to think about someone else for a change... I constantly wonder if I'll ever be married or have someone think ""I'm the one"" and then follow through. It's tiring and heartbreaking. And I want to cry just typing this but the best thing I can do is continue to push forward with things that help ME. Not anyone else. I can't spend my life trying to convince someone I'm doing better or am changing. I can't spend my life apolozing for every fiber of my being. As long as I'm working to move on and be ""Better"" than that's all I really can do. Maybe one day someone will come along who DOES TRULY WANT ME but for now I gotta focus on myself.  


Hope this helps? If you want to talk message me. I am also a female in her 30s.",mikachuXD,i3vim3
0,"I don't know that either of these 2 points will bring you real comfort but

People with borderline have had physician assisted deaths in countries where that is offered. May be no surprise.

Second is that DBT is designed to recognize that life is not always ""worth living"", and feeling as you described may be a life that's not ""worth living"" (why else would you be desperate for escape?). One point is to focus on that reality and risk , managing to cope with new tools while building the relationships, meaning and habits that can sustain a life you chose.

I can't say why your psych tells you ""you're doing well"", whether it's communication on your part, or perhaps just the limit of their validation and awareness. The fact you were previously on 5 medications at once is a small concern and maybe suggests that wasn't right care for you; in general fewer meds= better recovery for pwBPD. I can't assume you have access to other care providers or treatment programs, but possibly a higher level of care, partial hospitalization or intensive outpatient would fit; or a different treatment approach would be a better match for you. You find the group setting increases your anxiety and emotional avoidance or dissociation?

As you said, suicide hurts others, it's a painful grief, and still it's an outcome and a choice. And while you're here not choosing to die, perhaps a different team or treatment will eventually click. Do you make art or journal?",TranZeitgeist,i2asxt
1,"I feel you. I'm in a extremely bad place right now, things and situations are eating me alive from inside out, I can't control my horrible thoughts and paranoia, it's hurting a lot and it feels like I'm broken and empty and never going to recover. I know I've been there before and recover but every time this comes back it seems impossible and hurt even more, I don't want to live in this cycle. I can't eat properly, I can't think, I can't do things that I like, and don't know how much time it's gonna take. 
The only reason I don't kill myself right now is because my family will not ever recover, I don't even consider the possible happy and joyful things I could live if I didn't kill myself.
So, I feel you, that's all fucked up, it's too much for a person to endure, wish I could take this from me and from you.
If you wanna reach, we could talk everyday, know that you're not alone in this hurtful situation.
Sending love from here.",lun44tic,i2asxt
2,"Fucking all of this shit right here. 

I hear you. I see you. You are valid. Your thoughts are valid. 

I offer no advice but damn, wish I could hug you right now. Lots lots lots lots lots lots of love sent your way.",Dirtyfeet4peace,i2asxt
3,"Hi, Thank you for your thoughtful reply. 

I think my psychiatrist thinks I'm doing well compared to how I am when I'm admitted as an inpatient. I'm not sure that's a very fair benchmark though. I feel like she thinks my current level of suffering is acceptable because it's presenting as an improvement on where I was before. But it's always going up and down and honestly, even with the few moments where my mood is at its best, it's still not worth the remaining 99% of the time which seems to range from extremely difficult to absolutely unbearable.

I wasn't able to leave the house, but now I can sometimes with immense distress and difficulty. I'm still having crazy mood swings that I can barely manage. Just because I'm not aggressively trying to kill myself all the time and dont require constant surveillance doesn't mean I'm doing better enough to be left without help. She's refusing to prescribe any more medications because of the bad reactions I've had but honestly I would try anything at this point, even more bad drug reactions if it meant that this was not the level of normal I would be settling with for the rest of my life. I just feel like as long as I'm not immediately going to kill myself, that seems to be good enough, which seems cruel and disappointing. As things are, I don't know how much longer I can survive like this. 

I cycle through these suicidal loops so often that when I come out, I know I didn't really want to die, I just wanted to know that there was a possibility of a way out. This hope is difficult to hold on to when you're constantly told to just go to therapy when it's clearly not addressing your current level of distress at all.",sarahthehumanperson,i2asxt
4,"Hi there, 
I don't want to say the cliched line 'I'm sorry you're going through that' which seems to be the standard automated response to someone sharing their pain, because it never makes me feel any better. I'll just say thank you for validating my experience and sharing yours. Sometimes things just suck and there's not a lot we can do about it. We don't need to be going through the exact same thing but just being able to be honest about how terrible things are and meeting in the middle through our mutual suffering is enough. I don't want to minimise how unique your situation is, but I will say that I definitely share a sense that I'm living purely out of obligation to my family and also that it feels pretty much impossible for me to feel any positive emotions, enjoy anything or relax completely without self-judgment, fear or paranoia setting in. I'm very inconsistent because of my moods (and I avoid interaction if I'm acutely anxious, depressed or angry), but would be happy to chat to someone with shared experience. Most people feel really overwhelmed by the weight of all this stuff.",sarahthehumanperson,i2asxt
5,"Hi there, thank you for your reply, validation and empathy. ditto.",sarahthehumanperson,i2asxt
6,"thank you so much for your kind words. yeah, we definitely don't need to be facing the exact sames things to validate the struggles and feelings of others. it's 'comforting' in a certain way to know that you're not alone at all and is not the only human ever to experience this kind of pain, it's too much to handle.
hope you feel better in the next days <3",lun44tic,i2asxt
0,"There is good new research that is showing there is proof for genetic causes. Often misdiagnosed in relation to childhood trauma, but seems like there is something genetic in us. Seriously though the experience of growing up trans in a Christian family whether you realized or not, is traumatic enough!",,gi1w9f
1,"That was a lot to read.

Stay sober. Get DBT books and continue your therapy alone if you can’t attend sessions. Life will continue to progress if you prioritise your health.

You grew up in a strict household/lifestyle where you couldn’t be your true gender. Case closed. There’s your trauma. You don’t have to be molested or beaten to develop BPD. 

Focus on the now and continuing to be well.",pippopipperton,gi1w9f
2,I read this whole thing and just now realized your username lmao! I totally relate to your story regarding the drug use!!!! I just recently got diagnosed with bpd. I’m so confused and scared of what lies ahead but hopefully things will turn out for the both of us! Good luck to you friend 😁,thefty6,gi1w9f
3,"Idk if you'll see this cus this post is old but hopefully you do. Thank you so much for sharing, I feel a lot less alone from reading your life story. It's crazy how similar you are to me, minus the Christian background and not being accepted by your parents. I'm a lesbian but my parents told me before I ever even knew what being gay was that I would be accepted and my parents had no religious affiliations. But a lot of what you described growing up and how your felt is how I felt. I haven't had any drug problems or weight problems but I think it's mostly because my mom and all her brothers had drug addictions so I've always been really careful with that. But I have put myself in debt over $20,000 twice with my shopping addiction. I've also been asked a lot if I've ever been sexually abused but don't have any memory of anything. I'm sure I have BPD but I haven't been diagnosed. I've been misdiagnosed bi polar also but always knew that was wrong because my mood swings are caused by outer circumstances not chemical imbalance and because my sister is bi polar so I've seen manic episodes and I don't have those. My new therapist doesn't believe in diagnosis so I don't have any diagnosis she's just working on each thing I want to work on one at a time. Idk if that's going to be effective though or if you need a diagnosis to actually make progress with this? Any ways it's crazy how similar I felt like we are from reading your life story so thank you so much for making me feel less alone and crazy❤️",,gi1w9f
4,"thank you for reading and taking the time to reply, I appreciate it 
I suspected as much because B always reminds me that being trans in itself is pretty traumatic. I've recently after a not fun Ecstasy binge that I'm done with that shit. Do you have any DBT books you'd recommend?",dickfag69420,gi1w9f
5,"best of luck to you too dude, lmao I couldn't think of a name and it was my boyfriend's old Poptropica account name and it wasn't taken so 🤷🏻‍♂️😂",dickfag69420,gi1w9f
0,All the time. Just learn to recognize the patterns and get therapy. Its a process but eventually you get results. Sending good vibes your way. I got ears if you need a chat every now and again.,megalink5,gpuyap
1,"I can relate so much✌🏽 some days I feel I can conquer the world, I wake up the next I can't even bring myself out of bed👎🏽 You've just gotta make the good days count, I find its a blessing and also a curse ⚖️",xlostdreamz_x,gpuyap
2,"Of course! Practically the basis of BPD are the constant shifts between being happy and sad and not much/at all hence the black and white thinking. I just started meditation every day this week. I feel like it is stupid hard but going to keep trying. Try guided meditations for RAIN, mindfulness, and bodyscan. And therapy. DBT is for us. Based off of CBT.",,gpuyap
3,"Lol, that sounds like 10:00-10:15...  Thank goodness for DBT; life can be so much more manageable.",holdonwhileipoop,gpuyap
4,thank you so very much I really appreciate it :),AveryJadexoxo,gpuyap
5,"I feel the same way as you do, My emotions are all over the place and no one understands",,gpuyap
6,"excatly how i feel my babies keep me going and most of the time i am ok :) today my best friend did the nicest thing and wined me so im so greatful to have a really good friend and i have the best support thankfully <3 i love my good days because i feel like im on top of the world and can literally conqure anything bad days are just low and feel sad i try hard not to cry but it happens at least twice or more on bad days,",AveryJadexoxo,gpuyap
7,i talk to my mom and dad  for support i have only ever had one therapist that i ever liked and she left. everyone else it hasnt worked out luckily though my momma and dad is always there to listen and never judges me it helps alot im usually on the phone with mom for a hour then call dad and usually a hour it always helps my moods :),AveryJadexoxo,gpuyap
8,my meds stable me for the most part still have my bad days i dont think ive tried DBT i might look into it though...i was going to a place to get meds i had to switch i could not do therapist there i tried and they just irraitaed me and pretty much felt judged now my pcp doc just prescribes my meds.,AveryJadexoxo,gpuyap
9,No worries! We all have bad days and we all need support. 😄,megalink5,gpuyap
10,"If you're ever stuck for anyone to talk to pm me, I'm all ears when needed 👍🏽",xlostdreamz_x,gpuyap
11,i also suffer from anxiety and social anxiety and PTSD BPD and bipolar so its all hard on me but i do make the best of everyday :),AveryJadexoxo,gpuyap
12, There are DBT workbooks you can do at home on your own.  I don't know why I didn't pick one up sooner!,holdonwhileipoop,gpuyap
13,thank you so much :) means alot,AveryJadexoxo,gpuyap
14,thank you so so much i appriciate it i am going to have to look it up. therapist give me anxiety and nervous i know sounds bad but i have had a couple bad expirences with some :(,AveryJadexoxo,gpuyap
0,"You've got a lot going on so please please be gentle with yourself! This lockdown is adding so much pressure to everyone and I'm in exactly the same position you described. Ive phoned my drs who are now trying new meds to see if they can help calm me down. 

What are you doing currently with your days hun? Are you keeping busy? Idle minds over think and you know how fun that can be 😏😂 but seriously, routine is so helpful. And reach out to your friends and your family during these trying times! You can also pm me at any time. 

Stay safe, I'm sorry for your loss. 💕

Edited for spelling mistakes. Oops.",jaycakes30,fy4y0d
1,"Wow thank you for being so understanding. I didn't expect such a lovely response it's much appreciated.  
I'm trying to keep busy and structured but so hard as out of work. I work in a primary school so a key worker but been off for a couple weeks due to Easter and the rota we are using. 

I'm trying desperately to reach out to my loved ones but it's so hard. My best friend was my literal crutch for everything like this in my life so now without them it's like learning to walk again and I'm lost.

I weaned myself off my meds 2 years ago and have since attempted to OD so they were reluctant to prescribe me but on the other side of DBT and therapy it could be helpful to go back on medication. I'm hoping they will do a phone consultation as I'm trying to shield my father who I'm currently living with.

Thank you so much for your really positive reply x",Daisyloux,fy4y0d
2,"I'm not sure if you are in the UK too but all drs appointments are held over the phone during the current climate. 


Oh you're a key worker! How amazing are you, I definitely don't have the bravery to just carry on, you should be so proud. 💚
This entire situation has played havoc on everyone, my routine has flown way out of the window. Ive slept all afternoon so I'll be up all night! 

Two weeks is not a lot time, you'll still be in a lot of shock and pain, it's important for you to be gentle with yourself at this time and reach out as much as possible when you feel you need to x",jaycakes30,fy4y0d
