,Title,Post Text,Post Creation Time,Content Type,Post Score,Number of Comments,Post Author,Author Flair,ID,URL
44,How to stop being obsessed with my fp,How can I stop relying on my partner for my emotional needs…when he’s not there it feels like the end of the world I’m trying to find hobbies to get into to keep my mind off of him and to distract myself but it’s like the only way I can feel ok is when he’s by me it’s honestly hard for me to do say to say tasks when he’s at work I forget to take my meds I forget to eat until my blood sugar is low even when I set alarms I literally don’t know what to do with myself when hes not home and I don’t want to be like this it’s not healthy I feel like I’m losing touch with who I am as a person and not even enjoying stuff I used to like bc I’m so consumed by trying to make him happy and neglecting myself in the process…I feel like Patrick when SpongeBob asks him what he does all day while he’s at work “I wait for you to come home” bc that’s literally me I will constantly look at the clock to see how much longer it is until he gets home bc I don’t feel like I’m me without him and I want it to stop I want to be able to be a single person and not rely so much on him for everything I think it’s straining our relationship and I’m just unsure of how to make it stop,1690002452.0,False,4,4,bordercup-brat,None,156asds,https://www.reddit.com/r/BPDsupport/comments/156asds/how_to_stop_being_obsessed_with_my_fp/
45,Does it ever get better?,"I, 21NB, felt like I was finally moving forward with my life. I received my diagnosis, I started to work on myself, I had a job that paid well that I somewhat liked, am engaged to the sweetest man I've ever met, and am moving into a new house. Everything was going so well for me.

Yesterday I was fired from my job. I've never been fired before andy work ethic has always been one of my best achievements. Suddenly, the thing I was most proud of doing for myself was taken from me. My fiance is doing his best to convince me that it'll all be okay. I've been sending in job applications and I already had a temporary job in the works that starts on August 12th.

But my feelings of worthlessness has gotten so much worse. Everything feels wrong. I feel like an imposter in my own body. I've been faking it for his sake, as he works really hard to support us and doesn't need the added stress, but it's taking a huge toll on my mental health and physical body. I've completely wrecked my sleep schedule overnight. I've fluctuated between eating nothing and eating everything. I can barely bring myself to even play my comfort game. All I want to do is curl up into a ball and wither away.

I don't know who to turn to. I feel like a burden either way. I'm trapped in this impenetrable sadness and I'm drowning. I have no insurance, so a grippy socks vacation and meds are out of the question. What do I do when my entire world is crashing down around me?",1691031184.0,False,3,3,Intelligent_Froyo403,None,15gs22s,https://www.reddit.com/r/BPDsupport/comments/15gs22s/does_it_ever_get_better/
46,just ranting cause I've got too much to deal with,"

so I took a break from my relationship cause the way my
boyfriend said he wants stuff just proves that it'll only last for a few more months and him being resentful towards me, there's this senior who's been there for me for the last 7-8 months whatever I went through, from my panic attacks to being alone to my worst days during exams, he got extremely upset over me not prioritising myself over someone who clearly doesn't and won't talk to me anymore and I feel like I've lost the only person who genuinely loved and cared about me here without asking for anything in return, he didn't even show up at the library, didn't text me back, and i feel so so alone now, I felt a panic attack building up and called a friend who lectured me about only being in relationships so I don't feel alone and how I need to fix everything that I'm doing wrong and how I'm giving importance to little things in life and relying on others when I clearly shouldn't be doing that and that just made me feel extremely hurt and invalidated my feelings, he said I should break up because broken people ruin relationships and I'd do the same. he said just be grateful that you're in a good med school and have family don't think about the little stuff, you're getting panic attacks because you're not resolving anything in your life and i feel so conflicted and alone 
as with my boyfriend, he said he'd try to be there except for a few hours that he needs to study and I was okay with it, but the thing is we'll be busier when exams approach and when we.have to prepare for post grad so basically it's 3 hours now but it'll get to the point where he'll be like not there for me at all so it just feels like a waste of time energy and efforts to be with him now so I don't even know what to do, i feel like I have no friends here in college so I feel so helpless ",1713810225.0,False,3,3,tteokbokki11,None,1cai4fg,https://www.reddit.com/r/BPDsupport/comments/1cai4fg/just_ranting_cause_ive_got_too_much_to_deal_with/
47,I hate myself so much.,"I just had one of my worst episodes. It’s cost me my marriage. 

I don’t want to get much into it but basically I switched on my husband and “exposed” him on social media. His grandmother has just passed away and all of his family are angry at me. Rightfully so. 

Now he’s leaving me to go be with his family. I don’t blame him, I don’t blame them either. I only blame myself and I can’t forgive myself for hurting so many good people. 

I feel so terrible. I was never filled with so much rage before. I just want to rid of myself so I can’t hurt any more people. I’m sick of living like this",1701854505.0,False,6,3,Careless_Fee_5500,None,18c07wg,https://www.reddit.com/r/BPDsupport/comments/18c07wg/i_hate_myself_so_much/
48,Meditation suppressing hyperactive,"Have any of you all found any meditation techniques or anything? To not be so hyper, sensitive and paranoid?",1697150855.0,False,3,6,kenshinkan08,None,176jwcc,https://www.reddit.com/r/BPDsupport/comments/176jwcc/meditation_suppressing_hyperactive/
49,I don't know what to do anymore,"I am literally going crazy, so confused, don't even know whom to talk to and even what to talk anymore. First is being deep down in debt, not able to start up a life again, not able to study, tried applying to jobs, but nothing. Then this person I like so much, I am there to listen to when they want but if I want them to listen to me, the things I am going through, then it becomes negativity, them not wanting to talk, or having no time cause they are busy. On top of that when they start telling me to do this and do that, its fine but when it's the other way, I am irritating them by repeating the same thing again and again. I miss them so much, its not like we see each other everyday and then I am still asking them to be on phone with me, parents, therapists, helplines, all are so damned useless. I am totally burned out. I cannot do this anymore. Its a hell, I see no way out of. I try my best to keep myself calm, focus on other things but every morning it's waking up heavy hearted. I wish I could go to sleep and never wake up. Yeah, I am overflowing with negativity and anyone I turn around to ask for help has to first criticize me for I wasted 10 years in med school without completing it, wasting my parents money when I could have let go way back in 2016-2017 when my fees was not paid on time and I wasn't allowed to write exams and although I didn't want to do this course, I still hanged on in the hope my parents will make things right at the financial front. So yes, hoping that things will get better was and is still my fault, I do agree I act out impulsively at times. 
RN I have totally lost it, my mind's a mess.",1707202943.0,False,5,1,Winter_Sandwich_9166,None,1ak3vsd,https://www.reddit.com/r/BPDsupport/comments/1ak3vsd/i_dont_know_what_to_do_anymore/
50,Im tired,"Im a devoted muslim , I really love my religion , but besides religion i just like having faith and believe in god , makes me feel something out there truely loves me and understands me and knows my intentions... Yall will understand why im saying this.
Okay so since i was 12 i started contemplating death but i was not $uc^dal like i just wanted to die but did not think of like kms .. ive witnessed my dad beating the shet out of my mom since i was 2 i guess , then when i turned six i had a lovely sister that ive been protecting her from everything literally everything from her witnessing the abuse to do all the things to protect her from any damage because i wont feel okay unless i see her doing better than me in literally everything.
Anyways my parents finally got divorced at 2016 ... But thats when i started SH and attempting to unalive myself , i was 17 i guess , i thought i was diagnosed with depression like how i was diagnosed when i was 15 but at 18 they said no ur borderline 
Fast forward to 2021 i started to engage in impulsive sexual acts from sending pics to like foreplay , im still a virgin tho ... I just idk dont wanna make my mom more disappointed 
The thing is year after year i destruct myself in different ways .. i took shiton of meds , i had ect , and now the drs are getting fed up , the last thing my psychologist said to me is that im the one that made my state this bad haha
My mom is surprised qnd disappointed about my acts and like she became skeptical of every action i take , my sister now is kinda like disappointed as well , that fucking hurts ... My dad well hes in prison so ef that , like all my closed ones now are blaming me for bleeding on them and they just want me to recover in a blink of an eye , like healing from bpd takes more time even years and years than cancer ..
Im extremely $cuidal .... Im so afraid of losing it and just give in to my thoughts..... Im literally crying from fear 
Im in pain , like i work my ass off and trying to provide and being completely independent financially and trying to fake for EVERY FUCKING DAMN PERSON im alright ... Like fuck i got even blamed that guys used me sexually.... I wanna die , i really cant handle it .. abiding my moms rules abiding everyones expectations letting them make me believe what i think ... I just wanna give em a break if im the cancer in their lives .",1715147466.0,False,2,0,lostbear321,None,1cmxagz,https://www.reddit.com/r/BPDsupport/comments/1cmxagz/im_tired/
51,(TW) Bpd x bpd relationship. Advice?,"Hi. I never use reddit and just made this account like 10 mins ago so please excuse if I'm not really doing this right. And sorry for the length I've added a ""TLDR"" at the end (is that how you do it?)
TW Substance abuse, Institutions, Suicidal Ideation, Psychosis, Police Brutality, Eating Disorders (possible other tw I forgot to mention)
I am F20 dating someone with bpd M24. We have known each other a year now (started relationship April 2023 then both didnt talk for 3 months May 2023-Sep 2023 because we both went to rehab in different places) and honestly the way we met kinda.. will raise some red flags for some people but honestly I am not looking for anyone to comment on that aspect. We met in a psych ward in April 2023. Both at super low points. I was in a severe manic/psychotic episode as I also struggle with bipolar disorder. I had stayed up for 4 nights straight and maybe eaten 2 meals during that time. When I got there I weighed under 100 pounds. I was having delusions and convinced myself I had alters. I had no idea that the guy I was with was giving me weed that was laced with benzos. He also had laid hands on me and cheated during the relationship as well. I didnt even find out I tested positive for the benzos until a while later. The psychward I went to was absolutaly disgusting and also didn't tell me I had very abnormal blood levels and forced psych meds down my throat. I don't even think it was the right time to start those meds with my weight and health issues and substances in my body. It was pretty much medical abuse. And it was my second ever time, besides when I was 16, going to a mental hospital. My boyfriend, on the other hand, was considered a ""frequent flyer."" He struggled with lots of substance abuse and suicidal thoughts. I would find out later that he admitted himself this time because he was feeling awful about not having his old FP. When I first saw him, he mentioned having BPD in a group therapy and explaining how it was affecting him. My ears perked up listening to him. He was just a great talker, vulnerable, and accountable for himself. I don't remember a lot from when we first met because of all the different things going on with my brain, but I talked to him by passing him a note (I think the note may have been about the staff at the psych ward.) We both began talking the whole time we were there after that. There was absolutely no activities, the staff treated us like utter garbage, and we both were too restless to just sit around all day. We would talk ""walks"" down the hallways just talking. About everything. There was so much chemistry. He somehow knew how exactly to calm me down. We both knew how to make eachother laugh. He was optimistic, despite how awful different circumstances he had were. Way more optimistic than me. He pointed out a big photo on the wall of a colorful wave and said to pretend we were taking a walk on the beach together.  We also did have one activity room we would go in maybe once out of the whole week that had a piano and some playing cards. I played Heart and Soul as a duet with him. We somehow made that awful situation we were in into something enjoyable. As days passed, he started opening up about how he had a charge of battery on an officer. Basically, he was in the same mental hospital we were in at the time, and he was having an episode. He is a black man with tattoos, so everyone just treated him as if he was dangerous and aggressive before he even got to any point like that. I don't know exactly what happened, but they didn't attempt to deescalate at all. A police officer came over to slam him against the wall and tell him ""you'd be better off dead."" He then spit in the officers direction. And that's it. He didn't hit him or attempt to hit him.  Because of covid, that action he took is considered battery against a police officer, and he was looking at a minimum of 10 years in prison for it. The case is still ongoing as we speak. He's doing a mental health diversion to get the felony off his record, and he's trying to get the case dropped. If the case is dropped, he plans to sue. So basically, everything has been extremely stressful for both of us the entire time we have known each other. But we connect so well. I have never felt so much love and passion for someone. After the mental hospital, we hung out for weeks. We did smoke a lot of weed together and both of us started getting worse mentally. I got sent to psych 2 more times after the first time and then got transferred to residential on the 3rd time. The 3rd time I went was because I went to his house, had severe psychosis, and he had to call the police on me. We weren't really together for quite a few months and I even broke off talking to him because I needed to recover. Then, I reached out again in September. We both relapsed, and I would see him once a week so my use was weekly and his was daily. He lives with his mother who has a medical card and gives him free weed. Now, we both are over 2 weeks sober and plan to stay that way. But the relationship had gotten tense and strained. We don't use escapism for our feelings anymore. We even quit nicotine. We started eating healthy, exercising, and finding ourselves. But it's so hard. I know people say two sick people can't get better together, but I just want to prove them wrong. I want us to be healthy. So many things make us insecure. We are both terrified of losing each other. We both want to get out of our triggering households together. But we both struggle with things. I'm going back to regular talk therapy and he's about to start his therapy too. I even want to do couples therapy. But money is a huge issue. He couldn't work for the entire time we have been together. I've only had a part-time retail job that pays 13 an hour. He's been mad that I'm working way more and seeing him less. I'm trying to explain that I'm doing this for us. It hurts him because he wants to be a caretaker and he wants to be the breadwinner. But realistically, I'm the one who can work rn. And I'm even struggling with that as well because I got in a car accident in an Uber and my back is messed up. The pain is making me constantly irritated. Please. I know a lot of people might say this doesn't seem like it's possible it could work, but I want some optimism. Me and him both want it to work and are willing to do anything we possibly can to make it work. Any advice is so appreciated. Thank you. 

TLDR: My (F20) bf (M24) and I are both struggling with withdrawal and bpd symptoms but really want to make our relationship work. Advice? ",1716359833.0,False,1,1,bpdrelationshiphelp,None,1cxtrlf,https://www.reddit.com/r/BPDsupport/comments/1cxtrlf/tw_bpd_x_bpd_relationship_advice/
52,Just blew up and fucked things up ,"Would go to the normal BPD sub but I was banned for a no good reason. 
So basically I have BPD, ADHD, and some other things. I am not medicated for the ADHD due to my psychiatrist being a piece of shit. Today I looked at my grades (I’m in college) and I’m failing two of my classes because I’m unable to focus and get work done, I procrastinate a lot and I put my boyfriend above everything because he’s my ‘favorite person’. I am so fed up with being misunderstood and not listened to by my psychiatrist and I’m feeling incredibly impulsive, like criminally impulsive if you get what I’m getting at. I am so angry. I blew up on my mom and boyfriend and I’m at work right now so they are not with me but I was spamming them with texts and calls telling them I’m going to do something impulsive or hurt myself. My boyfriend is now mad at me and won’t talk to me because I scared him which is totally reasonable. I know I’m a bad person sometimes. But I am just so angry that they won’t put me on a stimulant to help me. I had anorexia but I’ve been in recovery for a year now and my eating disorder therapist cleared me for a stimulant but my psychiatrist won’t talk to her and she keeps putting me on diff meds like lithium and qelbree. I never took the lithium because I’ve been on too many mood stabilizers and anti psychotics and I don’t wanna turn into a zombie again. I’m not taking the qelbree because it’s not a stimulant. I’ve taken adderal before, and it helped so much. I would only take it on school days though because I like being frenzied when I’m sewing or working on my creative stuff. I don’t know what to do anymore, it feels like my world is crashing down around me and I’m starting to get those minor hallucinations and my mom said that I’m acting deranged right now. Which I think I am because of the things I said. I Can be so mean when i go thru episodes like this and I say some really fucked up shit. I just can’t keep living like this. Does anyone experience the same thing? Have any suggestions? Should I just continue to self medicate? I feel like I’m going crazy. Trust me the texts I sent were very very bad. I feel so guilty now. I want to punish myself. But I’ve made it so far (I used to self harm daily and had many attempts but I’ve been clean from those for a year now) I can’t fall back into those habits. I don’t know what to do. Yes I’m trying to get a new psychiatrist. ",1709686603.0,False,1,4,liddyloushysteria,None,1b7m7cr,https://www.reddit.com/r/BPDsupport/comments/1b7m7cr/just_blew_up_and_fucked_things_up/
53,i'm so fckn sad...,"its like rotting from inside, even lying in bed is immensely hard..I can't stop my tears....just because my bf is in the same room but he doesn't talk to me at all, just gaming all day.
i forgot to take my meds today...
I can't tell /ever/ if it is my bpd or these feelings are real and just...",1584021926.0,False,10,2,napsis,None,fhgu60,https://www.reddit.com/r/BPDsupport/comments/fhgu60/im_so_fckn_sad/
54,I’m the BPD loved one and the one that has to step away,"
In a nutshell, my fiancée and I ended things little less than a month ago. My BPD took over and I became a person neither of us could continue to love. I miss her more than anything, there is and never had been a lack of love in our relationship but there was a good amount of drama and trauma on both ends.   I wish more than anything we could be friends and be in each others lives but I unfortunately broke the trust I was granted and I can’t do that anymore. I have to keep her safe from the dark parts of me and though I’m feeling as if I’m starting to heal I still need to step away. I can’t hurt her or myself anymore.   It’s so hard being so in love with someone, being capable of being nice and civil  and being able to be there for them but knowing that the reason you can’t do these things is because you love each other too much.    


I don’t think you’re on here but if you are…  I’m gonna miss you. I’m gonna hope every day that you’ll reach out but I’m not gonna hate you if you don’t. I won’t even be mad if you don’t.  I just pray you take care of yourself and I pray for your healing.        


If anyone has a similar situation or any success stories or anything like that, please reach out. My heart is shattered right now.",1686849875.0,False,12,3,xoxgossipgurl,None,14a86ms,https://www.reddit.com/r/BPDsupport/comments/14a86ms/im_the_bpd_loved_one_and_the_one_that_has_to_step/
55,New diagnosis,"I have done a bit of research on BPD mostly because I thought my mom had it. Now that my med manager is talking about me having it, it's terrifying me. It makes a lot of sense. In reading these posts, I've never related to a group of people more. I have never felt like I belong to a group more but I'm still scared. I walked into that session believing that I would be fine with whatever mental illness they thought I needed to be diagnosed with but personality disorder? That couldn't be me... Could it? She told me to think about it and talk to my therapist about it but it's triggering so much anxiety that I'm not exactly sure what to do. She did start me on a new med to see if it helps but it's only day one. I joined this group because I know I need support especially from people who might understand me. Help me be ok with this. Help me understand this isn't a pathway to hopelessness. Please share success stories with me for how you've managed it and how you've found hope in your relationships after being diagnosed. It would help a lot.",1594950300.0,False,3,1,Clobo015,None,hsmy8k,https://www.reddit.com/r/BPDsupport/comments/hsmy8k/new_diagnosis/
56,(28F) I’m doing better but I’m very self conscious of the amount of medications it took to get here,"Like the title says, I’m very self conscious of the fact that I have over 9 different medications I take daily. I won’t list them for privacy reasons. I work in a pharmacy and 98% of customers have very few medications and the ones that have a buttload are elderly. I’v come a long way with therapy, support, and of course all these medications. But I’m really stuck in a “thinking loop” that I’m so needy or messed up because of the number of meds I need to take. I’m probably just crazy but I want to know what you guys think. Do medications have much stigma near you? Am I normal? (As normal as any BPD person can be, I guess)",1591322151.0,False,7,8,BlueArctic08,None,gwvdht,https://www.reddit.com/r/BPDsupport/comments/gwvdht/28f_im_doing_better_but_im_very_self_conscious_of/
57,I gained weight after 10+ years of being under weight.,"Just like the title says, I finally gained weight after about 10 years of being under weight.
It happened because one of my doctors gave me medication that makes me have more of an appetite.
It feels like a sudden change, suddenly I'm 62kgs (167cm) 
Suddenly my clothes barely fit, suddenly I need to go shopping, suddenly I can feel the ""fat"" on my back (or whatever its called) 

I look big in the mirror and I feel extremely ugly, I feel uncomfortable in my own skin.
I spent so many years being under weight that I got used to it and now I'm not under weight anymore and I'm kinda freaking out.",1687267949.0,False,3,2,xarsxene,None,14eb9rf,https://www.reddit.com/r/BPDsupport/comments/14eb9rf/i_gained_weight_after_10_years_of_being_under/
