,Comment,Author,Post
1,"You need to tell him, I’m 31nb with a partner of 15 years (I got diagnosed at 18) I  just literally say hey dude I’m not doing well, they don’t have to do anything but they know what’s going on

Also sorry to sound therapist like but you need some self care or  soothing actions to help. Get yourself a sweet treat, do some face masks it’s so dumb but it’ll have time pass and you’ll slowly get there

I know you’ll get a job but I completely understand where you are coming from. It’s scary and awful feeling but you can push through this even if it’s just simply needing some hug time from your partner",princelleuad,15gs22s
2,"Me personally, don't think it ever gets better, but I also think for some people it can get better.. 
I've been diagnosed 20 years ago, I'm 39yo now and had all kinds of therapy and meds and whatnot, but it's only getting worse... so bad even, that I signed up at a ""life ending clinic"", I think I'm really lucky we have those here (I live in the Netherlands) so I know I only have to live with this for max 2 years, that's how long it takes to go through the process of the clinic.
But again, I do think some people with BPD can get better, I'm just not one of them.",Floffje,15gs22s
0,"I am sorry to hear that you have to go through this all. Even though it is an older post - it's an ongoing situation in your life. The friends don't understand BPD currently, they see it from a perspective of pulling up yourself on your bootstrap mentally. They don't see what you are going through internally. They don't understand that there is therapy available for BPD and that you can be in a healthy relationship with professional help. 

And there are people out there who will be supportive to you. Hope things are ok with your relationship.",lostinspace80s,1cai4fg
1,"hey!
yeah I guess things aren't a lot better but I'm isolating from everyone so I don't realise how bad things are, I think I'll just keep spiralling down if I face it, so I've shut everyone out, came back home, and I'm pretending to be in a great place in front of my parents. 
i hope things work out, people have told me that I have a very negative attitude towards everything in my life, especially my BPD so it'll never be easier cause I'm not willing to try and make people want to accept me as i am, because no matter how hard I'm trying I'm not able to apply everything my therapist suggests in my life, he's very understanding towards it and even told me that if I'm even doing 5-10% it's great progress but it feels like no one else understands or even cares to so idek what I'm doing anymore except running away from everything and everyone",tteokbokki11,1cai4fg
2,I understand. I hope it is DBT that will over time help you. And I hope for you that people around you will be more understanding in the future. I wish you strength. ,lostinspace80s,1cai4fg
0,Are you on meds?,split-divide,18c07wg
1,i’m so sorry,little7bean,18c07wg
2,"I know how you feel. I am currently, and am 2 years deep in isolation from my family, all friends and my FP. I gave up, I didn't even feel like I had done enough, or sometimes even anything to warrant the alienation. Don't get me wrong, I've been nasty, and said some nasty things. However, I think my logic and rational is what makes me so easy to cut off. Saying nasty irrational insults is easy to forgive. Fighting with rational critiques of people's character, not so much. 

I've been in a limbo for the past few years, noone is coming to make a menz with me and I don't know how to make up whilst maintaining integrity, so I'm just here, alone, wondering how long it can possibly last on a planet of 7.8bn 😕 at least 2 years apparently.",Amazing_Ad4571,18c07wg
0,"I have been practicing meditation for some years now, and yes it has helped with the things you describe. 

I practice in the sōtō zen tradition of Japanese Buddhism, mainly following Dōgen Zenji's instruction to just sit, and also incorporating interpretations of Dōgen's type of meditation from modern commentators, mainly from Uchiyama Kōshō and Okumura Shohaku. From the former I've learnt to open the hand of thought and the latter that zen  (i.e., meditation) is good for nothing.

Hope this helps somewhat. If you want to know more ask away!🙏",Hour_Tomatillo8730,176jwcc
1,I meditate daily with some app and it helps me calm down and be less restless (side effect of the meds),AnnyFoxy,176jwcc
2,Do you think the meditation where you try to think of nothing is better or to focus on something,kenshinkan08,176jwcc
3,Wut,RetroRedhead83,176jwcc
4,"I think that in order to focus on something you first have to clear the clutter from the mind. So for starters, I think it's better to try to think of nothing.

That said, these two approaches can be practiced concurrently. For example, one of the most used introduction to meditation is to focus on your breath as it naturally comes and when your mind wanderd, then gently return tour focus to breathing. But this in fact clears the mind. In the beginning of my practice, I found this to be a good approach and still do. 

Just be gentle. Thoughts will come, it is difficult to think of nothing. When they come, just let them. Equally, when they come, let them go too.",Hour_Tomatillo8730,176jwcc
5,"What I said. 

Meditation is (in principle) simple: You just have to sit. 

Normally, we have trouble to be still. We grasp onto thoughts that come; into ideas avout what we should be doing (be it while meditating or in our lives in general); what will come next, what happened yesterday etc. Thus, we have open the proverbial ""hand of thought"" that grasps onto these things, fo let them go. This will enable these things to beas they are in themselves, not as the images we try to make them into.

Saying that zazen, or meditation, is good for nothing is a warning. Ultimately, meditation is not done for some goal but for its own sake. Paradoxically, only then can meditation be benificial. 

Hopefully my answer clears some perplexities.",Hour_Tomatillo8730,176jwcc
0,Hey message me I need someone to talk to as well.,Beneti901,1ak3vsd
0,"don't drink, at all, ever again, oh that's my thing, yea stay sober",Technical_Beach8850,1cxtrlf
0,Make sure things are okay with mama,underthewetstars,1b7m7cr
1,Listen to your doctor and take your meds. Please remember you are hurting those that love you the most.,Ok-Dinner7052,1b7m7cr
2,"I have. She’s used to this (not an excuse) but I apologized and we made up. I think the worst thing about this is that I felt so shitty yesterday and it was up down, up down, up down, with my moods and now today I feel great. I def had an episode. They don’t happen as much anymore but when it does it’s really bad.",liddyloushysteria,1b7m7cr
3,I know and that’s what makes me feel so guilty.,liddyloushysteria,1b7m7cr
0,"Take a deep breath. Ask your bf for a hug and to spend a little quality time with you. It might just be that his man-brain is engaged and doesn’t realise you are feeling this way. If he comes off his game, hopefully that will tell you that its just ur emotions getting the better of you. 

I’m proud of you for opening up on here. Now the next step is to do it with your partner. Its so hard for those without bpd to know how much of an emotional rollercoaster life is. I’m here if you ever want to talk :)",UnbuckledCrayon,fhgu60
1,"thank you so much for your words, i will try my best :)",napsis,fhgu60
0,"The best thing you can do is work on yourself. You can recover from this and become the best verison of yourself so that you never have to go through this again. I would say, as much as you love someone, give yourself that much more love while you heal and develop. Loving, accepting and forgiving yourself is an integral part of moving on so you can be a worthy partner again someday. Good luck and I believe in you.",raincanyon,14a86ms
1,i'm going through the same but she just left me. i feel so lost and just keeping a little hope she'll come back is keeping me sane,ackhein,14a86ms
2,"100%

Therapy.  

Work through the ""ism""s.

Check if meds are a good choice.",Abrakem,14a86ms
0,"I was diagnosed with BPD about 7 years back when I hit rock bottom. Lost my relationship, abused substances, dropped out of college, and took park in generally morally dubious behavior. I didn't want to live anymore. Every day I watched myself be self-destructive while I felt helpless to stop it. I knew something had to change. 

I spent the next 2 years in and out of out-patient facilities, and what helped me the most was mood-stabilizers to combat the highs and lows, and Dialectical Behavior Therapy to change the way I approached my interpersonal relationships. You've gotta stick with the treatment regiment, and be honest with yourself and your doctors but it *will* get better. Don't get bogged down by this highly stigmatized condition. I'm now in a happy, healthy relationship with a partner who supports me. I am open about my diagnosis with my partner but I would urge you to exercise caution and only share your diagnosis with those you trust most.",I_Aint_No_Lawyer,hsmy8k
0,"In my perspective, I'm just happy you found a combo that works for you! I've tried many different ones and it took 10 years to find a combo that worked for me. If it makes you better, that's all that matters, imo.",Alcoholic-Pizza,gwvdht
1,It is no different than somebody who is physically sick and needs medication. Physical health and mental health are the same thing. That's the stigma we have to fight for to get rid of. :),,gwvdht
2,"(28F)I think I'm quite lucky to be surrounded by a community that (generally) supports mental health recovery and advocacy. There are always going to be people who judge anyone who takes 'a lot' of medication, regardless of whether it's for physical or mental aid. I used to be incredibly self conscious about sharing the fact that I take medication for my mental health, but the more I've spoken to people, the more I see theres a LOT of people who:
1. Dont carry judgement for people seeking medical help for a medical issue
2. Know someone close to them who is going through something similar
3. Feel more comfortable talking about their own issues having heard me share mine.

I hope this makes sense and helps at all 💜",smebsk,gwvdht
3,"I am so proud of you for the improvement you’ve achieved.

I have a friend who would take photos when her cocktail was changed — she had to put all the pills in a big soup spoon in order to take them efficiently, there were so many. She did ECT, she did EMDR, she did therapy with 24 hour access that she fully utilized. She slept for 36 hours at a time. She took meds that almost paralyzed her. But she did not improve.

I take four meds. I do well. I am extremely lucky. But so are you, regardless of how many meds it is that helps it to happen. Too many people live their entire lives searching desperately for relief and never feel its embrace. You should be proud that you did what was necessary to help yourself.

Imagine being someone out here *avoiding* things that could help them.",pennycenturie,gwvdht
4,"I'm on 8 different meds, 18 total pills a day (including supplements), and 9 at night. I hate it too.

But, I also just emerged from a very dark place thanks to the new inclusion of Pristiq. I can function again. I can be a better dad and husband. My motivation has come back.

Every time i get self conscious, I think about what I've been through, and how essential a piece of the puzzle meds are.",Batmans_not_Batmen,gwvdht
5,"Consider how hard BPD is to treat effectively: the fact that you found a drug combo that helps is a **big damned deal**.  People who take zero pills are not ""better than"" people who take 20. 

If you had pancreatitis, you'd take pancreatic enzymes with each meal to make up for what you can't make for yourself. If you had depression, you'd take anti-depressants to replace missing serotonin.  If you have anemia, you take iron to make up for that lack.  The fact that you need 9 meds to get your unusual brain under control isn't broken: it's proof positive that it's manageable.",Alilbitey,gwvdht
6,I feel you! I am happy with my mood stabilizers and smart with my ADHD medication. I feel like without them I'm neither and that some how makes it less real for me? I don't know,superbella012,gwvdht
7,"My very emotionally abusive ex drilled into me that taking/relying on meds is weak and disgraceful. I didn’t realize I was needing to hear someone tell me that “people who take 0 pills are not ‘better than’ people who take 20.” So, thank you <3",BlueArctic08,gwvdht
0,And this is why I would never allow any doctor to put me on meds that have weight gain as a side effect.,AffectionateMistake7,14eb9rf
1,"Hi! It's important to remember that we struggle with self image, so it's normal that if you were under weight and are now in a more healthy weight (even if you don't feel like it) you feel uncomfortable, ugly or bad in your own skin. It's important for you to remember that is normal after a big chance to feel anxiety. Try to talk to your doctor so he/her about this discomfort you are feeling. I also had a similar experience and know even tho I'm overweight cause of medication and other factors, I try not to blame myself, to put my mental health as a priority and to always be sincere with my therapist so we can work about that insecurities. Weight is just a number, believe me, you are much more than that 💕",,14eb9rf
0,"I don't know if this helps. Everyone is different. But for me, it wasn't about finding the one so much as finding someone I really liked and building a relationship with them. I have BPD and I still have breakdowns all the time, and sometimes when I have depressive episodes it feels like j can't feel love. But what I will feel is a lack of hate. When I hate the whole world, my so is the only one I don't hate. 

I think it's a good idea for him to talk to a therapist, but I'm wondering if couples therapy could also be a viable option. A couple's therapist doesnt try to get two people back together, but rather their focus is on the best outcome for both people, whether the two people stay together or break up. It sounds like you're both very kind to each other, so you have a good base to start out with. If your husband feels a bit unfulfilled right now, maybe you can also try taking a love language test to see that boh of you are getting your preferred version of affection. 

I wish you well. I hope this helps. Hang in there!",Cobalt-Royal,hkgk64
0,"she’s clearly a germaphobe, you’re allowed to be annoyed at her behavior. find an NVC way to bring this up if you wish to address it. eg. “i am upset that you keep micromanaging my hygiene. i feel like i’m being personally singled out due to my health condition and would appreciate if you would stop” if she doesn’t leave you alone that’s on her for being rude and ignorant",jes_sthemess,17zw64t
0,"This is how I have learned to approach these situations:

Have you ever heard of.....?

I was wondering if I could bounce something off of you...?

I came across something online and was wondering if I could get your thoughts?

If they aren't receptive you can always switch doctors. I've to had to change GP because one was unwilling to take my concerns seriously and it ended up being something serious.",unbrokenSGCA,hmlge2
1,Did you get an answer to the quiet bpd? Hope it went well if so,Only_NIN,hmlge2
2,Thankyou so much I've been stressing for the last week about it,bluehairedmommyof1,hmlge2
3,"They couldnt confirm that I had it but they did say that steps that I'm taking ( I found a workbook online for dialectical behavior therapy )will help with the things I have been diagnosed with ( depression ,anxeity, ptsd)",bluehairedmommyof1,hmlge2
0,"I don't have BPD (but do have some Cluster B attributes) but am dealing with someone with BPD who see's me as their FP. If you don't want to lose your FP, please do all that you can to give him some breathing room.  I recently set some boundaries about not wanting to chat as much and brought up the issue of one-sided conversations, which led to a major blowout and threats of blocking. I recently came close to taking up their offer to cut ties forever only to be roped back in. I'm telling you, this is very exhausting and the more this cycle continues, the more I personally feel like a worthless person who must bend to her will and live up to her distorted perception of me. I'm often second guessing how I act and feel like I have to be extra cautious, lest I step on another landmine. I often wonder if it's worth all the sacrifice and emotional turmoil.

Does your FP know about your BPD? I've put up with all this so far because I empathize with how tough it is to have this disorder and don't want to be one of numerous people who've abandoned her or like the many who've abandoned me. If you truly love your FP and don't want to drive him away, you absolutely need to be willing to see things from his perspective and understand that he can't be there for you all the time and must be willing to compromise.  I wish my friend w/ BPD would be more open to having forthcoming discussions about our friendship. Although she's willing to talk about the many conflicts she has with other people at great lengths and detail, she fears discussion of conflict between us and would rather be super passive aggressive or use the nuclear option of threats of cutting ties forever.  Try to be as open as you can with him and allow him to be open with you without blowing up. Set firm boundaries with each other that allow both of you to see eye-to-eye and respect each other. I know that's much easier said than done, but try to always keep in mind how your FP must feel during the blowups and how it could cause him distance himself form you. He must also be willing to also understand where you are coming from and cut you a degree of slack if you cut some slack for him.   


Oh, and look up love languages if you haven't already. People show their love in different ways. Just because he doesn't express it the way you do, doesn't necessarily mean he love you any less. Observe how he shows his love for you in other ways that may be different from your own. Anyhow, I sincerely wish you the best!",escapadablur,i65hub
0,"You're not a bad boyfriend or terrible person for feeling jealousy during this situation! I think anyone would tbh.
How long were your bf and his ex together for? Does his ex openly have a crush on him or are you assuming it based on how the ex behaves?",SevenInHeaven,gf5gk8
1,"thank you for saying that!

they were together for 3 months only before he figured out he likes me. and no, my bf said his ex isn\`t over him at all and doesn\`t hide it.",lasdehnennnheart,gf5gk8
2,"Gather your thoughts and tell your boyfriend how uncomfortable it makes you to hear him talk about his ex and how they have feelings for him. The ex isn't respecting your relationships boundaries and your bf shouldn't be ok with that, especially because he knows how terrible it makes you feel.

I don't wanna tell you to tell your bf to get rid of his best friend, but if they're still not over him after 8 months then that doesn't seem like a healthy friendship either. It sounds very uncomfortable for everyone involved.",SevenInHeaven,gf5gk8
3,"we had a talk and he said he won\`t mention his ex now.

even though it makes me feel bad, i hope things will get better now..

thanks for your support!!",lasdehnennnheart,gf5gk8
4,I'm glad!! I'm sure it will :),SevenInHeaven,gf5gk8
0,I think what this has to do with BPD is that I am convinced I have to control my moods into order to accomplish tasks. People say you have to do things even if you don't feel like it but that feels really impossible. My ex said she could not fathom the way I thought about things and that you really just have to force yourself to do shit until you feel better. Instead of trying to feel better to do things. To me that sounds like a fast track to a total meltdown or anger explosion. I just wish my moods had less control over everything in my life.,oisin_berry,um6ynj
0,"Perhaps you are thinking of the worst case scenario when you meet new friends.
 When you say, ""he has other friends, clearly you are not enough, so just ghost him and isolate”, you are assuming he will reject you once he gets to know you. Perhaps he will. Perhaps he won't.
What is the best case scenario? 
He is completely interested in you only and wants to only spend time with you every second of the day but he has these pesky other people who talk to him and it's hard to keep them away. He even started using bug spray on them. He has different fly swatters that are color coded for each friend and he slaps them with those when he can't find the spray. 

You see, that's quite silly. But isn't your  worse case scenario too much? I think so.

 The most likely scenario is he has known that friend for years and talks to them often. 

So give it a try and maybe you'll have a good friend to hang out with on the weekends.",EurekaVonFritz,x7mvqe
0,"I think your psychiatrist isn't a right fit, and he disregarded the diagnosis without any reference to the 9 criteria of the DSM-5.

You might have BPD and should see another psychiatrist without those biases and religious views, this is not normal

Your therapist sounds great though!",Anarchaboo,16ewfgp
0,"I don't know what the meds mistake could do, but feeling a drop in mood overall makes sense. One thing about BPD is a predisposition to emotional vulnerability and a difficult time at regulating once stress has made you feel overwhelmed. So it makes sense that even for a few days you've been noticing low energy and mood. (I would definitely encourage you to eat, get water and morning sun, and rest, those can help reset). Maybe you'd like to read a bit about BPD here - https://lisacdeluca.com/2013/05/06/marsha-linehans-biosocial-theory-of-the-causes-of-borderline-personality-disorder/",TranZeitgeist,gg7li7
0,"Ypu.dont have to sign on for this. What are his short term plans 

Tge ficus needs to cone off him and onto you. If your mental healtn I'd bad you need treatment. Go to self helo groups they are online. Immerse yourself un getting better. 
If you sre depresses try medication 

Set ip.a plan to maje your mental health.better. 
Detach from him. 

He doesn't sound like he has a clear path 
You neec one of your own",Equivalent_Section13,1b6i730
1,oh no this sounds very hard,,1b6i730
2,"You’re young and sounds like you have a good head on your shoulders, work hard to improve your mental health and get a job or whatever the answers are and don’t give up. Sorry if that’s not very specific but just commit to yourself to do whatever you have to you, no matter how hard it is rn, and you will make it and things will get better. ❤️ 
also finding a meet up group within one of your interests would be a good way to socialize. Expanding your individual life will probably help relieve some pressure on you and your relationship stress, it’s easy to get so hyper focused when it’s your whole world but the world is big and it’s good to get out in it.",__Keeys,1b6i730
3,"You don't have anything to be sorry for. BPD can be all-encompassing and rule every moment in your life. I know from personal experience. Like you I have no friends, nothing outside of my small bubble. But that is a choice of mine. It sounds like you are contemplating every side of the situation. Don't doubt that deep down you know what is right for you! Believe in you, your strength, and your capabilities. You will go far!",The_Facecloth_Lady,1b6i730
4,Why was a 22 year old with a 16 year old,bi_or_die,1b6i730
5,"i just want to say i’m 19f with bpd so we’re around the same age a few months ago i went through like a “break up” with my very toxic ex best friend who was also my fp during our friendship i lost all my childhood friendships because i pushed them away and became toxic myself so after me and my best friend stopped talking i didn’t have anyone except my family either i genuinely thought i was going to die and not make it through but i did it!,and on my own everyday i woke up and chose to live for myself which is what you have to do you’re so young and you seem so smart you deserve so much matter then what you have now. I know it’s the hardest thing in the world to not have your comfort person or fp but you can live without him if anything you can live better without him you just can’t see it yet with bpd rose coloured glasses go back to your family lean on them get better for yourself go out into the world for yourself and you’ll find the right people for you i promise i doesn’t seem like it can happen but it will i’d bet every last dollar i have on it you seem like a smart young woman and you deserve to live your young life not carry the stress of a 26 year old man",Evening_Station_429,1b6i730
6,"I think your right, he is all over the place and right now I need stability. It's difficult and scary though :(",Naive-Foot4459,1b6i730
7,It is :(,Naive-Foot4459,1b6i730
8,"Thankyou, I think I knew what the right thing to do was but it's always easier when other people support you throughout your decisions. As scary and painful as it might be this is what I need rn and I have worked my ass of to get to this point, it would be senseless to let myself get really ill again. I'm just sorry it has to be this way.. It could have worked out, I just don't understand why he had to go and f##k it all up. Anyway thanks for your advice I really appreciate it❤️❤️",Naive-Foot4459,1b6i730
