,Title,Post Text,Post Creation Time,Content Type,Post Score,Number of Comments,Post Author,Author Flair,ID,URL
23,having trouble differentiating mania from euphoria,"hi! so basically i am a 22yo nonbinary person (they/he) and i started testosterone about 4 months ago. I have been feeling super gender euphoric because of the changes happening with my hair, voice, bottom growth, and then just my mood in general has elevated. My problem is i also have been previously diagnosed with bipolar and tried all the meds for it, but my psychiatrist and i kinda came to the conclusion i have more bpd symptoms than bipolar. At the time, i also hadn’t had a manic or extreme depressive episode in over two years. Since starting T, tho, I’ve been feeling so good about myself and so I’ve been having a hard time figuring out if it’s because I’m manic or because I’m just starting to feel more comfortable in my body?? 

tldr: has anyone else who is diagnosed bipolar and/or bpd and also on T seen their mania acting up bc of the testosterone? ",1713689496.0,False,0,1,waterfallstar,None,1c9d9um,https://www.reddit.com/r/BPDsupport/comments/1c9d9um/having_trouble_differentiating_mania_from_euphoria/
24,"Those who have diagnosed BPD, Do You Struggle with Other Disorders Too? ","I’m 26f, here is my full diagnosis list 😅 

Borderline Personality Disorder; 
Obsessive Compulsive Disorder;
PTSD; 
Body dysmorphia;
ADHD.

Treating the ADHD with medication, helped alleviate some of the other symptoms from the other stuff, which is honestly a relief. Especially the BPD symptoms that left me scrambling for a dopamine hit just to FEEL something other than dead inside all of the time. I’ve been feeling so much more positive minded since starting meds for ADHD. I’m scared it won’t last. I don’t want to go back to the spiral of bad behavior and out bursts and craving alcohol and suicidal ideations. Just all the stuff. It’s not perfect all of the time, but this last month I’ve been medicated, I’ve just felt a bit of relief from it all and it’s been nice. 

Just curious if anyone else with BPD has experienced this scenario of treating a different disorder and feeling relief from your BPD. ",1710478841.0,False,7,2,Rowdylilred, M O D ,1bf64ze,https://www.reddit.com/r/BPDsupport/comments/1bf64ze/those_who_have_diagnosed_bpd_do_you_struggle_with/
25,"When you split on someone, is the tone always angry? Is splitting ever done in a measured tone but nonetheless very black and white?","My partner with BPD recently broke up with me out of the blue, days after saying she wants to be with me forever. The breakup occured when she was in the middle of a very stressful week at work, and I was too busy writting the final med school exams to support her.

When ending things, she painted an incredibly one-sided and distored picture of the relationship where I never made efforts or sacrifices. The whole thing was very black and white. While I was imperfect, she left out very key information and believed a narrative that i sincerely believe to be untrue. She also made some mean comments about my character (""you are not the man i need you to be"" ,""you would be bad to raise kids with"").

Ordinarily I would recognize this as splitting, but she was not yelling at me (though she was notably cold and raised her voice once or twice). She even cried and said that I remain her soulmate. Nonetheless, she was definitively ""done"" with me.

Can splitting present itself in such a way without anger or vitriol? What does it look like for others?",1714692934.0,False,7,18,Afraid_Knowledge4983,None,1ciu9kt,https://www.reddit.com/r/BPDsupport/comments/1ciu9kt/when_you_split_on_someone_is_the_tone_always/
26,I cant stop myself ,"How do i stop blocking and unblocked and unfriend and friend request people on socials practically daily and multiple times in a day? Also  my friends /fam are getting annoyes of me quick because i say i delete socials and don't want kids and then next day or two change my mind. It very pathetic to point i hate myself. Sometimes i don't think people understand that i am more annoyed of my indecisiveness and impulsive then anyone will ever know. I keep apologizing for my behavior and it only does so much.  I wonder if going up on my meds will help because therapy doesn't do much for me with this negative habbits. Eveyone thinks i am crazy and i obsessive and i also do not feel comfortable to tell the world about my diagosis.  I feel like i am losing it. Everyone says once i get a job i will be distracted, but i know these habbit are always there even if they r a bit lessoned. I hope this make sense. F 28",1708107465.0,False,6,4,Significant_Access_1,None,1asfix4,https://www.reddit.com/r/BPDsupport/comments/1asfix4/i_cant_stop_myself/
27,I’m new here,"My most recent psych doctor suggested I have BPD, and it honestly lines up with my symptoms. I’m having a hard time wrapping my head around it. I’ve always had the extreme mood changes, and the thing where if someone does something “against” me, I will think of them like an enemy, if that makes sense. I had pretty significant trauma in my childhood and I’ve heard that’s common for this diagnosis. I’m also in recovery from alcoholism and an eating disorder. One good thing about it, is that I switched to DBT in therapy which I like, and have tried new meds like a mood stabilizer in addition to an SSRI, which never worked alone. I’m not as suicidal, like I was for awhile. So there’s progress. I just, I have this overlaying feeling that to my core, I am damaged/broken/unworthy. Like there is something wrong with me. It gets worse when I have to interact with other people, and I feel so awkward and overthink everything. But when I don’t interact with other people, I isolate and the obsessive thoughts of unworthiness gets worse. I’m ranting, I know. I’ve never posted here or really talked to anyone about this besides my therapist. I guess I’m looking for support? Tools? Connection? This shits hard. Sending love ",1716352643.0,False,2,1,nicolem411,None,1cxrx0s,https://www.reddit.com/r/BPDsupport/comments/1cxrx0s/im_new_here/
28,I feel like a ghost,"I have been depressed for the past three months, and my meds finally kicked in so I don't think I'm depressed anymore, but a deep sense of boredom and emptiness is still there, even worse than it was when I was in crisis. I feel half dead: I've been social, going out every day this past week, both with old friends and new qcquaintances, and it doesn't change anything. It's like no one can touch or reach me, and when I say ""I'm bored"" people don't understand how bad it really is, and kinda play it off. I do not know how to make anyone understand, my mind is numb, I might as well be dead already but I am still breathing? I tried getting high and it helps foe a while, not a long term solution though. I met with my prescriber and she said there is no med to treat this, which is what I expected because I would have heard about it if there was. The best she could give me was, 'you're fairly young, (31) and bpd usually eases with age' like k thanks. The worse part for me is the total disconnection, like people hear me and see me but...I feel nothing. I have felt this in the past but never to this degree, and when I did I jumped into relationships to feel less alone. I am not sure what I want out of posting this, i'm just screaming into the void to see if I can feel any sense of connection with anyone reading this.",1695252240.0,False,2,1,fetchthequeen,None,16nzxrc,https://www.reddit.com/r/BPDsupport/comments/16nzxrc/i_feel_like_a_ghost/
29,How do you deal with splitting?,"I just Had very bad episode of splitting. I handled it better, because I used to harm myself but still I can stop crying today. I feel guilty and angry I can,'t cope with my new job and being in long distance relationship. I also hate my body because I gained bunch of weight on meds and then lost it so I have loose skin and I just don't feel beautiful and I am mourning my old skinny body from times when I was a teen. How do you deal with this, how do you stay productive enjoy your life and hobbies? How do you stop feel like a monster that sucks everything from those close to you?",1696798840.0,False,2,0,Middle-Hyena-8284,None,1739tay,https://www.reddit.com/r/BPDsupport/comments/1739tay/how_do_you_deal_with_splitting/
30,Losing track of time,"So I’ve been diagnosed since I was 18, I’m 23 now. I recently had an attempt about a month ago, got out of the mental hospital about three weeks ago and let’s just say my life has gotten worse. But it dawned on me today that I’ve been out for almost a month and I have no idea where the time went. I don’t know what I did, what I’ve been doing for the past 3 weeks. I’ve been sober and taking my meds, lexapro and seroquel at night. Is this a symptom? How do I stop it & what is wrong inside my head that I’m losing so much time ??",1694850306.0,False,2,2,PrincessKittyy00,None,16k1gc6,https://www.reddit.com/r/BPDsupport/comments/16k1gc6/losing_track_of_time/
31,my mum died,"about 2 weeks ago I lost my Mum to cancer. we never had the best relationship, she was neglectful in many ways and was incredibly invalidating. when she was alive I found her absolutely insufferable to be around due to her constant judgments and general misery. she had always been this way, but the intense paid meds to cope with her terminal cancer just exacerbated her anger. I hate myself and feel like I never spent enough time with her while she was alive but I only had to leave sometimes to prevent me splitting and blowing up. she told be two weeks before she died that I would have to live with myself because she will be dead as though it was somehow my doing but I can’t get the fact I do have to live with this out of my head. it just makes me feel so sad I’m nauseous. how does one cope with complex grief I hate this feeling so much, I’m only 20 and feel like my life is just spiralling down :(",1700993178.0,False,9,4,Curious-Jicama3475,None,1847k6a,https://www.reddit.com/r/BPDsupport/comments/1847k6a/my_mum_died/
32,Emotional outbursts,"Hi guys, I’m new in here and need help. I have come a long way in healing myself and trying to cope with my BPD. Recently my irritability has gotten worse and worse where I got so upset about my friends dog eating my shoe that I took it out on my friend in the middle of Walmart.. I felt so guilty afterward and felt like I wanted to end everything;  this friend is also my FP. They’ve done so much for me and I just want them to feel happy again but it’s hard to do that while I’m struggling so bad. I feel like I ruin everything and feel so empty. My depression and SH is getting out of hand as well and I’m sharing this with my care team but I bottle it up while I’m not with friends. I’m getting to the point where I don’t want to try anymore and I’m afraid that’ll make me lose my friendships and lose my relationships with my mom again. Some symptoms I’ve been having is isolating, extreme irritability, constant feeling of loneliness, intense emotions, trying to shut people out and taking it out on myself through my ED and other harmful coping mechanisms. My therapist is trying to do child work with me and at this point it’s doing more harm than good for my mental state. If anybody knows any coping skills, meds, or any type of treatment, I’m willing to hear about it. Thank you ",1716134087.0,False,2,1,Avocado_tyrex,None,1cvrfvw,https://www.reddit.com/r/BPDsupport/comments/1cvrfvw/emotional_outbursts/
33,How can i move on,How do i stoped texting my ex? Everytime i message him saying  i will stop bothering him he says it okay. I know it not though.  We broke up last April and i talk to him ever since.  He sometimes replies . I don't even wanna be with him or anyone rly. I am not looking to date. I wonder if i should go back on apps for an distraction? It is not priority.  I feel awful bc he let himself go... Everytime i block his number  i unblock it's.  The cycle is non stop and sometimes i tell him it blocked etc. Idk how i can be with him ever again bc i am an addict to pot. He smokes/industry so i doubt he be okay with my boundaries.  Also he wanted a women who drive and im not 100 percent comfortable with it  as i have seizures not elplosy and on meds for it but still... can someone plz help me ? I am always obsessed with them after breakup but it never been this bad. We together for 3 yeats.f28,1704425558.0,False,4,3,Significant_Access_1,None,18ywuxb,https://www.reddit.com/r/BPDsupport/comments/18ywuxb/how_can_i_move_on/
34,How to stop crying,"I've genuinely done everything. The shame and guilt keeps bubbling up. I'm not just crying every few hours. I'm crying all the time and I can't stop. I can't sleep because I'm crying. I can't go BACK to sleep because I keep crying. I can't enjoy my day, can't talk to my boyfriend, can't be with friends. I'm crying. Realistically, what do I do? How do I stop this? What meds can I take? What drugs can I take? What would make me stop",1676662454.0,False,17,2,moobloom,None,114vffw,https://www.reddit.com/r/BPDsupport/comments/114vffw/how_to_stop_crying/
35,"Follow up - How to stop being abuser TW: SI, SA, ABUSE","Hello. 
Some time ago I posted here about being afraid of parpatuating in cycle of abuse. Since then some things have changed. 

I still feel guilty for my past. I still feel like a bad person and I still feel lost. But at the same time thanks to therapy and meds I was able to break the pattern.

Long story short I was in long distance relationship for past two months. Me and my boyfriend tried to work it out. Unfortunally he wanted to stay in a place where he currently is, because it is better than my country for him. I can't immigrate now because college in my country is free while in the USA where he is I would have to pay. And although I love him and I would immigrate it would be in a time when I finished college and gained more financial stability - I have problems with impulsive spendings - so It was hard for us. We drift Apart and although both of us tried we both weren't happy. Me especially because as a pwBPD I am triggered by abondoment and distance. And the first plan was he would come back to my country in 5 months time when he gets his papers in check. 

So at Sunday we broke up. It wasn't easy decision. I think we both took it very hard. But I am proud to say that I broke the cycle. I would split on him even back in March when we met. I would harras him, I would beg him to comeback even threathend to hurt myself. And just to him, but to my parents and friends as well. I would probably be institiunalized again or at least took to ER. But this time I blocked him. Not because I hate him. I am hurt, sad, deppresed but I don't hate him. I finally see the other side the other person feelings even though my heart is bledding. I see past my hurt feelings and unmet needs. 

So for anyone in similar situation: block your ex. Delete all of the contacts, reminders etc. Go to therapy. Practice mindfullness, meditation, yoga. Focus on other stuff. Do whatever neccesary to not cause harm to you or your ex, especially if they were your FP. Let yourself be angry, hurt, dissapointed. But don't took it onto yourself or the other person. Don't split. It is hard. But therapy and meds help.

If anyone Has the same guilt and shame as me and is afraid that they can't change let this be an example. And also don't beat yourself up if you fucked up. Healing takes a lot of time and work. You won't be perfect, I am not Perfect. But we can heal. We can stop the abuse if we try and hold ourselfs accountable.",1697576538.0,False,5,1,Middle-Hyena-8284,None,17a8mdd,https://www.reddit.com/r/BPDsupport/comments/17a8mdd/follow_up_how_to_stop_being_abuser_tw_si_sa_abuse/
36,Bpd and pregnant ,"Honestly, I feel like I’ve been having a lot more Intense episodes since I’ve been pregnant. Also I am incredibly stressed. I was in rehab for a year and a half basically and got off all my meds , I got  out and of course I was wanting to have sex and slept with a couple of guys being the impulsive fuck I am. Anyways, I went to the er bc I was bleeding, the ultra sound said I was 12 weeks. (Which lines up perfectly with a guy K. he’s had a vesectomy) 
And then I had a drs app 9 days later and he said 15 weeks (which adds up perfectly with p but he pulled out(I know there’s still precum) I was told by a Ob that it would be nearly impossible for me to have kids on my own, so I’m so confused. And p , refuses to believe it’s his and wanted me to have an abortion anyways. A prenatal dna test is 1600.. I can’t afford that and he ain’t paying it. But if he doesn’t sign the birth certificate, then I can’t ask for child support (also messaged him to ask if he was signing it and he ignored me ) this is all a mess. And it doesn’t help half of my family told me to give it up for adoption …. 
",1708283944.0,False,1,0,Zealousideal-Dig9303,None,1au273g,https://www.reddit.com/r/BPDsupport/comments/1au273g/bpd_and_pregnant/
37,flat feelings most of the time,"hi. I've been diagnosed with BPD a long time ago, and it progressed through the years. i've experienced a lot of criteria, and talked to other people with bpd IRL.
i was confused - i asked my friend if she too has disorganised mind, like thoughts might be non linear, shaped as other stuff, basically i have a mess in my head and thoughts only start to make sense when i am telling them, without preparation. she said no. 
I've researched and found out that BPD was morphed with Schizotypal PD some decades ago, they were intertwined, and some people with BPD  might or might not have symptoms of schizotypal. 
i guess my core problem is due to this. i am losing feelings. i still can rage, or argue, or feel hypomaniac, but its all flat. when i am not triggered i feel like i have no emotions at all. i lost ability to feel love, romantic feelings, i just don't feel anything even if the person i try it with is meeting all of my criteria for a cool bf.
the only ""love-like"", limerence, i feel towards my ex, but we parted 3 years ago and now he has a gf and bla bla bla.... but its not a string feeling, it's like auto pilot 


do you have schizotypal pd? do you have symptoms of it? 
do you too, experience this cold hearted state, despite being on meds? 
how do you cope ?",1706837021.0,False,2,0,rodaroller,None,1agrk00,https://www.reddit.com/r/BPDsupport/comments/1agrk00/flat_feelings_most_of_the_time/
38,Hyperventilating,"I feel so upset. I actually have been feeling so upset these past couple of days that I start hyperventilating, crying/laughing involuntarily, and can't stop talking out loud to myself and saying terrible things. 

I have a psychiatrist, I'm on some meds. I'm on a waiting list for therapy. I've done so many DBT worksheets but after all of this, I still am so upset I feel delusional. Or maybe I'm not? I don't want to overshare about my relationship but I just can't tell what's real anymore. I feel so disgusting and like I'm absolutely nothing. I hope something horrible happens to me so I don't have to deal with life anymore.",1677713497.0,False,9,1,moobloom,None,11flx2j,https://www.reddit.com/r/BPDsupport/comments/11flx2j/hyperventilating/
39,"Do you ever feel like no matter what you are broken? TW: Self harm, breaking down, generally deppresive mood","Hello. I know my last post was very uplifting. 
I don't want to demotivated anybody, especially that I am keeping no contact with my ex. 

At the same time I feel do guilty about my past and I lashed out at my mom and my roomate. Which O shouldn't do. My roomate forgive me, but I still feel the guilt. 

I slipped even into self harm again. I feel like a monster that doesn't deserve any good. I even feel like my needs or emotions don't matter. 

Does anybody else feel that way? Does anybody else struggles to forgive yourself no matter how much they improved? If so what do you do with it? 
I don't want to down anybody and I still stand by my last post and I won't contact my ex. But I just need support. I need to feel like I am not alone in battle with BPD. And I need to know what you doing when you feel down like that. I feel so lost. 

I am not giving up, I even gone back to a gym I still take my meds and of course I have apologized to my roomate. She didn't deserved my behaviour. And I am glad she forgive and is still willing to support me. At the same time I feel like K don't deserve it. Like I have to earn it somehow. 

Idk if this makes sense. I am sorry for bringing negativity here.",1698184461.0,False,5,0,Middle-Hyena-8284,None,17fokdi,https://www.reddit.com/r/BPDsupport/comments/17fokdi/do_you_ever_feel_like_no_matter_what_you_are/
40,What jobs do you have?,I've just been diagnosed and understanding why I've struggled in a traditional workplace in the past. What roles of jobs do you have? Which are best for people with bpd?,1699444111.0,False,6,19,EarthQuackShugaSkull,None,17qjwsb,https://www.reddit.com/r/BPDsupport/comments/17qjwsb/what_jobs_do_you_have/
41,My BPD self and my boyfriend ended it...,"Im a heavy person, I know it full well. I was very overprotective and jealous...I just didn't want him to leave me like the previous men but...it all came to an end. Our days went from laughing and playing games to constant toxicity and bickering. He wanted a person I was back in the summer last year when we met but...that person was gone. I was at my peak then, fit, happy, even without meds. Then...my mother died and 3 of my pets in a span of a week. I was...gone. The cheerful me that wanted to be there for everyone just, disappeared. I was a heavy burden on him. I tried overdosing a few weeks ago, failed (sadly). Today we had a huge fight and...its over... i love him. I just couldn't stand the yelling, the fighting. I was too heavy of a burden to myself too. My head hurts, and i have been crying for a past few hours...maybe...I shouldn't have gotten into anything. I know he won't read this but if he does...im sorry Michael for who I am. I wish i could have changed...I wish I could have been a better person. He didn't deserve to bear my burdens. Sorry for long post, had to write it somewhere...",1686871527.0,False,2,2,Angiogio,None,14aguvd,https://www.reddit.com/r/BPDsupport/comments/14aguvd/my_bpd_self_and_my_boyfriend_ended_it/
42,Needing support,"Hello!
This is my first post ever on Reddit. I need support from people who also have BPD. 

I am 22f and I was properly diagnosed with BPD last year although I suspected it for a long time. I always had troubles with impulsivity, deppresion and emotional Control. Last year I fully realize how bad I am even though I was in therapy for almost two years at this time. It started when my boyfriend broke up with me. I Had a relationship before but this was first more long term. We were living together for couple months. 

I am acknowlegding that we had problems on his side, but I was more impulsive abusive and awful, because my mental Health was awful. I just got out from my parents house, was adjusting to new work, new city and was dealing with relative that Had dementia and unfourtunally died at the end of 2021. I am not saying this to demish what I did which included intensive splitting, arguing, trying to keep it through being FwB even though it was hurting us both etc. This land me in group therapy which I couldn't handle, because I really had a hard time hearing critism and taking full accountability for what I did. 

My question is does anybody else deal with a guilt after being abusive partner or is afraid of repeating the pattern? If so does it get easier and can you fully recover from it and be a good partner?

I am in New relationship since March this year and I am just afraid. Especially that It is long distance.. I don't want to hurt anybody else or myself. The guilt is sometimes overwhelming. And yes I am in therapy and on meds which makes me at least able to keep my job for a longer period of time.",1696625932.0,False,1,1,Middle-Hyena-8284,None,171nkeh,https://www.reddit.com/r/BPDsupport/comments/171nkeh/needing_support/
43,I cant tell if im actually just a bad person,"My episodes just keep getting worse, ill shut down and deactivate all my socials and refuse to talk to anyone for days. Or ill start massive arguments over nothing and im not sure how to stop. 

Ive been in therapy for a few years, been on meds and really done my absolute best to keep myself in check but it only seems to get worse with time. I cant hold a job because ill have outbursts at rude customers, dropped out of school because it was an extremely triggering environment, dont have friends because ill randomly get it in my head theyre bad people and ill cut them off. 

I have a partner who loves me, hes so nice to me and does his absolute best to understand but i even have outbursts at him. We’ve been together over a year now and i still feel like he doesn’t actually like me. 

I cant even tell if im actually a bad person or not at this point. Do i have a mental illness i cant control or do i just fucking suck ??? I cant differentiate between me and the bpd. 

I was also exposed to the fucking shit hole of (anti bpd subreddit) today and i cant tell if i always feel like this or if it just triggered me. 

Does anyone else do that ?? Get upset and can’t figure out if the thoughts theyre having have always been there, or if theyre brand new.",1686846193.0,False,6,4,throwaway81828281,None,14a6p2o,https://www.reddit.com/r/BPDsupport/comments/14a6p2o/i_cant_tell_if_im_actually_just_a_bad_person/
