,Comment,Author,Post
0,"Australia is honestly the best place to be when it comes to suffering from BPD and not being able to work. Centrelink is not offered in any countries besides Australia - it may be considered poverty but in hard times I have been fortunate enough to depend on this as income.

I am unsure what DBT is but I’m sorry to hear what you are going through and especially when you feel alone. I hope everything turns out a bit better for you, I find watching motivation videos on YouTube / instragram or looking at quotes really help me to feel better about my entire existence. Maybe give this a go?",Delicious-Visit-4740,1cpxs35
1,"I’m sorry you’re having a tough time. I can relate to a lot of what you just said.

I don’t have much advice other than can you get your hands on the workbook? There’s also DBT cards. Look up distress tolerance skills. I’ve made a distraction bag for when I’m spiraling. It’s got a fidget toy, sour candy, icy hot, a little toy I like, my book, and a stress ball. Good luck. I hope you find the support you need :)",JohnDwyersDanceMoves,1cpxs35
2,https://dialecticalbehaviortherapy.com/ I've been using this site. I find it helpful and free,GaxlaysHopper,1cpxs35
3,"Thank you, I’ve been watching DBT videos. DBT stands for Dialectical Behaviour Therapy. It’s the treatment made by Dr. Marsha Linehan for BPD sufferers. It’s not cheap, and I’ve been told to see if I can get it with my private health insurance. I will ring and see.",TiredSleepyGrumpy,1cpxs35
4,"Thank you. 😊 I will make a bag for myself. And I do have a workbook, but not “the workbook”. I will keep monitoring it until it’s a price I can afford. 😊

I really appreciate the tip. Hope you’re having an amazing day!",TiredSleepyGrumpy,1cpxs35
5,Thank you ☺️,TiredSleepyGrumpy,1cpxs35
6,"I was diagnosed at 16 and when I was 19 was in a inpatient program for longer than the program goes for because I was struggling so badly at the time and I remember the psychologist/ psychiatrist advising that it’s easier to overcome BPD when your younger, so you may not need this treatment but just some determination to better your mental wellbeing by seeking help and genuinely following through with it.

Just my thoughts if you’re worried about your financial situation but I hope it goes well for you if you do end up getting it! I’ll have a look into it",Delicious-Visit-4740,1cpxs35
7,Thank you for sharing. I *wish* I knew I had BPD when I was that age! That was decades ago now.,TiredSleepyGrumpy,1cpxs35
0,"I was diagnosed on paper with Borderline Traits at 14 yrs old, but the psychologist that had done my full psychological evaluation told my caretaker and I that he had no doubt that even at 14 I had the full disorder, but he said he couldnt put a full BPD diagnosis on paper/record until I turned 18, for patients under 18 years old they diagnose it as Borderline Traits. But my psychologist explained BPD and how it forms in terms 14 year old me would understand and I have yet to come across a better way to explain it on my opinion. He put it like this:

There is a childhood trauma, picture that is a splinter in your foot. And the childs environment is not emotionally validating and toxic, so the trauma is never processed through so it just festers and builds and keeps getting worse as time passes. So you get this splinter in your foot right? Trauma, particularly childhood trauma. Well then you dont take care of that blister, dont wash it or cover it or remove it, nothing. And you go walking around everywhere barefoot in dirty, unclean places okay? Emotionally invalidating and toxic environment. Well one day that splinter gets severely infected, swollen and hot and red with infectious puss. He said the splinter is the trauma, and the surrounding sore redness and infection is the BPD that developed. I am in no way saying one way or another as to if she might or might not have anything.  That is for a trained mental health professional to deside. That is the one and only way to have any idea what state her behavioral health is really in. I recommend you talk to her and try to get her to see a psychiatrist, psychologist, or therapist/counselor",FairyDemon,7v4vg2
0,[deleted],,fu914t
1,"BPD is a sadly stigmatized disorder, and it's disappointing that professional bias is a real thing.

If you're struggling with PTSD symptoms like flashbacks and dissociation, EMDR could be a highly effective treatment. One challenge in treating BPD for someone who has post trauma responses is ""staying present"" during treatment; trauma therapy like EMDR usually includes practicing skills specifically to help that.",TranZeitgeist,fu914t
2,"Usually for people with BPD the best course of action is to do DBT and get to a stable place and then do EDMR or other trauma work if its applicable (it sounds like it is). DBT is kinda like crisis management skills so you can tolerate the every day, and once you get that under control it's much easier to work on the less fun stuff. Doing any kind of work with trauma isn't something you want to start if you aren't at a stable place because it's a really difficult process and it can bring up old wounds and make you worse before it makes you better. You want to be able to cope with that before you bring it all up. 

I'm sorry that your therapists are being difficult. It's so frustrating how stigmatized BPD is unfortunatley. I don't know if your diagnosis is already officially on your file, if it's not, it may be prudent to delay mentioning BPD until a few sessions into treatment. Therapists without much  experience often have stereotyped images of a disaster client when they hear borderline. And honestly it may be best to look for a therapist without such views. As much as it sucks to be turned away by therapists, if someone thinks they wont be able to treat you properly, them not treating you is in your best interest.   

If you can, look for a therapist that does DBT because more than likely they will be willing and used to dealing with patients with BPD. A therapist with a trauma background is also ideal, and they usually go hand in hand.",,fu914t
3,I just learned what DBT is from someone else so I will be looking into it but because everyone is developing paranoia here in las vegas therapists are stretched thin,Alluringgaze,fu914t
4,Have you done emdr yourself how does it work also how have you managed BPD?,Alluringgaze,fu914t
5,Well I made a deal with my psychiatrist shes gonna hold off on letting anyone know that I have it because of the stigma with therapists. So I wrote this spam blasted to a bunch of therapists all over the internet as a fuck you. I'll post it up on r/BPD,Alluringgaze,fu914t
6,[deleted],,fu914t
7,"EMDR is like a kind of exposure therapy. You might spend time practicing ways to lower intense stress and anxiety, like deep breathing exercises and physical skills. The focus is to work with someone in a safe space, with a goal of decreasing how distressing it is to be with whatever thoughts are in your head. The treatment helps to stay present and grounded, when sometimes trauma could make us disassociate and anxious.

I would recommend maybe visiting /r/CPTSD, for more discussion about EMDR.",TranZeitgeist,fu914t
8,Whats the work book called I'll check it out,Alluringgaze,fu914t
9,Thank you I will look into it,Alluringgaze,fu914t
10,[deleted],,fu914t
11,[removed],,fu914t
12,"I'm glad you found a resource, and I'm sorry but Reddit is strict about copyright, so I'll have to remove this offer.",TranZeitgeist,fu914t
0,"Imo there are a lot of opinions from people without the knowledge or experience. Be careful where you dig on the internet as there are a lot of people who cast us as 'evil' or 'manipulative' and conflate that with a BPD thing. Since many of us with BPD have experienced abuse and have had to adapt coping skills, some people unintentionally pickup bad behaviors from partners as a coping skill or learn behaviors to survive that may come across as manipulation.  


Also very important to note, stating your needs and asking others to help you be safe and comfortable and to have those needs met is not manipulation.   


My mother and father used to scold me for crying and claim that I was trying to manipulate them to change their minds or behave differently. It's really easy to get conditioned into thinking that asking for what you need is manipulation.",PlaidCladHeroine,gzz4b5
0,"There a lot you mention I feel the same way and relate when it comes to emotions. I’ve never really felt emotion. Everyday is a battle for me and majority of the day I have no emotion, but to pretend. It’s frustrating and exhausting at times. And I hate myself it seems more and more because of it. Like some curse.",JMaximus85,uucbmy
1,"It's really strange to realize you don't do or feel things in the ""normal"" way. No real advice here but hang in there.",oisin_berry,uucbmy
2,"Same to you bud, I hope one day you will have a control on it and will get easier to deal with. When the moments I do feel emotion, I’ll either be really happy or if something triggers me and I get upset, I get really upset quickly. There is never a middle.",JMaximus85,uucbmy
0,"Hey, just wanted to send you some positive energy! I'm going through a break up too, in a country I moved to for my partner, thousands of miles away from home. It's hard but I do believe it gets better and easier with time. A LOT of time. Hang in there, friend.",yoko-tai,exszoj
1,"I’m a bpd going through a break up right now too! It’s really really hard to feel safe in our own brains so know you are not alone. 

Just wanted to reach out in a small way ❤️",,exszoj
2,"Hi darling, I’m really sorry. Breakups are extremely hard for those of us with bpd. We feel like our life is gone. We feel lost, unwanted, rejected, and abandoned. It’s important to talk about it and reach out to the friends you do have. Good for you for posting here. Is there a way to see a counsellor at a walk in clinic, resource centre, church, etc? I find that going to groups for any mental health challenge is helpful because we get to share and not be alone. Look at this as a fresh start to work on you, and be a little selfish. Make a vision board, lists of enjoyable activities, distraction techniques, perhaps start exercising, get a pet, read some related books , cut or dye your hair etc. I always change my hair and buy new underwear after a breakup hehe. Good luck. You’re not alone",ArtistofMind,exszoj
3,"Emotional support, right here.  Funny I say that, because I'm going through the identical type of situation. I'm in a city I know nobody, save for my ex-husband, my BF/FP broke up on NYE, but we had been in contact as he knew my situation.  But, that ended last night.  I am 100% alone, and I hate all the things going through my head. So please. I'm here, with an ear, and one sympathetic to what your'e going through. <3",SammiSmash,exszoj
4,"I have a daughter that suffers from BPD.  I have watched her suffer for years struggling to understand what she goes through, and struggling even more to figure out how to help her.  I  was worn thin with stress and worry, as she harmed herself with cutting and getting in trouble with the law through self destructive outbursts.   I've worked hard at finding serenity for myself.  If you want a friend with a sympathetic ear, feel free to PM me.",,exszoj
0,"Since this is focused on the relationship today, I would suggest subs like r/secondarysurvivors and r/polyamory",TranZeitgeist,gg7j7f
1,What you're feeling is normal. And sex can he a form of intimacy for most couples. If you have boundaries on this it's okay to have them if they are healthy. Ask your partner if their feelings fit the facts of the current situation. Imo it sounds like it doesn't fit the facts and they are comparing their past to the present and haven't fully recovered and healed. Maybe they might need a bit of therapy. They have to want therapy though as in cases of rape it is traumatic. Any trauma whether little or big is still trauma and needs to be worked through in order to live the best life possible. I am sorry you are going through this rough patch in the road with your loved one and I hope it gets better and you two flourish.,Chilly_Grimorie,gg7j7f
0,"Yup. Browsed r/bpdlovedones for like an hour, and ended up just crying wondering if I would ever have a relationship where my partner doesnt literally hate me",anonymousguy3000,gyq3ao
1,"As someone with BPD it’s very aggravating and hurtful to see these posts. 
I can’t help but think these people who view people with BPD, blame BPD because the person does too.

For example if the partner without BPD tries to talk about their feelings or something that took place and the partner with BPD blames it on their diagnosis. This could form the opinion that they’re expressing. Or they’re just misinformed. 

I’ve known other people with BPD and have never seen them in the terrible light that I see on some of these posts. Honestly most people with BPD I’ve met are genuinely caring and loving.",foreveryoung94,gyq3ao
2,"To all: I understand and that's very relatable. For me to cope with feeling like a monster I either:

a) Own I have BPD so I'm not a slave to the impression that gives people. By having a ""what's your point everyone has dark traits"" attitude towards people they have no power over you.

b) I don't cling to any permanent identity because the world and ourselves is constantly changing so either our identity is never final or we are already complete over and over again.",,gyq3ao
3,"I seen that thread as well, it wasn’t a good feeling reading all of that :/ I’m guessing the ppl that had bpd in their lives didn’t try to control their symptoms? Like therapy or medication whatever you know? So they were just basically a monster, I know I’m horrible without me meds and therapy. Can’t say for sure tho",moodswingmolly,gyq3ao
4,"Ive read through r/BPDlovedones and they are just enabling each other to hateful mindsets, is how i see it,, sure we can be abusive. It's not like any of those people understand why though, as i see it, none of those have ever read or informed themselves any other way about anything regarding bpd,, it even says in the rules ""no experts"" like?? Sure, anyone can say they're an expert but like, half of these people on there need some therapy too,,",grauaeugig,gyq3ao
5,"I am in love with a person with BPD and it’s easier for people to paint things as black and white rather than understand being human is complex. I’m constantly looking for information on how to help and be of support. I can’t say I’ve never fallin into ignorant thinking that he’s evil lol. Obviously it comes from the hopelessness after letting the episodes get to me. Plus my friends never having similar experiences can leave me isolated because it can be hard to share with them the intensity of it and them not judge me or feel sorry for staying. But meditation has been helping me a lot with letting things go and reviving the loving and supportive energy I know he needs. The more I educate myself and try to put my self love first. The quicker he diffuses and apologizes. I also try not to let him dwell in shame but rather to focus on solutions when he’s out of the fog. So I’m trying to become an example rather than try and fix him. It takes a lot of the pressure off of him which I feel can trigger the episodes. Also I ask the universe for guidance, strength and grace as often as I need and she never disappoints. If I don’t receive then I wasn’t paying attention. Also setting space while reassuring him I’m not leaving him helps. I know it hurts to reads those posts misinformed folks express. It annoys me when I look for help and the internet reads run, get out while you can. But people are just hurt they lost someone they hoped they’d have forever. Especially if it got dangerous so they had no other option than to leave. It’s hard to stay away from a dangerous situation when you have a lot of sympathy for it so people turn cold to protect themselves from a relapse. It’s easier to be angry than to feel hopeless. Anger= can’t be rejected. Plus western medicine is not as far along as people give it credit. This line also helps me

Healing is not linear✌️

Much love and support💛 you got dis!🐥",Dakotatheunicorn,gyq3ao
6,"Actually, reddit hates all cluster b personalities. Narcs, socio/psychopaths, us. I think they confuse hpd with bpd often, so them, as well. They just aren't aware. As soon as someone is lacking the slightest bit of empathy, someone has to point out npd or aspd. 🙄

I realize the seriously problematic issues of cluster b's, especially in relation to crime with sociopathy. Obviously not everyone with it is a criminal or violent person, but it is a concern.

However, most of them have been played up by media portrayals and people who assume their loved ones are the only example of people with bpd ever. It's tiring. I have ""quiet"" bpd, so people just think I'm naive and younger than I am... Until they really get to know me. Not that many people do. I'm careful about getting close to others.

It kills me that people will advocate for ""mental illness"" - - i.e. Anxiety and depression, until they are blue in the face. But other conditions, that are often comorbid conditions are overlooked and demonized.

Either you're for mental health or you're not. Pick one.",carnuatus,gyq3ao
7,"As a person who thinks they may bpd, has friends with it and that has dated a person long term suffering from it. I really hate that people with this are seen as monsters. You're not your mental illness..",kaibtw,gyq3ao
8,"Theres no excuse for being abusive, disordered or not.",,gyq3ao
9,"I didn't mean to make it sound that way.

What i was trying to say was that people with bpd can be abusive as much as anyone else can.

Pointing fingers at people with bpd is not helpful for either side as it enables harmful stereotypes, and making the coping with the trauma about the abuser is simply not a good way to cope. There's a reason trauma therapy exists and there's a reason why victims of abuse are not split up into groups by the mental health problems of their abuser. And there is a reason trauma therapy groups are led by professionals. 

If you want to simply be informed about why people with bpd share certain behaviours, looking in a subreddit that makes the abuse about the mental illness of the abuser the core of the sub, will not be helpful but harmful. In many cases, the victims will share their own personal view, which aren't accurate to the mental illness sometimes but to their abuser. Looking for information in a place where many people gather who are struggling with trauma unsupervised, will not make anyone informed. 

You're right, being abusive is not right. Neither is labeling a group of people as abusers because they have the same mental illness
And many of the people i have seen on the subreddit simply need trauma therapy with professional supervision, to understand that coping with trauma is about you and not about the abuser
Sorry for the confusion I'm having trouble to put into words what i mean when i get heated in the brain (also im not native English speaker so some of the things i say might sound weird) 

Anyway tl;dr 
It's not okay to abuse anyone 
It's not okay to reduce a person to their mental illness
Coping with trauma should be supervised by professionals 
People who were traumatised by someone with a mental illness shouldn't give advice about how to handle a person with the same mental illness 
People with mental illness shouldn't be reduced to the mental illness

Sorry for the long ass comment hhhh",grauaeugig,gyq3ao
0," i have BPD i’m not proud to admit I was abusive to my SO at one point in time. i want to tell you it does get better but YOU have to make it better, be mindful. Self Awareness is a big step in controlling your emotions & episodes when you have an episode try looking from a 3rd person POV — i realized how crazy & selfish i looked screaming at my boyfriend how pathetic he was & then getting in his face even more for not responding to such abusive language. 
Who tf would want to be with someone who degrades and disrespects them? 
A lot of the things I said I later realized that i was projecting my own pain & insecurity on him. 


When you get mad ask yourself, before you think of getting upset with her (or anyone.) Take a sec, ask yourself why am I mad? 

Is this anything to be upset about? 
What can I do to redirect my energy into something productive? 
How do I say what I feel without attacking my partner?

Don’t always expect an answer from your partner, expressing emotions can be venting, if you want them to respond let them know before hand “I want your advice on something that’s bothering me” or if you want to vent “I’ve been really bothered I’d like to vent if you could just listen” 

when i find myself in a rage I would start to label things around me, if i’m driving I will say 
“blue car with a shitty paintjob passing to my left” “pedestrian walking not looking where they’re going” & so on. 
This way you hijack your brain ...getting you out of your emotional thinking & more into your logical thinking 

Also try to come to terms with whatever you have been hurt by in the past, a lot of my abusiveness cane from my childhood & repeating what i knew.  After accepting that I don’t have a stable family relationship I was able to forgive my family and let go of my anger to them, because trying to justify the hurt you feel from the past is not healthy & the mindset of “this is all i know” 
will destroy you & future relationships 

I’ve lost many friends & lovers from BPD but these small changes have started to improve my relationships as well as my people skills & being able to sympathize with people and care about what my actions have done to effect my relationships. 

hopefully this helps I’m not a professional but I have read ALOOTTT of self help books on BPD/trauma healing",CattyChaos,d90j8f
1,I am the same way. I cheated on my gf so many times and I feel like shit because she loves me so much and I love her too but when I split I feel like she’s a stranger and I try my best to leave her. I also wanna die so bad that I can’t. My literal only goal in life is to die a meaningful death. I hate myself so much. And I hate waking up for the next day. So I stay awake as long as humanly possible so I don’t have to try.,sheepygreen,d90j8f
2,Thanks for this comment (not OP). Could you recommend any specific books? I feel like I'm drowning and about to lose everything.,pinkpickup,d90j8f
3,"of course. 

I Hate You, Don’t Leave Me  is specifically for BPD. For trauma I read The Body Keeps the Score: the body mind and brain in the healing of trauma ( this one was my first self help book & it was the most helpful for me) 

As well as Breaking the Habit of Being Yourself by Dr. Joe Dispenza, I’m still reading this book but it’s definitely helped.",CattyChaos,d90j8f
0,"Hey. I’m in the U.K. so can’t help with therapists in your area etc, but the ones you’ve seen sound appalling, and shouldn’t be practising. 

I have various personality disorders and PTSD, and yes, I probably will be on medication for the rest of my life (I’m 34 now and I started when I was 16). To be honest, I can’t even imagine life without them. They make me better. Why would I stop taking something that makes me better? Work on removing that medication stigma, and try to accept that medication can be a good thing.

Everyone is having a horrible time at the moment, and I think it’s especially hard for those of us with mental illness to endure. We’re lonely, claustrophobic, anxious, and some of our coping strategies have been removed. It’s natural that you’re feeling extra poorly at the moment. Let yourself accept that things are going to be really rubbish for a little while, but don’t forget that this will end. And you will have good days again.

I was very lucky around six or seven years ago and was offered ACT (acceptance and commitment therapy), and it changed my life. I still struggle, of course. I bloody posted here last week because I cut myself! It was the first time in two years, though, and of course I’m struggling with the lockdown like everyone else. But on the whole, it has allowed my recovery. It’s very peculiar because it forces you to lean into your trauma and accept it, rather than fight it (which is what we’ve spent all our lives doing, right?). But it works. There’s also a programme here called STEPPS which is used for those with PDs who aren’t as far into their recovery. Have a look into both these therapies/programmes and see if someone near you might offer them (when lockdown is over).

Please take care of yourself.",Unusualbellows,fxe0xe
